date,factor,explanation,updated_time,news_count
2025-01-14,0.6,IC 設計族群成長動能強勁且合作案持續擴大，但短期市場仍受總體經濟與庫存調整影響，投資人對後市展望保持審慎樂觀。,2025-07-20 17:18:37,1
2025-01-15,0.6,AI 概念股受輝達供應鏈消息影響而走弱，但 IC 設計族群表現相對強勁，尤其是世芯 - KY 等個股，顯示市場仍看好相關產業的長期成長前景。,2025-07-20 17:18:39,1
2025-02-04,0.6,美國總統暫停加徵關稅帶來短期利多，但市場觀望氣氛濃厚，電子權值股與矽光子族群表現強勁，ASIC 族群漲勢凌厲，整體呈現正面但不確定性仍高的市場情緒。,2025-07-20 17:18:42,1
2025-02-07,0.9,AI 概念股與高價科技股強勁表現帶動大盤上漲，台積電領軍電子權值股助攻，加上傳產族群普遍疲軟，整體市場情緒偏正面。,2025-07-20 17:18:44,1
2025-02-10,0.4,電子股普遍走弱，加上傳出可能課徵關稅的消息衝擊市場信心，半導體類股指數重挫，台積電領跌，世芯 - KY 等高價股也紛紛下跌，整體電子族群表現疲軟。,2025-07-20 17:18:46,1
2025-02-17,0.3,台積電領軍反彈帶動電子權值股上攻，搭配機器人、航運等題材股強勢表現，整體市場情緒偏正面，但個別股票如世芯 - KY 等仍有波動。,2025-07-20 17:18:48,1
2025-02-24,0.3,電子權值股與高價股普遍疲軟，市場信心受挫，加上台積電領跌，拖累大盤表現。,2025-07-20 17:18:50,1
2025-02-28,0.6,市場對未來獲利成長預期趨於保守，分析師調降目標價與EPS估值，但營收展望仍維持正面，整體市場情緒偏向中性。,2025-07-20 17:18:52,3
2025-03-03,0.3,台積電領軍下挫拖累加權指數重摔，半導體族群普遍走跌，世芯 - KY 等高價股亦遭波及，市場情緒偏空。,2025-07-20 17:18:53,1
2025-03-04,0.4,美國總統宣布加徵關稅與美股重挫引發市場恐慌，台股大跌創今年新低，權值股全面走弱拖累大盤，但世芯 - KY 等少數個股表現相對抗跌。,2025-07-20 17:18:55,1
2025-03-11,0.4,全球經濟衰退疑慮衝擊市場信心，多數個股走跌，但部分防禦性類股與個股表現相對抗震。,2025-07-20 17:18:56,1
2025-03-18,0.7,世芯在 AI 晶片設計領域的技術優勢與訂單展望，帶動市場對其營運成長前景的正面期待。,2025-07-20 17:18:59,2
2025-04-17,0.6,電子股強勢表現與部分個股漲停帶動市場情緒，惟台積電走弱及觀望氣氛仍影響大盤整體漲幅。,2025-07-20 17:19:03,1
2025-04-29,0.3,市場對明年獲利預估下修引發短期信心動搖，但整體展望仍維持正向。,2025-07-20 17:19:05,1
2025-05-02,0.9,市場對明年獲利展望樂觀，分析師調升目標價與預估值，激勵股價強勢上揚。,2025-07-20 17:19:07,2
2025-05-09,0.6,法說會釋出正面訊息，包括客戶專案無遞延、先進製程設計案件增加以及中國 ADAS 專案重新啟動等，都有助於維持市場對公司營運的樂觀預期。,2025-07-20 17:19:09,1
2025-05-12,0.6,消息面利多與技術面轉強交織，市場信心回溫但仍需留意後續談判進展與籌碼動向。,2025-07-20 17:19:10,1
2025-05-14,0.6,目標價下修與評級偏空顯示市場信心受挫，但股價相對大盤強勢反彈，短期內市場情緒仍有待觀察。,2025-07-20 17:19:11,1
2025-05-23,0.6,台積電概念股表現強勁，世芯 - KY 受惠輝達演講題材而走高，但整體市場受到美債殖利率衝高與穆迪信評降級影響，指數下跌。,2025-07-20 17:19:14,1
2025-05-24,0.9,輝達推出 NVLink Fusion 搶攻 ASIC 市場並點名世芯 - KY 為合作夥伴，激勵市場對世芯 - KY 未來成長前景的樂觀預期。,2025-07-20 17:19:15,1
2025-06-02,0.3,美中貿易緊張局勢升溫引發市場恐慌，拖累科技股表現，世芯 - KY 股價承壓，但整體影響有限。,2025-07-20 17:19:17,1
2025-06-11,0.3,市場對明年獲利預估下修與營收展望保守，引發短期市場信心不足，但整體趨勢仍維持正向。,2025-07-20 17:19:19,1
2025-06-13,0.4,中東地緣政治風險升溫引發市場恐慌，拖累台股與相關個股走勢，短期內市場情緒偏向保守。,2025-07-20 17:19:20,2
2025-06-18,0.7,策略合作關係有助於加速打造符合下一代應用效能與規模需求的 AI 專用架構，激勵市場對未來成長前景的正面期待。,2025-07-20 17:19:22,1
2025-06-27,0.3,市場對未來獲利成長預期下修，反映出對營運展望的謹慎態度。,2025-07-20 17:19:24,2
2025-06-30,0.6,市場情緒受惠於美中貿易進展、聯準會壓力測試結果以及新台幣升值等因素，帶動科技股上漲，相關類股如機器人、自動駕駛與特斯拉供應鏈具題材與基本面支撐。,2025-07-20 17:19:26,1
