date,factor,explanation,updated_time,news_count
2022-11-04,0.7,法說會釋出正面展望與財報表現符合預期，激勵市場情緒但仍需留意 ABF 載板供給、中國營收比重等潛在風險。,2025-07-20 17:14:10,2
2022-11-07,0.9,美中晶片禁令影響有限，加上超微新品助攻台積電，ASIC、IP 概念股強勢漲停，市場對世芯 - KY 未來成長前景樂觀。,2025-07-20 17:14:12,1
2022-11-22,0.4,市場情緒偏空，權值股普遍疲軟，加上矽智財與 ASIC 族群遭遇獲利了結賣壓，拖累大盤走勢。,2025-07-20 17:14:14,1
2022-12-07,0.3,市場情緒受到美股下挫與經濟風險升溫的影響而轉為保守，世芯 - KY 股價承壓。,2025-07-20 17:14:17,1
2022-12-08,0.3,市場觀望氣氛濃厚，權值股疲軟拖累大盤走跌，但個別題材股如再生能源與觀光類股表現強勁，整體市場情緒偏向保守。,2025-07-20 17:14:18,1
2022-12-09,0.9,"多家台廠11月營收創新高，顯示產業基本面穩健，帶動相關個股股價走揚。

====================",2025-07-20 17:14:19,1
2023-01-03,0.6,權值股走勢分歧且多數疲軟拖累大盤，但世芯領軍的 IC 設計族群強勁反彈，資金明顯轉進，提振市場信心。,2025-07-20 17:14:23,1
2023-01-16,0.9,美元走弱與新台幣強升帶動科技股表現，ASIC 與 IP 族群領漲，市場對半導體後市展望樂觀。,2025-07-20 17:14:26,1
2023-01-31,0.3,大盤漲多調節與台積電走弱拖累指數回測年線，但個股仍有強勢表現，市場等待 FOMC 會議結果，短期行情面臨觀望。,2025-07-20 17:14:28,1
2023-02-01,0.6,台股反彈行情延續，權值股與高價股齊揚，加上 IC 設計族群輪動表現強勁，激勵市場信心回溫。,2025-07-20 17:14:30,1
2023-02-07,0.6,IP 概念股領軍衝鋒，加上權值股撐盤，市場情緒偏正面，但個別族群強弱分歧，整體漲勢仍有待量能配合。,2025-07-20 17:14:32,2
2023-02-08,0.9,IC 設計族群強勁反彈，展望樂觀與資金回流激勵市場情緒，多檔個股重返千金行列。,2025-07-20 17:14:33,2
2023-02-09,0.3,權值股普遍疲弱拖累指數維持低檔整理，千金股賣壓出籠，但軍工概念與 AI 軟體題材支撐部分個股表現。,2025-07-20 17:14:35,1
2023-02-24,0.3,市場情緒受到 MSCI 季度調整與連假因素影響而轉為中性，權值股普遍走弱但高價股仍有亮點。,2025-07-20 17:14:37,1
2023-03-03,0.4,美系外資調降世芯目標價，市場擔憂族群獲利前景，引發賣壓出籠，拖累股價重挫。,2025-07-20 17:14:39,1
2023-03-06,0.6,台積電、聯發科等權值股領漲，加上大立光強彈與軍工概念股表現亮眼，激勵市場信心回升，但高價股走勢分歧，顯示整體情緒仍偏謹慎。,2025-07-20 17:14:41,1
2023-03-09,0.7,半導體族群領漲，尤其是晶圓代工與 IC 設計股強勁表現，顯示市場對相關產業前景仍持樂觀態度。,2025-07-20 17:14:42,1
2023-03-10,0.3,美股重挫拖累台股大跌失守月線，權值股與電子指標普遍走低，但部分個股逆勢抗跌，顯示市場信心尚未完全喪失。,2025-07-20 17:14:44,1
2023-03-15,0.9,強勁的財報表現、對未來成長的樂觀展望以及車用市場潛力激勵市場情緒，投資人看好公司基本面與前景。,2025-07-20 17:14:46,2
2023-03-18,0.9,強勁的 HPC 需求與量產動能帶動營收成長，股價創下 14 個月新高，市場對未來獲利展望樂觀。,2025-07-20 17:14:47,1
2023-03-20,0.4,市場對於 AT1 債券註銷事件反應謹慎，金融股走勢疲弱拖累大盤，雖然部分科技股維持強勁，但整體信心仍有待恢復。,2025-07-20 17:14:49,1
2023-03-22,0.9,強勁的營收成長、樂觀的展望以及多項利多消息激勵市場情緒，預期將帶動股價上揚。,2025-07-20 17:14:50,2
2023-03-31,0.6,市場情緒偏多且個股輪動活躍，記憶體與設計 IP 等族群表現強勁，但大盤未能站穩萬六關卡，技術面仍受壓抑。,2025-07-20 17:14:52,1
2023-04-10,0.9,營收創高與成長動能強勁反映市場需求暢旺，AI/HPC/車用等多元應用帶動未來展望樂觀。,2025-07-20 17:14:54,1
2023-04-13,0.1,美股拖累加上電子權值股走弱，台積電跌破季線等利空因素疊加，引發市場負面情緒與大盤重挫，短期內投資人信心受損。,2025-07-20 17:14:56,1
2023-04-18,0.3,市場觀望氣氛濃厚，高價股與權值股普遍走弱，台積電法說會結果將影響後市，但部分中小型股如 PMIC 相關業者展現反彈力道。,2025-07-20 17:14:58,1
2023-04-25,0.3,IP 股普遍走跌，尤其是世芯 - KY，受到市場對相關族群的負面情緒影響，短期內股價可能承壓。,2025-07-20 17:15:00,1
2023-05-03,0.6,市場情緒受到大盤走勢與個股表現影響，整體呈現中性偏空態勢。,2025-07-20 17:15:01,1
2023-05-08,0.9,台積電領軍上攻帶動加權指數強勁反彈，多檔電子股齊揚，市場情緒樂觀，推升整體股價向上。,2025-07-20 17:15:03,1
2023-05-09,0.9,法說展望樂觀且營收持續創高，顯示公司基本面強勁且成長動能穩健，激勵市場情緒與股價上漲。,2025-07-20 17:15:04,2
2023-05-10,0.4,電子股疲弱拖累大盤走低失守月季線，但世芯逆勢上漲支撐市場情緒。,2025-07-20 17:15:06,2
2023-05-12,0.3,市場情緒偏弱，權值股疲軟拖累大盤，但高價股與部分概念股撐盤有限，整體呈現跌勢。,2025-07-20 17:15:07,1
2023-05-15,0.3,雖然公司基本面表現尚可，但市場對於產業前景仍存在疑慮，導致股價波動加劇。,2025-07-20 17:15:08,1
2023-05-16,0.9,權值股領漲激勵市場信心，多頭氣勢強勁推升大盤突破短均並重返季線之上。,2025-07-20 17:15:10,1
2023-05-18,0.7,台積電領軍電子權值股上攻萬六關卡，帶動加權指數強勁反彈，市場情緒回溫但仍需觀察後續量能與個股表現。,2025-07-20 17:15:11,1
2023-05-20,0.9,同業領漲帶動股價創高，市場對 ASIC 市場前景樂觀，激勵正面情緒。,2025-07-20 17:15:12,1
2023-05-22,0.3,大盤漲勢歇息，權值股走弱拖累指數，但觀光與航運類股表現亮眼，高價股疲軟，市場情緒偏中性。,2025-07-20 17:15:13,1
2023-05-29,0.7,AI 概念股強勢上攻，輝達執行長來台助漲市場情緒，加權指數創近一年新高，但台積電休息震盪使漲幅收斂。,2025-07-20 17:15:16,2
2023-05-31,0.4,電子權值股與 AI 概念股同步走弱，市場觀望氣氛濃厚，指數一度跌逾百點，世芯 - KY 等個股也承壓修正。,2025-07-20 17:15:17,1
2023-06-06,0.3,台積電穩盤帶動大盤上漲，但高價股普遍疲軟，市場情緒偏向保守，預期成交量萎縮將抑制短線漲勢。,2025-07-20 17:15:19,1
2023-06-07,0.9,熱錢湧入與權值股領漲激勵市場信心，多頭氣勢強勁推升指數創波段新高。,2025-07-20 17:15:20,1
2023-06-08,0.9,"AI 需求強勁與新案件洽談進展正面，激勵市場對營運成長前景樂觀，推升股價上揚。

世芯 - KY 受惠北美客戶 AI 晶片量產動能持續增溫，5 月營收再創新高，累計前 5 個月營收已近去年全年水準。公司預期第二季營收將優於上季，並因認列 NRE 案件，毛利率可望回升，全年營收目標達 8 億美元，明年挑戰 10 億美元。世芯 - KY 目前除北美大客戶外，也與多家 Hyperscaller 業者及汽車廠洽談新案件，預計 2024 年貢獻營收，長期營收年複合成長率目標為 20%。",2025-07-20 17:15:24,2
2023-06-09,0.9,新產品線拓展、訂單取得進度樂觀以及車用市場前景看俏，激勵市場對未來成長性與獲利能力的正面期待。,2025-07-20 17:15:25,3
2023-06-13,0.6,電子權值股領軍衝鋒，搭配觀光族群強勁表現，激勵市場情緒走揚，但整體漲幅仍有待擴大以鞏固多頭格局。,2025-07-20 17:15:27,1
2023-06-17,0.7,市場對 ASIC 產業長期成長趨勢的樂觀預期，以及智原 在關鍵應用領域的成長動能，激勵投資人信心回升並推升股價上漲。,2025-07-20 17:15:28,1
2023-06-18,0.6,AI 熱潮持續延燒，各廠紛紛推出新產品與服務，相關概念股營運前景樂觀，但短期內仍受總體經濟影響，庫存調整壓力未除。,2025-07-20 17:15:31,1
2023-06-26,0.6,策略投資者入股顯示對公司發展的信心，但短期內市場可能擔憂稀釋效應，導致股價波動。,2025-07-20 17:15:33,1
2023-06-27,0.3,外資賣超金額縮小且部分個股獲得法人青睞，市場情緒略有改善，但整體仍受大環境不確定性影響，預期短期內波動難免。,2025-07-20 17:15:35,1
2023-06-29,0.7,個股表現與產業輪動帶動漲勢，市場情緒偏正面，但航運族群修正壓抑漲幅。,2025-07-20 17:15:36,1
2023-07-25,0.9,台積電領軍帶動加上 AI 概念股強勁表現，激勵市場情緒向上，多頭買盤信心回溫。,2025-07-20 17:15:39,1
2023-07-31,0.3,美股財報利多激勵台股開盤走揚，但權值股與高價股賣壓出籠，市場情緒偏中性，成交量能不足。,2025-07-20 17:15:41,1
2023-12-09,0.6,世芯 - KY 等 ASIC 與 IP 族群受惠微軟晶片量產與需求復甦，營運成長前景樂觀，但短期漲多拉回壓力仍在。,2025-07-20 17:15:52,2
2023-12-12,0.6,半導體產業展望樂觀、美系外資調升評等與多檔個股獲青睞，以及金管會釋出維穩市場訊號，整體而言市場情緒偏正面。,2025-07-20 17:15:53,1
2023-12-19,0.4,市場情緒受到個股表現影響而分歧，部分權值股與高價股走勢疲弱引發賣壓，但航運類股強勁上漲支撐盤面。,2025-07-20 17:15:55,1
2023-12-20,0.9,明年在供應商支持下取得更多 CoWoS 產能，客戶主力量產案件升級至 5 奈米，加上中國車用晶片客戶貢獻與設計中心多點開花策略，營收獲利成長動能強勁，激勵市場正面情緒。,2025-07-20 17:15:57,2
2023-12-21,0.6,CoWoS 產能提升與客戶升級帶動營收獲利成長的正面展望，以及半導體需求前景樂觀，抵銷市場整體疲弱氛圍。,2025-07-20 17:15:58,1
2023-12-22,0.6,權值股反彈與航運、ASIC 等族群領漲帶動指數重新站回十日線，市場情緒偏正面但仍需留意個別類股表現。,2025-07-20 17:16:00,1
2023-12-29,0.9,AI 概念股全面走強，市場對相關產業前景樂觀，激勵整體市場情緒與股價上揚。,2025-07-20 17:16:02,1
2023-12-30,0.9,AI 概念股強勢表現與市場資金湧入，激勵科技權值股大漲，推升指數創高並收在歷史次高價位，反映投資人對明年展望樂觀。,2025-07-20 17:16:03,1
2024-01-04,0.3,世芯 *-KY 股價走勢疲弱，市場情緒偏空，但整體電子股表現分歧，顯示對產業前景看法仍有不確定性。,2025-07-20 17:16:05,1
2024-01-09,0.7,市場情緒受貨櫃三雄重挫拖累而轉為負面，但高價 IC 設計與 AI 股強勢支撐大盤，整體維持中性偏空態勢。,2025-07-20 17:16:07,2
2024-01-11,0.7,AI 概念股與 IC 設計族群領漲，世芯 - KY 創高帶動千金股強勁表現，激勵市場情緒走揚。,2025-07-20 17:16:08,2
2024-01-17,0.6,現金增資稀釋股本並挹注營運資金，市場對未來成長前景樂觀但仍擔憂短期獲利影響。,2025-07-20 17:16:10,1
2024-01-24,0.6,電子權值股表現分歧，AI 股漲跌互見，中小型股與傳產族群強勢支撐大盤，但世芯 - KY 跌幅拖累市場情緒。,2025-07-20 17:16:12,1
2024-01-25,0.6,AI 概念股與半導體族群齊漲，市場情緒偏正面，但個別公司表現分歧。,2025-07-20 17:16:13,1
2024-01-31,0.3,美股走弱拖累台股大跌，電子權值股普遍疲軟，但部分高價股與族群逆勢抗跌，市場情緒偏空但尚未完全失望。,2025-07-20 17:16:15,1
2024-02-06,0.9,AI 與半導體族群強勢表現激勵市場信心，展望未來成長潛力樂觀，推動投資情緒與股價上揚。,2025-07-20 17:16:17,1
2024-02-15,0.9,AI 概念股強勢表現與半導體族群領漲帶動大盤創高，市場情緒樂觀且對科技類股前景看好。,2025-07-20 17:16:19,1
2024-02-16,0.3,AI 概念股漲跌互見，權值股走弱壓抑市場信心，但傳產與部分電子股撐盤使短期情緒維持溫和偏多。,2025-07-20 17:16:20,1
2024-02-21,0.1,AI 概念股與高價股同步走弱，加上輝達股價下挫拖累台積電等權值股，市場信心受創，引發大盤重挫並失守五日線。,2025-07-20 17:16:22,1
2024-02-26,0.7,高價股領軍上攻，加上重電族群強勢表現，激勵市場情緒向上，但權值股走勢平平使漲幅受限。,2025-07-20 17:16:24,1
2024-02-27,0.3,台積電領跌與 AI 股全面下挫拖累大盤，金融股撐盤力有未逮，市場情緒偏空但跌幅有限，顯示投資人信心尚未完全喪失。,2025-07-20 17:16:25,1
2024-02-29,0.7,重電與高價股領軍上攻，電子權值股表現分歧，多頭氣盛推升指數突破萬九關卡。,2025-07-20 17:16:27,1
2024-03-01,0.9,營收與獲利雙創新高，展望樂觀且訂單能見度長，激勵市場情緒走揚並推升股價上攻。,2025-07-20 17:16:28,2
2024-03-04,0.9,美股費半大漲激勵科技股，台積電領軍衝高再創新天價，帶動加權指數與多檔電子權值股齊揚，市場情緒樂觀。,2025-07-20 17:16:30,1
2024-03-10,0.6,AI 熱潮持續推升千金股漲勢，但個股表現分歧，市場過度集中於 AI 概念股，短期資金輪動快速恐引發波動。,2025-07-20 17:16:32,1
2024-03-14,0.6,高價股強勢表現與電子權值股穩盤帶動指數上揚，但世芯 - KY 等個股漲多拉回壓抑整體市場情緒，短期維持區間震盪走勢。,2025-07-20 17:16:34,1
2024-03-15,0.5,市場情緒受美國 PPI 數據影響而轉趨謹慎，半導體類股普遍走弱，但鴻海法說釋出正面訊息帶動相關個股表現，整體市場呈現震盪整理。,2025-07-20 17:16:35,2
2024-03-20,0.9,客戶關係穩固且訂單出貨無虞，加上新產品進度樂觀，市場對未來成長前景充滿信心。,2025-07-20 17:16:37,1
2024-03-24,0.3,投信買超世芯 - KY 達 27 億元，但外資同步賣超，顯示市場對該公司前景仍有疑慮，短期內股價波動可能加劇。,2025-07-20 17:16:39,1
2024-03-26,0.3,電子權值股普遍疲軟，AI 概念股表現不如預期，加上傳產與金融族群漲幅有限，整體市場情緒偏向保守，導致大盤震盪走低。,2025-07-20 17:16:40,1
2024-03-28,0.9,AI 伺服器需求強勁、產品組合優化與新品研發進度樂觀，激勵市場對公司未來成長前景的正面期待。,2025-07-20 17:16:42,1
2024-03-29,0.9,AI 概念股領軍強彈，搭配高股息 ETF 資金湧入概念股，激勵市場情緒向上且買氣回溫。,2025-07-20 17:16:43,3
2024-04-08,0.6,台積電領軍上攻激勵大盤走高，多頭指標強勢表態，但個股漲跌互見，市場情緒偏正面但仍有部分雜音。,2025-07-20 17:16:45,1
2024-04-11,0.3,AI 概念股普遍回檔，世芯 - KY 挫低但仍守住 3000 元大關，市場對相關族群後市信心略顯動搖。,2025-07-20 17:16:47,1
2024-04-15,0.1,市場情緒受美股重挫與地緣政治風險影響而轉為負面，權值電子股全面走跌，世芯 - KY 股價回測年線。,2025-07-20 17:16:48,1
2024-04-19,0.1,台積電等科技股全面走跌拖累大盤重挫，市場情緒悲觀，短期內難以恢復信心。,2025-07-20 17:16:50,1
2024-04-26,0.9,電子股全面反彈，尤其是半導體相關個股領漲，顯示市場信心回溫，帶動台股大盤上揚。,2025-07-20 17:16:51,1
2024-04-30,0.6,千金股股王競爭激烈，世芯 - KY 小漲帶動相關族群走強，但整體市場仍受到獲利了結賣壓影響，導致大盤震盪。,2025-07-20 17:16:53,1
2024-05-02,0.7,AI 概念股領漲帶動市場情緒向上，但權值股走勢分歧與美股下挫仍對大盤造成壓力。,2025-07-20 17:16:54,1
2024-05-03,0.9,法說會釋出對明年成長前景樂觀展望，強勁需求與產能支援有利維持營收動能，激勵市場情緒走揚。,2025-07-20 17:16:56,2
2024-05-06,0.3,市場情緒受 AI 概念股強勢表現帶動，但世芯 - KY 法說會後股價大跌拖累整體電子族群，短期漲多個股面臨獲利了結賣壓。,2025-07-20 17:16:57,1
2024-05-11,0.6,市場情緒偏正面，主要受惠於台積電強勁營收表現與 AI 題材帶動相關個股，如世芯 - KY、創意、M31 等。投顧分析師也看好這些股票的長期成長潛力，並建議投資人追蹤投信籌碼變化。,2025-07-20 17:17:00,1
2024-05-14,0.6,亞馬遜參與私募顯示長期合作信心，惟短期市場對於股價折價仍有疑慮，整體而言對公司營運前景持正面看法。,2025-07-20 17:17:02,2
2024-05-15,0.6,亞馬遜入股世芯 - KY 的利多消息激勵股價上漲，但整體盤勢震盪劇烈，缺乏強勢主流族群帶領，市場情緒維持中性偏正面。,2025-07-20 17:17:03,2
2024-05-16,0.3,AI 概念股漲跌互見，世芯 - KY 股價走勢疲軟，市場情緒略為偏空。,2025-07-20 17:17:04,1
2024-05-17,0.3,市場情緒偏向保守，個股表現分歧，指數量縮整理。,2025-07-20 17:17:05,1
2024-05-27,0.9,台股創新高帶動市場樂觀情緒，AI 概念股與貨櫃三雄領漲，多頭行情延續。,2025-07-20 17:17:07,1
2024-05-28,0.6,AI 概念股普遍走揚，緯創、奇鋐、智原等強勢漲停或大漲，世芯 - KY 也在盤上表態，顯示市場對相關族群的正面期待。,2025-07-20 17:17:09,1
2024-05-30,0.9,展望未來三年營收成長與新一代晶片效益帶動下，市場對公司長期發展前景樂觀，激勵正面情緒。,2025-07-20 17:17:10,2
2024-06-11,0.3,營收年增率持續成長且獲利預估維持正向，整體基本面穩健但短期股價表現有限。,2025-07-20 17:17:13,2
2024-06-21,0.6,市場情緒偏正面，主要受惠於台股強勁反彈與 OTC 指數突破關鍵壓力帶動。惟個股表現分歧，建議留意具轉折扣低、低基期特性的 IC 設計族群。,2025-07-20 17:17:16,1
2024-06-24,0.4,市場情緒偏弱，電子權值股普遍走跌，加上獲利了結賣壓出籠，拖累大盤失守兩萬三關卡。,2025-07-20 17:17:17,1
2024-06-25,0.9,分析師普遍看好公司基本面與營運前景，激勵市場情緒樂觀且股價上漲。,2025-07-20 17:17:18,1
2024-06-26,0.9,市場普遍看好公司未來獲利成長前景，預估EPS與營收持續上修，激勵正面市場情緒。,2025-07-20 17:17:20,1
2024-06-27,0.3,權值股普遍走跌拖累大盤，市場情緒偏空，但部分個股仍維持平穩或小幅上漲，顯示整體影響有限。,2025-07-20 17:17:21,1
2024-06-30,0.6,除權息活動與營收表現將影響個股走勢，但整體市場展望樂觀，多頭氛圍支撐指數維持高檔。,2025-07-20 17:17:22,1
2024-07-04,0.6,市場情緒偏正面，主要受台股創新高與多檔個股強勢表現帶動，但部分公司財報與展望仍存在不確定性。,2025-07-20 17:17:24,1
2024-07-05,0.3,電子權值股普遍走勢疲弱，世芯 - KY 等高價股亦未能倖免於難，拖累市場信心，但傳產與金融股如儒鴻、台灣大等表現相對強勁，整體而言市場情緒偏向中性。,2025-07-20 17:17:26,1
2024-07-09,0.9,營收成長與股價創高顯示公司基本面強勁，激勵市場情緒向上。,2025-07-20 17:17:27,3
2024-07-10,0.6,市場對世芯-KY的獲利預估持續上修，反映出對未來營運成長的樂觀展望，但力肯的營收表現與股價走勢則顯示短期內缺乏明確的催化劑，整體市場情緒維持溫和偏多但不過度熱絡。,2025-07-20 17:17:29,2
2024-07-17,0.3,千金股波動加劇與注意股規定調整可能影響市場情緒，但具基本面支撐的個股仍有資金青睞。,2025-07-20 17:17:31,1
2024-07-18,0.1,地緣政治風險升溫引發市場恐慌，半導體類股全面下跌，世芯面臨龐大賣壓。,2025-07-20 17:17:32,1
2024-07-26,0.3,台股大跌，權值股全面下挫，加上 AI 概念股修正，市場情緒偏空，但部分房產族群逆勢抗跌，整體影響有限。,2025-07-20 17:17:34,1
2024-07-31,0.4,台股電子權值股普遍走跌，加上部分高價指標下挫，市場情緒偏向保守。,2025-07-20 17:17:36,1
2024-08-02,0.3,半導體族群展望不如預期與市場賣壓出籠，加上中東情勢緊張與美股重挫，拖累台股大跌，世芯 - KY 股價亦隨大盤修正。,2025-07-20 17:17:38,2
2024-08-05,0.3,半導體類股全面重挫，世芯-KY等ASIC與IP族群遭恐慌性賣壓襲擊，市場情緒轉趨悲觀。,2025-07-20 17:17:39,2
2024-08-07,0.6,營收年增率持續強勁成長，惟近期股價下跌，市場對後市展望轉趨謹慎。,2025-07-20 17:17:40,1
2024-08-12,0.3,市場對明年獲利預估下修與營收展望保守，引發短期市場信心不足，但整體趨勢仍正向。,2025-07-20 17:17:42,1
2024-08-13,0.7,電子指標股普遍走揚，世芯 - KY 大漲 5.76%，健策也上漲 4.19%，加上台積電尾盤翻紅帶動大盤小幅收高，顯示市場情緒偏正面。,2025-07-20 17:17:44,2
2024-08-16,0.6,市場對未來獲利成長前景樂觀，權值股與高價股齊揚帶動大盤走強，但個別股票表現分歧。,2025-07-20 17:17:46,3
2024-08-21,0.6,市場對未來獲利成長前景樂觀，但短期營收表現與展望仍有不確定性，整體市場情緒偏正面但略顯謹慎。,2025-07-20 17:17:47,1
2024-08-23,0.9,AI 需求強勁與新案件挹注，明年成長動能可期；CoWoS 產能支援、車用晶片出貨等利多因素支撐營收展望。,2025-07-20 17:17:49,3
2024-08-24,0.6,市場對未來獲利展望樂觀，分析師調升目標價與預估值，激勵正面市場情緒。,2025-07-20 17:17:50,1
2024-08-26,0.9,法說釋出正面展望，外資看好未來成長動能與新案件進度，激勵市場情緒樂觀且股價上漲。,2025-07-20 17:17:52,2
2024-08-27,0.7,市場情緒受美股影響而轉弱，但在半導體設備與板卡族群強勢表現下，跌幅收斂，世芯 - KY 外資偏多看待帶動反彈。,2025-07-20 17:17:53,1
2024-09-06,0.6,電子權值股與高價股領漲帶動市場情緒回升，但成交量萎縮與技術面弱勢顯示反彈力道不足，整體維持區間震盪走勢。,2025-07-20 17:17:56,2
2024-09-19,0.9,電子權值股與高價股齊揚帶動大盤上攻月線，市場情緒樂觀，多頭氣勢回升。,2025-07-20 17:17:58,1
2024-10-02,0.9,市場對未來獲利與營收表現樂觀，分析師調升目標價與預估值顯示長期正面展望。,2025-07-20 17:18:00,1
2024-10-15,0.9,AI 概念股領漲帶動台股大盤上揚，世芯 - KY 等高價股同步走強，市場情緒樂觀。,2025-07-20 17:18:03,1
2024-10-21,0.6,IC 設計與高價股領軍上攻，多頭氣勢延續，但台積電漲幅收斂使指數漲幅受限，市場情緒偏正面但不過度樂觀。,2025-07-20 17:18:05,1
2024-10-28,0.3,市場對明年獲利預估下修與營收展望保守，引發短期市場信心不足，但整體趨勢仍維持正向。,2025-07-20 17:18:06,1
2024-11-01,0.9,第三季財報亮眼，營收與獲利雙創新高，產品組合優化推升毛利率提升至 19%，展望北美客戶需求強勁，市場對未來成長前景樂觀。,2025-07-20 17:18:08,1
2024-11-02,0.6,聯發科入股世芯 - KY 表示雙方策略性合作關係，市場對 ASIC 業務前景樂觀但仍存在需求放緩疑慮。,2025-07-20 17:18:09,1
2024-11-04,0.3,分析師調降目標價與評級，市場對未來獲利展望仍有疑慮，短期股價面臨修正壓力。,2025-07-20 17:18:11,2
2024-11-16,0.9,AI ASIC 市場需求強勁，帶動台灣 IC 設計產業成長機會，市場競爭加劇激勵正面市場情緒。,2025-07-20 17:18:13,1
2024-11-19,0.6,電子權值股普遍上揚，加上貨櫃三雄與傳產指標同步走高，提振市場信心並帶動大盤反彈。,2025-07-20 17:18:15,1
2024-12-06,0.6,AI 概念股漲勢延續，世芯 - KY 等千金股領軍上攻，資訊類股同步走強，顯示市場情緒偏正面。,2025-07-20 17:18:18,1
2024-12-11,0.7,世芯 - KY 持續走揚，顯示市場對其基本面與未來成長前景仍持正向看待。,2025-07-20 17:18:19,1
2024-12-13,0.6,世芯 - KY 受惠 AI 晶片需求強勁，股價連日上漲突破年線，但中美晶集團遭遇利空消息拖累表現，使市場情緒偏向保守。,2025-07-20 17:18:21,1
2024-12-14,0.9,世芯 - KY 受惠 AWS 新晶片訂單挹注，股價強漲創近五個月新高，市場對未來成長前景樂觀。,2025-07-20 17:18:22,1
2024-12-16,0.6,台積電領軍大漲帶動加權指數強勁反彈，但中小型股表現分歧，世芯 - KY 等個股漲幅有限。,2025-07-20 17:18:23,1
2024-12-17,0.7,市場對世芯-KY的樂觀預期與獲利成長潛力帶動股價上揚，但整體展望仍需持續關注。,2025-07-20 17:18:24,2
2024-12-18,0.6,外資期貨空單高達近四萬口，結算壓力使股價短期承壓，但基本面穩健且有 AI 商機支撐，預計結算後將回歸基本面表現。,2025-07-20 17:18:27,1
2024-12-22,0.3,外資在年底假期前的程式賣單與內資籌碼鬆動轉賣引發短期負面情緒，但集團作帳行情仍可望支撐盤勢弱中透強。,2025-07-20 17:18:29,1
2024-12-23,0.3,台積電領漲帶動大盤反彈，但高價股如緯穎、世芯-KY等震盪整理，拖累指數上攻力道。,2025-07-20 17:18:30,1
2024-12-31,0.7,高價股波動加劇與力旺超車信驊奪回股王地位帶來短期市場關注，但整體而言個股走勢分歧，對大盤影響有限。,2025-07-20 17:18:32,2
2025-01-06,0.7,台積電領漲帶動大盤強彈，世芯等 IC 設計股同步走揚，市場情緒回溫但仍需關注個別公司基本面表現。,2025-07-20 17:18:34,1
2025-01-07,0.8,台積電領軍衝高帶動大盤上揚，世芯等千金股強勢表現助攻市場情緒。,2025-07-20 17:18:35,1
