date,factor,explanation,updated_time,news_count
2024-10-07,-0.5,分析師對目標價與獲利預估下修，引發市場保守情緒，但營收表現優於同業，股價跌幅相對溫和。,2025-06-08 01:47:33,2
2024-10-08,0.9,營收與獲利雙創新高，顯示公司營運狀況良好，預期帶動市場情緒正面。,2025-06-08 01:47:34,1
2024-10-09,0.8,營收與獲利雙創高點，顯示公司營運狀況良好，預期帶動市場情緒正面。,2025-06-08 01:47:35,1
2024-10-11,0.1,台股今日漲逾300點，英業達與緯創等AI概念股也有所表現，但美股四大指數皆小幅收黑，顯示市場情緒偏向中性。,2025-06-08 01:47:37,1
2024-10-15,0.6,AI 股帶動下，英業達 等相關個股走揚，顯示市場對 AI 概念股有正面期待。,2025-06-08 01:47:38,1
2024-10-22,0.8,AI 需求暢旺帶動訂單成長，激勵相關個股走揚。,2025-06-08 01:47:39,1
2024-10-23,0.3,英業達積極佈局智慧家庭領域，持續尋找垂直應用場景，但居家機器人仍處於概念階段。,2025-06-08 01:47:40,1
2024-10-29,0.3,英業達投資墨西哥廠建設高壓變電站，顯示公司積極擴充產能以因應 AI 伺服器需求成長，對市場情緒帶來正面影響。,2025-06-08 01:47:42,2
2024-11-05,0.8,營收與獲利雙創高點，顯示公司營運狀況良好，預期帶動市場情緒正面。,2025-06-08 01:47:44,3
2024-11-06,0.6,AI 族群表現強勁，英業達 漲勢最為突出，但整體市場觀望氣氛濃厚。,2025-06-08 01:47:45,1
2024-11-09,0.9,營收創新高、獲法人買超，加上 AI 伺服器訂單挹注明年展望樂觀，引發市場正面情緒。,2025-06-08 01:47:46,1
2024-11-11,0.9,營收與獲利雙創高點，顯示公司營運狀況良好，預期帶動市場情緒正面。AI 伺服器需求強勁，產品營收年成長約 2.5-3 倍，預計今年 AI 伺服器營收占比達 20-30%。展望未來，英業達表示，第四季營收將再創新高；至於明年，仍會維持成長趨勢，伺服器產品線將呈現年增及季增雙成長，其中 AI server 將占伺服器從 3 成提升至 6 成，而 PC 事業部在 Windows Copilot NB 及 Windows 11 帶動的換機潮之下推動下，有望實現兩位數成長。,2025-06-08 01:47:49,2
2024-11-12,-0.7,英業達股價大跌，顯示市場對公司營運前景持悲觀態度。,2025-06-08 01:47:50,2
2024-11-14,-0.3,分析師目標價估值下修及評級分歧，顯示市場對公司前景看法不一，引發短期波動。,2025-06-08 01:47:51,1
2024-11-20,0.5,台股延續反彈，英業達等 AI 類股漲幅超過 1%，顯示市場情緒偏正面。,2025-06-08 01:47:52,1
2024-11-26,0.2,台股跌幅主要來自於兩大權值股壓盤，且多數電子類股走跌，但英業達等部分個股仍能逆勢上漲。,2025-06-08 01:47:54,1
2024-11-27,-0.7,墨西哥廠受關稅影響，AI 供應鏈重挫，英業達股價下跌。,2025-06-08 01:47:55,2
2024-12-05,0.6,英華達的醫療產品導入國內外醫院使用，並拓展東南亞市場，顯示公司在健康產業有所斬獲，對市場情緒帶來正面影響。,2025-06-08 01:47:57,1
2024-12-06,0.6,英業達11月營收創新高，第四季筆電有望優於預期，加上伺服器產品助攻下，第四季營收可望迎來今年高峰。車用實驗室成立，看好車用相關業績年成長三位數，明年倍增。,2025-06-08 01:47:58,4
2024-12-09,0.8,英業達自研NPU獲得獎項肯定，顯示其在AI晶片領域具備競爭優勢，有利於提升公司形象與市場信心。,2025-06-08 01:48:00,1
2024-12-18,0.8,英業達積極推動數位轉型並獲得多項獎項肯定，顯示公司在 IT 領域的實力與創新能力，預期將帶動市場正面情緒。,2025-06-08 01:48:01,1
2024-12-31,0.2,電子五哥整體表現平平，英業達股價下跌，三大法人減碼，市場情緒偏向保守。,2025-06-08 01:48:03,1
2025-01-09,0.85,營收與獲利雙創新高，顯示公司營運狀況良好，預期帶動市場情緒正面。,2025-06-08 01:48:05,2
2025-01-12,0.3,英業達在墨西哥、泰國、捷克、中國等地布局，可以分散風險，同時也透露，若要到美國設廠，德州會是評估的首選。2024年英業達表現亮眼，各事業群皆有成長，展望2025年，蔡枝安預估仍會持續成長，不過川普即將上任、變數很多，目前保守看2025年成長幅度，認為成長幅度將較2024年低。,2025-06-08 01:48:08,2
2025-01-20,0.7,輝達執行長黃仁勳親臨尾牙站台，對緯創營運與合作關係表達高度肯定，激勵相關個股上漲。,2025-06-08 01:48:09,1
2025-02-03,-0.7,AI 概念股全面下挫，英業達等相關個股受累。,2025-06-08 01:48:11,1
2025-02-07,0.2,營收年增率正成長，顯示公司獲利能力持續。然而，由於第一季筆電出貨預計下修雙位數百分比，以及淡季效應影響，市場情緒偏向保守中性。,2025-06-08 01:48:13,1
2025-02-13,0.9,AI 伺服器需求強勁、營收創高點，以及打入中國雲端巨頭等利多消息，預期將帶動市場情緒正面。,2025-06-08 01:48:14,1
2025-02-21,0.6,外資買超英業達 3.7 萬張，顯示對該公司後市有正面看法。,2025-06-08 01:48:16,1
2025-02-27,-0.7,電子權值股普遍下挫，加上 AI 概念股疲弱，顯示市場情緒偏向保守，英業達 股價可能面臨修正壓力。,2025-06-08 01:48:17,1
2025-03-01,0.9,ODM 廠紛紛提高資本支出，顯示對 AI 伺服器需求樂觀，預期將帶動英業達等相關公司的營收與獲利成長，激勵市場情緒正面。,2025-06-08 01:48:19,1
2025-03-04,0.1,英業達等電子指標股上漲，但整體市場受到美股拖累而下跌，顯示對該公司的影響有限。,2025-06-08 01:48:20,1
2025-03-06,0.8,營收與出貨雙創新高，顯示公司業務表現亮眼，預期帶動市場正面情緒。,2025-06-08 01:48:21,2
2025-03-07,0.8,營收創高且獲利成長，顯示公司財務狀況良好，激勵市場情緒正面。,2025-06-08 01:48:22,1
2025-03-11,0.3,營收創新高、配發率高且殖利率佳，顯示公司財務狀況良好，但輝達股價下跌拖累相關代工廠表現。,2025-06-08 01:48:23,2
2025-03-12,0.1,分析師對EPS和營收預估下修，顯示市場對公司未來表現持保守態度。,2025-06-08 01:48:24,1
2025-03-13,-0.4,分析師目標價調降及評級分歧，顯示市場對公司前景看法不一，引發短期波動。,2025-06-08 01:48:25,1
