date,factor,explanation,updated_time,news_count
2024-11-13,0.6,廣達與緯創等 AI 伺服器組裝代工廠獲資金青睞，股價上漲，但整體市場仍受到台積電下跌影響，指數回測季線支撐。,2025-07-06 16:30:38,3
2024-11-14,0.9,廣達第3季營收創新高，AI伺服器需求強勁，超過整體伺服器營收50%，預估2025年AI伺服器營收將有三位數年增率。董事會通過對美國子公司增資2.3億美元，加速AI伺服器產能擴充，並預計輝達GB200 GPU的AI伺服器明年第一季中期開始出貨，顯示公司營運狀況良好，預期帶動市場情緒正面。,2025-07-06 16:30:41,2
2024-11-15,0.3,廣達股價下跌，顯示市場情緒偏向保守。,2025-07-06 16:30:43,3
2024-11-17,0.3,市場避險情緒濃厚，加上大型電子股冷卻，廣達遭外資賣超，預期短期內股價波動將受影響。,2025-07-06 16:30:44,1
2024-11-18,0.7,電子權值股普遍走跌，AI 類股下挫，傳產股如橡膠、塑化等表現較強。,2025-07-06 16:30:45,2
2024-11-19,0.6,廣達收黑，顯示市場對其表現較為保守，但整體台股上漲，電子權值與貨櫃三雄表現亮眼，傳產指標也走強，綜合而言對廣達的影響屬於中性。,2025-07-06 16:30:47,1
2024-11-20,0.8,AI 類股表現強勁，伺服器類股與光通訊族群漲幅顯著，帶動廣達股價上揚。,2025-07-06 16:30:48,1
2024-11-22,0.8,台股全面走揚，廣達等電子權值股同步上攻，顯示市場情緒正面。,2025-07-06 16:30:49,1
2024-11-24,0.3,外資連賣兩周，大型 AI 族群遭提款，但航運股獲得青睞，顯示市場偏向保守觀望。,2025-07-06 16:30:51,1
2024-11-25,0.8,AI 股強勁表現，帶動廣達 等權值股走揚，市場情緒正面。,2025-07-06 16:30:52,2
2024-11-26,0.2,台股下跌，廣達與其他科技類股同步走跌，顯示市場情緒偏向保守。,2025-07-06 16:30:53,1
2024-11-27,0.2,市場觀望氣氛濃厚，權值股表現不佳，廣達等組裝代工廠遭外資提款，引發市場負面情緒。,2025-07-06 16:30:55,2
2024-11-28,0.5,電子權值股漲跌互現，廣達小幅上漲，顯示市場情緒偏中性。,2025-07-06 16:30:56,1
2024-11-29,0.5,電子權值股普遍走弱，廣達逆勢小漲，顯示在市場疲軟時仍具一定支撐力道。,2025-07-06 16:30:57,1
2024-12-02,0.8,大盤上漲，權值股全面走揚，廣達等電子權值股漲近 1%。,2025-07-06 16:30:58,2
2024-12-03,0.8,廣達在台積電等大型權值股帶動下，收盤維持平盤，顯示市場對其表現仍有信心。,2025-07-06 16:31:00,1
2024-12-04,0.6,廣達漲幅與其他光通訊族群同步，顯示市場對該產業前景樂觀。,2025-07-06 16:31:01,1
2024-12-06,0.5,資訊族群類股走勢仍強勁，顯示相關產業需求穩定，但缺乏明確利多或利空因素，市場情緒偏中性。,2025-07-06 16:31:03,1
2024-12-09,0.8,11月營收雙增且創同期新高，加上伺服器出貨看俏，市場情緒正面。,2025-07-06 16:31:05,3
2024-12-11,0.1,台股電子權值股全面走弱，廣達也同步下跌，顯示市場情緒偏向保守。,2025-07-06 16:31:06,1
2024-12-12,0.85,廣達受惠於台股反彈與電子族群強勢表態，市場情緒正面。,2025-07-06 16:31:08,1
2024-12-13,0.5,廣達與聯電等權值股約於平盤遊走，顯示市場對其表現持中立態度。,2025-07-06 16:31:09,1
2024-12-15,0.3,市場觀望美國聯準會利率決策，外資賣超廣達等大型電子股，使盤勢轉弱。,2025-07-06 16:31:10,1
2024-12-16,0.4,廣達股價下跌，顯示市場對其表現持保守態度。,2025-07-06 16:31:12,2
2024-12-17,0.5,廣達與其他權值股表現相近，市場情緒中性。,2025-07-06 16:31:13,1
2024-12-20,0.5,廣達與其他權值股同步走弱，顯示市場情緒偏向保守。,2025-07-06 16:31:15,1
2024-12-22,0.3,外資賣超廣達，但仍有意加碼高價股和大型電子權值股，使盤勢弱中透強。,2025-07-06 16:31:16,1
2024-12-23,0.8,權值股普遍走強，廣達勁揚 4%，顯示市場情緒正面。,2025-07-06 16:31:17,1
2024-12-25,0.6,廣達股價小幅上漲，顯示市場情緒偏向正面，但漲幅有限，可能受到整體盤勢影響。,2025-07-06 16:31:19,1
2024-12-26,0.3,電子權值股表現平淡，廣達收黑，顯示市場對相關個股的興趣不高。,2025-07-06 16:31:20,1
2024-12-27,0.6,廣達與其他權值股同步於平盤下方遊走，顯示市場情緒偏向保守。,2025-07-06 16:31:22,1
2024-12-30,0.2,權值股普遍走弱，廣達跌逾 1%，加上營建類股表現強勁，軍工及無人機概念股漲停，整體市場交投清淡，量縮至 2666 億元。,2025-07-06 16:31:24,2
2024-12-31,0.8,電子五哥中廣達漲幅最大，顯示市場對其表現正面看待。,2025-07-06 16:31:25,1
2025-01-02,0.6,廣達 AI 領域成績亮眼，展望 2025 年高成長，但權值股走弱拖累大盤，加上 GB200 出貨傳聞，市場情緒偏正面但波動加劇。,2025-07-06 16:31:27,3
2025-01-03,0.85,廣達董事長林百里看好今年業績繼續衛冕冠軍，執行副總暨雲達總經理楊麒令也提到 GB200 未見需求減少，將如期於第一季出貨，激勵股價急拉。,2025-07-06 16:31:29,2
2025-01-05,0.3,市場情緒偏向保守，主要原因為台股整體表現疲弱，加上多項不確定因素待釐清，包括 FOMC 公布前次會議紀錄、大立光法說登場，以及美國新總統川普上任前的政策變數。,2025-07-06 16:31:31,1
2025-01-06,0.8,台積電領漲帶動科技股大反彈，廣達等電子權值股齊揚，顯示市場情緒正面。,2025-07-06 16:31:33,2
2025-01-08,0.85,營收與獲利雙創高點，顯示公司營運狀況良好，預期帶動市場情緒正面。,2025-07-06 16:31:34,2
2025-01-10,0.5,廣達股價早盤於平盤下方遊走，顯示市場情緒中性。,2025-07-06 16:31:36,1
2025-01-14,0.45,廣達股價走勢分歧，跌幅在 1% 左右，市場觀望氣氛濃厚。,2025-07-06 16:31:37,3
2025-01-15,0.2,電子權值股普遍下跌，廣達也無法倖免，顯示市場觀望氣氛濃厚，整體市場情緒偏向保守。,2025-07-06 16:31:39,2
2025-01-17,0.4,廣達股價走紅，顯示市場對其表現持中性偏正面看法。,2025-07-06 16:31:40,1
2025-01-20,0.8,AI 概念股受惠輝達執行長黃仁勳來台，帶動相關個股強勢反彈。,2025-07-06 16:31:42,3
2025-01-21,0.5,廣達在平盤上下震盪，市場情緒中性。,2025-07-06 16:31:43,1
2025-01-22,0.5,台股漲幅帶動廣達上漲，但缺乏明確利多消息。,2025-07-06 16:31:45,2
2025-01-29,0.8,AI 基礎建設投資將帶動相關產業成長，廣達身為 AI 伺服器的代表廠商，營運前景看俏，市場情緒正面。,2025-07-06 16:31:47,1
2025-02-03,0.2,AI 族群受美中貿易戰影響，廣達、緯創、英業達等個股跌停或重挫，顯示市場情緒偏向負面。,2025-07-06 16:31:49,1
2025-02-05,0.8,權值股全面走強，廣達漲逾2%，顯示市場情緒正面。,2025-07-06 16:31:51,1
2025-02-07,0.8,電子權值股與高價股齊揚，帶動市場情緒正面。,2025-07-06 16:31:52,1
2025-02-08,0.85,營收與獲利雙創高點，顯示公司營運狀況良好，預期帶動市場情緒正面。,2025-07-06 16:31:53,1
2025-02-10,0.7,營收成長顯示公司業績強勁，但電子權值股走弱，可能影響市場情緒。,2025-07-06 16:31:54,2
2025-02-14,0.5,廣達於平盤上方遊走，顯示市場對其營運狀況持中立態度。,2025-07-06 16:31:56,1
2025-02-18,0.8,廣達股價上漲，顯示市場對公司表現持正面看法。,2025-07-06 16:31:57,1
2025-02-20,0.5,電子權值股普遍走弱，廣達也小跌，但重電、綠能類股強勢表現，資金輪動帶來中性影響。,2025-07-06 16:31:59,1
2025-02-21,0.6,權值股普遍走強，廣達漲幅在1%左右，顯示市場對該公司表現持中性偏正面看法。,2025-07-06 16:32:00,2
2025-02-24,0.5,電子股普遍疲軟，廣達在權值股中表現偏弱，但整體市場量能仍在，傳產與防疫族群支撐跌幅。,2025-07-06 16:32:02,2
2025-02-25,0.2,權值股普遍下跌，廣達受影響。,2025-07-06 16:32:03,1
2025-02-26,0.8,廣達受惠於權值股全面反彈，且 AI 伺服器相關類股強勢表現，市場情緒正面。,2025-07-06 16:32:04,1
2025-02-27,0.8,廣達財報亮眼，營收與獲利雙創新高，顯示公司營運狀況良好，預期將帶動市場情緒正面。,2025-07-06 16:32:06,3
2025-02-28,0.8,廣達獲多位分析師調升2024年EPS預估值與目標價，顯示市場對公司營運前景樂觀。,2025-07-06 16:32:07,2
2025-03-01,0.8,資本支出大幅增加，顯示對未來市場需求樂觀看待，預期將帶動營收與獲利成長，激勵市場情緒正面。,2025-07-06 16:32:09,1
2025-03-02,0.3,國際局勢動盪、美中貿易戰升溫，以及台積電股價下跌等因素，對廣達產生負面影響。,2025-07-06 16:32:10,1
2025-03-03,0.3,廣達在台股中表現相對強勢，市場情緒略偏正面，但整體大盤疲弱影響其漲幅空間。,2025-07-06 16:32:12,1
2025-03-04,0.7,廣達與聯發科等權值股表現亮眼，帶動大盤跌幅收斂。,2025-07-06 16:32:13,1
2025-03-07,0.85,營收與獲利雙創高點，顯示公司營運狀況良好，預期帶動市場情緒正面。,2025-07-06 16:32:14,2
2025-03-11,0.4,市場對於廣達獲利預估下修與川普關稅政策的擔憂，引發市場情緒偏向保守。,2025-07-06 16:32:17,3
2025-03-12,0.5,台股上漲，廣達權值股帶動，但籌碼動向呈現外資連續賣超。,2025-07-06 16:32:18,1
2025-03-13,0.6,輝達 GTC 大會將登場，相關概念股有望受惠，但整體市場仍受到美股下跌、外資賣超等因素影響，預期廣達股價短線波動較大。,2025-07-06 16:32:19,1
2025-03-14,0.5,廣達與其他電子權值股同步反彈近 1%，顯示市場情緒偏向正面，但缺乏明確利多因素，無法推升指數大幅上揚。,2025-07-06 16:32:21,1
2025-03-17,0.7,電子股普遍走揚，廣達受惠於市場情緒正面。,2025-07-06 16:32:22,1
