date,factor,explanation,updated_time,news_count
2024-07-02,0.6,"電子權值股普遍進行修正，影響指數下跌，但在低接買盤進場下，跌幅已逐步收斂。市場成交重心持續聚焦設備股和綠能概念股，顯示資金流向仍有支撐。

台積電、聯發科等電子權值股走勢疲軟，影響大盤指數下跌，但光電族群和航運類表現亮眼，顯示市場信心尚未完全動搖。",2025-07-06 17:07:21,4
2024-07-03,0.8,台積電領漲，電子權值股表現強勁，加上金融族群助攻，帶動台股大漲。,2025-07-06 17:07:22,3
2024-07-04,0.8,台積電股價創新高，市值突破兆元，顯示市場對公司營運前景樂觀。,2025-07-06 17:07:24,4
2024-07-05,0.6,台積電維持平盤，顯示目前市場對其營運狀況尚無明確看法。整體而言，雖然有部分利多消息，如股價站上千元大關，但也有利空訊息，如訂單下修等，綜合考量後判斷市場情緒偏向中性。,2025-07-06 17:07:26,4
2024-07-06,0.8,鴻海營收與獲利雙創高點，顯示公司營運狀況良好，預期帶動市場情緒正面。,2025-07-06 17:07:28,1
2024-07-07,0.6,市場對美國總統大選結果的不確定性以及第二季財報可能帶來的影響，導致台積電股價出現波動。儘管如此，該公司在 AI 供應鏈中的地位和穩定的營運表現仍然受到投資者的青睞。,2025-07-06 17:07:30,3
2024-07-08,0.9,台積電市值首次突破兆美元，營收與獲利雙創高點，預期將引發市場正面情緒。,2025-07-06 17:07:32,3
2024-07-09,0.5,台積電股價創新高，但盤中壓回平盤，市場波動加大。法人分析技術面乖離過大造成風險擴大，外資連續減碼影響指數。半導體先進製程和 Apple 大週期，使基本面利多可期。,2025-07-06 17:07:34,4
2024-07-10,0.6,營收表現優於預期，市場情緒偏正面，但整體股價漲幅有限，顯示利多已部分反映在股價上。,2025-07-06 17:07:36,4
2024-07-11,0.8,分析師普遍上修目標價，顯示對公司前景樂觀，且股價近期表現優於大盤，加上外資終結連四賣，市場情緒正面。,2025-07-06 17:07:38,2
2024-07-12,0.4,電子股修正下，資金轉戰傳產族群，台塑四寶今日連袂上漲，南亞漲 2.8% 最為強勢，台化也漲近 2%，台塑、台塑化連袂走揚；其他像是豐泰漲 3%、潤泰新也漲 2%，亞泥、正新、華新等也收漲。,2025-07-06 17:07:40,3
2024-07-13,0.6,台積電在台灣股市崛起，帶動市場情緒正面，但中國股市疲弱，可能影響整體新興市場表現。,2025-07-06 17:07:41,1
2024-07-14,0.6,儘管台積電法說會即將登場，市場對其抱持樂觀，但上周四美國 CPI 數據的利多出盡表現須警惕，應觀察個股和市場量能變化，不排除本周市場波動恐放大。AI 技術對能源的巨大需求，科技巨頭為了實現 2030 年淨零碳排的目標，加劇了對綠色能源的需求，相關類股有機會成為下一波接力上漲的族群。,2025-07-06 17:07:45,3
2024-07-15,0.2,台積電平盤收場，市場情緒偏向中性。,2025-07-06 17:07:47,3
2024-07-16,0.8,台積電法說會前夕買盤點火，帶動多檔市值型、半導體 ETF 表現，加上營建類股表現亮眼，顯示市場對公司前景樂觀。,2025-07-06 17:07:48,3
2024-07-17,0.8,"台積電股價維持高檔，顯示市場對公司營運前景樂觀。

證交所放寬高價股波動幅度，減少注意股頻繁遭列的狀況；美股道瓊再創新高，帶動台股上漲；被動元件報價大漲，傳出庫存調整告終。",2025-07-06 17:07:51,4
2024-07-18,0.2,川普孤立主義言論引發外界譁然，為之後當選帶來高度不確定性，衝擊台積電股價重挫超過 4%，千金股也成為重災區。,2025-07-06 17:07:53,4
2024-07-19,0.3,台積電法說會釋出正面訊息，但市場對地緣政治風險意識升高，股價開盤下挫，再度跌破千元。,2025-07-06 17:07:55,4
2024-07-21,0.6,蘋果新機的銷售成果將影響 AI 應用發展，相關概念股有望受惠。,2025-07-06 17:07:57,2
2024-07-22,0.2,美國總統大選不確定性升高，加上資安事件衝擊美股，引發市場擔憂對台積電營運造成負面影響，導致台股重挫，權值股全面下跌。,2025-07-06 17:07:59,4
2024-07-23,0.8,台積電尾盤大單拉抬，大漲 40 元收 979 元，帶動指數最後一盤拉抬近 80 點，顯示市場對公司股價有正面期待。,2025-07-06 17:08:01,3
2024-07-24,0.7,國巨營收與獲利雙創高點，顯示公司營運狀況良好，預期帶動市場情緒正面。,2025-07-06 17:08:02,2
2024-07-25,0.8,大陸客戶為應對中美關係不確定性而大量下單，帶動台積電訂單激增，且願意支付高溢價，顯示市場情緒正面。,2025-07-06 17:08:03,1
2024-07-26,0.2,台股在連放 2 個颱風日後，儘管基本面無明顯變化，但美科技股崩跌影響，出現補跌態勢。權值電子全面遭空襲，台積電重挫超過半根停板，貢獻台股跌點約 420 點。新台幣僅開盤時見到貶值價位，且僅貶值 2.2 分，隨後處在升值走勢，再次呈股匯不同調，稍稍緩和資金賣股後流出市場的壓力。,2025-07-06 17:08:07,4
2024-07-27,0.3,新聞內容多聚焦在台積電的法說會與財報表現，但市場對獲利展望仍佳的消息反應不佳，顯示投資人對公司長期發展存在疑慮。,2025-07-06 17:08:09,2
2024-07-28,0.3,台股交易員認為，台股漲了大半年，很容易受到各種風吹草動的影響，已進入「易跌難漲」階段。外資在集中市場賣超 793 億元，呈現連 3 周賣超，其中，台積電 遭賣 387 億元。,2025-07-06 17:08:11,1
2024-07-29,0.6,台積電大漲帶動大盤反彈，顯示市場情緒有所回溫，但整體成交量仍然偏低，且部分個股表現疲弱，預期短期內市場將維持區間震盪。,2025-07-06 17:08:13,3
2024-07-31,0.4,台股整體走勢疲弱，電子權值股普遍下跌，但部分個股如國巨、台達電等有所支撐。市場情緒偏向保守，缺乏明顯利多刺激。,2025-07-06 17:08:15,2
2024-08-01,0.8,"散戶持續加碼，顯示對公司前景樂觀，帶動市場情緒正面。美聯儲降息預期也提振投資信心。

0.6
台積電領軍反攻，加上多個族群表現亮眼，推升大盤強彈超過 450 點，站回季線與五日線，顯示市場情緒偏正面。",2025-07-06 17:08:17,3
2024-08-02,0.1,台積電股價重挫，跌破季線關卡，市值縮水，半導體類股指數大跌，顯示市場情緒偏向負面。,2025-07-06 17:08:19,2
2024-08-04,0.2,美股重挫、台積電 ADR 跌超過 5%，加上融資水位仍高、大盤跌破季線位置，恐慌指數 VIX 竄升超 25%，顯示市場情緒偏向負面。,2025-07-06 17:08:20,1
2024-08-05,0.1,台積電股價大跌，市值驟降，顯示市場對公司營運前景悲觀。,2025-07-06 17:08:21,1
2024-08-06,0.6,台積電在市場波動下仍維持強勢表現，顯示公司基本面良好，短期內有望支撐股價。,2025-07-06 17:08:23,4
2024-08-07,0.8,"台積電上漲近 5%，外資大摩重新列為投資首選，推測目標價 1,220 元。",2025-07-06 17:08:25,2
2024-08-08,0.2,台積電股價下跌，市場情緒偏向保守，主要原因是電子權值股全面走弱，加上地震對熊本廠的潛在影響。,2025-07-06 17:08:26,3
2024-08-09,0.8,營收創新高，預估第三季財報表現亮眼，帶動市場情緒正面。,2025-07-06 17:08:28,3
2024-08-11,0.9,台積電營收創歷史新高，獲利表現亮眼，且法人看好未來三年先進製程產能及 AI 產業發展前景，預期帶動市場情緒正面。,2025-07-06 17:08:29,1
2024-08-12,0.8,台積電小漲表態，市場聚焦 AI 概念股與重電族群，顯示資金流向其他產業，對台積電的影響有限。,2025-07-06 17:08:31,2
2024-08-13,0.85,台積電尾盤翻紅，帶動指數小漲，顯示市場情緒偏正面。,2025-07-06 17:08:32,4
2024-08-14,0.9,台積電權值股走揚，帶動大盤上漲，顯示市場對公司表現正面看待。,2025-07-06 17:08:34,3
2024-08-15,0.8,地震對台積電營運影響有限，但精材法說釋出上半年獲利成長、下半年旺季可期的正面訊息，預期將提振市場情緒。,2025-07-06 17:08:35,2
2024-08-16,0.9,台積電股價強勁反彈，市值重返25兆元，顯示市場對公司營運前景樂觀，預期將帶動買盤進駐。,2025-07-06 17:08:37,4
2024-08-17,0.8,台積電等權值股強勢表態，搭上多頭順風車，填息率高，市場情緒正面。,2025-07-06 17:08:38,1
2024-08-18,0.6,市場情緒偏向正面，因為外資回補台積電等個股，顯示對市場信心的恢復。然而，投資人仍謹慎追價，且缺乏明確主流與類股輪動，表明漲勢可能有限。,2025-07-06 17:08:40,1
2024-08-19,0.6,台積電股價小跌，顯示市場對其表現持中立態度。,2025-07-06 17:08:41,2
2024-08-20,0.6,台積電舉行 ESMC 動土典禮，德國總理與歐盟執委會主席出席，顯示政府高度重視，並宣布補助 50 億歐元。董事長透露決定投資的由來和設廠原因，展現對未來在當地發展的信心。,2025-07-06 17:08:43,2
2024-08-21,0.2,台積電股價下挫超過 1%，失守五日線，顯示市場情緒偏向保守。,2025-07-06 17:08:45,1
2024-08-22,0.3,市場觀望氣氛濃厚，電子權值股走勢疲軟，台積電開盤平盤震盪，整體缺乏明顯利多刺激。,2025-07-06 17:08:46,2
2024-08-23,0.5,台積電股價小跌，市場情緒中性。,2025-07-06 17:08:47,2
2024-08-24,0.8,台積電供應鏈三家公司股價大漲，顯示市場對先進封裝技術發展樂觀看待。,2025-07-06 17:08:48,1
2024-08-25,0.6,矽光子技術受市場追捧，台積電領軍產業夥伴組生態系，但美國總統大選、經濟數據等因素影響市場觀望氣氛。,2025-07-06 17:08:50,2
2024-08-26,0.6,群創出售南科廠給台積電，帶動股價大漲，但第三季產能稼動率調降，營運狀況略顯保守。,2025-07-06 17:08:52,1
2024-08-27,0.7,台積電在盤下走勢，但半導體設備族群強勁表現帶動市場情緒正面。,2025-07-06 17:08:53,1
2024-08-28,0.6,台積電權值股上漲貢獻指數，顯示市場對公司表現仍有正面期待。,2025-07-06 17:08:54,2
2024-08-29,0.4,電子權值股普遍走弱，尤其是台積電下挫超過2%，影響市場情緒偏向保守。,2025-07-06 17:08:55,1
2024-08-30,0.6,電子權值股漲跌互見，台積電挑戰 5 日線失利，但傳產類股與金融股有不錯表現，支撐大盤走勢。市場持續聚焦光通訊，指標股聯亞強攻漲停，其他個股也有上漲表態。,2025-07-06 17:08:57,2
2024-08-31,0.5,長華 * 獲利與營收雙創高點，顯示公司營運狀況良好，但僅為相關個股，對台積電市場情緒影響有限。,2025-07-06 17:08:59,1
2024-09-01,0.6,國際半導體展與矽光子技術備受關注，顯示產業前景良好，但外資持續賣超台積電，市場情緒偏向保守。,2025-07-06 17:09:01,3
2024-09-02,0.5,電子股普遍走弱，但部分網通業者表現強勁，傳產族群則偏弱勢，整體市場量能低迷。台積電尾盤在大單敲進下小漲，顯示買盤力道仍在，但缺乏明確利多刺激，預期短期市場情緒將持續偏保守。,2025-07-06 17:09:03,1
2024-09-03,0.6,雖然台積電維持在平盤之上，但量能不出，市場情緒偏向保守。期交所將聯電納入夜盤交易，可能吸引外資參與，對台積電形成競爭壓力。,2025-07-06 17:09:05,2
2024-09-04,0.6,台積電獲得八大官股券商買超，顯示官方對該公司有信心，但整體市場下跌影響有限。,2025-07-06 17:09:06,2
2024-09-06,0.8,電子權值股強勢反彈，帶動台股上漲，但市場觀望美國非農就業數據，成交量縮減，顯示買盤力道不足。,2025-07-06 17:09:08,2
2024-09-08,0.9,魏哲家談話強調台積電在 AI 領域的獨特優勢與信賴度，展現公司對未來市場發展的正面看法。,2025-07-06 17:09:09,1
2024-09-09,0.1,美股下挫、台積電失守 900 元大關，顯示市場情緒偏向負面。,2025-07-06 17:09:11,3
2024-09-10,0.8,營收創新高且第三季財測樂觀，預期將帶動市場情緒正面，但近期股價表現疲弱，顯示短期內缺乏明確的利多刺激。,2025-07-06 17:09:13,3
2024-09-11,0.3,台積電股價下跌，且加權指數收黑，顯示市場情緒偏向保守。,2025-07-06 17:09:14,2
2024-09-12,0.9,"台積電營收持續成長，外資看好第三季與第四季營收表現，股價大漲填息，顯示市場對公司前景樂觀。董事長魏哲家呼籲員工多元包容的溝通方式，提升企業形象。

0.9
台積電營收持續成長，外資看好第三季與第四季營收表現，股價大漲填息，顯示市場對公司前景樂觀。董事長魏哲家呼籲員工多元包容的溝通方式，提升企業形象。

0.9
台積電營收持續成長，外資看好第三季與第四季營收表現，股價大漲填息，顯示市場對公司前景樂觀。董事長魏哲家呼籲員工多元包容的溝通方式，提升企業形象。",2025-07-06 17:09:18,3
2024-09-13,0.6,台積電股價上漲，但整體市場量能低迷，顯示買氣不足，對公司短期營運影響有限。,2025-07-06 17:09:20,2
2024-09-14,0.6,台積電相關設備廠股價上漲，顯示市場對其擴產需求正面看待。,2025-07-06 17:09:21,1
2024-09-15,0.6,台積電 3 奈米技術領先全球，AI 浪潮帶動訂單爆發，後續量產潛力大。,2025-07-06 17:09:23,3
2024-09-16,0.8,CoWoS 產能供不應求，台積電與日月光投控積極擴產，帶動設備業者訂單爆發，萬潤營收創新高，股價飆漲，成交值超越台積電，顯示市場對半導體產業前景樂觀。,2025-07-06 17:09:25,2
2024-09-18,0.9,台積電與上詮的合作關係證實，且上詮營收持續成長，顯示公司在光通訊領域有良好發展前景，預期將帶動市場正面情緒。,2025-07-06 17:09:26,1
2024-09-19,0.9,台積電股價大漲2%，帶動整體市場走勢向上，顯示投資人對公司前景樂觀。,2025-07-06 17:09:28,1
2024-09-20,0.9,台積電股價大漲逾 2%，帶動電子權值表現強勁，顯示市場對公司前景樂觀。,2025-07-06 17:09:29,1
2024-09-22,0.6,市場對美國降息循環到來持正面態度，有利推動中小型股補漲行情，但選前難出現連續大漲行情，且投信可能有結帳手法。,2025-07-06 17:09:31,1
2024-09-23,0.6,台積電股價小幅上漲，顯示市場對於其營運狀況持中性態度。,2025-07-06 17:09:32,3
2024-09-24,0.6,台積電法說會將牽動全球金融市場連鎖效應，且第四季成長股發揮空間大於指數，但黑天鵝事件可能影響市場情緒。,2025-07-06 17:09:34,3
2024-09-25,0.85,台積電重返千金行列，帶動台股再現 15 千金，市場情緒正面。,2025-07-06 17:09:35,4
2024-09-26,0.8,台積電股價上漲，顯示市場對公司表現持正面看法。,2025-07-06 17:09:36,1
2024-09-27,0.8,台積電股價守住千元大關，三大法人買超295億元，加上美股四大指數全面收漲、費半飆3%，帶動台股開盤大漲120點，台積電領軍穩步上攻。,2025-07-06 17:09:38,3
2024-09-28,0.8,CoWos 訂單挹注、半導體設備出貨穩定，營收成長可期，市場情緒正面。,2025-07-06 17:09:40,1
2024-09-29,0.8,外資買超台積電近 379 億元，顯示市場對公司前景樂觀。,2025-07-06 17:09:41,1
2024-09-30,0.2,美股四大指數全面下挫，台積電失守千元關卡，加上電子權值重挫，引發市場負面情緒。,2025-07-06 17:09:43,3
2024-10-01,0.6,台積電權值股回神，帶動大盤反彈，但成交量縮減，籌碼動向呈現外資與自營商賣超，投信買超。,2025-07-06 17:09:44,1
2024-10-04,0.4,台積電小漲且權值股表現分歧，市場情緒偏中性。,2025-07-06 17:09:45,1
2024-10-05,0.8,CoWoS 產能持續供不應求，預期將帶動設備業者訂單成長，間接挹注台積電營收與獲利。,2025-07-06 17:09:47,1
2024-10-06,0.8,輝達新一代顯示卡規格亮眼，預計將為台積電帶來強勁的晶圓產能需求，並間接刺激相關零組件廠商營收與獲利成長。,2025-07-06 17:09:48,1
2024-10-07,0.9,台積電強漲重登1000元之上，帶動大盤點數達218.8點，加上權值股將士用命，顯示市場情緒正面。,2025-07-06 17:09:49,1
2024-10-08,0.6,權值股漲跌互現，台積電翻紅帶動大盤跌幅收斂，但整體市場情緒偏保守。,2025-07-06 17:09:51,2
2024-10-09,0.85,台積電第三季財報優於預期，9月營收創歷史次高，顯示公司營運狀況良好，預期帶動市場情緒正面。,2025-07-06 17:09:53,4
2024-10-11,0.9,"台積電受惠於輝達、超微等客戶釋出 AI 晶片需求強勁的展望，股價創近三個月高點，市值重返 27 兆元。第四季營運將受惠超微新品、英特爾 CPU、手機晶片大廠等訂單挹注，市場對後續業績展望樂觀。

0.8
台積電法說前股價強漲 2.45%，收在近三個月高點。聯發科旗艦晶片獲外界肯定，漲幅超過 4%。輝達釋出 Blackwell 需求熱絡，廣達大漲超過 3% 收復半年線。大盤指數上漲 242.56 點，收在 22,901.64 點，成交量 3,503 億元。三大法人買超 221.35 億元。",2025-07-06 17:09:57,3
2024-10-12,0.8,台積電供應鏈業績看俏，營收獲利成長可期，帶動市場正面情緒。,2025-07-06 17:09:58,1
2024-10-13,0.8,台積電法說行情有望提前發酵，由護國神山發揮穩盤的角色，牽引大盤偏多格局。外資買超台積電達 440.8 億元，電子領頭羊買盤強勁有利盤勢。,2025-07-06 17:10:00,1
2024-10-14,0.6,台積電成交值高，顯示市場關注度高，但僅以平盤收盤，反映市場觀望氣氛濃厚。,2025-07-06 17:10:01,1
2024-10-15,0.8,台股大漲，AI 股強勁表現帶動權值股上攻，三大法人同步買超，顯示市場信心回升。,2025-07-06 17:10:03,3
2024-10-16,0.3,台積電遭外資減碼，但三大法人同步賣超，顯示市場情緒偏保守。,2025-07-06 17:10:04,2
2024-10-17,0.9,法說會釋出樂觀展望，營收與獲利雙創新高，顯示公司營運狀況良好，預期帶動市場情緒正面。,2025-07-06 17:10:06,4
2024-10-18,0.9,法說會釋出優於預期的財報與展望，外資調升目標價，股價創新高，顯示市場對公司營運前景樂觀。,2025-07-06 17:10:08,4
2024-10-19,0.8,台積電 2 奈米需求強勁，供應鏈業績成長，市場情緒正面。,2025-07-06 17:10:09,1
2024-10-20,0.6,市場對於台積電的消息反應偏中性，雖然第三季財報亮眼，但美中貿易戰與美國總統大選等不確定因素仍影響市場情緒。,2025-07-06 17:10:11,3
2024-10-21,0.6,台積電今日股價平盤狹幅震盪，整體市場由高價 IC 設計股與鴻海等權值股撐場，顯示雖然台積電休息，但仍有其他利多支撐市場情緒。,2025-07-06 17:10:13,3
2024-10-22,0.6,台積電工安意外引發停工，對公司營運造成負面影響，但目前事件仍在調查中，且 2 奈米廠進展順利，預期明年將進入量產，整體而言市場情緒偏向保守。,2025-07-06 17:10:15,3
2024-10-23,0.3,台積電股價下跌，顯示市場情緒偏向保守。,2025-07-06 17:10:16,2
2024-10-24,0.3,台積電法說會展望優良，股價創下歷史新高，但後續走勢疲弱，顯示市場情緒偏向保守。,2025-07-06 17:10:18,3
2024-10-25,0.6,台積電法說會釋出 AI 需求強勁的訊息，加上第四季輝達 GB200 將開始陸續出貨，AI 供應鏈表現亮眼，但美國大選不確定性高，加上美國 10 年期公債殖利率攀升至 4.2%，壓抑市場資金及風險偏好。,2025-07-06 17:10:21,3
2024-10-26,0.8,發放特別獎金顯示公司營運狀況良好，激勵員工士氣，預期帶動市場正面情緒。,2025-07-06 17:10:22,3
2024-10-28,0.6,台積電股價走勢疲軟，顯示市場情緒偏向保守。,2025-07-06 17:10:24,3
2024-10-29,0.3,美國大選影響、川普聲勢上漲引發市場擔憂，拖累台股走跌，但經濟部長強調台灣電力供應充足，半導體產業發展有利。,2025-07-06 17:10:26,3
2024-10-30,0.3,市場觀望氣氛濃厚，權值股表現平淡，台積電於平盤附近震盪。,2025-07-06 17:10:27,2
2024-11-01,0.6,美國總統大選帶來不確定性影響市場，但台積電等電子權值股低接買盤進場，跌幅收斂。,2025-07-06 17:10:29,4
2024-11-03,0.5,中信銀行擴大日本布局，熊本辦事處升格分行，有利於服務半導體廠商，但對台積電股價影響有限。,2025-07-06 17:10:30,1
2024-11-04,0.8,電子權值股回神，帶動台積電上漲，顯示市場情緒偏正面。,2025-07-06 17:10:31,2
2024-11-05,0.6,台積電在市場普遍觀望下仍維持平盤附近遊走，顯示公司基本面穩健，對市場情緒帶來正面支撐。,2025-07-06 17:10:33,3
2024-11-06,0.5,市場對川普當選的反應尚未完全明朗，各界觀望其政策細節與執行力度。,2025-07-06 17:10:35,4
2024-11-07,0.8,台積電股價上漲，顯示市場情緒正面。,2025-07-06 17:10:36,2
2024-11-08,0.6,台積電營收持續創高，顯示公司營運狀況良好，但中國 AI 晶片客戶斷供消息引發市場擔憂，短期內可能對股價造成壓力。,2025-07-06 17:10:38,4
2024-11-09,0.6,台積電暫停供應 7 奈米以下技術給大陸 AI 晶片客戶的消息引發市場擔憂，但公司強調遵守法規，且要求核查並非全面禁售。整體而言，市場情緒偏向保守，短期內缺乏明確利多刺激。,2025-07-06 17:10:40,1
2024-11-10,0.8,台積電在矽光子技術的開發上取得進展，AI需求強勁，相關供應鏈受惠。HBM4和矽光子商機龐大，市場對2025年有所期待。,2025-07-06 17:10:42,1
2024-11-11,0.3,市場情緒偏向保守，主要受到美元指數上漲、亞幣走疲、新台幣貶值等因素影響。,2025-07-06 17:10:43,4
2024-11-12,0.3,台積電第三季財報與現金股利雙創新高，顯示公司營運狀況良好，但市場對於權值股普遍走弱仍持保守態度。,2025-07-06 17:10:45,3
2024-11-13,0.3,市場關注美國對中國晶片出口管制措施，導致台積電股價波動加劇。,2025-07-06 17:10:47,4
2024-11-14,0.5,台積電股價維持平盤，顯示目前市場對公司營運狀況尚無明確看法。,2025-07-06 17:10:48,3
2024-11-15,0.6,台積電在美國獲得政府補助，顯示其在全球半導體產業的重要地位持續受到肯定。然而，創辦人張忠謀表示不會舉行完工典禮，引發市場對於該公司海外擴廠計畫的疑慮。整體而言，雖然獲得政府補助為正面消息，但完工典禮取消則可能帶來一些負面影響。,2025-07-06 17:10:51,4
2024-11-17,0.3,市場對台積電的看法偏向中性，雖然新晶片禁令可能影響營收，但輝達財報表現良好，有望帶動市場情緒。,2025-07-06 17:10:53,2
2024-11-18,0.3,台股受美股影響，電子權值股普遍走跌，但塑化類股因川普提名能源部長人選而強勁反彈，顯示市場情緒偏向中性。,2025-07-06 17:10:55,3
2024-11-19,0.8,群益金融集團預估台積電 2 奈米量產將帶動指數挑戰 26500 點，顯示市場對該公司未來成長前景樂觀。,2025-07-06 17:10:56,2
2024-11-20,0.5,台積電股價持續波動，市場情緒偏向保守，但整體而言並無明顯利多或利空因素。,2025-07-06 17:10:58,2
2024-11-21,0.6,台積電股價下跌，顯示市場對其表現不滿意，但整體大盤走勢尚可，其他電子權值股也有所下挫，無明確利多或利空因素。,2025-07-06 17:10:59,1
2024-11-22,0.9,台積電股價上漲，帶動電子權值股表現，顯示市場對公司營運前景持正面看法。,2025-07-06 17:11:01,3
2024-11-24,0.3,外資連賣大型 AI 族群，顯示對市場信心不足。,2025-07-06 17:11:02,1
2024-11-25,0.8,台積電權值股漲跌互現，AI類股走勢強勁，帶動市場情緒正面。,2025-07-06 17:11:03,3
2024-11-26,0.3,台積電股價下跌，顯示市場對公司表現存在疑慮。,2025-07-06 17:11:05,4
2024-11-27,0.3,台積電股價波動與市場情緒偏向保守，主要原因為權值股普遍下跌，加上加權指數接連摜破季線與半年線。,2025-07-06 17:11:06,2
2024-11-28,0.6,台積電股價波動與大盤走勢相似，但終場小幅上漲，顯示市場情緒偏向中性。,2025-07-06 17:11:07,2
2024-11-29,0.2,台積電股價走弱，權值三雄全面下挫，加上美股四大指數皆臉黑，顯示市場情緒偏向保守。,2025-07-06 17:11:09,2
2024-12-02,0.8,台股大盤上漲，帶動台積電開高走高，權值股全面走強，顯示市場情緒正面。,2025-07-06 17:11:11,3
2024-12-03,0.8,台積電股價上漲且站回月線之上，加上三大法人買超，顯示市場情緒正面。,2025-07-06 17:11:12,3
2024-12-04,0.9,台積電漲幅領先大盤，帶動市場情緒正面。,2025-07-06 17:11:14,2
2024-12-05,0.6,外資持續買超，顯示市場對台積電後市仍有期待。,2025-07-06 17:11:15,1
2024-12-06,0.6,營收與獲利雙創高點，顯示公司營運狀況良好，但市場情緒偏中性。,2025-07-06 17:11:16,3
2024-12-08,0.8,"外資大買台積電，顯示對公司前景樂觀，預期帶動股價上漲。

12 月作帳行情啟動，加上聯準會降息機率高，利多消息助長市場情緒正面。",2025-07-06 17:11:18,2
2024-12-09,0.5,台股漲跌互現，權值股表現不一，航運、AI 類股走強，但中小型股相對低迷。法人分析指出，台股短線處於高位震盪收斂短均線，本週估持續站穩 23000 之上，月線將翻揚上彎，無論基本面、技術面或是籌碼面，都將持續有利於行情走高續攻波段甚至歷史高點。,2025-07-06 17:11:21,4
