date,factor,explanation,updated_time,news_count
2024-01-30,0.6,台積電法說釋出樂觀展望，半導體與 AI 類股上攻，加權指數站上月線，顯示市場對公司營運前景持正面看法。,2025-07-06 17:03:27,2
2024-01-31,0.3,台積電股價走弱，電子權值股普遍疲軟，市場情緒偏向保守。,2025-07-06 17:03:29,2
2024-02-01,0.6,台股今日交投清淡，半導體雙雄表現疲弱，但尾盤在台積電買盤進駐，加上重電、金融股撐腰，指數甩尾上漲。三大法人合計買超 220.57 億元，其中外資翻多回補，自營商同步回頭買超。,2025-07-06 17:03:31,3
2024-02-02,0.8,"台積電尾盤拉抬帶動加權指數上漲，顯示市場對該公司仍有信心。

外資回補敲進台積電，反映其基本面良好且具投資價值。",2025-07-06 17:03:33,3
2024-02-04,0.8,"投信積極進場 AI 族群，顯示對市場情緒正面。加上外資連續買超，預期有利於股價表現。

台積電 股票市場情緒正面，主要原因為投信與外資同步買超，顯示對公司前景樂觀。",2025-07-06 17:03:35,2
2024-02-05,0.9,台積電領軍大盤站穩萬八，AI 概念股強勢表現，美科技巨頭財報亮眼，經濟穩健上行。,2025-07-06 17:03:37,3
2024-02-06,0.8,"外資持續加碼台積電，顯示對公司前景樂觀。熊本廠擴大投資，將進一步鞏固其在全球半導體市場的地位。

0.6
是方電訊獲得政府支持，未來有望成為台灣網路產業的領導者。然而，目前營收增長仍有限，需要更多政策支持才能實現其目標。",2025-07-06 17:03:40,4
2024-02-07,0.9,台積電1月營收創新高，預估首季營運淡季不淡，全年營收成長21-26%，3奈米貢獻大增，顯示公司營運狀況良好，預期帶動市場情緒正面。,2025-07-06 17:03:41,1
2024-02-08,0.9,台積電熊本廠擴建，顯示對日本市場的重視與信心，帶動相關供應鏈營運表現。,2025-07-06 17:03:42,1
2024-02-09,0.8,CoWoS 產能持續吃緊，顯示 AI 應用需求強勁，帶動市場對台積電的正面情緒。,2025-07-06 17:03:43,1
2024-02-12,0.8,半導體產業前景看好，加上在地化供應趨勢帶動特用化學品需求，多家大廠積極投資布局，顯示對台積電等晶圓代工廠商營運有正面助益。,2025-07-06 17:03:45,1
2024-02-14,0.6,美股四大指數走強，費城半導體指數漲幅達 3%，台積電 ADR 漲幅達 10%，顯示市場對該公司前景持正面態度。然而，美國通膨數據高於預期，降息時程恐有變數，美股回落，可能壓抑台股龍年開紅盤的拉抬力道，呈現萬八關卡有撐的驚驚漲格局。,2025-07-06 17:03:48,1
2024-02-15,0.85,台積電股價創新高，顯示市場對公司營運前景樂觀。,2025-07-06 17:03:49,3
2024-02-16,0.3,台積電股價拉回休息，市場資金轉向中小型股和相關族群。,2025-07-06 17:03:51,4
2024-02-18,0.6,外資大買台積電，但投信連 7 賣，市場情緒偏向中性。,2025-07-06 17:03:52,1
2024-02-19,0.6,台積電雖然訂單滿手，但市場仍受到其他因素影響，如美股下跌、AI 概念股走弱等，導致台積電股價震盪。整體而言，消息面偏正面，但市場情緒略顯保守。,2025-07-06 17:03:54,3
2024-02-20,0.9,權值股回神，台積電尾盤拉抬大盤指數，再創新高，顯示市場情緒正面。,2025-07-06 17:03:55,2
2024-02-21,0.2,電子權值股普遍疲軟，台積電漲多拉回整理休息，股價開低震盪，下跌約 6 元、跌幅 0.8%。,2025-07-06 17:03:57,3
2024-02-22,0.8,輝達財報優於預期，激勵台股半導體與 AI 類股表現，推升加權指數創高。台積電、聯發科等大漲，顯示市場情緒正面。,2025-07-06 17:03:59,3
2024-02-23,0.9,日本政府可能加碼補助台積電擴廠，熊本廠開幕帶動市場情緒正面。美股大漲，輝達財報亮眼，AI概念股強勢表現，預期將延續多頭態勢，挑戰萬九關卡。,2025-07-06 17:04:01,3
2024-02-24,0.8,熊本廠開幕典禮圓滿成功，顯示台積電與日本政府、企業的良好關係，有助於未來在日本擴張業務。,2025-07-06 17:04:03,3
2024-02-25,0.6,台股大漲且外資連續買超，但投信逢高調節 AI 族群，個股輪動加快，市場情緒偏正面但需留意拉回修正風險。,2025-07-06 17:04:05,1
2024-02-26,0.6,電子權值股撐盤，高價股表現強勢，傳產重電族群也續揚，但台積電平盤震盪，整體市場情緒偏正面但不過於熱絡。,2025-07-06 17:04:07,3
2024-02-27,0.3,市場情緒偏向保守，主要原因為台積電領跌翻黑、AI股全面倒地，以及三大法人同站賣方。,2025-07-06 17:04:08,3
2024-02-29,0.4,電子股由聯發科擔綱多頭要角，金融、傳產也同步強勢表態，推升大盤一度重返萬九，但台積電走弱影響市場情緒。,2025-07-06 17:04:11,4
2024-03-01,0.6,電子權值股表現分歧，高價股與 AI 股走強，傳產族群則有所拉回，整體市場情緒偏正面，但個別股票表現仍有差異。,2025-07-06 17:04:12,1
2024-03-02,0.8,台積電連續11年蟬聯高科技業夢幻企業冠軍，顯示其品牌形象與聲望良好，預期帶動市場正面情緒。,2025-07-06 17:04:13,1
2024-03-03,0.3,市場對聯準會降息的預期升高，可能導致美債殖利率上揚，進而影響科技股表現。加權指數創新高，但個股本益比過高，恐引發回檔修正。,2025-07-06 17:04:15,1
2024-03-04,0.9,台積電ADR大漲4%，股價創新高，顯示市場對公司前景樂觀。,2025-07-06 17:04:17,4
2024-03-05,0.8,"台積電領軍衝高，AI概念股跟進上漲，顯示市場對公司營運前景樂觀。

0.6
雖然台積電創新高，但尾盤遭殺壓，使得漲幅收斂，顯示短線獲利調節賣壓存在。",2025-07-06 17:04:19,3
2024-03-06,0.6,市場情緒偏正面，但漲幅空間有限。,2025-07-06 17:04:20,2
2024-03-07,0.8,"台積電股價強勢，市值衝上 19.9 兆元，帶領半導體權值股同步攻堅，大盤再創新高。外資看好英特爾訂單將顯著增長，2025 年成為台積電第二大客戶，僅次於蘋果。

0.6
台積電跳空開高、續寫新高價，也帶領半導體權值股同步攻堅，大盤最高衝上 19794.57 點，再度締造新猷。三大法人合計買超 92.12 億元，外資回頭買超 119.53 億元。",2025-07-06 17:04:23,4
2024-03-08,0.8,台積電股價創新高，顯示市場對公司營運前景樂觀，預期將帶動指數上漲。,2025-07-06 17:04:25,4
2024-03-09,0.8,京元電營收成長、擴產計畫積極且股價創新高，預期將帶動台積電等半導體族群正面市場情緒。,2025-07-06 17:04:26,1
2024-03-10,0.6,台積電股價創新高，反映市場對其營運前景的樂觀態度，但部分個股下跌和大盤結構不健康，引發對資金過度集中和潛在回檔風險的擔憂。,2025-07-06 17:04:29,3
2024-03-11,0.3,台股今日在權值股走勢不振之下，全局震盪有加劇之勢，但盤中仍有鴻海及金融股的力撐，收盤指數小跌。三大法人合計賣超 33.85 億元。,2025-07-06 17:04:31,3
2024-03-12,0.85,台積電股價上漲，反映市場對其未來業績前景的樂觀預期，以及英特爾外包帶來的快速成長。,2025-07-06 17:04:33,4
2024-03-13,0.6,"台股指數小幅上漲，但成交量放大，顯示市場觀望氣氛濃厚。權值股表現分歧，台積電守穩盤上，但聯發科開高走低。重電族群與金融股則相對強勢。

台股指數震盪幅度縮小，三大法人合計買超。台積電營收創新高，顯示公司基本面良好。但市場情緒仍偏觀望，缺乏明確的利多刺激。",2025-07-06 17:04:36,4
2024-03-14,0.6,台股指數創新高，但漲幅收斂且個股表現分歧，顯示市場情緒偏向謹慎。雖然台積電等權值股支撐，但中小型股普遍走跌，整體而言缺乏明確的利多或利空因素，預期隔日波動可能持續。,2025-07-06 17:04:38,3
2024-03-15,0.3,台積電除息、股價下跌，但營運狀況良好，市場情緒偏中性。,2025-07-06 17:04:39,3
2024-03-16,0.5,台積電受惠於高通新品發表，預計將採用台積電 3 奈米製程生產的晶片，帶動市場對半導體產業的關注。然而，目前缺乏明確的利多消息，因此市場情緒偏向中性。,2025-07-06 17:04:41,1
2024-03-17,0.3,市場對 ETF 申購熱潮與成分股拉高出貨的擔憂，引發部分投資人觀望態度。,2025-07-06 17:04:43,2
2024-03-18,0.9,台積電除息交易順利完成秒填息，股價上漲並帶動大盤上揚，顯示市場對公司營運前景樂觀。,2025-07-06 17:04:45,4
2024-03-19,0.8,台積電股價持續上漲，帶動大盤走強，加上輝達 GTC 大會宣布新款 AI 晶片，多家台廠入列供應鏈，相關概念股強勢表現。,2025-07-06 17:04:46,2
2024-03-20,0.3,台積電尾盤賣壓湧現，跌幅收斂，但仍下跌 0.5%，顯示市場情緒偏向保守。,2025-07-06 17:04:48,1
2024-03-21,0.9,美股三大指數再創新高，激勵台股夜盤上漲逼近2萬點，帶動台積電等權值股領漲，市場情緒正面。,2025-07-06 17:04:49,2
2024-03-22,0.4,台積電今日開高走低，顯示市場情緒偏向保守，短期內缺乏明確利多刺激。,2025-07-06 17:04:50,1
2024-03-23,0.6,台積電設廠帶動相關設備需求增長，子公司均華營收創新高，顯示市場對該產業前景樂觀。,2025-07-06 17:04:51,1
2024-03-24,0.6,台股站穩 2 萬點大關，顯示市場情緒偏正面，但部分交易員對盤面架構仍有疑慮，認為集中度過高且不健康，可能影響短期漲勢。,2025-07-06 17:04:53,1
2024-03-25,0.3,市場情緒偏中性，電子權值股走弱，重電族群與貨櫃航運股表現強勢。,2025-07-06 17:04:55,4
2024-03-26,0.3,台股今日震盪，電子權值股表現不一，傳產與金融股則相對強勢。整體而言，市場情緒偏中性，缺乏明顯利多或利空因素。,2025-07-06 17:04:56,2
2024-03-27,0.5,權值股表現平穩，軍工國防、線纜與生技族群走揚，整體市場情緒偏向中性。,2025-07-06 17:04:58,1
2024-03-28,0.6,台積電股價下跌，顯示市場情緒偏向保守，但因日本政府持續強化境內半導體生產基礎，並補助協助台積電在熊本縣建廠，預期對公司營運仍有正面影響。,2025-07-06 17:05:00,4
2024-03-29,0.8,AI 概念股領軍上漲，加上 ETF 資金進場，帶動指數強勁反彈，顯示市場情緒正面。,2025-07-06 17:05:02,2
2024-04-01,0.6,高階主管獲得限制員工權利新股，顯示公司對其人才的重視與獎勵，可能帶動市場正面情緒。然而，台積電股價在今日盤中表現平穩，未有明顯漲幅，整體市場氛圍偏向中性。,2025-07-06 17:05:04,2
2024-04-02,0.9,"台積電領漲帶動市場情緒正面，股價創新高。主要原因是 AI 權值股強勢上漲，以及三大法人買超。

0.8
台積電持續擴充先進封裝產能，對設備廠下單增加，印證公司營運良好，帶動相關供應鏈股價上揚。",2025-07-06 17:05:06,4
2024-04-03,0.6,雖然地震造成部分設備受損與生產中斷，但台積電迅速復原並維持工安系統正常運作，顯示公司應變能力強且營運狀況良好。,2025-07-06 17:05:08,3
2024-04-04,0.6,"地震造成部分設備受損，但台積電迅速復原並持續與客戶溝通，顯示公司應變能力強且對營運影響有限。市場預期先進製程需求強勁，可緩解地震帶來的財務衝擊。

0.6
台積電復工速度快且設備損壞不嚴重，顯示公司應變能力強且對營運影響有限。市場預期先進製程需求強勁，可緩解地震帶來的財務衝擊。

0.7
辛耘為台積電濕製程設備供應商，受惠於台積電擴建先進封裝廠，營運看增。市場預期公司未來數年業績成長可期，股價上漲反映投資人對其前景樂觀。",2025-07-06 17:05:12,4
2024-04-05,0.8,地震影響有限，全年營收展望維持不變，顯示公司營運狀況良好。,2025-07-06 17:05:13,2
2024-04-06,0.8,台積電供應鏈迅得業績展望樂觀，營收比重提升，有助於支撐市場情緒正面。,2025-07-06 17:05:14,1
2024-04-08,0.8,台積電獲得美國政府大額補助及三大客戶力挺，顯示公司營運前景良好，預期將提振市場信心。,2025-07-06 17:05:16,4
2024-04-09,0.9,台積電獲得美國大額補助與貸款，並宣布在美興建第三座晶圓廠，顯示公司營運前景樂觀，預期將帶動市場情緒正面。,2025-07-06 17:05:18,3
2024-04-10,0.9,第一季營收創同期新高，且第二季有望持續成長，顯示公司在 AI、HPC 領域的優勢與競爭力。,2025-07-06 17:05:19,1
2024-04-11,0.6,台積電尾盤再度攻高，達 820 元歷史新高價，顯示市場對公司營運前景仍持正面看法，但整體而言，市場情緒偏中性。,2025-07-06 17:05:20,3
2024-04-12,0.8,台積電股價創新高，第一季營收表現亮眼，且外資看好其在 HPC、AI 晶片領先地位，預估第二季營收持續增長。整體市場情緒正面，但午盤過後賣壓湧現，顯示短期獲利了結壓力仍在。,2025-07-06 17:05:22,2
2024-04-13,0.9,台積電交易戶數大增，顯示越來越多投資人將其視為長期存股標的，預期帶動市場情緒正面。,2025-07-06 17:05:24,1
2024-04-14,0.6,市場對台積電法說會的五大焦點議題存在不確定性，包括營運展望、先進製程研發進度、先進封裝擴產、全球布局計劃與資本支出金額。新台幣貶值帶動第一季財報表現亮眼，但市場對於第二季的成長力道仍持謹慎態度，且國際利空因素如伊朗與以色列的衝突、通膨數據高於預期等，可能影響投資人信心。,2025-07-06 17:05:27,2
2024-04-15,0.3,台股受中東戰事影響而出現大幅震盪，但台積電相關設備族群仍有低接機會。,2025-07-06 17:05:28,3
2024-04-17,0.9,台積電法說會前股價強彈，帶動權值股走高，大盤收復2萬點關卡，顯示市場情緒正面。,2025-07-06 17:05:30,3
2024-04-18,0.8,法說會上，台積電財務長黃仁昭表示受惠於3奈米與5奈米需求持續強勁，抵銷智慧型手機季節性影響，帶動第二季營收持續成長，美元營收預估為196-204億美元，季增4-8%，再創歷史新高。,2025-07-06 17:05:32,3
2024-04-19,0.2,台積電下修產業展望引發市場擔憂，但整體而言對公司營運影響有限，短期內股價波動可能受到大盤與國際情勢影響。,2025-07-06 17:05:34,3
2024-04-21,0.2,外資大舉賣超，台積電ADR跌幅顯著，加上聯準會降息延後等利空因素，市場情緒偏向保守。,2025-07-06 17:05:35,1
2024-04-22,0.3,調薪幅度回歸常態，顯示公司營運狀況趨於穩定，但整體市場仍偏保守。,2025-07-06 17:05:36,2
2024-04-23,0.8,地震未對廠區造成重大影響，市場情緒偏正面。,2025-07-06 17:05:38,3
2024-04-24,0.8,"電子權值股全面走強，尤其是半導體族群領漲，顯示市場對產業前景樂觀。加上外資買超多檔個股與 ETF，整體呈現正面氛圍，有利於台積電隔日股價表現。

0.9
大盤強勁反彈，電子權值股全面走揚，尤其是半導體族群漲幅領先，加上外資買超多檔個股與 ETF，顯示市場對產業前景樂觀，有利於台積電隔日股價表現。",2025-07-06 17:05:41,2
2024-04-25,0.6,台積電股價回吐昨日部分漲幅，顯示市場情緒偏向保守，但整體而言營造業景氣好轉、房市買氣增加等因素仍有利於公司未來發展。,2025-07-06 17:05:42,2
2024-04-26,0.9,台積電股價上漲，顯示市場對公司營運前景樂觀，預期將帶動買氣。,2025-07-06 17:05:43,1
2024-04-28,0.6,外資上周止賣轉買，回補台積電等多檔個股，顯示市場情緒略有改善。然而，5月1日美股財報與FOMC利率決策會議將登場，鮑爾的會後聲明受到關注，可能影響市場信心。,2025-07-06 17:05:45,1
2024-04-29,0.8,台積電股價上漲，帶動整體市場走揚，顯示公司表現良好，引發市場正面情緒。,2025-07-06 17:05:47,4
2024-04-30,0.3,權值股走勢平淡，台積電小漲表態，但鴻海與聯發科下跌，整體影響有限。,2025-07-06 17:05:48,2
2024-05-02,0.85,台積電走弱拖累大盤跌破月線，顯示市場情緒偏向保守。,2025-07-06 17:05:50,4
2024-05-03,0.6,電子權值股普遍上漲，顯示市場情緒偏正面，但部分 AI 股走弱，可能對整體市場帶來一些壓力。,2025-07-06 17:05:51,1
2024-05-05,0.8,台積電在高雄設廠帶動房市熱絡，營建業者獲利翻揚，預期將持續受惠未來十年。,2025-07-06 17:05:52,1
2024-05-06,0.9,台積電領軍大漲，帶動大盤再度攻高，顯示市場情緒正面。,2025-07-06 17:05:53,2
2024-05-07,0.8,台積電領軍上攻，帶動市場情緒正面。,2025-07-06 17:05:54,2
2024-05-08,0.5,台積電股價走勢與大盤表現相當，顯示目前市場對該公司的消息並無明顯偏多或偏空影響。,2025-07-06 17:05:56,3
2024-05-09,0.3,台股高檔震盪，電子權值股撐盤，但尾盤遭遇賣壓，台積電下挫。,2025-07-06 17:05:57,3
2024-05-10,0.8,台積電營收持續成長，現金股利調升至 4 元，顯示公司財務狀況良好，預期將帶動市場正面情緒。,2025-07-06 17:05:59,3
2024-05-13,0.9,"台積電股價創歷史新高，帶動台股指數衝上 20,933 點，顯示市場對公司營運前景樂觀。",2025-07-06 17:06:01,3
2024-05-14,0.8,台積電股價持續走高，顯示市場對公司營運前景樂觀。,2025-07-06 17:06:02,3
2024-05-15,0.9,"台積電股價創新高，顯示市場對公司前景樂觀。

台積電營運表現亮眼，股利政策穩定，技術領先且擴廠計畫持續進行。",2025-07-06 17:06:04,3
2024-05-16,0.8,"台積電美國廠爆炸事件造成人員受傷,但公司強調不影響營運,且股價在台股大漲下表現平穩。",2025-07-06 17:06:05,2
2024-05-17,0.3,台股今日開盤雖然開高，但旋即翻黑震盪，顯示市場情緒偏向保守。電子權值股如台積電、聯發科走跌，IC 設計指標及面板雙虎也普遍下挫，僅少數個股如廣達、技嘉、京元電子等維持漲勢。整體而言，市場對於電子類股的前景仍有疑慮。,2025-07-06 17:06:07,2
2024-05-19,0.5,市場情緒中性，雖然三大法人買超台股，但個別公司表現參差，AI PC 市場競爭激烈，轉單效應尚待觀察。,2025-07-06 17:06:10,2
2024-05-20,0.5,台積電股價在盤下游走，顯示市場情緒偏向保守，但整體指數呈現震盪走勢，無明顯漲跌傾向。,2025-07-06 17:06:11,1
2024-05-21,0.6,市場消化聯準會官員談話、期盼輝達財報，美股四大指數漲多跌少，那斯達克指數寫下歷史新高，上漲 108.91 點收 16794.87 點。台積電有能力透過遠端操作讓生產設備無法運轉，引發市場關注。,2025-07-06 17:06:13,4
2024-05-22,0.9,權值股普遍走強，帶動市場情緒正面。,2025-07-06 17:06:15,4
2024-05-23,0.9,台積電股價創新高，帶動市場情緒正面。,2025-07-06 17:06:16,3
2024-05-24,0.6,台股今日跌幅不斷收斂至百餘點，顯示市場情緒偏向穩定。雖然台積電下跌近 1%，但其他權值股如鴻海、聯發科等維持盤上表現，整體大盤走勢未受太大影響。此外，光通訊族群因台積電釋出矽光子新技術而強勢表態，亦為市場注入一劑強心針。,2025-07-06 17:06:18,2
2024-05-27,0.8,台積電熄火，權值股表現亮眼，AI族群強勢表態，貨櫃三雄也大漲，顯示市場情緒正面。,2025-07-06 17:06:20,3
2024-05-28,0.6,台積電小跌、失守五日線，顯示短期股價承壓，但整體市場仍維持高檔，AI 概念股強勢表現帶動大盤走揚。,2025-07-06 17:06:22,1
2024-05-29,0.3,台股震盪，電子權值股賣壓沉重，但光電、營建族群表現強勢。市場情緒偏向保守，缺乏明顯利多刺激。,2025-07-06 17:06:23,3
2024-05-30,0.5,"陳立白表示台灣是站在 AI 最有利的位置，但擔憂供電問題，期望新任經濟部長調整能源政策。台股受美股影響，權值三王全面修正，台積電跌幅超過 1%，回測月線支撐。

陳立白認為台灣在 AI 解決方案上有利，但擔憂供電問題；台股走勢偏弱，台積電等權值股下挫。",2025-07-06 17:06:26,2
2024-05-31,0.3,台積電股價下跌，主要受到市場賣壓與外資持續賣超影響。儘管營建、生技等族群有所表現，但權值股如聯發科走勢疲弱，拖累整體大盤表現。,2025-07-06 17:06:28,3
2024-06-02,0.9,輝達執行長黃仁勳宣布與多家台廠合作，打造 Blackwell 架構系統，推動生成式 AI 發展，並點名台積電等供應商提供晶圓代工及關鍵零組件，顯示對公司營運的正面支持。,2025-07-06 17:06:30,1
2024-06-04,0.8,"台積電股東會上，董事長劉德音表示公司營運狀況良好，持續加大研發投資，並在全球建立新的製造基地。同時也強調與客戶的關係良好，未來成長深具信心。整體而言，股東會釋出正面訊息，預期將帶動市場情緒正面。

0.6
台積電董事長劉德音表示，公司目前沒有回購股票計畫，將以穩定的現金股利發放方式回饋股東。同時也強調與輝達、超微等客戶關係良好，共同成長。雖然釋出正面訊息，但對於未來的營運方向仍持中立態度。

0.4
台積電總裁魏哲家表示，公司將根留台灣，並在美國、日本建立新廠，強調重點是價值觀一致。同時也坦言兩岸地緣政治挑戰，但不希望戰爭發生。整體而言，對於海外布局與地緣政治議題持中立態度。",2025-07-06 17:06:35,4
2024-06-05,0.8,台積電股價上漲，帶動加權指數終場上漲 128 點。,2025-07-06 17:06:37,2
2024-06-06,0.9,台積電 ADR 大漲創新高，外資看好輝達同意接受漲價將引發連鎖效應，營收成長動能強勁。,2025-07-06 17:06:38,4
2024-06-07,0.8,營收持續創高，顯示公司財務狀況良好，預期將帶動市場情緒正面。,2025-07-06 17:06:40,3
2024-06-10,0.6,台積電營收與獲利雙創高點，顯示公司營運狀況良好，但外資近期持續賣超，引發市場情緒偏向保守。,2025-07-06 17:06:41,1
2024-06-11,0.8,台積電領軍衝高創新高，帶動市場情緒正面，但尾盤遭殺，顯示獲利了結賣壓出籠。,2025-07-06 17:06:43,2
2024-06-12,0.9,"台積電股價持續上揚，總市值超越波克夏，顯示市場對公司營運前景樂觀。

台積電ADR目標價調升至180美元，重申「買入」評級，反映外資看好其成長潛力。",2025-07-06 17:06:45,4
2024-06-13,0.95,除息行情、獲利成長預期、AI 需求強勁等正面因素，帶動市場對公司前景的樂觀情緒。,2025-07-06 17:06:46,2
2024-06-14,0.9,台積電股價上漲，帶動台股創新高，顯示市場情緒正面。,2025-07-06 17:06:48,2
2024-06-15,0.9,營收與獲利雙創高點，顯示公司營運狀況良好，預期帶動市場情緒正面。,2025-07-06 17:06:49,2
2024-06-17,0.6,台股連日創高後出現獲利了結賣壓，權值股普遍震盪走勢，但成交重心轉向中小型股如重電、光電等族群支撐盤勢。整體而言市場情緒偏正面但略顯保守，預期短期內指數將在高檔區間波動。,2025-07-06 17:06:52,4
2024-06-18,0.95,台積電股價持續創高，帶動台股再度攻上歷史新高，大盤漲幅擴大至近 300 點，顯示市場情緒正面。,2025-07-06 17:06:54,3
2024-06-19,0.9,台積電股價持續創新高，顯示市場情緒正面。外資上調目標價，加上輝達市值超越微軟，皆有利於台積電的漲勢。群益金融集團預估第三季台股指數區間 21000-23500 點，並認為台積電將持續上漲。,2025-07-06 17:06:57,4
2024-06-20,0.85,台積電休息不影響市場情緒，鴻海強漲帶動大盤指數再創新高。,2025-07-06 17:06:58,3
2024-06-21,0.2,電子權值股普遍走弱，台積電開盤下跌 2%，加上美科技股周四收黑，整體市場情緒偏向保守。,2025-07-06 17:07:00,3
2024-06-22,0.8,台積電遭鉅額違約交割事件影響市場信心，但營運表現仍維持強勁，獲利與營收雙創新高，顯示公司基本面良好，預期將帶動市場情緒正面。,2025-07-06 17:07:02,2
2024-06-23,0.8,台積電漲幅強勁推動大盤上漲，外資持續買超，顯示市場對公司前景樂觀。技術面乖離大，季底前可能有回檔休息，但長線成長趨勢仍利多吸引資金。,2025-07-06 17:07:04,1
2024-06-24,0.2,台積電領跌、半導體、AI 等電子股修正下，大盤重挫逾 400 點，顯示市場情緒偏向保守。,2025-07-06 17:07:06,4
2024-06-25,0.6,市場情緒偏正面，但漲跌幅受制於整體大盤表現。,2025-07-06 17:07:08,3
2024-06-26,0.8,台積電權值股上漲，帶動市場情緒正面。,2025-07-06 17:07:09,4
2024-06-27,0.5,台積電相關新聞中，既有利多消息如擴廠投資，也有營收獲利表現、股價走勢等資訊。整體而言，雖然公司持續成長且對未來展望樂觀，但市場情緒仍偏保守，短期內缺乏明顯的強勁利多刺激，因此判斷對隔日股價影響中性。,2025-07-06 17:07:12,4
2024-06-28,0.6,台積電股價表現優於大盤，顯示市場對公司基本面仍有信心。,2025-07-06 17:07:14,3
2024-06-30,0.9,台灣整體半導體產業維持和緩漸進的復甦，下半年行情不淡，多家廠商鎖定 AI 應用為目標，預計將帶動半導體產業 2024 至 2026 年成長趨勢。,2025-07-06 17:07:16,1
2024-07-01,0.8,台積電與鴻海等權值股走強，加上市場卡位除息行情，帶動大盤表現。,2025-07-06 17:07:18,3
