date,factor,explanation,updated_time,news_count
2023-03-21,0.9,"瑞信危機暫解與普發現金效應持續發酵，電子權值股回神、觀光族群強勢，儲能概念股延續漲勢，市場情緒樂觀。

====================",2025-07-20 21:14:06,1
2023-05-04,0.9,外資報告對散熱產業展望樂觀，預期奇鋐等廠商未來幾年營收成長強勁，激勵市場情緒與股價上漲。,2025-07-20 21:14:12,1
2023-05-06,0.9,美系外資看好伺服器平台升級與 PC 需求回溫將帶動散熱產業成長，給予奇鋐正面評價並上修目標價至 200 元。,2025-07-20 21:14:13,1
2023-05-09,0.6,電子權值股普遍走揚提振市場信心，但儲能概念股與國防航太族群疲弱，整體大盤漲幅有限且量能萎縮，顯示買氣仍偏觀望。,2025-07-20 21:14:15,1
2023-05-15,0.3,雖然公司基本面表現尚可，但整體市場氛圍疲弱，且產業展望仍有疑慮，使得股價波動加劇。,2025-07-20 21:14:16,1
2023-05-26,0.9,輝達概念股強勢表現帶動市場情緒，電子股領軍大漲創今年新高，個股輪動與資金流向將持續影響盤勢走向。,2025-07-20 21:14:19,1
2023-05-31,0.4,電子權值股與 AI 概念股同步走弱，市場觀望氣氛濃厚，指數一度跌逾百點，拖累整體市場情緒。,2025-07-20 21:14:20,1
2023-06-02,0.4,成分股調整影響短期市場情緒，個別股票漲跌表現將取決於公司基本面與投資人預期。,2025-07-20 21:14:21,1
2023-06-18,0.6,產業與數字分析提供新機會，擴散效應有助於發掘潛在漲勢股，但仍需謹慎評估基本面與市場情緒。,2025-07-20 21:14:24,1
2023-06-30,0.7,AI 概念股強勢表現帶動市場情緒，惟電子權值股疲弱拖累大盤整體漲幅有限。,2025-07-20 21:14:27,1
2023-07-24,0.9,獲利創高與AI題材助攻帶動股價強勁漲勢，市場對奇鋐基本面展望樂觀。,2025-07-20 21:14:29,1
2023-12-31,0.6,AI 應用商機與科技大廠新品發表將帶動相關族群成長，惟整體市場情緒仍偏中性，需持續關注展覽後的實際效益。,2025-07-20 21:14:44,1
2024-01-01,0.6,總統大選行情與外資買超力道強勁有利多頭氣勢，但CES展後AI股表現仍待觀察。,2025-07-20 21:14:45,1
2024-01-04,0.3,電子股漲跌互見，個別表現分歧，加上貨櫃三雄強勢領漲航運類股，整體市場情緒溫和偏多但仍有不確定性。,2025-07-20 21:14:47,1
2024-01-08,0.6,營收創高與產品組合優化帶動獲利成長，但市場對新舊產品交替的短期影響仍持謹慎態度。,2025-07-20 21:14:48,1
2024-01-09,0.7,AI 概念股與高價 IC 設計族群強勢表現帶動市場情緒，權值股如台積電、聯發科維持平盤以上，但貨櫃三雄及傳產指標走弱壓抑漲幅。,2025-07-20 21:14:50,1
2024-01-10,0.6,外資大舉調節航運股轉進散熱雙雄，顯示對相關產業前景樂觀，但整體市場仍偏空震盪。,2025-07-20 21:14:51,1
2024-01-22,0.9,AI 概念股全面噴出，奇鋐 等個股強攻漲停帶動市場情緒向上，預期 AI 熱潮將持續推升相關族群表現。,2025-07-20 21:14:53,1
2024-01-25,0.6,熱錢湧入與 AI 概念股強漲帶動市場情緒向上，但個別公司表現參差，整體漲幅有限。,2025-07-20 21:14:55,1
2024-01-26,0.3,大盤指數在平盤附近遊走，權值股與金融股撐盤，但 AI 類股拉回，觀光類股表現亮眼。整體而言市場情緒維持中性偏正面。,2025-07-20 21:14:56,1
2024-01-30,0.9,AI 伺服器與散熱需求強勁，激勵相關個股大漲，其中奇鋐攻上漲停，雙鴻、健策等也表現亮眼，顯示市場對這些公司未來營運前景樂觀。,2025-07-20 21:14:58,2
2024-02-01,0.6,電子權值股疲軟拖累大盤，但 IC 設計與散熱族群強勢表現挹注市場信心，整體市場情緒偏向中性。,2025-07-20 21:15:00,1
2024-02-03,0.9,伺服器需求展望樂觀帶動散熱族群股價強漲，營運成長前景明確激勵市場情緒走揚。,2025-07-20 21:15:01,1
2024-02-04,0.6,投信積極進場 AI 族群並建立部位，外資持續買超科技股，市場情緒偏正面但仍需留意財報與經濟數據的影響。,2025-07-20 21:15:02,1
2024-02-09,0.6,NVIDIA 新品效能提升且價格相對親民，有望刺激換機潮，帶動顯卡相關零組件需求增溫，支撐業績表現。,2025-07-20 21:15:04,1
2024-02-15,0.9,伺服器、VGA 與手機等產品需求強勁，帶動營收創高，顯示公司在多元應用領域的競爭力與成長潛力。,2025-07-20 21:15:06,1
2024-02-16,0.9,AI 伺服器需求持續暢旺，營收與獲利創高激勵市場信心，奇鋐基本面展望樂觀將支撐股價表現。,2025-07-20 21:15:07,2
2024-02-25,0.6,外資買超金額居前個股普遍獲利了結，市場情緒偏向中性，惟大盤仍維持多頭格局。,2025-07-20 21:15:09,1
2024-03-01,0.6,電子權值股表現分歧，高價股與 AI 股領軍上攻，但傳產、金融普遍走弱，市場情緒偏正面但仍有不確定性。,2025-07-20 21:15:11,1
2024-03-04,0.9,電子權值股領軍衝高，加上族群表現強勁，激勵市場情緒樂觀，推升指數再創新高。,2025-07-20 21:15:13,1
2024-03-11,0.3,電子權值股普遍走弱拖累大盤，但輝達技術大會題材點火散熱族群，金融股撐盤中小型股也有資金拉抬，整體市場情緒偏向保守。,2025-07-20 21:15:15,1
2024-03-15,0.6,台積電尾盤急跌拖累大盤下跌，但鴻海等電子權值股及相關概念股表現強勁，整體市場情緒維持中性偏正面。,2025-07-20 21:15:16,1
2024-03-24,0.3,投信買超與外資賣超交叉影響股價，市場情緒中性偏空，觀望除權息填息力道及盤面架構健康度。,2025-07-20 21:15:19,1
2024-03-26,0.3,電子權值股普遍疲軟，傳產與金融股表現相對抗跌，市場情緒略偏空。,2025-07-20 21:15:20,1
2024-04-08,0.6,權值股漲跌互見，重電、線纜與 AI 概念股強勢上揚，顯示市場信心回溫但仍偏中性。,2025-07-20 21:15:22,1
2024-04-21,0.6,產業分散配置與多元題材挹注成長潛力，中小型股輪動行情啟動有利市場情緒，但短期漲多個股獲利了結賣壓仍在。,2025-07-20 21:15:25,1
2024-04-24,0.9,電子權值全面反彈，AI 概念股與半導體族群領軍大漲，加上觀光航空類股強勁表現，激勵市場情緒向上，推升加權指數重返 2 萬點關卡。,2025-07-20 21:15:27,1
2024-05-06,0.7,AI 伺服器與 NB 換機潮帶動營收成長，搭配水冷散熱需求增溫有利未來獲利提升，激勵市場正面情緒。,2025-07-20 21:15:29,1
2024-05-15,0.6,MSCI 台灣指數成分股新增奇鋐，權重調升至 0.53%，顯示市場對該公司前景持正面看法。,2025-07-20 21:15:31,1
2024-05-18,0.6,法說展望樂觀、AI 伺服器需求強勁與電動車進展有利支撐市場情緒，但 MSCI 調整結果中權重僅微幅上調，綜合而言對隔日股價波動影響呈現溫和偏多。,2025-07-20 21:15:33,1
2024-05-23,0.6,權值股領漲與軍工、散熱等族群表現強勁，激勵市場情緒向上，但中共軍演仍帶來不確定性因素。,2025-07-20 21:15:35,1
2024-05-30,0.6,市場對奇鋐未來獲利與營收展望樂觀，分析師調升目標價，顯示對公司成長前景的正面看待。,2025-07-20 21:15:37,1
2024-06-02,0.9,輝達執行長黃仁勳宣布與多家台廠合作打造 Blackwell 架構 AI 系統，顯示台灣供應鏈在生成式 AI 發展中扮演關鍵角色，激勵市場對相關個股的正面情緒。,2025-07-20 21:15:39,1
2024-06-23,0.6,市場熱度高且外資青睞 AI 供應鏈，但技術面乖離大與籌碼面偏多恐引發震盪修正。,2025-07-20 21:15:42,1
2024-06-26,0.6,綠能與生醫族群強勢表現帶動大盤上漲，加上電子權值股撐盤，整體市場情緒偏正面。,2025-07-20 21:15:44,1
2024-06-27,0.9,分析師對目標價與評級的樂觀共識反映市場對公司基本面前景的信心，激勵正面情緒並支撐股價上漲。,2025-07-20 21:15:45,1
2024-06-28,0.6,市場對未來獲利成長與營收表現持樂觀態度，但短期內仍存在一定的不確定性因素。,2025-07-20 21:15:46,1
2024-06-30,0.6,權值股除息及營收表現將影響短期走勢，但整體多頭氛圍仍在，加上選舉題材或有利空出盡契機。,2025-07-20 21:15:48,1
2024-07-01,0.4,市場情緒受到電子股普遍走弱影響，尤其是高價股與 PCB 相關個股的疲軟表現，對奇鋐等相關股票產生一定程度的負面壓力。,2025-07-20 21:15:49,1
2024-07-07,0.6,市場情緒偏正面，多頭行情持續，但個股表現分歧，投資人關注台積電法說與通膨數據。,2025-07-20 21:15:51,1
2024-07-09,0.7,FactSet 最新調查顯示目標價上修，市場對奇鋐的基本面展望樂觀，但營收與獲利成長動能仍待觀察。,2025-07-20 21:15:53,4
2024-07-15,0.3,電子股普遍走跌，尤其是權值股與大型個股，金融股也出現修正，僅少數傳產類股如地產股表現相對強勁，大盤在台積電、金融股壓力下翻黑，但整體影響有限。,2025-07-20 21:15:55,1
2024-07-26,0.3,台股大盤補跌，電子權值股全面下挫，加上 AI 概念股、重電族群同步走弱，市場情緒偏空，奇鋐 等個股面臨較大修正壓力。,2025-07-20 21:15:58,2
2024-07-30,0.6,市場對未來獲利成長預期持續上修，反映出對公司基本面的正面看法，但短期營收表現仍有待觀察。,2025-07-20 21:15:59,1
2024-08-02,0.1,市場信心受國際情勢與經濟數據影響而明顯下滑，加權指數大跌，電子股全面重挫，奇鋐等個股面臨較大賣壓。,2025-07-20 21:16:01,1
2024-08-10,0.6,市場對未來獲利成長持正向展望，但短期營收與獲利表現仍有壓力，引發中性偏空的市場情緒。,2025-07-20 21:16:03,1
2024-08-12,0.6,市場對未來獲利成長持正向展望，但短期營收與獲利表現仍有壓力，引發中性偏空的市場情緒。,2025-07-20 21:16:04,1
2024-09-02,0.5,台股量縮震盪，電子與傳產族群普遍走弱，市場情緒偏向保守，但金融股表現相對抗跌，整體而言維持中性。,2025-07-20 21:16:07,1
2024-09-12,0.9,AI 伺服器需求強勁帶動營收成長，奇鋐與雙鴻股價齊揚，顯示市場對相關個股後市樂觀。,2025-07-20 21:16:10,1
2024-09-19,0.9,聯貸案完成簽約與 AI 伺服器需求強勁帶動營運成長，市場對未來發展前景樂觀。,2025-07-20 21:16:11,1
2024-10-12,0.9,分析師普遍樂觀看待公司基本面與營運前景，目標價上修顯示市場對未來成長性有信心。,2025-07-20 21:16:15,1
2024-10-15,0.6,AI 概念股領漲激勵市場情緒，但整體成交量能不足且非電族群表現疲弱，短期漲多個股獲利了結賣壓仍在。,2025-07-20 21:16:17,2
2024-10-17,0.6,電子股走勢疲弱拖累大盤漲幅收斂，但傳產族群與貨櫃三雄領軍上攻，整體市場情緒偏正面但仍受不確定因素影響。,2025-07-20 21:16:18,1
2024-10-28,0.6,權值股全面走揚帶動大盤上漲，營建類股表現強勁，但 AI 類股回檔整理，市場情緒偏正面但短期波動加劇。,2025-07-20 21:16:20,1
2024-10-29,0.3,美國大選前市場觀望氣氛濃厚，加上川普再提台灣保護費議題引發疑慮，拖累權值股與 AI 族群走跌，市場情緒偏向保守。,2025-07-20 21:16:22,2
2024-11-20,0.6,分析師對奇鋐目標價與評級持續偏多，但近期股價表現疲弱，市場情緒受短期利空影響而轉趨謹慎。,2025-07-20 21:16:25,1
2024-11-25,0.7,AI 概念股強勢表現與台灣隊奪冠帶動相關類股上漲，激勵市場情緒走揚。,2025-07-20 21:16:27,1
2024-12-02,0.9,輝達新品出貨帶動散熱族群強勁漲勢，奇鋐等主要供應商受惠，營收獲利成長可期，激勵市場情緒與股價上揚。,2025-07-20 21:16:29,1
2024-12-08,0.6,外資大舉回補台股，傳統 12 月作帳行情啟動，加上市場預期聯準會降息機率高，有利個股輪漲，但技術面與成交量需配合，避免過熱引發震盪。,2025-07-20 21:16:31,1
2024-12-12,0.3,市場情緒維持中性，成交量萎縮與多空因素交雜使行情陷入區間整理，選擇看好的產業趨勢股拉回買進、逢高調節。,2025-07-20 21:16:33,1
2024-12-22,0.3,外資大舉賣超影響市場信心，但高價股與權值股仍獲青睞，籌碼面雜音與政策變數使盤勢偏弱但尚未完全失守。,2025-07-20 21:16:35,1
2025-01-22,0.6,權值股與AI族群領漲，搭配美股慶祝行情激勵，市場情緒偏正面。,2025-07-20 21:16:40,1
2025-02-05,0.4,分析師調降目標價與評級，反映市場對公司基本面看法趨於保守，引發中性偏空的市場情緒。,2025-07-20 21:16:42,1
2025-03-02,0.3,國際局勢動盪與關稅政策不確定性壓抑市場信心，但 MWC 展題材與 AI 應用前景仍支撐部分買盤，整體情緒偏向中性。,2025-07-20 21:16:46,1
2025-03-04,0.3,權值股普遍走跌拖累大盤，但中小型電子股如奇鋐、金像電等表現相對強勢，顯示市場情緒仍有支撐。整體而言，台積電在美投資案利多與權值股疲弱交錯下，市場觀望氣氛濃厚。,2025-07-20 21:16:48,1
2025-03-06,0.9,營收大幅成長且年增率維持高位，顯示公司基本面強勁，激勵市場情緒樂觀並推升股價上漲。,2025-07-20 21:16:49,1
2025-03-13,0.3,川普政策引發科技股重挫，台積電面臨壓力，但與 Intel 合組新公司的影響有限，整體而言市場情緒偏向中性。,2025-07-20 21:16:51,1
2025-03-19,0.3,市場對 AI 概念股信心不足，GTC 大會未能有效提振投資人情緒，加上美股四大指數走低，台股同步下挫。,2025-07-20 21:16:53,1
2025-03-21,0.4,台股走勢疲弱，權值股普遍下跌，加上 AI、伺服器類股表現不佳，市場情緒偏向保守。,2025-07-20 21:16:55,1
2025-03-23,0.3,市場擔憂美國可能將台灣列入「骯髒15國」清單並課徵關稅，引發投資人對台股後市的疑慮，雖然部分利空消息已被淡化，但整體氛圍仍偏向保守。,2025-07-20 21:16:56,1
2025-04-07,0.6,營收年增率持續成長且月增率正向，但近期股價下跌與籌碼面偏空使市場情緒趨於保守。,2025-07-20 21:16:59,1
2025-04-16,0.1,市場情緒受美中關稅戰升溫影響，電子權值股與相關族群走勢疲軟，僅少數個股表現抗跌。,2025-07-20 21:17:01,1
2025-04-25,0.9,水冷產品出貨放量與新品需求強勁帶動營收成長，加上越南擴廠計畫，激勵市場對奇鋐的正面情緒。,2025-07-20 21:17:03,1
2025-05-07,0.9,營收年增率與累計營收雙創新高，顯示公司基本面強勁，激勵市場情緒樂觀。,2025-07-20 21:17:05,1
2025-05-13,0.6,市場對未來獲利成長預期持續上修，反映出對公司基本面的正面看法，但短期營收表現仍有待改善。,2025-07-20 21:17:07,1
2025-06-04,0.6,市場對未來獲利成長預期持續上修，反映出對公司基本面與營運前景的正向看待。,2025-07-20 21:17:10,1
2025-06-05,0.9,營收年增率高達87%，顯示公司基本面強勁且成長動能持續，激勵市場情緒與股價上漲。,2025-07-20 21:17:11,1
2025-06-06,0.6,市場對未來獲利成長持正向看法，但短期營收與獲利表現仍有壓力，引發中性偏空情緒。,2025-07-20 21:17:13,1
2025-06-08,0.6,投信作帳行情啟動，選股聚焦中小型成長股與題材股，奇鋐等個股獲得買超青睞。,2025-07-20 21:17:14,1
2025-06-11,0.9,AI 伺服器需求強勁與水冷散熱元年來臨，激勵營收創高並帶動股價上揚，市場對未來成長前景樂觀。,2025-07-20 21:17:16,1
2025-06-15,0.3,地緣政治風險與市場避險情緒升溫帶來不確定性，但台股基本面穩健，外資操作策略將影響盤勢走向。,2025-07-20 21:17:17,1
2025-06-19,0.6,市場對未來獲利成長預期持續上修，中位數估值調升至37元，顯示分析師對公司基本面看法正向。,2025-07-20 21:17:19,1
2025-06-25,0.6,市場對未來獲利成長預期持續上修，反映出對公司基本面的正面看法，但短期營收表現仍有待觀察。,2025-07-20 21:17:21,1
