date,factor,explanation,updated_time,news_count
2024-03-14,0.6,市場情緒偏向正面，但高股息 ETF 被大舉調節，顯示投資人對於獲利能力與股息發放的疑慮。,2025-08-04 12:26:52,20
2024-03-15,0.6,個股表現分歧，權值股疲軟拖累大盤，但部分電子及傳產股逆勢上揚，市場情緒偏向中性。,2025-08-04 12:26:54,20
2024-03-18,0.6,市場對聯準會利率決策與通膨數據的擔憂，以及輝達 AI 大會帶動相關概念股輪動，綜合影響金像電的中性市場情緒。,2025-08-04 12:26:55,20
2024-03-19,0.7,多頭架構支撐、族群輪動及政策概念股助攻，整體市場情緒偏正面，但個股表現仍有差異。,2025-08-04 12:26:57,20
2024-03-22,0.6,市場情緒維持中性，股價波動有限。雖然台股創新高，但個股表現分歧，AI 概念股相對強勢，而傳產與電信類股則有賣壓。整體而言，市場關注升息、通膨與庫存調整等因素的影響，短期內難以出現明顯漲跌趨勢。,2025-08-04 12:27:00,20
2024-03-25,0.7,AI 概念股持續強勢，但個股漲多拉回壓力大，逢低可留意具爆發力成長的主升股。泰國 PCB 聚落形成有利產業發展。,2025-08-04 12:27:02,20
2024-03-26,0.7,市場情緒維持偏多，雖然大盤震盪拉回但仍守穩萬點關卡，重電族群與風電概念股輪動領漲，AI、散熱等主流類股表現強勁，但個別股票漲幅過高且本益比偏高，投資人應留意獲利了結賣壓。,2025-08-04 12:27:05,20
2024-03-29,0.6,台積電與聯發科領漲帶動加上 AI 概念股輪動激勵市場情緒，但部分高價股與傳產族群走勢疲軟，整體呈現正面但不強勁的多頭格局。,2025-08-04 12:27:07,20
2024-04-02,0.6,AI 概念股輪動激勵市場信心，但個別公司營運狀況與基本面差異大，整體走勢仍呈現區間震盪。,2025-08-04 12:27:09,20
2024-04-03,0.5,市場情緒中性，長假前賣壓使大盤下跌但仍守穩於五日線之上，顯示多頭並未棄守。,2025-08-04 12:27:10,20
2024-04-08,0.3,受惠於台商 PCB 廠積極切入東南亞地區設廠，設備廠商如迅得、聯策及科嶠等可望受惠，但整體市場情緒仍偏中性。,2025-08-04 12:27:13,20
2024-04-09,0.6,"市場情緒偏正面，多檔個股轉強帶動，但部分族群本益比過高，需留意漲多後的獲利了結賣壓。

====================

以下是提供的新聞資訊 :

1. 金像電 (2368) 今日以 56.2 元開盤，上漲 0.5 元，漲幅 0.89%。
2. 金像電 (2368) 今 (1) 日召開法說會，總經理李進祥表示，目前訂單能見度看到第四季，預期下半年營運優於上半年，全年業績力拚與去年持平。金像電 2023 年資本支出約 30 億元，其中 20 億元用於台灣廠區擴產，其餘 10 億元用於中國大陸昆山廠區的新建廠房，預計明年底完工投產。金像電今年前三季合併營收 174.98 億元，年增 12.5%，毛利率 16.9%，年減 0.6 個百分點，營益率 8.1%，年減 2.3 個百分點；稅後純益 10.15 億元，年減 11.4%，每股純益 3.14 元。金像電表示，目前訂單能見度看到第四季，預期下半年營運優於上半年，全年業績力拚與去年持平。金像電今年資本支出約 30 億元，其中 20 億元用於台灣廠區擴產，其餘 10 億元用於中國大陸昆山廠區的新建廠房，預計明年底完工投產。

採訪來源: 工商時報

====================

以下是提供的新聞資訊 :

1. 金像電 (2368) 今 (1) 日召開法說會，總經理李進祥表示，目前訂單能見度看到第四季，預期下半年營運優於上半年，全年業績力拚與去年持平。金像電 2023 年資本支出約 30 億元，其中 20 億元用於台灣廠區擴產，其餘 10 億元用於中國大陸昆山廠區的新建廠房，預計明年底完工投產。金像電今年前三季合併營收 174.98 億元，年增 12.5%，毛利率 16.9%，年減 0.6 個百分點，營益率 8.1%，年減 2.3 個百分點；稅後純益 10.15 億元，年減 11.4%，每股純益 3.14 元。金像電表示，目前訂單能見度看到第四季，預期下半年營運優於上半年，全年業績力拚與去年持平。金像電今年資本支出約 30 億元，其中 20 億元用於台灣廠區擴產，其餘 10 億元用於中國大陸昆山廠區的新建廠房，預計明年底完工投產。

採訪來源: 工商時報

====================",2025-08-04 12:27:23,20
2024-04-11,0.7,AI 概念股與 PCB 族群受惠產業成長，搭配投信買超等資金面因素，激勵市場情緒偏正向。,2025-08-04 12:27:25,20
2024-04-15,0.3,市場成交量萎縮、外資賣超及指數失守 10 日線等因素影響整體市場情緒偏空，個別股票表現分歧。,2025-08-04 12:27:26,20
2024-04-16,0.3,金控股賣壓與外資調節影響市場信心，雖然部分電子權值股買盤支撐但整體氣氛偏弱。,2025-08-04 12:27:28,20
2024-04-17,0.6,半導體設備需求強勁與擴廠趨勢帶動營收成長，股價本益比仍低於同業，中長期前景看俏。,2025-08-04 12:27:29,20
2024-05-08,0.7,"AI 概念股受惠產業前景樂觀，營收表現亮眼，吸引買盤進駐，推升市場情緒偏多。

====================",2025-08-04 12:27:31,20
2024-05-10,0.6,台積電領漲帶動電子權值股走強，加上貨櫃航運與金融股助攻，整體市場情緒偏正面。惟金像電等個別業績表現不一，影響部分投資人信心。,2025-08-04 12:27:33,20
2024-05-13,0.7,市場情緒偏向正面，但因外資買超力道不強且個股表現分歧，短期漲勢恐受限。,2025-08-04 12:27:34,20
2024-05-14,0.5,市場資金流向航運、IP、軍工及 AI 伺服器等個股，顯示類股高速輪動走勢，對 金像電 的影響中性。,2025-08-04 12:27:36,20
2024-05-22,0.7,獲利成長與營收回升顯示公司基本面穩健，搭配產業前景樂觀有助支撐市場情緒。,2025-08-04 12:27:37,20
2024-05-28,0.6,業績成長與新產能挹注支撐基本面，但大盤修正壓力加劇使市場情緒偏向保守。,2025-08-04 12:27:39,20
2024-06-03,0.5,PCB 廠商擴產計畫與新廠投資帶動設備需求，中長期展望正面，但短期營收表現仍疲弱。,2025-08-04 12:27:40,20
2024-06-07,0.3,雖然營收持續成長，但房地產市場消息對股價造成壓力，短期內市場情緒偏向保守。,2025-08-04 12:27:42,20
2024-06-08,0.6,獲利預估下修與市場共識偏向保守，反映整體營運成長趨緩，但仍有部分分析師對未來維持樂觀展望。,2025-08-04 12:27:43,20
2024-06-19,0.3,市場預估EPS與營收下修壓抑短期市場信心，但獲利表現仍維持一定水準。,2025-08-04 12:27:45,20
2024-06-25,0.7,受惠 AI 伺服器需求強勁，金像電營收和產能利用率創新高，擴廠計畫積極布局未來成長。,2025-08-04 12:27:47,20
2024-06-28,0.7,金像電受惠 AI、HPC 等新興科技需求強勁，營運成長動能穩健，激勵市場情緒偏正面，但整體盤勢漲跌互見，影響程度有限。,2025-08-04 12:27:49,20
2024-07-01,0.6,AI 題材持續發酵，相關個股漲多後拉回整理，但基本面強勁支撐市場信心，選股操作仍是重點。,2025-08-04 12:27:51,20
2024-07-02,0.7,"AI 伺服器需求強勁帶動 PCB 基板訂單爆表，新產能開出有助營收成長，但股價漲多後短線面臨獲利了結賣壓。

====================

金像電 (2368-TW) 受惠 AI 伺服器用 PCB 基板需求強勁，客戶訂單持續湧入，新產能第三季開出，有助營收表現優於去年。公司產品涵蓋 CPU 板、GPU 板、GPU 加速卡等高價板，AI 伺服器用 PCB 基板包括高密度多層設計、高頻率低信噪比、散熱功率管理、EMI/EMC 要求及可靠耐用等特性。金像電 (2368-TW) 股價近期走強，但漲幅已大，短線面臨獲利了結賣壓，建議逢高減碼或觀望。

宏捷科 (8086-TW) 6 月營收年增率達 101.88%，累計前六月營收年增率更是超過 198%。公司為砷化鎵晶片、數位行動電話功率放大器模組等製造商，受惠於手機市場需求回溫及客戶庫存水位下降，帶動宏捷科 (8086-TW) 出貨暢旺。宏捷科 (8086-TW) 股價近期表現平穩，建議持續追蹤後市發展。

請注意以上分析僅供參考，不作為投資建議。",2025-08-04 12:27:57,20
2024-07-04,0.7,市場情緒偏正面，主要受惠於產業趨勢向上、營收成長與題材支撐，但部分個股漲幅過大且波動加劇。,2025-08-04 12:27:59,20
2024-07-05,0.7,AI 產業趨勢明確，相關個股長線看漲，但短期漲多後基期已高，操作宜逢低佈局、買黑不買紅。,2025-08-04 12:28:01,20
2024-07-09,0.7,權值股帶動大盤創高，市場情緒正面，但中小型股休息，操作難度增加；綠能、軍工、遊戲等題材股有望受惠暑假旺季與政策利多。,2025-08-04 12:28:03,20
2024-07-10,0.5,台股創新高，綠能與矽光子概念股強勢表現提振市場信心，但整體漲幅有限，顯示短期內無明顯方向。,2025-08-04 12:28:05,20
2024-07-11,0.7,AI 伺服器需求強勁帶動 PCB 基板訂單增加，新廠產能開出，有助營收表現優於去年，但市場情緒仍維持中性。,2025-08-04 12:28:07,20
2024-07-16,0.7,營收與獲利成長動能強勁，AI 應用需求穩定，激勵市場情緒偏正面。,2025-08-04 12:28:09,20
2024-07-18,0.6,市場對金像電的獲利預估下修，營收展望保守，短期股價面臨壓力，但長期需求前景穩健，基本面仍具支撐。,2025-08-04 12:28:11,20
2024-07-30,0.7,產能擴充與下半年營運展望樂觀，搭配外資報告上調目標價激勵市場情緒，但整體盤勢仍偏弱使漲幅受限。,2025-08-04 12:28:13,20
2024-07-31,0.6,電子權值股普遍走跌拖累大盤，但部分個股如台達電、國巨等逆勢上漲，金像電等 PCB 相關個股也有表現，顯示市場信心尚未完全喪失。,2025-08-04 12:28:15,20
2024-08-01,0.7,AI 產業趨勢明確，金像電等相關個股有基本面支撐，反彈行情中操作以短線為主。,2025-08-04 12:28:17,20
2024-08-02,0.2,市場恐慌情緒升溫，加權指數重挫，半導體與高價股跌幅居前，金像電等電子指標股亦遭拖累。,2025-08-04 12:28:18,20
2024-08-05,0.3,市場信心受台積電領跌影響而下滑，加上個股表現疲弱，整體市場情緒偏向保守。,2025-08-04 12:28:20,20
2024-08-06,0.9,台積電與聯發科領軍反彈，金像電等多檔個股強勢表態，顯示市場信心回溫，整體情緒正面。,2025-08-04 12:28:22,20
2024-08-07,0.9,獲利創高且產能擴張計畫穩定公司成長前景，激勵市場情緒偏正面。,2025-08-04 12:28:24,20
2024-08-08,0.7,獲利創高與需求前景穩健顯示公司基本面強勁，激勵正面市場情緒，但整體大盤走勢疲弱影響金像電股價表現。,2025-08-04 12:28:26,20
2024-08-09,0.7,AI 概念股領軍反彈，權值股強勢表態，加上美股大漲助攻，激勵市場情緒回升，但仍需留意後續營收與財報表現。,2025-08-04 12:28:28,20
2024-08-12,0.3,市場對降息預期過度樂觀，利率風險仍在，短期內債券基金表現可能受到影響。,2025-08-04 12:28:31,20
2024-08-13,0.6,財報表現優於預期且對下半年復甦樂觀看待，獲利成長與營收增長帶動正面市場情緒。,2025-08-04 12:28:32,20
2024-08-20,0.5,三大法人買賣超個股差異顯示市場信心仍有分歧，整體而言對金像電的影響中性。,2025-08-04 12:28:34,20
2024-08-28,0.7,營收創高與產能擴張計畫顯示公司成長動能強勁，但市場觀望氣氛使股價波動加劇。,2025-08-04 12:28:35,20
2024-09-02,0.7,PCB 材料需求強勁與營收創高激勵市場信心，但產能利用率飽和可能壓抑短期成長動能。,2025-08-04 12:28:37,20
2024-09-03,0.3,電子權值股疲弱、外資賣超及解套賣壓影響市場信心，短期內台股走勢偏空。,2025-08-04 12:28:40,20
2024-09-04,0.7,蘋果新機題材與銅箔基板族群強勢表現帶動市場信心，但整體量能不足且資金輪動加快，短期內股價漲幅仍有壓力。,2025-08-04 12:28:41,20
2024-09-11,0.3,定穎泰國新廠火警事件引發市場擔憂，雖然初步傳回消息指出狀況不嚴重，但仍壓抑短期股價表現。,2025-08-04 12:28:43,20
2024-09-13,0.6,獲利與營收預估上修顯示市場對公司前景樂觀，但分析師分歧仍使目標價區間有限。,2025-08-04 12:28:44,20
2024-09-16,0.7,市場觀望 FOMC 會議，權值股表現平淡，但 PCB、車電及造紙族群領漲，整體市場情緒偏正面。,2025-08-04 12:28:45,20
2024-09-25,0.7,"AI 伺服器概念股受惠需求成長，營收獲利可望持續成長，但本益比偏低，拉回是買點。汽電零業績穩健成長，東陽擴廠因應未來成長需求，本益比超低。

====================",2025-08-04 12:28:47,20
2024-09-30,0.7,AI 帶動科技股強勁表現，搭配美國降息與選舉行情，激勵市場信心，但匯率變化與中美關係仍是觀察重點。,2025-08-04 12:28:50,20
2024-10-03,0.5,獲利預估下修與營收展望保守壓抑市場信心，但分析師普遍預期仍有正成長，維持中性市場情緒。,2025-08-04 12:28:51,20
2024-10-09,0.6,多空消息交錯，外資買超電子股但也減碼金融股，整體市場情緒偏正面但仍有不確定性。,2025-08-04 12:28:52,20
2024-10-16,0.6,整體市場表現強勁，AI 伺服器相關個股具成長潛力，但部分高估股開始修正，需留意漲多後的獲利了結壓力。,2025-08-04 12:28:54,20
2024-10-22,0.6,多檔 ETF 換股影響有限，但鋼鐵與線束類股納入，顯示市場對相關產業前景樂觀。,2025-08-04 12:28:56,20
2024-10-28,0.7,AI 伺服器需求成長與產能擴增利多激勵市場信心，但股價漲幅已大，短期獲利了結賣壓可能出現。,2025-08-04 12:28:57,20
2024-10-30,0.3,市場觀望氣氛濃厚，個股表現分歧，金像電買超力道減弱，市場情緒略為偏空。,2025-08-04 12:28:59,20
2024-11-08,0.5,市場預估EPS與營收雖有下修但幅度有限，整體展望仍維持穩健中性。,2025-08-04 12:29:00,20
2024-11-09,0.6,分析師目標價下修與評級偏空，但整體調降幅度有限，市場情緒略為悲觀但無明顯負面影響。,2025-08-04 12:29:01,20
2024-11-12,0.7,市場對選舉結果的不確定性導致短期波動加劇，但 AI 伺服器、陸股相關及車電等族群展現強勁走勢，整體情緒偏正面。,2025-08-04 12:29:03,20
2024-11-22,0.6,輝達財報與展望優於預期，激勵市場情緒，但漲幅不足引發疑慮，台股受影響呈現區間整理。AI 供應鏈如金像電、台燿等維持強勢。,2025-08-04 12:29:05,20
2024-11-27,0.6,市場信心受到負面影響，短期股價可能承壓，但部分個股如金像電等具長線需求支撐，有望在修正後反彈。,2025-08-04 12:29:06,20
2024-12-02,0.7,出口表現亮眼與 AI 伺服器需求強勁帶動科技產業成長，搭配企業獲利持續上修，支撐市場信心，但需留意外資動向及降息幅度縮減等潛在風險。,2025-08-04 12:29:09,20
2024-12-04,0.6,整體市場氛圍偏正面，展望後市營運不看淡，但獲利與營收下滑及庫存調整壓力使短期市場情緒維持中性。,2025-08-04 12:29:10,20
2024-12-11,0.2,市場情緒偏向負面，股價可能下跌。外資連續賣超且空單增加，加上台積電除息前賣壓沉重，顯示投資人對短期行情持保守態度。,2025-08-04 12:29:13,20
2024-12-12,0.7,美股四大指數中費半跌破年線，輝達連4天下跌，台積電ADR跌至月線，電子股非唯一主流，加上雲端軟體資安概念股漲多拉回，貨櫃三雄有機會輪動，PCB個股金像電可能受惠。,2025-08-04 12:29:16,20
2024-12-13,0.7,PCB 板族群與網通類股齊揚，帶動金像電 股價上漲，顯示市場對相關產業前景樂觀。,2025-08-04 12:29:17,20
2024-12-16,0.7,外資買超台積電等權值股與台塑集團個股，市場信心回溫，帶動股價上漲，但整體市場觀望氣氛濃厚。,2025-08-04 12:29:20,20
2024-12-17,0.7,"市場情緒偏正面，部分個股漲勢強勁，但整體仍需觀察全球央行會議結果及期貨結算表現。操作上建議留意 A 指標訊號，並密切關注主力動向與產業趨勢。

====================

請注意以上分析僅供參考，不代表實際市場走勢，投資人應自行判斷並審慎評估風險。",2025-08-04 12:29:24,20
2024-12-20,0.7,"轉單題材激勵股價走高，但大盤下跌拖累表現，市場情緒偏向正面但仍有壓力。

====================

0.3
大盤重挫拖累個股表現，網通概念股雖然強勢但整體市場氛圍仍然疲弱。",2025-08-04 12:29:26,20
2024-12-24,0.7,市場情緒受盤勢穩定與分析師看好相關族群表現的正面影響，股價有望跟隨多頭走揚。,2025-08-04 12:29:27,20
2024-12-25,0.6,電子權值股穩健、千金股與機器人光學族群強勢上漲帶動大盤小幅收紅，但成交量萎縮且傳產與金融類股疲弱，市場情緒偏向正面但仍有不確定性。,2025-08-04 12:29:29,20
2024-12-27,0.6,市場對台積電熊本廠量產的正面消息反應熱烈，AI、無人機等題材股表現強勁，但整體市場情緒仍受到經濟數據和政策變化的影響而維持中性。,2025-08-04 12:29:31,20
2024-12-30,0.7,AI 伺服器需求強勁，帶動金像電營收與獲利成長，外資看好其產能擴張與一站式解決方案能力，推升市場情緒。,2025-08-04 12:29:33,20
2025-01-06,0.6,台股大漲帶動金像電等電子權值股走揚，但個股表現分歧，市場情緒偏正面但波動加劇。,2025-08-04 12:29:34,20
2025-01-08,0.7,營收持續成長且年增率維持雙位數，顯示公司基本面穩健，但股價表現相對疲弱，籌碼面略偏多。,2025-08-04 12:29:36,20
2025-01-10,0.6,外資操作混亂且無明顯方向，個股表現強弱分歧，基本面與產業趨勢仍支撐市場信心。,2025-08-04 12:29:38,20
2025-01-13,0.3,營收與獲利預估下修、產能擴張速度不如預期及新產品開發受阻等負面因素影響市場信心，短期股價承壓。,2025-08-04 12:29:39,20
2025-01-16,0.7,權值股領漲帶動大盤上揚站上季線，財報表現亮眼且需求前景穩健支撐市場信心。,2025-08-04 12:29:41,20
2025-01-18,0.5,新增金像電等 30 檔個股，顯示強勁基本面與獲利能力，激勵市場情緒但短期漲幅有限。,2025-08-04 12:29:43,20
2025-01-22,0.7,"AI Server 需求強勁與投信買超激勵市場情緒，外資、投信同步買進顯示共識。

====================

以下是提供的新聞資訊 :

聯發科 (2454-TW) 今 (1) 日召開法說會，公布第三季財報，稅後純益 135.58 億元，季減 14%，年增 3%，每股純益 12.03 元。累計前三季稅後純益 448.08 億元，年增 2%，每股純益 40.63 元。聯發科第三季營收 1,042.62 億元，季減 6%，毛利率 44.4%，季減 0.7 個百分點，營益率 17.9%，季減 1.3 個百分點；稅後純益 135.58 億元，季減 14%，年增 3%，每股純益 12.03 元。聯發科前三季累計營收 3,424.08 億元，年增 8%，毛利率 44.6%，年增 0.7 個百分點，營益率 18.2%，年增 1.4 個百分點；稅後純益 448.08 億元，年增 2%，每股純益 40.63 元。聯發科預估第四季營收介於 9,650~10,100 億元之間，以中位數計算，將季減約 4%、年減 1%，毛利率介於 43.5~46.5%，營益率介於 15.5~17.5%。聯發科表示，第三季受客戶庫存調整影響，手機與電源管理晶片出貨量下滑，但電視、平板等產品出貨成長，帶動營收表現。展望第四季，聯發科預期手機市場需求仍疲弱，不過 5G 手機滲透率持續提升，有助於新產品組合表現。

範例輸出4:
0.6
財報與展望符合預期但庫存調整壓力延續使市場情緒維持中性偏空。",2025-08-04 12:29:50,20
2025-01-28,0.6,"AI 需求帶動 PCB 廠營收成長，但消費性電子市場回溫力道不確定，生產區位調整及泰國新廠成本壓力也將是今年 PCB 產業重大變數。公司積極轉型高階產品以因應市場變化。

====================

以下是提供的新聞資訊 :

2024 年電子產業景氣 AI 的浪潮帶動復甦，上游 CCL 及 PCB 廠在 AI 需求加持之下，包括台光電 (2383-TW)、臻鼎 - KY(4958-TW)、金像電 (2368-TW) 及健鼎 (3044-TW) 營收創新高。但同時，PCB 廠的生產區位調整順利與否及消費性電子市場的回溫力道，也將是今年的 PCB 產業重大變數。 但 PCB 產業界人士指出，就產品的應用上，2025 年在 AI 及低軌衛星板的成長性仍不容置疑。 就 PCB 廠的生產區位調整來看，2024 年有包括柏承 (6141-TW) 關閉在江蘇昆山廠的生產，而將訂單移轉到南通廠；同時，競國 (6108-TW) 繼售出泰國廠給 PCB 陸廠之後，也關閉在台灣樹林的生產線，而志超 (8213-TW) 持股 44.21% 的宇環 (3276-TW) 也暫停高雄前鎮汽車板廠 (志昱科技) 的 PCB 自行生產業務，採全單外包方式生產交貨。 而在 PCB 廠迫於地緣政治的形勢及客戶端的壓力，紛紛赴泰國投資設廠，包括華通 (2313-TW)、金像電、臻鼎 - KY 及欣興 (3037-TW)2025 年泰國新廠都將進入 量產，量產初期成本及人力的負擔，加上泰國 PCB 供應鏈仍處初期發展階段，加上語言、文化及民俗風情等學習曲線成本，形成對經營獲利的龐大挑戰 。 雖然 AI 伺服器板爲 2024 年最為紅火的話題，但在消費性電子、車用等應用，仍未見明確的復甦，雖然 2025 年市場有 AI 手機及 AI PC 等驅動換機潮的議題，志超主管指出，志超對 2024 年志超對於資本支出維持在逾 15 億元高檔，AI PC 的發展趨勢對 PCB 廠而言，因屬新料號、新產品，更有高的附加價值，等於爲 PCB 廠帶來新的發展機會，在目前志超以積極的態度擴充設備及製程，也指望市場需求得以出現回溫走勢帶動營運。 而楠梓電 (2316-TW) 主管則表示，楠梓電正積極進行在台 PCB 生產業務的重要轉型，預估將對目前需求最高的 AI、HPC 高速運算應用 PCB 接單比例大幅提高；2024 年楠梓電的 HPC 高速運算應用 PCB 占營收比重約 13%，在楠梓電執行的策新略之下，預估今年將可提高至 5 個百分點的占比。 楠梓電 2024 年的營收 33.32 億元，產品應用比重以通訊電子比重 46%，微機電系統應用 13%，HPC 速運算應用 PCB 占營收比重約 13%，工業電子 9%，GPS 占 8%，車用電子占 7%。 楠梓電目前的轉型策略在營收成長之下，預計拉高 HPC 高速運算應用 PCB 占營收比重至少要拉高 5 個百分點。同時，此一策略之下，預計今年的資本支出將高於 2024 年。並以更新設備承接高階產品的訂單。",2025-08-04 12:30:02,20
2025-02-08,0.7,營收創高與產能擴張展現公司成長動能，但獲利表現仍需觀察，市場情緒偏正面但不過度樂觀。,2025-08-04 12:30:04,20
2025-02-11,0.5,獲利預估下修與營收展望保守壓抑市場信心，但整體趨勢仍維持中性。,2025-08-04 12:30:05,20
2025-02-12,0.6,展望樂觀但仍有變數，AI成長動能與庫存回補需求支撐市場情緒，但關稅爭議與DeepSeek帶來不確定性。,2025-08-04 12:30:08,20
2025-02-17,0.5,市場預估金像電2024年EPS下修至11.34元，顯示獲利成長趨緩，但營收仍有增長空間，整體基本面維持穩健。,2025-08-04 12:30:09,20
2025-02-18,0.7,市場情緒中性，指數反彈但個股表現分歧，權值股漲跌互見，題材股強勢表現。,2025-08-04 12:30:11,20
2025-02-19,0.7,AI 應用爆發帶動高速運算需求，相關產業鏈受惠，但短期漲多個股宜保守操作。,2025-08-04 12:30:14,20
