date,factor,explanation,updated_time,news_count
2023-12-23,0.7,"市場情緒受英特爾 AI 產品發表會與相關概念股帶動，短期正面但須留意高檔震盪壓力。

====================

以下是提供的新聞資訊 :

嘉澤 (3533-TW) 今 (29) 日召開法說會，董事長劉德明表示，目前訂單能見度看到 2023 年第一季，預期第四季營收可望優於第三季，全年營收力拚與去年持平。嘉澤今年前三季稅後純益 16.08 億元，每股純益 12.45 元，較去年同期成長 22%，法人估全年每股純益上看 17 元。 嘉澤第三季營收 61.5 億元，季增 3.8%，毛利率 23.4%，季減 0.7 個百分點，營益率 12.1%，季減 2.6 個百分點；稅後純益 5.16 億元，季減 14.9%，每股純益 4.05 元。 嘉澤前三季累計營收 173.8 億元，年增 19.3%，毛利率 23.6%，年增 1.2 個百分點，營益率 12.5%，年減 0.7 個百分點；稅後純益 16.08 億元，年增 22%，每股純益 12.45 元。 嘉澤表示，目前訂單能見度看到明年第一季，預期第四季營收可望優於第三季，全年營收力拚與去年持平。展望後市，嘉澤認為，隨著客戶庫存逐步回到健康水位，加上英特爾新平台 Sapphire Rapids 將在第四季開始放量出貨，有助推升伺服器市場需求，帶動營運成長。

範例輸出4:
0.9
訂單能見度延伸至明年第一季、Sapphire Rapids 放量有利未來成長，激勵正面市場情緒。",2025-08-04 12:37:41,20
2023-12-27,0.6,獲利創高與需求前景穩健顯示公司基本面強勁，激勵正面市場情緒，但部分個股漲幅已大且估值偏高，短期回檔整理壓力仍在。,2025-08-04 12:37:42,20
2023-12-29,0.7,台股封關日漲幅擴大，AI 概念股領軍上攻，加上權值股普遍平穩，高價股也強勢撐盤，激勵市場情緒向上。,2025-08-04 12:37:44,20
2024-01-02,0.3,電子權值股疲弱拖累大盤走低，貨櫃三雄與航空雙雄撐盤，但 AI 概念股普遍下跌，市場情緒偏向保守。,2025-08-04 12:37:45,20
2024-01-03,0.2,電子類股普遍走跌，尤其是半導體與 AI 概念股下挫，拖累市場情緒偏空。,2025-08-04 12:37:47,20
2024-01-04,0.3,權值股疲弱與高價股下挫拖累大盤，加上航運漲多拉回影響整體市場信心。,2025-08-04 12:37:48,20
2024-01-07,0.3,醫療險改革引發市場關注，部分實支實付產品停售或調整投保條件，短期內可能壓抑市場情緒，但長遠來看有利於健全發展。,2025-08-04 12:37:50,20
2024-01-09,0.7,AI、高價 IC 設計族群撐盤，權值股表現平穩，但貨櫃三雄重挫拖累大盤，電子與傳產股走勢分歧。,2025-08-04 12:37:51,20
2024-01-10,0.6,整體而言，市場對嘉澤的消息反應中性，雖然公司展望第四季營運不淡，但持續虧損與營收下滑仍壓抑短期市場信心。,2025-08-04 12:37:53,20
2024-01-16,0.6,半導體雙雄走弱拖累大盤，但嘉澤逆勢上揚力拚重返千元關卡，顯示市場對其基本面仍有信心。,2025-08-04 12:37:54,20
2024-01-17,0.6,"市場擔憂地緣政治緊張局勢與通膨壓力，半導體股漲跌互見，AI族群仍是強勢族群。台股觀察航運、生技、綠能與金融股，以及AI、IC設計與軟體股表現。

====================",2025-08-04 12:37:56,20
2024-01-23,0.7,面板報價止穩與綠能政策概念股強勢表現帶動市場情緒，部分高價股如嘉澤、再次重返千金行列，大立光也漲 2%，站回 2000 元之上。,2025-08-04 12:37:58,20
2024-01-24,0.6,電子權值股表現分歧，中小型股與傳產族群領軍上攻，但整體量能不足且接近前高壓力區，使市場情緒偏向樂觀但謹慎。,2025-08-04 12:37:59,20
2024-01-26,0.7,中小型股表現強勁，00733 成分股調整反映市場焦點，選後行情與基本面支撐正面市場情緒。,2025-08-04 12:38:01,20
2024-01-29,0.7,AI 概念 ETF 搖身一變成為最熱門的概念股，產業龍頭宏碁推出新 AI PC 系列，帶動相關個股漲勢，00733 成分股中清一色為 AI 概念股，未來漲勢值得期待。,2025-08-04 12:38:03,20
2024-02-02,0.7,美股強彈激勵台股，電子權值股與高價股領漲，市場情緒偏正面，但成交量能與個別股表現仍是關鍵。,2025-08-04 12:38:05,20
2024-02-05,0.7,AI 伺服器需求強勁，相關個股漲勢可期，但整體市場仍受宏觀經濟影響，短期內難以維持過高的樂觀情緒。,2025-08-04 12:38:07,20
2024-02-19,0.5,AI 股普遍走弱拖累市場信心，但面板雙虎與 PCB 指標強勢表現提供支撐，整體市場情緒維持中性。,2025-08-04 12:38:08,20
2024-02-22,0.7,輝達財報激勵半導體與 AI 股表現，嘉澤受惠台股上漲與產業前景穩健，市場情緒偏向正面。,2025-08-04 12:38:09,20
2024-02-27,0.7,AI 伺服器需求強勁與業績成長支撐市場信心，但漲幅過大後的技術面修正壓抑短期股價上漲動能。,2025-08-04 12:38:11,20
2024-03-01,0.7,AI 概念股強勢表現與輝達即將召開 GTC 大會帶動相關個股，權值股雖陷入整理但中小型股仍遍地開花，個股多頭輪動格局不變。,2025-08-04 12:38:13,20
2024-03-04,0.9,強勁的美股與費半帶動台積電創高，激勵大盤再寫新猷，電子權值股普遍走揚，族群表現分歧。,2025-08-04 12:38:15,20
2024-03-06,0.9,AI 伺服器需求強勁、Intel 新平台推出及營收成長動能皆顯示嘉澤基本面強勁，激勵市場情緒樂觀。,2025-08-04 12:38:17,20
2024-03-13,0.7,美股反彈激勵科技股上漲，但市場關注台積電法說會釋出的展望與財報表現。重電族群受惠政策利多，強勢領漲。金融股也有所表現。高價股普遍走弱，只有少數個股維持反彈態勢。,2025-08-04 12:38:40,20
2024-03-15,0.7,市場信心受通膨數據與降息預期影響而下滑，個股表現分歧，電子權值股走弱但鴻海集團強勢反彈。,2025-08-04 12:38:42,20
2024-03-20,0.6,市場情緒偏中性，短期內受到輝達 GTC 大會、ETF 掛牌行情與三月底法人作帳/結帳等因素影響，股價波動加劇。整體而言，AI 概念股、半導體設備廠與部分電子零組件股表現強勁，但 IP 股與中小型 IC 設計股仍面臨較大賣壓，市場觀望氣氛濃厚。,2025-08-04 12:38:45,20
2024-03-25,0.6,市場情緒中性，盤面上電子權值股走弱但高價股與重電族群表現強勁，傳產貨櫃三雄也連袂走揚。第二季軍工題材有望成為 520 行情的黑馬，但整體而言消息面影響有限，市場仍需觀察後續發展。,2025-08-04 12:39:08,20
2024-03-27,0.7,多空交戰激烈，指標股輪動快速，市場情緒偏正面但短線漲多震盪加劇。,2025-08-04 12:39:10,20
2024-03-29,0.6,"市場觀望氣氛濃厚，多數維持漲勢，但電子族群以內資作帳為主，個股表現較強。

====================",2025-08-04 12:39:12,20
2024-04-02,0.9,AI 概念股領軍衝鋒，加上市場傳出巴菲特回補台積電持股，激勵大盤再創新高，電子與半導體族群表現強勢。,2025-08-04 12:39:34,20
2024-04-03,0.5,市場對聯準會可能長時間保持高利率的擔憂，以及加權指數開低走低，終場下跌 128.97 點，收在 20337.6 點，但仍力守在 5 日均線上，投信連續 24 天買超，累計 2313.17 億元，未來 ETF 將挹注台股資金活水，多頭格局不變。,2025-08-04 12:39:37,20
2024-04-08,0.7,AI 伺服器需求強勁帶動相關個股走揚，惟整體市場情緒仍受總體經濟與地緣政治因素影響而維持中性。,2025-08-04 12:39:39,20
2024-04-09,0.7,台積電領軍衝高帶動大盤創高，電子股漲跌互見，傳產與金融族群普遍走揚，嘉澤強勢表現引人注目。,2025-08-04 12:39:40,20
2024-04-10,0.6,市場情緒受美股四大指數上漲與台積電 ADR 上漲 1.87% 影響，激勵科技類股反彈，但 AI 族群買盤力道放緩，整體市場呈現震盪走高態勢。,2025-08-04 12:39:42,20
2024-04-11,0.3,台股早盤跌逾百點，電子權值股普遍疲軟，僅少數個股撐場，但高價IC設計股與重電族群表現亮眼。整體而言市場情緒偏空，投資人觀望美股反彈力道。,2025-08-04 12:39:44,20
2024-04-12,0.7,美股反彈激勵台股，AI、半導體等電子族群領漲，但利率上升壓力仍在，個別股票表現分歧。,2025-08-04 12:39:45,20
2024-04-18,0.6,電子權值股普遍走弱拖累大盤，但高價股與重電族群撐盤，整體市場情緒偏向中性。,2025-08-04 12:39:47,20
2024-04-19,0.2,"大盤重挫拖累個股表現，雖有部分抗跌股但整體市場情緒偏空。

====================

以下是提供的新聞資訊 :

嘉澤 (3533-TW) 今 (19) 日召開法說會，董事長劉德光表示，目前訂單能見度看到第四季，預期下半年營運優於上半年，但全年仍將呈現衰退。展望明年，劉德光認為，若庫存去化順利、需求回溫，有機會恢復成長。嘉澤第三季稅後純益 2.3 億元，季減 45%，年減 56%，每股純益 4.16 元；前三季稅後純益 8.5 億元，年減 35%，每股純益 15.7 元。嘉澤第三季營收 61.3 億元，季增 2%，毛利率 18.6%，季減 1.4 個百分點，營益率 9.8%，季減 0.5 個百分點；稅後純益 2.3 億元，季減 45%，年減 56%，每股純益 4.16 元。嘉澤前三季累計營收 178.6 億元，年減 10%，毛利率 18.9%，年減 1.5 個百分點，營益率 10.2%，年減 0.7 個百分點；稅後純益 8.5 億元，年減 35%，每股純益 15.7 元。嘉澤表示，目前伺服器市場需求仍然疲弱，但資料中心、人工智慧等新興應用帶動的換機潮有望在明年上半年啟動，預期下半年營運將優於上半年。

範例輸出4:
0.3
法說釋出保守展望與衰退警訊，加上大盤疲弱拖累個股表現，市場情緒偏空。",2025-08-04 12:39:53,20
2024-04-21,0.6,"換股潮帶動 ETF 表現，產業分散配置降低單一產業風險，但整體市場回檔影響短期漲勢。

====================

以下是提供的新聞資訊 :

嘉澤 (3533-TW) 今 (1) 日召開法說會，總經理賴志賢表示，目前訂單能見度看到第四季，預期下半年營運優於上半年，明年在 AI 伺服器需求強勁帶動下，營收成長可望超過雙位數。 賴志賢指出，嘉澤今年前三季營收表現符合預期，但獲利受到匯率影響而略低於預期，主要是美元兌台幣貶值幅度大於歐元、人民幣等其他貨幣，導致匯損較多。展望第四季，賴志賢表示，目前訂單能見度看到第四季，預期下半年營運優於上半年，全年營收成長目標仍維持在雙位數百分比。 賴志賢強調，嘉澤在 AI 伺服器領域已取得領先地位，目前市占率約 50%，隨著 AI 伺服器需求強勁，預期明年營收成長可望超過雙位數百分比。 賴志賢指出，嘉澤在 AI 伺服器的 C2C 連接器已取得領先地位，市占率約 50%，而 C2C 連接器是 AI 伺服器主板上最重要的零組件之一，隨著 AI 伺服器需求強勁，嘉澤在明年營收成長可望超過雙位數百分比。 賴志賢表示，目前嘉澤在手訂單能見度看到第四季，預期下半年營運優於上半年，全年營收成長目標仍維持在雙位數百分比。

範例輸出4:
0.7
AI 伺服器需求強勁帶動明年營收成長，訂單能見度延伸至第四季，激勵正面市場情緒。",2025-08-04 12:40:00,20
2024-04-22,0.3,電子股走弱與 AI 股下跌壓抑市場信心，雖有部分傳產族群支撐但整體情緒偏向保守。,2025-08-04 12:40:01,20
2024-04-23,0.3,蘋果供應鏈名單變動影響公司股價，匯率與台股走勢波動使市場情緒偏空。,2025-08-04 12:40:03,20
2024-04-24,0.7,AI 族群強彈帶動台股反彈，搭配美股科技股回神與通膨降溫激勵，市場情緒轉趨正面。,2025-08-04 12:40:04,20
2024-04-25,0.6,"蘋果供應鏈名單變動反映產業競爭態勢，新入列廠商展望正向，但剔除的舊廠商可能面臨轉型壓力。整體而言，名單調整有利於優質台廠持續受惠蘋概訂單。

====================",2025-08-04 12:40:06,20
2024-04-26,0.7,電子股強勁反彈帶動大盤上揚，半導體與高價股領漲，航運與散熱族群也同步走揚。,2025-08-04 12:40:07,20
2024-05-07,0.6,台積電與鴻海領軍帶動電子權值股上漲，但嘉澤等部分高價 IC 指標及重電族群走弱，整體市場情緒偏向正面但仍有不確定因素。,2025-08-04 12:40:09,20
2024-05-08,0.6,4月營收成長動能強勁，顯示公司業績表現亮眼，但股價漲幅落後於營收增速，市場情緒偏向中性。,2025-08-04 12:40:11,20
2024-05-13,0.7,基本面強勁且獲利預期上修，激勵市場情緒正向，但股價已大幅反彈，短線漲多後可能出現震盪整理。,2025-08-04 12:40:13,20
2024-05-15,0.6,台股創高帶動市場樂觀情緒，惟個股漲跌互見，整體影響有限。,2025-08-04 12:40:14,20
2024-05-21,0.7,電子權值股普遍走揚，尤其是半導體族群表現強勁，帶動市場情緒偏正面，但傳產類股如貨櫃三雄、重電股等仍疲弱，整體漲跌互見。,2025-08-04 12:40:16,20
2024-05-22,0.7,業績成長與轉型效益顯現，搭配低本益比優勢，有利支撐市場情緒，但漲幅空間仍需觀察。,2025-08-04 12:40:17,20
2024-05-27,0.3,電子族群表現分歧，AI 概念股強勢，但嘉澤 等個股走弱拖累整體市場情緒。,2025-08-04 12:40:19,20
2024-05-30,0.5,權值股走勢疲弱拖累大盤，高價股普遍下跌，但部分中小型股如神盾集團維持強勁漲勢，使市場情緒維持中性。,2025-08-04 12:40:20,20
2024-05-31,0.7,AI PC 潛力股受惠產業成長趨勢，搭配低基期題材有望吸引市場關注與資金挹注。,2025-08-04 12:40:22,20
2024-06-04,0.7,台積電召開股東會及輝達供應鏈強勢表態提振市場信心，但大盤漲多拉回，個股走勢分歧，嘉澤等少數個股逆勢上揚。,2025-08-04 12:40:23,20
2024-06-05,0.7,新產品推出與策略合作夥伴助攻下半年成長，市場對公司前景樂觀看待。,2025-08-04 12:40:24,20
2024-06-06,0.7,台積電領軍衝高帶動加權指數創新高，但中小型股表現疲弱，市場情緒偏向正面但仍有部分個股走勢疲軟。,2025-08-04 12:40:26,20
2024-06-07,0.7,營收成長顯示市場需求強勁，雖短期股價無明顯表現但整體市場情緒正面。,2025-08-04 12:40:27,20
2024-06-13,0.7,展望今年營運成長、需求提升與 AI 伺服器成長潛力帶動市場信心，股價有機會上漲。,2025-08-04 12:40:28,20
2024-06-14,0.9,"多位分析師上修嘉澤獲利預估，市場對其營運前景樂觀，帶動股價強勁上漲。

====================

以下是提供的新聞資訊 :

根據FactSet最新調查，共14位分析師，對嘉澤(3533-TW)做出2024年EPS預估：中位數由72.2元上修至72.65元，其中最高估值78.76元，最低估值68.74元，預估目標價為1797.5元。 市場預估EPS 預估值 2024年(前值) 2025年 2026年 最高值 78.76(76.51) 100.01 118.64 最低值 68.74(68.74) 75.25 89.65 平均值 72.94(72.41) 87.55 104.24 中位數 72.65(72.2) 87.46 101.14 市場預估營收 預估值 (單位：新台幣千元) 2024年 2025年 2026年 最高值 30,442,000 37,992,000 45,770,000 最低值 28,125,000 31,920,000 34,828,000 平均值 29,197,310 34,913,760 40,273,360 中位數 28,965,000 34,713,000 41,712,000 歷史獲利表現 項目 2023年 2022年 2021年 2020年 EPS 50.65 58.7 33.32 26.41 營業收入 (單位：新台幣千元) 24,483,463 27,099,134 21,391,917 17,291,332 詳細資訊請看台股內頁： 最新相關新聞 嘉澤看好新品滲透率攀升 董座：今年營運優於去年 營收速報 - 嘉澤(3533)5月營收25.56億元年增率高達35.66％ 〈COMPUTEX〉晟銘電主力新產品Q4量產出貨 樂觀看後市 不是鴻海、不是廣達 「AI PC」更勝AI 伺服器！AI PC股價爆發最猛的是「它」！ AI PC股價爆發最猛的是「它」！ 〈台股開盤〉開低後挫近250點 權值、高價股腳軟 芯鼎飆第4根漲停 資料來源：Factset，數據僅供參考，不作為投資建議。

---

台股今 (14) 日走勢續強，再度攻上 22440 點歷史新高，高價股成為多方焦點，包括大立光 (3008-TW)、嘉澤 (3533-TW) 等都大漲超過半根，穎崴 (6515-TW) 盤中最高達 1065 元，成為新千金，為台股第 17 千金。 台股 17 千金依價格排序為信驊 (5274-TW)、緯穎 (6669-TW)、力旺 (3529-TW)、世芯 - KY(3661-TW)、大立光、祥碩 (5269-TW)、旭隼 (6409-TW)、嘉澤 (3533-TW)、創意 (3443-TW)、聯發科 (2454-TW)、弘塑 (3131-TW)、川湖 (2059-TW)、M31(6643-TW)、鈊象 (3293-TW)、健策 (3653-TW)、亞德克 - KY(1590-TW) 以及今日剛上榜的穎崴。 穎崴為測試座大廠，手中握有兩大 GPU 客戶，隨著客戶積極投入先進封裝，將帶動高頻、高速等測試需求增長，尤其客戶皆積極在今年推出新品，可望推升下半年營運。 穎崴目前已布局相關產品，包括 SerDes PAM4 224 Gbps 高頻高速同軸測試座 (Coaxial Socket)、全球首創的晶圓級光學 CPO 封裝 (Wafer Level Chip Scale CPO Package) 測試系統、2000 W 超高功率散熱方案 HEATCon Titan 溫控系統等。",2025-08-04 12:40:43,20
2024-06-17,0.7,市場情緒受惠於美股創高與經濟數據轉佳，搭配台積電領漲帶動指數再創新高，激勵正面看法。,2025-08-04 12:40:44,20
2024-06-19,0.7,新增散熱三雄與航空雙雄等個股納入兩檔ETF成分股，顯示市場對相關產業前景樂觀，激勵正面投資情緒。,2025-08-04 12:40:46,20
2024-06-21,0.2,電子權值股普遍下跌拖累大盤，加上高價股與部分個股修正，整體市場情緒偏向保守。,2025-08-04 12:40:47,20
2024-06-24,0.3,"電子權值股普遍走弱，加上獲利了結賣壓，拖累整體市場情緒偏空，短期內難以出現明顯反彈。

====================

以下是提供的新聞資訊 :

美股周五適逢三巫日，三大指數齊跌，台股今 (24) 日早盤開低後，電子權值股幾乎回檔修正，影響一路下挫至最低 22960 點，失守兩萬三大關，預估今日成交量 4800 億元，較上周五略縮。 權值股普遍走弱，台積電 (2330-TW)(TSM-US) 小跌 1%，摜破五日線，鴻海下挫 2%，聯發科重挫 4%，回測十日線支撐，其他如廣達 (2382-TW)、台達電 (2308-TW) 都有 2% 以上的跌幅，其他金控股也都弱勢，壓抑整體大盤走勢。 高價股也成提款區，信驊 (5274-TW)、緯穎 (6669-TW) 跌幅都在 2% 以上，世芯 - KY(3661-TW)、力旺 (3529-TW)、祥碩 (5269-TW)、旭隼 (6409-TW)、嘉澤 (3533-TW) 都有 1-3% 不等跌幅，獲利了結賣壓沉重。 市場焦點方面，隨著輝達 (NVDA-US)B 系列晶片測試難度大幅升高，有助相關供應鏈營運，京元電 (2449-TW) 今日大漲超過半根，往前高靠攏，雍智科 (6683-TW) 也有不錯漲幅。

---

台股今 (24) 日在台積電領跌、半導體、AI 等電子股修正下，大跌 439.69 點或 1.9%，為逾 2 個月來單日最大跌點，收 22813.7 點，摜破 5 日線，成交量 4993 億元；櫃買指數同樣走弱，下跌 3.2 點或 1.2%，收 267.56 點。不過，金融指數則在中場由黑翻紅，不但守穩 200 點，更在尾盤拉高，指數收在 2030.54 點，漲幅 0.38%。 台積電今日下跌 30 元或 3.1%，收 940 元，鴻海下跌 2.8%、聯發科跌 5.8%，族群來看，AI 相關的廣達、緯穎等也跌約半根停板，智邦、緯創、奇鋐等也跌 2-3%，通路指標聯強重挫 8.6%。 IC 設計族群也成重災區，祥碩挫逾 6%、瑞昱及達發、創意等都跌 5%、采鈺跌 4%、世芯 - KY 跌近 3%；其他像是嘉澤跌 5%、南亞科跌 4.3%、力積電、友達、南電、華邦電、宏碁等跌逾 2%。 傳產股方面，重電族群中，華城跌近半根、士電也跌近 4%、東元也修正；貨櫃三雄走弱，萬海跌 3.8%、陽明及長榮同步走弱；不過，紡織股王儒鴻今日逆勢上漲 1.9%，成為較強勢的傳產指標。 金融股中，除了新產大漲 7.69% 外，高雄銀、統一證、臺企銀、中信金、元大金漲幅也都在 1% 以上。",2025-08-04 12:40:59,20
2024-07-01,0.2,電子權值股撐盤但高價股與部分族群疲弱，整體市場情緒偏向保守。,2025-08-04 12:41:00,20
2024-07-05,0.7,電子權值股普遍走跌拖累大盤，但嘉澤等個股強勢上揚，整體市場情緒偏正面。,2025-08-04 12:41:22,20
2024-07-06,0.7,配息金額大增與規模激增顯示市場反應正面，但溢價過高及暫停申購風險提醒使情緒稍有壓抑。,2025-08-04 12:41:24,20
2024-07-08,0.7,市場情緒受大盤創高與權值股助漲激勵，中小型股表現亮眼，但仍需留意個別公司基本面變化。,2025-08-04 12:41:26,20
2024-07-11,0.7,新品出貨帶動下半年成長與液冷機櫃合作夥伴擴大有利於未來營運表現，激勵正面市場情緒。,2025-08-04 12:41:27,20
2024-07-12,0.7,電子權值股下跌拖累大盤，但嘉澤逆勢上漲，傳產族群如台塑四寶也有所表現，顯示市場信心尚未完全喪失。,2025-08-04 12:41:29,20
2024-07-17,0.3,美前總統質疑美國保衛台灣及晶片生意議題引發市場擔憂，拖累台積電與電子權值股走跌，壓抑整體市場情緒。,2025-08-04 12:41:30,20
2024-07-18,0.2,川普「保護費論」引發地緣政治風險疑慮，衝擊台積電及相關半導體股表現，市場情緒轉趨悲觀。,2025-08-04 12:41:32,20
2024-07-23,0.6,"市場情緒回溫，多頭反攻，權值股領漲，加上重電與營建族群助攻，推升指數大幅彈升。

====================

以下是提供的新聞資訊 :

美股昨 (22) 日回神，加上台積電開盤即大漲 25 元，聯發科、鴻海也紛紛開紅盤，帶動台股指數今 (23) 日早盤反彈超過 500 點，最高漲至 22762.56 點，預估成交量 4200 億元。除電子權值股回神，重電、營建族群今天也都走強。 權值股今天群起反彈，台積電 (2330-TW) 開盤大漲 25 元，最高漲至 970 元，漲幅約 3%，鴻海 (2317-TW) 大漲逾 3%，再度站回 200 大關，聯發科 (2454-TW) 也漲逾 2%。日月光 (3711-TW) 漲逾 3%，台達電 (2308-TW) 則漲逾 2%。 重電族群今天走強，華城 (1519-TW) 大漲逾半根停板，大同 (2371-TW) 漲逾 2%，士電 (1503-TW) 及東元 (1504-TW) 漲逾 1%，亞力 (1514-TW) 與中興電 (1513-TW) 也都有所表態。 營建族群今天也紅通通，紛紛強勢表態，京城 (2524-TW)、欣巴巴 (9906-TW)、國產 (2504-TW)、隆大 (5519-TW) 及上曜 (1316-TW) 漲逾半根停板，櫻花建 (2539-TW)、日勝生 (2547-TW)、三地開發 (1438-TW) 以及寶徠 (1805-TW) 也都有超過 4% 的漲幅。 個股方面，昇鈦 (3229-TW)、聯策 (6658-TW)、佳和(1449-TW) 以及光麗 - KY(6431-TW) 亮燈漲停，一詮 (2486-TW)、海悅(2348-TW)、大量(3167-TW)、新日興(3376-TW)、嘉澤(3533-TW) 及智原 (3035-TW) 也都漲逾半根停板。 美股四大指數全面收漲， 道瓊指數 上漲 127.91 點，或 0.32%，收 40415.44 點。 那斯達克 指數上漲 280.63 點，或 1.58%，收 18007.57 點。 S&P 500 指數上漲 59.41 點，或 1.08%，收 5564.41 點。 費城半導體 指數上漲 210.67 點，或 4.00%，收 5477.83 點。

---

台股今 (23) 日隨美科技股展開反彈，在台積電尾盤大單拉抬下，大漲 614.85 點或 2.76%，收在今日最高 22871.84 點，創收盤第二大漲點，並將昨日跌點 612.12 點失土全數收復，成交金額 3939 億元。 台股今年在 2/15 和 4/24 的漲點分別達 548 和 532 點，漲點擠上史上前十大排名，今天漲點 614.85 點，僅次於 2021 年 5/18 締造的 792.02 點史上最大漲點紀錄。 台積電今日最後一盤在 6369 張大單敲進下，漲幅擴大至 4.26%，上漲 40 元收 979 元，也帶動指數最後一盤拉抬近 80 點；鴻海則漲 4.68%，收 201.5 元，重返「郭董退休價」200 元之上，聯發科、台達電等也漲逾 4%。 另外，廣達漲 3%、聯電漲 2%、奇鋐、台光電等漲逾 5%、健鼎漲 3%；電子千金股也漲多跌少，嘉澤、健策漲 6%、旭隼也漲逾半根停板，川湖漲 4%、世芯 - KY 漲 2%，大立光、緯穎均收紅，但祥碩、創意收黑。 傳產方面，重電族群強勢反彈，華城大漲 8% 重返 900 元之上，士電、大同也有約 4% 的漲幅，中興電漲 3%；航運族群走揚，航空雙雄華航、長榮航，以及貨櫃三雄萬海、陽明、長榮均有 3-4% 漲幅；另外，潤泰新大漲近 7%。 不過，電視面板需求明顯放緩，跌勢擴及大尺寸產品，面板雙虎今日雙雙走弱，群創跌 2.9%、友達也跌 2.7%，其餘如南亞科跌 2%，力成、研華、宏碁，台塑及台塑化等收黑，都是今日盤面上較弱勢大型股。",2025-08-04 12:41:49,20
2024-07-26,0.3,籌碼面與基本面訊息紛雜，股價波動加劇，但整體市場情緒偏向中性。,2025-08-04 12:41:50,20
2024-07-27,0.7,液冷散熱商機帶動相關廠商成長，嘉澤等台廠受惠轉單與擴展產品線，有望進一步提升毛利率。,2025-08-04 12:41:52,20
2024-07-31,0.5,電子權值股走勢分歧，台積電領跌但鴻海、台達電等個別表現強勁，整體市場情緒中性。,2025-08-04 12:41:54,20
2024-08-10,0.7,獲利與營收預估持續成長，分析師調升目標價帶動正面市場情緒。,2025-08-04 12:41:55,20
2024-08-12,0.7,獲利預估上修與市場情緒回溫推升股價表現，但技術面仍有壓力待克服。,2025-08-04 12:41:56,20
