date,factor,explanation,updated_time,news_count
2022-11-01,0.7,半導體雙雄領漲，IC設計族群強勢表現，加上伺服器概念股走揚，激勵市場情緒向上，但匯率與國際盤勢仍是觀察重點。,2025-08-04 12:33:01,20
2022-11-03,0.6,市場情緒偏中性，雖然利空消息影響盤勢，但伺服器族群表現強勁，顯示部分類股仍有買盤支撐。,2025-08-04 12:33:24,20
2022-11-05,0.7,歐盟統一充電介面法案帶動 USB Type-C 概念股漲勢，嘉澤等相關公司受惠。,2025-08-04 12:33:25,20
2022-11-09,0.7,營收報喜與利空出盡帶動市場信心，搭配通膨降溫預期及聯準會放緩升息步調，激勵盤面資金回歸電子族群。,2025-08-04 12:33:27,20
2022-11-15,0.7,半導體族群領漲帶動指數上揚，股神增持台積電激勵市場信心，但中小型個股表現分歧。,2025-08-04 12:33:29,20
2022-11-16,0.6,電子股普遍走揚，尤其是台積電領軍上攻，加上傳產與生技族群支撐，整體市場情緒偏正面。,2025-08-04 12:33:31,20
2022-11-17,0.6,光學族群強勢表現與生技股轉強帶動市場信心，但指標個股走弱壓抑漲幅，整體市場情緒偏正面但仍有回檔疑慮。,2025-08-04 12:33:32,20
2022-11-21,0.6,市場觀望氣氛濃厚，個股表現分歧，雖有台積電創辦人釋出正面訊息，但整體盤勢仍維持區間震盪走勢。,2025-08-04 12:33:34,20
2022-11-22,0.6,"市場情緒偏向中性，雖然台積電帶動指數上漲，但電子股追價意願下降，轉往生技與伺服器相關產業。記憶體供應鏈有望提前落底，成為震盪時的焦點。

====================

以下是提供的新聞資訊 :

一、 護國神山走強，指數再戰半年線 護國神山走強，指數挑戰半年線 國際股市普遍回落，令台股早盤一度開低，但在 (2330-TW) 台積電開低走高的帶動下，指數不但扭轉跌勢甚至由黑翻紅來到本日相對高點，當前上漲 85 點，預估量為 1993 億，量能相較於昨日稍有放大。 盤面上來看，當前貢獻漲點多方指標依序為 (2330-TW) 台積電、(1303-TW)南亞、(6505-TW)台塑化、(2303-TW)聯電、(2883-TW)開發金，造成盤勢壓抑則為 (2454-TW) 聯發科、(2301-TW)光寶科、(1216-TW)統一、(2412-TW)中華電、(2356-TW)英業達。 同時搭配本日成交值比重來看，前十名依序為 (2330-TW) 台積電、(1795-TW)美時、(3443-TW)創意、(8478-TW)東哥遊艇、(3661-TW)世芯 - KY、(8069-TW)元太、(6550-TW)北極星藥業 - KY、(2454-TW)聯發科、(1605-TW)華新、(1760-TW)寶齡富錦，當中股價上漲的僅有台積電、東哥遊艇及元太，顯示當前市場的走強主要是台積電所帶動，除此以外大都是以個別類股的表現為主。 值得注意的是，日前因晶片禁令影響的矽智財族群如 (3035-TW) 智原、(3443-TW)創意、(3529-TW)力旺、(6643-TW)M31、(6533-TW)晶心科等個股，大多普遍呈現疲弱，或反映出當前市場資金有再度轉移的情形。 二、資金或可能轉趨防禦，選股不選市 資金或可能轉趨防禦，選股不選市 連日來生技族群比重提升與持續走強，顯示當前市場對於大方向已有轉趨觀望的現象，而今天生技族群比重仍高，且前十大成交排行即有 3~4 檔為生技個股，表示當前市場對於電子追價意願有所下降，轉往升技族群，但觀察相關主要個股的股價走勢，在本日也有開高走低現象，是短線的獲利了結或者是資金有再度移轉的跡象，則是有待觀察的方向。 觀察本日盤面，相較強勢個股仍是以具營運動能或市場認為有望提前落底的產業，比如說伺服器相關的 (3037-TW) 欣興、(3189-TW)景碩、(8046-TW)南電、(6669-TW)緯穎、(3653-TW)健策、(3533-TW)嘉澤、(6213-TW)聯茂、(2383-TW)台光電、(6274-TW)台燿、(8358-TW)金居。 有望提前落底的個股當前市場則認為或可能是記憶體相關產業，而這原因主要是記憶體市況疲軟已久，在景氣未明下相關供應商紛紛減產因應，縱使日前三星並未明確表態是否減產，但其餘廠商如南亞科、鎧俠、美光、海力士等在 DRAM 市佔約莫 67%，對市場供需結構的改善也仍有相當影響力，而在美光再度重申減產 20% 後，市場開始預期記憶體產業有機會早於明年第二季前落底，因此相關供應鏈如 (6531-TW) 愛普 *、(8299-TW)群聯、(5351-TW)鈺創、(2408-TW)南亞科、(2344-TW)華邦電、(2337-TW)旺宏、(3260-TW)威剛等個股，就可能再度成為大市震盪時，資金關注的焦點。 當沖教學延伸閱讀： 1. 股價搭配「1 指標」提高當沖勝率： 2. 新手必學閃電下單術： 3. 隔日沖操作條件與交易風險大公開： 本公司所推薦分析之個別有價證券 無不當之財務利益關係 以往之績效不保證未來獲利 投資人應獨立判斷 審慎評估並自負投資風險",2025-08-04 12:33:50,20
2022-11-24,0.7,市場買盤回籠，聯發科領軍 IC 設計股放量大漲，加上航運股助攻，激勵台股走揚，權王台積電、電子股與高價股表現強勁。,2025-08-04 12:33:52,20
2022-11-25,0.3,高價股與權值股同步走弱拖累大盤，市場信心受挫，個別族群表現分歧。,2025-08-04 12:33:53,20
2022-11-28,0.6,整體市場情緒偏正面，預期指數在半年線附近整理後將再上攻，搭配選舉前後的資金行情與法人作帳，明年第一季有望延續多頭走勢。,2025-08-04 12:33:55,20
2022-12-06,0.2,"電子權值股與高價股普遍走弱拖累市場信心，加上台積電美國廠典禮利多出盡，整體市場情緒偏空。

====================

以下是提供的新聞資訊 :

美股四大指數周一收黑，台股今 (6) 日開低下挫，台積電等電子權值股同步熄火，指數一路走低，最低探至 14846 點，下挫 134 點，跌破五日線，預估今日成交量 2300 億元，較昨日略為縮減。 權值股走勢普遍偏弱，台積電下挫近 1%，回測月線，鴻海、聯發科下挫皆超過 1%，台塑四寶、金控雙雄也修正，其餘如聯電、日月光投控、中鋼等都在盤下游走，壓抑大盤走勢。 高價股也難逃賣壓，股后信驊下挫超過 3%，回補前方跳空上漲缺口，旭隼更重挫近半根，跌破五日線，其他如力旺、亞德克 - KY、緯穎、嘉澤、譜瑞 - KY、AES-KY、祥碩全面下跌，矽力 *-KY 跌幅更高達 9%。 今日盤面焦點為生技股，包括基亞、達爾膚、羅麗芬 - KY 皆亮燈漲停，和康生、大江、逸達也飆漲超過半根，指標股寶齡富錦成交值更衝上台股第二名，僅次於台積電，至於合一、保瑞則因漲多拉回，保瑞更殺至跌停板。

---

台股今 (6) 日隨美股收黑走跌，午盤過後受新台幣貶值，加上台積電 (2330-TW)(TSM-US) 等電子權值股熄火拖累下，指數跌幅擴大，大跌超過 200 點，終場下跌 251.86 點，收在今日最低 14728.88 點，失守 5 日線、10 日線，成交量則達 2441.79 億元。 電子權值股普遍走疲，晶圓雙雄台積電終場大跌 11 元，收在 478 元、跌幅超過 2%，回測月線，聯電也重挫近 2%，鴻海、聯發科跌幅也在 2% 上下，其他包含日月光投控、台塑四寶、中鋼等也全數被壓在盤下，金控族群也弱勢，國泰金重挫接近 3%，富邦金、開發金、新光金跌幅也超過 1%。 高價股賣壓同樣沉重，除股王大立光力守平盤，信驊、旭準重挫逾 3%，力旺、亞德客 - KY、世芯 - KY、緯穎、嘉澤、譜瑞 - KY、AES-KY、祥碩等也一片綠油油，矽力 *-KY 更被摜殺到跌停價位。 盤面焦點，台積電美國亞利桑那州廠將在當地時間 6 日舉行首批機台設備到廠 (First tool-in) 典禮，市場看好相關供應鏈前景，相關個股今日股價也逆勢抗跌，閎康大漲超過半根停板，宜特、上品、M31、創意、崇越、中砂等表現也不俗。 遊戲概念股今日表現也強勢，華義、辣椒雙雙亮燈攻上漲停，激勵網龍同步大漲超過 6%，其他包含昱泉、廣錠、宇峻、鈊象、橘子漲幅也都在 1% 之上。 生技股中，羅麗芬 - KY 也不畏大盤開低，強鎖漲停價位，和康生、麗豐等也獲買盤追捧。",2025-08-04 12:34:08,20
2022-12-07,0.3,市場信心受美股拖累，權值股表現分歧，加上 FOMC 會議在即，投資人觀望氣氛濃厚。,2025-08-04 12:34:09,20
2022-12-08,0.6,市場風險意識升溫，指數跌破月線支撐，但部分個股如伺服器供應鏈與 IC 設計仍獲得買盤青睞，顯示內資對盤面仍然相對積極。,2025-08-04 12:34:11,20
2022-12-09,0.7,電子股反彈帶動加權指數收復月線，半導體三雄領漲，太陽能族群強勢表現，營收創高個股買盤青睞。,2025-08-04 12:34:13,20
2022-12-13,0.3,市場觀望 CPI 數據及獲利了結賣壓影響大盤走低，權值股與高價股同步下挫，僅生技醫療股表現強勁。,2025-08-04 12:34:14,20
2022-12-14,0.9,美國通膨緩解激勵美股走揚，帶動台股大漲逾 200 點，電子權值股領軍，高價股與矽智財概念股強勢上攻，加上塑化、汽車等傳產股助陣，三大法人同步買超。,2025-08-04 12:34:16,20
2022-12-19,0.7,"伺服器需求前景穩健，新平台滲透率提升，有助嘉澤等連接器、機殼供應鏈營運成長。

====================

以下是提供的新聞資訊 :

新冠疫情肆虐了全球三年了，不僅改變了世界運作方式，也讓人們的工作、生活、消費、學習等發生了不小變化，遠距工作變成常態，也更習慣在網路購物，訂餐等，所有的行業也陸續朝數位轉型，且薪資高漲與缺工的壓力，更讓自動化迎來一波加速成長趨勢。 然而要達成數位轉型趨勢，必須要有基礎建設來配合，故伺服器與網路通訊的建置就不容小覷。雖然 TrendForce 研究表示，2023 年伺服器整機出貨年增率將再下修至 2.8%，主要是經濟不佳削弱企業資本支出，及疫情漸退，包括 Meta、Google、ByteDance (TikTok) 均下修明年伺服器的採購動能等，不過在成長趨勢仍不變下，研判 2023 年仍是值得關注的產業。 嘉澤股價創高，嘉基補漲 超微 Genoa 及英特爾 Eagle Stream 已分別在 11 月及 12 月啟動拉貨，在兩大 CPU 伺服器新平台的拉貨下，明年伺服器持續成長可期，相關供應鏈將看俏。包括組裝、插槽、連接器、高速傳輸晶片、遠端管理晶片、電源管理 IC、電池、交換器、滑軌、機殼、PCB 相關、散熱模組等，其中連接器的嘉澤 (3533-TW)、嘉基 (6715-TW)；機殼的營邦 (3693-TW) 等近期股價均紛紛大漲。 嘉澤股價更是創下歷史新高，也帶動同集團的嘉基股價反攻，嘉澤受惠於 PCIe Gen 5 伺服器新平台逐漸發揮效益，及美系伺服器需求有撐，11 月營收 24.1 億，月增 1.46%、年增 17.6%，維持在相對高檔，由於 1 月為農曆年，客戶將提前拉貨，預期 12 月營收有望進一步成長。嘉澤前 3 季 EPS45.17 元，全年上看 60 元以上，展望 2023 年，在新平台滲透率提升，伺服器占比持續成長，及新 CPU 規格升級、socket 的 pin 腳數增加下，將可樂觀看待營收與獲利進一步成長。至於嘉基前 3 季 EPS7.4 元，有機會賺 1 個股本，股價有機會挑戰第三季高點。 緯穎、廣達股價委屈 伺服器組裝廠方面，包括緯創 (3231-TW)、英業達 (2356-TW) 股價紛紛創下波段高，且站上所有均線，研判前 3 季分別賺 58.48 元、7.32 元及 5.18 元的緯穎 (6669-TW)、鴻海 (2317-TW)、廣達 (2382-TW) 等股價也將跟進，其中緯穎 11 月營收 334.56 億，月增率 42.56%、年增率 62.8%，創歷史次高，股價也站上所有均線，日 KD 剛交叉向上，月線與年線也開始黃金交叉，10 日線不破可偏多操作。至於廣達客戶涵蓋亞馬遜、微軟、谷歌與 Meta 北美地區雲端四大業者，股價也剛站上季線，只要量能增溫也有反彈契機，至於鴻海因蘋果手機出貨高峰將過，目前恐處於區間整理。 致新打出大頭肩底 在 IC 設計方面包括高速傳輸晶片的譜瑞 - KY(4966-TW)、遠端管理晶片的信驊 (5274-TW)、電源管理 IC 的致新 (8081-TW) 等，其中在利空出盡後呈現反彈格局，不過下半年營收確實已明顯衰退，建議以跌深反彈視之，月線為多空分水嶺。而信驊也開始步入淡季，11 月營收 4.19 億，月減 18.81%，不過股價偏高，研判將先於季線與年線間整理。剛切入伺服器領域的致新，前 3 季 EPS20.69 元，股價已打出大頭肩底，站上中長期均線，配合日 KD 低檔交叉向上，月線不失守有機會挑戰年線反壓。 營邦股價飆漲，勤誠被低估 伺服器機殼的營邦 (3693-TW)，前 3 季 EPS6.75 元，全年 EPS 估 8.1 元。",2025-08-04 12:34:54,20
2022-12-21,0.3,市場情緒偏弱，股價下跌主因為高價股普遍走低與嘉澤下挫 2%，加上台積電等權值股表現平平。,2025-08-04 12:34:56,20
2022-12-28,0.3,電子權值股與高價股疲弱拖累大盤，半導體族群賣壓沉重，但觀光類股相對抗跌，市場情緒偏向中性。,2025-08-04 12:34:57,20
2022-12-29,0.7,電子股普遍走跌，僅少數個股上漲，但傳產與生技股有所支撐，整體市場情緒偏向保守。,2025-08-04 12:34:59,20
2022-12-30,0.6,電子權值股與高價股表現穩健，加上解封概念股助攻，激勵盤中指數大漲，但尾盤賣壓湧現使漲點收斂，顯示市場信心仍有疑慮。,2025-08-04 12:35:00,20
2023-01-04,0.6,多空消息交錯，電子族群漲跌互見，光電與再生能源股強勢，但航運股賣壓重，整體市場情緒偏正面但波動加劇。,2025-08-04 12:35:02,20
2023-01-05,0.6,個股漲跌互見，台積電等權值股支撐大盤，但高價股表現分歧，多族群受題材點火但整體量能不足。,2025-08-04 12:35:03,20
2023-01-09,0.7,電子族群強勁反彈，權值股與高價股齊漲，加上市場看好落底跡象，激勵正面市場情緒。,2025-08-04 12:35:05,20
2023-01-12,0.2,"市場觀望氣氛濃厚，加權指數下跌，電子與傳產股漲跌互見，鋼鐵族群表現相對強勢，但嘉澤受大盤影響而下挫。

====================

以下是提供的新聞資訊 :

台積電 (2330) 今 (12) 日召開法說會，總裁 C.C. Wei 表示，全球經濟成長放緩、終端市場需求疲軟，但台積電 2023 年仍將維持成長。展望未來，C.C. Wei 指出，半導體產業雖面臨一些短期波動，但長期成長趨勢不變，5G、人工智慧、高效能運算等應用持續推動半導體需求成長。 C.C. Wei 強調，台積電在先進製程技術領先業界，3 奈米製程已於 2022 年下半年量產，2 奈米製程也將按照計畫於 2025 年量產，預期未來幾年將持續擴大先進製程的產能。 C.C. Wei 也提到，台積電在成熟製程技術方面具有競爭優勢，7 奈米及 16 奈米製程產能利用率維持高檔，預期未來幾年將繼續擴大這些製程的產能。 C.C. Wei 表示，台積電將繼續投資先進製程技術和成熟製程技術，以滿足客戶需求並保持競爭優勢。

---

台積電 (2330) 今 (12) 日召開法說會，由總裁 C.C. Wei 主持。C.C. Wei 表示，全球經濟成長放緩、終端市場需求疲軟，但台積電 2023 年仍將維持成長。展望未來，C.C. Wei 指出，半導體產業雖面臨一些短期波動，但長期成長趨勢不變，5G、人工智慧、高效能運算等應用持續推動半導體需求成長。

C.C. Wei 強調，台積電在先進製程技術領先業界，3 奈米製程已於 2022 年下半年量產，2 奈米製程也將按照計畫於 2025 年量產，預期未來幾年將持續擴大先進製程的產能。C.C. Wei 也提到，台積電在成熟製程技術方面具有競爭優勢，7 奈米及 16 奈米製程產能利用率維持高檔，預期未來幾年將繼續擴大這些製程的產能。

C.C. Wei 表示，台積電將繼續投資先進製程技術和成熟製程技術，以滿足客戶需求並保持競爭優勢。",2025-08-04 12:35:13,20
2023-01-16,0.6,電子股普遍上漲帶動大盤走揚，但個別股票表現分歧，嘉澤下跌影響市場情緒。,2025-08-04 12:35:15,20
2023-01-31,0.3,大盤漲多調節與台積電走弱拖累整體市場信心，但個股表現分歧，部分高價股逆勢上攻。,2025-08-04 12:35:16,20
2023-02-01,0.6,台股上攻站回年線，權值股與高價股齊揚，MCU 類股強勢表現吸引資金進駐，整體市場情緒偏正面。,2025-08-04 12:35:17,20
2023-02-02,0.9,台股在聯準會釋出利多訊息下強勁反彈，半導體與高價股領漲，市場情緒轉趨樂觀。,2025-08-04 12:35:19,20
2023-02-06,0.3,半導體族群普遍下跌拖累市場，但解封概念股與部分電子股撐盤，整體市場情緒偏向保守。,2025-08-04 12:35:41,20
2023-02-09,0.7,電子權值股表現平淡，但嘉澤等指標股強勢上漲，加上工業電腦及軍工概念族群買盤進駐，整體市場情緒偏正面。,2025-08-04 12:35:42,20
2023-02-13,0.3,市場憂心首季財測表現，加上股神巴菲特持股變化疑慮，電子權值股走弱拖累大盤下跌，但低軌衛星與生技族群逆勢抗跌。,2025-08-04 12:35:44,20
2023-02-14,0.7,AI 概念股受惠需求成長與技術進步，相關個股如晶心科、金麗科、創意等有望受惠。,2025-08-04 12:35:45,20
2023-02-20,0.7,AI 概念股受市場熱議，相關個股如其陽、嘉澤等漲幅顯著，但仍需留意基本面與技術面變化。,2025-08-04 12:35:47,20
2023-02-23,0.7,電子族群回神帶動大盤上漲，半導體股領漲下激勵正面市場情緒，但個別強勢指標有限。,2025-08-04 12:35:49,20
2023-03-02,0.6,"市場情緒受通膨疑慮與美債利率走升影響而轉為中性，傳產族群如航運、觀光表現強勁，但電子權值股疲弱，整體漲跌互見。

====================

0.7
台股在傳產族群帶動下翻紅小漲，電子權值股走勢分歧，航運、觀光等族群撐盤，但高價股普遍疲軟，市場情緒維持正面但略顯謹慎。",2025-08-04 12:35:51,20
2023-03-15,0.7,半導體股領軍反彈，權值股普遍走揚，加上貨櫃三雄與生技族群助攻，激勵市場情緒向上。,2025-08-04 12:35:52,20
2023-03-20,0.7,IGBT 缺貨題材帶動相關個股漲勢，嘉澤等連接器產業受惠需求成長，但需留意市場情緒過熱的風險。,2025-08-04 12:35:54,20
2023-03-22,0.6,電子權值股與金融股領軍反彈，市場情緒回溫，但個別股票表現分歧，整體漲幅有限。,2025-08-04 12:35:55,20
2023-03-24,0.7,基本面穩健且產品應用廣泛，增資目的明確有助支撐市場信心，但潛在報酬率有限。,2025-08-04 12:35:57,20
2023-03-27,0.7,電子權值股普遍走跌拖累大盤，但高價股如嘉澤、力旺等逆勢上漲，傳產族群也有部分個股表現強勁，顯示市場信心尚未完全喪失。,2025-08-04 12:35:58,20
2023-03-28,0.6,運動鞋產業成長趨勢穩健，相關概念股具潛力，但個別公司表現差異大，需進一步分析。,2025-08-04 12:36:00,20
2023-03-30,0.7,台股大盤指數上漲帶動個股表現，其中聯發科、聯電等權值股與高價股如嘉澤、創意等走揚，記憶體族群與網通族群也普遍有不錯的漲幅，顯示市場情緒偏向正面。,2025-08-04 12:36:02,20
2023-03-31,0.7,權值股與記憶體族群領軍上攻，加上聯發科、聯電等大型股助陣，激勵市場情緒走揚。,2025-08-04 12:36:03,20
2023-04-06,0.7,汽車市場需求穩健且銷售表現亮眼，帶動相關個股投資情緒正向，但整體影響有限。,2025-08-04 12:36:05,20
2023-04-13,0.2,電子股普遍走弱拖累大盤，加上台積電失守季線，市場信心受挫，整體市場情緒偏向負面。,2025-08-04 12:36:27,20
2023-05-02,0.7,權值股走勢分歧，伺服器概念股與高價股表現強勁，顯示市場對產業前景仍有信心。,2025-08-04 12:36:49,20
2023-05-05,0.7,蘋果供應鏈股價上漲帶動市場情緒，但傳產金融股走弱使整體盤勢維持區間震盪。,2025-08-04 12:36:50,20
2023-05-08,0.7,美股上周五大漲帶動台股走揚，權值股如台積電領漲，加上電子、重電概念股表現強勁，激勵市場情緒。,2025-08-04 12:36:52,20
2023-05-10,0.4,電子股疲弱拖累大盤走低，失守月季線，但部分個股如世芯-KY逆勢上漲，顯示市場仍有波動空間。,2025-08-04 12:36:53,20
2023-05-18,0.7,台積電領軍電子權值股上攻萬六關卡，帶動加權指數強勁反彈，多頭氣勢回籠，嘉澤等高價股與族群股同步走揚。,2025-08-04 12:36:55,20
2023-05-19,0.9,520 行情延續，電子權值股與高價股領軍上攻，加上傳產族群助攻，激勵市場信心，推升股價走揚。,2025-08-04 12:36:56,20
2023-05-23,0.5,個股表現分歧，權值股與高價股普遍上漲，但部分個股仍疲弱，整體市場情緒維持中性。,2025-08-04 12:36:57,20
2023-05-25,0.7,輝達財報優於預期激勵相關概念股走強，嘉澤受惠雲端運算需求穩定，市場情緒正面。,2025-08-04 12:36:59,20
2023-05-30,0.6,市場情緒偏正面，AI 概念股持續輪動，但漲多個股拉回修正壓力增加，加上總體經濟與升息因素影響，整體行情維持中性。,2025-08-04 12:37:01,20
2023-06-06,0.3,在台積電穩盤下，權值股表現分歧，高價股普遍走跌，市場情緒偏向保守。,2025-08-04 12:37:03,20
2023-06-07,0.7,熱錢湧入帶動指數創波段新高，權值股與高價股強勢上揚，觀光類股表現亮眼。,2025-08-04 12:37:04,20
2023-06-08,0.2,獲利了結賣壓出籠，加權指數重挫，權值股與高價股全面下跌，AI 概念股亦遭調節，市場情緒轉趨保守。,2025-08-04 12:37:05,20
2023-06-18,0.7,AI 熱潮持續延燒，輝達與超微積極推出新款 AI 晶片，相關供應鏈受惠，展望樂觀；惟部分個股漲幅已大，短期獲利了結賣壓恐加重。,2025-08-04 12:37:08,20
2023-06-29,0.7,獲利表現亮眼且多家半導體公司上榜顯示產業前景穩健，激勵市場情緒偏正面。,2025-08-04 12:37:10,20
2023-07-30,0.6,市場情緒受內外資動態影響，整體呈現中性偏多，但需留意指數壓力區與法人籌碼變化。,2025-08-04 12:37:11,20
2023-07-31,0.3,投信單月賣超金額最大，顯示市場對公司基本面信心不足，引發中性偏空情緒。,2025-08-04 12:37:12,20
2023-08-01,0.6,營收與獲利表現亮眼但市場信心受創，短期內市場情緒偏向中性。,2025-08-04 12:37:14,20
2023-12-07,0.6,市場情緒受到多空因素影響，整體呈現中性偏正面。權值股表現較弱，但半導體、航太等族群支撐指數；電力類股抗跌，顯示產業前景仍有期待。,2025-08-04 12:37:16,20
2023-12-14,0.9,聯準會放鴿激勵市場情緒，熱錢湧入帶動股匯雙漲，加上權值股領漲與中小型股活躍，推升台股再創波段新高。,2025-08-04 12:37:19,20
2023-12-15,0.7,"聯準會暗示明年可能降息三次，激勵美股創高，台股也同步歡慶，盤面百花齊放，更上演股匯齊漲。法人指出，雖然接近年底外資法人陸續休假，但整體仍往好的方向前進，有望挑戰萬八關卡。

美股四大指數連六漲，拉高結算買盤力抗獲利賣壓。星期四美股由費半指數上漲 2.67% 領漲四大指數，狼速 + 7.32% 與安森美 + 6.35% 領漲半導體股。周四美股漲跌互見且震盪劇烈，能源、工業、原物料、汽車與銀行類股領漲，科技軟體、醫療保健、通訊服務、保險與非必須消費類股跌幅較重。

台指期盤後盤上漲 79 點作收，漲幅 0.45%，台積電 ADR+1.3%。週五大盤指數觀察重點有三: 1. 創高量能與中小型股 2 車用、航運、軍工與綠能股 3. 消費電子、半導體與中小題材股走勢

周五電子股持續輪動創高，美股周四劇烈震盪，周五族群觀察消費電子、半導體與中小型股表現。高價股週五震盪居多，矽智財因晶片巨頭頻發新品稍見賣壓，短線留意 PC 與手機相關股，如大立光與嘉澤等。",2025-08-04 12:37:27,20
2023-12-16,0.7,獲利創高與需求前景穩健顯示公司基本面強勁，激勵正面市場情緒，但漲多後賣壓出籌使短期漲勢趨緩。,2025-08-04 12:37:29,20
2023-12-18,0.7,北韓試射導彈引發亞股震盪，但鋼鐵與貨櫃海運族群強勢表態，搭配總統大選行情，維持正面市場情緒。,2025-08-04 12:37:31,20
2023-12-19,0.4,市場信心受美 Fed 利率決策影響而轉弱，加上電子權值股與高價股走勢疲軟，拖累整體市場情緒，預期嘉澤 股票可能會下跌。,2025-08-04 12:37:33,20
2023-12-20,0.6,市場情緒趨於低落，多空交戰加劇，股價波動加大。,2025-08-04 12:37:34,20
