date,factor,explanation,updated_time,news_count
2022-11-01,0.3,"獲利衰退、營收下滑及庫存調整壓力拖累市場信心，雖有新產能擴建與綠色轉型計畫但短期正面效益有限。

====================",2025-08-04 15:46:29,20
2022-11-02,0.7,電子零件與光電族群強勢反彈，搭配航運股穩盤，加權指數收高，但量能不足恐影響後市漲幅。,2025-08-04 15:46:32,20
2022-11-03,0.6,盤面上中小型股表現強勁，尤其是伺服器、5G 和車用相關的銅箔基板族群，如威盛、嘉聯益和聯茂等個股逆勢大漲。這些股票受惠於科技產業復甦和主流題材需求的支撐，展現出良好的反彈潛力。然而，整體市場仍受到國際情勢影響，指數可能在萬三附近進行區間整理。投資人應密切關注盤面變化，並根據個股基本面做出明智判斷。,2025-08-04 15:46:36,20
2022-11-04,0.6,台股中小型個股漲跌互見，電子股強弱分明，費半指數與美股科技成長股持續疲弱，大型權值電子股與高價股受法人提款，多數表現疲弱。央行行長針對台幣匯率發言，是否有助台幣回升，決定外資賣壓是否收斂，半導體族群仍以台積電為重點觀察，385 元 10 日線反壓須能重新站上，才有利下周出現反彈走勢。PCB 族群維持強勢輪動，嘉聯益、聯茂留意周五有無隔日沖賣壓，但同族群個股有機會接棒走強。載板三雄持續震盪觀望，法人持續回補但攻擊力道不強，仍看盤中買盤點火在順勢進場即可。矽智財中創意業績佳且發動軋空走勢，週五站上所有均線後，續航力道決定其餘矽智財股票補漲力道。雙 11 倒數計時，電子商務概念股題材持續加溫，周五仍看輪動轉強。元宇宙族群連續兩天轉強，近期券資比再度快速攀升，中小型元宇宙股如位速、建達與揚明光等，都是券資比開始增加，搭配威盛與宏達電同步站上月線，下週六世界 VR 大會登場，元宇宙軋空力道決定下周是否擔綱主流。車用電子、工業電腦與網通族群，近期低檔開始輪動反彈，法人開始回補個股，可留意反彈力道。,2025-08-04 15:46:44,20
2022-11-05,0.4,營收下滑與庫存調整壓力延續至明年上半年，聯茂第三季獲利表現疲弱，市場信心偏向保守。,2025-08-04 15:46:45,20
2022-11-09,0.2,財報與營收表現疲弱，加上第四季展望保守，拖累市場信心，短期內難以激勵正面情緒。,2025-08-04 15:46:47,20
2022-11-14,0.6,"營收穩定且產業前景樂觀的個股有望吸引資金青睞，激勵市場情緒，但整體盤勢仍受到總體經濟與庫存調整壓力影響，維持中性偏多看待。

====================

以下是提供的新聞資訊 :

之前龍哥就跟大家分析，美股利空淡化，要把握這波行情，台股已經大漲 1500 點，全部驗證，這一波從矽智財，安全監控，面板，記憶體到顯卡，驅動 IC，ABF 載板，龍哥全部抓到，簡單獲利，有行情就是要把握，今天台股資金輪動到傳產股，像水泥，鋼鐵等等，不一定要去追傳產，反而要留意強勢電子股的拉回，稍微震盪整理清洗籌碼，後面資金會再輪動回到電子股，那時候就會有簡單獲利的機會，目前台股目標為 14384 點缺口，持續搶錢。 現在可以關注有題材，技術面偏多，籌碼穩定的主力股，比較容易吸引資金進駐，例如面板，ABF 載板，車用，IP 矽智財，PCB 銅箔基板等等。 龍哥帶領會員朋友佈局相連到天邊和精彩人生，都開始攻擊，突破後有更大行情，低檔佈局就是簡單獲利，把握最後買點。 安全監控受惠轉單，晶睿 (3454-TW)，奇偶 (3356-TW)，昇銳 (3128-TW) 面板報價續漲，友達 (2409-TW)，群創 (3481-TW)，聯詠 (3034-TW)，天鈺 (4961-TW) ABF 載板站穩月線，欣興 (3037-TW)，景碩 (3189-TW)，南電 (8046-TW) IP 矽智財營收穩定，創意 (3443-TW)，智原 (3035-TW)，力旺 (3529-TW)，M31(6643-TW)，晶心科 (6533-TW) 投信佈局車用，台半 (5425-TW)，詮欣 (6205-TW)，智伸科 (4551-TW) PCB 應用廣，金居 (8358-TW)，嘉聯益 (6153-TW)，台光電 (2383-TW)，聯茂 (6213-TW)，台燿 (6274-TW)，金像電 (2368-TW)，華通 (2313-TW) 想要掌握主力股的狀況，只要訂閱龍哥 YouTube 和開啟小叮噹，就可以得到第一手消息（ ）。 一路以來，龍哥與大家分享好的產業，資金就是輪動攻擊，從網通，車用，節能，光學，再生晶圓，矽智財，工業電腦到太陽能等等，一檔接著一檔攻擊，龍哥的持股就是一檔接著一檔創高，從昇陽半導體到致伸，再換中興電以及高力，然後到昇達科，揚明光，老朋友昇陽半導體又多送一次獲利，工業風好自在 - 虹堡直接大賺 31.5%，極速 - 台半噴出直接獲利 15%，再來換隱藏飆股 - 元晶噴出大賺 16%，連續 10 檔賺錢，買到對的產業對的股票，還是能簡單獲利，記住，營收穩定，對股價就有保障。 【SuperStock 動能操盤系統】 #SuperStock 動能操盤改版囉 #增加期貨波段和高勝率當沖訊號 #增加即時買賣訊號系統 #市場上最強大的操盤軟體 市面上最強的股票操盤系統，要買要賣直接告訴你! SuperStock 動能操盤立志幫助投資朋友更簡單獲利，只要【傻傻】的跟著訊號操作，就可以簡單獲利，改版後，股票增加即時訊號系統，即時掃描全部股票，把有訊號的股票抓出來讓投資朋友一目了然，更能即時操作，簡單獲利。 還有當日多空訊號紀錄，將有多或空訊號的股票抓出來讓投資朋友檢視，方便了解個股狀況，全盤透析盤面狀況。 更重要的是，SuperStock 動能操盤增加期貨波段和當沖訊號，介面中會直接顯示盤勢狀況，期貨直接顯示多空訊號，高勝率波段和當沖，喜歡操作期貨的朋友絕對不能錯過。 操盤系統介紹影片 體驗操盤快感請填表！ 或直接打電話 02-25415555 盤勢震盪，突顯出股票當沖的優勢，不留部位，沒有隔夜風險，龍哥推出主力當沖班以及大戶當沖班，依照自己的操作資金來選擇，無本金交易，小資族好操作，安心穩定操作，天天都有加薪的機會，常常賺累積大獲利。 龍哥先前就說過要把握這一波行情，指數已經大漲 1500 點~ 族群從矽智財~ 面板驅動 IC~ABF 載板~ 安控~ PCB 銅箔基板等等~ 全面獲利全面驗證~ 一切都在你的思考之間大變特變，龍哥的宇宙最強 11 轟，全面鎖定下一波主流，絕對不要錯過上漲行情，一定要讓你大鑽紅不讓。 只要你拿出對股市的信心， 只要你拿出對自己的信心， 我們就可以攜手合作、掌握獲利！ 龍哥宇宙最強 11 轟，就要讓你大鑽紅不讓獲利持續增加！ 點連結專人服務 請直接來電詢問 02-25415555 《獲得更多「獨家」盤中資訊》 【FB 粉專】： 【Line ID：@lung1688】 【Telegram】 【Instagram】 留言跟龍哥互動： TG： LINE： FB",2025-08-04 15:47:07,20
2022-11-15,0.7,營收穩定且題材豐富的個股有望受惠於市場情緒，惟需留意漲多後的獲利了結壓力。,2025-08-04 15:47:09,20
2022-11-16,0.7,聯茂 作為 PCB 產業的強勢股，受惠於台積電等電子股的強勁表現，股價持續上漲，呈現良好的輪動走勢。隨著大盤整理後有望繼續上漲，聯茂 的中長期前景看俏。,2025-08-04 15:47:12,20
2022-11-17,0.6,光學族群強勢表現與生技股轉強帶動市場信心，惟指標個股走弱壓抑漲幅，短期維持中性偏多看待。,2025-08-04 15:47:14,20
2022-11-18,0.7,多空消息交雜，營收獲利表現符合預期，但市場情緒受總體經濟與消費性電子需求影響而趨中性。,2025-08-04 15:47:15,20
2022-11-21,0.7,"聯茂受惠於車用電子和資料中心需求維持穩健，且公司持續聚焦非消費性的高階高速運算材料，如伺服器、5G/6G 車聯網與電動車等相關應用，預期下半年營運已到谷底，第四季及明年第一季持平，第二季起在新產品發酵下營運可升溫。股價站上半年線，並突破頸線，後續有機會挑戰年線。

====================================================================",2025-08-04 15:47:19,20
2022-11-22,0.7,電子股跌深反彈，伺服器、ABF、網通等產業有望受惠復甦題材，但整體市場仍偏觀望，選股不選市。,2025-08-04 15:47:22,20
2022-11-23,0.7,金融與航運領漲帶動市場情緒偏正面，但電子族群表現疲弱且獲利下滑壓力仍在，整體市場情緒維持中性偏正向。,2025-08-04 15:47:24,20
2022-11-24,0.6,選舉行情結束與軍工航太股漲多整理，投信作帳買超個股有望受惠。,2025-08-04 15:47:26,20
2022-11-25,0.7,"多空消息交錯使市場情緒偏向正面，但仍需留意後續發展以確保獲利。

====================

請注意以上內容僅供參考，實際判斷可能因個人觀點與分析方法而有所不同。",2025-08-04 15:47:28,20
2022-11-29,0.6,軍工、車電股強勢上漲，搭配伺服器產業展望樂觀，整體市場情緒偏正面，但個別股票表現差異大。,2025-08-04 15:47:31,20
2022-12-01,0.6,"市場情緒偏正面，但漲幅有限。公司在第三代半導體領域有所突破，且氮化鎵晶圓應用於快充領域，效率表現優異，有利未來成長動能。

====================

請注意以上回覆僅供參考，不代表實際市場行情。投資人須審慎評估自身可承擔風險，盈虧自負。",2025-08-04 15:47:33,20
2022-12-02,0.6,市場情緒中性，股價波動可能受多空因素影響，需持續關注後市發展。,2025-08-04 15:47:35,20
2022-12-05,0.6,營收創近期新高且產能擴張計畫持續，顯示基本面穩健，但市場仍觀望庫存調整何時結束。,2025-08-04 15:47:38,20
2022-12-06,0.7,軍工、車電股強勢上漲帶動指數，搭配伺服器、光通訊等族群表現，整體市場情緒偏正面，但部分個股如矽智財已見法人獲利了結跡象，操作宜留意。,2025-08-04 15:47:40,20
2022-12-08,0.6,市場情緒受到短期風險影響而趨於謹慎，但伺服器供應鏈與元宇宙題材個股表現強勁，顯示部分成長動能仍受青睞。,2025-08-04 15:47:42,20
2022-12-12,0.3,市場信心受總體經濟影響而轉弱，加權指數跌破月線，三大法人同步賣超，顯示短期內市場情緒偏向負面。,2025-08-04 15:47:44,20
2022-12-16,0.6,市場情緒偏中性，雖然營收和獲利表現穩健，但總體經濟環境的不確定性和競爭對手的挑戰仍在。,2025-08-04 15:47:46,20
2022-12-19,0.7,營收穩定且展望正向的個股有機會吸引資金進駐，惟整體市場情緒仍偏中性。,2025-08-04 15:47:48,20
2023-01-03,0.7,新平台需求帶動材料供應商成長潛力，聯貸案穩定資金挹注有利未來擴張。,2025-08-04 15:47:49,20
2023-01-04,0.7,"多家重量級公司股價強勢，帶動大盤上漲，顯示市場情緒正面且對相關個股有信心。

====================

以下是提供的新聞資訊 :

聯電 (2303-TW) 今 (1) 日召開法說會，總經理王石表示，目前產能利用率仍維持 95% 高檔水準，預期到年底前都將保持在此水準以上。 王石指出，由於客戶庫存調整速度比預期慢，聯電第四季營收可能僅與第三季持平或小幅下滑，但明年第一季仍有機會維持高檔水準。 聯電表示，目前 12 吋晶圓代工產能依然吃緊，尤其是成熟製程，預期到明年上半年都將供不應求。聯電也看好車用電子、工業相關需求強勁，明年成長動能可望優於平均水準。 聯電第三季營收 1,057.62 億元，季增 11%，毛利率 53.4%，季減 0.3 個百分點，營益率 44.2%，季減 0.6 個百分點；稅後純益 366.08 億元，季增 10.5%，年增 73.7%，每股純益 3.02 元。聯電前三季累計營收 2,996.48 億元，毛利率 53.1%，年增 9.6 個百分點，營益率 43.8%，年增 10.4 個百分點；稅後純益 1,045.98 億元，年增 68.5%，每股純益 8.57 元。 聯電預估，以新台幣平均匯率 29.7 元兌換一美元假設，第四季營收將介於 980-1,030 億元之間，相當於季減約 6.9%-2.4%，毛利率將介於 51.5-53.5%，營益率將介於 40.5-42.5%。 聯電表示，目前產能利用率仍維持高檔水準，預期到年底前都將保持在此水準以上。聯電也看好車用電子、工業相關需求強勁，明年成長動能可望優於平均水準。

範例輸出4:
0.9
產能利用率維持高檔且對明年展望樂觀，顯示公司基本面強勁且獲利前景良好，激勵市場情緒正面。",2025-08-04 15:47:57,20
2023-01-05,0.3,營收表現低於預期且全年衰退壓力仍在，加上庫存調整延續至明年上半年，拖累市場信心。,2025-08-04 15:47:59,20
2023-01-09,0.6,"整體市場情緒偏正面，多檔個股表現強勁，但部分公司仍有庫存調整壓力，需謹慎操作。

====================",2025-08-04 15:48:00,20
2023-01-12,0.6,投資設廠計畫與營收表現略優於預期提振市場信心，但獲利下滑壓抑部分正面效應。,2025-08-04 15:48:02,20
2023-01-16,0.7,電子權值股與金融股領軍反彈，加上生技族群強勢表態，激勵市場情緒向上，但銅箔基板廠火災事故仍帶來部分壓力。,2025-08-04 15:48:04,20
2023-01-17,0.7,營收穩定與技術面偏多的族群有望受惠年後資金動能回籠，激勵市場情緒。,2025-08-04 15:48:06,20
2023-01-27,0.7,需求前景穩健與擴產計畫積極推進，顯示公司基本面強勁且成長潛力可期，激勵正面市場情緒。,2025-08-04 15:48:08,20
2023-01-30,0.6,市場情緒偏正面，主要受惠於龍哥看好半導體族群與相關概念股的表現，以及營收穩定性。,2025-08-04 15:48:10,20
2023-01-31,0.7,"營收衰退但新產品推出與需求回溫預期提振市場信心，股價突破平台整理區。

====================

以下是提供的新聞資訊 :

聯茂 (6213-TW) 2022 年前三季稅後純益 15.21 億元，年減 34.19%，每股純益 4.01 元。 聯茂指出，市場產品走向高頻、高速傳輸的趨勢確立，並帶動材料升級需求，高階車用、高階伺服器是帶動 2023 年營運回溫的動能；此外，下一代 PCIe Gen 5 伺服器新平台小量出貨，今年第二季起需求放量更顯著，預期第一季淡季為全年谷底，第二季開始受惠新產品發酵，營運將逐漸加溫。

---

台股昨日大漲逾 500 點外資買超創史上次高，今 (31) 日漲多調節開低走低，台積電也下挫逾 3%，盤中指數最重下跌逾 185 點，不但摔破年線，且回測 15300 點，成交量估超過 2500 億元。 電金權值股方面，台積電在昨日大漲 40 元後，今日調節賣壓出籠，下跌逾 3%，仍站穩年線之上，聯發科一度站上短線 752 元高點後持續走低下跌 1%，日月光則下挫超過 4%，中租跌逾半根漲停板，而鴻海受到新電動車策略長的加持，今逆勢上漲近 3%。 高價股方面，祥碩表現強勁，昨日亮燈漲停後今仍收於平盤之上，信驊延續漲勢今再漲逾 1%，大立光平盤走低暫跌 0.9%，譜瑞遭遇調節下跌 2% 以上，緯穎、嘉澤也跌逾 2%，世芯跌 1%。 儘管大盤走勢疲弱，盤中仍有個股強勢上攻，其中銅價帶動下第一銅早盤即亮燈漲停，聯茂漲 6.8%，聯亞資金法說會前卡位大漲 9%，凌巨聚焦工控營運強健今大漲 8.8%，康舒在併購激勵下今再上漲 7%。 展望後市，法人認為，在紅盤開出激勵市場情緒後，市場也正等待下半周 FOMC 今年第一場會議結果，不排除在短線行情熱絡後，隨即又將陷觀望。",2025-08-04 15:48:18,20
2023-02-01,0.7,"市場情緒受多空因素影響，短期波動加劇，但營收穩定族群仍具上漲潛力。

====================",2025-08-04 15:48:20,20
2023-02-04,0.7,"產能擴張計畫與獲利表現支撐市場信心，預期營收將回升帶動股價上漲。

====================",2025-08-04 15:48:21,20
2023-02-05,0.3,營收創下近三年新低，顯示市場需求疲弱與庫存去化壓力仍在，短期內正面訊息有限。,2025-08-04 15:48:23,20
2023-02-06,0.3,"營收下滑與庫存調整壓力影響市場信心，但新專案挹注及獲利成長帶來部分正面支撐。

====================

以下是提供的新聞資訊 :

聯茂 (6213-TW) 昨 (5) 日公布 2023 年 1 月營收 19.56 億元，創 35 個月來新低，月減 16.63%，年減 36.83%，主要仍因客戶端還在去化庫存階段，同時，1 月工作天數減少也造成營收下滑，預計去化庫存時程要到第二季後才會緩解。",2025-08-04 15:48:26,20
2023-02-09,0.6,外資買超電子權值股，賣超金融股，顯示對科技產業前景樂觀，但台股漲跌幅有限，市場情緒溫和偏多。,2025-08-04 15:48:27,20
2023-02-10,0.2,三大法人賣超，外資調節晶圓雙雄與聯茂等個股，市場情緒偏空。,2025-08-04 15:48:29,20
2023-02-13,0.3,電子權值股走疲拖累大盤，外資連三賣超聯電等個股，但投信持續力挺金融族群。,2025-08-04 15:48:30,20
2023-03-03,0.7,"類股輪動推升大盤，銅箔基板庫存消化最完整且原料成本上漲，有利後市表現。

====================",2025-08-04 15:48:32,20
2023-03-05,0.3,營收衰退與庫存調整壓力延續，但新產能擴建和伺服器成長動能提振市場信心。,2025-08-04 15:48:33,20
2023-03-07,0.6,財報表現符合預期但營收與獲利下滑及庫存調整壓力使短期市場情緒維持中性。,2025-08-04 15:48:34,20
2023-03-08,0.2,"獲利與營收雙降及股息縮水壓抑市場信心，財報表現疲弱使正面情緒受挫。

====================

以下是提供的新聞資訊 :

專業 CCL 廠台燿 (6274-TW) 今 (8) 日公布去年財報稅後純益 12.61 億元，年減 32.95%，每股純益爲 4.69 元，公司擬配約 4 元股息，訂 4 月 12 日除息交易，依今天台燿收盤價計算，股息現金殖利率爲 6.29%。 台燿 2022 年第四季獲利表現優於第三季，單季營收 41.43 億元，毛利率 20.37 %，季增 4.49 個百分點，年增 1.27 個百分點，稅後純益 2.9 億元，季增 7.28%，年減 24.96%，每股純益 1.08 元。 台燿 2022 年全年營收 184.72 億元，毛利率 18.43%，年減 2.54 個百分點，稅後純益 12.61 億元，年減 32.95%，每股純益爲 4.69 元，公司擬配約 4 元股息，訂 4 月 12 日除息交易。 台燿 2023 年前 2 月營收 23.38 億元，年減 28.86%。 各 CCL 廠去年財報來看，台光電 (2383-TW) 2022 年全年營收 386.73 億元，創新高，毛利率 25.11%，年減 1.04 個百分點，稅後純益 50.73 億元，年減 7.74%，每股純益爲 15.24 元，爲台光電連續 4 年年度賺回超過 1 個股本。 聯茂 (6213-TW) 2022 年營收 291.3 億元，毛利率為 13.5%，年減 4.9 個百分點，稅後純益 18.6 億元，年減 41%，每股純益 4.94 元。擬配發 3 元股息。",2025-08-04 15:48:41,20
2023-03-10,0.7,"營運展望樂觀、獲利成長及股息殖利率支撐下，市場情緒偏正面，但整體漲幅空間有限。

====================

以下是提供的新聞資訊 :

本週一台股再度創波段新高，這波行情在不少電子次族群搭配傳產，包含網通、資訊服務、光電、電機、食品等類股強勢下使台股在國際股市中表現特別強勢，持續維持高檔偏多整理；這波推升台股如此強悍原因在於內資法人以及融資籌碼，幾乎是一路加碼作多，八大官股券商也大多站買方，雖買盤並未十分連續，也可看出台股強勢的背後可能有政府的力道在；也因此即便外資在高檔回補的興致缺缺，半導體類股也無特別表現，還是讓台股撐在這個位置。 前一週有提到台股短線投機氣氛減緩，可以把目光多放在股息殖利率高的個股上，近期不少公司招開董事會宣布股息，殖利率高的就有機會在董事會後見到股價發動。而筆者認為搭配股價位階以及營運前景來看，即便是已公布現金股利，股價也有反映過的，後續依舊可以留意相關機會。 這波市場熱度還沒結束，不過從近期資金流向來看，確實具有高殖利率、低本益比等條件的標的，都還有機會續強，且預期即便盤跌也能表現相對抗跌。 今天來看銅箔基板廠。台燿 (6274-TW) 於 3/8 決議配發現金股利 4 元，以當天收盤價來計算殖利率達 6.3%，並不能說相當吸引人，但搭配股價位階仍處於一年來相對低檔，隔天股價上攻逼近漲停，且其為 2 月營收月增率表現上相對亮眼公司，相較其於兩家個位數月增，台燿月增達到接近 16%。 短期營運及殖利率利多使股價衝高，而股價在此位階，主要還是營運還處在產業需求修正的階段。今年上半年伺服器在大型雲端企業較為保守下，伺服器板的需求還沒明顯回溫，高階網路交換器的需求也跟著下滑，預計還是要等到今年年中，Intel Eagle Stream 逐漸放量下，才會見到營收從去年持續下滑的拐點，因此預期 Q2 震盪過程中都還有可以逢低承接機會。 再看到另一家 3/7 也公布現金股利 3 元的 聯茂 (6213-TW)，當天收盤價算得殖利率約 3.8%，未能吸引市場短線買盤，不過從近期盤面輪動表現來看，同類股的補漲行情很值得期待，也因此近期網路交換器相關廠商領先發動後，銅箔基板也出現可觀察的指標股，單純從資金可能青睞的標的來說，也是有機會在中期均線附近震盪後跟進發動。 下半年展望上，高階板材的需求也將開始回溫，下半年營運優於上半年，且聯茂產品線上有切入車用板材，在很多廠商導入自駕輔助系統、影像處理等需求，此產品線毛利率有望持續提升；儘管目前佔營運比例很低，今年有機會呈現倍數成長 (雖還是低個位數，也有機會出現像很多台廠利用車用題材拉抬股價的表現)，且全年獲利年增預期達雙位數成長，以股價今年來維持橫向整理，筆者認為很能符合進可攻退可守的標的。 筆者近期關注方向從原先盤面的投機氣氛，上週起陸續轉移至股價具有更多基本面因素支撐的方向，最主要也是跟盤面資金輪動的方向有關，提醒在此創高的階段可以積極作多，並順應盤面資金流向，才更有機會搭上不同階段行情。 （撰文者：永誠資產管理處 分析師 江太壹） 「永誠資產管理處」是全台合法擁有金管字號的證券投資顧問公司中「唯一首創資產管理的部門」20 年深耕專營台灣各大科技園區，以認真、誠信思維提供客戶服務，讓努力累積財富的你，也可貼身感受理財管家的 VIP 價值。 沒有代理金融商品，不以商品銷售出發，減少你的財務漏洞。從資產配置出發，透過「專案客製化」、「服務精緻化」、「獲利系統化」，你不需犧牲時間體力，就能感受到資產提升！ 「卓越投資研究團隊」加「頂尖財務顧問團隊」共同與客戶締造里程碑 ▶ ▶ ▶立即加入 ▶ ▶ ▶閱讀更多精彩文章 ▶ ▶ ▶認識永誠資產管理處 本公司所分析個別有價證券僅供參考，投資人應獨立判斷，審慎評估並自負投資風險。",2025-08-04 15:48:59,20
2023-03-12,0.7,跨出兩岸布局的購併案顯示公司積極因應市場需求與客戶要求，增強投資信心。,2025-08-04 15:49:01,20
2023-03-14,0.3,財報表現不佳與獲利下滑壓抑市場信心，但展望未來動能仍然存在，短期內市場情緒偏向保守。,2025-08-04 15:49:02,20
2023-03-22,0.6,市場雖受金融業拖累但優質科技股抗跌，網通股中磊成長動能強勁，基本面支撐股價上漲潛力。,2025-08-04 15:49:04,20
2023-03-29,0.3,市場信心受歐美金融股影響，資金轉向科技股，但整體盤勢仍偏弱，個股表現分歧。,2025-08-04 15:49:06,20
2023-03-31,0.6,多家 PCB 廠商陸續宣布赴泰國投資建廠，顯示對市場前景樂觀且擴產需求，激勵正面市場情緒。,2025-08-04 15:49:07,20
2023-04-03,0.7,跨足東南亞市場顯示對未來成長前景樂觀，雖短期擴張成本增加但長遠有利分散風險並滿足客戶需求。,2025-08-04 15:49:09,20
2023-04-11,0.7,獲頒名譽醫學博士學位與對電子產業景氣的正面展望激勵市場情緒，但營收與獲利下滑壓抑部分樂觀預期。,2025-08-04 15:49:11,20
2023-04-14,0.3,營收與獲利下滑壓抑市場信心，但伺服器新平台需求增溫及海外設廠計畫提供部分正面支撐。,2025-08-04 15:49:12,20
2023-04-16,0.7,設備廠擴產與下游客戶投資東南亞帶動設備需求，整體市場情緒偏正面。,2025-08-04 15:49:13,20
2023-04-23,0.6,聯茂在東南亞設廠進度領先，顯示其擴張策略積極，對市場情緒帶來正面影響，但整體獲利表現仍需關注。,2025-08-04 15:49:15,20
2023-04-27,0.7,AI server 需求增溫與營收貢獻提升提振市場信心，但獲利表現仍有改善空間。,2025-08-04 15:49:16,20
2023-05-03,0.3,獲利表現不佳與同業競爭壓力使市場情緒偏向保守，但部分公司仍積極擴廠佈局東南亞市場。,2025-08-04 15:49:18,20
2023-05-04,0.3,獲利表現不佳與營收低於預期壓抑市場信心，但 AI 題材帶來一定支撐。,2025-08-04 15:49:19,20
