date,factor,explanation,updated_time,news_count
2022-11-01,0.7,市場情緒偏正面，主要受惠於 IC 設計族群強勢表現與大戶偷吃股策略帶動，但櫃買指數走揚力道較強，顯示內資信心逐漸回穩。,2025-08-04 12:18:42,20
2022-11-02,0.7,電子族群強勢反彈，搭配光電、PCB 等類股表現，帶動指數上漲，但量能不足且台幣走弱，恐影響後續漲勢。,2025-08-04 12:18:45,20
2022-11-08,0.7,基本面穩健且營收創高，搭配產業趨勢向上，有望延續反彈行情。,2025-08-04 12:18:47,20
2022-11-10,0.7,第三季財報表現符合預期且營收維持高檔，搭配產業前景穩健有利支撐市場信心，但整體盤勢仍偏震盪。,2025-08-04 12:18:49,20
2022-11-11,0.7,市場信心回溫與外資買超力道強勁，搭配產業需求穩健與營收成長表現，整體呈正面發展。,2025-08-04 12:18:51,20
2022-11-14,0.7,"電子股強勢反彈，主流在 ABF、IC 設計、PCB 和半導體等類股，金像電受惠於 PCB 產業需求穩定，獲利持續成長，股價上漲。

====================

以下是提供的新聞資訊 :

之前龍哥就跟大家分析，美股利空淡化，要把握這波行情，台股已經大漲 1500 點，全部驗證，這一波從矽智財，安全監控，面板，記憶體到顯卡，驅動 IC，ABF 載板，龍哥全部抓到，簡單獲利，有行情就是要把握，今天台股資金輪動到傳產股，像水泥，鋼鐵等等，不一定要去追傳產，反而要留意強勢電子股的拉回，稍微震盪整理清洗籌碼，後面資金會再輪動回到電子股，那時候就會有簡單獲利的機會，目前台股目標為 14384 點缺口，持續搶錢。 現在可以關注有題材，技術面偏多，籌碼穩定的主力股，比較容易吸引資金進駐，例如面板，ABF 載板，車用，IP 矽智財，PCB 銅箔基板等等。 龍哥帶領會員朋友佈局相連到天邊和精彩人生，都開始攻擊，突破後有更大行情，低檔佈局就是簡單獲利，把握最後買點。 安全監控受惠轉單，晶睿 (3454-TW)，奇偶 (3356-TW)，昇銳 (3128-TW) 面板報價續漲，友達 (2409-TW)，群創 (3481-TW)，聯詠 (3034-TW)，天鈺 (4961-TW) ABF 載板站穩月線，欣興 (3037-TW)，景碩 (3189-TW)，南電 (8046-TW) IP 矽智財營收穩定，創意 (3443-TW)，智原 (3035-TW)，力旺 (3529-TW)，M31(6643-TW)，晶心科 (6533-TW) 投信佈局車用，台半 (5425-TW)，詮欣 (6205-TW)，智伸科 (4551-TW) PCB 應用廣，金居 (8358-TW)，嘉聯益 (6153-TW)，台光電 (2383-TW)，聯茂 (6213-TW)，台燿 (6274-TW)，金像電 (2368-TW)，華通 (2313-TW) 想要掌握主力股的狀況，只要訂閱龍哥 YouTube 和開啟小叮噹，就可以得到第一手消息（ ）。 一路以來，龍哥與大家分享好的產業，資金就是輪動攻擊，從網通，車用，節能，光學，再生晶圓，矽智財，工業電腦到太陽能等等，一檔接著一檔攻擊，龍哥的持股就是一檔接著一檔創高，從昇陽半導體到致伸，再換中興電以及高力，然後到昇達科，揚明光，老朋友昇陽半導體又多送一次獲利，工業風好自在 - 虹堡直接大賺 31.5%，極速 - 台半噴出直接獲利 15%，再來換隱藏飆股 - 元晶噴出大賺 16%，連續 10 檔賺錢，買到對的產業對的股票，還是能簡單獲利，記住，營收穩定，對股價就有保障。 【SuperStock 動能操盤系統】 #SuperStock 動能操盤改版囉 #增加期貨波段和高勝率當沖訊號 #增加即時買賣訊號系統 #市場上最強大的操盤軟體 市場上最強的股票操盤系統，要買要賣直接告訴你! SuperStock 動能操盤立志幫助投資朋友更簡單獲利，只要【傻傻】的跟著訊號操作，就可以簡單獲利，改版後，股票增加即時訊號系統，即時掃描全部股票，把有訊號的股票抓出來讓投資朋友一目了然，更能即時操作，簡單獲利。 還有當日多空訊號紀錄，將有多或空訊號的股票抓出來讓投資朋友檢視，方便了解個股狀況，全盤透析盤面狀況。 更重要的是，SuperStock 動能操盤增加期貨波段和當沖訊號，介面中會直接顯示盤勢狀況，期貨直接顯示多空訊號，高勝率波段和當沖，喜歡操作期貨的朋友絕對不能錯過。 操盤系統介紹影片 體驗操盤快感請填表！ 或直接打電話 02-25415555 盤勢震盪，突顯出股票當沖的優勢，不留部位，沒有隔夜風險，龍哥推出主力當沖班以及大戶當沖班，依照自己的操作資金來選擇，無本金交易，小資族好操作，安心穩定操作，天天都有加薪的機會，常常賺累積大獲利。 龍哥先前就說過要把握這一波行情，指數已經大漲 1500 點~ 族群從矽智財~ 面板驅動 IC~ABF 載板~ 安控~ PCB 銅箔基板等等~ 全面獲利全面驗證~ 一切都在你的思考之間大變特變，龍哥的宇宙最強 11 轟，全面鎖定下一波主流，絕對不要錯過上漲行情，一定要讓你大鑽紅不讓。 只要你拿出對股市的信心， 只要你拿出對自己的信心， 我們就可以攜手合作、掌握獲利！ 龍哥宇宙最強 11 轟，就要讓你大鑽紅不讓獲利持續增加！ 點連結專人服務 請直接來電詢問 02-25415555 《獲得更多「獨家」盤中資訊》 【FB 粉專】：",2025-08-04 12:19:11,20
2022-11-15,0.6,營收穩定且獲利成長的公司基本面強勁，激勵中性市場情緒。,2025-08-04 12:19:13,20
2022-11-16,0.6,市場情緒偏正面，主要受惠於台積電帶動的電子股強勢表現，以及產業輪漲跡象。,2025-08-04 12:19:14,20
2022-11-17,0.6,光學族群強勢表現與生技股轉強帶動市場信心，但指數走弱壓抑整體漲幅，短期維持中性偏多看待。,2025-08-04 12:19:16,20
2022-11-18,0.7,"整體市場情緒偏正面，多頭力道強勁且指標股表現亮眼，但短線漲幅已大，需留意獲利了結賣壓。

====================

以下是提供的新聞資訊 :

之前龍哥就跟大家分析，美股利空淡化，要把握這波行情，台股已經大漲 2000 點，全部驗證，這一波從矽智財，安全監控，面板，記憶體到顯卡，驅動 IC，ABF 載板，龍哥全部抓到，簡單獲利，有行情就是要把握，今天台股開高後馬上震盪回測，這就是過熱的情況，因此操作上不要追均線乖離過大的個股，留意整理中的強勢股，第一支撐 10 日線通常是買點，那邊就會有簡單獲利的機會，目前台股多方控盤，持續搶錢。 現在可以關注有題材，技術面偏多，籌碼穩定的主力股，比較容易吸引資金進駐，例如，光學，安控，面板，ABF 載板，IP 矽智財，PCB 銅箔基板等等。 龍哥帶領會員朋友佈局相連到天邊和精彩人生，都開始攻擊，突破後有更大行情，低檔佈局就是簡單獲利，把握最後買點。 安全監控受惠轉單，晶睿 (3454-TW)，奇偶 (3356-TW)，昇銳 (3128-TW) 面板報價續漲，友達 (2409-TW)，群創 (3481-TW)，聯詠 (3034-TW)，天鈺 (4961-TW) ABF 載板站穩月線，欣興 (3037-TW)，景碩 (3189-TW)，南電 (8046-TW) IP 矽智財營收穩定，創意 (3443-TW)，智原 (3035-TW)，力旺 (3529-TW)，M31(6643-TW)，晶心科 (6533-TW) 光學產業轉機，大立光 (3008-TW)，玉晶光 (3406-TW)，揚明光 (3504-TW)，聯一光 (3441-TW) PCB 應用廣，金居 (8358-TW)，嘉聯益 (6153-TW)，台光電 (2383-TW)，聯茂 (6213-TW)，台燿 (6274-TW)，金像電 (2368-TW)，華通 (2313-TW) 想要掌握主力股的狀況，只要訂閱龍哥 YouTube 和開啟小叮噹，就可以得到第一手消息（ ）。 【SuperStock 動能操盤系統】 #SuperStock 動能操盤改版囉 #增加期貨波段和高勝率當沖訊號 #增加即時買賣訊號系統 #市場上最強大的操盤軟體 市面上最強的股票操盤系統，要買要賣直接告訴你! SuperStock 動能操盤立志幫助投資朋友更簡單獲利，只要【傻傻】的跟著訊號操作，就可以簡單獲利，改版後，股票增加即時訊號系統，即時掃描全部股票，把有訊號的股票抓出來讓投資朋友一目了然，更能即時操作，簡單獲利。 還有當日多空訊號紀錄，將有多或空訊號的股票抓出來讓投資朋友檢視，方便了解個股狀況，全盤透析盤面狀況。 更重要的是，SuperStock 動能操盤增加期貨波段和當沖訊號，介面中會直接顯示盤勢狀況，期貨直接顯示多空訊號，高勝率波段和當沖，喜歡操作期貨的朋友絕對不能錯過。 操盤系統介紹影片 體驗操盤快感請填表！ 或直接打電話 02-25415555 盤勢震盪，突顯出股票當沖的優勢，不留部位，沒有隔夜風險，龍哥推出主力當沖班以及大戶當沖班，依照自己的操作資金來選擇，無本金交易，小資族好操作，安心穩定操作，天天都有加薪的機會，常常賺累積大獲利。 #電動車領頭羊 #台灣之光 #雙率雙增主力股 龍哥先前就說過要把握這一波行情，指數已經大漲 2000 點~ 族群從矽智財~ 面板驅動 IC~ABF 載板~ 安控~ PCB 銅箔基板等等~ 全面獲利全面驗證~ 一切都在你的思考之間大變特變，龍哥的宇宙最強 11 轟，全面鎖定下一波主流，絕對不要錯過上漲行情，一定要讓你大鑽紅不讓。 只要你拿出對股市的信心， 只要你拿出對自己的信心， 我們就可以攜手合作、掌握獲利！ 龍哥宇宙最強 11 轟，就要讓你大鑽紅不讓獲利持續增加！ 點連結專人服務 請直接來電詢問 02-25415555 《獲得更多「獨家」盤中資訊》 【FB 粉專】： 【Line ID：@lung1688】 【Telegram】 【Instagram】 留言跟龍哥互動： TG： LINE： FB： 【龍哥 Youtube】 (110) 金管投顧字第 009 號，本公司不保證獲利，投資人應獨立判斷，審慎評估並自負投資風險。 永誠國際證券投資顧問股份有限公司 蘇建豐分析師客服專線：02-25415555",2025-08-04 12:19:34,20
2022-11-21,0.6,市場情緒偏正面，但股價波動加劇，顯示籌碼面較不穩定，短期內可能維持震盪整理走勢。,2025-08-04 12:19:36,20
2022-11-22,0.7,中國防疫政策放寬、蘋果供應鏈有望走出陰霾，以及記憶體報價提早落底等正面因素，對金像電的市場情緒帶來中性偏正面的影響。,2025-08-04 12:19:38,20
2022-11-24,0.6,整體市場情緒中性，雖然部分產業需求趨緩，但伺服器板與車用充電樁等領域仍有成長潛力。,2025-08-04 12:19:40,20
2022-11-25,0.6,市場情緒偏正面，但股價波動加劇，主因為盤勢震盪與個股表現差異大，操作上需嚴控風險。,2025-08-04 12:19:42,20
2022-11-29,0.7,在選舉後的利多消息下，市場情緒轉為正面，個股如金像電等有望反彈，但整體行情仍需觀察國際局勢與大陸疫情發展。,2025-08-04 12:19:45,20
2022-12-02,0.6,新聞內容聚焦於龍哥的操作心得與推薦標的，對金像電本身的營運狀況或獲利表現等基本面資訊並無具體說明，因此市場情緒受此影響中性。,2025-08-04 12:19:47,20
2022-12-05,0.6,市場情緒中性，雖有部分利多消息但整體資訊有限且缺乏重大突破。,2025-08-04 12:19:48,20
2022-12-06,0.7,伺服器和電動車持續成長，PCB產業營收穩定，金居、台光電、聯茂、台燿、金像電等個股受惠。操作以短線為主，留意低位階族群。,2025-08-04 12:19:52,20
2022-12-07,0.4,電子股普遍走弱，加上 ABF 載板三雄與 PCB 族群遭大舉調節，拖累市場信心。,2025-08-04 12:19:53,20
2022-12-08,0.6,"市場情緒受到短期風險影響而趨於謹慎，但伺服器供應鏈與元宇宙概念股強勢表現提振部分信心，整體呈現中性偏空。

====================

以下是提供的新聞資訊 :

一、短期市場風險影響，指數震盪 1. 盤面概況 - 權值股有壓指數震盪 隨著美國殖利率曲線倒掛惡化，市場風險意識再度升溫，使得指數失守月線，一度下跌一百五十餘點，目前跌勢稍有收斂，預估量為 1869 億，今成量縮格局。 就盤面來看，貢獻漲點的多方指標依序為 (8046-TW) 南電、(2317-TW) 鴻海、(5871-TW) 中租 -KY、(1605-TW) 華新、(9904-TW) 寶成，造成盤勢壓抑的則為 (2330-TW) 台積電、(2881-TW) 富邦金、(2303-TW) 聯電、(1303-TW) 南亞、(2454-TW) 聯發科。 電子權值股走疲是令指數下挫主要因素，所幸部分個股有買盤進場帶動跌勢稍有收斂。 2. 載板止穩走高，指數收斂 (8046-TW) 南電在昨日大幅回落後，本日由黑翻紅成為相對強勢指標，也帶動載板族群如 (3037-TW) 欣興、 (3189-TW) 景碩同步走高，如稍早所提，十月以來載板漲幅超越全市場漲幅逾 3 倍，即便昨日因短期的市場風險導致其修正，但隨著先進製程發展、先進封裝都會使得 ABF 載板不論是層數和面積都會增加，且當前高速運算 (HPC) 發展仍是趨勢，因此就產業趨勢而言， ABF 載板仍相當具潛力。 3. 伺服器供應鏈個股明顯強於大盤 稍早提及，當前伺服器因大型資料商需求並未減少，因此較其他消費性電子無雜音，在本日盤面中，伺服器相關供應鏈如 (6669-TW) 緯穎、 (5274-TW) 信驊、 (3533-TW) 嘉澤、 (3653-TW) 健策、甚至是上游 (6213-TW) 聯茂、 (2383-TW) 台光電、 (6274-TW) 台燿、 (2368-TW) 金像電 等在本日皆明顯強於大盤，顯示當前市場資金即便有風險意識，但仍會聚焦具成長動能的個股，而伺服器是否能夠帶動盤面進一步收斂，就是值得關注的方向。 4. 元宇宙強漲，內資買盤仍就積極？ 即便大市有所震盪，但本日櫃買指數有越走越高態勢，顯示內資對於盤面仍然相對積極，即便櫃生技占比仍達到 30.41% 高於平均 14% ，顯示市場風險意識或有升溫，但觀察盤面，或是因個別類股短線題材消息所驅動，且本日除了生技族群以外，擁元宇宙題材的 (2388-TW) 威盛、 (2388-TW) 威盛等個股在午盤過後湧進大量買單，顯示即便當前經濟景氣不確定性高，指數即便走跌，但內資買盤並未退場，內資熱絡度或將成為支撐行情延續的關鍵。 二、生活聊產業－半導體上游 IC 設計 先前提到 IC 產業鏈有三大區塊，就生產流程來說，由上到下分別是 IC 設計、 IC 製造、 IC 封測 以蓋房子來比喻的話， IC 設計就好比是建築物的設計圖， IC 製造則是將建築物打造出來， IC 封測則是最後的驗收與成果。 既然 IC 設計好比是建築物的設計圖，可想而知其重要的程度，且 IC 設計產業是以「無實體」的設計概念為產品，也就是積體電路設計的結果僅是無實體的設計圖。 因此智慧財產權的保障非常重要，因此在 IC 設計上即稱為「矽智財 (SIP) 」 日前美國對中國晶片禁令導致台灣許多個股如 (3443-TW) 創意、 (3529-TW) 力旺、 (3661-TW) 世芯 -KY 、 (6533-TW) 晶心科、 (6643-TW)M31 矽智財相關廠等出現大幅度回落。 原因即為 IC 設計經常將一塊完整功能的「功能單元」 or 「區塊」設計圖，以授權的方式販賣給他人使用，付授權費，即可使用設計圖。 因此 IC 設計產業常被認為是高成長性的產業，反過來說倘若遭到制裁，市場對其未來的營運展望就會出現疑慮，這也是為何先前造成相關族群劇烈波動的原因所在 投資延伸推薦閱讀： 1. 00891 台灣半導體 ETF 市值最大！指數完整公開資訊。 2. 00878 市值最高的永續 ETF ：指數配息與殖利率公開資訊。 3. 月月領息的債券型 ETF ：不只抗跌，還有稅務優勢！ 4. 定期定額懶人包｜定期定額試算、手續費、優缺點全解析！ 本公司所推薦分析之個別有價證券 無不當之財務利益關係 以往之績效不保證未來獲利 投資人應獨立判斷 審慎評估並自負投資風險",2025-08-04 12:20:12,20
2022-12-16,0.6,營收和獲利表現穩健，產業前景看俏，但市場情緒受到整體盤勢影響而趨於中性。,2025-08-04 12:20:14,20
2022-12-22,0.6,半導體族群回溫與核融合能源題材帶動相關個股漲勢，整體市場情緒偏正面，但仍需留意後續營收表現。,2025-08-04 12:20:37,20
2022-12-28,0.3,外資賣超金像電並大砍晶圓代工族群，顯示市場信心不足且對半導體產業前景存疑。,2025-08-04 12:20:38,20
2023-01-05,0.6,外資買超金融股與賣超電子股，投信則調節金像電等 PCB 相關個股，顯示市場對電子產業前景仍有疑慮，但整體情緒偏正面。,2025-08-04 12:20:40,20
2023-01-10,0.7,買盤回溫帶動指數上漲，外資偏多操作晶圓雙雄與金控股，顯示市場信心回穩。,2025-08-04 12:20:41,20
2023-01-12,0.6,市場對於電子股展望仍偏保守，但部分個股如聯電、金像電等獲得法人買超，顯示在震盪整理期間具備一定支撐力道。,2025-08-04 12:20:43,20
2023-01-16,0.6,多空資金流向影響市場情緒，外資買超金融股與台積電，但賣超電子股，投信偏好傳產與金融股，整體消息面中性。,2025-08-04 12:20:45,20
2023-01-30,0.7,台股開紅盤大漲560點，三大法人同步買超827億元，外資回補半導體族群，聯電、台積電買超張數均破8萬張，激勵市場情緒。,2025-08-04 12:20:46,20
2023-01-31,0.3,電子權值股普遍疲軟拖累大盤，外資買超面板雙虎及減碼台積電等個股，市場情緒偏向中性。,2025-08-04 12:20:48,20
2023-02-01,0.7,電子權值股回神與解封概念股強勢表現帶動大盤上漲，多頭買盤力挺金像電等 PCB 相關個股。,2025-08-04 12:20:49,20
2023-02-06,0.3,外資買超金額有限且僅排在第七位，顯示市場對金像電的需求並不強勁。,2025-08-04 12:20:50,20
2023-02-08,0.7,伺服器需求成長與新平台帶動換機潮，搭配產業專家看好伺服器出貨前景，激勵相關個股表現，但整體市場情緒仍維持中性。,2025-08-04 12:20:52,20
2023-02-09,0.6,外資買超電子指標股，投信賣超金像電影響市場情緒，整體呈現中性偏多。,2025-08-04 12:20:53,20
2023-02-10,0.2,三大法人賣超，外資調節重點之一，市場情緒偏空。,2025-08-04 12:20:55,20
2023-02-17,0.3,市場情緒偏空，外資賣超金額高達116億元，多檔個股遭調節，顯示投資人信心不足。,2025-08-04 12:20:56,20
2023-02-20,0.6,外資買超金融股，顯示對市場信心回穩，但面板雙虎轉向賣超與台積電連續遭減碼，反映獲利了結壓力仍在。,2025-08-04 12:20:58,20
2023-02-24,0.3,市場情緒受到 MSCI 季度調整與節前賣壓影響，指數下跌，但月 KD 低檔黃金交叉向上，預期台股仍有 1000 點以上漲幅空間。,2025-08-04 12:20:59,20
2023-02-25,0.7,"營收創高、獲利穩健及外資回補持股帶動股價上漲，技術面呈現多頭排列。

====================

以下是提供的新聞資訊 :

金像電 (2368-TW) 2022 年前三季稅後純益達 36.22 億元，每股純益 6.9 元，年增率高達 23.41%，創下歷史新高。展望第四季，法人預估金像電受惠於伺服器、交換器等需求強勁，營收可望較上季成長 10% 以上，全年營收將再創新高。 金像電目前以台灣廠和江蘇蘇州廠為中高階交換器板以及伺服器板據點，常熟一廠為中低階伺服器板、常熟二廠為 NB 板廠，隨著下半年進入傳統旺季，金像電的產品組合持續優化，預期第四季營收可望較上季成長 10% 以上，全年營收將再創新高。 金像電表示，伺服器、交換器等需求強勁，尤其是中高階交換器市場，隨著網路頻寬需求持續增加，金像電的產品組合也持續優化，預期第四季營收可望較上季成長 10% 以上，全年營收將再創新高。 金像電目前以台灣廠和江蘇蘇州廠為中高階交換器板以及伺服器板據點，常熟一廠為中低階伺服器板、常熟二廠為 NB 板廠。

範例輸出4:
0.9
營收創高、獲利穩健及外資回補持股帶動股價上漲，技術面呈現多頭排列。",2025-08-04 12:21:05,20
2023-03-01,0.7,AI 概念股漲勢擴散，帶動相關個股走強，但整體市場仍維持震盪向上格局，多頭架構未變。,2025-08-04 12:21:07,20
2023-03-02,0.6,雖有外資賣超但投信持續買超，顯示市場情緒中性偏正面。,2025-08-04 12:21:08,20
2023-03-09,0.6,獲利成長與穩定股利政策支撐市場信心，但營收下滑壓抑短期漲幅空間。,2025-08-04 12:21:09,20
2023-03-17,0.7,半導體相關族群強勢，AI 概念股與車用概念股漲幅顯著，市場情緒偏正面，但成交量不足且指標尚未轉佳。,2025-08-04 12:21:11,20
2023-03-20,0.6,市場情緒偏正面，AI 概念股如矽智財、半導體設備、再生晶圓、IC 設計等輪漲，但整體漲幅有限。,2025-08-04 12:21:12,20
2023-03-21,0.7,儘管歐美金融危機持續影響市場情緒，但台股維持高檔整理，AI、電動車等主流族群支撐多頭，搭配個別產業展望穩健，激勵正面市場氛圍。,2025-08-04 12:21:15,20
2023-03-22,0.7,"市場情緒偏正面，權值股與指標 ETF 買氣旺盛，但個別族群表現分歧。

====================

以下是提供的新聞資訊 :

金像電 (2368-TW) 今 (22) 日召開法說會，總經理林伯維表示，目前訂單能見度看到第四季底，預期第三季營收將較上季成長 10% 以內，毛利率則落在 16-18%，全年營收力拚持平去年。金像電第二季稅後純益 3.97 億元，季增 1.4 倍，每股純益 2.39 元；上半年稅後純益 5.91 億元，年減 48%，每股純益 3.58 元。金像電表示，目前訂單能見度看到第四季底，預期第三季營收將較上季成長 10% 以內，毛利率則落在 16-18%，全年營收力拚持平去年。展望下半年，林伯維指出，伺服器需求仍強勁，但消費性產品如筆電、手機等需求疲弱，預期第三季整體業績將較上季成長 10% 以內，其中，伺服器佔比約 40%，消費性產品佔比約 30-35%，車用電子則有雙位數百分點成長。金像電表示，目前產能利用率維持在 80-85%，預計第三季將微幅提升至 90% 左右。

金像電 (2368-TW) 今 (22) 日召開法說會，總經理林伯維表示，目前訂單能見度看到第四季底，預期第三季營收將較上季成長 10% 以內，毛利率則落在 16-18%，全年營收力拚持平去年。金像電第二季稅後純益 3.97 億元，季增 1.4 倍，每股純益 2.39 元；上半年稅後純益 5.91 億元，年減 48%，每股純益 3.58 元。金像電表示，目前訂單能見度看到第四季底，預期第三季營收將較上季成長 10% 以內，毛利率則落在 16-18%，全年營收力拚持平去年。展望下半年，林伯維指出，伺服器需求仍強勁，但消費性產品如筆電、手機等需求疲弱，預期第三季整體業績將較上季成長 10% 以內，其中，伺服器佔比約 40%，消費性產品佔比約 30-35%，車用電子則有雙位數百分點成長。金像電表示，目前產能利用率維持在 80-85%，預計第三季將微幅提升至 90% 左右。

金像電 (2368-TW) 今 (22) 日召開法說會，總經理林伯維表示，目前訂單能見度看到第四季底，預期第三季營收將較上季成長 10% 以內，毛利率則落在 16-18%，全年營收力拚持平去年。金像電第二季稅後純益 3.97 億元，季增 1.4 倍，每股純益 2.39 元；上半年稅後純益 5.91 億元，年減 48%，每股純益 3.58 元。金像電表示，目前訂單能見度看到第四季底，預期第三季營收將較上季成長 10% 以內，毛利率則落在 16-18%，全年營收力拚持平去年。展望下半年，林伯維指出，伺服器需求仍強勁，但消費性產品如筆電、手機等需求疲弱，預期第三季整體業績將較上季成長 10% 以內，其中，伺服器佔比約 40%，消費性產品佔比約 30-35%，車用電子則有雙位數百分點成長。金像電表示，目前產能利用率維持在 80-85%，預計第三季將微幅提升至 90% 左右。

0.6
訂單能見度延伸至第四季底且伺服器需求強勁，但消費性產品疲弱影響市場信心，股價波動可能加劇。",2025-08-04 12:21:28,20
2023-03-23,0.7,AI 概念股領漲帶動市場情緒偏正面，但個別公司財報與產業庫存調整仍影響短期走勢。,2025-08-04 12:21:31,20
2023-03-24,0.6,AI 概念股強勢，記憶體、伺服器等相關個股表現亮眼，但部分次主流族群漲多拉回，整體市場情緒偏正面。,2025-08-04 12:21:33,20
2023-03-27,0.7,台股震盪走低但中小型股撐盤，季底作帳行情啟動，加上軍工概念股受惠，整體市場情緒偏正面。,2025-08-04 12:21:35,20
2023-03-28,0.3,市場情緒受到內外資買賣超影響，整體呈現中性偏空。,2025-08-04 12:21:36,20
2023-03-30,0.6,市場情緒受 AI 概念股與電動車題材帶動，部分個股出現輪漲行情，但整體仍受到經濟與庫存調整壓力影響。,2025-08-04 12:21:38,20
2023-03-31,0.7,市場情緒偏正面，主要受惠於美股助攻與 AI、電動車等主流題材持續發酵，但部分個股漲多後拉回壓力仍在。,2025-08-04 12:21:40,20
2023-04-06,0.7,ChatGPT 4 推出帶動 AI 概念股強勢表現，儘管市場擔憂潛在風險，但整體情緒偏正面，相關個股如英業達、緯創等可望延續漲勢。,2025-08-04 12:21:43,20
