date,factor,explanation,updated_time,news_count
2024-02-25,0.6,外資買超金額大且集中度高，顯示市場信心回溫，但投信逢高調節 AI 族群，個股輪動加快，短期漲多後可能出現獲利了結賣壓。,2025-07-21 13:47:59,1
2024-02-26,0.6,台積電熊本廠開幕、資金行情與輝達帶動的多頭氣勢使市場情緒偏正面，但獲利賣壓與外資操作仍是股價波動的主要因素。,2025-07-21 13:48:01,1
2024-02-27,0.3,台積電股價走勢疲弱，市場情緒偏空，但金融股撐盤及傳產族群逆勢抗跌使指數跌幅收斂，整體市場氛圍仍然偏向保守。,2025-07-21 13:48:02,1
2024-02-29,0.3,電子族群資金流向轉移與台積電股價疲軟引發市場觀望氣氛，但大盤指數維持高檔整理，航運、電力供應及營建類股表現強勁。,2025-07-21 13:48:03,1
2024-03-01,0.6,電子權值股表現分歧，高價股與 AI 股領軍上攻，但傳產與金融普遍走弱，市場情緒偏正面但仍有不確定性。,2025-07-21 13:48:05,1
2024-03-02,0.9,畢業生對台積電的嚮往程度持續領先高科技產業，顯示其在年輕世代心目中的正面形象與高度認同度。,2025-07-21 13:48:06,1
2024-03-03,0.3,外資買盤力道減弱、投信連續賣超與本益比過高個股壓回風險，均抑制市場情緒，但整體維持中性偏空。,2025-07-21 13:48:07,1
2024-03-04,0.9,台積電領軍大漲帶動指數創高，市場情緒樂觀且對產業展望前景看好。,2025-07-21 13:48:08,1
2024-03-05,0.5,市場靜待重要經濟數據與聯準會主席談話，匯市區間整理，對台積電股價影響中性。,2025-07-21 13:48:10,1
2024-03-06,0.3,台積電作為台股創高的重要推手，但隨著加權指數靠攏 2 萬點大關及美股漲勢稍歇，須留意回檔風險，加上超微遭美國政府阻礙對中國出口先進技術，引發市場擔憂。,2025-07-21 13:48:11,1
2024-03-07,0.8,台積電股價創高且成交量大增，顯示市場對其基本面與前景樂觀看待，激勵正面市場情緒。,2025-07-21 13:48:12,1
2024-03-08,0.9,台積電領軍衝刺加權指數站上2萬點新里程碑，外資買超力道強勁且大盤結構偏多，激勵市場情緒樂觀。,2025-07-21 13:48:14,1
2024-03-09,0.9,AI晶片需求強勁、CoWoS產能擴張帶動業績成長，加上三大法人同步買超，激勵市場情緒樂觀。,2025-07-21 13:48:15,1
2024-03-10,0.7,外資持續加碼並參與除息，顯示對公司基本面及未來成長前景的信心，激勵市場正面情緒。,2025-07-21 13:48:16,1
2024-03-11,0.3,美股四大指數全數收黑，費半大跌逾 200 點、台積電 ADR 下跌 1.90% ，加上台股日 KD 指標仍在嚴重超買區，漲勢有過度集中於部分半導體股的現象，整體下跌家數亦遠高於上漲家數不利於類股輪動，短線恐面臨漲多拉回整理。,2025-07-21 13:48:18,1
2024-03-12,0.9,分析師看好未來兩年盈利成長、持續的產業需求與技術優勢，樂觀展望將激勵市場情緒向上並推升股價。,2025-07-21 13:48:19,1
2024-03-13,0.9,權值股普遍上揚且重電族群強勢表現帶動大盤突破2萬點關卡，顯示市場信心回升並對未來展望樂觀。,2025-07-21 13:48:21,1
2024-03-14,0.6,高價股與電線電纜類股領漲帶動指數上揚，台積電等權值股維持平穩，整體市場情緒偏正面但漲勢受制於兩萬點關卡。,2025-07-21 13:48:22,1
2024-03-15,0.1,台積電尾盤急跌拖累大盤下跌，市場情緒偏向負面，但鴻海等個股表現強勁，整體影響有限。,2025-07-21 13:48:23,1
2024-03-16,0.6,新品發表與市場競爭加劇帶動產品創新，半導體產業前景樂觀但短期內仍受庫存調整影響。,2025-07-21 13:48:25,1
2024-03-17,0.6,外資賣超台積電但買超其他權值股，顯示對後市仍具信心，但短線漲多修正壓力增大。,2025-07-21 13:48:26,1
2024-03-18,0.9,除息交易順利完成與市場信心回溫推升股價走高，顯示投資人對台積電基本面維持正向看待。,2025-07-21 13:48:27,1
2024-03-19,0.9,台積電領軍大漲，帶動加權指數強勁反彈，市場情緒樂觀且對後市展望正向。,2025-07-21 13:48:28,1
2024-03-20,0.3,電子權值股普遍走跌，尤其是台積電尾盤賣壓湧現，拖累指數收黑，但 AI 概念股與機器人概念股強勢表態，整體市場情緒偏向中性。,2025-07-21 13:48:30,1
2024-03-21,0.9,美股再創新高激勵台股夜盤大漲，市場情緒樂觀且對電子權值股展望正面。,2025-07-21 13:48:31,1
2024-03-22,0.4,央行升息半碼引發市場擔憂經濟前景與企業獲利，拖累台積電等科技股表現，短期內投資人觀望氣氛濃厚。,2025-07-21 13:48:32,1
2024-03-23,0.9,設備廠受惠台積電先進封裝設廠需求強勁，營收與獲利成長動能可期，激勵市場情緒樂觀。,2025-07-21 13:48:33,1
2024-03-24,0.6,外資買超大型電子股並轉賣傳產股，顯示對科技業前景樂觀，但集中度過高與個股填息表現仍是市場關注焦點。,2025-07-21 13:48:35,1
2024-03-25,0.6,雖然台股再創新高，但量能不足且震盪加劇，市場追價意願不高，加上美股漲跌互見與主要權值股 ADR 表現分歧，短期內台積電股價波動可能持續。,2025-07-21 13:48:36,1
2024-03-26,0.3,權值股普遍走弱，電子族群疲軟，加上傳產與金融股表現不一致，整體市場情緒偏向中性，預期台積電隔日股價波動幅度將在 -1% 到 +1% 之間。,2025-07-21 13:48:38,1
2024-03-27,0.7,520 概念股如軍工國防、線纜與生技族群走強，帶動市場情緒正面，但權值股表現平淡且成交量萎縮，整體影響有限。,2025-07-21 13:48:39,1
2024-03-28,0.9,日本政府持續強化境內半導體生產基礎，並透過補助協助台積電在熊本縣建廠，顯示對該公司的重視與支持，預期將有利於未來營運發展。,2025-07-21 13:48:40,1
2024-03-29,0.9,台積電領軍上漲，加上 AI 概念股強勢表現，激勵市場情緒向上，多頭信心回溫。,2025-07-21 13:48:41,1
2024-04-01,0.6,高層經理人獲得大量限制員工權利新股，顯示公司對其未來表現有高度期許與肯定，激勵市場情緒但短期內可能引發獲利了結賣壓。,2025-07-21 13:48:43,1
2024-04-02,0.9,台積電領軍的電子權值股強勁上漲，帶動加權指數再創新高，市場情緒樂觀。,2025-07-21 13:48:44,1
2024-04-03,0.6,地震造成部分設備受損及產線停擺，雖然主要機台無損且復原率高但仍對短期營運造成衝擊，市場情緒偏向中性。,2025-07-21 13:48:45,1
2024-04-04,0.3,地震造成部分生產中斷與潛在損失的消息引發市場擔憂，但台積電強調復工進度良好且已與客戶溝通，短期內對股價影響有限。,2025-07-21 13:48:47,1
2024-04-05,0.9,地震對營運的實質衝擊有限，公司迅速復原生產線且全年財測維持不變，激勵市場信心回升。,2025-07-21 13:48:48,1
2024-04-06,0.9,作為台積電認證供應鏈且半導體業務展望樂觀，市場對未來營運成長前景持正面期待。,2025-07-21 13:48:49,1
2024-04-08,0.6,地震影響有限，台積電領軍上漲帶動加權指數再創新高，但三大法人中外資與自營商仍維持賣超態勢。,2025-07-21 13:48:50,1
2024-04-09,0.9,台積電領軍創高帶動大盤上漲，多頭指標強勢表態，市場情緒樂觀且對後市展望正向。,2025-07-21 13:48:51,1
2024-04-10,0.9,強勁的第一季財報與展望樂觀顯示公司基本面穩健，AI/HPC 需求成長趨勢明確，激勵市場情緒向上並推升股價。,2025-07-21 13:48:53,1
2024-04-11,0.3,市場情緒受到多空消息影響，整體呈現中性偏空態勢。,2025-07-21 13:48:54,1
2024-04-12,0.9,營收創高與外資持續看好第二季表現，顯示市場對台積電基本面前景樂觀，激勵股價再創新高。,2025-07-21 13:48:55,1
2024-04-13,0.9,定期定額交易戶數大增顯示市場對台積電長線成長前景樂觀，吸引更多投資人以分批方式布局。,2025-07-21 13:48:56,1
2024-04-14,0.6,法說會將釋出第二季與全年營運展望、先進製程研發進度等重要訊息，市場對於公司財務表現與產業前景的看法仍存在不確定性，引發中性偏空情緒。,2025-07-21 13:48:58,1
2024-04-15,0.9,市場情緒受中東戰事影響而波動，但分析師看好台積電設備股的低接機會，建議密切關注法說內容與重點族群。,2025-07-21 13:48:59,1
2024-04-17,0.6,法說會前市場情緒偏正面，權值股走高帶動指數上漲，但三大法人仍持續賣超影響短期信心。,2025-07-21 13:49:00,1
2024-04-18,0.9,法說會釋出強勁的營收與獲利展望，加上 3 奈米需求持續成長，激勵市場對台積電未來業績前景樂觀，推升正面情緒並帶動股價上漲。,2025-07-21 13:49:01,1
2024-04-19,0.1,台積電領軍大盤重挫千點，失守月線，市場情緒極度悲觀，短期內難以恢復信心。,2025-07-21 13:49:03,1
2024-04-21,0.1,外資大舉賣超並引發多殺多，技術面轉弱，加上地緣政治風險與聯準會降息延後等利空因素交織，市場情緒極度悲觀。,2025-07-21 13:49:04,1
2024-04-22,0.3,調薪幅度回歸常態反映公司獲利下滑，但維持一定水平仍有助留才，整體市場情緒中性偏正。,2025-07-21 13:49:05,1
2024-04-23,0.3,花蓮地震造成部分晶圓報廢與材料損耗，影響第二季毛利率，但目前營運未受重大衝擊，市場對短期營運前景仍持審慎態度。,2025-07-21 13:49:07,1
2024-04-24,0.9,電子權值全面反彈，AI 概念股與半導體族群領軍大漲，加上航空觀光等傳產類股助攻，激勵台股重返 2 萬點並收復短均線，市場情緒樂觀。,2025-07-21 13:49:08,1
2024-04-25,0.9,台積電設廠帶動西部投資、股市強勁與新青安政策等多重因素激勵房市信心，營建業景氣可望持續回溫。,2025-07-21 13:49:09,1
2024-04-26,0.9,電子股全面反彈，台積電領軍上攻，加上傳產類股同步走揚，激勵市場情緒向上，推升大盤強勁反彈。,2025-07-21 13:49:11,1
2024-04-28,0.3,外資回補台積電等個股但籌碼不穩定，加上重要財報與法說會陸續登場，市場情緒偏向中性。,2025-07-21 13:49:12,1
2024-04-29,0.9,權值龍頭台積電領軍大漲，加上觀光與營建等族群強勢表現，激勵市場情緒向上且成交量能回溫，有利多方續攻。,2025-07-21 13:49:13,1
2024-04-30,0.4,權值股普遍疲軟且尾盤遭殺，尤其是台積電與聯發科的表現不佳拖累大盤走勢，加上月線收黑，市場情緒偏向保守。,2025-07-21 13:49:15,1
2024-05-02,0.4,台積電股價下跌拖累大盤走勢，市場情緒偏向保守，但其他類股如營建、航空與觀光表現強勁，整體影響有限。,2025-07-21 13:49:16,1
2024-05-03,0.6,電子權值股領漲帶動大盤上揚，但 AI 股走勢分歧與部分族群漲多拉回使市場情緒偏向中性。,2025-07-21 13:49:17,1
2024-05-05,0.6,台積電設廠效應帶動高雄房市熱絡，營建股獲利看增，但漲幅已大且仍需觀察後續供需變化。,2025-07-21 13:49:19,1
2024-05-06,0.7,台積電等權值股領漲帶動大盤上揚，市場情緒偏正面，但個別族群表現分歧，AI 概念股強勢，散熱、IP 等則有壓力。,2025-07-21 13:49:20,1
2024-05-07,0.9,台積電領軍電子權值股強勢反彈，帶動加權指數開高走高，市場情緒樂觀，多頭氣盛。,2025-07-21 13:49:21,1
2024-05-08,0.6,市場情緒偏正面，電子權值股與重電族群領漲帶動指數上揚，但整體成交量仍然偏低。,2025-07-21 13:49:22,1
2024-05-09,0.3,台積電領軍權值股走勢疲軟拖累大盤，市場情緒偏空，但其他族群如航運、AI 等仍有表現，整體而言呈現高檔震盪格局。,2025-07-21 13:49:24,1
2024-05-10,0.9,4月營收大幅成長，顯示市場需求強勁且產能利用率維持高檔，激勵正面市場情緒與股價上漲動能。,2025-07-21 13:49:25,1
2024-05-13,0.6,財報季與市場情緒激勵下台股創高，但個股表現分歧，多空勢力角力使盤勢漲幅有限。,2025-07-21 13:49:27,1
2024-05-14,0.6,台積電支撐加權指數創新高，但缺乏後續買盤力道，加上選擇權市場與外資籌碼面偏空，多方信心薄弱且漲勢不紮實。,2025-07-21 13:49:28,1
2024-05-15,0.9,現金股利政策穩定、先進製程技術自主性高、歐洲新廠動土等正面訊息，強化市場對台積電未來成長前景的信心。,2025-07-21 13:49:29,1
2024-05-16,0.1,意外事件引發安全疑慮與營運風險，加上美國廠建置進度延宕，恐衝擊市場信心並拖累股價表現。,2025-07-21 13:49:30,1
2024-05-17,0.4,市場擔憂通膨降溫進展緩慢與美股下跌壓力，拖累台積電等電子權值股走勢，引發投資人信心動搖。,2025-07-21 13:49:32,1
2024-05-19,0.9,520 總統就職與輝達財報將牽動 AI 族群走勢，三大法人連四周買超創高，外資青睞台積電等權值股，股東會旺季與除息行情啟動有利多頭延續。,2025-07-21 13:49:33,1
2024-05-20,0.7,新任總統與副總統就職帶來政策方向變化，市場對綠色能源、AI 等相關產業展望樂觀，但權值股走勢分歧，整體漲幅有限。,2025-07-21 13:49:35,1
2024-05-21,0.6,520 政治因素干擾及外資籌碼動向使市場情緒波動，但指數支撐浮現且多方力道續航。,2025-07-21 13:49:36,1
2024-05-22,0.9,外資回頭大舉買超，顯示對台積電後市展望樂觀，激勵股價創高並帶動加權指數再度改寫收盤新猷。,2025-07-21 13:49:37,1
2024-05-23,0.9,台積電股價再創新高，帶動權值股全面走揚，激勵市場情緒與買氣回升。,2025-07-21 13:49:38,1
2024-05-24,0.5,台積電股價創新高後回檔，市場情緒維持中性，整體大盤走勢受權值股疲軟拖累。,2025-07-21 13:49:39,1
2024-05-27,0.9,台積電股價小幅上漲且創新高，顯示市場對其基本面與前景持正向看法。,2025-07-21 13:49:41,1
2024-05-28,0.6,台積電失守五日線壓抑市場信心，但整體大盤仍維持高檔，AI 概念股與機器人族群強勢表現支撐多頭氣勢。,2025-07-21 13:49:42,1
2024-05-29,0.3,電子權值股普遍下跌拖累大盤，但航運與觀光類股強勢上揚抵銷部分賣壓，市場情緒偏向中性。,2025-07-21 13:49:43,1
2024-05-30,0.6,AI 產業發展帶動用電需求上升，加上業界呼籲調整能源政策，凸顯供電穩定性對經濟發展的重要性。,2025-07-21 13:49:44,1
2024-05-31,0.4,台積電尾盤急殺拖累大盤重挫，顯示市場情緒受到權值股表現疲弱的負面影響。,2025-07-21 13:49:45,1
2024-06-02,0.9,輝達攜手台廠打造 AI 工廠與資料中心，顯示台灣供應鏈在生成式 AI 發展中的關鍵地位，激勵市場對相關概念股的正面情緒。,2025-07-21 13:49:47,1
2024-06-04,0.9,董事長對未來展望樂觀且全球擴廠進度順利，顯示公司營運前景光明，激勵市場情緒與股價上漲。,2025-07-21 13:49:48,1
2024-06-05,0.6,台積電股價走勢與大盤表現同步，權值股帶動指數上漲，但個別產業展望不明朗引發市場擔憂。,2025-07-21 13:49:49,1
2024-06-06,0.9,台積電領軍大漲帶動台股飆升，加上央行總裁看法偏正向，市場情緒樂觀，預期股價將維持強勢。,2025-07-21 13:49:51,1
2024-06-07,0.7,營收持續成長且年增率維持雙位數，顯示公司基本面強勁，激勵正面市場情緒。,2025-07-21 13:49:52,1
2024-06-10,0.6,市場對未來獲利成長持正向展望，但短期營收表現與外部環境不確定性仍影響市場情緒。,2025-07-21 13:49:53,1
2024-06-11,0.3,外資大舉賣超影響市場信心，雖然台積電領漲創高但終場翻黑收低，顯示短期多空力道拉鋸。,2025-07-21 13:49:54,1
2024-06-12,0.3,證交所公告台積電明日除息將影響指數約28.69點，雖然股價短期可能承壓，但整體市場情緒維持樂觀。,2025-07-21 13:49:55,1
2024-06-13,0.9,獲利能力提升與先進製程優勢可望轉化為價格調漲，外資看好 AI 需求帶動營收成長，激勵市場情緒向上。,2025-07-21 13:49:57,1
2024-06-14,0.9,台積電股價翻紅帶動大盤創高，多頭信心增強，加上權值股普遍走揚與傳產重電族群助攻，激勵市場情緒樂觀。,2025-07-21 13:49:58,1
2024-06-15,0.9,台積電支援與CoWoS擴產效益帶動晶圓測試訂單，顯著提升精材營收貢獻與獲利表現，激勵市場對未來成長前景的樂觀預期。,2025-07-21 13:49:59,1
2024-06-17,0.6,市場情緒偏正面，中小型股有望受惠權值股帶動，但需留意漲多個股的獲利了結壓力。,2025-07-21 13:50:01,1
2024-06-18,0.9,台積電領漲帶動大盤再創新高，半導體族群強勢表現與金融股買盤挹注市場信心，多頭氣盛。,2025-07-21 13:50:02,1
2024-06-19,0.9,台積電股價創高帶動大盤再寫新猷，權值股與半導體相關類股齊揚，市場情緒樂觀。,2025-07-21 13:50:03,1
2024-06-20,0.9,三大法人同步買超，外資大舉回補，顯示市場對台積電後市展望樂觀，激勵股價強勢上漲。,2025-07-21 13:50:04,1
2024-06-21,0.4,電子權值股普遍走跌拖累大盤，加上高價股與部分中小型股同步修正，市場情緒偏向保守。,2025-07-21 13:50:05,1
2024-06-22,0.3,鉅額違約交割事件引發市場擔憂投資人信心動搖，但整體而言對台積電股價影響有限，短期內仍將維持高檔震盪走勢。,2025-07-21 13:50:06,1
2024-06-23,0.6,台積電漲幅過大且技術面乖離擴大，加上輝達高檔轉弱，季底前風險增加，但多頭熱度仍在，補漲股有望輪動。,2025-07-21 13:50:08,1
2024-06-24,0.6,AI 產業前景樂觀與資金行情延續有利多頭，但市場波動難免，建議採取分散投資策略並利用定期定額降低風險。,2025-07-21 13:50:09,1
2024-06-25,0.6,電子權值股如台積電等反彈帶動加權指數收紅，但整體成交量能不足且類股表現分歧，市場情緒偏向中性。,2025-07-21 13:50:10,1
2024-06-26,0.9,多位分析師上修目標價與EPS預估，顯示市場對公司未來成長前景樂觀，激勵股價表現優於大盤。,2025-07-21 13:50:12,1
2024-06-27,0.3,權值股普遍走跌拖累大盤，雖有部分個股力守平盤但整體市場情緒偏向保守。,2025-07-21 13:50:13,1
2024-06-28,0.6,分析師調升目標價與評級多空比偏正面，但股價仍在合理區間內波動，市場對後市展望持審慎樂觀態度。,2025-07-21 13:50:14,1
2024-06-30,0.9,半導體 ETF 績效亮眼與產業前景樂觀激勵市場情緒，預期台積電等相關個股將受惠。,2025-07-21 13:50:15,1
2024-07-01,0.4,台積電股價上漲但市場情緒仍偏向保守，主要受到整體大盤走勢與個別產業表現不一的影響。,2025-07-21 13:50:16,1
2024-07-02,0.9,多位分析師調升目標價與樂觀評級顯示市場對公司基本面前景看好，激勵正面市場情緒。,2025-07-21 13:50:17,1
2024-07-03,0.6,鮑爾鴿聲激勵美股漲勢延續至台股，權值股如台積電領漲帶動大盤上揚，但個股表現分歧。,2025-07-21 13:50:19,1
2024-07-04,0.9,CoWoS 和 SoIC 產能滿載與蘋果採用帶動營運成長，加上先進封裝解決方案領先地位鞏固，激勵市場情緒樂觀。,2025-07-21 13:50:20,1
2024-07-05,0.9,權值股表現平穩，AI 與光電族群強勢上漲，激勵市場情緒樂觀，推升大盤指數走高。,2025-07-21 13:50:21,1
2024-07-06,0.7,分析師普遍樂觀且上修目標價，顯示市場對公司基本面與未來成長前景持正向看法。,2025-07-21 13:50:22,1
2024-07-07,0.6,多因子策略與 ETF 結構提供較穩健的投資組合，搭配 AI 產業成長趨勢有利於中長期報酬表現。,2025-07-21 13:50:23,1
2024-07-08,0.9,市值突破兆美元與獲利成長展望樂觀帶動市場情緒向上，股價創新高。,2025-07-21 13:50:24,1
2024-07-09,0.6,技術面乖離過大與外資賣超壓力使短期市場情緒轉趨謹慎，但基本面利多如法說行情與高股息支撐下，預計波動加劇但仍有反彈契機。,2025-07-21 13:50:26,1
2024-07-10,0.6,營收年增率持續成長且維持高位，市場對公司基本面展望樂觀，但月減幅度擴大引發短期獲利了結賣壓。,2025-07-21 13:50:27,1
2024-07-11,0.9,多位分析師上修目標價與樂觀評級，顯示市場對台積電基本面前景看好，激勵股價表現優於大盤。,2025-07-21 13:50:28,1
2024-07-12,0.4,美股重挫拖累台股大跌，權值股全面修正，雖有部分傳產股抗跌但整體市場情緒偏空。,2025-07-21 13:50:29,1
2024-07-13,0.6,台積電受惠於台灣股市強勢上漲，市場情緒正面，但中國新興市場地位被挑戰可能對整體區域產生負面影響。,2025-07-21 13:50:30,1
2024-07-14,0.3,台積電法說會將登場，市場對其展望存在不確定性，加上外資賣超及美聯準會降息訊號已提前反應，短期內股價波動加劇的風險增加。,2025-07-21 13:50:32,1
2024-07-15,0.6,市場情緒受到川普遇襲事件與台積電走勢疲弱的影響而轉為中性，惟整體仍維持小幅上漲態勢。,2025-07-21 13:50:33,1
2024-07-16,0.6,台積電股價走揚且扮演撐盤要角，加上營建類股強勢表現帶動市場情緒，但整體漲幅有限，顯示對未來展望仍持審慎態度。,2025-07-21 13:50:34,1
2024-07-17,0.6,證交所放寬高價股波動幅度規定有利市場穩定，但台積電等權值股下跌拖累大盤，整體市場情緒偏向中性。,2025-07-21 13:50:35,1
2024-07-18,0.1,地緣政治風險升溫引發市場恐慌，台積電股價大跌並拖累千金股與半導體類股走勢，顯示投資人對未來展望的擔憂。,2025-07-21 13:50:37,1
2024-07-19,0.9,法說會釋出正面展望與獲利上修激勵市場信心，營收成長預期強勁且資本支出增加，外資調升目標價，但地緣政治風險意識抬高壓抑短線漲幅。,2025-07-21 13:50:38,1
2024-07-21,0.3,台積電法說會釋出正面訊息但外資大舉賣超，市場信心受挫，加上川普言論牽動短線波動，整體市場情緒偏向保守。,2025-07-21 13:50:40,1
2024-07-22,0.1,拜登退選再度增添美國年底選舉不確定性，加上台股重挫超過 600 點，衝擊市場信心，權值股全面下跌，包括 台積電 在內的多檔個股回測季線支撐，整體走勢疲弱。,2025-07-21 13:50:41,1
2024-07-23,0.6,新台幣升值與美國總統宣布退選緩解政治風險，市場情緒趨穩但需留意財報季與經濟數據的影響。,2025-07-21 13:50:42,1
2024-07-24,0.7,分析師普遍上修目標價與樂觀評級，顯示對公司基本面前景看好，但股價仍受大盤影響而無明顯表現。,2025-07-21 13:50:44,1
2024-07-25,0.9,大陸客戶搶購晶片以應對地緣政治風險，激勵市場情緒與股價上漲。,2025-07-21 13:50:45,1
2024-07-26,0.3,美股重挫與台股休市期間國際情勢動盪引發市場恐慌，權值電子領跌加劇賣壓，但房產族群抗跌支撐盤面。,2025-07-21 13:50:46,1
2024-07-27,0.6,法說會釋出正面展望與營運成長動能，加上外銷訂單連四紅支撐市場信心，但台積電拖累大盤重挫影響整體情緒。,2025-07-21 13:50:47,1
2024-07-28,0.3,市場信心受創，指數大幅回檔，權值股遭外資提款，短期內籌碼面與獲利了結賣壓仍在，但美股反彈與融資減肥有助穩盤。,2025-07-21 13:50:49,1
2024-07-29,0.9,權值股強勁反彈與營建、金融族群領漲帶動大盤大幅上揚，市場情緒轉趨樂觀。,2025-07-21 13:50:50,1
2024-07-31,0.3,7月台股大跌，外資賣超創史上第二高，市場信心受挫，但考量基本面穩健且已反映利空，短期內仍有反彈契機。,2025-07-21 13:50:52,1
2024-08-01,0.9,散戶投資人對護國神山信心增強，激勵市場情緒走揚，但須留意後續營運表現與外在環境變化的影響。,2025-07-21 13:50:53,1
2024-08-02,0.1,市場對半導體產業展望的疑慮加劇，美國出口管制規定、輝達併購案調查等負面因素疊加，加上台積電領跌，引發投資人擔憂，拖累整體股價表現。,2025-07-21 13:50:54,1
2024-08-04,0.1,大盤跌破季線且融資水位高，外資持續賣超並使新台幣貶值，加劇多殺多風暴與市場負面情緒。,2025-07-21 13:50:56,1
2024-08-05,0.1,市場恐慌情緒升溫、半導體類股重挫拖累台積電走勢，營收與展望不確定性籠罩整體產業前景。,2025-07-21 13:50:57,1
2024-08-06,0.3,台積電因近期股價波動劇烈被列入注意股票，市場情緒偏向保守，但整體影響有限。,2025-07-21 13:50:58,1
2024-08-07,0.9,台股大漲，權值股領軍上攻，市場情緒樂觀，多頭氣勢強勁。,2025-07-21 13:50:59,1
2024-08-08,0.1,台積電股價重挫、電子權值股全面下跌，拖累大盤再度失守21000點關卡，市場情緒轉趨悲觀。,2025-07-21 13:51:00,1
2024-08-09,0.9,營收表現亮眼，年增率持續成長且月增率大幅回升，顯示公司基本面強勁，激勵市場情緒向上。,2025-07-21 13:51:01,1
2024-08-11,0.9,營收創高與展望樂觀激勵市場情緒，投信法人青睞龍頭股，AI 題材持續發酵。,2025-07-21 13:51:03,1
2024-08-12,0.6,台積電股價上漲但成交量縮減，顯示市場觀望氣氛濃厚，對未來走勢持中性態度。,2025-07-21 13:51:04,1
2024-08-13,0.7,台積電權重調升與尾盤翻紅帶動指數上漲，但整體電子股走勢分歧，非電族群普遍疲軟，市場情緒偏向中性。,2025-07-21 13:51:05,1
2024-08-14,0.7,通膨數據降溫與市場樂觀預期聯準會降息，提振美股與台積電等電子權值股表現，激勵正面市場情緒。,2025-07-21 13:51:06,1
