date,factor,explanation,updated_time,news_count
2022-11-01,0.6,大盤指數回升至萬三之上，電子權值股普遍走揚，金融與傳產也有撐盤表現，整體市場情緒偏正面。,2025-07-21 13:39:53,1
2022-11-02,0.6,電子權值股普遍收紅，尤其是台積電強勢翻紅帶動大盤上漲，顯示市場情緒回溫，但部分傳產與金融類股仍偏弱勢，整體而言市場信心略有改善但尚未完全恢復。,2025-07-21 13:39:54,1
2022-11-03,0.3,市場情緒轉趨樂觀但 Fed 暗示考慮暫停升息仍言之過早，美股重挫將為台股帶來壓力。,2025-07-21 13:39:55,1
2022-11-04,0.6,電子權值股跌勢收斂與航運、金融撐盤帶動加權指數翻紅，顯示市場情緒有所回溫，但三大法人合計賣超仍影響整體信心。,2025-07-21 13:39:57,1
2022-11-07,0.9,美股強彈激勵台股續揚，電子權值領漲、金融傳產助陣，市場信心回溫推升指數突破短期均線。,2025-07-21 13:39:58,1
2022-11-08,0.9,美股反彈激勵加權指數大漲逾百點，半導體、航運族群領軍衝鋒，台積電強勢上漲 2%，帶動市場情緒轉趨樂觀。,2025-07-21 13:40:00,1
2022-11-09,0.9,基本面展望穩健且股價反彈，市場情緒樂觀並推升股價上漲。,2025-07-21 13:40:00,1
2022-11-10,0.6,美債殖利率走高與加密貨幣遭拋售引發市場波動，但台積電未受影響，短期均線翻揚並封閉跳空缺口，顯示止穩訊號明確。,2025-07-21 13:40:02,1
2022-11-11,0.9,"美股大漲激勵 ADR 同步飆漲，營收持續成長與通膨降溫訊息助攻市場信心，推升股價強彈。

====================",2025-07-21 13:40:03,1
2022-11-12,0.7,營收持續成長與新廠設廠計畫利多激勵市場信心，但部分擴產調整傳言仍引發短期波動。,2025-07-21 13:40:04,1
2022-11-14,0.6,展望未來多頭仍有表現空間，個股輪動行情可把握，但需留意短線技術指標超買賣的情況。雙11購物節專案活動結束，提醒留意相關個股的後續走勢。,2025-07-21 13:40:06,1
2022-11-15,0.9,巴菲特加持與技術面突破帶動強勁反彈，市場信心回升但仍需關注後續基本面發展。,2025-07-21 13:40:07,1
2022-11-16,0.9,ADR 大漲超過 10% 與夜盤走揚顯示市場情緒樂觀，惟需留意期貨結算與地緣政治風險。,2025-07-21 13:40:08,1
2022-11-17,0.3,美光釋出利空訊息衝擊半導體股表現，但台灣廠商受惠於最先進製程擴產，且產創條例修法通過將為護國神山等龍頭企業帶來助益，市場情緒呈現中性偏多。,2025-07-21 13:40:10,1
2022-11-18,0.3,台版晶片法案通過有利半導體產業，但市場觀望氣氛濃厚、外資調節及電子指數漲多恐引發獲利了結賣壓，短期內難以擺脫震盪整理走勢。,2025-07-21 13:40:11,1
2022-11-19,0.7,產創條例修法利多與先進製程投資策略有助提升市場信心，但短期營收表現疲弱壓抑股價漲幅。,2025-07-21 13:40:12,1
2022-11-20,0.9,巴菲特大舉買入台積電 ADR 引發市場熱議，多檔 ETF 持股比重超過 35%，顯示其受青睞程度，激勵正面投資情緒。,2025-07-21 13:40:14,1
2022-11-21,0.3,台積電股價下跌與量能萎縮引發市場信心動搖，短期內整體盤勢呈現震盪走低態勢。,2025-07-21 13:40:15,1
2022-11-22,0.6,市場情緒維持區間整理，雖然台積電帶動指數上漲但多頭家數降溫，外銷訂單衰退恐影響營收表現。,2025-07-21 13:40:16,1
2022-11-23,0.6,市場反彈與鴻海延攬台積電人才有助提振信心，但非蘋手機銷售疲弱及產業庫存壓力仍在，短期內對整體市場情緒帶來中性影響。,2025-07-21 13:40:18,1
2022-11-24,0.6,市場情緒維持正面，指數創高但個股族群仍有轉弱現象，類股輪動狀態與強勢族群將是關鍵。,2025-07-21 13:40:19,1
2022-11-25,0.6,台積電等電子權值股疲弱拖累大盤，但電動車概念股與半導體測試介面族群強勢上漲，整體市場情緒偏向正面但仍有震盪疑慮。,2025-07-21 13:40:20,1
2022-11-26,0.6,鴻海延攬前台積電共同營運長擔任半導體策略長，市場解讀為強化集團半導體實力，但郭台銘重申不會複製台積電模式，聚焦利基、下一代材料與新一代製程封裝，並著重汽車應用，引發市場對未來發展方向的疑慮。,2025-07-21 13:40:22,1
2022-11-27,0.9,外資回流、指數反彈與多頭格局延續，激勵市場情緒樂觀並推升股價上揚。,2025-07-21 13:40:23,1
2022-11-28,0.3,選後政治風險與漲多修正壓力疊加，市場情緒偏向謹慎，但整體維持中性看待。,2025-07-21 13:40:24,1
2022-11-29,0.3,台積電股價疲弱拖累大盤指數失守14500點關卡，市場情緒偏空，但類股表現分歧，顯示整體影響有限。,2025-07-21 13:40:26,1
2022-11-30,0.6,市場情緒偏正面，指數創反彈新高且量能放大，但台積電漲幅有限，顯示個股表現仍有待觀察。,2025-07-21 13:40:27,1
2022-12-01,0.9,美股大漲激勵台積電股價跳空開高突破 500 元關卡，市值重返 13 兆元，展望樂觀與重要人士到場參與典禮助長市場信心。,2025-07-21 13:40:28,1
2022-12-02,0.6,台積電董座對台灣供電問題表達擔憂引發關注，再生能源題材點火帶動相關概念股強勢上漲。,2025-07-21 13:40:30,1
2022-12-03,0.3,缺電議題帶動相關概念股表現，但公司基本面仍需進一步強化以支撐長期市場信心。,2025-07-21 13:40:31,1
2022-12-04,0.6,12 月通常漲多跌少且資金行情升溫，惟個股基本面將成為本周市場關注焦點，預期呈現個股表態格局。,2025-07-21 13:40:32,1
2022-12-05,0.6,台積電相關供應鏈漲勢啟動，帶動市場情緒偏正面，但整體大盤仍維持震盪走高格局。,2025-07-21 13:40:33,1
2022-12-06,0.6,雖然外資淨匯入創高且台積電站穩短均線之上，但美股重挫與經濟數據引發升息擔憂恐影響市場信心，預期大盤將承壓。,2025-07-21 13:40:35,1
2022-12-07,0.9,台積電加碼美國廠投資至 400 億美元，展現對美國市場的長期承諾與信心，同時也反映出全球半導體供應鏈重組的大趨勢，預計將為公司帶來新的成長動能。,2025-07-21 13:40:36,1
2022-12-08,0.3,權值股走勢疲弱拖累指數回測月線，市場觀望修正後的反彈行情。,2025-07-21 13:40:37,1
2022-12-09,0.9,營收創高且全年財測可望達陣，顯示公司基本面強勁，激勵市場情緒向上並推升股價。,2025-07-21 13:40:38,1
2022-12-11,0.3,台積電除息與聯準會利率決策將左右短期股價波動，除息行情能否延續有待觀察。,2025-07-21 13:40:40,1
2022-12-12,0.4,台積電遭遇沉重賣壓，股價大跌影響市場情緒，但整體而言仍維持中性看待。,2025-07-21 13:40:41,1
2022-12-13,0.3,市場情緒受到 CPI 數據公布前賣壓影響，台積電 跌幅有限且權重貢獻下跌點數，整體呈現中性偏空走勢。,2025-07-21 13:40:42,1
2022-12-14,0.9,"除息交易與填息預期帶動正面市場情緒，股價強勁反彈。

====================

以下是提供的新聞資訊 :
台積電 (2330-TW) 今 (14) 日召開法說會，總裁 C.C. Wei 表示，第 4 季美元營收將介於 119-121 億美元，季減 5.8-7.1%，毛利率介於 59-61%，營益率介於 49-51%，全年美元營收成長 30%。台積電預估，第 4 季美元營收將介於 119-121 億美元，季減 5.8-7.1%，毛利率介於 59-61%，營益率介於 49-51%，全年美元營收成長 30%。台積電表示，第 4 季在產能利用率方面將與第 3 季相當，客戶庫存調整預計延續到明年上半年，但車用、工控等非消費性產品需求依舊強勁，且 AI、HPC 等高效能運算需求也持續成長。台積電指出，目前看來 2023 年全球經濟成長將放緩，預期半導體產業將面臨溫和的下滑，但台積電仍將專注於技術領先地位，並透過製程、封裝技術創新以維持競爭優勢。台積電強調，公司已在 3 奈米製程取得良好進展，預計明年下半年量產，2 奈米製程也將於 2025 年如期推出。

台積電法說會後，外資圈普遍維持對台積電的正向投資建議，其中有 4 家調升目標價，最高為 720 元，最低為 550 元。",2025-07-21 13:40:48,1
2022-12-15,0.6,外資買超、股東人數增加與營收創高等正面因素抵銷聯準會鷹派言論的負面影響，市場對除息行情仍抱持樂觀期待。,2025-07-21 13:40:50,1
2022-12-16,0.3,升息壓力與外資放假影響台股動能，權值股如台積電表現疲弱，市場信心偏向保守。,2025-07-21 13:40:51,1
2022-12-17,0.9,高層主管大舉買進自家股票顯示對未來營運樂觀，激勵市場情緒與股價上漲。,2025-07-21 13:40:52,1
2022-12-18,0.6,市場情緒偏中性，短期內雖有個股輪動漲勢但整體走勢仍受外資賣超、美股財報等因素影響，年底前法人和大戶拚績效下個股表現仍具操作空間。,2025-07-21 13:40:53,1
2022-12-19,0.4,美股持續下跌與外資提前結帳壓力加劇，台積電面臨中性偏空的市場情緒。,2025-07-21 13:40:55,1
2022-12-20,0.6,市場情緒受到聯準會鷹派言論影響而轉趨保守，半導體與金融類股承壓，但鋼鐵與航運類股逆勢上揚，整體盤勢呈現區間震盪。,2025-07-21 13:40:56,1
2022-12-21,0.1,外資休假與資金流出壓力加上電子權值股疲弱，拖累台積電等大型股走勢，市場信心受挫，短期內股價面臨下探季線的風險。,2025-07-21 13:40:57,1
2022-12-22,0.9,"ADR 強彈帶動股價反彈、市值重返兆元，加上傳言擴廠計畫不變，市場對營運前景樂觀。

====================",2025-07-21 13:40:59,1
2022-12-23,0.3,美元走強與美股大跌引發市場擔憂，半導體族群承受較大賣壓，但特斯拉訂單利多提振台積電表現，電子權值股面臨雙重挑戰。,2025-07-21 13:41:00,1
2022-12-26,0.3,大盤走勢疲弱且技術指標偏空，加上外資休假與電子產業庫存去化壓力，短期內台股恐陷入整理，但國安基金信心喊話有助穩定市場。,2025-07-21 13:41:02,1
2022-12-27,0.6,電子權值股與觀光族群領漲帶動大盤上揚，但台積電尾盤漲幅收斂，航運股也出現賣壓，使得指數漲幅縮小。,2025-07-21 13:41:03,1
2022-12-28,0.3,權值股普遍走跌拖累大盤，台積電領跌失守季線支撐，但觀光類股強勁反彈提供資金避風港。,2025-07-21 13:41:04,1
2022-12-29,0.3,市場憂心中國疫情升溫衝擊全球經濟，加上外資放假導致資金動能疲軟，拖累台股走低，權王台積電領跌，多頭缺乏助燃火種，大盤面臨 14000 點關卡保衛戰。,2025-07-21 13:41:06,1
2022-12-30,0.3,雖然台積電展現技術領先優勢與產能擴張決心，但股價走弱、市值縮水及法說會前觀望氣氛仍壓抑市場信心，短期內難以激勵正面情緒。,2025-07-21 13:41:07,1
2023-01-01,0.3,CES 展與台股開紅盤帶來關注，但市場觀望氣氛濃厚，加上出口表現疲軟，短期內市場情緒偏向中性。,2025-07-21 13:41:09,1
2023-01-02,0.7,在手訂單維持高檔與大客戶擴產計畫支撐下，市場對公司未來營收成長前景樂觀，但半導體產業趨緩仍帶來一定不確定性。,2025-07-21 13:41:10,1
2023-01-03,0.6,權值股走勢分歧，台積電領軍反彈帶動大盤翻紅，但鴻海等其他指標股疲弱，市場情緒偏向中性。,2025-07-21 13:41:11,1
2023-01-04,0.3,外資買超傳產與金融股但賣超權值股，籌碼面土洋對作使市場觀望氣氛濃厚，台積電法說會將影響後市走勢。,2025-07-21 13:41:13,1
2023-01-05,0.6,法說會釋出保守展望與庫存調整壓力持續，加上總經環境不佳，短期內市場情緒偏向中性偏空。,2025-07-21 13:41:14,1
2023-01-06,0.6,電子族群資金回流與個股利空不跌激勵市場情緒，半導體、IC設計、面板及載板類股領漲。,2025-07-21 13:41:15,1
2023-01-08,0.3,營收、法說等重大事件接連登場，市場關注度提高，但展望保守與獲利衰退壓力仍在，短期內市場情緒偏向中性。,2025-07-21 13:41:16,1
2023-01-09,0.6,美股反彈激勵加上題材個股與中小型股表現強勁，預期大盤指數將重新站回月線之上，但電子股仍面臨庫存去化等利空因素影響。,2025-07-21 13:41:18,1
2023-01-10,0.3,營收表現符合預期但需求前景轉弱與產能利用率下滑壓抑市場信心，法說會釋出訊息將左右後市走勢。,2025-07-21 13:41:19,1
2023-01-11,0.3,電子股普遍走勢疲軟，尤其是權值龍頭台積電下挫影響市場信心，但部分個股如聯發科仍維持強勁表現，金融與傳產族群也出現賣壓，整體而言市場情緒偏向保守。,2025-07-21 13:41:21,1
2023-01-12,0.3,台積電法說前觀望氣氛濃厚，市場情緒偏向保守，股價呈現狹幅震盪，整體影響有限。,2025-07-21 13:41:22,1
2023-01-13,0.9,台積電法說會後外資大舉買超，激勵股價上漲並帶動加權指數走揚，顯示市場對公司基本面與營運展望持正向看待。,2025-07-21 13:41:23,1
2023-01-16,0.6,市場情緒溫和偏多，權值股領漲加上中小型業績題材股表現強勁，但技術面仍須留意半年線轉壓的潛在風險。,2025-07-21 13:41:25,1
2023-01-17,0.3,電子權值股表現疲弱，航運與觀光類股撐盤有限，市場情緒偏空但跌幅有限，顯示投資人對後市仍抱持一定期待。,2025-07-21 13:41:26,1
2023-01-18,0.6,基本面展望樂觀且產業前景穩健，激勵市場對未來營運成長的正向期待。,2025-07-21 13:41:27,1
2023-01-19,0.3,需求放緩與產業庫存調整壓力加劇，短期營收展望疲弱引發市場信心動搖，但先進製程優勢仍可望支撐基本面韌性。,2025-07-21 13:41:29,1
2023-01-22,0.9,半導體產業展望樂觀、台積電海外擴廠帶動廠務工程需求強勁，訂單能見度高且供應鏈轉移趨勢確立，激勵市場對相關個股的正面情緒。,2025-07-21 13:41:31,1
2023-01-27,0.6,檢測分析產業受惠先進製程、車用電子等強勁需求支撐，擴產計畫持續進行，展現對未來成長的樂觀預期。,2025-07-21 13:41:32,1
2023-01-30,0.9,美科技股強彈與 AI 訂單挹注提振市場信心，外資回頭買超，加上中美晶片戰利台積電轉單效應，多項正面因素激勵開紅盤行情。,2025-07-21 13:41:35,1
2023-01-31,0.3,台積電股價大跌拖累指數回測年線，市場信心受到衝擊，但整體走勢仍維持高檔，預期在 FOMC 會議結果出爐前，盤勢將呈現區間震盪。,2025-07-21 13:41:37,1
2023-02-01,0.7,市場情緒受惠於美國升息趨緩、亞股走強及解封概念股表現，整體呈現正面但仍有壓力。,2025-07-21 13:41:38,1
2023-02-02,0.6,彈性上班制度引發討論並改造辦公室空間帶來新商機，市場對於友達營運模式轉型持正面期待。,2025-07-21 13:41:39,1
2023-02-03,0.6,台積電止穩帶動大盤翻紅收高，顯示市場信心獲得支撐，但個股漲跌分歧仍大，整體情緒維持溫和樂觀。,2025-07-21 13:41:40,1
2023-02-06,0.6,新聞內容對台積電的市場情緒與股價波動影響呈現中性偏正面，主要原因是半導體產業展望穩健、公司基本面強勁，以及外資持續回流亞洲。,2025-07-21 13:41:42,1
2023-02-07,0.3,外資大舉買超後轉賣壓抑市場信心，加上美股走低、中國晶圓廠搶購設備等利空因素，短期內台積電股價恐承受修正壓力。,2025-07-21 13:41:43,1
2023-02-08,0.9,美股四大指數全面上漲，道瓊、那指均大漲超過 200 點，台積電 ADR 走揚，加上鮑爾釋出鷹鴿訊號，市場樂觀反應，預期台股可望重返向上格局。,2025-07-21 13:41:45,1
2023-02-09,0.3,權值股普遍疲弱拖累大盤表現，但部分族群如軍工概念、儲能電池與 AI 軟體指標仍有支撐，整體市場情緒偏向保守。,2025-07-21 13:41:46,1
2023-02-10,0.9,營收表現符合預期、2奈米進度超前與擴廠計畫利多交織，激勵市場情緒向上且股價走揚。,2025-07-21 13:41:47,1
2023-02-13,0.1,新台幣貶值與加權指數下跌拖累台積電等晶圓雙雄走勢，市場信心受挫，引發整體股市情緒轉趨保守。,2025-07-21 13:41:49,1
2023-02-14,0.7,員工激勵方案擴大釋出正面訊號，反映公司對未來成長前景的信心，提振市場情緒。,2025-07-21 13:41:50,1
2023-02-15,0.3,台積電股價大跌拖累加權指數回檔，但解封概念股與面板族群表現強勁，中小型個股撐盤有限。,2025-07-21 13:41:51,1
2023-02-16,0.3,台積電 ADR 下跌拖累加權指數走弱，但電子股仍獲得較高資金分配比重，半導體產業不確定性升高及消費性產品銷售疲弱等因素影響大盤表現。,2025-07-21 13:41:53,1
2023-02-17,0.3,美股下挫與台積電 ADR 跌幅擴大引發市場恐慌，但車用晶片廠擴產計畫、聯發科新品發表等利多因素仍在，整體市場情緒偏向保守。,2025-07-21 13:41:54,1
2023-02-20,0.6,電子權值股走勢分歧，金控股與航空股領軍上攻，帶動大盤黑翻紅、收復五日線，但整體漲幅有限，市場情緒偏向中性。,2025-07-21 13:41:56,1
2023-02-21,0.3,電子權值股走勢疲弱拖累指數，傳產族群如塑化、貨櫃航運及部分金融股力挺，但整體市場情緒仍偏向保守。,2025-07-21 13:41:57,1
2023-02-22,0.3,美債殖利率飆升、地緣政治緊張局勢以及零售巨頭財測不佳等多重利空因素衝擊美股，台股今日恐同步修正回測月線支撐。,2025-07-21 13:41:58,1
2023-02-23,0.6,雖然部分員工對赴美設廠存有疑慮，但台積電強調將加強內部培訓以促進全球人才共融，並重視多元觀點，整體展現出積極面對挑戰的態度，有助於穩定市場信心。,2025-07-21 13:42:00,1
2023-02-24,0.3,權值股普遍走弱，尤以半導體龍頭台積電跌幅最重，拖累大盤失守季線，市場情緒偏空但高價股撐盤有限。,2025-07-21 13:42:01,1
2023-02-25,0.8,AI 應用需求強勁帶動ASIC業者成長，創意擁有先進製程與封裝產能優勢，股價持續上攻突破歷史新高。,2025-07-21 13:42:03,1
2023-03-01,0.6,台積電股價在美國 ADR 下跌影響下走弱，但大盤仍受其他權值股與族群題材支撐維持高檔震盪，顯示市場信心尚未動搖。,2025-07-21 13:42:04,1
2023-03-02,0.4,市場情緒受到晶圓雙雄走勢疲弱與獲利表現不佳的影響而轉為負面，但航運、中小型股等族群撐盤，整體漲跌互見。,2025-07-21 13:42:06,1
2023-03-03,0.9,員工平均薪資創高且獲利表現亮眼，顯示公司營運與人才留任能力強勁，激勵市場正面情緒。,2025-07-21 13:42:07,1
2023-03-06,0.9,權王領軍大漲、多頭指標全面點火，加上資金比重攀升與量能放大，市場情緒樂觀且信心恢復。,2025-07-21 13:42:08,1
2023-03-07,0.7,台積電領軍大盤上漲，多方攻勢再起，電子、金融及傳產股輪流點火，指數將進一步向上挑戰 15900 點。,2025-07-21 13:42:10,1
2023-03-08,0.3,權值股普遍走跌拖累大盤，但儲能、LED、IC 設計等族群逆勢上揚，顯示部分中小型股仍有資金青睞，整體市場情緒偏向保守。,2025-07-21 13:42:11,1
2023-03-09,0.3,權值股表現分歧，面板雙虎與電力供應概念股遭賣壓調節，但高價股與航運股撐盤有限，大盤開高走低下跌，市場情緒偏向保守。,2025-07-21 13:42:12,1
2023-03-10,0.1,台積電領跌權值股拖累大盤走勢，短期市場情緒偏空，投資人信心受挫。,2025-07-21 13:42:13,1
2023-03-12,0.4,市場觀望氣氛濃厚，個股表現分歧，漲多股面臨獲利了結賣壓，整體市場情緒偏向中性。,2025-07-21 13:42:15,1
2023-03-13,0.3,兩大利基藥品成長動能強勁有望推升營收毛利率表現，惟市場關注度有限且缺乏明確時間點，整體市場情緒溫和偏多但不熱絡。,2025-07-21 13:42:16,1
2023-03-14,0.3,矽谷銀行危機引發市場擔憂，權值股普遍下跌，但太陽能與生技族群撐盤，加密貨幣行情翻揚帶動板卡類股有撐，整體市場情緒偏向中性。,2025-07-21 13:42:18,1
2023-03-15,0.3,多檔個股除息影響指數表現，市場觀望氣氛濃厚且美股走勢不明朗，整體市場情緒偏向中性。,2025-07-21 13:42:19,1
2023-03-16,0.3,瑞信事件引發的系統性風險與升息疑慮籠罩市場，拖累台積電除息首日表現，但利空因素逐漸淡化，短期內市場情緒仍偏向保守觀望。,2025-07-21 13:42:21,1
2023-03-17,0.9,除息填息順利且外資態度轉趨樂觀，顯示市場對台積電基本面與獲利前景仍有信心。,2025-07-21 13:42:22,1
2023-03-20,0.6,美股下跌壓抑短期市場信心，但台積電 ADR 上漲及族群題材支撐，整體展望中性偏正面。,2025-07-21 13:42:23,1
2023-03-21,0.9,美股反彈激勵台股大漲，權值股普遍走強，加上電動車、儲能等概念股續揚，市場情緒樂觀，推升指數突破 15500 點。,2025-07-21 13:42:24,1
2023-03-22,0.9,權值股領軍大漲、多頭指標高價股強勢表現以及輝達概念股爆發，顯示市場情緒樂觀且信心回穩，推升台股突破月線並挑戰前波高點。,2025-07-21 13:42:26,1
2023-03-23,0.9,熱錢湧入台股，指數大漲創 9 個月新高，多檔個股強勢表現，顯示市場情緒樂觀且對後市信心回升。,2025-07-21 13:42:27,1
2023-03-24,0.3,市場情緒偏中性，雖然美股反彈但台積電領跌，權值股漲跌互見，缺乏主流股帶動。,2025-07-21 13:42:28,1
2023-03-26,0.6,市場情緒趨冷卻與獲利結帳壓力使行情觀望氣氛濃厚，但投信作帳與部分個股漲勢仍支撐中性偏多走勢。,2025-07-21 13:42:30,1
2023-03-27,0.4,電子權值股普遍走跌，尤其是晶圓代工龍頭台積電下挫，拖累大盤失守五日線，市場情緒偏向保守。,2025-07-21 13:42:31,1
2023-03-28,0.3,市場情緒偏中性，整體格局呈現上有壓、下有撐，短期恐維持震盪走勢，靜待量能明顯放大。,2025-07-21 13:42:33,1
2023-03-29,0.6,儘管美股四大指數收跌，但台積電等權值股反彈帶動加上觀光類股與散熱雙雄強勢表現，整體市場情緒偏正面。,2025-07-21 13:42:34,1
2023-03-30,0.3,美國晶片法案補助附帶條件引發疑慮，恐影響台積電營運與獲利分潤，短期市場情緒偏向保守。,2025-07-21 13:42:35,1
2023-04-01,0.6,"劉德音針對美國補貼法案表達部分不滿意見，但仍將與美方溝通調整，市場對台積電在全球半導體地位的影響持審慎樂觀態度。聯發科呼籲政府集中資源發展 IC 設計產業，凸顯台灣半導體生態系面臨轉型需求，引發市場關注未來政策方向。

0.5
永豐金首席經濟學家黃蔭基預期台股高點將上演藍寶堅尼行情，其中若走大牛行情可望上看萬七，但仍需觀察歐美銀行風暴對市場的持續影響。央行升息半碼，青安房貸一段式利率攀升至 2.025%，揮別 1 字頭利率時代。

0.7
蘋果 WWDC 將於台灣時間 6/6 凌晨舉行，有望揭曉 MR 頭戴式裝置，引發市場期待。鮑爾在私人會議上透露預計今年還會升息一次，反映美聯儲對通膨的謹慎態度。

0.4
群聯考慮到馬來西亞設研發中心，顯示台灣 IC 產業面臨人才短缺問題。 大同子公司躍特斯拉充電樁最大建置廠，今年訂單跳增 3 倍，凸顯能源事業成長潛力。

0.6
整體而言，台積電董事長劉德音針對美國補貼法案表達部分不滿意見，但仍將與美方溝通調整，市場對台積電在全球半導體地位的影響持審慎樂觀態度。聯發科呼籲政府集中資源發展 IC 設計產業，凸顯台灣半導體生態系面臨轉型需求，引發市場關注未來政策方向。永豐金首席經濟學家黃蔭基預期台股高點將上演藍寶堅尼行情，其中若走大牛行情可望上看萬七，但仍需觀察歐美銀行風暴對市場的持續影響。央行升息半碼，青安房貸一段式利率攀升至 2.025%，揮別 1 字頭利率時代。蘋果 WWDC 將於台灣時間 6/6 凌晨舉行，有望揭曉 MR 頭戴式裝置，引發市場期待。鮑爾在私人會議上透露預計今年還會升息一次，反映美聯儲對通膨的謹慎態度。群聯考慮到馬來西亞設研發中心，顯示台灣 IC 產業面臨人才短缺問題。大同子公司躍特斯拉充電樁最大建置廠，今年訂單跳增 3 倍，凸顯能源事業成長潛力。整體而言，市場情緒維持中性偏正面，預期台積電股價將呈現溫和上漲趨勢，但仍需密切關注國際政經局勢與產業發展動向的變化。",2025-07-21 13:42:46,1
2023-04-05,0.3,營收表現符合預期但仍年減，市場對後續需求展望持保守態度，短期股價波動風險增加。,2025-07-21 13:42:47,1
2023-04-06,0.3,市場信心受美國經濟疑慮與電子權值股疲弱影響，台積電等大型股走勢偏空，但航運、生技族群逆勢抗跌，整體市場情緒略為悲觀。,2025-07-21 13:42:49,1
2023-04-07,0.6,台積電尾盤拉升帶動大盤小幅上漲，但整體成交量能萎縮且個股表現分歧，市場情緒維持謹慎觀望。,2025-07-21 13:42:50,1
2023-04-10,0.3,營收表現低於預期，季減幅度擴大引發市場疑慮，但仍維持中性展望，等待法說會釐清全年前景。,2025-07-21 13:42:52,1
2023-04-11,0.6,市場消息雜音紛陳，營收表現不佳與外資買賣超影響市場信心，整體展望仍有待觀察。,2025-07-21 13:42:53,1
2023-04-12,0.3,針對網路詐騙事件，台積電嚴正澄清並保留法律追訴權，維護公司聲譽與投資人利益。,2025-07-21 13:42:54,1
