date,factor,explanation,updated_time,news_count
2024-08-15,0.3,地震對台積電營運影響有限，但仍可能引發市場短期波動，投資人應密切注意後續發展。,2025-07-21 13:51:07,1
2024-08-16,0.9,電子權值股全面走揚帶動大盤上漲，台積電領軍衝高激勵市場情緒，多頭氣勢強勁。,2025-07-21 13:51:08,1
2024-08-17,0.6,多檔台股 ETF 填息與高殖利率題材激勵市場信心，惟個別標的填息表現參差，整體而言中性偏正面。,2025-07-21 13:51:10,1
2024-08-18,0.6,市場情緒趨於樂觀但謹慎，反彈力道有限且缺乏主流類股領漲，短線仍需時間消化利空因素。,2025-07-21 13:51:11,1
2024-08-19,0.6,市場情緒偏正面，電子股強勁反彈帶動指數上漲，但整體成交量仍然低迷，顯示買盤力道不足。,2025-07-21 13:51:12,1
2024-08-20,0.6,市場情緒受美股上漲與電子權值股走勢影響，呈現溫和樂觀但仍有不確定性。,2025-07-21 13:51:13,1
2024-08-21,0.2,台積電等電子權值股走跌拖累大盤，市場情緒偏空，加上成交量萎縮，顯示買盤力道不足。,2025-07-21 13:51:15,1
2024-08-22,0.3,市場對於台積電的信心受到電子權值股走勢疲軟影響，整體情緒偏向中性。,2025-07-21 13:51:16,1
2024-08-23,0.6,市場情緒偏向正面，主要受惠於高價電子股強勢表現與金融股換股合併利多，但台積電小幅走低壓抑漲幅。,2025-07-21 13:51:17,1
2024-08-24,0.9,先進封裝設備需求強勁，供應鏈營運同步成長，股價創新高反映市場對未來展望的樂觀期待。,2025-07-21 13:51:18,1
2024-08-25,0.9,矽光子技術發展備受關注，多家廠商參與聯盟顯示產業鏈完整性強，市場樂觀期待新興應用帶動成長動能。,2025-07-21 13:51:19,1
2024-08-26,0.6,出售南科廠利益挹注與新事業發展題材激勵，但產業需求疲弱壓抑短期漲幅空間。,2025-07-21 13:51:20,1
2024-08-27,0.3,台積電受大盤走勢拖累而下跌，但在半導體設備與板卡族群強勁表現支撐下，市場情緒維持中性偏多。,2025-07-21 13:51:22,1
2024-08-28,0.4,市場情緒受到電子與金融類股疲軟影響，營建類股撐場但整體指數開高走低翻黑，顯示多空勢力拉鋸，短期內大盤仍將維持震盪走勢。,2025-07-21 13:51:23,1
2024-08-29,0.4,電子權值股普遍走弱，尤其是晶圓代工龍頭台積電大跌超過 2%，拖累整體市場信心，短期內市場情緒偏向保守。,2025-07-21 13:51:24,1
2024-08-30,0.7,權值股普遍平盤附近震盪，電子與傳產類股各自有所表現，光通訊族群強勁上攻帶動市場情緒向上。,2025-07-21 13:51:26,1
2024-08-31,0.7,CoWoS-L 產能擴充需求帶動設備與材料代理業務成長，市場對營運前景樂觀看待。,2025-07-21 13:51:27,1
2024-09-01,0.9,國際半導體展 SEMICON Taiwan 2024 對產業發展前景展望樂觀，重量級貴賓齊聚討論 AI 發展趨勢，凸顯台灣在全球半導體供應鏈中的關鍵地位。,2025-07-21 13:51:28,1
2024-09-02,0.5,台積電尾盤在大單敲進下小幅上漲，顯示市場情緒仍有支撐，但整體電子股普遍走弱，加上傳產族群疲軟，導致加權指數收黑，成交量創逾 7 個月新低。,2025-07-21 13:51:30,1
2024-09-03,0.6,雖然台積電維持在平盤之上，但量能不出下，市場情緒仍偏向中性。法人認為，在旺季營收公布、蘋果新機發表等因素帶動下，指數有望突破季線，但短期內震盪難免。,2025-07-21 13:51:31,1
2024-09-04,0.6,八大官股券商大舉買超台積電等權值股，顯示政府有意穩盤，但外資賣壓沉重使得市場情緒仍偏向保守。,2025-07-21 13:51:32,1
2024-09-06,0.6,市場觀望美國就業報告與 FED 降息前景，權值股反彈帶動短線正面情緒，但成交量萎縮顯示追價意願不足。,2025-07-21 13:51:34,1
2024-09-08,0.9,魏哲家強調台積電在 AI 領域扮演純晶圓代工廠獨特角色，並重申信賴是最關鍵因素，激勵市場對未來成長前景樂觀。,2025-07-21 13:51:35,1
2024-09-09,0.1,美股重挫與經濟衰退疑慮升溫拖累台股大跌，權值股全面走弱，市場情緒悲觀。,2025-07-21 13:51:36,1
2024-09-10,0.6,營收表現優於預期但年增率放緩，市場對未來成長動能存疑引發短期股價壓力。,2025-07-21 13:51:37,1
2024-09-11,0.4,台積電股價下跌與電子指標普遍疲軟壓抑市場信心，但部分傳產類股如重電、航運表現亮眼提供支撐。整體而言，市場情緒偏向保守中性。,2025-07-21 13:51:39,1
2024-09-12,0.9,營收創新高、外資樂觀展望與產能利用率維持高檔，顯示公司基本面強勁，激勵市場情緒向上。,2025-07-21 13:51:40,1
2024-09-13,0.7,台積電股價開高走低，市場情緒受到大盤量能不足與電子權值股疲軟影響而轉為中性。,2025-07-21 13:51:41,1
2024-09-14,0.6,CoWoS 先進封裝需求強勁，台積電擴廠帶動相關設備廠股價走揚，市場對半導體產業景氣前景樂觀。,2025-07-21 13:51:42,1
2024-09-15,0.6,市場情緒溫和偏正面，短期內有機會維持區間整理走勢，但成交量萎縮與技術指標疲弱可能限制上攻空間。,2025-07-21 13:51:43,1
2024-09-16,0.6,市場觀望氣氛濃厚、成交量急凍，加上權值股漲跌互見與高價股疲軟，整體市場情緒偏向中性，但半導體設備族群強勢表現為少數亮點。,2025-07-21 13:51:45,1
2024-09-18,0.7,與台積電的合作關係帶來正面消息，激勵股價大漲，但獲利能力與成長前景仍需進一步觀察。,2025-07-21 13:51:46,1
2024-09-19,0.9,大盤反彈行情激勵台積電領軍上攻，多頭信心回溫推升股價走揚。,2025-07-21 13:51:47,1
2024-09-20,0.9,美股大漲帶動台股跳空開高，權值股全面走強，市場情緒樂觀，預期指數將挑戰季線反壓。,2025-07-21 13:51:48,1
2024-09-22,0.6,聯準會降息激勵市場信心，但選前行情保守且投信結帳壓力使盤勢維持區間整理，族群走勢分歧。,2025-07-21 13:51:49,1
2024-09-23,0.6,權值股普遍走強、金控類股表現亮眼及矽光子族群領漲帶動下，市場情緒偏正面，但整體成交量仍顯低迷，對大盤支撐力道有限。,2025-07-21 13:51:51,1
2024-09-24,0.6,展望樂觀但仍須留意黑天鵝事件，預期成長股表現優於指數，市場情緒偏正面但風險不容忽視。,2025-07-21 13:51:52,1
2024-09-25,0.9,營收表現優於預期、AI 需求強勁與漲價效應激勵市場信心，股價重返千金行列帶動台股再現 15 千金。,2025-07-21 13:51:53,1
2024-09-26,0.9,三大法人同步買超，顯示市場對台積電後市展望樂觀，激勵股價上漲並帶動加權指數走揚。,2025-07-21 13:51:54,1
2024-09-27,0.6,三大法人同步買超，顯示市場對台積電後市仍持正面看法，但漲多拉回壓力使盤勢震盪。,2025-07-21 13:51:55,1
2024-09-28,0.9,CoWoS 訂單挹注與半導體設備需求強勁帶動下，營收展望樂觀且訂單能見度高，激勵市場情緒向上並推升股價表現。,2025-07-21 13:51:56,1
2024-09-29,0.6,市場情緒偏正面，受惠於聯準會降息與 AI 需求強勁等利多因素，但大選前觀望氣氛仍存。,2025-07-21 13:51:57,1
2024-09-30,0.3,美股四大指數全面下挫，台積電失守千元關卡，權值股全面走跌，市場信心受挫，但玻璃與水泥族群相對抗跌，資金流入。,2025-07-21 13:51:59,1
2024-10-01,0.6,台積電領軍反彈，權值股回神帶動大盤上漲，但成交量萎縮且三大法人仍呈現小幅賣超，市場信心尚未完全恢復。,2025-07-21 13:52:00,1
2024-10-04,0.4,台積電營收與獲利表現符合預期，但市場仍擔憂總體經濟與消費性電子需求放緩的影響，引發中性至略負面情緒。,2025-07-21 13:52:01,1
2024-10-05,0.9,CoWoS 產能持續吃緊與擴廠計畫帶動設備需求強勁，相關供應鏈受惠訂單暢旺，激勵市場對未來成長前景樂觀。,2025-07-21 13:52:03,1
2024-10-06,0.9,新一代顯示卡規格亮眼且市場佔有率領先，預期將為台廠板卡業者帶來強勁的換機商機與營收成長。,2025-07-21 13:52:04,1
2024-10-07,0.9,台積電強勁漲勢帶動加權指數上揚，外資與自營商同步偏多操作，顯示市場情緒樂觀且對台股前景持正面看法。,2025-07-21 13:52:05,1
2024-10-08,0.3,權值股普遍走弱，尤其是台積電失守千元大關，拖累加權指數開低走低，但仍守住所有均線，顯示市場信心尚未完全潰散。塑膠、重電等族群表現疲軟，美股四大指數昨日全面收黑也為台股帶來壓力，但整體而言影響有限，預期短期內市場情緒仍維持中性偏空。,2025-07-21 13:52:07,1
2024-10-09,0.6,營收年增率持續成長但月增率趨緩，市場對未來獲利能力與產業景氣前景存疑慮。,2025-07-21 13:52:08,1
2024-10-11,0.9,AI 晶片需求強勁與多家客戶新品採用先進製程挹注，預期將為第四季營運帶來正面成長動能。,2025-07-21 13:52:09,1
2024-10-12,0.7,半導體先進製程需求強勁帶動設備廠業績成長，外資買盤推升股價上漲並站回所有均線。,2025-07-21 13:52:10,1
2024-10-13,0.6,台積電法說行情提前發酵且電子領頭羊買盤強勁，但總統大選與經濟衰退疑慮仍使市場觀望氣氛濃厚。,2025-07-21 13:52:12,1
2024-10-14,0.7,台積電維持平盤收市，顯示市場對其基本面看法正向且信心穩固。三大法人中投信大幅買超助漲股價，但外資賣超則為短期利空因素。整體而言，多方與空方勢力拉鋸，預計隔日盤勢將維持區間震盪走勢。,2025-07-21 13:52:13,1
2024-10-15,0.9,AI 概念股領漲激勵市場信心，台積電等大型權值股同步走揚，多頭氣勢強勁。,2025-07-21 13:52:15,1
2024-10-16,0.4,台積電普通股補跌近 3%，回到五日線支撐，市場情緒偏向負面。,2025-07-21 13:52:16,1
2024-10-17,0.6,台積電法說會前夕股價走勢疲弱，市場觀望氣氛濃厚，加上電子類股普遍疲軟拖累指數，但傳產族群如塑化、航運等表現相對強勁，整體市場情緒偏向中性。,2025-07-21 13:52:17,1
2024-10-18,0.7,分析師普遍調升目標價且樂觀評級顯示市場對台積電基本面看好，但股價仍落後大盤表現，短期內可能有補漲空間。,2025-07-21 13:52:18,1
2024-10-19,0.8,2 奈米需求強勁帶動相關供應鏈股價上漲，市場對台積電未來成長前景樂觀。,2025-07-21 13:52:19,1
2024-10-20,0.3,雖然台積電第三季財報亮眼，但市場擔憂華為供貨遭調查、美國總統大選等因素干擾，引發觀望氣氛，短期內股價漲多後可能出現修正。,2025-07-21 13:52:21,1
2024-10-21,0.6,台積電股價漲勢暫歇但多頭氣盛，鴻海、IC設計、高價股領軍反攻，中小型股同步上揚，市場情緒偏正面。,2025-07-21 13:52:22,1
2024-10-22,0.6,台積電最後一盤拉抬跌幅收斂，搭配金融股走揚撐盤，加權指數僅小跌，顯示市場情緒維持中性偏正面。,2025-07-21 13:52:23,1
2024-10-23,0.4,權值股普遍走弱拖累大盤，台積電領跌下引發市場信心動搖，但中小型股及部分傳產族群表現相對抗跌。,2025-07-21 13:52:25,1
2024-10-24,0.6,展覽題材帶動相關概念股漲勢，市場情緒偏正面，但需留意美國總統大選後的表現。,2025-07-21 13:52:26,1
2024-10-25,0.3,台積電法說釋出 AI 需求強勁訊息與第四季新品出貨利多，但美國大選不確定性與債券殖利率上升影響市場信心，股價短期波動加劇。,2025-07-21 13:52:27,1
2024-10-26,0.6,員工獎金加碼凸顯公司對人才的重視，激勵士氣有助穩定市場情緒，但獲利展望仍是關鍵。,2025-07-21 13:52:29,1
2024-10-28,0.3,大盤指數下跌且電子權值股普遍走弱，台積電疲軟影響市場信心，但傳產類股如塑化、玻璃等表現相對強勁，整體而言市場情緒偏向中性。,2025-07-21 13:52:30,1
2024-10-29,0.1,利空消息衝擊投資人信心，加上市場觀望美國大選結果，台積電股價重挫拖累指數走低，短期內市場情緒偏向悲觀。,2025-07-21 13:52:31,1
2024-10-30,0.3,市場觀望氣氛濃厚，外資與自營商同步賣超拖累指數，但投信持續偏多操作，整體籌碼面中性偏空。,2025-07-21 13:52:32,1
2024-11-01,0.3,選舉不確定性影響短期市場情緒，但李長庚認為衝擊屬於短期，待選後不確定因素減少將回歸基本面。,2025-07-21 13:52:34,1
2024-11-03,0.6,台積電熊本廠進度與中國信託銀行在日本市場的布局策略為正面消息，但整體經濟環境仍存在不確定性，影響有限。,2025-07-21 13:52:35,1
2024-11-04,0.6,電子權值股回神帶動大盤上漲，市場情緒偏正面，但航運類股下挫與傳產資金流向電子顯示觀望氣氛濃厚。,2025-07-21 13:52:36,1
2024-11-05,0.4,地緣政治風險與選舉觀望氣氛影響市場信心，台積電股價走勢疲弱。,2025-07-21 13:52:38,1
2024-11-06,0.6,美股四大指數全面收紅，道瓊、那斯達克、S&P 500 與費城半導體指數同步上漲，激勵台積電早盤小幅震盪，市場觀望氣氛濃厚。,2025-07-21 13:52:39,1
2024-11-07,0.3,政策不確定性與選舉因素影響短期投資氣氛，但 AI 與半導體長線趨勢未變，高股息 ETF 如 00961 可望受惠波動低檔布局。,2025-07-21 13:52:40,1
2024-11-08,0.9,營收表現亮眼，年增率持續成長且月增率大幅上揚，顯示公司基本面強勁，激勵市場情緒與股價上漲。,2025-07-21 13:52:42,1
2024-11-09,0.3,出口管制法規疑慮引發短期市場波動，但台積電強調遵守所有相關法規，後續發展仍待觀察。,2025-07-21 13:52:43,1
2024-11-10,0.7,AI 應用需求強勁，矽光子技術商機龐大，相關台廠受惠，市場情緒正面。,2025-07-21 13:52:44,1
2024-11-11,0.3,雖然台積電股價下跌，但在三大法人中僅自營商賣超，外資與投信分別小幅買超，顯示市場對台積電的整體情緒仍屬穩健。,2025-07-21 13:52:46,1
2024-11-12,0.9,現金股利大幅增加與營收獲利創高顯示公司財務狀況強勁，激勵市場情緒向上並推升股價。,2025-07-21 13:52:47,1
2024-11-13,0.3,地緣政治緊張局勢升溫與出口管制議題再起，短期內可能對市場情緒造成負面衝擊，但實際影響程度仍有待觀察。,2025-07-21 13:52:48,1
2024-11-14,0.7,測試介面族群營收表現亮眼且股價反彈，顯示市場對業績成長前景持正向期待。,2025-07-21 13:52:49,1
2024-11-15,0.9,權值股回神、金融與傳產領漲帶動大盤上攻，電子類股表現平穩，市場情緒樂觀。,2025-07-21 13:52:51,1
2024-11-17,0.3,市場對台積電後市信心略顯不足，短期內可能維持區間整理走勢，但若輝達財報優於預期且帶動科技股反彈，將有利多頭重拾上攻力道。,2025-07-21 13:52:52,1
2024-11-18,0.3,美股重挫與電子權值股走跌壓抑市場信心，但塑化類股強彈提供支撐，整體市場情緒偏向保守。,2025-07-21 13:52:53,1
2024-11-19,0.8,台積電領軍電子權值股反彈，搭配貨櫃三雄與傳產指標齊揚，激勵市場情緒回升並推升大盤上漲。,2025-07-21 13:52:54,1
2024-11-20,0.3,台積電走勢續弱拖累加權指數回測季線，市場情緒偏空但矽光子族群與 AI 伺服器概念股逆勢抗跌。,2025-07-21 13:52:56,1
2024-11-21,0.4,台積電股價下跌與電子權值股普遍疲弱，引發市場悲觀情緒，但航運類股強勢反彈提供一定支撐。,2025-07-21 13:52:57,1
2024-11-22,0.9,美股四大指數齊漲，帶動台股全面走揚，權值股領軍衝鋒，市場情緒樂觀，多頭氣勢強勁。,2025-07-21 13:52:58,1
2024-11-24,0.3,外資動向與資金流向影響股價表現，個股表現分歧，整體市場維持觀望態度。,2025-07-21 13:52:59,1
2024-11-25,0.9,台積電持穩帶動大盤上漲，AI、高價股與運動概念股強勢表現，激勵市場情緒樂觀。,2025-07-21 13:53:00,1
2024-11-26,0.4,台積電遭遇外資連日賣超與千元支撐力道考驗，股價走弱拖累大盤表現，但部分題材股如無人機概念股逆勢上揚，市場情緒偏空但仍有個別族群支撐。,2025-07-21 13:53:02,1
2024-11-27,0.3,台積電面臨千金保衛戰，股價下挫近1%，加上電子、金融與傳產權值股全面走弱，拖累大盤重挫343點失守季線與半年線。,2025-07-21 13:53:03,1
2024-11-28,0.6,台積電股價波動與電子權值股漲跌互見，市場情緒偏向中性。,2025-07-21 13:53:04,1
2024-11-29,0.3,外資連四賣且權值股表現不佳拖累大盤，市場情緒偏空但賣壓未擴大，顯示仍有部分買盤支撐。,2025-07-21 13:53:05,1
2024-12-02,0.9,美股科技股大漲帶動台積電跳空開高，權值股齊揚下指數站回季線，顯示市場情緒轉趨樂觀。,2025-07-21 13:53:07,1
2024-12-03,0.9,台積電領軍大盤反彈，多檔個股強勢表現帶動市場情緒向上，指數重返2萬3千點並站回月線。,2025-07-21 13:53:08,1
2024-12-04,0.9,台積電領漲帶動大盤上揚，市場情緒樂觀且對產業前景看好。,2025-07-21 13:53:09,1
2024-12-05,0.7,外資連四買且大盤上漲帶動股價走揚，顯示市場情緒正面但仍需留意投信賣壓。,2025-07-21 13:53:10,1
2024-12-06,0.6,台積電走勢疲弱拖累大盤，但電子五哥等權值股力挺，資訊類股續強，市場情緒偏向正面但信心略顯不足。,2025-07-21 13:53:12,1
2024-12-08,0.6,傳統作帳行情啟動與外資回補力道強勁有利多頭氣勢，但技術面量能不足且聯準會降息預期不確定性仍存，短線漲多後恐將拉回整理。,2025-07-21 13:53:13,1
2024-12-09,0.6,權值股表現分歧，台積電漲幅有限但仍維持正面走勢，加上大型 ETF 納入與 AI 類股強勁支撐整體市場信心。,2025-07-21 13:53:15,1
2024-12-10,0.6,營收表現優於預期，年增率持續成長，但月減幅度較大，市場對後市展望仍有疑慮。,2025-07-21 13:53:16,1
2024-12-11,0.6,除息交易將減少發行市值與指數點數，引發賣壓，但長期基本面穩健支撐市場信心。,2025-07-21 13:53:17,1
2024-12-12,0.9,現金股利調升與填息行情激勵市場信心，公司穩健的配息政策有助維持正面投資氛圍。,2025-07-21 13:53:18,1
2024-12-13,0.3,權值股漲跌互現，台積電持平，加上部分族群如 PCB、網通與生技類股表現亮眼，整體市場情緒溫和偏多但仍有不確定性。,2025-07-21 13:53:19,1
2024-12-15,0.3,市場觀望 FOMC 利率會議結果，外資賣超大型電子股影響盤勢，但降息預期與年底作帳行情支撐多頭信心。,2025-07-21 13:53:21,1
2024-12-16,0.7,市場觀望氣氛濃厚，權值股走勢分歧，但台積電領漲帶動半導體類股上揚，整體大盤維持小幅收紅，顯示在 FOMC 會議前仍有部分買盤進場。,2025-07-21 13:53:22,1
2024-12-17,0.6,台積電領軍反彈激勵市場情緒，但個股輪動快速且部分題材股已過熱，短期漲多後恐陷入震盪整理。,2025-07-21 13:53:23,1
2024-12-18,0.6,市場延續樂觀情緒與科技股強勢表現帶動，加上大型科技股領漲台積電等指標股助攻，整體呈現正面氛圍。,2025-07-21 13:53:25,1
2024-12-20,0.3,權值股普遍走弱，尤其是台積電領跌，加上美股前一日下挫影響，整體市場情緒偏空，但部分個股如營建、網通與資服股表現相對強勁，抵銷部分賣壓。,2025-07-21 13:53:26,1
2024-12-21,0.6,AI 概念股強勢表現帶動市場情緒，但營收與獲利數字仍待觀察，短期漲多個股恐面臨獲利了結賣壓。,2025-07-21 13:53:27,1
2024-12-22,0.3,外資賣超影響加上年底節慶因素與政策不確定性，整體市場情緒偏向保守，但集團作帳行情仍可望支撐股價表現。,2025-07-21 13:53:29,1
2024-12-23,0.6,台積電強勁漲勢反映外資回補意願轉強，有助支撐新台幣匯率，但聯準會降息力道變小與美債殖利率上揚仍將影響全球股市。,2025-07-21 13:53:30,1
2024-12-24,0.8,台積電領軍大盤上揚，電子權值股普遍走強，激勵市場情緒與股價表現。,2025-07-21 13:53:31,1
2024-12-25,0.9,美股全面反彈激勵台股大盤強勢反彈，權值股領軍衝鋒，市場情緒樂觀。,2025-07-21 13:53:32,1
2024-12-26,0.6,電子權值股表現平淡，光學與電池族群強勢上揚，防疫與生技概念股受惠疫情傳言而大漲，整體市場情緒偏正面但仍有不確定性。,2025-07-21 13:53:34,1
2024-12-27,0.6,台積電權值股表現平平，市場情緒偏中性。整體盤勢呈現震盪格局，資金流向生化股與 PCB 族群。,2025-07-21 13:53:35,1
2024-12-29,0.6,內資主導的年底作帳行情積極且外資買超大型電子股，市場信心回升但美債殖利率上揚與聯準會鷹派態度仍是隱憂。,2025-07-21 13:53:37,1
2024-12-30,0.7,台積電維持平盤，電子權值股表現平穩，加上軍工及無人機概念股強勢反彈，整體市場情緒偏正面。,2025-07-21 13:53:38,1
2024-12-31,0.6,營收表現符合預期但成長力道趨緩，市場對第四季展望與法說會釋出訊息期待度提高。,2025-07-21 13:53:39,1
2025-01-02,0.4,權值股普遍走弱，市場信心受挫，加上缺乏明顯的利多消息支撐，整體市場情緒偏向保守。,2025-07-21 13:53:40,1
2025-01-03,0.7,台積電股價強勁反彈，帶動大盤指數站回季線及23000點關卡，但權值股整體表現平淡，市場情緒偏向正面但仍有不確定性。,2025-07-21 13:53:42,1
2025-01-04,0.6,台積電權重下降與市值型 ETF 多因子策略分散風險有助穩定市場情緒，但漲幅空間仍受限於整體大盤走勢。,2025-07-21 13:53:43,1
2025-01-05,0.3,市場情緒平穩但觀望氣氛濃厚，多空因素交錯使股價波動加劇。,2025-07-21 13:53:44,1
2025-01-06,0.9,強勁的營收展望、AI晶片需求暢旺以及海外擴廠計畫帶動市場信心，預期股價將持續上攻。,2025-07-21 13:53:45,1
2025-01-07,0.8,台積電股價再創新高帶動大盤上漲，顯示市場對其基本面與前景持正向看法。,2025-07-21 13:53:47,1
2025-01-08,0.3,三大法人同步賣超且外資轉為空單增加，顯示市場信心略有動搖，但買盤力道仍在，整體情緒維持中性偏空。,2025-07-21 13:53:48,1
2025-01-09,0.4,電子權值股疲弱與航運類股重挫拖累大盤走勢，市場情緒偏向保守。,2025-07-21 13:53:49,1
2025-01-10,0.6,營收年增率持續成長但月增率轉負，市場對後市展望略顯保守，股價呈現溫和上漲。,2025-07-21 13:53:50,1
2025-01-13,0.6,台積電營收表現亮眼但市場情緒受美股拖累影響，整體電子權值走弱，非電族群中僅部分個股撐盤。,2025-07-21 13:53:51,1
2025-01-14,0.8,大盤止跌反彈，台積電領軍上漲帶動市場情緒回升，多頭信心獲得提振。,2025-07-21 13:53:52,1
2025-01-16,0.9,台積電領漲激勵大盤強彈，三大法人同步回補買超，顯示市場情緒轉趨樂觀。,2025-07-21 13:53:54,1
2025-01-17,0.7,台積電法說報佳音激勵股價上揚，但漲幅收斂且權值股表現不一，市場情緒偏正面但仍有變數。,2025-07-21 13:53:55,1
2025-01-18,0.9,分析師普遍樂觀看待公司基本面與營運前景，目標價上修顯示市場對未來獲利成長的信心。,2025-07-21 13:53:56,1
2025-01-20,0.6,法說釋出正面展望與節日行情預期提振市場信心，整體而言對股價產生中性偏多影響。,2025-07-21 13:53:57,1
2025-01-21,0.3,地震概念股強勢表現與貨櫃三雄走揚帶動指數維持高檔整理，但電子權值股疲弱影響市場信心。,2025-07-21 13:53:59,1
2025-01-22,0.7,台積電領軍電子權值股上攻，加上矽光子概念股強勁表現，激勵市場情緒向上，但聯電法說釋出利空與個別弱勢股拖累漲幅，整體而言呈現正面但不過度樂觀的走勢。,2025-07-21 13:54:00,1
2025-01-24,0.6,地震對主要晶圓代工廠營運造成短期中等程度影響，但迅速復原與供應鏈韌性使市場情緒維持溫和樂觀。,2025-07-21 13:54:01,1
2025-01-25,0.6,總統就職演說與預期相符，關稅政策修正有利市場信心，但整體經濟前景仍存在不確定性。,2025-07-21 13:54:03,1
2025-01-29,0.6,AI 基礎建設投資題材持續發酵，相關個股強勢表現，但整體市場情緒仍偏中性，需留意漲多後的獲利了結賣壓。,2025-07-21 13:54:05,1
2025-02-01,0.6,AI 機器人趨勢帶動新應用商機，上銀在關鍵零組件與在地服務具優勢，市場對其營運成長前景持正向期待。,2025-07-21 13:54:06,1
2025-02-02,0.6,受惠台積電外包策略，測試廠商有機會獲得更多訂單，激勵市場對半導體供應鏈的正面期待。,2025-07-21 13:54:07,1
2025-02-03,0.3,美股春節期間大跌與川普點名將對台灣晶片課稅引發市場擔憂，但 DeepSeek 事件影響有限，整體而言不確定性因素仍在，短期內台積電股價走勢恐持續波動。,2025-07-21 13:54:09,1
2025-02-04,0.3,市場對貿易戰與 DeepSeek 衝擊的擔憂使投資人謹慎觀望，短期內股價波動加劇，但若股價下跌至合理水準或 AI 使用量成長帶來利多，則有望吸引買盤進場。,2025-07-21 13:54:10,1
2025-02-05,0.7,台積電等權值股領漲帶動大盤上攻，站上所有均線與 23000 點關卡，顯示市場情緒正面且對後市樂觀。,2025-07-21 13:54:12,1
2025-02-07,0.9,三大法人同步買超，尤其外資與自營商加碼力道強勁，顯示市場對台積電後市展望樂觀，推升股價上漲並帶動指數創高。,2025-07-21 13:54:13,1
