date,factor,explanation,updated_time,news_count
2024-10-18,0.8,AI 需求強勁與台積電財測優於預期帶動市場情緒向上，相關概念股如矽光子、伺服器組裝、散熱、機殼等可望受惠。,2025-08-12 02:39:29,15
2024-10-20,0.7,AI 概念股受惠於新晶片推出及供應鏈需求穩定，激勵市場情緒上揚，但須留意總統大選等外在因素的干擾。,2025-08-12 02:39:32,15
2024-10-21,0.7,AI 題材持續發酵，輝達新品 GB200 第四季出貨，明年量產將帶動液冷散熱技術市場成長，雙鴻受惠，股價有望挑戰前高。加上高價 IC 設計股強勢表態，中小型股補漲行情啟動。,2025-08-12 02:39:36,15
2024-10-22,0.6,AI 需求強勁帶動相關概念股走勢，但中國軍事活動與美國總統選舉因素干擾市場信心，整體影響中性偏空。,2025-08-12 02:39:40,15
2024-10-23,0.3,市場觀望美國大選結果，AI概念股如愛普、長華、昇達科等表現強勁，但整體盤面受到權值股拖累而下跌。,2025-08-12 02:39:43,15
2024-10-24,0.6,鴻海受惠 AI 伺服器需求強勁，營運展望樂觀，但市場情緒受到權值三雄疲弱與外資賣超影響而轉為中性。,2025-08-12 02:39:47,15
2024-10-25,0.6,AI 手機題材助攻權值股與相關概念股表現，市場情緒偏正面。,2025-08-12 02:39:51,15
2024-10-26,0.9,外資及投信同步買超顯示市場對鴻海第四季旺季動能樂觀，且 AI 伺服器出貨增添正面期待。,2025-08-12 02:39:53,15
2024-10-27,0.6,蘋果新品發表與財報帶動相關供應鏈股價上揚，但 AI 功能落後 ChatGPT 引發市場疑慮，整體而言對鴻海的影響中性。,2025-08-12 02:39:55,15
2024-10-28,0.6,市場情緒偏向正面，部分個股如 (2330-TW) 台積電、(2454-TW) 聯發科等受到外資青睞，但整體漲跌互見，AI 題材股表現亮眼。,2025-08-12 02:39:59,15
2024-10-29,0.7,市場情緒偏正面，預期 AI 產業鏈需求持續增長，但部分權值股走跌拖累大盤表現。輝達 GB200 伺服器出貨帶動相關個股漲勢，工具機、電子商務等族群也有所表現。鴻海、廣達旗下子公司或供應鏈可留意。台積電法說會釋出正面訊息，但華為晶片爭議影響短期走勢。整體而言，市場對 AI 產業前景樂觀，選股重於選市。,2025-08-12 02:40:04,15
2024-10-30,0.6,市場情緒偏向中性，雖然有利多消息如鴻海法說會，但整體而言缺乏強勁的正面訊息，導致股價波動有限。,2025-08-12 02:40:08,15
2024-11-02,0.7,"輝達新品出貨帶動散熱模組需求強勁，加上法人買超力挺，激勵正面市場情緒。

====================

以下是提供的新聞資訊 :

鴻海 (2317-TW) 子公司工業富聯 (FII-US) 今日公告第三季財報，稅後純益人民幣 52.3 億元，年增 1.2%，每股純益人民幣 0.28 元。工業富聯第三季營收人民幣 1,042.7 億元，年減 4.8%，毛利率 10.6%，年減 0.3 個百分點，營益率 2.9%，年減 0.5 個百分點。工業富聯前三季累計營收人民幣 3,042.7 億元，年減 4.8%，毛利率 10.6%，年減 0.3 個百分點，營益率 2.9%，年減 0.5 個百分點；稅後純益人民幣 118.1 億元，年增 0.7%，每股純益人民幣 0.64 元。工業富聯表示，第三季毛利率與營益率均符合預期，但受到消費電子需求疲弱影響，客戶積極進行庫存調整，訂單明顯由過去高點下滑，產能利用率也下滑至 80-82%。

範例輸出4:
0.5
財報表現符合預期但營收與獲利下滑及庫存調整壓力使短期市場情緒維持中性。",2025-08-12 02:40:30,15
2024-11-03,0.6,產學合作有助於提升人才素質並強化智慧製造能力，對公司長期發展正面，但短期內營運影響有限。,2025-08-12 02:40:32,15
2024-11-05,0.6,鴻海營收創高且獲獎助長市場信心，但整體大盤走勢疲弱使股價漲幅受限。,2025-08-12 02:40:51,15
2024-11-06,0.7,雖然美國大選結果出爐，但整體市場情緒仍偏正面，台股在護國神山領軍下維持強勁走勢。個股方面，建議關注電競、AI伺服器等長線看好的族群，如技嘉 (2376-TW) 等。,2025-08-12 02:40:55,15
2024-11-07,0.8,美國總統大選結果出爐，市場不確定性消除，美股強勁反彈帶動台股同步走高，多方趨勢延續。鴻海集團等權值股領漲，加上 AI 產業趨勢成長、消費性電子產品營運回溫，個股表現亮眼，整體市場情緒正面，股價有望持續向上。,2025-08-12 02:41:00,15
2024-11-08,0.6,市場情緒偏正面，部分個股如台積電、緯穎等有強勁表現，但整體漲幅有限，顯示投資人仍謹慎觀望。新聞中提及美國降息、全球寬鬆貨幣政策，以及 AI 產業趨勢不變等利多因素，有助支撐市場信心。但也提醒選擇有產業前景的股票，漲勢延續性較高，避免追高風險。整體而言，第四季行情可期，但仍需留意個股基本面與籌碼狀況。,2025-08-12 02:41:05,15
2024-11-09,0.7,鴻海集團帶動買盤湧入，富鼎受惠 AI 伺服器與散熱需求強勁，業績成長數倍，後市展望樂觀。,2025-08-12 02:41:07,15
2024-11-10,0.7,AI 應用需求強勁與相關供應鏈受惠題材激勵市場信心，但部分個股漲幅已大且財報表現仍有不確定性，維持中高位階的謹慎態度。,2025-08-12 02:41:10,15
2024-11-11,0.7,市場情緒偏正面，但受到美國商務部對台積電出口管制影響，股價走勢震盪。AI、儲能等概念股表現強勁，生技股如保瑞、美時也有所上漲。鴻海集團受惠題材，子公司有望跟進。富邦台灣中小型基金評估有波段行情可期。,2025-08-12 02:41:14,15
2024-11-13,0.3,市場情緒偏空，股價可能下跌。雖有 AI 概念題材，但賣壓沉重，外資持續看淡，加上鴻海法說會結果不佳，整體利多因素不足以支撐反彈。,2025-08-12 02:41:34,15
2024-11-14,0.7,展望樂觀且訂單能見度提升，加上 AI 伺服器需求強勁，激勵市場情緒偏正面，但消費智能產品需求仍疲弱，抵銷部分利多影響。,2025-08-12 02:41:37,15
2024-11-15,0.3,市場情緒偏向中性，雖然大盤上漲但權值股表現疲弱，外資買超金額有限且賣超鴻海、廣達等個股，籌碼面仍有不確定性。加上美國通膨數據高於預期，聯準會態度轉趨鷹派，影響美股走勢，台股也受到波及。整體而言，市場觀望氣氛濃厚，短線漲多個股有獲利了結壓力，但跌深的個股則有反彈契機。,2025-08-12 02:41:42,15
2024-11-16,0.7,法說展望樂觀、AI 伺服器成長動能強勁以及新超算中心啟用等正面消息帶動市場情緒，但稅收超徵議題與地緣政治風險仍存在不確定性。,2025-08-12 02:41:45,15
2024-11-17,0.3,市場避險情緒濃厚，加上電子權值股疲軟，短線呈易跌難漲態勢，但輝達財報優於預期將是多頭能否重整旗鼓的關鍵訊號。,2025-08-12 02:41:47,15
2024-11-18,0.6,市場情緒偏向中性，股價可能在區間波動。輝達財報與台指期結算將是關鍵轉折點，若能突破前高，則有利多頭反攻；反之，若未能超出預期，則需謹慎保守。AI基本面仍強勁，但短期受到市場氣氛與外資賣盤影響而回檔整理，逢低可留意長線佈局機會。,2025-08-12 02:41:52,15
2024-11-19,0.7,三大法人同步買超激勵市場情緒，外資加碼金融與貨櫃股，電子權值股回神，但仍需留意個別產業庫存調整狀況。,2025-08-12 02:41:55,15
2024-11-20,0.6,鴻海加入 OpenUSD 聯盟有利於推動通用場景描述標準化，展現對開源與創新的承諾，有助於提升公司在製造領域的技術實力和市場地位，但外資調節持股影響隔日股價表現。,2025-08-12 02:41:59,15
2024-11-21,0.3,市場情緒偏向負面，主要受到輝達財報與鴻海子公司處分持股影響，預期隔日股價可能下跌。,2025-08-12 02:42:03,15
2024-11-22,0.7,輝達財報優於預期但股價下跌，引發市場擔憂 AI 產業成長趨緩，但基本面仍強勁，搭配台灣相關供應鏈表現，中長線維持正面看待。操作上建議留意輪動快速的中小型類股，並密切關注新主流出現時佈局。,2025-08-12 02:42:07,15
2024-11-23,0.6,巴菲特看多美國經濟與科技發展，AI 長期前景樂觀，但存股標的需持續檢視基本面變化。,2025-08-12 02:42:10,15
2024-11-24,0.3,外資持續賣超大型 AI 股引發市場觀望，但航運股獲青睞，指數陷入震盪整理。,2025-08-12 02:42:12,15
2024-11-25,0.7,三大法人同步買超、權值股漲跌互現、AI類股強勢表現，以及棒球概念股上攻帶動市場情緒偏多，但成交量未能有效放大，整體而言呈現中性偏多格局。,2025-08-12 02:42:15,15
2024-11-26,0.7,鴻海擴產與佈局美國的消息有利長期發展，但近期台股整體走勢疲弱，外資賣超影響隔日市場情緒。,2025-08-12 02:42:19,15
2024-11-27,0.3,市場情緒轉趨謹慎，電子權值股與貨櫃三雄走弱拖累大盤，外資賣超組裝代工廠，AI伺服器概念股表現相對強勢。,2025-08-12 02:42:23,15
2024-11-28,0.2,川普關稅政策引發市場擔憂，台股震盪加劇，但鴻海等台廠已全球佈局，影響有限。AI族群回神，展望未來仍看漲。整體而言，市場情緒偏向負面，短期內股價可能承壓。,2025-08-12 02:42:27,15
2024-11-29,0.3,市場情緒偏空，指數下跌且量能不足，但個別強勢股如 BBU、美國優先概念股表現抗跌，顯示內資主導的中小型股仍有機會。,2025-08-12 02:42:31,15
2024-11-30,0.3,美國總統當選人川普放話對墨西哥等國加徵關稅引發市場擔憂，外資連賣四天，股價失守200元，跌破季線。,2025-08-12 02:42:34,15
2024-12-01,0.6,整體而言，12月作帳行情可期，但外資賣壓持續且FOMC會議結果不確定性影響市場情緒。,2025-08-12 02:42:36,15
2024-12-02,0.7,美股創高帶動台股反彈，電子權值股全面走強，加上網通、AI 概念股表現亮眼，激勵市場情緒回升，但成交量不足且個別族群漲跌分歧，預期短線仍將維持區間整理格局。,2025-08-12 02:42:40,15
2024-12-04,0.7,台積電與鴻海領漲帶動大盤上攻，千金股比價行情發酵，以及光通訊與 BBU 電容題材助攻，三利多激勵市場情緒偏正面。,2025-08-12 02:42:59,15
2024-12-05,0.7,外資連四買超並加碼台積電，搭配投信、集團作帳與年底作夢行情，激勵市場情緒偏多，但漲幅收斂顯示獲利了結壓力仍在。,2025-08-12 02:43:03,15
2024-12-06,0.6,市場情緒偏正面，多空勢力拉鋸，預期隔日股價將呈現區間整理走勢。主要原因包括：1)投信買超金融股且賣超鴻海，顯示對鴻海後市看法保守；2)外資買超華航、富邦金等個股，但也賣超鴻準、神達等相關股票，反映市場對鴻海的信心參差不齊。整體而言，雖有部分利多消息如新台幣升值、集團作帳行情等，但負面因素如三星研發罷工、INTEL執行長下台、鴻海出清Vizio持股等，也使得市場對鴻海的看法趨於謹慎。因此，預計隔日股價將在目前位置附近震盪整理，短期內難有明顯漲跌。,2025-08-12 02:43:09,15
2024-12-07,0.7,多項正面消息包括合併案送件、AWS 投片台積電、緯穎部署 AWS Outposts 等有利產業發展，但市場仍需時間消化。,2025-08-12 02:43:12,15
2024-12-08,0.7,AI 基本面穩健、經濟數據支撐及外資淨空單降低等利多消息支撐市場情緒，但川普關稅言論仍帶來波動風險。ETF 00905 多因子選股策略有望掌握台股產業脈動，提供穩健報酬。,2025-08-12 02:43:15,15
2024-12-09,0.7,鴻海子公司揚信科技與渣打銀行完成 22 億元綠色貸款，顯示集團持續落實 ESG，並強化高雄電池中心的綠建築專案，有利於長期營運發展。三大法人中，外資連五買超鴻海，投信則小幅賣超，整體籌碼面偏多，但需留意權值股表現與市場情緒變化。,2025-08-12 02:43:19,15
2024-12-10,0.3,市場情緒偏弱，電子權值股普遍走跌拖累大盤，但傳產族群如玻璃、紡織等表現抗跌，外資連六賣後轉為小幅賣超，投信也加入賣超行列。,2025-08-12 02:43:23,15
2024-12-11,0.3,美股下挫影響台股開低走低，權值股普遍下跌，但高價股表現強勢，中小型股有表現機會。加上台股基本面穩健，建議投資者以選股為主，關注具有高成長性及獲利能力的標的，同時留意盤勢震盪中的反彈契機。,2025-08-12 02:43:27,15
2024-12-12,0.7,市場情緒轉趨樂觀，指數重返2萬3大關，權值股台積電除息後秒填息，聯發科獲利消息激勵，外資雖小幅賣超但投信持續進場，整體呈現多頭排列。汽車零組件族群轉強，AI伺服器市場動能增強，鴻海2025年每股盈餘有望挑戰17元以上，展望樂觀。加上美CPI符合預期，Fed降息機率高，台股年底作帳行情可期。,2025-08-12 02:43:32,15
2024-12-13,0.7,多空消息交錯，營收、獲利表現符合預期，但外資賣超與債券 ETF 提款壓力仍在，加上蘋果 AirPods 新廠啟用利多，整體市場情緒中性偏正面。,2025-08-12 02:43:36,15
2024-12-15,0.7,鴻海集團積極布局 AI 伺服器、光通訊技術與智慧建築市場，營收創高且獲利前景穩健，激勵正面市場情緒。,2025-08-12 02:43:39,15
2024-12-16,0.7,市場情緒偏正面，股價有望上漲。主要原因包括：1) 投信買超且連續多日買超；2) 鴻海等權值股強勢表現；3) AI 產業前景看俏；4) 台積電領先地位穩固。然而，市場仍需關注美國 PCE 數據、台指期結算和 FED 決策等因素的影響。,2025-08-12 02:43:44,15
2024-12-17,0.7,市場情緒偏正面，股價有機會上漲，但鴻海股價低迷主要是因為被剔除出兩檔 ETF 成分股，以及 11 月營收表現不如預期。加權指數今日開高走低，終場下跌 21.89 點，收在 23018.01 點，成交量縮小至 3991.44 億，雖然拉回不過扣除【台積電】的回檔下指數仍是上漲，加上櫃買指數也在日線連七黑後出現一根長紅 K 棒外資也連續兩天買超台股，目前將有利多頭行情的延續，選股重於選市。,2025-08-12 02:43:50,15
2024-12-18,0.7,鴻海積極進軍電動車與汽車零組件領域，激勵市場情緒偏多，但整體盤勢仍受美股影響而呈現區間震盪。,2025-08-12 02:43:53,15
2024-12-19,0.6,市場情緒偏空，美聯儲鷹派言論引發投資人擔憂，但部分科技股如光通訊、機器人概念股表現相對抗跌，顯示內資主導的中小型股有望成為短線焦點。,2025-08-12 02:43:57,15
2024-12-20,0.6,鴻海與雲林縣政府合作推動「AI 智慧城市 2.0」系列計畫，涵蓋交通、觀光、醫療、人才培育等領域，有利於提升公司在 AI 和智慧城市相關業務的發展前景。,2025-08-12 02:44:02,15
2024-12-21,0.6,雖有多項利多消息如華航大手筆購機、鄉林啟動都更案等，但鴻海收購日產汽車股權傳出暫停，打擊市場信心，整體情緒偏中性。,2025-08-12 02:44:04,15
2024-12-22,0.3,籌碼面與消息面皆偏空，外資提前結帳且聖誕假期即將來臨，加上美國新總統就任的不確定性因素，使市場情緒轉為中性。,2025-08-12 02:44:07,15
2024-12-23,0.8,通膨壓力緩解、經濟強勁及半導體產業需求穩健等正面因素激勵市場情緒，股價有望延續反彈走勢。鴻海、高附加價值業務比重提升、新旗艦裝置 NPI/量產案、跨區製造佈局優化等利多消息可能推升隔日股價上漲。,2025-08-12 02:44:11,15
2024-12-24,0.6,鴻海宣布與 Porotech 合作進軍 AR 眼鏡市場，並計畫在台中建立 MicroLED 晶圓製程產線，預計在 2025 年第 4 季開始量產，顯示出對未來技術的投資和發展前景。加上外資買超、自營商連續兩日買超，以及三大法人合計買超等因素，整體市場情緒趨於正面，有利隔日股價表現。,2025-08-12 02:44:16,15
2024-12-25,0.7,"市場情緒偏正面，多頭趨勢延續。鴻海集團旗下個股表現強勁，機器人、光學等題材股持續吸引買盤進駐，外資放假影響交易量，但內資主導的作帳行情仍在進行中。

====================

請參考上述範例輸出格式回覆。",2025-08-12 02:44:20,15
2024-12-26,0.7,鴻海與英商 Porotech 合作超薄 AR 眼鏡市場，激勵相關光學元件供應鏈如玉晶光強勢表現，搭配電池股走強，帶動本日台股小幅上漲。,2025-08-12 02:44:24,15
2024-12-27,0.6,夏普出售相機模組資產給鴻海子公司 Fullertain Information Technologies，顯示鴻海集團整合夏普業務的決心，但短期內對股價影響有限。,2025-08-12 02:44:28,15
2024-12-28,0.7,多項併購、收購與業務擴張計畫顯示公司積極佈局，激勵市場情緒但短期獲利能力可能受到影響。,2025-08-12 02:44:30,15
2024-12-29,0.7,鴻海子公司工業富聯取得 ASPICE V4.0 及 ASPICE for Cyber​​security V1.0 CL2 等級認證，顯示其在汽車軟體開發管理方面的能力獲得國際認可，有助於提升產品品質與市場競爭力。,2025-08-12 02:44:33,15
2024-12-30,0.6,"市場情緒偏中性，指數量縮震盪整理。權值股走弱，營建、軍工航太等類股表現亮眼。外資休息，台積電法說會利多展望可期，CES 展與遊戲電玩展題材發酵，交易量有望放大，指數挑戰 24,000 點大關。",2025-08-12 02:44:38,15
2025-01-01,0.7,太空衛星ETF表現亮眼，受惠川普政策概念，激勵市場情緒，但半導體ETF漲幅有限，顯示投資人對產業前景仍持審慎態度。,2025-08-12 02:44:56,15
2025-01-02,0.3,市場情緒偏向負面，指數下跌且成交量增溫，主要受到美股拉回影響，加上外資持續賣超，權值股如台積電、鴻海等走弱。雖然下檔半年線有撐，但整體呈現區間震盪格局，需留意大選後的政策風險。,2025-08-12 02:45:00,15
2025-01-03,0.7,市場情緒偏正面，股價可能上漲。新聞中提到外資買超、權值股表現相對平淡，但整體來看，市場信心仍然穩健，需求前景良好，加上公司與開鴻能源的合作案，以及持續推動綠能投資，有望為公司帶來長期穩定的收益。同時，三大法人皆回頭買超，顯示對市場情緒有正面影響。因此，整體而言，股價可能上漲。,2025-08-12 02:45:05,15
2025-01-05,0.7,營收創歷史次高且全年增長優於預期，加上 AI 伺服器出貨看俏，激勵市場情緒偏正面，但仍需留意傳統淡季效應。,2025-08-12 02:45:23,15
2025-01-07,0.7,市場情緒偏正面，股價有望上漲。主要原因包括：1) 美股大幅跳升，費城半導體指數大幅上漲；2) 台積電 ADR 大漲 5.46%，日月光 ADR 上漲 4.21%；3) 台股在台積電續創新高下，早盤一度大漲近 400 點；4) 外資連三買超逾 727 億元。,2025-08-12 02:45:44,15
2025-01-08,0.3,新台幣貶值壓力加劇，對出口導向的科技產業造成負面影響，市場情緒轉為偏空。,2025-08-12 02:45:47,15
2025-01-09,0.3,市場情緒偏弱，電子權值股與航運類股表現疲軟，外資連賣兩日，加上美國經濟數據引發擔憂，拖累大盤下跌。部分個股如生技股、網通光通訊等有所支撐，但整體而言市場信心仍然不足。,2025-08-12 02:45:51,15
2025-01-10,0.3,台股在營收公布後出現震盪整理，三大法人連續賣超且外資持續調節鴻海等權值股，加上美國對中國科技封鎖進一步升級的不確定性影響，市場情緒轉趨保守。,2025-08-12 02:45:55,15
2025-01-11,0.7,多項正面訊息激勵市場情緒，如輝達執行長發表主題演講、台積電營收創高、鴻海全年營收締新猷等，整體呈現樂觀氛圍。,2025-08-12 02:45:58,15
2025-01-13,0.3,市場情緒偏向負面，股價可能下跌。主要原因包括美國非農就業數據強勁、通膨壓力再起導致降息預期降溫，以及台積電等權值股走弱。加上外資連賣四日，籌碼面也對市場產生一定影響。雖然部分塑化和軍工類股表現較強，但整體而言，短期內台股仍處於橫向整理格局，難以大幅走高。需要關注本周的美國 CPI 數據、台積電法說會，以及輝達等科技巨頭的財報和展望，以獲得更多市場信心。選股方面，建議聚焦在 BBU 和自動化機器人類股，因為這些領域有望受益於政策支持和產業升級趨勢。,2025-08-12 02:46:04,15
2025-01-14,0.7,輝達來台參加尾牙與供應鏈會面，AI需求穩健、基本面強勁，激勵市場情緒偏正面，但美債殖利率走高、出口數據優於預期等因素使盤勢維持區間整理。,2025-08-12 02:46:08,15
2025-01-15,0.3,市場觀望氣氛濃厚，加權指數開低走低，失守半年線，外資連六賣，電子權值股遭提款，但投信連三買，美債 ETF 受青睞。台積電法說會前夕，市場不確定因素影響，選股重於選市。,2025-08-12 02:46:12,15
2025-01-16,0.8,台積電法說會報喜，股價強勢表態，加上美股反彈激勵，大盤站穩所有均線之上，多頭行情延續。機器人、矽光子概念股等主流股強勢演出。,2025-08-12 02:46:16,15
2025-01-18,0.9,高層會面與產業前景樂觀激勵市場情緒，AI 應用商機可期。,2025-08-12 02:46:34,15
2025-01-19,0.3,外資賣超鴻海等大型權值股，反映市場觀望氣氛濃厚，同時農曆年封關前國際金融情勢變數多，壓抑行情表現。,2025-08-12 02:46:37,15
2025-01-20,0.8,AI 伺服器需求強勁，水冷散熱技術成為主流，奇鋐、雙鴻等公司受惠，營收獲利成長可期。加權指數上漲，外資連三買，多頭行情延續。,2025-08-12 02:46:41,15
2025-01-21,0.7,"美股與台股連動性高，川普重視資本市場政策有利股市表現，加上 AI 類股行情持續，建議擇優抱股過年。市值成長型 ETF 國泰台灣領袖 50(00922-TW)掌握台股上攻動能。

0.6
外資連四買超，三大法人合計賣超金額縮小至 5.8 億元，市場情緒回暖。川普延遲關稅決策、黃仁勳訪台行程激起 AI 概念股熱潮，焦點集中於川普政策動向、日本央行利率決策、科技股財報及封關等因素。權值股漲跌互見，鴻海籌碼面回穩，技術面呈現 W 底形態。",2025-08-12 02:46:46,15
2025-01-22,0.7,權值股領軍大盤上攻，電子族群強勢表現，搭配封關日行情，激勵市場情緒偏多，但仍需留意後市能否延續漲勢。,2025-08-12 02:46:50,15
2025-01-23,0.7,AI/AR 眼鏡產業前景看俏，相關個股強勢表現激勵市場情緒，但鴻海股價下跌至 200 日線以下，短期超跌低位階機會浮現。,2025-08-12 02:46:53,15
2025-01-24,0.9,NVIDIA 執行長的肯定與鴻海營運續創高點顯示公司表現亮眼，激勵正面市場情緒。,2025-08-12 02:46:55,15
2025-01-29,0.7,AI 基礎建設題材持續發酵，相關個股如廣達、緯創、鴻海等走勢強勁，市場情緒正面。,2025-08-12 02:46:57,15
2025-01-30,0.7,富邦與保德信兩檔市值動能 ETF 新兵募集，顯示市場對台股成長潛力的正面看待，但費用率仍是投資人需留意的重點。,2025-08-12 02:47:00,15
2025-02-02,0.7,轉型效益顯現與矽光子需求增溫帶動下半年營運優於預期，激勵市場情緒向上。,2025-08-12 02:47:03,15
2025-02-03,0.3,市場情緒偏空，股價可能下跌。主要原因包括：1) DeepSeek 的崛起對 AI 產業帶來短期壓力；2) 川普宣布對中、墨、加徵收關稅，引發貿易戰擔憂；3) 三大法人合計賣超 850.5 億元，其中外資賣超 743.9 億元，為史上第 8 大賣超。,2025-08-12 02:47:07,15
2025-02-04,0.6,市場情緒略為回溫，但外資持續賣超及美股四大指數全面下跌壓抑漲幅，整體仍偏中性。,2025-08-12 02:47:11,15
2025-02-05,0.7,電子權值股領漲、千金股比價帶動下，台股反彈收復月線季線，市場情緒轉為正面，但仍需觀察後續 DeepSeek 影響與關稅戰發展。,2025-08-12 02:47:15,15
2025-02-06,0.7,美股全面反彈帶動台股大漲，三大法人同步買超，外資連二買，技術面強勢反彈，多頭氣盛。,2025-08-12 02:47:18,15
2025-02-07,0.7,"市場情緒偏正面，電子權值股與高價股領漲，加上 AI 概念股強勁表現，帶動指數上揚，但非電族群走勢疲弱。

市場對鴻海收購日產的可能性持開放態度，並期待相關合作案能促進雙方成長。同時，AI 概念股如世芯 - KY、達邁等強勁表現，也為市場注入活力。此外，台積電漲幅超過 0.9%，顯示大型權值股的穩健表現也對整體市場情緒產生正面影響。然而，非電子族群如華城、航空雙雄和台塑四寶等則普遍走跌，導致市場分化加劇。總體而言，儘管非電族群表現不佳，但電子股的強勁表現仍然支撐了整體市場情緒，使得指數上漲。",2025-08-12 02:47:24,15
2025-02-08,0.3,高層異動頻繁與內部人減持訊號，引發市場擔憂，短期情緒偏空。,2025-08-12 02:47:26,15
