date,factor,explanation,updated_time,news_count
2023-12-07,0.3,美股四大指數下挫拖累台股走弱，雖有風電、低軌衛星和伺服器族群支撐，但航運、MCU概念股走勢疲軟，終場加權指數收黑。三大法人合計賣超99億元，外資轉賣超51.59億元，自營商連7賣55.73億元，投信買超8.32億元。台積電、聯發科等權值股表現分歧，半導體族群相對強勢，但散裝航運和MCU概念股走弱。外資跟投信若能持續加碼，有利多頭延續。,2025-08-04 20:33:01,20
2023-12-08,0.7,"AI 概念股與半導體領漲，電子族群表現強勁，指數收復五日、十日線，三大法人買超 122 億元，多頭格局維持，但高檔套牢區橫向震盪，靜待美國非農就業報告與 FOMC 利率決策會議。個股方面，台積電、聯發科漲幅顯著，AI 概念股如創意 強攻漲停，IC 設計族群普遍走揚。

0.6
電子類股領漲，AI 概念股與半導體表現強勁，但高檔套牢區橫向震盪，靜待美國非農就業報告與 FOMC 利率決策會議。個股方面，台積電、聯發科漲幅顯著，AI 概念股如創意 強攻漲停，IC 設計族群普遍走揚。",2025-08-04 20:33:07,20
2023-12-09,0.7,創意與 IP 族群受惠自研晶片趨勢，股價強漲，但市場情緒仍受到大盤震盪影響而維持中高檔。,2025-08-04 20:33:09,20
2023-12-11,0.6,美就業數據優於預期使降息時點延後，台股高檔震盪整理，AI、IC 設計等族群輪動，但量能不足，操作宜汰弱留強。,2025-08-04 20:33:13,20
2023-12-12,0.7,投信買超標的與法人籌碼集中，搭配半導體族群強勢表現，激勵市場情緒向上。,2025-08-04 20:33:16,20
2023-12-13,0.7,AI、半導體等科技產業展望樂觀，帶動相關個股漲勢，但成交量不足且輪動快速，市場情緒偏向正面但仍需留意追高風險。,2025-08-04 20:33:20,20
2023-12-14,0.7,臺股創高帶動市場情緒樂觀，但個股表現分歧，半導體族群漲勢強勁，受惠總統選舉行情與產業前景。,2025-08-04 20:33:22,20
2023-12-15,0.7,AI PC 潛力股創意受青睞，搭配半導體、記憶體等族群強勢表現，激勵市場情緒向上。,2025-08-04 20:33:26,20
2023-12-17,0.6,意外發現的二維薄冰鐵電性與新型憶阻器潛力，為奈米科技帶來新的可能性，激勵市場對未來應用前景的正面期待。,2025-08-04 20:33:30,20
2023-12-18,0.6,AI 潛力股受惠邊緣 AI 發展，聯發科成千金將帶動相關 IC 設計股漲勢，但目前估值仍偏低。,2025-08-04 20:33:33,20
2023-12-19,0.6,市場情緒偏正面，主因為鋼鐵股震盪後翻紅，以及電子股如創意、弘塑等漲停帶動，但整體行情仍處於震盪盤。,2025-08-04 20:33:36,20
2023-12-20,0.7,營收與獲利成長、產品推出及優惠活動等正面消息帶動市場情緒，股價有望上漲。,2025-08-04 20:33:39,20
2023-12-21,0.3,市場情緒受到美股重挫影響而轉為中性，雖有 AI 伺服器概念股逆勢上漲，但整體行情仍呈現震盪走低。,2025-08-04 20:33:41,20
2023-12-22,0.7,電子權值股反彈、航運股續強以及 AI PC 族群走勢，激勵指數開高震盪，重新站回十日線，但記憶體族群表現不夠強勁，且部分個股出現獲利了結賣壓。,2025-08-04 20:33:45,20
2023-12-23,0.7,產業前景樂觀、AI題材發酵與英特爾新品助攻，激勵市場情緒，但高檔震盪與獲利了結賣壓仍在。,2025-08-04 20:33:47,20
2023-12-25,0.6,CES 展將帶動 AI 應用商機，相關 IC 設計、IP 等族群受惠，但個股表現差異大，建議鎖定具轉機或低基期個股。,2025-08-04 20:33:51,20
2023-12-26,0.7,耶誕行情與 AI PC 概念股帶動下，指數大漲逾百點，多檔個股強勢表現，市場資金回流，展望明年第一季走高。,2025-08-04 20:33:53,20
2023-12-27,0.7,中國信託積極布局數位金融與永續發展，透過創新展示區和活動區展現科技實力，激勵市場對該公司前景的正面看法。,2025-08-04 20:33:56,20
2023-12-29,0.9,AI 概念股全面點火，千金股股王世芯 - KY 全年飆漲 3.16 倍，帶動電子五哥、緯穎及相關概念股強勢表態，顯示市場對 AI 題材的高度期待。,2025-08-04 20:34:00,20
2023-12-30,0.7,AI 應用成長趨勢明確，相關半導體指標股走揚，但操作需謹慎選擇個股，避開漲多高位階的 IP 股。,2025-08-04 20:34:02,20
2023-12-31,0.7,AI 應用商機與科技展題材激勵市場情緒，半導體、記憶體、散熱等相關族群受惠。,2025-08-04 20:34:04,20
2024-01-02,0.6,大盤漲勢延續但個股輪動加快，傳產補漲股表現較佳，電子權值股走弱，AI 概念股震盪整理。,2025-08-04 20:34:08,20
2024-01-03,0.7,生成式 AI 普及、女性科技崛起以及 AI 助理提升開發者生產力等趨勢顯示創新驅動經濟成長，激勵市場情緒偏正面。,2025-08-04 20:34:11,20
2024-01-04,0.3,權值股疲弱與高價股重挫拖累大盤走勢，航運類股雖強漲但難以扭轉整體市場悲觀情緒。,2025-08-04 20:34:13,20
2024-01-05,0.6,處分土地資產帶來一次性收益，但對於公司未來營運成長或獲利能力的正面影響有限，市場情緒溫和偏多。,2025-08-04 20:34:15,20
2024-01-09,0.7,"選前觀望氣氛濃厚，市場情緒中性，但 AI 與 IP 族群維持強勢表現，預期選後有補漲機會。

====================

綜合以上所有新聞內容，整體而言對 創意 股票市場情緒的影響為 0.7。主要原因是雖然選前觀望氣氛濃厚，但 AI 與 IP 族群維持強勢表現，預期選後有補漲機會。",2025-08-04 20:34:19,20
2024-01-11,0.7,AI、IC 設計族群強勢表現，搭配投信連 9 買及官股加碼，激勵市場情緒上漲，但權值股走勢平平，整體維持中高檔偏多格局。,2025-08-04 20:34:44,20
2024-01-12,0.7,"AI 半導體趨勢強勁，輝達股價續創新高，帶動相關概念股走強，搭配元月半導體 ETF 配息旺季，有利台灣半導體供應鏈營收成長。

---

IC 設計族群中智原、世芯、M31、巨有科技等表現亮眼，反映特定應用積體電路 (ASIC) 市況熱絡。晶豪科、驊訊、通嘉、信驊、凌陽、旺玖、威鋒電子和敦泰等低位階個股值得留意。",2025-08-04 20:34:49,20
2024-01-13,0.7,選舉結果底定帶來不確定性消除，投信與外資買超力道強勁，加上 AI 股轉強，激勵市場情緒走揚。,2025-08-04 20:34:51,20
2024-01-16,0.7,投信持續買超多檔電子股，顯示對相關族群的偏好與信心，激勵市場情緒。,2025-08-04 20:34:53,20
2024-01-17,0.3,地緣政治緊張局勢升溫、美債利率飆升與超級財報週開低，拖累科技股表現，AI族群雖仍強勁但整體市場情緒偏向保守。,2025-08-04 20:34:55,20
2024-01-18,0.6,市場情緒中性，股價呈現小幅上漲。權值股台積電穩盤帶動指數反彈，但中小型股仍弱勢，顯示市場信心尚未完全恢復。政府護盤力道強勁，暗示季線附近為相對低點，後續需觀察三天內能否止跌回升。,2025-08-04 20:34:59,20
2024-01-19,0.7,台積電法說報喜與外資升評激勵股價強彈，半導體、AI 與先進封裝供應鏈同步走強，市場情緒偏正面。,2025-08-04 20:35:02,20
2024-01-20,0.7,AI 應用帶動 3D-IC 技術發展，創意電子領先業界完成投片驗證，有望成為公司未來核心競爭力。整體而言市場情緒偏正面，但需留意總經因素影響。,2025-08-04 20:35:05,20
2024-01-21,0.7,先進製程與封裝技術持續推進，相關設備與服務需求強勁，激勵市場情緒偏正面。,2025-08-04 20:35:08,20
2024-01-22,0.7,AI 股領軍衝鋒，廣達、緯創等指標股強勢表態，搭配美超微大漲，顯示 AI 趨勢持續向上，相關個股後市看俏。,2025-08-04 20:35:12,20
2024-01-23,0.7,矽智財族群受惠 AI 需求爆發，營收成長與高毛利率帶動市場信心，但股價已大幅上漲，短期獲利了結賣壓可能出籠。,2025-08-04 20:35:14,20
2024-01-25,0.3,美系外資調降 (3443-TW) 創意營收展望，加上 AI 股震盪整理，拖累大盤漲幅收斂。,2025-08-04 20:35:38,20
2024-01-26,0.6,雖然公司舉辦自動化機器人比賽以培養當地人才，但整體而言，新聞內容並未提供足夠的資訊來判斷對該公司股票市場情緒的影響。因此，我將市場情緒評為中性。,2025-08-04 20:35:41,20
2024-01-30,0.7,半導體 ETF 受益人數成長與台股創高激勵市場信心，但產業展望仍需財報確認。,2025-08-04 20:35:44,20
2024-02-01,0.7,都更案帶動區域發展與房市需求，綠地景觀公園提升生活品質，展現企業社會責任，激勵正面市場情緒。,2025-08-04 20:36:06,20
2024-02-02,0.7,AI、IP 股持續強勢，美超微、輝達領漲美股，帶動台股電子族群表現，多頭格局不變，但須留意漲多個股的獲利了結賣壓。,2025-08-04 20:36:10,20
2024-02-04,0.6,展望樂觀且 AI 伺服器需求強勁，但上游晶片供給仍是隱憂，電動車量產交車有信心，區域製造策略推進中，整體市場情緒偏正面但仍需關注供應鏈狀況。,2025-08-04 20:36:12,20
2024-02-05,0.3,市場情緒偏空，AI 股漲多拉回，法說會釋出利空訊息衝擊個股表現。,2025-08-04 20:36:15,20
2024-02-13,0.7,權重調升與指數成分股變動提振市場信心，但漲幅受制於整體新興市場表現。,2025-08-04 20:36:17,20
2024-02-15,0.7,AI 題材持續發酵，美超微、ARM 股價飆漲，帶動相關概念股強勢表現，預期 AI 伺服器出貨量將大幅成長，台灣供應鏈中技嘉、奇鋐、雙鴻、川湖等具備補漲空間；IP 產業訂單外溢至二線廠，金麗科、神盾、安國等受惠，前鼎、上詮則是 CPO 新需求概念股。,2025-08-04 20:36:22,20
2024-02-18,0.7,台積電股價創新高、MSCI 調升權重及獲利表現亮眼等正面消息帶動市場情緒，但囤房稅 2.0 最快三月底上路的潛在影響使短期漲幅受限。,2025-08-04 20:36:24,20
2024-02-19,0.6,AI 股漲多拉回壓力大，資金轉向業績成長的中小型股。操作宜選擇具基本面支撐且價差大的個股，並留意元宵節後可能出現的變盤風險。,2025-08-04 20:36:28,20
2024-02-20,0.9,權值股回神、IC設計族群強勢表現，紡織業景氣回溫及紅海危機帶動散裝航運反彈，多頭行情延續。,2025-08-04 20:36:31,20
2024-02-21,0.3,"AI 概念股受輝達財報利空影響而下跌，市場情緒轉為謹慎，但長期趨勢仍看漲，短線整理後有望反彈。其他如高價股、矽光子族群等亦出現修正，顯示漲多個股面臨獲利了結賣壓。

---

0.5
佳格投資健康產業新創公司，展現對該領域的長期支持與信心，有助於提升品牌形象並開拓新的商機。整體而言，該消息對公司和相關產業具有正面影響。",2025-08-04 20:36:36,20
2024-02-22,0.7,半導體產業鏈持續受惠於輝達財報優異表現，台積電、聯發科等指標股領漲，加上台灣晶片業者在日本擴張的消息帶動市場情緒，整體呈現正面。,2025-08-04 20:36:38,20
2024-02-26,0.7,新辦公室設計展現創新思維與員工關懷，激勵正面市場情緒，但獲利細節仍待進一步評估。,2025-08-04 20:37:01,20
2024-02-27,0.7,AI 伺服器需求強勁與半導體 ETF 成分股中多檔千金股激勵市場情緒，但漲幅過大後的技術面修正壓抑短期漲勢。,2025-08-04 20:37:04,20
2024-02-29,0.7,AI 應用持續擴大與創新，相關概念股漲勢延續，但個別股價波動劇烈，投資人宜選擇基本面穩健的標的。,2025-08-04 20:37:08,20
2024-03-01,0.7,AI 概念股強勢表現與類比 IC 廠商急單湧入，顯示產業前景樂觀，激勵市場情緒偏正面。,2025-08-04 20:37:11,20
2024-03-05,0.7,市場情緒偏正面，AI 概念股強勢表現帶動科技類股上漲，但部分個股回檔壓力仍在。,2025-08-04 20:37:14,20
2024-03-07,0.9,台股再創新高，多頭行情延續，加上 AI 伺服器供應鏈、散熱、機殼、PCB 等族群輪漲，激勵市場信心。,2025-08-04 20:37:36,20
2024-03-10,0.7,AI 熱潮持續，千金股受惠，但漲多個股出現獲利了結賣壓，市場情緒偏正面但短線波動加劇。,2025-08-04 20:37:39,20
2024-03-13,0.7,AI 概念股漲跌互見，市場情緒偏向正面，但整體漲幅有限。重電族群受惠政策利多，表現強勁。電子權值股台積電、鴻海等維持穩健，但中小型個股普遍下挫。展望後市，市場關注 AI 發展和法人的季底作帳行情，選股可留意重電、AI 設備概念股等。,2025-08-04 20:37:44,20
2024-03-14,0.7,英特爾推出 AI PC 加速計畫，帶動相關概念股漲勢，但市場仍關注通膨數據與降息預期，引發高檔震盪疑慮。,2025-08-04 20:37:47,20
2024-03-15,0.3,市場情緒轉為中性，股價震盪整理。雖然黑松持續進化智販機功能，但目前台股受到美國通膨數據超出預期、聯準會降息機率下滑等因素影響，導致美元走強，亞幣貶值，費半和日經指數拉回，台積電和加權指數同步失守 5MA，整體市場呈現修正格局。雖然鴻海法說報喜，但大盤成交量仍高達 5558 億元，顯示資金並未完全退場，而是從高檔股轉向低檔補漲股。目前市場震盪可能還要持續一兩週，投資人應謹慎操作，留意法人結帳賣壓和 ETF 的影響。,2025-08-04 20:37:53,20
2024-03-18,0.7,高股息 ETF 漏網之魚成補漲焦點，基本面強勁且殖利率較高的個股有望受惠。,2025-08-04 20:37:55,20
2024-03-20,0.6,輝達 GTC 大會與 ETF 之亂影響台股走勢，三月底法人作帳、結帳賣壓仍在，IP 股有機會反攻，但整體市場情緒偏中性。,2025-08-04 20:37:59,20
2024-03-22,0.7,美股三大指數續創歷史新高，企業財報與資金寬鬆推升美股強勢，激勵台股維持多方格局，但須留意量能變化、外資買盤力道及個股漲多後的籌碼凌亂問題。,2025-08-04 20:38:02,20
2024-03-24,0.3,投信買超力道強勁且外資同步加碼大型股，但市場擔憂集中度過高與架構不健康可能影響長線行情。,2025-08-04 20:38:04,20
2024-03-25,0.6,市場情緒受惠 AI 題材與投信買盤支撐，惟個股漲多修正壓力仍在，需留意基期過高的個股。,2025-08-04 20:38:06,20
2024-03-26,0.3,電子權值股疲弱拖累大盤回測萬九關卡，傳產與金融股撐盤有限，市場情緒偏向保守。,2025-08-04 20:38:08,20
2024-03-27,0.7,多頭趨勢維持，選股聚焦營收成長股、政策作多股與題材炒作股，但短線震盪加劇，操作以買黑賣紅為宜。,2025-08-04 20:38:12,20
2024-03-29,0.7,AI 概念股持續強勢，搭配 ETF 建倉行情與集團作帳，激勵市場情緒偏正面，但漲多個股拉回壓力仍在。,2025-08-04 20:38:15,20
2024-04-01,0.7,投信連續買超 22 天挹注市場信心，AI、散熱等族群表現強勁，整體市場情緒偏正面。,2025-08-04 20:38:18,20
2024-04-02,0.7,AI 應用與先進製程需求強勁，帶動半導體族群表現，搭配投信連續買超，激勵市場情緒走揚。,2025-08-04 20:38:22,20
2024-04-08,0.6,台積電領軍下，電子權值股普遍走揚，加上重電、AI 及 PCB 族群同步點火，激勵市場情緒，但高價股與部分個股表現疲弱，整體漲勢略顯溫和。,2025-08-04 20:38:24,20
2024-04-09,0.7,營收大幅成長顯示公司業績強勁，激勵市場情緒上漲，但整體產業表現仍需觀察。,2025-08-04 20:38:26,20
2024-04-10,0.7,營收大幅成長但股價下跌，顯示市場對短期獲利能力存疑，預計在財報釋出前市場情緒將持續偏空。,2025-08-04 20:38:30,20
2024-04-12,0.7,美股反彈激勵台股上漲，科技與蘋概股領漲，但需留意外資操作、航運股走勢與政策題材續航力道。,2025-08-04 20:38:32,20
2024-04-15,0.3,地緣政治衝突引發市場恐慌，電子權值股走弱，加上外資賣壓，台股大跌 286 點，收盤失守 10 日線。政策與原物料股受惠題材，但電子股面臨高檔震盪風險。,2025-08-04 20:38:35,20
2024-04-16,0.3,中東地緣政治衝突、美債殖利率上升及美國零售銷售數據優於預期等因素影響，台股大跌547點，失守2萬點關卡，月線也告失守。雖然部分個股如矽智財、重電、軍工等表現相對強勢，但整體市場情緒偏向負面，短期內需觀察止跌訊號或支撐力道。,2025-08-04 20:38:40,20
2024-04-17,0.9,電子權值股領漲，加上重電與 AI 概念股強勁表現，激勵市場情緒樂觀。,2025-08-04 20:38:41,20
2024-04-19,0.2,市場信心受台積電產業展望調降、中東局勢緊張等負面因素影響，股價大幅修正拖累整體市場情緒走疲。,2025-08-04 20:39:05,20
2024-04-22,0.3,電子股普遍走跌，尤其是權值股與 AI 股表現疲弱，加上中東局勢緊張帶動油價上漲，資金轉向塑化紡織族群，但整體市場情緒仍偏空。,2025-08-04 20:39:07,20
2024-04-24,0.7,總統創新獎表彰企業與個人在各自領域的卓越成就與貢獻，凸顯產業創新動能，激勵市場情緒偏正面。,2025-08-04 20:39:11,20
2024-04-26,0.7,美股財報與經濟數據疲軟延後降息預期，但台股在三大法人買超及 AI 題材帶動下強勁反彈，月線反壓得而復失。個股方面，創意受惠 AI 訂單成長動能，股價亮燈漲停。,2025-08-04 20:39:36,20
2024-04-27,0.7,AI 題材持續發酵，相關個股跌深反彈，但市場仍對後市保持謹慎態度。,2025-08-04 20:39:38,20
2024-04-29,0.7,AI 產業趨勢持續，相關個股如世芯 - KY、創意 等表現強勁，帶動市場情緒正面。,2025-08-04 20:39:41,20
2024-05-02,0.6,台電獲獎凸顯其在環境永續與生態共融方面的努力，正面消息有助於提升公司形象，但對股價短期影響有限。,2025-08-04 20:39:44,20
2024-05-03,0.6,法說會釋出正面展望與強勁成長前景，但明年動能趨緩使市場情緒溫和偏多。,2025-08-04 20:39:46,20
2024-05-06,0.7,生成式 AI 與元宇宙發展趨勢下，HTC VIVE ORIGINALS 進軍 VTuber 領域，透過技術整合與內容產製，深化虛擬社群體驗，為未來元宇宙商機做準備。,2025-08-04 20:39:49,20
2024-05-07,0.6,雖然公司營收成長強勁，但股價表現相對疲弱，顯示市場情緒受到其他因素影響。,2025-08-04 20:39:52,20
2024-05-08,0.7,營收年增率前三名公司表現強勁，顯示基本面穩健，但市場情緒仍受到整體經濟與地緣政治因素影響而維持中性。,2025-08-04 20:39:55,20
2024-05-09,0.6,營收年增率前三名公司表現亮眼，激勵市場情緒，但整體而言中小型股營收成長動能仍待觀察。,2025-08-04 20:39:57,20
2024-05-11,0.6,市場情緒受投信籌碼動向影響，個股基本面仍是長期操作關鍵。,2025-08-04 20:39:59,20
2024-05-12,0.2,市場對於聯準會鷹派言論反應敏感，加上資金流向變化與重要經濟數據即將公布，整體市場情緒趨於保守。,2025-08-04 20:40:01,20
2024-05-13,0.7,AI、航運等族群強勢表現，搭配創意等個股亮眼財報，激勵市場情緒向上，但聯準會鷹派言論與通膨疑慮仍在，維持中性偏多判斷。,2025-08-04 20:40:05,20
2024-05-14,0.7,AI 概念股強勢表態，搭配產業展望樂觀與法說釋出正向訊息，激勵市場情緒走揚。,2025-08-04 20:40:08,20
2024-05-15,0.7,台積電創新高帶動大盤突破21000點關卡，外資連4買、投信連23買，多頭氣盛，加上美股四大指數全面上漲，激勵市場情緒走揚。,2025-08-04 20:40:12,20
2024-05-16,0.9,AI 應用需求大增，帶動創意營運成長可期，股東會釋出正面訊息，加上三大法人連五買，籌碼面偏多，有利股價持續向上。,2025-08-04 20:40:16,20
2024-05-17,0.3,台股量縮震盪，權值股走弱，部分電子股撐盤，但高價股、面板雙虎及貨櫃三雄表現疲軟，市場情緒偏空。,2025-08-04 20:40:18,20
2024-05-18,0.6,多檔 ETF 換股潮帶動，成分股調整頻繁，市場關注度提高，但個別公司基本面表現仍是影響股價的主要因素。,2025-08-04 20:40:20,20
2024-05-21,0.3,市場消化輝達財報與拜登補助政策等利多因素，電子權值股台積電、聯電有撐，但創意、信驊等高價股走跌，綠能環保、食品類股與半導體族群表現較強。整體而言，市場觀望氣氛濃厚，指數小幅下跌。,2025-08-04 20:40:25,20
2024-05-22,0.6,台塑企業與韓國頂尖大學 KAIST 建立產學研專案團隊，在生技、新能源領域展開合作，雖有利長期技術創新發展，但短期內對營收獲利貢獻有限。,2025-08-04 20:40:27,20
2024-05-23,0.3,輝達財報優於預期激勵股價大漲，但中共軍演利空衝擊市場信心，台股震盪走低。,2025-08-04 20:40:29,20
2024-05-24,0.3,市場情緒偏向中性，雖有部分個股表現強勁，但整體科技股普遍下跌，電子股走勢分歧，非科技類股如原物料、製藥等也有亮眼表現。,2025-08-04 20:40:32,20
2024-05-25,0.7,AI 熱潮推動 IP 股與 ASIC 股，台灣 IC 設計業前景光明。產業復甦、籌碼面穩定，股價有望持續上漲。,2025-08-04 20:40:35,20
2024-05-27,0.7,AI 概念股強勢表態，帶動台股創高，但部分電子個股如健鼎、群光等表現疲弱，整體市場情緒偏正面但仍需留意個別股票的走勢。,2025-08-04 20:40:38,20
2024-05-28,0.7,市場情緒偏正面，AI 概念股強勢表現帶動加權指數創高，但外資賣超、景氣燈號轉向黃紅燈等因素影響整體信心。,2025-08-04 20:40:41,20
2024-05-29,0.7,市場情緒偏正面，多空消息交錯，但整體呈現量縮輪動格局，短期操作為主。,2025-08-04 20:40:43,20
2024-05-30,0.6,市場信心受創，雖有產業前景穩健但短期操作困難，籌碼面問題需謹慎因應。,2025-08-04 20:40:46,20
2024-05-31,0.4,電子權值股與 AI 概念股疲弱，半導體族群走勢不振，加上 MSCI 季度調整盤後生效，台積電殺尾盤下跌 2%，拖累大盤重挫 190 點。,2025-08-04 20:40:49,20
2024-06-03,0.7,輝達執行長黃仁勳演講釋出利多消息，相關個股強勢表現，AI 題材持續發酵，半導體族群漲幅顯著，但需留意籌碼面問題。,2025-08-04 20:40:52,20
2024-06-04,0.7,AI 概念股強勢表現帶動市場情緒偏多，但籌碼面波動與個別公司基本面因素仍可能導致股價短期震盪，整體而言維持樂觀但謹慎的判斷。,2025-08-04 20:40:56,20
2024-06-05,0.6,AI 概念股漲多拉回整理，但整體市場情緒仍偏正面，預期在輝達財報釋出後，相關個股有望再度反彈。,2025-08-04 20:41:00,20
2024-06-06,0.7,台股創新高帶動市場情緒，輝達執行長對台積電的正面評論進一步提振信心，但個別股票籌碼面問題仍存在，整體而言中性偏多。,2025-08-04 20:41:03,20
2024-06-07,0.6,市場情緒偏向中性，部分獲利了結與資金輪動影響個股表現，但長期看好 AI、HBM 等相關概念股。,2025-08-04 20:41:06,20
2024-06-08,0.3,市場對公司獲利預估下修，營收表現平平，整體展望中性。,2025-08-04 20:41:08,20
2024-06-11,0.7,營收大幅成長但產業屬性與整體市場情緒不符，股價短期漲多後可能面臨獲利了結賣壓。,2025-08-04 20:41:11,20
2024-06-12,0.7,法人買超且基本面穩健的創意，股價有望延續漲勢。,2025-08-04 20:41:14,20
2024-06-13,0.6,營收與展店計畫帶動正面市場情緒，但獲利表現仍需時間改善，整體而言中性偏多。,2025-08-04 20:41:17,20
2024-06-16,0.7,台積電領軍衝刺帶動大盤創新高，但季底換股操作及聯準會官員談話將牽動資金敏感神經。,2025-08-04 20:41:40,20
2024-06-17,0.7,營收成長與法人買超支撐市場信心，基本面強勁且籌碼面穩定有助維持正面情緒。,2025-08-04 20:41:42,20
2024-06-18,0.7,"權值股與半導體族群領漲，搭配金融、傳產等類股助攻，激勵大盤再創新高，多頭氣勢強勁。加上 AI 概念股表現亮眼，顯示市場對相關產業前景樂觀。

====================

請問您是否需要我針對個別公司進行分析？",2025-08-04 20:41:46,20
2024-06-19,0.6,中華電信積極推動數位科技產業發展與培育數位文創人才，相關活動有助於提升公司在數位領域的影響力和形象。,2025-08-04 20:41:50,20
2024-06-20,0.7,政策概念股漲勢延續，WiFi7 概念股表現強勁，多頭趨勢不變，但個別股票操作仍需謹慎。,2025-08-04 20:41:54,20
2024-06-21,0.3,漲多拉回整理，市場觀望氣氛濃厚，個股表現分歧。,2025-08-04 20:41:57,20
2024-06-25,0.7,AI 伺服器需求強勁，相關個股表現亮眼，加上蘋概三王與貨櫃三雄拉抬，激勵市場情緒向上。,2025-08-04 20:42:21,20
2024-06-26,0.6,市場對公司未來獲利預估下修，營收成長趨緩，但整體財務表現仍維持正面。,2025-08-04 20:42:23,20
2024-06-27,0.6,市場對公司獲利預估上修且目標價調升，顯示基本面穩健，但整體股市波動加劇使市場情緒偏向中性。,2025-08-04 20:42:25,20
2024-06-28,0.7,市場情緒偏正面，股價可能上漲。創意為輝達股東會中提到的 AI 熱潮成長機會受惠族群，加上攜手台積電取得下世代 HBM4 關鍵的基礎介面晶片大單，營運前景穩健。,2025-08-04 20:42:29,20
2024-07-01,0.6,市場情緒中性，股價波動可能持續震盪整理。主要原因是美國 PCE 數據利多不漲，以及籌碼面疑慮，融資籌碼有疑慮的個股應謹慎操作。,2025-08-04 20:42:32,20
2024-07-02,0.4,營收成長動能趨緩與股價表現疲弱反映市場對公司後市的擔憂。,2025-08-04 20:42:36,20
