date,factor,explanation,updated_time,news_count
2022-11-01,0.7,半導體族群強勢表現與伺服器概念股上漲帶動市場情緒，惟匯率壓力及部分權值股疲軟使整體影響力有限。,2025-08-05 00:35:48,20
2022-11-02,0.6,市場信心逐漸恢復，中小型股表現亮眼，但量能不足與月線壓力使短期行情趨觀望。,2025-08-05 00:35:51,20
2022-11-03,0.6,市場情緒偏中性，雖然利空消息如升息、經濟衰退等影響盤勢，但伺服器族群與內資青睞的個股表現強勁，顯示部分類股仍有買盤支撐。,2025-08-05 00:35:54,20
2022-11-05,0.7,歐盟統一充電介面法案帶動 USB Type-C 概念股漲勢，嘉澤等相關公司受惠於市場需求增加。,2025-08-05 00:35:56,20
2022-11-09,0.7,營收報喜與市場信心回溫帶動科技股表現，搭配聯準會升息放緩預期提振市場情緒。,2025-08-05 00:35:58,20
2022-11-15,0.7,半導體族群領漲，投信買盤聚焦中小型股，市場情緒偏正面。,2025-08-05 00:36:01,20
2022-11-16,0.3,電子股普遍走揚，尤其是台積電等指標股帶動，但傳產與航運股疲弱拖累大盤表現，市場情緒偏向中性。,2025-08-05 00:36:03,20
2022-11-17,0.6,光學族群強勢表現與生技股轉強帶動市場信心，但指標個股走弱與技術指標過熱壓抑漲幅，短期市場情緒偏正面但波動加大。,2025-08-05 00:36:06,20
2022-11-21,0.6,"市場情緒受到多空消息交雜影響，整體呈現中性偏正面。防禦類股表現強勁，但電子權值股漲跌互見，指數尾盤翻紅機率增加。

====================

以下是提供的新聞資訊 :

一、指數盤下震盪，防禦族群成焦點 1. 指數盤下震盪，防禦族群成焦點 經過於兩千點的激情，指數於半年線轉趨震盪，當前小跌 56 點，預估量為 1784 億，對比先前逾 2000 億的成交量，市場或開始浮現觀望的態勢。 盤面上來看，指數漲點貢獻依序為 (2002-TW) 中鋼、(2201-TW)裕隆、(2886-TW)兆豐金、(3037-TW)欣興、(3533-TW)嘉澤，壓抑盤勢的則為 (2330-TW) 台積電、(2454-TW)聯發科、(3045-TW)台灣大、(2317-TW)鴻海、(2603-TW)長榮。 多方以產業而言，分別是傳金、電動車與伺服器，顯示市場經歷過台積電的強彈激情後，轉趨保守，前往仍具營運動能或相較防禦的族群。 造成盤勢壓抑的即為護國神山台積電與聯發科，以股價而言，近期台積電、聯發科雙雙強彈逾 20%，是帶動指數走強的關鍵，而在各大指標過熱的氛圍下，市場易轉趨保守觀望。觀察當前盤面成交比重排行依序為 (2330-TW)台積電、(8069-TW)元太、(1795-TW)美時、(8996-TW)高力、(3443-TW)創意、(3661-TW)世芯 - KY、(6533-TW)晶心科、(4743-TW)合一、(6550-TW)北極星藥業 - KY、(2603-TW)長榮、(4162-TW)智擎，排行前十一檔個股中，即有 4 檔與生計有關，與此同時，與能源相關的 (3708-TW) 上緯投控、(9958-TW)世紀鋼、(6477-TW)安集、(6443-TW)元晶皆有強勢的表現，顯示當前市場確實如先前所提，開始有觀望意味，但當前許多個股仍有強於大盤的表現，顯示盤面即便有所震盪，但不至於悲觀。 2. 櫃生技領軍櫃買指數 日前不斷提及，櫃生技族群成交比重頻頻攀升，同時電子比重下滑，可能代表市場風險意識再起，而櫃生技比重再度來到 24%，且電子族群僅 62% 低於常態的 76% 水準，顯示當前資金或是對短期指數強漲後有所顧慮，從而帶動生技族群成為盤面重點，成交重心主要為 (4743-TW) 合一、(4162-TW)智擎、(6589-TW)台康生技、(6712-TW)長聖、(4128-TW)中天、(4105-TW)東洋等，因此相關個股的走勢，是近期盤勢的重點，倘若將來櫃生技比重再度回落，電子是否能夠增溫，就會是未來的重點。 二、台積電創辦人證實，先進製程不排斥赴美 台積電創辦人張忠謀擔任今年度 APEC 台灣領袖代表，於本日舉行記者會，除了傳達三點政府立場外，現場記者提問，台積電的先進製程有無可能將一些些或把部分產能轉移至美國？ 對此創辦人張忠謀表示「在美國亞利桑納州設廠的五奈米廠，已是美國最先進的製程，但台灣台積電已經有三奈米技術，而五奈米是 先進製程當中的後一代 ，但已經是 美國最先進製程 。記者進一步提問，未來三奈米是否可能至美國設廠，對此創辦人張忠謀則回應，對，在五奈米之後。」 顯示即便台積電確實有規畫將先進產能開往美國，但三奈米主要仍要看五奈米量產狀況而定，意味五奈米與三奈米應該不會 同時進行 。 三、陪你看盤勢猜漲跌 權值股跌幅收斂，指數尾盤是否翻紅值得關注 即便本日諸多電子股走跌，但當前指數能力守短天前的均線之上，且許多個股皆ˊ的表現，加上稍早台積電、聯發科稍早皆有買盤進駐，帶動指數一度靠攏平盤，尾盤是否能夠再度上演翻紅戲碼，就是可以關注的方向。 當沖教學延伸閱讀： 1. 股價搭配「1 指標」提高當沖勝率： 2. 新手必學閃電下單術： 3. 隔日沖操作條件與交易風險大公開： 本公司所推薦分析之個別有價證券 無不當之財務利益關係 以往之績效不保證未來獲利 投資人應獨立判斷 審慎評估並自負投資風險",2025-08-05 00:36:26,20
2022-11-22,0.6,台積電領漲帶動大盤走揚，但電子股追價意願降低，轉向生技與伺服器相關個股，顯示市場觀望氣氛濃厚。,2025-08-05 00:36:28,20
2022-11-24,0.7,市場買盤回籠，聯發科領軍 IC 設計股放量大漲，加上航運股助攻，激勵台股走揚，指數創逾 2 個月新高。,2025-08-05 00:36:31,20
2022-11-25,0.3,高價股與權值股同步走弱拖累大盤表現，加上市場觀望美國通膨數據，引發投資人擔憂經濟衰退疑慮升溫。,2025-08-05 00:36:33,20
2022-11-28,0.6,基本面轉折訊號浮現，搭配法人買盤與產業復甦前景，激勵市場情緒偏正向。,2025-08-05 00:36:35,20
2022-12-07,0.3,市場信心受美股拖累，權值股表現分歧，加上 FOMC 會議在即，投資人觀望氣氛濃厚。,2025-08-05 00:36:57,20
2022-12-08,0.6,市場風險意識升溫，指數震盪走跌，但伺服器供應鏈個股強勁，元宇宙題材股也有買盤進場。,2025-08-05 00:37:00,20
2022-12-09,0.6,電子股反彈與太陽能族群強勢領漲帶動市場情緒回溫，但整體漲幅有限，顯示投資人仍謹慎觀望。,2025-08-05 00:37:02,20
2022-12-13,0.3,市場觀望 CPI 數據公布，加上獲利了結賣壓與電子股走弱，拖累大盤下挫翻黑，高價股全面收跌。,2025-08-05 00:37:04,20
2022-12-14,0.9,美國通膨緩解激勵美股走揚，電子權值股領軍台股大漲逾 200 點，高價股與矽智財概念股強勢表現，傳產族群如塑化、汽車等也有不錯的買盤支撐，顯示市場情緒轉趨樂觀。,2025-08-05 00:37:08,20
2022-12-15,0.6,營收與獲利表現強勁，搭配解封題材股與散裝航運等傳產族群齊揚，激勵市場信心，但電子類股普遍疲軟，顯示市場對行情看法仍有分歧。,2025-08-05 00:37:11,20
2022-12-21,0.3,台股反彈行情提振市場信心，但個股表現分歧，嘉澤下挫影響正面氣氛。,2025-08-05 00:37:33,20
2022-12-28,0.3,電子權值股與高價股疲弱拖累大盤，半導體族群賣壓沉重，但觀光類股相對抗跌，市場情緒偏空。,2025-08-05 00:37:36,20
2022-12-29,0.2,市場情緒偏向負面，主要受到大盤下跌影響，但部分電子股如聯詠、創意、致茂等仍有1%以上的漲幅。,2025-08-05 00:37:38,20
2022-12-30,0.6,"美股科技股反彈帶動台股上揚，但權值股尾盤賣壓湧現，漲點收斂。電子、傳產類股輪番表現，整體市場情緒偏正面但仍有調節賣壓。

====================

以下是提供的新聞資訊 :

今 (30) 日是台股 2022 年最後一個交易日，隨著美股科技股逢低買盤進場強彈下，台股早盤跳空開高，資金重回電子族群，午盤前大漲逾百點，站回 14200 點之上，不過交投仍相對清淡，預估成交量達約 1400 億元，而今日也將同步收周線、季線、月線、半年線、年線。 電子權值股今日扮演撐盤要角，台積電 (2330-TW) 站回 450 元之上，漲幅超過 1%，最高來到 456 元，收復 5 日均線，聯電 (2303-TW)、聯發科 (2454-TW)、台達電、台塑四寶等，同樣穩守盤上，大立光、旭隼、嘉澤、緯穎等高價股表現也不俗。 盤面上軍工概念股再度成為焦點，八貫接獲全球知名軍用品大廠訂單，間接打進北約軍隊防彈衣供應鏈，今日股價續強，午盤前漲幅超過 9%，環天科、雷虎、寶一、和成、精剛、漢翔等表現也不俗，漲幅也都超過 1%。 觀光旅遊、美食族群則持續受惠解封題材發酵，八方雲集大漲超過 7%，美食 - KY 也漲近半根停板，其他包含亞洲藏壽司、六角、王品、雄獅、華園、新天地、好樂迪同樣都力守盤上。 另一方面，生技族群中高端、基亞因涉內線交易、非常規交易案，檢調昨日大動作約談基亞董事長張世忠、云辰開發董事長張姿玲等 18 人，在利空消息衝擊下，基亞早盤一度逼近跌停價位，高端、云辰跌幅也接近 5%。

---

2022 年最後一個交易日，台股今 (30) 日在美股激勵下，盤中一度大漲 160 點，站回 5 日線之上，不過，尾盤調節賣壓湧現，台積電等權值股下壓，漲點收斂至 52.67 點、上漲 0.37%，收 14137.69 點，回到 5 日線之下，成交金額 1358 億元。今年來看，台股已跌掉 4081 點。 台積電今日上漲 2.5 元或 0.56%、收 448.5 元，今年以來台積電下跌 166.5 元或 27%；鴻海今日小漲，但未能回到百元之上，聯發科、聯電在尾盤調節賣壓下，翻黑作收，台達電漲近 2%。高價股方面，嘉澤漲近 2%、旭隼也漲 1%。 不過，南電跌 1.7%，創意、信邦、欣興、南亞科等均跌逾 1%，致茂、國巨以及技嘉等也同步走弱。 傳產今日表現相對強勢，紡織股王儒鴻大漲 3%、貨櫃三雄長榮漲 1.8%、陽明、萬海也漲逾 1%，潤泰新、華新也漲 1.3% 上下。其中，鋼鐵族群方面，雖然中鋼收黑，但在大成鋼漲 2% 帶動下，燁興漲近 3%、東鋼、春與、新光鋼等都漲 2% 以上。 多檔生技股漲多拉回，基亞受到檢調搜索消息影響，重挫 6%、強生跌逾半根，台微醫、視陽跌超過 4%、科研跌 3.9%、德英、浩鼎跌 3.7%、羅麗芬 - KY 跌 3.2%。不過，立康漲 3.5%、台康生及雃博等漲逾 2%，在族群中相對強勢。",2025-08-05 00:37:53,20
2023-01-04,0.5,多空因素交錯，電子族群漲跌互見，風電與太陽能概念股強勢上揚，但航運股賣壓沉重，整體市場情緒維持中性。,2025-08-05 00:37:55,20
2023-01-05,0.6,台股指數期貨上漲帶動開盤走揚，但高價股與部分權值股疲弱，多族群強勢但整體漲幅收斂，市場情緒溫和偏正。,2025-08-05 00:37:57,20
2023-01-09,0.7,電子族群強勁反彈帶動台股大漲，權值股與高價股齊揚，顯示市場信心回溫，但仍需觀察財報效應及落底跡象是否持續。,2025-08-05 00:38:00,20
2023-01-16,0.6,電子股領漲帶動台股創逾 1 個半月新高，但個別族群表現分歧，金融與傳產也助攻。,2025-08-05 00:38:22,20
2023-01-31,0.3,大盤漲多調節與台積電走低拖累指數，個股表現分歧，市場等待 FOMC 會議結果，整體氣氛轉趨謹慎。,2025-08-05 00:38:24,20
2023-02-01,0.7,新台幣貶值與熱錢湧入激勵大盤上攻，權值股與高價股齊揚，MCU 類股表現強勢，市場情緒正面。,2025-08-05 00:38:26,20
2023-02-02,0.9,聯準會釋出鴿派訊息激勵市場情緒，半導體三雄領軍衝鋒，加上高價股比價效應與元宇宙概念股助攻，推升台股創逾7個月新高。,2025-08-05 00:38:29,20
2023-02-03,0.6,台股小幅上漲但成交量萎縮，電子權值股疲軟，千金股漲跌互見，市場情緒偏向中性。,2025-08-05 00:38:31,20
2023-02-06,0.3,半導體族群普遍下跌拖累市場表現，但解封概念股與部分電子股撐盤，整體市場情緒偏向中性。,2025-08-05 00:38:33,20
2023-02-09,0.6,電子權值股表現平淡，但嘉澤等指標股強勢上漲，工業電腦及軍工概念族群也有買盤支撐，整體市場情緒偏向正面。,2025-08-05 00:38:35,20
2023-02-13,0.3,市場憂心晶圓雙雄首季財測表現與股神持股變化，加上新台幣貶值影響，電子權值股走弱，高價股普遍下跌，生技、低軌衛星族群則逆勢抗跌。,2025-08-05 00:38:38,20
2023-02-14,0.6,ChatGPT 概念股受惠 AI 人工智慧發展趨勢，相關產業族群如晶心科、金麗科、創意等可望迎來持續成長動能。,2025-08-05 00:38:40,20
2023-02-20,0.7,AI 概念股受市場熱議，營收成長與新產品推出帶動股價上漲，但整體市場情緒仍偏中性。,2025-08-05 00:38:43,20
2023-02-23,0.7,電子族群領漲帶動大盤上漲，半導體股表現強勁，傳產貨櫃三雄及觀光飯店股也有不錯的漲幅，整體市場情緒偏正面。,2025-08-05 00:38:45,20
2023-03-02,0.6,市場情緒受到航運族群強勁表現與觀光股買盤青睞的帶動，但高價股走勢疲弱拖累整體漲幅，呈現震盪格局。,2025-08-05 00:38:47,20
2023-03-15,0.7,台股反彈帶動權值股與半導體股上揚，多檔個股強勢表現激勵市場情緒，但貨櫃三雄漲幅收斂及潤泰雙雄重挫影響整體走勢。,2025-08-05 00:38:50,20
2023-03-20,0.7,IGBT 缺貨題材帶動相關個股漲勢，嘉澤等連接器族群受惠需求成長，但需留意市場情緒過熱的風險。,2025-08-05 00:38:52,20
2023-03-22,0.6,市場情緒受利多消息提振，電子權值股與金融股領軍上攻，加權指數收復月線，但個股表現分歧。,2025-08-05 00:38:54,20
2023-03-24,0.7,基本面展望穩健且潛在報酬率高，激勵市場情緒偏正向，但仍需留意籌碼面變化。,2025-08-05 00:38:56,20
2023-03-27,0.7,電子權值股普遍走跌拖累大盤，但高價股如嘉澤、力旺等逆勢上漲，顯示部分個股仍受市場青睞。,2025-08-05 00:38:58,20
2023-03-28,0.6,運動鞋產業成長趨勢穩健，相關概念股具潛力，但個別公司表現差異大，需進一步分析。,2025-08-05 00:39:01,20
2023-03-30,0.7,台股大盤指數創高帶動買氣，權值股與高價股同步走揚，記憶體與網通族群表現強勁，整體市場情緒正面。,2025-08-05 00:39:03,20
2023-03-31,0.7,台股創高帶動市場情緒樂觀，但個股表現分歧，記憶體與導線架族群強勢，權值股普遍上漲。,2025-08-05 00:39:05,20
2023-04-06,0.7,汽車銷售成績亮眼且市場需求穩定，帶動相關個股正面情緒，但整體影響力道有限。,2025-08-05 00:39:07,20
2023-04-12,0.7,多頭觀望態度使市場情緒趨中性，但航運、重電及生技股表現亮眼，帶動加權指數創近10個月新高。,2025-08-05 00:39:10,20
2023-04-13,0.2,電子股走弱與半導體類股疲軟拖累市場信心，加上美股下跌影響，整體市場情緒偏向負面。,2025-08-05 00:39:12,20
2023-04-27,0.6,電子權值股反彈與半導體族群回神帶動大盤上漲，但金融、傳產族群欲振乏力，部分高價股表現不俗。,2025-08-05 00:39:14,20
2023-05-02,0.7,伺服器概念股與高價股領漲，搭配儲能題材發酵，激勵市場情緒偏多，但整體漲幅有限，顯示買盤力道仍在觀望。,2025-08-05 00:39:17,20
2023-05-05,0.6,蘋概股普遍走揚，尤其是台積電重返500元大關帶動，加上傳產中小型股發威，激勵市場情緒，但金融及造紙類股疲軟拖累整體表現。,2025-08-05 00:39:19,20
2023-05-08,0.7,美股上周五大漲激勵台股走揚，權值股如台積電領漲，加上電子、電機族群表現強勢，推升市場情緒正面。,2025-08-05 00:39:21,20
2023-05-10,0.4,電子股疲弱拖累大盤走低，失守月季線，但部分個股如世芯-KY逆勢上漲，顯示市場情緒仍有支撐。,2025-08-05 00:39:24,20
2023-05-18,0.7,台積電領軍帶動電子權值股與高價股走揚，加上重電、觀光等族群強勢表現，激勵市場情緒向上。,2025-08-05 00:39:26,20
2023-05-19,0.9,520 行情延續，電子與高價股領軍上攻，加上台積電帶動，激勵市場信心，推升指數走揚。,2025-08-05 00:39:28,20
2023-05-23,0.5,電子權值股表現分歧，高價股普遍上漲，但嘉澤等個股下跌影響市場情緒，整體維持中性。,2025-08-05 00:39:30,20
2023-05-25,0.7,輝達財報優於預期激勵相關概念股走強，嘉澤受惠雲端運算需求穩定，市場情緒正面。,2025-08-05 00:39:32,20
2023-05-30,0.7,AI 概念股持續輪動，搭配總統大選行情與政策概念股，維持多頭格局。,2025-08-05 00:39:35,20
2023-06-06,0.3,在台積電穩盤下指數一度上漲，但高價股與權值股表現分歧，市場情緒偏向中性。,2025-08-05 00:39:37,20
2023-06-07,0.8,熱錢湧入與權值股強勢表現帶動指數創波段新高，多頭氣盛。,2025-08-05 00:39:39,20
2023-06-08,0.2,獲利了結賣壓與權值股疲軟拖累大盤走勢，加上 AI 概念股、汽車股普遍下跌，市場情緒偏向負面。,2025-08-05 00:39:41,20
2023-06-18,0.9,AI 熱潮持續延燒，各大廠紛紛推出新產品與服務，加上輝達執行長看好 AI 市場前景，激勵相關概念股表現強勁。,2025-08-05 00:39:44,20
2023-06-29,0.6,獲利表現亮眼的半導體產業與航運三雄帶動整體市場情緒，營收成長與經營績效提升為主要驅動力。,2025-08-05 00:39:47,20
2023-07-30,0.6,多空因素交雜，市場情緒偏向正面但仍有不確定性。,2025-08-05 00:39:49,20
2023-07-31,0.3,投信賣超金額居冠且前十名多數遭調節，市場情緒偏空。,2025-08-05 00:39:51,20
2023-08-01,0.6,科技業營收成長但獲利衰退，顯示庫存調整與產品交替過渡期影響，市場情緒中性偏空。,2025-08-05 00:39:53,20
2023-12-07,0.6,市場情緒中性，雖然個股表現優於大盤且多頭架構持續，但量能不足、外資賣超及三大法人合計賣超影響整體市場信心。,2025-08-05 00:39:56,20
2023-12-14,0.9,聯準會放鴿、熱錢湧入市場、外資回補台股、12 月作夢行情啟動、年終法人的作帳壓力等因素，激勵大盤上漲並創下 22 個月新高，多頭氣勢強勁。,2025-08-05 00:40:00,20
2023-12-15,0.7,美股創高激勵台股再創新高，多頭趨勢未變，但需留意量能與中小型股表現。電子股輪動續強，傳產股則聚焦車用、軍工等題材。,2025-08-05 00:40:04,20
2023-12-16,0.7,外資升評並大舉買超激勵股價創高，市場情緒偏正面，但須留意漲多後的獲利了結壓力。,2025-08-05 00:40:06,20
2023-12-18,0.7,雖然北韓射彈引發短暫震盪，但內資力挺與總統大選行情支撐，多頭格局不變，市場情緒偏正面。,2025-08-05 00:40:09,20
2023-12-19,0.4,新台幣升值與電子權值股走弱壓抑市場信心，加上高價股回檔使多方人氣減退。,2025-08-05 00:40:11,20
2023-12-20,0.3,市場情緒低落與多檔個股出現賣壓，顯示短期內買盤力道不足，行情承壓。,2025-08-05 00:40:13,20
2023-12-23,0.7,市場情緒受英特爾 AI 發表會與相關概念股帶動，短期正面，但須留意高檔震盪與追高風險。,2025-08-05 00:40:16,20
2023-12-27,0.7,獲利創高與需求前景穩健顯示公司基本面強勁，激勵正面市場情緒，但部分個股漲幅已大，投資人應留意追高風險。,2025-08-05 00:40:18,20
2023-12-29,0.7,台股封關日漲幅擴大，指數再創今年收盤新高，AI 概念股領軍上攻，加上高價股撐盤，激勵市場情緒向上。,2025-08-05 00:40:20,20
2024-01-02,0.3,電子權值股走弱與 AI 概念股疲軟拖累大盤，但貨櫃三雄、航空雙雄等傳產股撐盤，整體市場情緒偏向中性。,2025-08-05 00:40:22,20
2024-01-03,0.2,半導體類股全面下殺拖累市場信心，電子族群普遍走跌，僅少數個股力守紅盤。,2025-08-05 00:40:24,20
2024-01-04,0.3,航運強漲提振市場信心，但權值股疲弱與高價股下挫拖累整體表現，使市場情緒偏向中性。,2025-08-05 00:40:26,20
2024-01-07,0.3,醫療險改革引發市場擔憂，副本理賠保單下架潮衝擊投資人信心，但具體影響程度仍有待觀察。,2025-08-05 00:40:29,20
2024-01-09,0.7,電子權值股與高價IC設計族群撐盤，AI概念股強勢表現，以及貨櫃三雄重挫拖累大盤走勢，市場情緒偏向正面但震盪加劇。,2025-08-05 00:40:31,20
2024-01-10,0.3,雖然公司基本面穩健且獲利成長，但漲幅過大且本益比偏高，短期技術面修正壓力較大。,2025-08-05 00:40:33,20
2024-01-16,0.3,半導體雙雄走弱拖累大盤，加上台塑四寶表現疲軟，市場情緒偏空，但嘉澤逆勢抗跌力圖重返千元關卡。,2025-08-05 00:40:36,20
2024-01-17,0.6,市場情緒中性，雖然美股四大指數跌多漲少，但費半指數上漲 1.32%，科技軟體與電信服務類股逆勢收漲。台股因國際股市拉回、外資空單水位偏高，以及選擇權壓力落在 17400 點之上，結算在相對低檔區機率較高，但櫃買指數反映內資心態，守穩月線有利下半周台股反彈信心。,2025-08-05 00:40:39,20
2024-01-23,0.6,綠能與面板族群強勢表現帶動市場情緒，但台積電、聯發科走弱壓抑指數漲幅，整體呈現高檔震盪。,2025-08-05 00:40:41,20
2024-01-24,0.7,電子權值股表現分歧，中小型股與傳產族群領軍上攻，帶動大盤高檔量縮後續漲，但接近前高壓力使市場觀望，維持溫和樂觀但不過度追價的態勢。,2025-08-05 00:40:44,20
2024-01-26,0.7,中小型股表現強勁，00733 成分股調整納入多檔個股，有利於後市行情，但波動風險仍需留意。,2025-08-05 00:40:46,20
2024-01-29,0.7,受惠 AI 概念股納入成分股，搭配產業展覽題材發酵，激勵市場情緒偏正面。,2025-08-05 00:40:49,20
2024-02-02,0.7,美股強彈帶動台股上漲，電子權值股與高價股領軍，搭配政策題材股與 AI 伺服器概念股轉強，激勵市場情緒正面。,2025-08-05 00:40:51,20
2024-02-05,0.7,AI 伺服器需求強勁，相關個股漲勢可期，但整體市場仍受經濟與庫存調整影響，短期內難以維持過高的樂觀情緒。,2025-08-05 00:40:54,20
2024-02-19,0.4,AI 股普遍走弱與半導體指標疲軟壓抑市場信心，但面板雙虎及 PCB 指標強勢表現提供支撐。,2025-08-05 00:40:56,20
2024-02-22,0.7,"輝達財報優於預期激勵半導體與 AI 股表現，帶動台股創高，但部分個股漲多拉回壓抑市場情緒。

====================

以下是提供的新聞資訊 :

嘉澤 (3533-TW) 今 (22) 日召開法說會，董事長劉德明表示，目前伺服器客戶庫存水位已回到正常水準，預期下半年拉貨動能將優於上半年，且隨著英特爾新平台 Sapphire Rapids 將在第四季放量出貨，有望帶動嘉澤營運成長。 劉德明指出，目前伺服器客戶庫存水位已回到正常水準，預期下半年拉貨動能將優於上半年，其中英特爾新平台 Sapphire Rapids 將在第四季放量出貨，有望帶動嘉澤營運成長。展望明年，劉德明表示，隨著雲端資料中心需求持續強勁，看好嘉澤伺服器機殼產品將維持雙位數成長。 此外，嘉澤也積極拓展電競市場，目前已切入多家國際知名電競品牌供應鏈，並看好隨著電競產業發展，有望帶動嘉澤營收成長。

範例輸出4:
0.9
法說釋出正面展望，下半年動能回升與新平台放量助攻，激勵市場情緒樂觀。",2025-08-05 00:41:01,20
2024-02-27,0.6,AI 伺服器需求強勁與業績成長支撐市場信心，但整體台股本益比偏低，個股漲幅過大後可能出現技術面修正。,2025-08-05 00:41:04,20
2024-03-01,0.7,AI 概念股強勢表現與權值股支撐下，整體市場情緒偏正面，但漲多個股拉回壓力仍在。,2025-08-05 00:41:07,20
2024-03-04,0.9,美股費半大漲帶動科技股強勢表現，電子權值股領軍衝高，加權指數再創新高，市場情緒樂觀。,2025-08-05 00:41:09,20
2024-03-06,0.7,AI 伺服器需求強勁與新平台推出帶動嘉澤營運成長，股價創高且本益比仍低，激勵正面市場情緒。,2025-08-05 00:41:11,20
2024-03-08,0.7,AI 熱潮持續推升科技股表現，搭配台積電創高與外資回補力道強勁，激勵指數再創新高，但中小型股人氣仍待觀察。,2025-08-05 00:41:14,20
2024-03-13,0.7,美股反彈帶動科技股強勢表現，加上重電族群與金融股助攻，激勵市場情緒向上，但高價股漲不動且電子股回溫力道不足，使得指數未能站穩兩萬點。,2025-08-05 00:41:17,20
2024-03-15,0.7,市場情緒偏中性。美股四大指數同步拉回，利率攀升導致美股回跌，費半指數續跌 2.47% 領跌四大指數，狼速 - 5.59% 與 AMD-3.97% 領跌半導體股。周五台股因費半連跌兩天，且近期電子股震盪加劇，指數開盤回測 5 日線支撐，尾盤又因 0050 與 0056 成分股權重調整，預計容易爆量震盪，需觀察能否守穩 5 日線，決定下周結算行情方向。,2025-08-05 00:41:22,20
2024-03-20,0.6,市場情緒偏向中性，股價波動可能持續。主要原因包括：輝達 GTC 大會對台股的影響、ETF 之亂導致成分股被買上去、以及三月底法人作帳和結帳的賣壓。,2025-08-05 00:41:25,20
