date,factor,explanation,updated_time,news_count
2024-09-04,0.7,蘋果新機題材與銅箔基板族群強勢表現帶動市場情緒，但整體資金輪動加快且觀望氣氛濃厚。,2025-08-05 04:23:26,20
2024-09-12,0.5,市場預估EPS與營收呈現下修趨勢，顯示對公司未來獲利能力的擔憂。,2025-08-05 04:23:28,20
2024-09-16,0.7,市場觀望 FOMC 會議，權值股表現平穩，但 PCB、車電及造紙族群領漲，顯示類股輪動，整體市場情緒偏正面。,2025-08-05 04:23:30,20
2024-09-25,0.6,獲利與營收預估上修帶動市場信心，但分析師對後市看法分歧，整體情緒偏向正面。,2025-08-05 04:23:32,20
2024-10-01,0.5,市場預估EPS與營收下滑，分析師調降目標價壓抑短期市場信心。,2025-08-05 04:23:34,20
2024-10-03,0.5,市場預估EPS與營收下滑，分析師調降目標價壓抑短期市場信心。,2025-08-05 04:23:36,20
2024-10-18,0.3,獲利與營收預估下修壓抑市場信心，但整體展望仍維持中性。,2025-08-05 04:23:38,20
2024-10-23,0.7,AI、伺服器等高階材料需求強勁，營收與獲利成長帶動正面市場情緒。,2025-08-05 04:23:40,20
2024-11-05,0.6,獲利成長與新產品拓展為正面因素，但毛利率下滑及對未來業績看增的保守態度使市場情緒溫和偏多。,2025-08-05 04:23:42,20
2024-11-06,0.3,獲利預估下修與營收展望保守壓抑市場信心，但整體而言維持中性偏空的看法。,2025-08-05 04:23:44,20
2024-11-13,0.3,分析師下修目標價與獲利預估值，反映市場對公司前景的擔憂，但整體評級仍維持中立，顯示短期內股價無明顯漲跌傾向。,2025-08-05 04:23:46,20
2024-11-27,0.6,受惠於美國關稅政策影響較小且在美國設廠的優勢，營運前景穩健，激勵市場情緒偏正面。,2025-08-05 04:23:49,20
2024-12-13,0.9,營收、獲利創高與擴廠計畫顯示公司成長動能強勁，激勵市場情緒樂觀。,2025-08-05 04:23:51,20
2024-12-16,0.6,新廠投資案展現公司對未來市場的信心，雖然短期資本支出增加，但長遠有利擴大產能與分散風險。,2025-08-05 04:23:53,20
2024-12-31,0.7,營收與獲利創新高、擴廠投資顯示公司成長動能強勁，激勵正面市場情緒。,2025-08-05 04:23:55,20
2025-01-04,0.7,AI 伺服器需求強勁，銅箔基板 (CCL) 作為關鍵材料的高階產品出貨占比上升，三雄受惠。,2025-08-05 04:23:58,20
2025-02-11,0.6,盤中類股輪動與外資買超個股表現支撐市場，但漲多後賣壓出籠使得整體市場情緒趨於謹慎。,2025-08-05 04:24:00,20
2025-03-05,0.7,營收年增率與月增率雙升，顯示公司基本面強勁，但近期股價下跌，市場情緒略偏空。,2025-08-05 04:24:02,20
2025-03-10,0.6,總體經濟環境與產業題材交織，市場情緒偏正面，但個股漲幅過高恐引發獲利了結賣壓。,2025-08-05 04:24:05,20
2025-03-13,0.7,電子族群領軍反彈，技術面轉佳，加上美股彈升助攻，激勵市場情緒向上，但量能不足仍是隱憂。,2025-08-05 04:24:07,20
2025-03-24,0.6,獲利與營收預估上修顯示市場對公司前景樂觀，但漲幅有限。,2025-08-05 04:24:09,20
2025-04-07,0.7,營收雙增顯示需求強勁，激勵正面市場情緒，但近期股價表現疲弱，籌碼面亦無明顯利多。,2025-08-05 04:24:32,20
2025-05-05,0.7,受惠 AI 伺服器需求強勁帶動材料與設備成長，營收表現亮眼且展望正向，激勵中性偏樂觀的市場情緒。,2025-08-05 04:24:35,20
2025-05-06,0.7,獲利創高與需求前景穩健顯示公司基本面強勁，但市場預期下修壓抑短期漲幅空間。,2025-08-05 04:24:37,20
2025-05-07,0.5,市場情緒維持中性，聯茂股價波動受整體盤勢影響。,2025-08-05 04:24:40,20
2025-05-21,0.9,AI 伺服器需求強勁帶動營收與獲利創高，加上產能擴張計畫激勵市場對未來成長的樂觀情緒。,2025-08-05 04:24:43,20
2025-05-26,0.8,AI 伺服器需求強勁帶動 CCL 廠營運成長，聯茂 M9 通過認證、AI 推理與邊緣 AI 發展加速，公司受惠 AI 所帶來的廣大雲端資料中心和邊緣運算應用長期升級和需求的成長趨勢。,2025-08-05 04:24:47,20
2025-06-01,0.7,AI 伺服器與高速運算需求帶動相關供應鏈比價行情，法人青睞受惠 AI 的銅箔基板 (CCL) 及 PCB 族群。,2025-08-05 04:24:50,20
2025-06-03,0.6,新聞聚焦於公司基本面與產業前景，營收創新高且需求穩健支撐市場對其後市的樂觀情緒。,2025-08-05 04:24:53,20
2025-06-10,0.7,新聞聚焦在公司營收創下 39 個月新高，且 AI GPU 及 ASIC 加速卡材料升級題材，帶動市場情緒偏向正面。,2025-08-05 04:24:56,20
2025-06-16,0.7,AI、伺服器等產業需求穩健，搭配營收成長與新產品題材，激勵市場情緒偏正面，但短期內地緣政治衝突仍帶來一定的不確定性。,2025-08-05 04:24:59,20
2025-06-19,0.7,新聞聚焦於公司營收創下 39 個月新高，AI GPU 及 ASIC 加速卡材料升級帶動業績成長，整體呈正面發展。,2025-08-05 04:25:02,20
2025-06-23,0.7,地緣政治風險雖帶來短期波動，但 AI 產業鏈個股表現強勁，市場信心維持正面。,2025-08-05 04:25:05,20
2025-06-24,0.7,地緣政治風險緩解與聯準會降息預期提振市場信心，半導體產業基本面穩健支撐股價表現。,2025-08-05 04:25:08,20
2025-06-26,0.6,市場預估獲利與營收持續成長，分析師調升目標價帶動正面市場情緒。,2025-08-05 04:25:10,20
2025-06-30,0.7,新聞中提到台股連漲四天，外資熱錢湧入，帶動加權指數頻創新高，但也提醒要注意結構變化、汰弱擇強，並提及個別強勢族群如 AI 零組件、台積電供應鏈等，整體而言對市場情緒偏向正面。,2025-08-05 04:25:13,20
