date,factor,explanation,updated_time,news_count
2024-07-04,0.6,營收成長帶動市場信心，但文化創意產業整體表現平穩，短期內股價波動有限。,2025-08-04 20:43:00,20
2024-07-05,0.7,多頭行情延續，電子權值股表現平穩，半導體產業展望樂觀，AI供應鏈強勢，非電族群如儒鴻、台光電等表現亮眼。Morgan Stanley報告針對台灣半導體供應鏈進行調研，點名8檔個股「優於大盤」，南亞科與矽力KY遭評「劣於大盤」。AI GPU供不應求延續至B100與GB200，NVIDIA展望樂觀。AMD AI上行空間有限，MI300的出貨預期能達標財測，但CoWoS產能有限，因此下半年在競爭上直面NVIDIA壓力，報價調整隨之而來，且需求換代的延續性不如市場儒NVIDIA B系列那般期待，上行的成長力較不被看好。HBM發展持續推升B系列HBM3e仍由海力士獲得絕大部分NVIDIA供貨，美光、三星的產品認證與加入供應，會先從前一個世代的產品開始出貨，因此技術與議價能力排序並未改變。HBM外的產品價漲、出貨量平。WoA的反應分歧，高通首發WoA晶片在效能與耗電等表現上，優於預期，但Windows10既有的兼容問題存在，供應鏈方面對於WoA AI PC的態度多半持開放態度，但目前除了微軟PC以外，並沒有必定或主推的想法。AI供應鏈產生有趣的變化。整體半導體市場乏善可陳(SiC最為擔憂)。,2025-08-04 20:43:08,20
2024-07-08,0.9,台股持續創新高，多頭氣勢強勁，AI 產業蓬勃發展帶動相關類股上漲，尤其是台積電突破千元後，預計可觸及實施庫藏股的最高價 1281 元，貢獻大盤點數 2168 點，加上其他類股漲幅，台股有望上看 25000 點。AI 相關類股本周可留意采鈺、聯詠、世芯 - KY、耀勝等；能源相關類股則可關注大亞、合機等。技術強勢股包括極短線操作的能率網通、圓剛、圓展、中探針、皇昌等。重要事件有美國六月 CPI 消費者物價指數和 PPI 生產者物價指數公佈，以及多檔個股除息。整體而言，台股維持強勁上漲趨勢，建議續抱相關個股，但不宜過度追高。,2025-08-04 20:43:14,20
2024-07-09,0.3,營收成長帶動股價上漲，但市場仍擔憂總體經濟放緩的影響，整體情緒偏向中性。,2025-08-04 20:43:18,20
2024-07-10,0.3,雖然營收成長，但股價近期走勢疲弱，市場情緒偏向保守。,2025-08-04 20:43:21,20
2024-07-11,0.7,營收年增率前5名成長排行及6月營收年增率前3名成長排行顯示個別公司表現強勁，整體市場情緒偏向正面。,2025-08-04 20:43:24,20
2024-07-12,0.3,營收年增率前三名成長排行與電子股修正下，資金轉戰傳產族群，台塑四寶今日連袂上漲，南亞漲 2.8% 最為強勢，台化也漲近 2%，台塑、台塑化連袂走揚；其他像是豐泰漲 3%、潤泰新也漲 2%，亞泥、正新、華新等也收漲。,2025-08-04 20:43:29,20
2024-07-13,0.3,營收年增率前5名公司表現亮眼，但整體市場情緒受匯率波動與經濟指標影響，呈現中性偏空。,2025-08-04 20:43:31,20
2024-07-14,0.6,贊助霹靂舞賽事展現企業對體育推廣的重視，有利於提升品牌形象並激勵正面市場情緒。,2025-08-04 20:43:33,20
2024-07-15,0.6,外資賣超、做空不用怕，產業前景才是決定股市上漲的關鍵，本周三台指期結算，台資四萬口空單被軋機率非常高，預計本周四前後，台股將在創歷史新高！,2025-08-04 20:43:36,20
2024-07-16,0.6,營收年增率前三名成長表現顯示部分個股獲利穩健，但整體市場情緒受經濟數據與匯市波動影響，維持中性偏多看待。,2025-08-04 20:43:39,20
2024-07-17,0.7,營收年增前三名顯示部分公司表現強勁，但整體市場情緒受美股下跌與匯率消息影響而趨中性。,2025-08-04 20:43:42,20
2024-07-18,0.2,川普「保護費論」引發外界擔憂地緣政治風險，加上台積電法說會在即，市場情緒轉趨悲觀，拖累半導體族群表現。,2025-08-04 20:43:45,20
2024-07-19,0.7,營收成長帶動股價上漲，但獲利下滑壓抑市場情緒，整體呈現正面但中性偏向負面的態度。,2025-08-04 20:43:47,20
2024-07-20,0.6,營收年增率前三名顯示部分公司表現強勁，激勵市場情緒，但整體而言營收月增率中性，匯率有利營收的消息則可能對個別公司產生正面影響。,2025-08-04 20:43:50,20
2024-07-21,0.7,英特爾下一代AI晶片採用台積電3奈米製程與CoWoS技術，顯示雙方合作關係穩固，相關台廠如神盾、京元電等可望受惠。,2025-08-04 20:43:52,20
2024-07-23,0.6,市場情緒偏向正面，但個別股票表現差異大，整體漲跌互見。,2025-08-04 20:43:54,20
2024-07-26,0.3,市場情緒偏空，AI 概念股遭遇重挫，雖有部分個股如海悅、欣巴巴等表現較強，但整體影響有限。創意法說釋出正向訊息，但股價仍下跌，顯示投資人信心不足。台積電漲價傳聞持續發酵，對相關概念股造成壓力。整體而言，市場氛圍偏空，短期內難以樂觀。,2025-08-04 20:43:59,20
2024-07-27,0.2,市場對公司獲利與營收展望下調，引發負面情緒，但整體而言仍維持中性看待。,2025-08-04 20:44:01,20
2024-07-28,0.7,3D 堆疊封裝技術成為滿足 AI 需求的關鍵，台積電領先地位與相關台廠受惠潛力，激勵市場情緒偏正面。,2025-08-04 20:44:03,20
2024-07-29,0.4,法說會後外資調降目標價與獲利預估，AI 相關需求疲軟影響營收展望，股價重挫跌停。,2025-08-04 20:44:06,20
2024-07-30,0.3,雖然台股小幅上漲，但成交量低，且多檔個股大跌，顯示市場信心仍偏弱，操作難度提高。,2025-08-04 20:44:10,20
2024-07-31,0.2,市場情緒偏向負面，股價可能下跌。主要原因包括：1) 科技股周二重挫，台股電子權值全面走跌；2) 台積電開盤下跌，聯發科、欣興等個股也出現疲軟；3) 高價電子指標大立光、川湖跌幅較深。整體而言，市場氣氛不佳，投資人應謹慎評估並自負投資風險。,2025-08-04 20:44:14,20
2024-08-01,0.7,市場情緒轉為正面，AI概念股強勢表態，帶動大盤跳空上漲，多頭信心回升。,2025-08-04 20:44:17,20
2024-08-02,0.2,市場情緒轉為負面，主要受國際股市走弱與電子權值重挫影響，半導體和高價股跌勢尤其沉重。,2025-08-04 20:44:20,20
2024-08-05,0.6,創意營收成長與獲利展望正面，但股價近期走勢疲弱，市場情緒中性偏空。,2025-08-04 20:44:23,20
2024-08-07,0.7,亞泥與淡江大學合作舉辦「化學遊樂趣」活動，透過實驗課程提升偏鄉國中小學生的化學知識，展現企業善盡社會責任的正面形象。,2025-08-04 20:44:46,20
2024-08-08,0.7,繳稅旺季帶動刷卡金額創新高，顯示消費力道穩健，但個別銀行表現差異大，市場情緒偏向正面但不確定性仍在。,2025-08-04 20:44:49,20
2024-08-09,0.7,營收成長帶動股價上漲，文化創意產業指數小幅下跌，顯示公司基本面強勁但市場情緒略有保守。,2025-08-04 20:44:50,20
2024-08-12,0.9,台股延續反彈攻勢，AI 股領漲帶動大盤上揚逾 400 點，多頭氣盛。,2025-08-04 20:44:52,20
2024-08-13,0.5,台積電尾盤翻紅帶動加上電子指標股普遍走揚，但傳產與塑化族群疲弱，整體市場情緒維持中性。,2025-08-04 20:44:54,20
2024-08-14,0.6,臺鹽捐贈產品義賣支持偏鄉教育，展現企業社會責任，但營收與獲利表現無相關資訊。,2025-08-04 20:44:57,20
2024-08-15,0.7,櫃買市場整體表現穩健，多數上櫃公司基本面成長，搭配中小型股漲勢延續，激勵正面市場情緒。,2025-08-04 20:44:59,20
2024-08-16,0.7,零售銷售數據優於預期緩解衰退擔憂，指數大漲逾 400 點，站回月線之上，但成交量不足，市場信心仍有疑慮。,2025-08-04 20:45:03,20
2024-08-17,0.7,臺灣餅產業表現亮眼且獲獎作品展現創意與在地特色，有助提升市場對該產業的正面看法。,2025-08-04 20:45:05,20
2024-08-19,0.6,市場觀望 FOMC 會議紀要與全球央行年中會，成交量萎縮導致指數小幅上漲，但缺乏明確方向。部分產業展覽帶動相關類股表現，如機器人、AI 伺服器等，但需留意短線漲多的獲利了結壓力。總體經濟穩定，基本面無虞，待量能回溫後有望持續向上墊高。,2025-08-04 20:45:09,20
2024-08-20,0.6,市場情緒中性，雖然指數小幅上漲但成交量萎縮，專家建議汰弱留強並關注轉弱訊號。,2025-08-04 20:45:12,20
2024-08-21,0.3,雖有贊助活動並打造創意燈車，但整體而言缺乏正面營收或獲利消息，市場情緒維持中性。,2025-08-04 20:45:15,20
2024-08-22,0.6,量能持續萎縮，市場觀望氣氛濃厚，加上營建股走弱拖累大盤，整體市場情緒偏向中性。,2025-08-04 20:45:18,20
2024-08-23,0.6,量縮盤整與市場觀望聯準會年會，行情維持中性偏空。,2025-08-04 20:45:21,20
2024-08-26,0.6,全球央行年會後，市場情緒偏向樂觀，但量能不足且個股表現分歧，預計短期將維持箱型整理走勢。,2025-08-04 20:45:24,20
2024-08-27,0.6,市場情緒中性，盤整行情持續，個別股票表現分歧。,2025-08-04 20:45:27,20
2024-08-28,0.6,市場情緒偏正面，部分新聞對股價產生正面影響，但整體而言仍維持中性。,2025-08-04 20:45:30,20
2024-08-29,0.6,市場觀望氣氛濃厚，AI 概念股與蘋果相關個股表現相對強勢，但整體量能不足且籌碼面仍有疑慮。,2025-08-04 20:45:33,20
2024-08-30,0.6,中秋月餅禮盒買氣熱絡，多元創新口味與星級飯店禮盒吸引消費者，激勵相關食品、觀光類股表現。,2025-08-04 20:45:37,20
2024-09-02,0.7,通膨持續受控、降息機率高，利多支撐股市上漲，但個股表現分歧，選擇強勢股有望獲利。,2025-08-04 20:45:40,20
2024-09-03,0.3,市場觀望氣氛濃厚，成交量低迷，加上籌碼面問題，整體市場情緒偏向中性。,2025-08-04 20:45:42,20
2024-09-04,0.3,市場情緒偏空，股價下跌主因為美國 ISM 製造業數據疲軟引發經濟成長擔憂，以及台股大盤重挫 999 點。,2025-08-04 20:45:45,20
2024-09-05,0.6,營收成長帶動股價上漲，市場情緒偏正面，但整體盤勢仍維持箱型格局，短期內無明顯表現。,2025-08-04 20:45:48,20
2024-09-06,0.7,電子權值股和高價股領漲激勵市場情緒，但成交量萎縮與個別弱勢股表現不一，整體行情仍偏謹慎。,2025-08-04 20:45:52,20
2024-09-09,0.6,"AI 股財報利多失靈反映半導體週期接近高峰，市場擔憂經濟衰退疑慮持續干擾股市，短期內影響投資信心。

====================

根據提供的新聞資訊和分析師的評論,以下是我的總體結論:

0.6
AI 股財報利多失靈反映半導體週期接近高峰,市場擔憂經濟衰退疑慮持續干擾股市,短期內影響投資信心。

這個判斷的主要依據是:
1. 美國非農就業數據低於預期,加劇了對美國經濟可能已經陷入衰退的擔憂。聯準會在9月18日的FOMC會議上將面臨兩難境地,如果降息一碼,市場可能認為經濟已經衰退;如果降息兩碼,則意味著經濟正在下滑,這對股市來說都是利空消息。
2. 費城半導體指數在過去一年中大幅上漲,但最近出現了急劇的修正,下跌超過20%,面臨技術熊市定義。輝達和博通等主要AI股票的財報表現不佳,這表明半導體週期可能已經接近高峰。
3. 貨櫃輪行業在三年前也曾出現過類似的現象,即使公司公佈了優異的財報,股價仍然下跌。後來證實,這是由於半導體週期即將結束所致。

綜合以上因素,市場對經濟衰退的擔憂和半導體行業可能進入週期尾聲的情況,都對股市產生了負面影響。因此,短期內投資者的信心可能會受到影響,股票價格可能會在一定程度上下跌。",2025-08-04 20:46:01,20
2024-09-10,0.6,營收成長與產業前景穩健帶動市場情緒偏正面，但籌碼面疑慮與大盤量能不足抑制漲幅，整體呈現溫和上揚態勢。,2025-08-04 20:46:04,20
2024-09-11,0.6,市場情緒中性偏正面，部分個股漲幅過大且本益比高，使得反彈力道受限。營收表現亮眼但股價領先反應，籌碼面凌亂，投資人宜審慎評估進出場時機。,2025-08-04 20:46:08,20
2024-09-12,0.7,營收成長帶動市場情緒，AI族群領漲加上蘋果新機發表會等正面因素，激勵股價走強。,2025-08-04 20:46:11,20
2024-09-13,0.6,營收年增率大幅成長，顯示公司基本面強勁，但市場情緒仍受到整體經濟環境與股市波動的影響而持續震盪。,2025-08-04 20:46:13,20
2024-09-17,0.7,營收年增率前5名公司集中在建材、文化創意與觀光餐旅等產業，顯示部分中小型股已展現成長動能，激勵市場情緒。,2025-08-04 20:46:36,20
2024-09-18,0.3,市場情緒偏向中性，雖有部分個股表現亮眼，但整體成交量放大且指數回檔，顯示短期內仍處於震盪整理階段。,2025-08-04 20:46:39,20
2024-09-19,0.6,營收表現參差，市場情緒偏中性；Google推出新功能有助創作者，對相關個股產生正面影響。,2025-08-04 20:46:42,20
2024-09-20,0.6,營收年增率前5名顯示個別公司表現強勁，但整體市場情緒受其他因素影響，中性看待隔日股價波動。,2025-08-04 20:46:44,20
2024-09-21,0.7,營收年增率前5名公司表現亮眼，顯示部分產業仍維持成長動能，激勵市場情緒。,2025-08-04 20:46:46,20
2024-09-23,0.6,市場情緒維持中性，雖有部分族群表現強勢但整體成交量萎縮與大盤位置反壓使短期漲跌難以確定。,2025-08-04 20:46:49,20
2024-09-24,0.7,市場情緒偏正面，股價上漲。創意 3 奈米 HBM3E 控制器和實體層 IP 獲得領先業界雲端服務供應商及多家高效運算解決方案供應商採用，預計今年完成設計定案，並將採用最新的 9.2Gbps HBM3E 記憶體技術。公司通過台積電先進製程技術驗證，包括 N7/N6、N5/N4P、N3E/N3P 製程，並在台積電 CoWoS-S 及 CoWoS-R 製程均通過矽驗證。,2025-08-04 20:46:54,20
2024-09-25,0.7,AI 概念股如廣達、鴻海等領漲，搭配輝達概念股強勢反彈，電子族群整體氣氛樂觀，提振市場信心。,2025-08-04 20:46:58,20
2024-09-26,0.7,台股挑戰 23000 點，中小型熱門股下跌，但電子股資金比重維持在七成之上，輪動行情持續，老師提供產業重點與選股建議，有助於操作。,2025-08-04 20:47:01,20
2024-09-30,0.7,市場情緒受到台股大跌影響而轉為中性，惟部分產業如能源、生技及半導體概念股表現抗跌，提供操作機會。,2025-08-04 20:47:04,20
2024-10-01,0.7,裕隆集團與富邦文教基金會等單位攜手包場凱達格蘭大道，10月19日將在凱道為孩子打造一座模擬城市，活動以兒童95cm視角規劃，為孩子打造一座模擬城市，包括都市空間設計、安全街道規劃、處處自由遊戲、移動工具製造等，孩子可擔任這座城市的主人翁，提案、發想並動手做。,2025-08-04 20:47:07,20
2024-10-02,0.7,ASML 在永續、再生能源與人才培養方面的貢獻，以及多元包容的工作環境與員工培訓計畫，展現公司對社會責任的重視，激勵正面市場情緒。,2025-08-04 20:47:10,20
2024-10-04,0.6,永續發展議題受到重視，相關計畫有助提升企業形象，但具體影響有限。,2025-08-04 20:47:13,20
2024-10-07,0.7,電子股與政策相關概念股表現強勁，帶動市場情緒上漲，但整體成交量仍有待提升。,2025-08-04 20:47:16,20
2024-10-08,0.7,市場情緒偏正面，雖然台股回檔但守穩所有均線，AI、矽光子等題材股表現強勁，營收表現亮眼個股也有所支撐。,2025-08-04 20:47:20,20
2024-10-09,0.7,市場情緒偏正面，主要受惠於 AI 和 IC 設計族群的強勁表現，以及第四季旺季行情的預期。,2025-08-04 20:47:22,20
2024-10-12,0.6,9月營收年增率前5名公司表現亮眼，顯示部分產業已走出谷底，但整體市場仍有不確定性，影響中小型股的漲跌波動。,2025-08-04 20:47:45,20
2024-10-14,0.6,雖然中國軍演帶來不確定性，但防禦型股票如生醫股和部分電子股表現強勁，IP概念股創意連漲5天站上1200元，低位階潛力股受到關注。,2025-08-04 20:47:48,20
2024-10-15,0.6,營收年增率前三名顯示部分個股表現強勁，但整體市場情緒仍受大盤影響維持中性。,2025-08-04 20:47:51,20
2024-10-16,0.7,海外市場擴張計畫與代理商年會激勵市場信心，但仍需關注當地競爭環境。,2025-08-04 20:47:53,20
2024-10-17,0.7,營收年增率前5名顯示個別公司表現強勁，整體市場情緒偏正面，但需留意個股波動。,2025-08-04 20:47:56,20
2024-10-18,0.6,"營收年增率前三名公司表現強勁,但中小型股走弱與大立光法說利空拖累市場情緒,加權指數漲幅主要來自台積電貢獻。第一銀行獲獎凸顯公平待客與優質服務的重要性。",2025-08-04 20:47:59,20
2024-10-19,0.6,跨界合作與永續發展主題提升品牌形象，激勵中性市場情緒。,2025-08-04 20:48:01,20
2024-10-21,0.7,AI 概念股強勢表態，ASIC 集團個股補漲向上，市場情緒偏正面。,2025-08-04 20:48:04,20
2024-10-22,0.3,市場信心受到美股四大指數漲跌互見影響，加上台積電、聯發科走勢疲軟，導致加權指數開低走低，呈現百點以上的回檔修正。雖然部分中小型股表現相對強勁，但整體而言，投資人仍持觀望態度，等待更多訊息釐清後再做決定。,2025-08-04 20:48:08,20
2024-10-23,0.3,電商平台新系統推出雖有助於提升營運效率，但短期內對股價影響有限，需持續觀察市場反應。,2025-08-04 20:48:11,20
2024-10-24,0.6,市場情緒受到多空消息交雜影響，整體呈現中性偏空，短期內股價可能維持震盪走勢。,2025-08-04 20:48:14,20
2024-10-25,0.6,市場情緒中性，股價波動可能持續震盪整理。新聞內容提及美國總統大選前觀望氣氛濃厚、台股量縮修正，以及個別公司營運與產品推出等資訊，但整體對市場影響有限，預期短期內難有明顯漲跌趨勢。,2025-08-04 20:48:18,20
2024-10-28,0.6,中東局勢暫緩、Fed降息機率高及選舉行情等因素帶動市場樂觀情緒，但財報公佈與總統大選仍是主要變數。,2025-08-04 20:48:20,20
2024-10-29,0.6,綠電議題與能源政策引發關注，市場對於台灣供應鏈的發展前景仍有期待，但短期內能否滿足國際大廠需求存疑。,2025-08-04 20:48:23,20
2024-10-30,0.3,市場信心受創，籌碼面壓力沉重，短期內股價波動加劇。,2025-08-04 20:48:25,20
2024-11-01,0.6,市場情緒中性，分析師看好產業前景但股價波動加劇，籌碼面混亂影響短期信心。,2025-08-04 20:48:28,20
2024-11-04,0.7,創意受惠於AI記憶體需求強勁與台積電合作加深，市場情緒正面。,2025-08-04 20:48:30,20
2024-11-05,0.7,AI 產業趨勢明確，矽光子概念股漲幅大但仍有機會，IP 矽智財與 IC 設計股受惠聯發科入股世芯 - KY，多方控盤帶量上攻。,2025-08-04 20:48:34,20
2024-11-06,0.6,市場情緒偏正面，部分因素包括 AI 產業前景穩健、庫存調整壓力減緩等，但選舉結果不確定性仍影響短期走勢。,2025-08-04 20:48:38,20
2024-11-07,0.7,營收成長與產業趨勢向上帶動市場情緒偏多，個股表現強勁。,2025-08-04 20:48:40,20
2024-11-08,0.7,營收成長與產業前景穩健帶動市場情緒正面，但籌碼面略顯凌亂，股價漲幅表現優於同業。,2025-08-04 20:48:43,20
2024-11-09,0.7,10月營收年增率前5名顯示部分公司成長強勁，月增率也普遍正向，整體呈現樂觀的市場情緒。,2025-08-04 20:48:46,20
2024-11-10,0.9,AI 發展帶動矽光子技術需求強勁，相關供應鏈受惠，營運展望樂觀。,2025-08-04 20:48:49,20
2024-11-11,0.6,營收持續成長且年增率維持雙位數正成長，顯示公司業績穩健，但月增率轉負影響短期市場信心。,2025-08-04 20:48:51,20
2024-11-12,0.7,營收年增率前三名公司表現強勁，顯示產業動能穩健；AI發展帶動相關產業成長，緯穎受惠轉單效益，股價有望延續漲勢。,2025-08-04 20:48:54,20
2024-11-13,0.6,營收年增率前5名公司表現強勁，顯示基本面穩健，但加權指數下挫影響市場情緒，預期短線將維持區間整理。,2025-08-04 20:48:57,20
2024-11-14,0.3,"營收年增率前5名顯示個別公司表現強勁，但整體中小型股營收成長趨勢仍偏弱，市場情緒維持溫和。

臺灣期貨交易所與公共電視合作辦理「2024 年台灣國際兒童影展暨金融防詐宣導偏鄉國小巡迴活動」，透過映前導讀、映後座談等方式，讓偏鄉兒童接觸到國際化、高品質的電影作品，並融入防範金融詐騙宣導，建立兒童防範金融詐騙觀念。",2025-08-04 20:49:00,20
2024-11-15,0.6,營收年增率前5名公司表現強勁，但整體市場情緒受到美股回檔與 PPI 數據不佳影響，短期內維持中性偏空。,2025-08-04 20:49:04,20
2024-11-16,0.7,營收年增率前5名顯示部分公司表現強勁，但整體市場需求仍疲弱，ASIC趨勢有望帶動相關產業成長，但短期內對股價的正面影響有限。,2025-08-04 20:49:06,20
2024-11-18,0.3,市場氣氛偏空，外資賣超壓力大，但 AI 產業基本面強勁支撐，個股跌深反彈機會增加。,2025-08-04 20:49:09,20
2024-11-19,0.6,營收年增率前五名公司表現亮眼，帶動相關個股上漲，但整體市場情緒仍維持中性。第一銀行與遊戲業者合作擴大生態系，為數位金融環境注入新活力，有助提升客戶黏著度，但對股價的直接影響有限。,2025-08-04 20:49:12,20
2024-11-20,0.6,營收年增率前三名公司表現亮眼，顯示部分產業仍維持成長動能，惟整體市場情緒受外資賣超影響而趨中性。,2025-08-04 20:49:15,20
2024-11-21,0.6,營收年增率前三名顯示個別公司成長動能強勁，但整體市場情緒仍受大盤影響而維持中性。,2025-08-04 20:49:17,20
2024-11-25,0.7,家庭日活動與中華隊奪冠帶動正面市場情緒，但個股表現仍需視產業趨勢與基本面而定。,2025-08-04 20:49:20,20
2024-11-26,0.6,雖然有 3 家公司未如期公告財報，但整體營收與獲利表現亮眼，AI、航運等產業帶動獲利成長，市場情緒偏向正面。,2025-08-04 20:49:24,20
2024-11-29,0.6,綠色創新與環境永續議題獲得重視，展現公司對社會責任的承諾，有助於提升正面市場形象。,2025-08-04 20:49:26,20
2024-12-04,0.7,AI 需求強勁與技術面向上，帶動相關個股如 CPO 概念股、ASIC 等表現，但短期漲幅已大，需留意獲利了結賣壓。,2025-08-04 20:49:29,20
2024-12-05,0.6,凱基金股利政策三大原則明年可望發放超過 0.5 元，耶誕節將至，凱基金首度舉辦點燈儀式，未來一年要比一年更有創意。,2025-08-04 20:49:32,20
2024-12-06,0.6,AI、ASIC 等主題持續發酵，搭配年底作帳行情，有利相關個股表現，但短線漲多後震盪整理壓力增大。,2025-08-04 20:49:36,20
2024-12-10,0.7,市場情緒偏向正面，主要受 IC 設計類股強勢表現帶動，以及外資連續買超台股所影響。然而，權值股普遍走弱，加上貨櫃三雄表現疲弱，使得大盤指數下跌。展望未來，雖然美國對中國晶片出口禁令升級，但對台廠的影響有限，市場反而看好輝達與晶圓大廠合作的 Rubin 平台晶片開發，有望加速 AI 供應鏈成長，助推相關個股的長期表現。整體而言，在政策面與資金面支撐下，預計台股將延續震盪整理格局，但中長期仍聚焦具有成長動能的個股進行布局。,2025-08-04 20:50:02,20
2024-12-11,0.3,美股四大指數全面走跌拖累台股半導體股，電子權值股全面走弱，加上塑膠族群表現弱勢，市場情緒轉向中性。,2025-08-04 20:50:05,20
2024-12-12,0.6,雖然11月營收年增率前5名成長強勁，但整體市場情緒仍受到美股費半指數回落及台積電ADR走弱影響，呈現中性偏空。,2025-08-04 20:50:09,20
2024-12-13,0.6,政府推動「AI兆立方計畫」強化台灣在全球AI供應鏈的競爭力，帶動相關產業成長，但具體效益尚待觀察。,2025-08-04 20:50:13,20
2024-12-14,0.7,獲獎產品與新技術的推出顯示產業創新能力強勁，但整體營收表現仍需關注。,2025-08-04 20:50:16,20
2024-12-15,0.7,生成式 AI 在教育領域應用前景廣闊，相關技術工具持續發展，激勵市場對該公司在新興科技教育市場的正面期待。,2025-08-04 20:50:18,20
2024-12-16,0.8,台積電領漲帶動大盤上揚，多頭氣勢強勁，加上 AI 概念股如創意表現亮眼，激勵市場情緒轉趨樂觀。,2025-08-04 20:50:22,20
2024-12-17,0.7,凱基人壽持續關注心智障礙者議題，贊助路跑活動並籌建安老家園，展現企業社會責任與正面形象，激勵市場情緒。,2025-08-04 20:50:26,20
2024-12-18,0.7,AI、ASIC 及多功能機器人概念股強勢表現，帶動市場情緒偏正面，但整體漲幅有限，顯示短期內仍處於區間整理格局。,2025-08-04 20:50:30,20
2024-12-20,0.7,政策推動與優渥條件吸引國際數位遊牧人潮，台南作為首站帶動正面市場情緒。,2025-08-04 20:50:53,20
2024-12-23,0.6,兼職市場需求強勁且人力短缺有利於平台業績成長，但獲利能力與長期發展前景仍待觀察。,2025-08-04 20:50:55,20
