date,factor,explanation,updated_time,news_count
2025-04-01,0.7,大盤反彈激勵多數個股上揚，但部分高價股與軍工概念股表現相對弱勢，市場情緒偏向正面但仍有不確定因素存在。,2025-08-05 00:47:02,20
2025-04-07,0.2,市場信心受創，多數類股重挫，僅少數個股抗跌，顯示投資人擔憂經濟衰退與通膨壓力。,2025-08-05 00:47:04,20
2025-04-09,0.2,市場信心受美股與總體經濟因素影響，多檔權值股與高價股重挫，拖累整體市場表現。,2025-08-05 00:47:07,20
2025-04-10,0.9,美國暫緩對多國實施關稅帶動台股大反彈，電子權值股、金融雙雄及 AI 類股全面亮燈漲停，千金股維持全數上揚，市場情緒樂觀。,2025-08-05 00:47:09,20
2025-04-11,0.3,市場情緒受美中貿易戰影響而轉趨保守，千金股普遍走弱，僅緯穎表現相對抗跌。,2025-08-05 00:47:11,20
2025-04-15,0.6,電子指標股與傳產族群齊揚，帶動大盤上漲，但成交量偏低且個股表現分歧。,2025-08-05 00:47:13,20
2025-04-17,0.6,3月營收年增率前5名公司表現亮眼，顯示部分產業需求穩健，但整體市場情緒仍受多空因素影響而趨中性。,2025-08-05 00:47:15,20
2025-04-25,0.7,電子權值股與散熱族群齊揚帶動大盤上攻，但缺口壓力使漲幅收斂，市場情緒偏正面。,2025-08-05 00:47:17,20
2025-04-28,0.7,AI 概念股強勢表現與輝達 B300 生產進度提前帶動相關供應鏈上漲，激勵市場情緒。,2025-08-05 00:47:19,20
2025-05-06,0.3,獲利預估下修與營收展望保守壓抑市場信心，雖有分析師調升目標價但整體偏向中性。,2025-08-05 00:47:21,20
2025-05-07,0.5,匯率波動影響市場信心，台股震盪整理，個股表現分歧。,2025-08-05 00:47:23,20
2025-05-12,0.3,市場預估獲利下修與營收成長力道趨緩，引發對公司未來表現的擔憂。,2025-08-05 00:47:25,20
2025-05-16,0.5,市場預估2025年EPS上修至87.92元，營收成長動能穩健，但獲利表現與股價走勢尚未完全反映在分析師預期中。,2025-08-05 00:47:27,20
2025-05-19,0.6,輝達執行長點名多家台廠供應鏈，嘉澤入列顯示其在 AI 產業鏈中的重要地位，有助於提升市場信心。,2025-08-05 00:47:30,20
2025-05-21,0.8,展望樂觀與新平台推升 ASP 帶動營收成長，惟匯率因素影響短期獲利表現。,2025-08-05 00:47:32,20
2025-05-22,0.7,匯率有利公司營收與伺服器需求成長帶動下，市場情緒偏正面，但獲利預估調降壓抑部分樂觀氣氛。,2025-08-05 00:47:34,20
2025-05-23,0.6,市場情緒維持中性，雖有部分個股表現強勢，但整體盤面受經濟數據與政策變數影響，呈現區間震盪走勢。,2025-08-05 00:47:37,20
2025-05-27,0.6,主動式 ETF 上市帶來資金挹注，搭配 AI 產業前景看俏與庫存調整接近尾聲，支撐市場情緒偏多。,2025-08-05 00:48:00,20
2025-06-02,0.3,川普再度針對中國發文，引發市場恐慌情緒升溫，台股補跌走低，但金控與航運族群相對有撐。,2025-08-05 00:48:02,20
2025-06-05,0.7,台積電重返千金帶動大盤上漲，加上 AI 股強勢表現與多檔電子指標股走揚，激勵市場情緒，但航運股走弱壓抑漲幅。,2025-08-05 00:48:05,20
2025-06-13,0.2,中東地緣政治風險升溫拖累全球股市，加上部分個股走跌，整體市場情緒偏向負面。,2025-08-05 00:48:07,20
2025-06-18,0.3,市場預估EPS與營收下修顯示對公司未來成長前景的疑慮，壓抑短期市場情緒。,2025-08-05 00:48:09,20
2025-06-20,0.5,市場預估EPS與營收下修壓抑短期市場情緒，但整體趨勢仍維持正面。,2025-08-05 00:48:11,20
