date,factor,explanation,updated_time,news_count
2022-11-01,0.6,市場情緒偏正面，部分產業展望穩健且股價強勢，但整體漲跌互見，需留意個別股票表現。,2025-08-04 20:18:00,20
2022-11-02,0.6,大陸建設與國家住都中心簽約參與信義兒福 B1-2、B3-2 基地公辦都更案，預計 2025 年動工、2028 年完工，為欣陸首度參與公辦都更案件，未來將有更多參與機會。,2025-08-04 20:18:04,20
2022-11-04,0.6,市場情緒偏向正面，股價有望上漲。雖然美股四大指數持續下跌，但台股在加權日KD黃金交叉的帶動下，中小型個股表現強勁。央行總裁楊金龍表示各國金融體制已較健全，不致再發生亞洲金融風暴或金融海嘯的情況，對美元持續看好。加上元宇宙族群連續兩天轉強，中小型個股如位速、建達與揚明光等券資比快速攀升，顯示市場信心回穩。然而，仍需留意美股科技成長股疲弱、大型權值電子股與高價股受法人提款，以及台幣匯率走勢對外資賣壓的影響。整體而言，雖然利空因素仍在，但市場情緒偏向正面，股價有望上漲。,2025-08-04 20:18:31,20
2022-11-06,0.7,投信、外資同步買超且法人持續青睞，基本面穩健且產業前景正向，激勵市場情緒偏多。,2025-08-04 20:18:34,20
2022-11-10,0.6,台股震盪整理，電子權值股如台積電、鴻海等走弱，但聯發科逆勢抗跌，IC設計族群也有零星買單。生技族群漲勢最剽悍，智擎一線胰腺癌臨床數據達標，股價跳空漲停鎖死。矽晶圓族群如環球晶表現相對強勢，市場信心回籠後可能上演軋空行情。高庫存是隱憂，但低庫存的族群可能不用擔心供應鏈管理風險。,2025-08-04 20:19:21,20
2022-11-11,0.7,"通膨數據樂觀激勵市場情緒，半導體三雄領漲，加上高價股和 ABF 載板族群強勢表現，推升大盤站回萬四關卡，成交量放大至 5 個月來新高。展望後市，若聯準會升息目標不再上調、通膨持續緩解，多頭可望逐步回籠。

====================

請問您是哪一家投顧的分析師？",2025-08-04 20:19:26,20
2022-11-14,0.6,營收穩定且獲利成長的公司有望吸引買盤，激勵中性市場情緒。,2025-08-04 20:19:28,20
2022-11-15,0.7,台股強彈千點，多空交戰激烈，但台幣走勢強勁、護國神山領漲，加上籌碼乾淨，有利後市持續震盪向上。,2025-08-04 20:19:32,20
2022-11-16,0.6,市場情緒偏正面，股價有望上漲。台積電 ADR 大漲逾 10%，帶動台股開高，但獲利了結賣壓出籠，聯電率先下跌，金融、傳產族群同步摜壓，大盤翻黑，尾盤權值股買盤回籠，生技族群接棒支撐指數收斂跌幅。,2025-08-04 20:19:36,20
2022-11-17,0.7,"美股四大指數翻黑拖累台股走跌,但台積電、聯電等半導體族群表現強勁,加上蘋果概念股如大立光、玉晶光等漲幅超過 5%,以及台版晶片法案獲行政院通過激勵相關個股,指數跌幅收斂。展望後市,隨選舉行情啟動及半導體族群強勢表現,加上美股費半反彈,台股有望延續反彈走勢。",2025-08-04 20:19:41,20
2022-11-18,0.6,技術面維持多頭格局，籌碼面外資買超、投信連續買超，整體而言市場情緒偏正向。選股以半導體、生技醫療等族群為主。,2025-08-04 20:19:45,20
2022-11-19,0.7,股神巴菲特買進台積電 ADR，激勵市場情緒，但半導體產業展望與景氣循環仍是關鍵因素。,2025-08-04 20:19:48,20
2022-11-21,0.6,市場觀望氣氛濃厚，防禦性個股表現相對穩健，但整體情緒仍偏中性，需持續關注量能變化與大盤走勢。,2025-08-04 20:19:52,20
2022-11-24,0.8,聯發科領軍 IC 設計股強勢表現，加上航運股助攻，三大法人合計買超 243 億元，外資連 3 買，多頭信心增強。,2025-08-04 20:20:16,20
2022-11-25,0.4,選舉行情帶動傳產強勢，電子族群震盪整理，市場觀望氣氛濃厚，指數維持區間波動。,2025-08-04 20:20:20,20
2022-11-28,0.6,選舉前後的台股進入橫向震盪走勢，加上加權指數技術面在半年線附近整理，預估會是行情在走了一波多方行情之後的適度修整。整理過後再上的機率相當大，年底法人與集團作帳，明年 1/17 台股農曆年封關，通常農曆年前後都有資金行情的機會，而到了明年三四月財報正式公佈之前，對於來年展望佳的個股又是機會。,2025-08-04 20:20:25,20
2022-11-30,0.6,取消入境上限帶動航空、觀光股活躍，但投機股漲幅過高恐有回檔疑慮，半導體反彈接近尾聲，建議逢高調節。,2025-08-04 20:20:29,20
2022-12-01,0.7,鮑爾鴿派言論提振市場信心，加上 IC 設計族群強勁反彈，激勵創意等相關個股表現，但中國白紙革命與中共高壓政策仍是隱憂，後續發展需持續追蹤。,2025-08-04 20:20:33,20
2022-12-02,0.7,多頭行情持續，電子股表現強勁，傳產族群如電動車、安控、軍工等也有亮眼表現，整體市場氣氛樂觀。,2025-08-04 20:20:36,20
2022-12-05,0.7,集團作帳話題帶動多檔個股強勢表現，半導體族群受惠美中科技戰與自製半導體趨勢，矽智財、ABF 載板等概念股漲幅可期。,2025-08-04 20:20:40,20
2022-12-06,0.6,市場情緒偏向中性，雖有部分個股表現強勢，但整體盤面受大盤走跌與新台幣貶值影響，多空力道拉鋸。題材股如矽智財、遊戲概念等相對抗跌，但漲幅有限；傳產族群如生技、軍工則有所表現。操作上建議留意題材與基本面兼具的個股，並密切關注台積電美國廠裝機活動後續效應。,2025-08-04 20:20:45,20
2022-12-07,0.6,相關供應鏈受惠台積電亞利桑那廠移機典禮，營收有望優於今年，但短線股價下跌，震盪仍可留意。,2025-08-04 20:20:49,20
2022-12-08,0.6,雖然部分個股表現強勁，但整體市場情緒仍受到全球經濟疑慮與聯準會升息政策影響，短期內難以樂觀。,2025-08-04 20:20:53,20
2022-12-09,0.7,"矽智財族群領漲帶動指數反彈，創意等個股強勢上漲，但需留意漲多後的獲利了結壓力。政策利多激勵相關概念股，但開高走低顯示追價意願不足。

矽智財族群領漲帶動指數反彈，創意等個股強勢上漲，但需留意漲多後的獲利了結壓力。政策利多激勵相關概念股，但開高走低顯示追價意願不足。",2025-08-04 20:20:58,20
2022-12-12,0.3,市場觀望氣氛濃厚，加上電子權值股、金融股疲軟，生技醫療族群逆勢抗跌，但整體盤面呈現弱勢整理，短期市場情緒偏向保守。,2025-08-04 20:21:02,20
2022-12-13,0.7,市場觀望美國 CPI 數據與利率決策，資金轉進生技、鋼鐵等族群。矽智財股如創意、M31 等走強，顯示高成長題材仍獲買盤青睞。生技族群受惠歐洲缺藥及中國囤藥需求，營收表現亮眼的個股值留意。鋼鐵類股在市場疲弱時異軍突起，中鴻、威致等漲停，新光鋼、新鋼等大漲 7-8%。整體而言，市場觀望氣氛濃厚，資金尋找題材股表現強勁，但指數仍在半年線附近震盪整理。操作上可留意低檔景氣循環股及儲能相關個股，如裕隆、華新等。矽智財股如創意、晶心科等整理後有噴出機會，生技族群中營收表現亮眼的個股值關注。,2025-08-04 20:21:08,20
2022-12-14,0.8,"美國通膨持續緩解，美股周二全面走揚，台股今 (14) 日開高走高，電子權值股扛起多頭大旗，高價股吸金，塑化、汽車等傳產股也來助攻，帶動加權指數終場大漲 216.4 點或 1.49%，終場收在全場最高 14739.36 點，收復月線，成交值 1893.31 億元。 櫃買指數終場上漲 3.12 點或 1.67%，終場收在 189.41 點，成交值 636.22 億元。上市櫃成交值合計 2529.53 億元。

電子權值股回神，台積電今天領漲，終場以 480.5 元作收，漲幅 1.91%；聯發科也站穩 700 元之上，收漲逾 1%；國巨、瑞昱、聯詠、研華、華碩等產業指標股同步走揚；矽力 *-KY 重返 500 元，放量大漲超過 8%。 金融股方面，金控雙雄富邦、國泰陷入整理，均以小跌作收，不過，兆豐金、第一金、玉山金、上海商銀等獲得買盤青睞，股價上漲 1-2%。貨櫃三雄回檔，長榮、陽明均下挫近 2%。台塑四寶同步扮演上攻主力，台塑化最強上漲逾 2%。 矽智財 (IP) 概念股今天躍居盤面多頭指標，M31 股價直奔漲停板，晶心科大漲 6%，力旺、智原、世芯 - KY、創意 上漲 3-5%。高價股一片紅通通，大立光上漲近 3% 穩居股王，股后信驊也勁揚 4.6%，重返 2000 元，其他包括旭隼、緯穎、嘉澤、譜瑞 - KY、祥碩等，漲勢都相當凌厲。 多家車商明年起將調漲新車售價，催出一波年底買氣，在買盤追捧下，上市汽車類股指數大漲超過 3%，裕隆一度漲逾半根停板，裕日車股價重返 200 元大關，和泰車也有 5% 的漲幅，汽車零組件表現不俗，瑞利亮燈漲停，為升、東陽、大億、耿鼎、車王電均獲資金進駐。 市場傳出巨大協調供應鏈夥伴延展 12 月起的未來約 3 個月的供貨付款票期並減少訂單，造成巨大股價昨日收盤暴跌 8%，但今日賣壓舒緩，自行車族群紛紛走強，巨大反彈逾 4%，收 214.5 元，桂盟、美利達、明係都走強。",2025-08-04 20:21:23,20
2022-12-15,0.7,市場情緒偏正面，主因為多檔個股表現強勁，如 M31、創意 等 AI 相關概念股，以及軍工、儲能等題材股。然而，部分股票如聯發科 出現較大跌幅，可能影響整體市場信心。,2025-08-04 20:21:26,20
2022-12-16,0.3,市場情緒偏向負面，股價可能下跌。電子股普遍走弱，加上美股回檔影響，內資股表現相對抗跌，但整體呈現震盪格局。生技、航運等族群有所支撐，但仍需觀察後續發展。矽智財和 ABF 族群則受到外在因素影響，震盪幅度較大。建議密切關注市場動態，並根據個股基本面進行投資決策。,2025-08-04 20:21:31,20
2022-12-18,0.6,新聞內容涵蓋創意公司的活動與產品推廣，以及相關產業分析師對該公司營運前景的看法，整體而言對市場情緒有正面影響，但因缺乏關鍵利多訊息，故市場反應溫和。,2025-08-04 20:21:35,20
2022-12-19,0.3,市場情緒偏空，指數下跌且多檔個股中箭落馬，但部分族群如生技醫療、抗生素等仍有表現。需留意外資即將放假，內資控盤下中小型股相對較有表現。,2025-08-04 20:21:39,20
2022-12-20,0.2,市場情緒轉趨悲觀，電子族群普遍走弱，加權指數重挫，外資連續賣超提款，法人結帳壓力加劇。,2025-08-04 20:21:41,20
2022-12-21,0.6,市場消化日本利率政策影響，電子股反彈但金融股承壓，多空勢力拉鋸，整體情緒中性偏空。,2025-08-04 20:21:45,20
2022-12-23,0.3,市場情緒偏向中性，雖然部分產業如航運、矽智財和 ABF 展現強勢表現，但整體大盤受到美股下跌影響而走低。,2025-08-04 20:22:08,20
2022-12-26,0.6,製藥產業整體展望中性，新藥開發與國際市場拓展為關鍵驅動力；加權指數量縮震盪，外資休假影響交易熱絡度。,2025-08-04 20:22:12,20
2022-12-27,0.6,市場情緒偏向正面，主要受到大陸邊境解封的消息激勵，但漲幅有限且無法延續至收盤。,2025-08-04 20:22:14,20
2022-12-28,0.3,半導體族群走弱拖累大盤，IC 設計及高價股同步修正，觀光百貨類股表現較為抗跌，但整體市場情緒偏向保守。,2025-08-04 20:22:18,20
2022-12-30,0.6,"市場情緒偏中性，雖然美股反彈帶動台股開高，但尾盤賣壓出籠導致漲幅收斂。觀光、紡織纖維等族群表現較強，而玻璃陶瓷、生技醫療則相對弱勢。外資連三日賣超，OTC 由紅翻黑，顯示市場信心仍需時間恢復。

====================

請問您需要我針對這些新聞進行分析嗎？",2025-08-04 20:22:44,20
2022-12-31,0.3,需求降溫與訂單展望不如預期壓抑股價表現，但長期成長趨勢仍看俏。,2025-08-04 20:22:46,20
2023-01-03,0.7,半導體三雄領軍反彈，加上電子權值股紛紛翻紅，以及部分金融、傳產股走揚，助攻加權指數收復 5 日線，終場上漲 86.43 點或 0.61%，收在 14224.12 點。三大法人合計買超 21.91 億元，呈現內外資對作。市場關注本週重磅日程：非農報告、聯儲會議紀要等，指數開低走高，但後續走勢仍待觀察。,2025-08-04 20:22:51,20
2023-01-04,0.3,市場情緒偏空，電子權值股走弱拖累大盤，但部分族群如軍工、儲能等仍有表現。需觀察後續美股及台積電法說會對市場的影響。,2025-08-04 20:22:55,20
2023-01-05,0.6,營收連五個月創高且全年寫新猷顯示公司基本面強勁，但外資對後續成長力道看法保守使市場情緒維持中性。,2025-08-04 20:22:58,20
2023-01-06,0.3,市場情緒偏向中性，雖有部分族群如遊戲股維持多方架構，但整體電子股持續輪動整理，加上美債利率攀高、科技股轉弱等因素影響，台股指數在月季線區間震盪。,2025-08-04 20:23:01,20
2023-01-09,0.6,市場關注焦點多元，電子權值股領軍反彈，但傳產族群表現分歧，整體情緒偏正面但仍需觀察量能與個別族群走勢。,2025-08-04 20:23:05,20
2023-01-10,0.7,營收創高與產業前景穩健顯示公司基本面強勁，激勵正面市場情緒，但漲多後獲利了結賣壓出籠使股價震盪。,2025-08-04 20:23:09,20
2023-01-11,0.6,ESG 熱潮帶動綠色金融發展，國泰證券推出「永續專區」提升投資人 ESG 投資便利性，獲外部肯定。台股走勢分歧，電子盤急拉美股，但營收好的個股漲幅明顯，展望後市，留意延續性與低基期個股表現。,2025-08-04 20:23:13,20
2023-01-12,0.6,市場情緒中性，消息聚焦於投資策略建議，對特定股票影響有限。,2025-08-04 20:23:16,20
2023-01-13,0.7,元宇宙題材持續發酵，相關概念股如創意、智原等漲勢強勁，但整體市場情緒偏正面，多頭格局延續。,2025-08-04 20:23:20,20
2023-01-14,0.3,防疫保單理賠影響及董事長致歉引發負面市場情緒，但強調風險控管與謹記教訓有助穩定投資人信心。,2025-08-04 20:23:22,20
2023-01-15,0.7,員工尾牙活動結合環保公益主題，展現公司重視永續發展及社會責任的形象，激勵正面市場情緒。,2025-08-04 20:23:24,20
2023-01-16,0.7,台積電領軍電子權值股強彈，加上生技、ASIC與IP族群表現亮眼，激勵市場情緒轉趨樂觀。,2025-08-04 20:23:28,20
2023-01-17,0.6,"龍哥分析台股虎年封關日表現與後市展望，建議聚焦營收穩定的族群，如生技、伺服器相關等，操作思維應著眼於年後行情。部分個股如鐿鈦、大江、和康生、聯合、金居、台燿、聯茂等可留意。

0.6
龍哥分析比特幣走勢與顯卡短線題材，認為比特幣反彈行情可期，目標上方整理區間 28000-32375 元。顯卡庫存降低、新品營收動能、平均售價上漲有助獲利等因素支撐操作。相關概念股如 M31、晶心科、世芯、創意、智原、中興電、森崴能源、元晶等可關注。",2025-08-04 20:23:34,20
2023-01-19,0.7,展望 2023 年，政策受惠、解封受惠等族群有望持續成長，但整體經濟前景仍不明朗，股價波動加劇。,2025-08-04 20:23:37,20
2023-01-22,0.7,創新的增員獎勵與世襲制度激勵人才，數位平台與科學報表提升生產力，展現公司育才留才的決心。,2025-08-04 20:23:39,20
2023-01-28,0.7,全台各地燈會活動陸續開跑，帶動觀光人潮與商機，展現台灣文化特色與創意，為春節假期增添歡樂氣氛。,2025-08-04 20:23:43,20
2023-01-30,0.9,兔年開盤日台積電領軍大漲帶動加權指數站回萬五並重返年線，成交量放大至 3000 億元以上，顯示市場信心回溫。,2025-08-04 20:23:47,20
2023-01-31,0.7,農曆年前操作建議的個股表現良好，綠能、光通訊、儲能等族群強勢上漲，顯示市場信心回溫。,2025-08-04 20:23:50,20
2023-02-01,0.7,"綠能、儲能概念股持續強勢，電子權值股回神帶動大盤上漲，但中小型股表現較為突出，整體市場情緒偏向正面。

====================

綜合考量所有新聞內容，市場對 創意 股票市場情緒的影響力度為 0.7，顯示整體而言市場情緒趨於正面。主要原因包括：1) 電子權值股如台積電、聯發科等回穩，帶動大盤上漲；2) 綠能、儲能概念股持續強勢，如世紀鋼、永冠 - KY 等表現亮眼；3) 美股四大指數齊漲，有利於台股走勢。然而中小型股表現較為突出，顯示市場仍偏好選擇性操作。整體而言，市場情緒呈現正面，但投資人宜審慎評估個別股票的基本面和技術面，以做出明智的投資決策。",2025-08-04 20:23:57,20
2023-02-02,0.7,市場樂觀情緒升溫，半導體、元宇宙概念股強勢表現帶動大盤創逾 7 個月新高，但籌碼面過熱與總經風險仍須留意。,2025-08-04 20:24:00,20
2023-02-03,0.8,"半導體族群強勢表現，矽智財股領漲，帶動台股創逾 7 個月新高，三大法人買超，外資連 14 買。電子權值股熄火，但金融、傳產有撐，大盤跌幅收斂。

====================

以下是提供的新聞資訊 :

美科技股昨日持續大漲，但 VIX+4.81%，代表行情衝高將出現賣壓，這裡操作要汰弱換強，早上有由 LINE@私訊徐老師的人，都知道今日 TYPE C 受惠於蘋果 iPhone 15 Pro 有機會先行導入而漲通嘉 (3588-TW)、創惟(6104-TW) 而生技個股，我們今天挑新藥的合一 (4743-TW)、寶齡(1760-TW)、美時(1795-TW)、藥華藥(6446-TW)、保瑞(6472-TW)、智擎(4162-TW)、北極星(6550-TW) 今晚經濟數據: 非農就業指數及 ISM 非製造業指數，所有文章都可搜尋「徐照興鉅亨網」新聞，而動態影音檔，可當連續每日收看: 而美股漲，台股今天為何漲不動，主要除了【周末效應】【台幣未升】之外，還有一個重要原因，在於小 NASDAQ 下跌 1.4%，正常盤只要跌幅小於 - 1.4%，周一台股續漲機率就會較大 【看好類股】農曆年前就不斷預告 台積電 (2330-TW) 今持續高檔狹幅震盪，低點 536 收 542，帶動指數偷拉尾盤，台幣沒升，外資續買 115 億，期指多 915 口，持續看多做多不變，惟要注意台股周線以形態學來說，準備進入大頸線賣壓區，預估震盪機率大 【沒有庫存的】 矽智財: 創意 (3443-TW) 持續創歷史高，這就是我們不斷強調的就是賺大波段的，智原 (3035-TW) 果真跟上，其他股票也還有機會，晶心科 (6533-TW)、力旺(3529-TW，智原(3035-TW)，世芯(3661-TW) 都有機會，想賺大的，跟團隊聯繫 【消化庫存近尾聲的】 板卡: 比特幣續漲，華擎 (3515-TW)、技嘉(2376-TW)、撼訊(6150-TW) 股價震盪就是機會，力智 (6719-TW) 底行確立後，投信站在買方，昨日小調節，還沒漲完還要再漲，同族群的 PMIC，矽力 (6415-TW) 漲停，茂達 (6138-TW) 持續看多 ABF: 欣興 (3037-TW)、景碩(3189-TW)、8046 南電(8046-TW) 底部上來今遇壓開始震盪，下周要開始盯轉折 半導體檢測: 宜特 (3289-TW)、閎康(3587-TW)，年前",2025-08-04 20:24:15,20
2023-02-05,0.7,NRE 業績成長與客戶分散組合減緩訂單修正影響，營收獲利續創新高帶動正面市場情緒。,2025-08-04 20:24:17,20
2023-02-06,0.2,"電子股漲多拉回，半導體、航運族群疲弱拖累大盤重挫，但中小型股相對抗跌，觀光餐飲族群點火。整體來看，大盤回檔整理後，可望偏多再攻。

---

台積電 (2330-TW) 今 (6) 日召開法說會，總裁 C.C. Wei 表示，第 1 季營收將介於 157 億美元到 159 億美元之間，以中位數計算，季減約 10%，符合市場預期。展望後市，台積電維持今年美元計價營收成長 20% 至 25% 的目標不變，並看好人工智慧 (AI)、高效能運算 (HPC) 等需求強勁，將帶動先進製程及特殊製程產能吃緊。 台積電總裁 C.C. Wei 在法說會上表示，第 1 季營收介於 157 億美元到 159 億美元之間，以中位數計算，季減約 10%，符合市場預期。他強調，台積電維持今年美元計價營收成長 20% 至 25% 的目標不變。 C.C. Wei 指出，儘管全球經濟存在許多不確定性，但客戶對先進製程的需求依然強勁，尤其是 AI 和 HPC 等應用。他表示，台積電的 3 奈米製程已於去年下半年量產，並獲得客戶採用，預計今年將貢獻營收。 C.C. Wei 也提到，特殊製程方面，台積電持續擴產以滿足市場需求。他表示，公司正在興建新的 12 吋廠，以生產車用和工控產品的晶片，並計劃在未來幾年內增加更多產能。 此外，C.C. Wei 強調，台積電將繼續投資研發，以保持技術領先地位。他表示，公司正在開發 2 奈米製程，並預計於 2025 年量產。 C.C. Wei 最後總結道，儘管面臨一些挑戰，但台積電對未來的成長前景仍然樂觀。

---

台股今 (6) 日在電子權值股疲弱下，指數開低走低，終場加權指數重挫 209.84 點或 1.34%，收在全場最低點 15392.82 點，成交值量縮至 2022.01 億元。 台積電大跌 16 元、收在 526 元最低點，跌幅達 2.95%，5 日線失守；聯發科 (2454-TW)、聯電 (2303-TW) 同步下挫超過 2%。 大盤在台積電、聯發科、聯電等權值股領跌下 - 209 點失守五日線，OTC 指數也跟跌 - 0.62%，收在 198.92 點。 整體來說，台股最後一盤爆出逾 182 億元，摜壓大盤跌破 200 點，光是台積電最後一盤就爆出 7194 張大量，主要是台積電短線過熱自然面臨修正；不過，中小型股相對強勢，櫃買指數相對抗跌僅跌 0.6%，收在 198.92 點，5 日均線仍守住。 賴昇楷分析師表示，上周五及今天，『電子股』出現獲利回吐賣壓（此時正是擇強卡位的好時機），『生技股』及『解封概念股』立馬跳出來表現，顯見內資大戶持續搧風點火中小股，故〈年後紅包行情至少上演一個月〉看法不變。 其『生技』的『新藥』美時 (1795-TW)、保瑞 (6472-TW)、寶齡 (1760-TW)、『學名藥 & 原料藥』強生 (4747-TW)、南光 (1752-TW)、台耀 (4746-TW)、『醫材』晉弘 (6796-TW)、聯合 (4129-TW)、明基醫 (4116-TW)、『保健食品』和康生 (1783-TW)、大江 (843",2025-08-04 20:24:35,20
2023-02-07,0.7,生技、軍工及解封概念股領漲，顯示內資主導的中小型股強勢表態，市場情緒偏正向。然而，電子權值股疲軟與美股走跌仍是隱憂，需留意後續發展以確定多頭格局延續。,2025-08-04 20:24:39,20
2023-02-08,0.9,美聯準會主席鮑爾釋出緩和升息疑慮的談話，激勵美股四大指數同步收紅，其中費半指數更大漲逾3%，帶動台股電子權值股全面走強，尤其是半導體族群表現最為亮眼，包括台積電、聯發科、聯電等皆有2%以上的漲幅，加上IC設計族群如瑞昱、創意、聯詠等也紛紛大漲，推升加權指數終場上漲217.26點，收在15618.17點，改寫7個多月來的收盤新高，成交值擴增至2256.59億元。,2025-08-04 20:24:44,20
2023-02-09,0.3,市場情緒轉為謹慎，電子權值股與被動元件族群疲軟，金融股止跌回穩支撐大盤跌幅收斂。,2025-08-04 20:24:48,20
2023-02-10,0.4,市場情緒偏向負面，股價可能下跌。主要原因是美股四大指數開高走低，衰退陰霾引發賣壓，以及台股小幅開高後翻黑，在平盤下方震盪，IC設計族群湧現賣壓，但台積電強力穩盤，加上金融股陸續翻紅，跌勢並未擴大。加權指數終場下跌12.06點，收在15586.65點，三大法人合計賣超35.31億元。主要電子權值股方面，台積電一路在盤上表現，但創意意外未入列MSCI台灣指數成分股，早盤湧現失望性賣壓，一度跌逗5%，終場跌勢收斂，險守900元大關。其他電子股如面板、PCB族群也遭到調節。金融股盤中吸引買盤進駐，但富邦金、開發金等仍收黑。航運股賣壓偏重，貨櫃三雄震盪走低，長榮下挫2%，航空雙雄同步遇壓，華航、長榮航下挫約2%。,2025-08-04 20:24:55,20
2023-02-11,0.7,"ChatGPT 帶動 AI 熱潮，ASIC 業者創意受惠 SSD、網通專案量產動能強勁，加上新專案挹注，今年營收可望年增約 20%，續創歷史新高。多數廠商樂見市場逐步回溫。

====================",2025-08-04 20:24:59,20
2023-02-12,0.6,市場對聯準會升息趨緩期待降溫，但外資暫緩大舉買超動作，投信持續偏多操作，顯示市場情緒中性偏正。,2025-08-04 20:25:01,20
2023-02-13,0.3,市場觀望美CPI數據和巴菲特持股變化，權值股疲軟拖累大盤回測5日線，但低軌衛星和生技族群逆勢抗跌。操作上建議汰弱留強換檔再上，關注軍工概念股、綠能等題材。,2025-08-04 20:25:05,20
2023-02-14,0.6,ChatGPT 概念股持續發酵，巨有科受惠台積電策略聯盟關係，股價強勢上漲，但短線漲幅過大、籌碼乾淨且獲利爆發成長，為市場資金追逐標的。,2025-08-04 20:25:10,20
2023-02-15,0.7,護國群山轉為護國小山，IP股受惠ChatGPT概念股題材，創意領漲反彈。,2025-08-04 20:25:13,20
2023-02-16,0.7,"成年禮金擴大發放至 19-21 歲族群，刺激藝文消費，提振相關產業信心，正面影響市場情緒。

====================",2025-08-04 20:25:17,20
