date,factor,explanation,updated_time,news_count
2024-09-18,0.3,市場觀望氣氛濃厚，加上iPhone 16系列手機銷售未見亮點，拖累光寶科等相關個股表現。,2025-08-11 23:12:44,15
2024-09-20,0.3,電子權值股漲幅收斂與營建類股重挫拖累市場情緒，雖然台積電、鴻海等個股仍收紅，但光寶科等其他電子指標表現疲弱。,2025-08-11 23:12:46,15
2024-09-26,0.6,外資買超台積電及電子族群穩定市場信心，但漲多拉回壓力使盤勢維持溫和偏多整理。,2025-08-11 23:12:49,15
2024-09-27,0.6,外資連續買超且新台幣升值帶動市場信心，但個股表現分歧，整體市場情緒偏正面。,2025-08-11 23:12:51,15
2024-10-01,0.7,AI 概念股與光電展題材帶動權值股反彈，激勵市場情緒上揚。,2025-08-11 23:12:53,15
2024-10-08,0.7,臺灣團隊榮獲歐盟 6G 實驗網認證，展現國際合作實力，激勵市場對光寶科等相關業者的正面情緒。,2025-08-11 23:12:55,15
2024-10-09,0.6,營收月減但主要業務仍成長，顯示公司基本面穩健，激勵中性市場情緒。,2025-08-11 23:12:57,15
2024-10-11,0.7,AI 概念股與伺服器新品帶動市場信心，但通膨數據衝擊降息預期，短期漲勢可能受阻。,2025-08-11 23:13:01,15
2024-10-14,0.6,電子股旺季行情與技術指標偏多支撐市場信心，但匯損及地緣政治風險仍是潛在變數。,2025-08-11 23:13:03,15
2024-10-16,0.3,市場情緒偏向負面，主要受到 ASML 財報不佳與輝達重挫影響，但光寶科 展示整合式 AI 雲端伺服器解決方案的消息對該公司有正面助益。,2025-08-11 23:13:07,15
2024-10-17,0.6,市場情緒偏向正面，但電子股漲幅有限，傳產族群與貨櫃三雄表現強勁，整體大盤維持高檔震盪。,2025-08-11 23:13:10,15
2024-10-18,0.7,AI號誌系統的推出展現公司在車用電子領域的創新能力，有利於提升市場信心並帶來正面效應。,2025-08-11 23:13:12,15
2024-10-28,0.7,AI 產業政策支持與指數編製表現亮眼，激勵市場對相關個股的正面情緒。,2025-08-11 23:13:15,15
2024-10-29,0.6,新聞內容呈現多空消息，外資買超與景氣轉向、消費信心下滑等負面因素交錯，整體市場情緒偏向中性。,2025-08-11 23:13:18,15
2024-10-30,0.7,獲利成長與高價值事業比重提升帶動毛利率上升，展望未來並持續聚焦雲端、光電等新領域，激勵市場情緒。,2025-08-11 23:13:21,15
2024-11-01,0.3,市場預估EPS與營收下修壓抑短期市場情緒，但獲利表現仍維持正向。,2025-08-11 23:13:23,15
2024-11-02,0.7,AI 伺服器需求強勁與其他應用領域成長動能支撐營運展望，激勵正面市場情緒。,2025-08-11 23:13:25,15
2024-11-08,0.7,光電半導體、雲端運算及高階伺服器、網通電源營收成長帶動月增年增，顯示公司基本面穩健。,2025-08-11 23:13:27,15
2024-11-11,0.6,市場情緒偏中性，雖然 AI 伺服器與相關電池股走強，但台積電遭美國商務部限制供貨中國的消息影響大盤表現。,2025-08-11 23:13:30,15
2024-11-12,0.4,光寶科與 SUTD 合作開發節能應用，市場對 AI 概念股仍有期待，但整體電子族群疲弱，加上台積電領跌，拖累大盤下跌 547 點。,2025-08-11 23:13:33,15
2024-11-15,0.3,電子權值股表現疲弱拖累大盤，但三大法人買超及新台幣升值帶來支撐，整體市場情緒偏中性。,2025-08-11 23:13:36,15
2024-11-19,0.7,導入 AI 與大數據科技提升營運效率並實現數據驅動創新，展現公司數位轉型決心，激勵中性至正面市場情緒。,2025-08-11 23:13:38,15
2024-11-20,0.7,AI 產業需求強勁、展覽亮相新品與技術、外資買超等正面因素，對光寶科的市場情緒帶來中高檔影響。,2025-08-11 23:13:42,15
2024-11-22,0.7,輝達財報優於預期但股價下跌，市場對 AI 概念股信心略有動搖，但整體展望仍正向，加上台積電等權值股助攻，大盤反彈走勢。,2025-08-11 23:13:46,15
2024-11-24,0.7,AI伺服器需求強勁帶動相關產品出貨成長，台廠積極展開新一代解決方案並取得訂單，有利於營運表現。,2025-08-11 23:13:48,15
2024-11-25,0.7,AI 熱潮支撐科技大建設需求，營收旺季加上低碳策略助力，激勵市場對公司基本面與獲利能力的正向預期。,2025-08-11 23:13:52,15
2024-11-26,0.2,關稅提高與貿易戰疑慮升溫壓抑市場信心，權值股走弱拖累大盤下跌。,2025-08-11 23:13:54,15
2024-11-27,0.3,雖有部分個股獲提及，但整體市場仍受總體經濟與地緣政治因素影響，投資人應審慎評估。,2025-08-11 23:13:56,15
2024-12-02,0.7,AI 技術在淨零轉型中的重要性凸顯，光寶科 轉型系統整合方案提供者並運用 AI 碳管理，激勵正面市場情緒。,2025-08-11 23:13:58,15
2024-12-04,0.6,市場情緒維持中性，雖然外資連三買且台股上漲，但個股表現分歧。,2025-08-11 23:14:01,15
2024-12-05,0.6,外資買超力道縮小且三大法人籌碼動向分歧，市場情緒偏中性。,2025-08-11 23:14:03,15
2024-12-06,0.6,11 月營收年增且雲端及物聯網部門成長帶動整體表現，顯示公司基本面維持穩健但仍有衰退壓力。,2025-08-11 23:14:05,15
2024-12-11,0.6,市場情緒中性，雖有正面消息提到車用電子與雲端電源需求，但整體分析師觀點偏向保守。,2025-08-11 23:14:08,15
2024-12-17,0.7,市場信心回溫，AI、車電等產業前景穩健，但個股漲多拉回壓力仍在，建議選擇具基本面支撐且技術面強勢的標的逢低布局。,2025-08-11 23:14:12,15
2024-12-18,0.7,市場情緒偏正面，多方控盤態勢明確，但指數空間有限，類股輪動表現。電子次族群如 PCB、光學元件等強勢，傳產則以航運股較弱。,2025-08-11 23:14:15,15
2024-12-20,0.6,光寶科舉辦二手市集並捐贈拳擊鞋給熱原少年拳擊隊，展現企業社會責任與支持基層運動的正面形象。,2025-08-11 23:14:18,15
2024-12-24,0.9,在道瓊永續指數連續14年入選、總得分創新高及多項ESG獎項肯定下，光寶科的正面永續表現激勵市場情緒。,2025-08-11 23:14:20,15
2024-12-25,0.6,彰銀在資訊安全與永續融資表現獲得肯定，激勵市場對其長期營運的正面看法。,2025-08-11 23:14:22,15
2025-01-08,0.6,雲端運算及高階伺服器、網通電源營收成長帶動單月營收年月雙增，但全年營收仍呈現下滑，顯示市場需求尚未完全復甦。,2025-08-11 23:14:25,15
2025-01-09,0.4,市場情緒偏空，多數類股下跌，加上外資與投信同步賣超影響整體氣氛。,2025-08-11 23:14:27,15
2025-01-10,0.6,市場情緒偏中性，股價維持區間整理格局。雖有個別權值股表現強勁，但大盤指數下跌且日 K 線連四黑，顯示賣壓仍在。三大法人同步站在賣方，外資、自營商連續賣超，投信則連五賣。加上美國對中國 AI 及先進晶片出口限制升級的不確定性因素，短期內台股難有明顯漲勢，但基本面仍維持穩健成長，中長期展望正向。選股建議聚焦 AI 相關供應鏈、光通訊、機器人等題材股，以及高股息殖利率個股。,2025-08-11 23:14:32,15
2025-01-13,0.3,"營收表現不佳與市場信心不足使市場情緒偏空，短期內股價可能承壓。

新聞中提到台積電2024年12月營收新台幣2781億6300萬元，月增0.8%，年增57.8%，第四季合併營收8684億6100萬元，季增14.32%，年增38.84%，累計2024年全年營收28943億800萬元，年增33.9%。雖然台積電的營收持續創高，但整體市場情緒偏空，導致股價可能承壓。",2025-08-11 23:14:36,15
2025-01-14,0.6,市場情緒中性，反彈行情持續，但漲幅受制於量能與外資動向，選股重於選市。,2025-08-11 23:14:39,15
2025-01-16,0.7,權值股領漲帶動大盤反彈，三大法人同步買超且外資期貨空單減少，市場情緒轉趨樂觀。,2025-08-11 23:14:43,15
2025-01-21,0.7,AI 伺服器需求強勁帶動 BBU 概念股轉強，多檔個股漲停創高，整體市場情緒正面。,2025-08-11 23:14:45,15
2025-01-22,0.6,與 Plug and Play Japan 緊密合作有助於光寶科在 AI、能源與永續領域尋找新的商業機會，激勵市場對公司前景的正面看法。,2025-08-11 23:14:47,15
2025-01-29,0.7,AI 基礎建設投資題材持續發酵，相關個股如廣達、緯創、鴻海等走勢強勁，光寶科也受惠於此趨勢。,2025-08-11 23:14:50,15
2025-02-02,0.3,市場信心尚未完全恢復，再加上川普下令 4 日起調高對加墨中等國的關稅，市場氣氛將在半信半疑中拚紅盤好彩頭。,2025-08-11 23:14:52,15
2025-02-13,0.6,電子權值股普遍走揚帶動加上外資買超多檔高股息 ETF 與個股，激勵市場情緒但台積電熄火與部分個股遭調節使整體漲幅有限。,2025-08-11 23:14:55,15
2025-02-14,0.6,MWC 參展行情與相關概念股表現強勁，多檔個股漲幅超過 5%，顯示市場對行動通訊產業前景樂觀。,2025-08-11 23:14:57,15
2025-02-20,0.6,多元化 5G O-RAN 商業應用解決方案與國際夥伴合作，展現公司在通訊領域的實力，但整體市場情緒仍受到大盤影響而維持中性。,2025-08-11 23:14:59,15
2025-02-23,0.6,投信罕見大賣超引發市場擔憂，但外資轉買且期貨空單減少緩解資金出走壓力，整體市場情緒維持中性偏多。,2025-08-11 23:15:02,15
2025-02-24,0.6,法說會利多與 AI 需求強勁支撐市場信心，但美股重挫影響整體情緒，短期漲跌互見。,2025-08-11 23:15:04,15
2025-02-26,0.7,獲利表現符合預期且展望樂觀，雲端、AI等高成長領域需求強勁，但市場對財測修正仍有疑慮。,2025-08-11 23:15:07,15
2025-02-27,0.3,市場對光寶科的獲利預估下修，營收展望保守，財報表現不如預期，加上權值股疲弱影響整體盤勢。,2025-08-11 23:15:10,15
2025-03-10,0.7,2月營收年增率35%且三大部門同步成長顯示公司基本面穩健，但月減幅度較大使市場情緒維持中性偏多。,2025-08-11 23:15:44,15
2025-03-12,0.7,電子權值股與資訊族群領漲帶動大盤上揚，但量能不足且國際股市不穩定，市場觀望氣氛濃厚。,2025-08-11 23:15:47,15
2025-03-17,0.7,GTC 大會聚焦 AI、機器人、自駕等熱門領域，相關供應鏈受惠。輝達新王 GB300 對散熱與電源供應鏈帶來新需求。機器人技術則是 GTC 的另一大看點，台股中有不少公司已切入這塊領域。自駕技術也是重點，相關硬體廠商可望受惠。邊緣 AI 技術能減少雲端依賴，提升效率，應用範圍涵蓋手機、IoT 與工業 4.0。首度推出「量子日」，AI 與量子計算整合成未來趨勢。,2025-08-11 23:15:53,15
2025-03-18,0.7,TeraHive 智慧家用儲能系統取得德國萊因美規認證，為進軍國際市場奠定基礎，並計劃拓展商用儲能、微電網等領域，顯示公司在智慧能源管理技術創新與擴張策略的正面訊息。,2025-08-11 23:15:55,15
2025-03-19,0.3,市場信心受輝達 GTC 大會失靈與外資連 17 天賣超影響，權值股如台積電、鴻海熄火，加上地緣政治風險高，拖累大盤走跌。,2025-08-11 23:15:58,15
2025-03-26,0.7,輝達 GTC 大會帶動 AI 伺服器需求，水冷散熱、BBU 等相關族群受惠，營收與獲利成長可期，但個股表現差異大，應審慎評估。,2025-08-11 23:16:17,15
2025-03-27,0.9,展出多項車聯網智能照明核心技術解決方案，顯示公司在汽車光電半導體領域的實力與創新能力，激勵正面市場情緒。,2025-08-11 23:16:20,15
2025-03-28,0.9,與 NVIDIA 成為 AI-RAN 生態圈合作夥伴，推出端到端商業測試平台，展現光寶在 5G 和 AI 領域的技術實力和市場影響力。,2025-08-11 23:16:22,15
2025-04-09,0.7,營收月增雙位數且年增近三成，顯示公司產品組合優化與應用市場多元化效益持續發酵，激勵正面市場情緒。,2025-08-11 23:16:24,15
2025-04-11,0.7,AI 需求強勁、庫藏股護盤及國安基金可能進場等利多因素激勵市場情緒，指數反彈幅度可期，但仍需留意美中關係變化。,2025-08-11 23:16:28,15
2025-04-18,0.6,光林智能生態照明技術獲得認證，展現公司在綠色科技領域的創新與貢獻，但大盤指數漲幅收斂，顯示市場買盤保守。,2025-08-11 23:16:31,15
2025-04-19,0.7,高股息 ETF 受益人數與規模持續成長，反映市場對於穩定配息的需求，但整體市場仍受到川普關稅政策影響而維持區間波動。,2025-08-11 23:16:34,15
2025-04-21,0.3,全球經濟成長放緩與貿易政策不確定性影響市場信心，雖有 AI 產業需求支撐但整體情緒仍偏向中性。,2025-08-11 23:16:37,15
2025-04-22,0.7,光寶科與日本新創公司 Elephantech 簽署合作備忘錄，將低碳印刷電路板技術應用於商用開發，導入現有合作工廠升級產線，為打造低碳綠色供應鏈注入新動能。,2025-08-11 23:16:40,15
2025-04-23,0.3,市場情緒偏向中性，雖有部分正面訊息如外資買超、AI 中小型個股潛力主升股，但整體仍受到總體經濟不確定因素與消費性電子需求放緩影響。,2025-08-11 23:16:43,15
2025-04-24,0.3,市場動能萎縮與外資賣超壓力使市場情緒偏空，但指數守穩於短期均線之上，維持區間震盪走勢。,2025-08-11 23:16:45,15
2025-04-27,0.6,市場恐慌情緒緩和、外資回補大型股及法說行情等因素提振市場信心，整體而言呈現正面，但仍須留意匯率報告與關稅戰的不確定性。,2025-08-11 23:16:48,15
2025-04-28,0.7,光寶科法說會釋出正面展望，雲端電源與儲存需求擴大、車用電子滲透率提高等利多消息激勵市場情緒，但整體影響力道有限。,2025-08-11 23:16:51,15
2025-04-30,0.7,法說會釋出正面訊息，包括營收、獲利成長、產品組合優化與擴產計畫等，激勵市場情緒向上。,2025-08-11 23:16:54,15
2025-05-02,0.3,雖然目標價下修但仍有9位分析師給予積極樂觀評級，且股價近期表現優於大盤，顯示市場情緒尚未完全悲觀。,2025-08-11 23:16:56,15
2025-05-08,0.7,營收年月雙增顯示公司業務成長動能強勁，激勵正面市場情緒。,2025-08-11 23:16:59,15
2025-05-16,0.6,市場預估獲利與營收持續成長，分析師調升目標價帶動正面情緒，但整體仍偏中性。,2025-08-11 23:17:01,15
2025-05-18,0.9,輝達執行長盛讚台積電、廣達等台灣供應鏈，並強調台灣在全球科技產業的重要地位，激勵市場對光寶科後市正面看待。,2025-08-11 23:17:03,15
2025-05-19,0.6,黃仁勳演講秀出供應鏈背板，光寶科入列顯示其在輝達供應鏈中的重要地位，激勵市場情緒但短期漲幅有限。,2025-08-11 23:17:06,15
2025-05-20,0.7,積極佈局 AI 伺服器電源與液冷業務，強化雲端資料中心競爭力，展現轉型成果並推動營運成長，激勵市場信心。,2025-08-11 23:17:08,15
2025-05-28,0.6,5G 專網整合 AI 邊緣運算解決方案實際導入製造業場域，展現台灣在 5G 專網與 AI 融合技術上的成熟實力，有助於提升生產管理效能並降低成本。,2025-08-11 23:17:11,15
2025-06-06,0.7,營收回升、VR業務拓展及5G專網解決方案展示等正面消息提振市場信心，但獲利預估下修壓抑部分樂觀情緒。,2025-08-11 23:17:13,15
2025-06-09,0.7,營收年增率高達58%且月增率正向，顯示公司成長動能強勁，激勵市場情緒偏多。,2025-08-11 23:17:15,15
2025-06-10,0.7,營收年增率雙位數成長顯示產品組合優化與應用市場多元化效益，帶動正面市場情緒。,2025-08-11 23:17:17,15
2025-06-12,0.7,光耦解決方案展出帶動市場信心，新能源與儲能需求穩健支撐正面情緒，但具體效益仍待觀察。,2025-08-11 23:17:19,15
2025-06-13,0.7,AI 產業需求強勁與多國貿易談判氣氛樂觀帶動，股價有望延續漲勢，但需留意短期獲利了結賣壓。,2025-08-11 23:17:22,15
2025-06-16,0.7,ASIC AI 伺服器電源需求強勁、低軌衛星電源市占提升與光電半導體需求回升等利多因素，支撐市場對公司營運成長的正面預期。,2025-08-11 23:17:25,15
2025-06-25,0.7,AI 伺服器、光電半導體需求回溫，搭配外資買超力道強勁，激勵市場情緒偏多，但通膨與經濟衰退疑慮仍在，股價漲幅有限。,2025-08-11 23:17:28,15
