date,factor,explanation,updated_time,news_count
2024-09-29,0.6,鴻海旗下工業富聯在中國大陸擴廠，顯示對當地市場前景樂觀，為台股帶來正面支撐，但整體行情仍受美國選舉等因素影響呈現觀望。,2025-07-21 02:57:36,2
2024-09-30,0.3,鴻海員工分紅獎金發放與紀念悠遊卡激勵士氣，但台股走勢疲弱，市場情緒偏向中性。,2025-07-21 02:57:37,2
2024-10-01,0.6,展前說明會釋出新車款與合作計畫，市場對鴻海電動車事業發展前景樂觀，但整體市況仍存在不確定性。,2025-07-21 02:57:38,1
2024-10-04,0.6,AI 領域的創新突破有助於提升公司在自動駕駛等領域的競爭力，但短期內市場反應仍需觀察。,2025-07-21 02:57:40,2
2024-10-05,0.7,營收創同期次高且第三季表現亮眼，顯示消費智能、雲端網路與元件等產品需求強勁，激勵市場對鴻海基本面正向期待。,2025-07-21 02:57:41,1
2024-10-08,0.6,鴻海科技日帶動正面市場情緒，但整體台股走勢疲弱，權值股表現不佳與重電、塑膠族群同步下挫，顯示投資人對大盤仍持謹慎態度。,2025-07-21 02:57:43,2
2024-10-09,0.9,鴻海旗下子公司展示創新產品並聚焦 AI 資料中心與智慧車用領域，展現多項技術突破與應用潛力，激勵市場對未來成長前景的正面期待。,2025-07-21 02:57:45,2
2024-10-10,0.7,轉單效應與高階機種市占率提升帶動第四季旺季表現，市場對鴻海集團在 iPhone 供應鏈地位樂觀看待。,2025-07-21 02:57:46,1
2024-10-11,0.6,世界經濟論壇公布最新一批燈塔工廠名單，鴻海旗下工業富聯再添2座世界級燈塔工廠，顯示公司在製造業數位化與永續發展方面的領先地位，為市場帶來正面訊息。,2025-07-21 02:57:48,2
2024-10-15,0.9,AI 題材熱度持續升溫，加上權值股與大盤指數創高，激勵市場信心並推升相關個股漲勢。,2025-07-21 02:57:49,2
2024-10-16,0.3,市場情緒受到 ASML 財報與台股下跌影響而轉為中性偏空，短期內鴻海 股價可能承壓。,2025-07-21 02:57:51,2
2024-10-17,0.6,電子股走勢疲弱拖累大盤開高走低，但傳產族群與部分電子強勢股支撐市場，整體市場情緒偏向中性。,2025-07-21 02:57:52,1
2024-10-18,0.6,海外可轉債發行籌資與減輕利息負擔有助改善財務結構，但股本稀釋仍可能引發部分投資人疑慮。,2025-07-21 02:57:53,1
2024-10-20,0.6,AI 概念股強勢表現帶動台積電、鴻海等權值股上揚，搭配 ETF 除息行情，整體市場情緒偏正面。,2025-07-21 02:57:55,2
2024-10-21,0.6,鴻海等權值股與 IC 設計、高價股領軍反彈，提振市場信心，但金控族群走勢疲弱壓抑漲幅，整體多空力道拉鋸使盤勢維持中性偏強。,2025-07-21 02:57:56,2
2024-10-22,0.6,台積電最後一盤拉抬、鴻海廣達撐盤，加上金融股走揚，整體市場情緒維持中性偏正面。,2025-07-21 02:57:57,2
2024-10-23,0.3,權值股普遍走弱拖累大盤回測月線支撐，但小型先進封裝設備股逆勢抗跌，市場情緒偏空但不至於全面悲觀。,2025-07-21 02:57:59,2
2024-10-24,0.6,鴻海印度廠擴產iPhone 16 Pro、Pro Max的消息提振市場信心，但台積電走弱與其他權值股疲軟使大盤下跌，整體市場情緒偏向正面但尚未完全確立。,2025-07-21 02:58:00,2
2024-10-25,0.7,特斯拉財報優於預期激勵美股與台股走揚，權值股全面上漲且車用、AI 等族群表現強勁，整體市場情緒正面。,2025-07-21 02:58:02,2
2024-10-26,0.9,外資與投信同步買超顯示市場對鴻海第四季旺季動能與新品出貨的正面期待，激勵股價上漲並接近重返 3 兆元市值。,2025-07-21 02:58:03,1
2024-10-28,0.6,鴻海積極布局量子科技並推動教育普及化，展現長期發展策略與社會責任，激勵市場對公司前景的正面期待。,2025-07-21 02:58:05,2
2024-10-29,0.1,美國大選與台積電 ADR 夜盤重挫引發市場擔憂，拖累權值股走跌，大盤失守 23000 點關卡，成交量萎縮，顯示投資人觀望態度濃厚。,2025-07-21 02:58:06,2
2024-10-30,0.7,財報亮眼且 AI 業務成長強勁，激勵市場情緒偏正面，但整體盤勢觀望氣氛濃厚，股價漲幅有限。,2025-07-21 02:58:08,2
2024-11-01,0.6,台股早盤重挫後權值股低接買盤進場，跌幅收斂且翻紅，大盤僅小跌，顯示市場信心未完全喪失，但仍需時間消化利空消息。,2025-07-21 02:58:09,2
2024-11-02,0.7,輝達新品出貨帶動散熱模組需求，配合集團 AI 伺服器布局，營收結構改善與成長潛力激勵市場正面情緒。,2025-07-21 02:58:10,1
2024-11-03,0.5,產學合作有助於培育人才並提升智慧製造能力，但對短期營運或股價影響有限。,2025-07-21 02:58:11,1
2024-11-04,0.6,電子權值股回神帶動指數上漲，市場情緒偏正面，但月線反壓及成交量萎縮顯示追價意願不足。,2025-07-21 02:58:13,2
2024-11-05,0.7,營收創高與獲利展望樂觀顯示公司基本面強勁，惟市場仍受地緣政治緊張局勢影響，引發短期波動。,2025-07-21 02:58:14,2
2024-11-06,0.6,美總統大選結果逐漸明朗化，市場觀望氣氛濃厚，權值股表現分歧，指數高檔震盪，但成交量放大，顯示資金持續在場內。,2025-07-21 02:58:15,2
2024-11-07,0.6,輝達新品帶動鴻準散熱模組出貨前景樂觀，股價創高且成交量放大，市場對營運展望轉趨正面。,2025-07-21 02:58:17,2
2024-11-08,0.6,權值股普遍上揚，尤其台積電領軍大漲逾 2%，帶動加權指數一度突破前高，但塑化類股疲弱拖累，AI 概念股表現強勁，整體市場情緒偏正面但仍有壓力。,2025-07-21 02:58:18,1
2024-11-09,0.9,鴻海集團受惠 AI 伺服器需求強勁，帶動旗下個股業績成長，市場對相關概念股展望樂觀，激勵正面投資情緒。,2025-07-21 02:58:19,1
2024-11-10,0.7,AI 應用需求強勁與矽光子技術商機帶動相關供應鏈股價表現，但部分個股漲幅已大，短線獲利了結賣壓恐加重。,2025-07-21 02:58:21,2
2024-11-11,0.6,權值股普遍走弱拖累大盤，加上 AI 概念股表現分歧，市場情緒偏向保守。,2025-07-21 02:58:22,1
2024-11-12,0.1,權值股普遍疲弱拖累大盤重挫，市場信心受創，短期內恐難見反彈契機。,2025-07-21 02:58:24,2
2024-11-13,0.6,鴻海集團表現強勁，股價重新站回200元大關，帶動相關個股走勢，但市場仍擔憂總統大選後的不確定因素。,2025-07-21 02:58:25,2
2024-11-14,0.9,鴻海在美國的投資與營運表現穩健，加上第四季展望樂觀且訂單能見度提升，激勵市場對公司前景的正面情緒。,2025-07-21 02:58:26,2
2024-11-15,0.5,市場情緒維持中性，個別權值股漲跌互見，傳產類股表現強勁，但 AI 類股相對疲弱。,2025-07-21 02:58:28,2
2024-11-17,0.3,市場避險情緒濃厚且大型電子股走疲，短期內台股呈現易跌難漲態勢，但輝達財報優於預期或有助多頭醞釀反攻。,2025-07-21 02:58:29,1
2024-11-18,0.3,美股重挫與電子權值股疲弱拖累大盤，傳產類股如塑化、橡膠等表現相對強勁，但整體市場情緒仍偏向保守。,2025-07-21 02:58:31,2
2024-11-19,0.6,處分子公司持股帶來短期利益入帳但無重大影響，長期開發案計畫展現鴻海在南台灣深耕發展決心。,2025-07-21 02:58:32,2
2024-11-20,0.3,外資賣超鴻準及台積電等權值股，市場信心受挫，拖累指數回測季線，但金融與傳產股獲青睞，整體情緒偏向中性。,2025-07-21 02:58:33,2
2024-11-21,0.4,鴻海子公司處分持股衝擊鴻準股價，市場對集團內部投資決策產生疑慮，加上大盤走弱影響整體情緒。,2025-07-21 02:58:35,2
2024-11-22,0.6,市場情緒受到輝達財報失望與電子股疲弱影響，但友達子公司成立、汽車業績成長等利多消息緩解部分負面衝擊。,2025-07-21 02:58:36,1
2024-11-24,0.3,外資動向與資金流向影響股價表現，個別產業展望不一，整體市場維持區間震盪。,2025-07-21 02:58:38,1
2024-11-25,0.7,AI 概念股強勢表現與台積電持穩帶動下，多頭氣勢回升，市場情緒正面。,2025-07-21 02:58:39,2
2024-11-26,0.3,川普關稅政策引發市場擔憂全球貿易戰再起，權值股台積電與鴻海走跌拖累大盤，但部分電子股逆勢抗跌，顯示市場信心尚未完全潰散。,2025-07-21 02:58:40,2
2024-11-27,0.4,墨西哥關稅議題引發市場擔憂，鴻海積極佈局美國製造以分散風險，但短期內貿易戰陰霾仍壓抑股價表現。,2025-07-21 02:58:42,2
2024-11-28,0.4,市場情緒受到電子權值股與記憶體、線纜、重電族群走弱的拖累，整體呈現偏空，但 AI 族群反彈帶來些許支撐。,2025-07-21 02:58:43,1
2024-11-29,0.4,台積電、鴻海等電子權值股走弱拖累大盤，市場信心受挫但航運及航空族群逆勢上揚，整體呈現偏空格局。,2025-07-21 02:58:44,1
2024-11-30,0.3,川普關稅政策引發市場擔憂，加上外資連續賣超影響股價表現，但集團全球布局優勢與管理層對策因應，短期內雖有壓力但不致造成重大衝擊。,2025-07-21 02:58:46,1
2024-12-02,0.9,美股大漲帶動台積電領軍的電子權值股全面走揚，激勵加權指數收復季線與 10 日線，成交量放大至 3106 億元，顯示市場情緒回溫。,2025-07-21 02:58:47,2
2024-12-03,0.7,集團作帳行情持續，鴻海等大型集團股有望受惠，激勵市場情緒向上。,2025-07-21 02:58:49,2
2024-12-04,0.7,台積電與鴻海領漲帶動大盤上攻，三大法人買超及光通訊族群強勢表現支撐市場信心。,2025-07-21 02:58:50,2
2024-12-05,0.6,11 月營收雖因 iPhone 出貨動能暫緩而下滑，但累計前 11 月營收仍超越去年全年新高，主要產品線中雲端網路、電腦終端與元件等均維持成長態勢，市場對鴻海第四季展望樂觀。,2025-07-21 02:58:51,1
2024-12-06,0.6,台股漲跌互現，權值股表現分歧，但電子五哥及資訊族群齊心走紅，帶動市場情緒偏正面。,2025-07-21 02:58:53,1
2024-12-09,0.6,台積電撐盤及航運股強勁帶動大盤上漲，但鴻海等權值股表現疲弱，市場情緒偏中性。,2025-07-21 02:58:54,2
2024-12-10,0.4,市場情緒受到整體大盤走勢與權值股表現影響而轉弱，鴻海股價也隨之下跌。,2025-07-21 02:58:55,1
2024-12-11,0.1,美股四大指數全面走跌，拖累台股電子權值股全面走弱，市場情緒偏向負面。,2025-07-21 02:58:56,2
2024-12-12,0.6,台積電除息行情啟動、權值股普遍回神與蘋概股強勢表現帶動大盤反彈，市場信心獲得提振。,2025-07-21 02:58:58,2
2024-12-13,0.6,鴻海集團持續投資半導體產業，透過子公司增資能創半導體，顯示對該領域的長期信心與佈局，但短期營運展望仍受市場需求影響。,2025-07-21 02:58:59,2
2024-12-15,0.3,市場觀望 FOMC 利率會議結果與通膨壓力升溫，外資賣超大型電子股如鴻海等，引發短期盤整，但降息預期仍支撐基本面展望。,2025-07-21 02:59:01,1
2024-12-16,0.4,市場觀望氣氛濃厚，權值股表現分歧，雖有台積電領軍上攻但其他大型股走勢疲弱，整體市場情緒偏向中性。,2025-07-21 02:59:02,2
2024-12-17,0.6,台積電股價波動影響大盤指數，但整體市場情緒仍偏正面，千金股、觀光航空類股與機器人族群表現強勁。,2025-07-21 02:59:03,1
2024-12-18,0.6,鴻海收購日產汽車的傳聞引發市場關注，雖然目前尚未有明確進展，但若此案成真將對公司營運帶來重大變革，短期內可能引發股價波動。,2025-07-21 02:59:05,2
2024-12-19,0.6,合併傳聞升溫引發市場對未來營運整合與競爭力提升的期待，但短期內仍有諸多變數待釐清，導致市場情緒偏向中性。,2025-07-21 02:59:06,2
2024-12-20,0.6,夏普資產出售利多與鴻海 AI 智慧城市計畫展現轉型決心，市場對未來營運前景持正向期待。,2025-07-21 02:59:07,2
2024-12-22,0.3,外資大舉賣超鴻海等個股，但仍有意加碼高價股與權值股，使盤勢弱中透強。市場觀望聖誕節假期前提前結帳效應，以及新總統就職後的政策變數。,2025-07-21 02:59:09,1
2024-12-23,0.6,日產與本田合併傳聞帶動汽車類股反彈，鴻海暫緩收購計畫使市場情緒趨於穩定。,2025-07-21 02:59:10,2
2024-12-24,0.7,Micro LED 技術與龐大 AR 眼鏡商機帶動相關供應鏈成長，鴻海建置新產線將為設備業者注入活水。,2025-07-21 02:59:11,1
2024-12-25,0.6,美股平安夜全數收紅，激勵台股早盤反彈，電子權值股與機器人概念股領漲，市場情緒回溫但成交量仍有待擴大。,2025-07-21 02:59:13,1
2024-12-26,0.7,玉晶光受惠於鴻海進軍 AR 眼鏡市場的利多消息，股價強勢漲停，顯示市場對該公司未來成長前景持正面期待。,2025-07-21 02:59:14,2
2024-12-27,0.9,汽車品牌合併與 AI 伺服器成長展望強勁，顯示鴻海在產業轉型中的領導地位與未來發展潛力。,2025-07-21 02:59:16,2
2024-12-29,0.6,取得 ASPICE 認證顯示公司在汽車電子軟體開發管理方面能力獲得國際肯定，有助於拓展新能源汽車零件市場並提升品牌形象，但獲利表現與長期成長動能仍待觀察。,2025-07-21 02:59:17,1
2024-12-30,0.6,投資動力電池材料與固態鋰電池顯示公司布局電動車產業決心，但獲利能力與成長前景仍有待觀察。AI加速碳化矽功率元件開發為技術實力增添助力。,2025-07-21 02:59:19,2
2024-12-31,0.7,AI 概念題材持續發酵，展望樂觀且營收成長動能強勁，但近期大盤走弱與法人賣超壓力仍在，市場情緒偏向中性。,2025-07-21 02:59:20,2
2025-01-02,0.4,權值股普遍走弱，市場信心受挫，雖有觀光、航空等族群表現亮眼，但整體大盤仍呈現下跌。,2025-07-21 02:59:21,1
2025-01-03,0.6,"鴻海展望明年與高雄合作發展智慧城市並推出服務型機器人，營收可望突破7兆元，但目前獲利表現仍待觀察。盛新材料進行現金增資籌資以支應未來成長需求，股本將擴大至7億元。

====================",2025-07-21 02:59:23,2
2025-01-05,0.6,市場觀望氣氛濃厚且不確定因素多，輝達新品助攻鴻海 AI 伺服器出貨但整體展望平穩。,2025-07-21 02:59:24,2
2025-01-06,0.7,鴻海單月營收成長且全年累計營收正增長，搭配台股反彈與權值股領漲，激勵市場情緒向上但短期漲幅已大。,2025-07-21 02:59:26,2
2025-01-07,0.6,12月營收年增率前三名公司表現亮眼，尤其鴻準、鴻華先進-創及鴻海等鴻海集團成員，顯示整體產業需求回溫與營運成長動能。,2025-07-21 02:59:28,2
2025-01-08,0.5,外資賣超與權值股下跌壓力使市場情緒轉向中性，但鴻海處分土地及廠房可望挹注獲利表現。,2025-07-21 02:59:29,2
2025-01-09,0.4,電子權值股與航運類股齊跌拖累大盤走勢，市場情緒偏空，短期內缺乏明顯利多支撐。,2025-07-21 02:59:30,1
2025-01-10,0.6,權值股表現分歧，台積電與聯發科持穩在平盤之上，但鴻海、聯電等走勢疲軟，整體市場情緒偏中性。,2025-07-21 02:59:31,1
2025-01-13,0.3,美股暴跌拖累台股走低，權值股普遍疲軟，但台積電撐盤力守平盤之上，非電族群表現相對強勁。市場情緒偏空但尚未全面失控，短期內需觀察國際情勢與美股反應。,2025-07-21 02:59:33,1
2025-01-14,0.6,權值股走勢分歧，金融與傳產撐盤但電子族群仍疲弱，市場觀望氣氛濃厚，整體大盤反彈力道有限。,2025-07-21 02:59:35,2
2025-01-15,0.4,鴻海持續擴大海外產能以分散風險，但台股下跌且遭外資賣超，顯示市場情緒偏向保守。,2025-07-21 02:59:36,2
2025-01-17,0.3,台積電法說報佳音提振市場信心，但權值股漲跌互現且缺乏明顯領漲族群，整體盤勢維持區間震盪走勢。,2025-07-21 02:59:37,1
2025-01-20,0.3,董事改選與前夏普會長訴訟案牽動公司治理議題，短期內可能對股價造成波動。,2025-07-21 02:59:39,2
2025-01-21,0.5,地震概念股強勢表現與鋼鐵、玻璃陶瓷等傳產族群領漲帶動指數力守所有均線之上，整體市場情緒維持中性。,2025-07-21 02:59:40,2
2025-01-22,0.7,權值股普遍走強與封關日行情帶動下，大盤指數上漲且三線全紅，市場情緒偏正向，但個別公司表現仍有差異。,2025-07-21 02:59:41,2
2025-01-24,0.9,營運展望樂觀、產能表現超預期與高層互動良好，激勵市場情緒走揚並推升股價上漲。,2025-07-21 02:59:43,2
2025-01-29,0.6,AI 基礎建設投資題材持續發酵，相關個股如廣達、緯創、鴻海等 AI 伺服器供應鏈強勢表現，先進封裝、矽光子與 BBU 產業也同步受惠。,2025-07-21 02:59:45,1
2025-02-03,0.1,美國對墨西哥課徵關稅衝擊鴻海在當地的生產基地，市場擔憂影響公司營運與獲利，引發顯著負面情緒與股價下跌。,2025-07-21 02:59:47,2
2025-02-04,0.6,台積電領軍反彈、電子權值股普遍走揚帶動大盤上漲，但市場觀望氣氛濃厚，成交量萎縮，整體漲幅有限。,2025-07-21 02:59:48,1
2025-02-05,0.9,權值股全面走強、外資回頭買超及海運類股表現亮眼，激勵大盤站上2萬3關卡，市場情緒樂觀。,2025-07-21 02:59:49,2
2025-02-06,0.6,權值股領漲與美股反彈激勵市場信心，惟爆炸事故及航運類股走跌壓抑漲幅擴大。,2025-07-21 02:59:51,1
2025-02-07,0.7,日產考慮與鴻海合作的消息帶來正面影響，但整體市場情緒仍維持中性，電子權值股與高價股表現強勁。,2025-07-21 02:59:52,2
2025-02-08,0.3,減持投資標的引發市場對鴻海在該領域布局的疑慮，短期內可能壓抑部分投資人信心。,2025-07-21 02:59:53,1
2025-02-10,0.6,營收表現優於預期且第一季展望正向，激勵市場情緒但仍受整體大盤走勢影響。,2025-07-21 02:59:54,2
2025-02-11,0.7,權值股反彈與傳產類股領漲提振市場信心，整體盤勢呈現偏多格局。,2025-07-21 02:59:56,1
2025-02-12,0.6,關稅議題帶來不確定性但影響有限，日本車廠合作案露出曙光將提振市場信心。,2025-07-21 02:59:57,2
2025-02-14,0.1,川普再度批評台灣奪走美國晶片生意，引發市場負面情緒與股價壓力，尤其是台積電等權值股表現疲弱。,2025-07-21 02:59:58,1
2025-02-15,0.6,受惠於被列入人形機器人百強名單，激勵股價上漲並創下近一年高點，但實際營運表現與未來發展仍有待觀察。,2025-07-21 02:59:59,1
2025-02-17,0.7,台積電領軍反彈，電子權值股齊揚，加上機器人與航運族群表現亮眼，激勵市場情緒回升，但整體漲幅有限，顯示對後市仍持審慎態度。,2025-07-21 03:00:01,2
2025-02-18,0.4,權值股表現分歧，市場觀望氣氛濃厚，指數狹幅震盪。,2025-07-21 03:00:02,1
2025-02-21,0.6,與本田汽車合作傳聞及入股歌爾聲學越南廠，顯示鴻海積極拓展汽車供應鏈版圖並強化聲學產品布局，為未來營運增添成長動能。,2025-07-21 03:00:03,2
2025-02-24,0.6,權值股漲跌互現，台積電失守季線壓抑市場信心，但鴻海等個股反彈與航運、防疫類股強勢表現使跌幅收斂。,2025-07-21 03:00:05,2
2025-02-25,0.3,外資連續賣超並大砍鴻海與台積電，顯示市場信心受挫，但傳產股買超及生技醫療族群強勢支撐整體情緒。,2025-07-21 03:00:06,2
2025-02-26,0.9,權值股全面反彈、AI 伺服器概念股強勢表態，激勵大盤站回月線並收紅。,2025-07-21 03:00:08,1
2025-02-27,0.6,與墨西哥簽署智慧城市合作備忘錄展現鴻海拓展海外市場的企圖心，但短期內對營收貢獻有限。,2025-07-21 03:00:09,2
2025-03-02,0.3,國際局勢動盪與關稅政策不確定性壓抑市場信心，但 MWC 展題材與降息預期仍支撐部分買盤，整體情緒偏向中性。,2025-07-21 03:00:11,1
2025-03-03,0.3,市場情緒偏弱，半導體與 AI 股疲軟拖累大盤，但水泥、食品類股表現強勁提供支撐。,2025-07-21 03:00:12,1
2025-03-04,0.4,市場情緒受美股下挫與權值股走弱影響，鴻海集團旗下個股普遍疲軟，短期內缺乏明顯利多支撐。,2025-07-21 03:00:13,2
2025-03-05,0.7,營收創高且年增率強勁反映新品拉貨動能與 AI 雲端需求暢旺，激勵市場對第一季展望樂觀。,2025-07-21 03:00:14,2
2025-03-06,0.6,2月營收年增率前三名公司表現亮眼，尤其鴻華先進與鴻準成長動能強勁，激勵市場對相關個股的正面情緒。,2025-07-21 03:00:16,1
2025-03-07,0.4,市場情緒受到美股下挫與關稅風險影響，權值股普遍走弱，僅記憶體族群表現相對強勁，但整體大盤仍陷入震盪格局。,2025-07-21 03:00:17,2
2025-03-10,0.4,台積電領跌權值股拖累大盤，市場情緒偏空且信心不足。,2025-07-21 03:00:19,2
2025-03-11,0.4,日產汽車的轉型與合作策略引發市場關注，但整體展望仍不明朗，加上全球經濟衰退疑慮升溫，拖累台股走勢，鴻海等科技大廠也承壓。,2025-07-21 03:00:20,2
2025-03-12,0.6,權值股領漲與三大法人籌碼動向偏多有助支撐市場情緒，但整體成交量能不足且外資持續賣超，短期上攻力道仍需觀察。,2025-07-21 03:00:21,1
2025-03-14,0.6,鴻海配發創新高的現金股利與財務長強調獲利極大化策略有助穩定市場情緒，但整體大盤疲弱影響個股表現。,2025-07-21 03:00:23,2
2025-03-15,0.3,市場對鴻海未來獲利成長預期趨於保守，營收與EPS估值區間擴大引發中性偏空情緒。,2025-07-21 03:00:24,1
2025-03-18,0.6,市場對鴻海獲利展望雖有修正但反彈力道強勁，除息填權達陣激勵多頭信心。,2025-07-21 03:00:26,2
2025-03-19,0.3,權值股台積電與鴻海同步下跌，加上量能萎縮導致市場信心不足，引發整體股價走低。,2025-07-21 03:00:27,1
2025-03-20,0.6,與三菱汽車的合作計畫傳出，顯示鴻海在電動車領域的發展策略獲得正面回應，有助於提升市場信心，但整體展望仍有不確定性。,2025-07-21 03:00:28,2
2025-03-21,0.9,與日本三菱汽車電動車代工合作案傳出，鴻海集團在電動車領域的發展前景樂觀，激勵市場對未來成長潛力的正面期待。,2025-07-21 03:00:29,2
2025-03-22,0.6,00713 除息後買盤湧入，反映市場對高股息ETF的偏好與信心，但成分股調整帶來的波動仍是投資人需留意的風險。,2025-07-21 03:00:31,1
2025-03-23,0.3,市場擔憂美國可能將台灣列入「骯髒15國」清單，加徵關稅的不確定因素影響投資人信心，導致鴻海等大型電子股遭外資賣超，台股走勢疲弱。,2025-07-21 03:00:32,1
2025-03-24,0.6,鴻海集團在美國德州擴產計畫與資金投入顯示對美系市場的重視，有助穩定市場情緒，但整體經濟環境不確定性仍高，短期股價波動難免。,2025-07-21 03:00:34,2
2025-03-25,0.6,權值股普遍走揚，尤其是半導體與 AI 相關個股表現亮眼，激勵市場情緒向上，但傳產類股如鋼鐵、電纜等仍疲軟，整體漲勢略顯溫和。,2025-07-21 03:00:35,1
2025-03-26,0.6,市場情緒偏正面，電子權值股普遍走揚且成交量回溫，但漲幅受制於尾盤賣壓。,2025-07-21 03:00:36,2
2025-03-27,0.1,美國總統川普汽車關稅政策衝擊台股，權值股全面下跌，加上外資大舉賣超鴻海等電子權值股，市場情緒明顯偏空，預期短期內股價將承壓。,2025-07-21 03:00:38,2
2025-03-28,0.6,鴻海持續深化無線通訊領域佈局並進行轉型升級，市場對未來成長潛力與營收貢獻性存有期待。,2025-07-21 03:00:39,2
2025-03-30,0.3,輪值 CEO 制度順利交接傳承，展望未來營運表現穩健，但美中貿易戰升溫與外資提款壓力仍將影響市場情緒。,2025-07-21 03:00:41,2
2025-03-31,0.3,市場擔憂美國消費者信心指數創兩年多來新低，顯示對未來不確定性增加花錢謹慎，以及關稅戰影響持續發酵，美股重挫拖累台股夜盤再殺 458 點，但有機會像 3/11 那天開低走高。,2025-07-21 03:00:43,1
2025-04-01,0.6,鴻海取得蘋果設備並擴大印度、越南生產據點，顯示公司積極拓展新市場以分散風險，中長期營運前景樂觀。,2025-07-21 03:00:44,2
2025-04-02,0.6,美國關稅政策宣布在即引發觀望氣氛濃厚，市場情緒偏向中性，但部分權值股如鴻海仍維持小幅上漲。,2025-07-21 03:00:45,2
2025-04-03,0.3,美國針對多國課徵關稅，鴻海主要生產基地受影響程度不一，市場擔憂成本與通膨壓力增加，但蘋果可能爭取豁免，後續效應待觀察。,2025-07-21 03:00:47,1
2025-04-05,0.7,營收創新高與展望樂觀反映 AI 伺服器需求強勁，但消費智能產品疲弱壓抑整體市場情緒。,2025-07-21 03:00:48,2
2025-04-07,0.3,市場對鴻海未來獲利成長預期趨於保守，導致股價面臨修正壓力。,2025-07-21 03:00:49,1
2025-04-08,0.3,美國對多國祭出關稅影響鴻海代工業務，營收表現仍維持成長但展望保守，市場情緒偏向中性。,2025-07-21 03:00:50,1
2025-04-09,0.1,鴻海股價大跌，市場情緒轉趨悲觀，短期內投資人信心薄弱。,2025-07-21 03:00:51,2
2025-04-14,0.7,市場對關稅豁免利多反應正面，權值股與電子族群領漲，但個別強弱分歧顯著，整體行情仍偏樂觀。,2025-07-21 03:00:53,1
2025-04-15,0.6,三大法人合計賣超，外資調節鴻海等電子權值股，但買超晶圓雙雄，顯示市場信心尚存。整體而言，市場情緒偏中性，觀望氣氛濃厚。,2025-07-21 03:00:54,1
