date,factor,explanation,updated_time,news_count
2024-04-07,0.6,AI 人形機器人商機帶動相關台廠股價上漲，但聯準會降息時點延後恐影響外資資金動能，市場情緒呈現溫和樂觀。,2025-07-21 02:54:19,2
2024-04-08,0.6,權值股普遍走跌，僅台積電撐盤，加上重電、線纜與 AI 概念股強勢表態，整體市場情緒偏正面但仍存在不確定性。,2025-07-21 02:54:21,1
2024-04-09,0.3,海外設立第二總部計畫反映企業因應地緣政治風險的需求，為供應鏈穩定與營運持續性帶來正面效益，但具體影響仍待觀察。,2025-07-21 02:54:22,1
2024-04-11,0.6,推動輪值 CEO 制度與子公司增資案反映管理層轉型決心，市場對鴻海治理與營運前景維持正面但審慎態度。,2025-07-21 02:54:23,2
2024-04-12,0.7,中國工信部推動工業互聯網與算力發展，帶動相關概念股走強，激勵市場對鴻海子公司的投資前景持正面期待。,2025-07-21 02:54:25,1
2024-04-15,0.6,獲利預告顯示營運轉佳、由虧轉盈，但市場情緒受美股與地緣政治衝突影響，短期內對鴻海的正面消息反應有限。,2025-07-21 02:54:27,2
2024-04-17,0.3,地緣政治風險與電動車市場波動影響下半年景氣展望，但鴻海仍持續推動 2025 年電動車市占率目標，同時啟動輪值 CEO 制度以培養接班人選。,2025-07-21 02:54:28,2
2024-04-18,0.4,電子權值股普遍走弱，加上市場觀望美股四大指數收黑，引發台股開低走低，回測2萬點關卡，但跌幅逐步收斂，顯示市場信心尚未完全潰散。,2025-07-21 02:54:30,1
2024-04-19,0.1,大盤重挫逾千點，台積電領軍下殺，加上產業展望不佳與地緣政治風險升溫，市場情緒極度悲觀，拖累整體科技股走勢。,2025-07-21 02:54:31,1
2024-04-21,0.6,工業富聯與創新新材在型材研發、智慧製造和廢鋁回收等領域展開全面策略合作，透過技術創新和市場拓展提升競爭力並推動產業綠色低碳發展，為公司未來成長帶來正面助益。,2025-07-21 02:54:33,1
2024-04-24,0.7,電子權值股全面反彈，加上 AI 概念股強勢表現與航空觀光族群急拉，激勵大盤重返兩萬點關卡並收復短期均線，顯示市場情緒回溫。,2025-07-21 02:54:35,2
2024-04-25,0.3,權值股普遍下挫拖累大盤走勢，但部分個股如面板雙虎、重電股及貨櫃航運族群表現相對抗跌，市場情緒偏向中性。,2025-07-21 02:54:36,2
2024-04-26,0.6,投資綠能展現企業社會責任與永續發展決心，搭配電子股回升與傳產領漲帶動整體市場情緒正面。,2025-07-21 02:54:37,2
2024-04-28,0.5,外資回補前十大標的包括台積電、長榮航、長榮等，顯示市場信心略有恢復，但產業能見度不明朗與 FOMC 會議將影響後市走向。,2025-07-21 02:54:39,1
2024-04-29,0.6,權值股領漲帶動大盤反彈，市場情緒回溫但成交量能仍待觀察。,2025-07-21 02:54:40,1
2024-04-30,0.6,市場情緒維持中性偏正面，權值股走勢平淡但大盤仍守穩所有均線，重電族群獲利了結賣壓湧現。,2025-07-21 02:54:41,2
2024-05-02,0.4,權值股走勢分歧，台積電與鴻海下挫超過 1%，雙雙摜破五日線，影響大盤表現。,2025-07-21 02:54:43,2
2024-05-03,0.6,電子權值股撐盤與傳產族群輪動上攻帶動大盤上漲，但市場情緒仍偏向中性，觀望後市發展。,2025-07-21 02:54:44,1
2024-05-05,0.7,4月營收創新高且展望第二季成長，顯示消費性產品需求回溫與雲端伺服器出貨強勁，但仍需關注傳統淡季及庫存調整的影響。,2025-07-21 02:54:46,2
2024-05-06,0.9,營收創高與第二季展望樂觀激勵市場信心，股價再創新高。,2025-07-21 02:54:47,2
2024-05-07,0.6,台積電與鴻海領漲帶動大盤上揚，AI 概念股強勢表現激勵市場情緒，但個別族群漲跌互見，整體而言呈現正面但不過度樂觀的氛圍。,2025-07-21 02:54:48,2
2024-05-08,0.6,市場聚焦 AI 概念股與重電族群，權值股表現平穩，多頭信心回溫但漲跌互見，整體市場情緒偏正面。,2025-07-21 02:54:50,2
2024-05-09,0.3,電子權值股撐盤與航運族群強勢表現使指數維持高檔整理，但個股漲跌分歧顯示市場觀望氣氛濃厚。,2025-07-21 02:54:51,2
2024-05-14,0.7,法說展望樂觀且財報表現符合預期，AI伺服器需求強勁帶動營收成長，但毛利率受四大產品組合變化影響。,2025-07-21 02:54:53,2
2024-05-15,0.7,鴻海第一季財報略低於預期，但第二季展望樂觀，加上 AI 伺服器與電動車業務利多，市場情緒偏正面。,2025-07-21 02:54:54,2
2024-05-16,0.9,權值股普遍走揚，加上 AI 概念股強勢表態，激勵市場情緒向上，預期隔日股價將呈現正面反應。,2025-07-21 02:54:55,1
2024-05-17,0.3,市場情緒偏向保守，個股表現分歧，指數量縮整理。,2025-07-21 02:54:56,1
2024-05-18,0.6,法說展望樂觀、AI伺服器需求強勁與電動車進展有利於維持市場信心，惟整體成長力道仍待觀察。,2025-07-21 02:54:58,1
2024-05-19,0.6,520 總統就職與輝達財報將牽動相關概念股表現，但整體展望樂觀，預期短期內台股維持偏多格局。,2025-07-21 02:54:59,1
2024-05-20,0.5,新任總統與副總統就職帶來政策方向變化，市場對綠色能源、AI 等相關產業展望持正向態度，但權值股表現疲弱使整體市場情緒維持中性。,2025-07-21 02:55:01,1
2024-05-21,0.6,市場對鴻海未來獲利展望樂觀，但全新目標價下修與評級調整引發短期不確定性，綜合影響使市場情緒溫和偏正。,2025-07-21 02:55:02,2
2024-05-22,0.8,鴻海在越南被要求自主減少用電，顯示政府對能源議題的重視與積極管理，市場對其營運影響持謹慎樂觀態度。,2025-07-21 02:55:03,2
2024-05-23,0.6,鴻海集團造車進度與海外拓展計畫有助於提升市場信心，但中共軍演引發的政治風險仍然是短期內影響台股表現的主要因素。,2025-07-21 02:55:05,2
2024-05-24,0.4,市場情緒受到美股與權值股走勢影響，呈現中性偏空。,2025-07-21 02:55:06,1
2024-05-25,0.6,高息等權重 ETF 新兵表現亮眼，多檔成分股漲幅帶動市價攀升，展望未來配息機制有助穩定現金流。,2025-07-21 02:55:07,1
2024-05-27,0.9,台股創新高帶動多頭氣勢，AI 概念股與貨櫃三雄領軍上攻，加上重電類股止穩，整體市場情緒樂觀。,2025-07-21 02:55:09,2
2024-05-28,0.6,台股創高後獲利了結賣壓出籠，權值股漲跌互見，但機器人、AI 概念股續強，三大法人買盤力道不足，市場情緒偏向中性。,2025-07-21 02:55:10,2
2024-05-29,0.3,電子權值股普遍走跌，尤其是台積電、聯發科與鴻海等指標性個股下挫超過 1%，加上金融與傳產類股賣壓沉重，拖累大盤收黑，但航運族群表現強勢，貨櫃三雄逆勢走高，營建、光電與玻璃陶瓷等族群買盤點火，指數一度衝上 21906.1 點。,2025-07-21 02:55:12,2
2024-05-30,0.3,權值股普遍走弱拖累大盤，電子權值三王與台達電、日月光投控、聯電等領跌，加上美債利率攀升壓抑市場信心，但部分高價股如芯鼎、安格仍有資金流入支撐。,2025-07-21 02:55:14,2
2024-05-31,0.6,股東期望與經營團隊承諾推升市場信心，但夏普轉型策略仍待時間驗證。,2025-07-21 02:55:15,2
2024-06-02,0.9,AI 工業革命帶動智慧製造需求強勁，鴻海等台廠積極佈局相關解決方案與供應鏈整合，市場對產業轉型契機樂觀期待。,2025-07-21 02:55:17,2
2024-06-04,0.4,權值股普遍下跌，加上輝達供應鏈表現疲軟，市場情緒偏向保守，但工業電腦族群強勢表態提供支撐。,2025-07-21 02:55:18,2
2024-06-05,0.6,營收成長與展望優於預期帶動股價走揚，但整體市場氛圍仍偏觀望，影響力有限。,2025-07-21 02:55:20,2
2024-06-06,0.6,市場對 AI 概念股的追捧持續，但中小型股表現疲弱，整體盤勢呈現溫和上揚，電子指標普遍走強，台積電創新高價帶動大盤收在歷史新高。,2025-07-21 02:55:21,2
2024-06-07,0.4,市場情緒受到 AI 概念股熄火與權值股普遍走弱影響，短期內對鴻海 股票市場情緒呈現中性偏負面。,2025-07-21 02:55:22,1
2024-06-08,0.6,輝達與鴻海等台廠的合作計畫以及台積電股東會釋出的正面訊息有助於提振市場信心，但亞泥私有化子公司的消息可能引發對中國市場風險的擔憂，整體而言，市場情緒呈現溫和偏多。,2025-07-21 02:55:25,2
2024-06-09,0.6,AI 產業發展趨勢強勁，COMPUTEX 展覽帶動話題，但後續仍需關注財報表現與獲利能力。傳產航運、生技醫療等輪動股有機會受惠於行情轉移。,2025-07-21 02:55:27,1
2024-06-10,0.7,營收成長動能強勁，尤其華景電年增率高達 101%，顯示公司基本面穩健，但整體市場情緒仍維持中性。,2025-07-21 02:55:28,2
2024-06-11,0.9,AI 概念股領軍衝高，加上台積電助攻，激勵大盤再創新高，市場情緒樂觀。,2025-07-21 02:55:29,1
2024-06-12,0.9,權值股普遍走揚，尤其是鴻海強勁上攻逼近前高，加上蘋概股表現亮眼，激勵市場情緒向上，推升大盤突破 22000 點關卡。,2025-07-21 02:55:31,1
2024-06-13,0.9,美股四大指數強彈激勵台積電 ADR 跟進表態，加上除息秒填息與市值突破 24 兆 元的利多，帶動電子權值股全面走揚，金控 航運 也穩盤上攻，市場情緒樂觀，推升大盤再創新高。,2025-07-21 02:55:32,2
2024-06-14,0.7,鴻海透過富智康增資越南子公司，顯示持續深耕東南亞市場並擴大業務版圖，激勵買盤信心，外資與自營商同步偏多操作。,2025-07-21 02:55:34,2
2024-06-15,0.9,外資與投信聯手大舉買進，顯示市場對鴻海營運前景樂觀，激勵股價再創新高並帶動集團個股齊漲。,2025-07-21 02:55:35,1
2024-06-16,0.6,外資買超鴻海235億元，AI題材持續發酵，但聯準會官員談話將牽動市場敏感神經，投資人留意政策風險。,2025-07-21 02:55:37,1
2024-06-17,0.9,鴻海股價創新高、市值突破2兆元，顯示市場對公司營運展望與經營團隊表現的正面肯定。,2025-07-21 02:55:38,2
2024-06-18,0.6,獲利預估上修與營收展望穩健支撐市場信心，但股價漲多後短期可能面臨獲利了結賣壓。,2025-07-21 02:55:39,1
2024-06-19,0.9,台積電領軍衝上歷史新高，加上權值股普遍走揚與半導體相關類股強勢表現，激勵市場情緒樂觀，預期多頭行情可望延續。,2025-07-21 02:55:40,1
2024-06-20,0.9,鴻海股價再創新高，帶動集團成員強勢表現，加上三大法人同步偏多操作，顯示市場對鴻海營運前景樂觀。,2025-07-21 02:55:41,2
2024-06-21,0.6,權值股漲多修正與法人賣超壓力使市場情緒轉趨謹慎，但面板及網通概念股強勢表現提供支撐。,2025-07-21 02:55:43,2
2024-06-22,0.6,市場對和碩的獲利預期持續上修，反映出對其未來成長前景的樂觀態度。,2025-07-21 02:55:44,2
2024-06-23,0.9,"CPO 相關產品小量出貨題材激勵股價創高，市場對未來成長前景樂觀。

====================",2025-07-21 02:55:45,1
2024-06-24,0.3,權值股普遍走弱拖累大盤，AI 題材支撐多頭格局但短期漲多拉回整理，市場情緒偏中性。,2025-07-21 02:55:46,2
2024-06-25,0.1,權值股普遍走跌，AI 與光電面板類股疲軟，市場情緒偏空，拖累整體大盤表現。,2025-07-21 02:55:47,1
2024-06-26,0.6,AI 概念股與蘋果題材帶動市場信心，搭配電子傳統旺季來臨，有利於指數持續向上，但個股表現仍需關注基本面。,2025-07-21 02:55:49,2
2024-06-27,0.6,鴻海轉投資夏普改組董事會並任命劉揚偉為會長，顯示集團深化合作意圖，但對股價短期影響有限。,2025-07-21 02:55:50,2
2024-06-28,0.6,權值股表現分歧，鴻海撐盤但台積電、聯發科走弱，加上生技與光電族群強勢，整體市場情緒偏正面。,2025-07-21 02:55:51,1
2024-07-01,0.5,除息旺季帶動市場卡位行情，多檔權值股與成交重心概念股走強，但指數漲幅有限，顯示投資人對後市仍持審慎態度。,2025-07-21 02:55:53,2
2024-07-02,0.3,除息表現不佳與大盤走弱影響短期市場信心，但漲多拉回屬正常調整，後續填息路徑仍需觀察重量級個股及美股表現。,2025-07-21 02:55:54,2
2024-07-03,0.6,美股大漲激勵台股開高走高，電子權值股漲跌互見，但整體市場情緒偏正面。,2025-07-21 02:55:56,2
2024-07-04,0.6,雖然印度廠區的爭議暫時平息，但外界對鴻海勞工待遇的質疑仍在，市場情緒偏向中性。,2025-07-21 02:55:57,2
2024-07-05,0.6,營收表現符合預期且展望樂觀，市場對未來成長前景持正向態度，但漲幅受大盤休市與權值股熄火影響而收斂。,2025-07-21 02:55:58,2
2024-07-06,0.9,多位分析師上修目標價與樂觀評級，顯示市場對鴻海未來營運前景持正向看待。,2025-07-21 02:56:00,1
2024-07-07,0.6,中國河南省製造業頭雁企業名單中入選鴻海集團旗下 7 家企業，凸顯其在當地市場的重要性與發展潛力，有利於提升公司整體形象與未來營運前景。,2025-07-21 02:56:02,2
2024-07-08,0.9,填息成功與旗下子公司盈利預告雙喜臨門，激勵市場情緒向上並推升股價創高。,2025-07-21 02:56:03,2
2024-07-09,0.6,市場情緒受到技術面乖離過大與外資賣超影響而轉為中性，但基本面利多如法說行情、股息發放等仍可望支撐後續表現。,2025-07-21 02:56:04,2
2024-07-10,0.6,外資買超個股多以金融與傳產股為主，電子股賣壓較重，但整體市場情緒仍偏正面，預期隔日台股將維持高檔震盪走勢。,2025-07-21 02:56:05,2
2024-07-11,0.9,權值股領漲帶動大盤上揚，三大法人同步買超，顯示市場情緒樂觀且對台股前景持正面看法。,2025-07-21 02:56:07,2
2024-07-12,0.3,外資提款鴻海並賣超台積電等電子權值股，市場情緒偏空，但鴻海舉辦科技日活動展現發展決心，短期內對股價影響有限。,2025-07-21 02:56:08,2
2024-07-14,0.6,轉型效益顯現與矽光子需求增溫帶動業績成長，市場對未來營運展望樂觀，但仍須留意外資賣超壓力及大盤波動風險。,2025-07-21 02:56:10,2
2024-07-15,0.3,市場情緒受到川普遇襲事件影響而轉趨謹慎，個股漲跌互見，權值股表現分歧，金融股回檔修正，地產股則成為資金避風港。整體來看，大盤量縮小幅下跌，力守十日線，但外資部分資金轉進低波動標的，顯示市場觀望氣氛濃厚。,2025-07-21 02:56:12,2
2024-07-17,0.3,美前總統對台海局勢發表質疑言論引發市場擔憂，加上台積電 ADR 盤後下挫拖累，電子權值股普遍走跌，但鴻海逆勢抗跌，顯示部分資金仍偏好防禦性個股。,2025-07-21 02:56:13,1
2024-07-18,0.6,目標價上修與分析師普遍樂觀評級顯示市場對公司前景看好，但股價表現仍受大盤影響，短期內可能維持區間整理。,2025-07-21 02:56:15,1
2024-07-19,0.3,子公司處分專利權給夏普，交易金額 7.9 億元，活化資產並落實技術研發成果。,2025-07-21 02:56:16,2
2024-07-21,0.9,iPhone 16 新機預期將帶動換機潮，相關蘋概股有望受惠於新機拉貨效應，市場對未來營收表現樂觀。,2025-07-21 02:56:17,1
2024-07-22,0.4,市場信心受美股拖累，營收表現不如預期與產能利用率下滑壓抑鴻海股價走勢。,2025-07-21 02:56:19,2
2024-07-23,0.6,市場情緒回溫，主要權值股強勁反彈帶動指數大漲，多頭信心獲得提振。,2025-07-21 02:56:20,1
2024-07-24,0.6,鄭州航空港建設電動車核心生產基地計畫與固態電池佈局顯示鴻海在新能源領域的長期投資決心，市場對未來成長前景持正向期待。,2025-07-21 02:56:21,1
2024-07-25,0.7,與 WEC 能源集團合作建置太陽能板，展現鴻海對再生能源及永續發展的承諾，有利於提升企業形象並引領綠色製造趨勢。,2025-07-21 02:56:22,1
2024-07-26,0.3,台股連兩日因颱風休市後重挫千點，權值三雄全面下跌超過半根跌停板，拖累大盤摜破2萬2關卡與季線，顯示市場信心受創，短期內恐持續修正。,2025-07-21 02:56:24,2
2024-07-28,0.6,廣東電子資訊製造業綜合實力百強企業榜單顯示鴻海子公司表現亮眼，反映集團在相關領域的競爭優勢與成長潛力。然而，台股近期走勢疲弱，加權指數大幅回檔，市場情緒偏空，短期內可能對鴻海股價造成壓力。,2025-07-21 02:56:26,2
2024-07-29,0.3,權值股反彈與金融、營建族群表現強勁帶動大盤小幅上揚，但中小型股疲弱且跌停家數眾多，市場情緒仍偏向保守。,2025-07-21 02:56:28,2
2024-07-31,0.6,電子權值股普遍走跌拖累大盤，但鴻海、台達電等個股逆勢抗跌，市場情緒偏向中性。,2025-07-21 02:56:29,1
2024-08-01,0.9,美股強彈與台積電領軍大漲帶動下，市場情緒樂觀，多頭信心回穩。,2025-07-21 02:56:30,1
2024-08-02,0.1,國際局勢動盪與科技股財報失利引發全球股市重挫，台股大跌 4.43%，主要權值電子股全面下殺，半導體類指數跌幅達 5.9%。,2025-07-21 02:56:32,1
2024-08-05,0.9,"工業富聯業績亮眼且啟動庫藏股回購，顯示公司對未來發展前景樂觀，激勵市場情緒與股價上漲。

鴻海7月營收創同期新高並維持第三季旺季增長目標，四大產品類別均有成長，反映產業需求回溫及公司營運穩健。",2025-07-21 02:56:34,2
2024-08-06,0.6,產業鏈轉移與成本考量引發外移疑慮，但富士康在中國的擴張計畫顯示對當地市場依然重視，短期內市場情緒偏向中性。,2025-07-21 02:56:35,1
2024-08-07,0.6,市場情緒偏正面，反映強勁的營收表現與展望，但短期內仍受到總體經濟因素影響。,2025-07-21 02:56:37,1
2024-08-08,0.1,權值股領跌拖累大盤重挫，電子族群疲弱，市場情緒轉趨悲觀。,2025-07-21 02:56:38,2
2024-08-09,0.6,權值股強勁反彈與市場情緒回溫推升大盤大漲，多頭信心逐步恢復，但個股表現仍有差異。,2025-07-21 02:56:39,1
2024-08-11,0.3,AI 伺服器、iPhone 新機備貨展望與矽光子布局進度將成為法說焦點，但輝達晶片設計變更延遲可能影響出貨時程，短期市場情緒偏中性。,2025-07-21 02:56:40,1
2024-08-12,0.6,權值股普遍上揚、AI 概念股領軍大漲及重電股強勁表現提振市場信心，但鴻海 法說前夕仍有不確定性，整體市場情緒偏正面但尚未完全樂觀。,2025-07-21 02:56:42,1
2024-08-13,0.6,市場情緒偏正面，電子指標股漲跌互見，但權值龍頭台積電與鴻海續揚，帶動加權指數上漲。重電股則因產業趨勢轉變而出現賣壓。整體來看，市場對於法說會行情與超級數據週的反應正面，但個股表現仍有差異。,2025-07-21 02:56:44,2
2024-08-14,0.9,法說展望樂觀且財報優於預期，顯示公司營運成長動能強勁，激勵市場情緒與股價上漲。,2025-07-21 02:56:45,2
2024-08-15,0.6,法說缺席引發關注，但印度投資計畫進展順利，顯示公司國際佈局策略持續推動，激勵市場對未來成長前景的正向期待。,2025-07-21 02:56:46,2
2024-08-16,0.9,印度政府持續支持鴻海在當地投資並表彰其貢獻，顯示官方對於鴻海擴大印度製造計畫的正面態度，有利於未來營運發展。,2025-07-21 02:56:48,2
2024-08-19,0.6,市場情緒偏正面，電子權值股與光電類股領漲，加上美國消費者信心指數優於預期等多空因素交錯，整體呈現震盪走高格局。,2025-07-21 02:56:50,2
2024-08-20,0.3,市場情緒受美股上漲激勵但台積電等權值股走勢疲軟影響，整體呈現溫和偏多態勢。,2025-07-21 02:56:51,1
2024-08-21,0.6,鴻海大舉增資海外子公司，顯示對未來產能擴張與市場佈局的信心，但短期內龐大的資金支出可能壓抑獲利表現，引發市場中性情緒。,2025-07-21 02:56:52,2
2024-08-22,0.3,市場觀望全球央行年會，電子權值股走勢疲軟，IC 設計族群相對強勁，但整體量能萎縮，多空力道拉鋸使盤勢狹幅震盪。,2025-07-21 02:56:54,2
2024-08-23,0.6,集團全球布局持續推進且強調不會離開河南，同時對美國關稅及大選影響保持審慎態度，整體展望中性。,2025-07-21 02:56:55,2
2024-08-25,0.6,"矽光子技術發展趨勢明確，產業鏈完整性與合作深度提升有利長期成長，但短期漲多後獲利了結賣壓恐增。

====================

請注意以上輸出僅供參考，不代表實際市場行情或分析師意見。",2025-07-21 02:56:57,2
2024-08-27,0.6,財報與展望樂觀、網通與車用需求成長，支撐市場對乙盛未來營運的正面期待。,2025-07-21 02:56:58,2
2024-08-28,0.7,權值股如台積電與鴻海帶動指數大漲，顯示市場情緒回溫，但電子與金融類股疲軟且成交量萎縮，籌碼面仍有變數，預期短期將呈現震盪走勢。,2025-07-21 02:57:00,2
2024-08-29,0.5,電子權值股普遍疲弱拖累大盤走勢，但光通訊與半導體設備族群表現強勁，市場情緒維持中性。,2025-07-21 02:57:01,2
2024-08-30,0.6,權值股普遍平穩，傳產與光通訊族群領軍上攻，市場情緒偏正面但追價意願有限，整體呈現溫和上揚走勢。,2025-07-21 02:57:02,2
2024-09-01,0.6,市場情緒維持溫和樂觀，但對後續走勢仍有不確定性，預期個股表現將優於大盤。,2025-07-21 02:57:04,1
2024-09-02,0.6,ESG 數位管理平台獲獎凸顯公司對永續發展的重視與創新能力，激勵市場正面情緒但短期營運表現仍是關注焦點。,2025-07-21 02:57:05,2
2024-09-05,0.7,8月營收創同期新高且全年展望樂觀，顯示公司基本面強勁，但短期股價承壓於整體大盤疲弱。,2025-07-21 02:57:08,2
2024-09-06,0.6,市場觀望美國就業數據及經濟前景，導致台股震盪整理，但電子權值股與高價股強勢反彈，提振市場信心，預期在 FED 降息機率提升下，短線可望再走強。,2025-07-21 02:57:10,2
2024-09-07,0.7,營收與獲利大幅衰退並轉虧，短期展望不明將引發市場負面情緒與股價壓力。,2025-07-21 02:57:11,1
2024-09-08,0.9,iPhone16 新機備貨力道強勁、鴻海積極擴增產能與招募人力，顯示公司在蘋果新品供應鏈中地位穩固，激勵市場對未來營運前景樂觀。,2025-07-21 02:57:12,1
2024-09-09,0.6,鴻海在高雄市推動智慧城市計畫，iBus+ APP 正式上線，展現公司在交通軟體服務領域的實力與創新應用，為市場帶來正面訊息，但整體大盤下跌壓力仍在，影響鴻海股價表現。,2025-07-21 02:57:14,2
2024-09-10,0.6,權值股普遍上揚帶動大盤開高，但成交量萎縮與賣壓沉重使漲幅收斂，市場情緒偏正面但短期仍有不確定性。,2025-07-21 02:57:15,1
2024-09-11,0.6,展覽展示與上游合作加速 CPO 技術發展，市場對未來產品進入市場時間表持正向期待。,2025-07-21 02:57:16,2
2024-09-12,0.9,台積電填息行情點火，帶動大盤強彈，多檔權值股與高價股齊揚，市場信心回溫。,2025-07-21 02:57:18,1
2024-09-13,0.6,市場情緒偏正面但量能不足，個股表現分歧，權值股普遍走弱拖累大盤，但傳產與設備族群強勢支撐指數上揚。,2025-07-21 02:57:19,2
2024-09-15,0.6,市場情緒偏正面但仍有不確定性，外資買超與技術指標翻揚帶動反彈，但成交量萎縮與關注焦點未明抑制漲勢。,2025-07-21 02:57:20,1
2024-09-16,0.6,中秋節休市與超級央行周的不確定性使市場觀望氣氛濃厚，權值股漲跌互見，成交量急凍，但半導體設備族群強勢表現支撐大盤小幅上揚。,2025-07-21 02:57:22,1
2024-09-17,0.9,矽光子技術被視為 AI 伺服器高速傳輸的關鍵解方，帶動連接器 / 線等零組件廠商積極搶進，鴻海集團與貿聯 - KY 等業者透過與半導體大廠合作，加速布局矽光子應用，市場對相關技術發展前景樂觀。,2025-07-21 02:57:24,1
2024-09-18,0.6,鴻海與夏普合作開發電動車概念模型並推出新型可穿戴設備，展現創新實力與未來發展方向，激勵市場對相關業務前景的正面期待。,2025-07-21 02:57:25,1
2024-09-19,0.9,電子股普遍反彈、金控股強勢帶動大盤上漲，月線得而復失，市場情緒樂觀。,2025-07-21 02:57:26,1
2024-09-20,0.9,台股大漲帶動權值股強勢表現，市場情緒樂觀，預期鴻海將同步受惠。,2025-07-21 02:57:27,1
2024-09-22,0.6,美國降息循環啟動與零售銷售數據優於預期提振市場信心，但選前行情保守，外資態度將影響後市走勢。,2025-07-21 02:57:28,1
2024-09-23,0.6,權值股普遍走強、綠能與重電族群表現亮眼，搭配台積電尾盤爆量上漲，支撐大盤收紅但未站回季線。,2025-07-21 02:57:30,2
2024-09-24,0.9,與義大利汽車設計公司賓尼法利納合作推出新車款 Model D，展現鴻海在電動車領域的創新能力與國際級設計實力，激勵市場對未來成長前景的正面期待。,2025-07-21 02:57:31,1
2024-09-25,0.8,權值股普遍走揚，尤其是台積電強勁反彈帶動大盤創波段新高，顯示市場情緒轉趨樂觀。,2025-07-21 02:57:33,2
2024-09-27,0.7,權值股普遍走揚，帶動大盤上攻，且在台積電領軍下站回 2 萬 3 大關，顯示市場情緒正面。加上部分個股如 ASIC 與 IP 族群、MCU 等表現強勁，整體呈現多頭格局。,2025-07-21 02:57:34,1
