date,factor,explanation,updated_time,news_count
2024-03-04,0.9,半導體產業需求穩健與美股反彈激勵科技股上漲，日月光等相關個股強勢表現引領市場走揚。,2025-08-03 17:18:07,20
2024-03-05,0.9,AI 概念股強勢表現與台積電創高帶動大盤再創新高，權值股普遍上漲且成交量縮減，顯示市場情緒正面且對未來展望樂觀。,2025-08-03 17:18:09,20
2024-03-06,0.9,AI 概念股與半導體產業展望樂觀，權值股強勢表現帶動大盤創高，市場情緒正面。,2025-08-03 17:18:11,20
2024-03-07,0.6,台積電領軍衝高，帶動半導體權值股同步走揚，但 AI 概念股普遍疲軟，市場情緒偏向正面但略顯謹慎。,2025-08-03 17:18:14,20
2024-03-09,0.9,四大雲端服務供應商加速建置 AI 伺服器，帶動相關產業鏈需求強勁成長，激勵市場對日月光等 AI 伺服器概念股的正面情緒與股價表現。,2025-08-03 17:18:38,20
2024-03-12,0.7,權值股領軍反彈、散熱與航空族群表態、外資回頭買超帶動指數站上五日線，整體市場情緒偏正面。,2025-08-03 17:18:50,20
2024-03-13,0.3,台股站上2萬點後震盪走低，指數最終小漲收盤，但中小型股普遍下挫，電子權值股表現分歧，金融與重電族群撐盤。整體而言，市場情緒偏向保守，對未來展望仍有不確定性。,2025-08-03 17:18:53,20
2024-03-14,0.6,"日月光投控等電子股拖累大盤走勢，市場情緒偏向中性。整體而言，雖有泓德能源等個股表現亮眼，但電子權值股疲弱影響指數漲幅，投資人觀望後續動能。

====================",2025-08-03 17:18:55,20
2024-03-15,0.3,外資賣超台積電並調節航運族群，鴻海法說報喜獲三大法人攜手大買，市場情緒呈現分歧。,2025-08-03 17:18:59,20
2024-03-18,0.6,"市場情緒維持溫和偏多，權值股領軍上攻且成交量回升，但漲幅有限顯示追價意願不高。

台股在台積電除息秒填息激勵下強彈百點，重返 10 日線之上，三大法人合計買超近 50 億元，其中投信力挺買超逾 130 億元。電子權值股如聯發科、鴻海等維持高檔整理態勢；ABF 載板概念股欣興、景碩、南電齊揚。重電族群士電、高力、中宇、中砂、中興電等強漲逾半根停板，東元、上銀、瑞智、大山、大同、華城表現不俗。面板設備廠易發、陽程、志聖亮燈漲停，均豪大漲超過 6%，東捷、盟立漲幅逾 3%。",2025-08-03 17:19:04,20
2024-03-19,0.6,電子權值股熄火與傳產撐盤形成拉鋸，市場觀望氣氛濃厚，短期指數維持高檔震盪整理。,2025-08-03 17:19:05,20
2024-03-20,0.6,輝達 GTC 大會帶動 AI 概念股強勢表現，權值股走弱與 ETF 賣壓使大盤開高走低，市場情緒偏向中性。,2025-08-03 17:19:08,20
2024-03-21,0.6,日月光展現創新科技與解決方案，強調在智慧製造、節能減碳及廢棄物循環再利用等面向的成果，凸顯公司對永續發展的重視，有助於提升市場對其長期營運前景的信心。,2025-08-03 17:19:12,20
2024-03-22,0.3,市場資金強拉大型電子股推升指數創高，但 ETF 熱潮引發的籌碼鬆動壓力與個股連跌，反映出投資人信心不足，預期短期台股將呈現高檔震盪格局。,2025-08-03 17:19:15,20
2024-03-24,0.6,台積電擴大先進封裝產能帶動相關供應鏈成長，CoWoS受惠股漲多整理後仍具上漲潛力，但需留意市場情緒與籌碼面變化。,2025-08-03 17:19:17,20
2024-03-25,0.3,電子權值股普遍走跌拖累大盤表現，但傳產與中小型股相對強勢，市場情緒偏向保守但不至於過度悲觀。,2025-08-03 17:19:19,20
2024-03-26,0.3,市場情緒維持中性，電子股獲利表現不佳與外資賣超壓力仍在，但金融股買盤支撐使跌幅有限。,2025-08-03 17:19:21,20
2024-03-27,0.6,520 概念股如軍工國防、線纜及生技族群走強，權值股鴻海與聯發科撐盤，但成交量縮小恐影響多頭續航力。,2025-08-03 17:19:24,20
2024-03-28,0.6,日月光擬配發每股現金股利 5.2 元，顯示公司財務狀況穩健，同時預期今年營運優於去年，激勵中性至正面市場情緒。,2025-08-03 17:19:26,20
2024-03-29,0.6,投信大舉買超 ETF 成分股，激勵相關個股走強，市場情緒偏正面，但漲多個股仍有獲利了結壓力。,2025-08-03 17:19:30,20
2024-03-30,0.6,AI 題材持續發酵帶動相關個股強勢表現，但整體市場仍受大環境影響而維持區間波動，中性偏多看待。,2025-08-03 17:19:32,20
2024-03-31,0.3,投信大舉買超日月光等個股，外資則呈現對作態勢，市場情緒維持中性偏正面，但須留意聯準會降息預測轉向的風險。,2025-08-03 17:19:34,20
2024-04-01,0.4,00940 上市首日破發，加上清明節長假將至，市場觀望氣氛濃厚，指數開高走低翻黑下跌，成交量也大幅縮減，多方轉趨謹慎。,2025-08-03 17:19:38,20
2024-04-02,0.9,"權值股全面上漲帶動大盤再創新高，AI 概念股強勢表現與半導體設備族群助攻，市場情緒樂觀。

====================",2025-08-03 17:19:40,20
2024-04-03,0.5,市場情緒中性，長假前賣壓使大盤下跌但多頭並未棄守，低檔有支撐且主流類股仍強勢。,2025-08-03 17:19:41,20
2024-04-06,0.9,積極減碳與導入 AI 技術顯示公司轉型決心，強化投資人對未來營運的信心。,2025-08-03 17:19:43,20
2024-04-07,0.6,台商加速南向佈局，受惠於供應鏈轉移與政府政策支持，東協國家投資熱潮持續升溫，帶動相關產業與房地產市場發展。,2025-08-03 17:19:45,20
2024-04-08,0.5,營收表現亮眼但短期漲多且外資賣超，市場情緒中性偏空。,2025-08-03 17:19:48,20
2024-04-09,0.7,營收表現優於預期，先進封裝成長動能強勁，激勵市場對未來獲利能力的正面期待。,2025-08-03 17:19:50,20
2024-04-10,0.6,"日月光投控捐款 1000 萬元協助花蓮地震重建,展現企業社會責任與關懷,有利於提升公司正面形象。",2025-08-03 17:19:53,20
2024-04-11,0.6,日月光投控受惠 AI 概念股與重電股走強，市場情緒偏正面，但整體漲幅有限，顯示對未來展望仍持審慎態度。,2025-08-03 17:19:55,20
2024-04-12,0.5,台股早盤開高走低，權值股表現分歧，AI 概念股與重電族群強勢，但整體市場情緒尚未明朗。,2025-08-03 17:19:56,20
2024-04-15,0.3,市場情緒受到中東局勢緊張與美股重挫影響而轉弱，權值電子股普遍下跌，但部分傳產類股如重電概念股表現相對強勁。,2025-08-03 17:19:58,20
2024-04-16,0.3,中東戰事持續升溫引發全球金融市場動盪，台股加權指數跌破月均線，多數權值股與族群齊走低，市場情緒悲觀。,2025-08-03 17:20:00,20
2024-04-17,0.9,權值股領漲、族群齊揚，成交量縮使市場情緒轉趨樂觀，多頭重新掌控主導權。,2025-08-03 17:20:02,20
2024-04-18,0.6,電子權值股普遍走弱拖累大盤，但線纜、營建與散熱族群強勢支撐指數，整體市場情緒維持中性偏多。,2025-08-03 17:20:04,20
2024-04-19,0.1,台積電下修展望拖累電子股走弱，加上地緣政治風險升溫，引發市場恐慌情緒，導致大盤重挫創高檔最大跌點，短期內負面消息壓抑投資人信心。,2025-08-03 17:20:06,20
2024-04-21,0.6,ESG 職缺需求與意願雙增，顯示市場對永續發展人才的重視，但實際職缺比例仍低，反映企業轉型挑戰。,2025-08-03 17:20:07,20
2024-04-22,0.3,電子股走弱拖累大盤，AI 股領跌加上輝達重挫引發市場擔憂，雖有傳產與金融族群撐盤但整體氣氛偏空。,2025-08-03 17:20:10,20
2024-04-23,0.6,日月光高雄廠與供應商合作成立低碳聯盟，展現企業減碳決心，有利長期營運永續發展，但短期內 AI 概念股修正影響整體市場情緒。,2025-08-03 17:20:12,20
2024-04-24,0.9,權值股與 AI 概念股領軍反彈，搭配陸客開放利多，激勵市場情緒向上，推升大盤重返萬點關卡。,2025-08-03 17:20:15,20
2024-04-25,0.3,法說釋出第二季復甦訊號與資本支出上修，市場對日月光營運前景轉趨樂觀，但整體大盤走弱仍壓抑股價表現。,2025-08-03 17:20:18,20
2024-04-26,0.6,外資買超及航運股強勢表現提振市場信心，電子族群回神帶動指數重登萬點，但成交量仍偏低，整體行情維持中性偏多。,2025-08-03 17:20:21,20
2024-04-27,0.6,法說周三大廠釋出展望與財報，營運前景分歧引發市場觀望，整體而言對產業復甦樂觀但短期仍有雜音。,2025-08-03 17:20:23,20
2024-04-28,0.6,台積電 A16 技術發表引領先進製程發展，相關供應鏈受惠，但市場仍關注產業能見度與庫存調整狀況。,2025-08-03 17:20:26,20
2024-04-29,0.9,台積電領軍的電子權值股與金融族群齊揚，帶動加權指數大漲且站上所有均線，顯示市場情緒樂觀且對後市信心回升。,2025-08-03 17:20:28,20
2024-04-30,0.6,日月光第一季獲利表現不如預期，但策略聯盟開發新產品與擴展海外市場有助長期營運成長，中性偏多的市場情緒維持。,2025-08-03 17:20:30,20
2024-05-02,0.3,營收回升但獲利表現不如預期，加上策略聯盟效益尚未顯現，市場對牧德後市仍持謹慎態度。,2025-08-03 17:20:32,20
2024-05-03,0.6,美股四大指數全面收紅，激勵台股早盤跳空開高，大漲超過 200 點，權值股紛紛走揚，成為撐盤要角。整體市場情緒偏正面，但成交量仍待放大以利行情延續。,2025-08-03 17:20:34,20
2024-05-06,0.6,"台積電領漲帶動半導體族群反彈，市場情緒回溫但仍需觀察量能與後續走勢。

台股在台積電領軍下強勁反彈，但中小型股表現疲弱且量能不足，整體上攻力道仍待確認。",2025-08-03 17:20:36,20
2024-05-07,0.6,電子權值股領漲帶動指數上揚，傳產族群也有所表現，整體市場情緒偏正面但需留意類股輪動與獲利了結壓力。,2025-08-03 17:20:38,20
2024-05-08,0.6,營收與獲利下滑但 Q2 預期逐季成長，股價已反應利空且技術面出現買進訊號。,2025-08-03 17:20:40,20
2024-05-09,0.6,營收雙成長且第二季展望樂觀，市場對未來業績復甦前景持正向態度，但股價漲多後獲利了結賣壓出籠。,2025-08-03 17:20:43,20
2024-05-10,0.6,營收成長與獲利展望樂觀，市場對未來需求前景持正向態度，但整體籌碼面偏空，股價漲勢受阻。,2025-08-03 17:20:46,20
2024-05-13,0.6,AI 伺服器、車電與業績股的底部已完成落底，良性輪漲，低估股籌碼換手後將再走強。CPO 測試大單帶動矽格、台星科業績成長，股價嚴重低估。權值股與貨櫃三雄領軍創高，但部分族群漲多拉回。,2025-08-03 17:20:48,20
2024-05-14,0.6,權值股普遍平穩，航運股持續吸引買盤資金挹注，但整體市場情緒受消息面影響呈現溫和上揚。,2025-08-03 17:20:50,20
2024-05-15,0.6,台積電領漲帶動大盤突破萬二，權值股普遍走揚，市場情緒偏正面，但個別公司表現仍有差異。,2025-08-03 17:20:52,20
2024-05-16,0.6,日月光對中國大陸的投資案引發市場關注，但整體而言仍屬於中性消息，短期內不太可能對股價產生顯著影響。,2025-08-03 17:20:53,20
2024-05-17,0.5,日月光投控受惠半導體需求穩健與產業轉型契機，市場情緒維持中性偏正面，但整體盤勢疲弱影響股價表現。,2025-08-03 17:20:55,20
2024-05-20,0.6,日月光與天能綠電的綠電購售合作案凸顯企業減碳決心，但整體市場情緒仍受總統就職演說內容影響，短期漲跌難以預測。,2025-08-03 17:20:57,20
2024-05-21,0.6,綠能與線纜族群表現強勁，顯示市場對於能源轉型與基礎建設投資的正面期待，但整體大盤量縮震盪，多空勢力拉鋸，短期操作宜謹慎。,2025-08-03 17:21:00,20
2024-05-22,0.6,低本益比、高成長潛力的車電與 AI 伺服器概念股表現強勁，激勵市場情緒向上，但個別公司業績展望仍是關鍵。,2025-08-03 17:21:02,20
2024-05-23,0.6,"輝達財報優於預期激勵科技股上揚，但中共軍演利空影響市場信心，權值股與傳產族群表現分歧。整體而言，市場情緒偏向正面但波動加劇。

===========================================================================",2025-08-03 17:21:04,20
2024-05-24,0.5,台股受美股影響開低，但買盤進場拉抬跌幅收斂，權值股普遍在平盤附近遊走，光通訊族群強勢表現。整體而言市場情緒維持中性，靜待更多利多消息以穩定信心。,2025-08-03 17:21:07,20
2024-05-27,0.9,權值股強勢表現與 AI 概念股領漲激勵市場信心，指數再創新高，多頭氣盛。,2025-08-03 17:21:09,20
2024-05-28,0.6,權值股漲跌互見，成交重心轉向機器人與 AI 概念股，市場情緒偏正面但整體漲勢受限。,2025-08-03 17:21:11,20
2024-05-29,0.5,權值股普遍走跌拖累大盤，金融族群也疲軟，但光電與營建類股逆勢上揚，整體市場情緒中性。,2025-08-03 17:21:12,20
2024-05-30,0.3,日月光推出新電源供應平台，展現在先進封裝技術上的創新與領導地位，有助長期競爭優勢，但短期市場關注焦點仍在宏觀經濟環境與終端需求的不確定性。,2025-08-03 17:21:15,20
2024-06-01,0.6,淨灘活動展現企業社會責任並號召供應鏈夥伴參與，凸顯日月光對環境保護的重視，但短期內影響有限。,2025-08-03 17:21:30,20
2024-06-03,0.6,AI 應用前景樂觀與產業需求回升帶動相關概念股走強，但個別公司營運展望仍有不確定性。,2025-08-03 17:21:32,20
2024-06-04,0.6,市場情緒偏中性，權值股普遍走跌但輝達供應鏈及工業電腦族群表現強勁，顯示個別股票漲跌分歧。,2025-08-03 17:21:34,20
2024-06-05,0.6,三方合作案凸顯日月光在綠色運算、節能減碳等永續發展議題上的積極作為，有助提升公司形象並引領產業升級，中長期有利於市場情緒與股價表現。,2025-08-03 17:21:36,20
2024-06-06,0.7,台積電領軍的權值股強勢表態帶動大盤指數創高，加上航運族群續強，整體市場情緒偏向正面。,2025-08-03 17:21:38,20
2024-06-07,0.6,日月光攜手美超微、華系統整合打造水冷散熱技術資料中心，提升伺服器散熱效率並降低能源消耗，展現企業對永續經營與綠色製造的承諾，有利於長期發展。,2025-08-03 17:21:41,20
2024-06-11,0.6,CoWoS 產能吃緊與先進封裝需求強勁帶動業績成長，市場對未來營運展望樂觀，但航運族群疲弱拖累大盤表現。,2025-08-03 17:21:44,20
2024-06-12,0.6,權值股走勢分歧，電子股普遍上揚，台積電、鴻海、聯發科等漲幅超過 1-2%，推升大盤走勢，但金控股受新光金事件影響下跌。蘋果概念股隨著 WWDC 獲市場肯定，表現躍居盤上。整體而言，電子股強勁表現抵銷金融股的壓力，使得台股維持中性偏多走勢。,2025-08-03 17:21:47,20
2024-06-13,0.7,美聯儲降息預期與台股強勁漲勢帶動市場信心，電子權值股領軍上攻，但個別公司營運展望仍有不確定性影響短期股價波動。,2025-08-03 17:21:50,20
2024-06-14,0.9,台積電領軍大漲帶動權值股齊揚，加上重電股強攻助陣，多頭信心回穩推升指數再創新高，市場情緒樂觀。,2025-08-03 17:21:52,20
2024-06-18,0.9,台積電領軍衝高創新高，權值股普遍走揚，加上 ASIC、IP、記憶體與金融等族群表現亮眼，激勵市場情緒樂觀，推升大盤再度突破歷史新高。,2025-08-03 17:21:54,20
2024-06-19,0.9,權值股領漲、AI族群強勢，外資連2買，投信連13買，資金動能充足，加上輝達超越微軟和蘋果成為全球市值王，台股短期有望繼續上攻，再創歷史新高。,2025-08-03 17:21:57,20
2024-06-20,0.9,權值股領軍創高，加上 AI、散熱與能源類股強勢表現，激勵市場情緒樂觀，推升大盤再度改寫新猷。,2025-08-03 17:22:00,20
2024-06-21,0.6,新廠興建計畫有利長期營運擴張，但短期內對股價影響有限，市場情緒維持溫和偏多。,2025-08-03 17:22:01,20
2024-06-23,0.9,輝達新平台需求強勁帶動封測廠訂單爆發，日月光投控與京元電受惠，市場對產業前景樂觀看待。,2025-08-03 17:22:03,20
2024-06-24,0.6,AI 產業發展帶動相關類股強勢表現，惟大型權值股震盪修正機率高，整體市場情緒偏向樂觀但仍需留意個別股票波動。,2025-08-03 17:22:06,20
2024-06-26,0.7,日月光投控展望樂觀且持續投資先進封裝技術與測試服務，有利於營收復甦並維持市場信心，但海外產能擴張計畫仍待評估與落實，短期內股價可能因消息面而有波動。,2025-08-03 17:22:31,20
2024-06-27,0.5,"權值股普遍無表現，高價能源股拉回修正，中低價太陽能族群接棒漲停，AI、機殼族群則相對弱勢。整體而言，市場情緒維持中性，等待更多訊號。

---

台股今 (27) 日在權值股回檔修正下，開盤即跌逾百點，僅靠鴻海苦撐跌幅收斂，終場跌 80.71 點或 0.35%，以 22905.98 點作收，仍失守 5 日線，成交量 4415.31 億元，較昨 (26) 日稍收斂。此外，高價能源股拉回修正，中低價太陽能族群接棒，多檔漲停。權值股今天普遍無表現，唯有鴻海 (2317-TW) 苦撐，漲 1.19%，台積電 (2330-TW) 開低，盤中一度翻紅，終場收平盤，聯發科 (2454-TW) 則跌 0.71%，日月光 (3711-TW) 也跌 0.29%，台達電則小漲 0.39%。昨天強勢的高價能源概念股，雖然今天早盤漲勢強勁，不隨後漲幅收斂，甚至翻黑。雲豹能源 (6869-TW) 早盤大漲逾半根停板，近逼漲停板，不過隨後漲幅收斂，終場僅小漲 0.23%，森崴能源 (6806-TW) 早盤同樣漲逾半根停板，不過午盤後翻黑，終場跌 2.15%，泓德能源 (6873-TW) 翻黑後跌 3.37%。不過中低價的太陽能概念股成為盤面亮點，安集 (6477-TW)、國碩 (2406-TW)、聯合再生 (3576-TW)、太極 (4934-TW) 皆亮燈漲停。AI 族群方面，今天和碩 (4938-TW) 跌幅最沈重，跌逾半根停板，跌幅超過 7%，廣達 (2382-TW)、緯穎 (6669-TW)、英業達 (2356-TW)、仁寶 (2324-TW)，以及技嘉 (2376-TW) 也都跌逾 1%。機殼族群今天表現也相對弱勢，迎廣 (6117-TW) 跌 4.2%，勤誠 (8210-TW) 跌 3.58%，AMAX-KY(6993-TW) 跌 2.31%，晟銘電 (3013-TW) 跌 1.78%。",2025-08-03 17:22:43,20
2024-06-28,0.7,台股在新台幣升值與三大法人買超帶動下呈現強勢上漲，多頭格局延續，但仍需關注輝達股東會後的影響及外資動向。,2025-08-03 17:22:46,20
2024-06-29,0.6,"營運展望樂觀、資本支出增加與先進封裝需求強勁帶動市場對未來成長的正面期待。

====================",2025-08-03 17:22:48,20
2024-06-30,0.6,除權息交易與營收表現帶動填息力道的期待，以及 AI 產業前景看好支撐多頭信心，但選舉不確定性壓抑漲幅空間。,2025-08-03 17:22:50,20
2024-07-01,0.6,權值股表現強勁且市場積極卡位除息行情，多頭氣勢仍在，但高價股普遍走弱，電子族群震盪整理，資金轉向傳產與生技類股。,2025-08-03 17:22:53,20
2024-07-02,0.3,權值股普遍下跌，市場信心受挫，加上缺乏明確的多頭領軍個股，整體市場情緒偏向保守。,2025-08-03 17:22:56,20
2024-07-03,0.6,台積電領漲帶動大盤上揚，多檔電子權值股走勢疲弱，但金融族群與綠能概念股表現亮眼，整體市場情緒偏正面。,2025-08-03 17:22:59,20
2024-07-04,0.9,台積電站穩千元大關帶動台股再創新高，多檔權值股與族群強勢上漲，市場情緒樂觀。,2025-08-03 17:23:00,20
2024-07-05,0.6,權值股普遍走勢疲弱，僅少數個股如廣達、台達電、日月光投控等維持正面表現，整體市場情緒受到壓抑但尚未轉為負面。,2025-08-03 17:23:02,20
2024-07-07,0.6,外資買超日月光投控，市場情緒偏正面，但整體台股漲多後仍有獲利了結壓力，個股表現將取決於營收與展望。,2025-08-03 17:23:04,20
2024-07-08,0.9,權值股領漲帶動大盤創高，AI 概念股強勢表現與多檔個股亮燈漲停，顯示市場信心回溫且對後市展望樂觀。,2025-08-03 17:23:06,20
2024-07-09,0.7,台積電領軍衝高創新天價帶動大盤再創歷史新高，但震盪加劇後翻黑收斂漲幅，權值股普遍走揚，重電族群與綠能概念股表現亮眼，市場情緒偏正面但仍有波動風險。,2025-08-03 17:23:09,20
2024-07-10,0.5,台積電回檔修正影響指數跌幅，但營建、金融族群與 AI 類股續強，整體市場情緒維持中性。,2025-08-03 17:23:11,20
2024-07-11,0.7,蘋概股強勢上漲，尤其是晶焱等低位階個股，顯示市場對科技巨頭的信心持續高漲。,2025-08-03 17:23:13,20
2024-07-12,0.2,"營收與獲利大幅衰退並轉虧，短期展望不明將引發市場負面情緒與股價壓力。

日月光投控 (3711-TW) 旗下日月光 ISE Labs 今 (12) 日宣布在加州聖荷西開設第二個美國廠區，進一步擴大世界一流的服務能力，惠及更多客戶。弗里蒙特和聖荷西兩地廠區的營運空間總面積超過 150,000 平方英尺，將擴大北美版圖展現深耕矽谷的決心，更有助於強化美國半導體供應鏈。",2025-08-03 17:23:18,20
2024-07-14,0.6,轉型效益顯現與矽光子需求增溫帶動業績成長，市場對未來營運展望樂觀但仍需留意大盤波動風險。,2025-08-03 17:23:20,20
2024-07-15,0.6,永續發展營隊與競賽活動展現企業社會責任，提升市場對公司ESG策略正面評價。,2025-08-03 17:23:22,20
2024-07-16,0.6,市場焦點轉移至被動元件與 ASIC 族群，電子權值股普遍走弱，金控股撐盤，整體市場情緒中性偏正面。,2025-08-03 17:23:24,20
2024-07-17,0.3,市場對 AI 概念股漲多後的獲利了結疑慮升溫，拖累台積電等電子權值股走勢疲弱，短期內投資人信心仍有待穩固。,2025-08-03 17:23:28,20
2024-07-18,0.3,美股重挫與外資連續賣超影響市場信心，惟部分防守型股票表現相對抗跌，整體情緒偏向保守。,2025-08-03 17:23:29,20
2024-07-19,0.3,權值股普遍下挫拖累大盤走勢，尤其是台積電法說報捷但股價仍重挫，引發市場信心動搖，但半導體設備需求強勁與先進製程擴產帶來轉機。,2025-08-03 17:23:32,20
2024-07-22,0.1,美國總統選舉不確定性升高引發市場恐慌賣壓，權值股全面下挫，加上半導體族群同步修正，大盤重挫 612 點失守季線支撐。,2025-08-03 17:23:34,20
2024-07-23,0.7,大盤跌破季線後反彈，權值股強勢表態，重電與營建族群同步走揚，個股中機器人、半導體設備概念股相對抗跌，顯示市場信心回溫。,2025-08-03 17:23:36,20
2024-07-25,0.9,財報亮眼、資本支出倍增與先進封裝需求強勁顯示公司成長動能強勁，激勵市場情緒向上並推升股價表現。,2025-08-03 17:23:38,20
2024-07-26,0.3,市場情緒轉向保守，權值股全面下挫，加上美股走跌導致台股大幅補跌，季線失守，短期內維持中性偏空看待。,2025-08-03 17:23:41,20
2024-07-27,0.6,法說會釋出正面訊息與資本支出上修提振市場信心，但整體經濟展望仍存在不確定性，短期內股價可能維持區間震盪走勢。,2025-08-03 17:23:44,20
2024-07-28,0.3,市場情緒偏空，融資增加與外資賣超權值股壓抑漲勢，但部分穩健股獲得青睞，財報季與經濟數據將左右後市走向。,2025-08-03 17:23:46,20
2024-07-29,0.6,"權值股反彈帶動大盤小幅上揚，但中小型股仍疲弱，市場情緒偏向保守，觀望後續走勢。

多空交戰持續，指數在季線附近震盪整理，個別族群表現分歧，投資人應審慎評估並自行承擔風險。",2025-08-03 17:23:49,20
2024-07-30,0.3,景氣燈號轉紅與台積電下跌拖累大盤，市場對經濟過熱疑慮升溫，半導體族群承壓。,2025-08-03 17:23:51,20
2024-08-01,0.6,外資回頭買超晶圓雙雄與金融股，顯示市場信心略有恢復，但月線反壓區仍是短期觀察重點。,2025-08-03 17:24:13,20
2024-08-02,0.1,市場情緒轉向悲觀，股價面臨顯著下跌壓力，主要受到美股大幅走低與半導體類股領跌影響。,2025-08-03 17:24:16,20
2024-08-03,0.9,AI 概念股回檔提供良機，台積電領軍先進封裝產業鏈受惠，FOPLP 技術發展值得期待。,2025-08-03 17:24:18,20
2024-08-04,0.1,大盤跌破季線且融資水位高，多殺多風暴加劇，市場情緒悲觀。,2025-08-03 17:24:19,20
2024-08-05,0.6,展覽與論壇聚焦先進封裝技術與材料創新，反映產業發展趨勢，但面板級扇出型封裝仍有挑戰待克服。,2025-08-03 17:24:21,20
2024-08-06,0.6,中科廠完工啟用將為公司營運注入新動能，加上「零廢棄」核心價值與專利技術優勢，市場對未來成長前景持正面期待。,2025-08-03 17:24:24,20
2024-08-07,0.9,權值股強彈與多頭指標 AI 概念股領漲，顯示市場情緒回溫並積極反應利多訊息。,2025-08-03 17:24:26,20
2024-08-08,0.1,市場情緒轉趨悲觀，電子權值股全面下挫，加上重電、線纜與營建族群同步走弱，拖累大盤再度失守21000點關卡。,2025-08-03 17:24:27,20
2024-08-09,0.6,日月光斥資 52.63 億元購入宏璟建設持有的 K18 廠房，顯示對未來擴充先進封裝產能的需求與信心，激勵市場情緒向上。,2025-08-03 17:24:30,20
2024-08-11,0.6,台積電營收創高與 AI 題材帶動相關個股表現，市場情緒正面但仍需留意地緣政治風險對產業復甦的影響。,2025-08-03 17:24:32,20
