date,factor,explanation,updated_time,news_count
2025-01-18,0.6,半導體產業蓬勃發展帶動電子化學品市場成長，台積電在地採購政策推動供應鏈變革，台灣本土供應商實力提升，為高值化與精密化學發展注入新動能。,2025-08-03 15:20:06,20
2025-01-19,0.3,台積電法說利多行情平淡，加上外資賣超與國際政經變數影響，市場觀望氣氛濃厚，短期股價波動加劇。,2025-08-03 15:20:08,20
2025-01-20,0.7,外資買超、期貨回補、台積電法說釋出利多，市場情緒偏正面，但漲幅有限，顯示獲利了結賣壓仍在。,2025-08-03 15:20:11,20
2025-01-21,0.6,雖然台積電受地震影響有限，但市場仍對公司的營運安全性和潛在損失保持謹慎態度，導致股價出現短期波動。,2025-08-03 15:20:14,20
2025-01-22,0.3,法說展望不如預期，加上地震影響，導致外資調降目標價，市場情緒轉為負面。,2025-08-03 15:20:18,20
2025-01-24,0.9,"台積電資本支出大增與全球擴廠概念相關標的展望樂觀，市場對供應鏈廠商成長前景持正向期待。

南科主要半導體廠商產線已恢復正常運作，地震及餘震影響有限，顯示供應鏈韌性良好。",2025-08-03 15:20:41,20
2025-01-25,0.6,龍年封關前夕，市場對於金蛇年展望樂觀，AI、半導體等產業成長潛力備受看好，但仍需留意經濟面回升與聯準會降息的進度。投資人可把握 AI、半導體及金融族群的輪動機會，平衡風險並掌握上漲紅利。,2025-08-03 15:20:44,20
2025-01-26,0.6,"先進封裝與矽光子技術需求增溫，檢測分析商機湧現，相關業者營運成長可期。

====================",2025-08-03 15:20:45,20
2025-01-28,0.9,先進封裝擴產需求強勁，相關設備商訂單能見度高達 2026 年，顯示台積電在先進製程之外的成長動能持續增溫，激勵市場對未來營運前景樂觀。,2025-08-03 15:20:47,20
2025-01-29,0.6,台積電 2 奈米製程進展順利且客戶需求強勁，相關供應鏈營運可望受惠，但整體市場情緒仍受到總體經濟與地緣政治因素影響而維持中性。,2025-08-03 15:20:50,20
2025-01-30,0.6,台積電擴產計畫持續推進，顯示對未來需求展望樂觀，帶動市場信心，但缺工與成本上升仍是潛在風險。,2025-08-03 15:20:52,20
2025-02-01,0.6,AI 機器人趨勢與美國製造政策利多支撐營運成長前景，但市場情緒仍受整體經濟環境影響而維持中性。,2025-08-03 15:20:54,20
2025-02-02,0.6,AI 應用與先進製程需求強勁，半導體產業展望樂觀，但地緣政治風險及關稅政策變化仍是市場擔憂的主要因素。,2025-08-03 15:20:58,20
2025-02-04,0.3,市場對川普關稅政策反應趨緩，但 DeepSeek 衝擊與後續貿易戰發展仍將影響投資信心，短期內大盤難以站穩。,2025-08-03 15:21:11,20
2025-02-05,0.7,美中貿易戰暫時休兵，市場情緒回穩，AI 概念股強勢反彈，台積電領軍電子權值股走揚，大盤站回萬三關卡。,2025-08-03 15:21:15,20
2025-02-07,0.6,AI 概念股短線震盪但長期趨勢不變，市場關注財報與法說會釐清疑慮。非 AI 股則宜選擇基本面穩健、產業前景樂觀者，逢低分批佈局。,2025-08-03 15:21:24,20
2025-02-08,0.6,雖然台積電遵守美國出口管制法規，但中國客戶出貨受限的消息仍引發市場擔憂，短期內可能對股價造成壓力。,2025-08-03 15:21:26,20
2025-02-09,0.6,轉型成功與自有技術優勢帶動毛利率提升，但市場仍擔憂營收規模有限且外在環境不確定性影響。,2025-08-03 15:21:28,20
2025-02-11,0.7,台積電獲利創高與需求前景穩健顯示公司基本面強勁，激勵市場情緒上漲，但漲幅受制於整體盤勢表現。,2025-08-03 15:21:38,20
2025-02-12,0.7,台積電董事會決議維持現金股利水準、核准員工業績獎金與酬勞，資本支出與增資子公司等，展現穩健營運與良好財務狀況，激勵市場情緒。,2025-08-03 15:21:42,20
2025-02-13,0.6,台積電股價下跌與三大法人買超金額縮小顯示市場情緒轉為中性，鋼鐵、塑化類股強勢表現帶動指數上漲，但整體盤面仍以個別族群表現為主。,2025-08-03 15:21:46,20
2025-02-14,0.3,地緣政治風險升溫、市場信心受挫，短期內股價承壓，投資人應審慎評估後市。,2025-08-03 15:21:50,20
2025-02-15,0.6,台積電維持穩定現金股利政策，展望未來成長動能，激勵市場情緒偏向樂觀，但缺乏重大突破性消息使漲幅有限。,2025-08-03 15:21:52,20
2025-02-16,0.6,"專利申請成績顯示台積電領先地位穩固，但英特爾獲得美國政府大力扶植恐影響未來競爭態勢。市場對於台積電投資英特爾傳聞持謹慎觀望，半導體供應鏈受關注。

====================",2025-08-03 15:21:55,20
2025-02-17,0.6,"AI 發展將持續支撐台股表現，建議投資人掌握「蛇行盤升」之契機，在震盪中尋找向上動能。半導體產業升級、低成本 AI 普及將推動相關供應鏈成長。

---

2025 年台股加權指數預期維持震盪多頭格局，AI 需求伴隨新產品及新應用陸續推出，將成支撐台股表現的主要動能。富達國際基金經理白芳苹表示，建議投資人掌握「蛇行盤升」之投資契機，在震盪中持續尋找向上動能。

AI 發展促半導體產業升級
AI 科技發展預期將持續成為台股的關鍵動能，推動包括半導體、AI 電腦、機器人等產業升級，特別是先進封裝技術與高速傳輸需求的提升，同時帶動相關供應鏈的投資機會。

低成本 AI 普及促滲透率提升
中國大陸新創公司 DeepSeek 推出低成本、高效能的 AI 模型，使市場開始重新評估對 AI 的資本支出結構，預估短期市場將持續波動。然而，在低成本 AI 的趨勢下，將推動更多國家、中小企業、個人使用者投入，加速提升 AI 滲透率，並推動相關產品總體需求與市場規模上升。

整體而言，2025 年 AI 發展仍將領先其他應用，富達持續看好整體規格升級的助力，台股尤其以硬體為主的供應鏈具持續成長的營運發展機會，建議關注包括 AI 電腦、工業電腦、機器人等供應鏈之投資機會，同時留意次產業贏來強勁需求的投資機會，留意包括 AI、PC 相關族群之上游材料、晶圓製造和封裝廠商、下游的硬體零組件、代工廠與品牌廠等主軸。",2025-08-03 15:22:05,20
2025-02-18,0.6,台積電獲外資回補、股價上漲帶動大盤走揚，AI 概念股強勢表現吸引買盤，但整體成交量萎縮，市場觀望氣氛濃厚。,2025-08-03 15:22:09,20
2025-02-20,0.6,重電與綠能股強勢表現挹注市場信心，電子權值股疲軟使大盤指數下跌，但整體維持高檔震盪格局，中小型股輪動為主。,2025-08-03 15:22:32,20
2025-02-22,0.6,AI 發展持續推動硬體需求，Nvidia GTC 大會備受關注，市場情緒偏正面，但美中貿易緊張局勢升溫仍帶來不確定性。,2025-08-03 15:22:52,20
2025-02-23,0.6,AI 晶片需求強勁帶動產能擴張，但投信罕見大賣超引發市場疑慮，短期內恐影響個股表現。,2025-08-03 15:22:56,20
2025-02-24,0.6,AI 模型競爭加劇，台積電等供應鏈受惠，但市場仍擔憂總體經濟與關稅影響，短期內指數將維持區間整理。,2025-08-03 15:23:00,20
2025-02-25,0.6,"台積電股價探今年低點拖累大盤走跌,加上半導體類股普遍疲軟,電子權值股表現不佳,但傳產族群如鋼鐵、塑化等逆勢抗跌,整體市場情緒偏空,預期短期內指數將維持區間震盪。",2025-08-03 15:23:03,20
2025-02-26,0.3,中國國台辦批評台灣把晶片產業當成「伴手禮」拱手奉送給美國，引發市場擔憂，但分析認為此舉面臨多重挑戰，對美方而言，推動台積電在美投資或許是更務實的選項。,2025-08-03 15:23:07,20
2025-02-28,0.6,AI 概念股漲多回檔，市場情緒轉向謹慎，但基本面仍強勁，短期整理後有望再度反彈。,2025-08-03 15:23:16,20
2025-03-02,0.3,國際局勢動盪與關稅政策不確定性壓抑市場信心，但 MWC 展覽題材及降息預期仍支撐部分正面情緒。,2025-08-03 15:23:18,20
2025-03-03,0.3,美股持續修正、國際情勢動盪及關稅政策變數，拖累台積電補跌回測年線，短期市場信心偏弱。,2025-08-03 15:23:22,20
2025-03-04,0.6,台積電擴大美國投資案，顯示對美方的承諾與信心，市場預期將帶動相關產業鏈發展，但短期內仍可能引發獲利分散、成本增加等疑慮，股價波動加劇。,2025-08-03 15:23:25,20
2025-03-05,0.7,台積電宣布赴美投資千億美元，激勵股價強彈並帶動電子權值股反彈，大盤成功站回半年線，但成交量萎縮顯示市場觀望氣氛濃厚。,2025-08-03 15:23:28,20
2025-03-07,0.5,"台積電加碼美國投資案引發市場關注，但經濟部長強調沒有來自美方壓力且是企業應對策略，技術仍將留在台灣。整體而言，雖有不確定因素但公司佈局明確，市場情緒中性。

台積電擴大美國投資案引發各界關注，但經濟部長強調沒有來自美方壓力且是企業應對策略，技術仍將留在台灣。整體而言，雖有不確定因素但公司佈局明確，市場情緒中性。",2025-08-03 15:23:44,20
2025-03-08,0.6,台積電赴美投資案引發市場關注，短期內可能帶來一些不確定性，但整體而言，公司基本面仍然強勁，需求前景穩健，激勵正面市場情緒。,2025-08-03 15:23:48,20
2025-03-09,0.6,加碼投資美國引發市場擔憂營運分散風險與獲利影響，短期內恐壓抑股價表現，但長線仍有望受惠全球產業鏈重組。,2025-08-03 15:23:51,20
2025-03-11,0.3,美股重挫引發全球股市震盪，台積電等權值股走勢疲弱，市場情緒悲觀，短期內恐難見明顯反彈。,2025-08-03 15:24:00,20
2025-03-13,0.5,聯貸案超額認購 182%，顯示金融同業對世界先進營運與獲利表現給予高度肯定。臺銀持續支持政府居住正義之普惠金融政策，辦理「歡迎台商回台投資行動方案」、「根留台灣企業加速投資行動方案」及「中小企業加速投資行動方案」等三大方案，承作金額已連續五年居各行庫之冠。,2025-08-03 15:24:11,20
2025-03-16,0.6,台積電股價跌破年線且「組隊救英特爾」訊息不利多頭信心，加上外資持續賣超，拖累市場情緒，但 ETF 題材與指數調整可能帶來轉機，整體呈現中性偏空。,2025-08-03 15:24:45,20
2025-03-18,0.9,"台積電除息順利完成填息，帶動大盤上漲逾 150 點，重返年線之上。加上美國總統川普再度讚揚台積電，並傳出亞利桑那州州長訪台與台積電高層會面，顯示外資持續看好台積電前景，激勵市場情緒走強。

世芯 - KY(3661-TW) 受惠 AI 晶片需求成長，未來 3 年營收年增率可望維持四~五成水準，且車用與網通 ASIC 訂單回溫，有利中長期發展。",2025-08-03 15:24:55,20
2025-03-19,0.6,輝達 GTC 大會推出矽光子 CPO 技術與相關產品，台積電、鴻海、波若威等台廠受惠，但短期市場反應有限，整體展望中性偏多。,2025-08-03 15:24:58,20
2025-03-22,0.6,AI 技術進步與矽光子技術發展為半導體產業帶來創新突破，輝達 GTC 大會揭示未來技術路徑與市場策略，台廠在 CPO 產品與矽光子聯盟中扮演重要角色，相關個股有望受惠。,2025-08-03 15:25:16,20
2025-03-23,0.3,"美國總統川普可能實施的關稅政策引發市場擔憂,但交易員認為細節不明前台股易跌難漲,若最終關稅幅度不高則有望展開彈升行情。",2025-08-03 15:25:18,20
2025-03-24,0.3,市場情緒偏空，反彈力道不足，年線得而復失，加上川普關稅政策不確定性影響投資信心。,2025-08-03 15:25:21,20
2025-03-27,0.3,"外資賣超加上美股下跌影響台積電走勢，引發市場信心疑慮，短期內大盤恐持續探低。

台積電擴大美國投資效益深遠，對台灣經濟、國防與半導體供應鏈的貢獻將持續擴大。",2025-08-03 15:26:08,20
2025-03-30,0.3,市場高度不確定性與外資提款重心集中在電子權值股，引發市場悲觀情緒，但部分非電族群獲得青睞，顯示仍有投資人逢低承接。,2025-08-03 15:26:15,20
2025-04-01,0.6,"權值股反彈帶動大盤強勁上揚，但量能未能有效放大，顯示市場信心仍有待提振。軍工概念股受惠地緣政治因素，表現搶眼。

台積電 (
2330-TW
) (
TSM-US
) 今日舉行高雄廠 2 奈米擴產典禮，執行副總經理暨共同營運長秦永沛表示，台積電高雄廠總投資額達新台幣 1.5 兆元，除了正在裝機中的第一期廠房外，第二期也在今日上樑，第三期正如火如荼展開結構體工程，未來還會有第四期與第五期，喊話 2 奈米需求相當強勁，也重申持續擴大投資台灣的決心。",2025-08-03 15:26:30,20
2025-04-03,0.3,美方針對台灣課徵高額關稅引發市場擔憂，衝擊消費性電子需求並加劇通膨壓力，恐將抑制整體經濟成長動能。,2025-08-03 15:26:44,20
2025-04-04,0.6,台積電與英特爾合資設廠傳聞帶來正面消息，但美中貿易戰升溫引發市場擔憂，對股價造成壓力。,2025-08-03 15:26:47,20
2025-04-06,0.3,美國關稅措施引發市場恐慌，台股可能補跌，但政府積極應對並提出多項因應策略，有助穩定市場信心。,2025-08-03 15:26:50,20
2025-04-09,0.3,美國加大對台積電的壓力，關稅威脅與調查疑慮疊加，市場情緒偏向保守，但台積電遵循法規、政府介入護盤等因素仍為正面因子。,2025-08-03 15:27:24,20
2025-04-11,0.7,台積電領軍反彈，搭配航運、航空等強勢族群助攻，大盤指數收復5日線，但短期內仍難擺脫震盪整理格局。,2025-08-03 15:27:50,20
2025-04-12,0.3,川普關稅調整帶來短期樂觀，但後續影響仍有不確定性，加上大立光營運展望保守，市場情緒呈現溫和偏多。,2025-08-03 15:27:52,20
2025-04-13,0.6,美中貿易戰持續升溫，台積電等科技業面臨龐大壓力，市場情緒偏向保守，但台灣在全球供應鏈中的關鍵地位使其具有一定談判籌碼，有望在這場大國博奕中全身而退。,2025-08-03 15:27:56,20
2025-04-15,0.8,輝達與台積電等合作夥伴在美國建立 AI 超級電腦供應鏈，激勵相關個股上揚，市場情緒轉向正面。,2025-08-03 15:28:05,20
2025-04-17,0.3,"市場持續觀望川普關稅政策細節，半導體族群走勢疲弱，台積電股價跌破 800 元大關。


====================================================

綜合以上資訊，整體而言對台積電的影響為負面，建議投資人保守觀望。

====================================================

1. 台積電 (2330) 首季財報亮眼，但市場仍擔憂川普的半導體關稅政策。
2. 科嶠 (4542) 是一家生產自動化乾燥設備、載板清洗設備的公司，對於美國廣徵關稅的影響程度較低。
3. 永誠資產管理處提供專業的投資理財服務，幫助客戶累積財富。",2025-08-03 15:28:25,20
2025-04-19,0.6,"AI 伺服器需求強勁，帶動相關台廠營收成長，但美國關稅政策持續變化，引發供應鏈提前備貨潮，短期內雖有利多支撐，但長期風險仍在。建議聚焦具基本面支撐與產業趨勢力道的個股，汰弱留強、順勢換股，將會是翻身關鍵。

===========================================================================",2025-08-03 15:28:37,20
2025-04-20,0.6,台積電展望穩健成長、技術領先優勢明確，激勵市場信心回升，但獲利創高與高階主管薪酬大增也引發關注，中性偏正面。,2025-08-03 15:28:40,20
2025-04-21,0.3,市場情緒偏向中性，短期內仍受到美國對等關稅政策的影響而觀望，但部分個股如 AI 相關產業具反彈潛力。,2025-08-03 15:28:44,20
2025-04-22,0.3,"市場情緒偏弱，短期內仍有下探風險。


台股今 (22) 日美股昨日重挫，開盤即開低、一度下探至 18880 點，跌幅超過 220 點，包括電子、金融股成為提款標的，但隨後在低接買盤進場下，跌幅不斷收斂至百點內，萬九大關失而復得，預估今日成交量略為放大至 2300 億元。


權值股今漲跌互見，台積電 (
2330-TW
)(
TSM-US
) 今下跌超過 1%，最低下探 820 元，聯發科 (
2454-TW
) 則由黑翻紅，逆勢獲青睞，也收復十日線，鴻海 (
2317-TW
) 下挫超過 1%，廣達 (2382-TW) 也有逾 1% 的跌幅。


另外，隨著川普再嗆聯準會主席鮑爾施壓降息，今日金融股成重災區，富邦金 (2881-TW)、國泰金 (2882-TW) 雙雙下挫 2% 左右，其他如中信金 (2891-TW)、兆豐金 (2886-TW)、玉山金 (2884-TW)、元大金 (2885-TW)、華南金 (2880-TW)、合庫金 (5880-TW) 也都有 1% 左右的跌幅，壓抑整體大盤走勢。


不過，光通訊概念股今日強勢，華星光 (4979-TW)、波若威 (3163-TW) 雙雙亮燈漲停，聯鈞 (3450-TW)、光聖 (6442-TW)、環宇 - KY(4991-TW) 漲幅都至少半根漲停板以上，走勢相當凌厲。

---

受川普關稅影響，光通訊族群近期幾度成為弱勢指標，但隨著台積電 (2330-TW) 技術論壇，將於美西時間 23 日開跑，外界預期矽光子 (CPO) 技術進展，有望成為注目焦點，今 (22) 日包括波若威 (3163-TW)、華星光 (4979-TW) 雙雙在開盤後一度亮燈衝漲停，領軍帶領光通訊股反攻上揚。


法人表示，台積電歷年來的技術論壇，亦為業界矚目的重頭戲，外界期待公布新技術，其中 AI 人工智慧需要高運算之外，更需要快速的資料傳輸，CPO 矽光子共封裝技術更成為未來主流。


今日盤面上 CPO 概念股，波若威、華星光開盤後一度觸及漲停板，華星光自結 3 月營收為 3.76 億元，雖僅年增 42.97％，但稅後純益 8,100 萬元，年增 102.5％，盤中漲幅收斂 9%，波若威則是漲幅收斂至 7%，其他包括聯鈞 (3450-TW) 、聯亞 (3081-TW) 、光環 (3234-TW) 、光聖 (6442-TW) 盤中也一度上揚約 2-3% 。


分析師表示，CPO 類股受對等關稅影響，近期遭到關稅修正落底，目前股價已到低基期，加上籌碼的沉澱，融資水位降低，多家台廠也在 3 月營收繳出不錯的佳績，相關業者也各擁利基，除了台積技術論壇有望加持，包括美國、中國為避開彼此互課的高關稅，有機會釋出轉單效應予台灣光通訊廠受惠，投資人可以關注營收不錯的 CPO 類股，逐步分批進場。",2025-08-03 15:29:01,20
2025-04-24,0.3,台積電股價走勢偏弱且成交量能萎縮，拖累大盤表現，市場信心仍有疑慮。,2025-08-03 15:29:13,20
2025-04-26,0.7,技術論壇展望未來成長動能與製程進展，搭配產業復甦跡象，整體市場情緒偏正面但仍需留意利率走勢對終端需求的影響。,2025-08-03 15:29:20,20
2025-04-27,0.6,市場情緒趨於樂觀，美中關稅戰緩和跡象與台積電等大廠法說有望釋出正面訊息，但部分個股獲利表現疲弱且展望保守，整體市場仍存在不確定性。,2025-08-03 15:29:22,20
2025-04-29,0.6,"雖然台積電等電子權值股翻紅，但市場情緒仍偏謹慎，外資買超金額縮減，量能不足，短期行情維持中性。需留意後續經濟數據表現與關稅影響的超額庫存風險。

台積電等電子權值股翻紅，但市場情緒仍偏謹慎，外資買超金額縮減，量能不足，短期行情維持中性。需留意後續經濟數據表現與關稅影響的超額庫存風險。",2025-08-03 15:29:33,20
2025-04-30,0.5,外資回流、台幣升值帶動高價股領漲，機器人概念股接棒上攻，多頭氣勢延續，但仍需留意月線支撐力道。,2025-08-03 15:29:36,20
2025-05-01,0.9,公司治理評鑑連續 11 屆名列前 5% 顯示信任度高，正面消息有助於提升市場對企業的信心與股價表現。,2025-08-03 15:29:38,20
2025-05-02,0.6,台積電股價走強與大盤上漲，顯示市場情緒正面，但美中關係緊張、貿易戰升溫等外在因素仍帶來不確定性，影響短期漲勢延續力道。,2025-08-03 15:29:41,20
2025-05-03,0.3,新台幣強升對電子半導體業出口與公司獲利的潛在影響引發市場擔憂，匯率波動加劇股價波動，但材料供應鏈競爭態勢仍有利於台廠。,2025-08-03 15:29:43,20
2025-05-04,0.7,設備需求持續成長，製程升級與 AI 伺服器推波助瀾，台廠供應鏈受惠。,2025-08-03 15:29:46,20
2025-05-06,0.3,新台幣匯率快速升值引發市場疑慮，企業匯損壓力加劇，短期內可能對股市造成衝擊，但目前多頭格局尚未破壞，後續需密切關注經濟數據與資金流向。,2025-08-03 15:29:56,20
2025-05-07,0.6,台積電急拉帶動指數翻紅，市場情緒趨於樂觀，但成交量萎縮及外資態度仍需留意。,2025-08-03 15:29:59,20
2025-05-08,0.6,市場觀望氣氛濃厚，半導體關稅細節尚未公布，籌碼面及成交量縮小，操作上需精簡集中，聚焦三大主流族群。,2025-08-03 15:30:02,20
2025-05-09,0.7,美英達成貿易協議，半導體關稅底線浮現，加上台積電營收強勁，激勵市場情緒轉趨樂觀，帶動股價上漲。,2025-08-03 15:30:05,20
2025-05-10,0.7,營收創高反映強勁需求與產能利用率維持高檔，展望樂觀但仍需留意終端庫存去化狀況。,2025-08-03 15:30:07,20
2025-05-11,0.6,五大信賴產業受惠政策偏多與關稅緩徵利多，展望樂觀，但匯率波動、晶片回美議題等不確定因素仍將影響短期行情穩定度。,2025-08-03 15:30:10,20
2025-05-14,0.9,"美中關稅降低、AI晶片禁令解除等利多消息激勵市場情緒，外資持續偏多操作，指數站上季線並創波段新高。AI供應鏈與量子網路糾纏晶片等新興題材成焦點。

0.9
美中關稅降低、AI晶片禁令解除等利多消息激勵市場情緒，外資持續偏多操作，指數站上季線並創波段新高。AI供應鏈與量子網路糾纏晶片等新興題材成焦點。",2025-08-03 15:30:31,20
2025-05-15,0.7,市場對於美國政策轉向樂觀，AI 產業前景看俏，激勵相關個股走強，但台積電漲幅已大，短線上檔壓力仍在。,2025-08-03 15:30:35,20
2025-05-16,0.7,AI 概念股持續強勢，輝達執行長黃仁勳預計在 COMPUTEX 演講，釋出 AI 新藍圖，激勵市場情緒向上。,2025-08-03 15:30:39,20
2025-05-17,0.7,半導體產業前景樂觀，美中關稅衝突緩解帶動費半指數強勁反彈，激勵市場情緒與股價上揚。,2025-08-03 15:30:41,20
2025-05-18,0.9,輝達執行長黃仁勳來台引領話題，強調台灣在 AI 產業的重要性，激勵市場情緒向上，半導體供應鏈可望受惠。,2025-08-03 15:30:45,20
2025-05-21,0.7,AI 產業鏈強勢輪動，搭配 COMPUTEX 展會題材發酵，台股延續多頭格局，但震盪難免，操作需聚焦主流、掌握節奏與紀律。,2025-08-03 15:31:14,20
2025-05-22,0.3,美債殖利率飆升引發市場避險情緒，權值股普遍走弱，加上電子產業庫存調整持續，台積電領跌，拖累大盤下挫超過 130 點，失守五日線，成交量縮至 2976 億元。雖然部分傳產類股如航運、重電、綠能等有所支撐，但整體市場信心仍受到衝擊，短期內恐難見明顯反彈。,2025-08-03 15:31:18,20
2025-05-23,0.5,市場情緒中性，短期內消息面與技術面交雜影響，投資人觀望態度濃厚。,2025-08-03 15:31:22,20
2025-05-24,0.6,輝達在 COMPUTEX 展示 AI 技術與產業鏈整合能力，強化市場信心；國泰金股債操作穩健，持續加碼台股與台幣計價 ETF。,2025-08-03 15:31:24,20
2025-05-25,0.3,市場對川普最新關稅政策反應謹慎，美債殖利率走升壓力籠罩大盤，短期行情趨於震盪整理。,2025-08-03 15:31:26,20
2025-05-31,0.6,台積電與美國新創公司 Avicena 合作開發基於 MicroLED 的光學互連技術，引發市場高度關注。晶背供電技術逐步成為半導體效能優化的關鍵，Carrier Wafer 因其支撐與結構特性需求同步提升，並成為高階耗材市場的新核心，台廠如昇陽半與中砂持續擴產，積極卡位下一波成長動能。,2025-08-03 15:32:44,20
2025-06-01,0.6,外資操作轉為謹慎且匯率對營收的影響將反映在即將公布的營收中，市場對後續經濟表現存在不確定性，引發投資人擔憂。,2025-08-03 15:32:47,20
2025-06-03,0.9,台積電維持全年營收展望並表示未來幾個月整體情勢會更加清晰，將繼續密切關注相關情勢對終端市場需求的潛在影響，激勵股價上揚 2%，帶動指數早盤開高，漲逾 300 點站上 5 日線。公司釋出正面訊息並強調將持續投資綠電發展，為環境永續貢獻心力，整體而言對市場情緒與股價產生正面影響。,2025-08-03 15:32:56,20
