date,factor,explanation,updated_time,news_count
2024-08-12,0.9,AI 概念股領軍反彈、重電股強勁表現與台積電尾盤急拉帶動大盤上漲，市場情緒轉趨樂觀。,2025-08-03 17:24:34,20
2024-08-13,0.6,市場情緒偏向中性，個股表現分歧，權值股漲跌互見，新納入 MSCI 指數的個股強勢，但重電股卻遭遇大幅賣壓。整體而言，多空因素交錯，短期內難以明確判斷市場走向。,2025-08-03 17:24:35,20
2024-08-14,0.6,市場情緒偏正面，權值股普遍走揚且成交量放大，顯示對日月光等個股的信心回升，但整體漲幅仍受觀望氣氛影響而有所收斂。,2025-08-03 17:24:38,20
2024-08-15,0.3,"台股連續兩天挑戰月線失利，2萬2千點大關也失守，終場收最低21,895.17點，下挫132.08點，成交量創今年2月以來新低。權值股普遍在盤下震盪，電子股如台積電、聯發科、日月光投控等跌幅約2-3%，壓抑整體大盤走勢。",2025-08-03 17:24:41,20
2024-08-16,0.6,AI 需求強勁、CoWoS 產能吃緊，相關設備與材料廠商營運看俏，股價表現強勢。,2025-08-03 17:24:44,20
2024-08-18,0.9,轉型效益逐步顯現，下半年營收成長動能強勁，加上矽光子封裝技術需求增加，有利未來業績表現與市場情緒。,2025-08-03 17:24:46,20
2024-08-19,0.6,中科廠完工啟用與廢條再利用業務成長帶動營收前景，激勵市場對公司未來發展的正面期待。,2025-08-03 17:24:49,20
2024-08-20,0.6,市場情緒偏向正面，權值股與 AI 族群領漲帶動大盤上揚，但營收獲利展望仍有不確定性影響整體信心。,2025-08-03 17:24:50,20
2024-08-21,0.3,市場情緒偏向保守，電子權值股普遍走跌，加上營建與機器人族群疲軟，拖累大盤下挫，但綠能概念股表現亮眼，整體而言呈現中性偏空。,2025-08-03 17:24:53,20
2024-08-22,0.6,SEMICON Taiwan 2024 國際半導體展將登場，重量級嘉賓齊聚探討 AI 發展趨勢，激勵市場對半導體產業前景的正面期待。,2025-08-03 17:24:55,20
2024-08-23,0.6,市場關注併購議題與央行限貸令，引發投資人觀望氣氛濃厚，短期內市場情緒偏向中性。,2025-08-03 17:24:56,20
2024-08-25,0.9,矽光子技術發展備受市場關注，多家廠商參與聯盟顯示產業鏈完整性，為日月光等相關概念股帶來正面激勵。,2025-08-03 17:24:58,20
2024-08-26,0.6,權值股全面走揚與 AI 族群強勁表現帶動大盤上漲，但個別公司營運展望不明朗仍影響市場情緒。,2025-08-03 17:25:00,20
2024-08-27,0.6,台積電供應鏈強勢表現與 AI 族群整理形成對比，市場資金明顯流向半導體設備、材料股，展望後市仍有上漲空間。,2025-08-03 17:25:03,20
2024-08-28,0.6,矽光子技術受惠 AI 熱潮與產業聯盟加持，日月光投控擴大馬來西亞廠房投資，SEMICON Taiwan 2024 強調 AI 應用帶動半導體成長，整體展望正面但仍有庫存修正等變數待觀察。,2025-08-03 17:25:05,20
2024-08-29,0.6,CoWoS 產能擴張與先進封裝需求強勁帶動設備商成長，公司積極佈局半導體領域，未來展望樂觀。,2025-08-03 17:25:09,20
2024-08-30,0.7,權值股普遍平盤附近震盪，電子與傳產類股各有表現，光通訊族群強勢上攻支撐市場信心。,2025-08-03 17:25:10,20
2024-09-01,0.9,矽光子技術前景廣闊，台積電與日月光等 31 家廠商共同成立聯盟，加速產業發展並帶動相關概念股強勢表現，市場對未來成長潛力樂觀期待。,2025-08-03 17:25:12,20
2024-09-02,0.6,"日月光營運長吳田玉於 SEMICON TAIWAN 2024 展前記者會上表示，台灣在先進製造領域領先，但在記憶體、材料等並無優勢，因此要透過多領域合作，提升台灣半導體在全球的價值。市場對日月光與其他國際大廠攜手合作的可能性持正面期待。

---",2025-08-03 17:25:17,20
2024-09-03,0.6,SEMI 成立矽光子產業聯盟與台灣半導體生態系緊密合作，顯示矽光子技術發展前景可期，將帶動相關供應鏈成長，但仍需關注研發成本與量產規模等挑戰。,2025-08-03 17:25:21,20
2024-09-04,0.5,"AI 概念股重挫拖累大盤跌逾千點，八大官股券商護盤買超 217 億元，但仍無法阻止台股創下史上第三大跌點。整體而言市場情緒偏空，短期內恐難出現明顯反彈。

市場對 AI 概念股的前景看法分歧，加上美股重挫影響，導致電子權值股全面走跌，AI 族群更是重災區。雖然八大官股券商積極護盤，但買超金額仍無法彌補市場信心不足的問題。整體而言，短期內台股恐難出現明顯反彈，投資人應謹慎操作，避免過度追高。",2025-08-03 17:25:26,20
2024-09-05,0.6,矽光子技術合作與營收表現均為正面訊息，但市場情緒仍受整體經濟前景與庫存調整影響而維持中性。,2025-08-03 17:25:30,20
2024-09-06,0.3,市場對 AI 產業的擔憂與 FED 利率會議前觀望氣氛濃厚，拖累相關類股表現，但長線展望仍正向。,2025-08-03 17:25:32,20
2024-09-07,0.3,矽光子技術發展加速與工資調升有利產業人力成本，但外資大賣超及電子權值股疲弱壓抑市場信心。,2025-08-03 17:25:34,20
2024-09-08,0.6,面板廠出售閒置資產給半導體業者，旨在取得合作機會並提升財務表現，買家則藉此擴大產能與技術領先地位，雙方互蒙其利的策略聯盟有望為市場注入正面動能。,2025-08-03 17:25:37,20
2024-09-09,0.4,台積電失守900元大關，拖累大盤跌破21000點關卡，但跌幅收斂，顯示市場信心尚未完全崩潰。權值股普遍走跌，僅日月光力守平盤，表現相對抗跌。塑膠、鋼鐵類股疲軟，AI散熱與機殼族群則有所支撐，整體而言市場情緒偏空，但尚未完全失望。,2025-08-03 17:25:40,20
2024-09-10,0.7,營收創九個月來新高且年增率正向，AI 需求強勁與先進封裝擴產計畫支撐市場對未來成長的樂觀期待。,2025-08-03 17:25:42,20
2024-09-11,0.3,"多空消息交雜且量能萎縮，市場情緒偏向保守，短期股價波動加劇。

日月光與供應商合作捐贈教學物資給新竹縣市學校，展現企業社會責任，但整體台股表現疲弱，權值股普遍走跌。",2025-08-03 17:25:46,20
2024-09-12,0.9,美科技股反彈激勵大盤強勁上漲，權值股與 AI 族群領軍衝鋒，市場情緒樂觀。,2025-08-03 17:25:48,20
2024-09-13,0.6,半導體設備股強勢表現與日月光人才培育合作備忘錄簽署，顯示產業前景樂觀且持續擴張，有利支撐市場情緒。,2025-08-03 17:25:51,20
2024-09-14,0.6,台積電推動「晶圓製造 2.0」與矽光子聯盟，強化產業鏈合作分散壟斷壓力，相關概念股值得留意。,2025-08-03 17:25:53,20
2024-09-15,0.9,"3奈米製程需求強勁，台積電領軍帶動供應鏈成長，市場對相關概念股展望樂觀。

====================",2025-08-03 17:25:55,20
2024-09-16,0.6,"市場觀望 FED 決策，成交量萎縮，但 AI 概念股仍強勢表現，顯示產業前景樂觀，帶動個股漲幅。整體而言，中秋節後有機會迎來行情反彈。

====================

請注意以上僅為模擬分析，不代表實際操作結果，也不構成任何投資建議。",2025-08-03 17:25:59,20
2024-09-17,0.9,矽光子技術被視為 AI 伺服器高速傳輸的關鍵解方，帶動連接器 / 線等零組件廠商積極搶進，日月光身為矽光子產業聯盟創始成員之一，相關布局有望受惠。,2025-08-03 17:26:01,20
2024-09-18,0.6,AI 供應鏈股價漲多拉回整理，惟台積電擴產 COWOS 題材持續發酵，相關設備廠有望落後補漲。,2025-08-03 17:26:04,20
2024-09-19,0.6,聯準會降息帶動美股反彈激勵市場情緒，權值股走勢分歧但整體呈現震盪上揚格局。,2025-08-03 17:26:06,20
2024-09-20,0.6,外資持續圍繞新光金三角戀，買超面板雙虎與台積電等權值股，整體市場情緒偏向正面。,2025-08-03 17:26:10,20
2024-09-22,0.5,美國降息循環啟動與零售銷售數據優於預期提振市場信心，但選前行情保守，外資態度將影響後市走向。,2025-08-03 17:26:12,20
2024-09-23,0.6,權值股尾盤表現強勁帶動指數上漲，三大法人同步買超且外資連續買超多檔金融股，整體市場情緒偏正面。,2025-08-03 17:26:13,20
2024-09-24,0.6,三大法人同步買超，外資買超金額創近期新高，顯示市場情緒轉趨樂觀，但個股表現分歧，權值股與金融股獲青睞，電子與傳產股則有買賣超。,2025-08-03 17:26:15,20
2024-09-25,0.3,三大法人同步站在買方且外資回補權值股，激勵指數創近兩個月新高，但部分電子權值股遭調節壓抑漲幅。,2025-08-03 17:26:17,20
2024-09-26,0.7,台積電站穩千金地位激勵市場信心，但漲多拉回壓力仍在，加上綠能轉供需求增溫帶動相關個股表現，整體而言維持正面但謹慎的中性偏多態勢。,2025-08-03 17:26:20,20
2024-09-27,0.6,外資連續買超且原物料族群表現強勁帶動下，市場情緒偏正面，但子公司交易與財報仍影響個股走勢。,2025-08-03 17:26:22,20
2024-09-29,0.6,併購案有助擴大產品線與市場版圖，強化公司在半導體封裝材料領域的競爭力，激勵中長期市場信心。,2025-08-03 17:26:23,20
2024-09-30,0.3,電子權值股走弱與外資賣壓加劇，拖累大盤重挫近600點，月線連三黑，季線也下跌。傳產族群表現相對抗跌，但整體市場情緒偏空，短期內恐難見明顯反彈。,2025-08-03 17:26:27,20
2024-10-01,0.7,權值股反彈與大盤收復季線顯示市場情緒回穩，但三大法人賣超及外資提款壓力仍在，對未來走勢持中性偏空看法。,2025-08-03 17:26:29,20
2024-10-04,0.4,台股休市兩日後回檔修正，市場信心受到衝擊，個股表現分歧，權值股普遍疲軟，僅少數個股維持強勁。整體而言，投資人觀望美股與地緣政治情勢發展，短期內對市場前景仍抱持謹慎態度。,2025-08-03 17:26:31,20
2024-10-05,0.6,矽光子技術發展趨勢明確，相關產業鏈企業積極佈局，但短期營收貢獻有限，市場情緒偏正面但仍需時間發酵。,2025-08-03 17:26:33,20
2024-10-07,0.9,台積電領軍大漲帶動加權指數上攻，多頭信心增強且買盤力道持續，激勵市場情緒走揚。,2025-08-03 17:26:35,20
2024-10-08,0.5,權值股走勢分歧，半導體族群漲跌互現，市場情緒中性偏正面。,2025-08-03 17:26:37,20
2024-10-09,0.6,日月光新廠動土典禮展現對未來成長的信心，但營收增幅有限且市場競爭激烈，短期內股價波動可能受大盤影響。,2025-08-03 17:26:40,20
2024-10-11,0.7,權值股普遍走強，加上 AI、營建族群表現亮眼，激勵市場情緒向上，但美股四大指數昨日皆下跌，可能對後市造成壓力。,2025-08-03 17:26:43,20
2024-10-14,0.6,營收與獲利雙增創高顯示公司基本面強勁，但市場關注焦點轉向先進製程合作案的影響，引發中性情緒。,2025-08-03 17:26:47,20
2024-10-16,0.3,權值股普遍下挫，加上 ASML 財報提前爆雷與輝達重挫拖累，台股大跌逾 400 點，多檔電子、金融權值股走低，但光通訊族群及部分傳產類股表現相對強勢。,2025-08-03 17:27:04,20
2024-10-17,0.5,權值股漲跌互見，資金轉向傳產與中小型類股，市場情緒維持平穩。,2025-08-03 17:27:05,20
2024-10-18,0.9,台積電強勁走勢帶動電子股表現，市場情緒樂觀且買氣熱絡，多頭行情延續。,2025-08-03 17:27:07,20
2024-10-19,0.6,AI晶片市場競爭加劇，台廠供應鏈受惠，相關概念股看俏，但需留意產業週期性波動的影響。,2025-08-03 17:27:09,20
2024-10-21,0.6,權值股表現分歧，IC 設計股強勢領漲，但金控族群走弱拖累大盤，加上成交量萎縮，市場情緒偏向中性。,2025-08-03 17:27:10,20
2024-10-22,0.6,台股在權值股走弱下開低，但電子族群如 PCB 與載板表現強勁，金融股也撐盤，加上最後一盤拉抬使跌幅縮小，整體市場情緒維持中性偏正面。,2025-08-03 17:27:14,20
2024-10-23,0.3,大盤下挫拖累權值股走弱，市場信心受損，但小型先進封裝設備股逆勢抗跌，顯示部分族群仍獲資金青睞。,2025-08-03 17:27:15,20
2024-10-24,0.6,日月光等權值股走跌拖累大盤，市場情緒偏向保守，但軟體族群表現強勁提供支撐。,2025-08-03 17:27:17,20
2024-10-25,0.6,特斯拉財報優於預期激勵相關概念股走強，AI、車用等族群表現亮眼，市場情緒偏正面。,2025-08-03 17:27:20,20
2024-10-26,0.3,市場對明年獲利成長預期下修引發短期信心動搖，但整體展望仍屬正向。,2025-08-03 17:27:22,20
2024-10-29,0.3,市場對日月光的獲利預估下修與營收展望保守導致整體情緒偏空，但股價壓力有限。,2025-08-03 17:27:29,20
2024-10-30,0.6,市場觀望氣氛濃厚且成交量萎縮，權值股普遍疲軟，但日月光等個別族群仍有表現，整體而言市場情緒偏中性。,2025-08-03 17:27:31,20
2024-10-31,0.7,財報表現亮眼且對未來展望正向，激勵市場情緒但第四季旺季效應不如預期使短期漲幅有限。,2025-08-03 17:27:33,20
2024-11-01,0.3,營收與獲利預估下修引發市場信心受挫，加上整體經濟環境不佳，股價承壓。,2025-08-03 17:27:36,20
2024-11-02,0.6,"法說會釋出正面訊息與展望，但市場對第四季旺季效應不樂觀，整體情緒偏中性。

日月光第三季財報亮眼，毛利率創七季新高，稅後純益也改寫同期次高紀錄。董宏思表示，雖然第四季全球經濟環境影響，但先進封測需求仍強勁，預計全年先進封裝業績將超過 5 億美元，並看好明年持續成長。然而，由於市場對第四季旺季效應不樂觀，整體情緒偏中性。",2025-08-03 17:27:39,20
2024-11-04,0.3,三大法人同步縮手，外資調節聯電及多檔 ETF 部位，投信也賣超聯電，市場觀望美國大選，資金明顯退潮。,2025-08-03 17:27:41,20
2024-11-05,0.6,市場情緒偏向中性。儘管台股尾盤急拉站上 23000 點，但受到美國大選、北韓飛彈試射等因素影響，整體走勢仍顯觀望。外資買超航運三雄及 AI 伺服器族群，但賣超聯電、日月光投控等個股，顯示市場信心尚未完全恢復。,2025-08-03 17:27:44,20
2024-11-06,0.6,市場資金流向與川普概念股相關個股，權值股漲跌互見，整體呈現中性偏多格局。,2025-08-03 17:27:45,20
2024-11-07,0.6,日月光投控積極推動環境技術研究與產學合作，展現對永續發展的承諾，有助於提升企業形象並引領綠色轉型，但短期內相關新聞未直接影響營運表現。,2025-08-03 17:27:48,20
2024-11-08,0.6,墨西哥新廠投資案有利未來業務擴展，但短期營運表現與股價走勢仍受市場情緒影響。,2025-08-03 17:27:50,20
2024-11-10,0.9,"AI 應用需求強勁，矽光子技術商機龐大，相關台廠受惠，市場情緒樂觀。

====================",2025-08-03 17:27:52,20
2024-11-11,0.6,日月光投控 10 月營收創下 23 個月來新高，顯示客戶需求回溫與先進封裝成長動能強勁，但第四季旺季效應不如往年，市場對未來展望仍持審慎態度。,2025-08-03 17:27:55,20
2024-11-12,0.5,日月光與寶晶能源簽署綠電購售合約，展現企業永續經營決心，有利長期發展，但短期市場仍受到大盤走弱影響。,2025-08-03 17:27:57,20
2024-11-13,0.6,基本面表現亮眼且獲利成長動能強勁，搭配高股息ETF的配息行情，有助於支撐市場信心並維持正面情緒。,2025-08-03 17:27:58,20
2024-11-14,0.7,綠能整合競爭優勢與海外市場拓展計畫為公司未來成長注入動能，營收結構多元化有利穩定獲利。,2025-08-03 17:28:00,20
2024-11-15,0.9,權值股普遍上漲、金融與傳產類股強勢表現，帶動大盤指數上攻並突破前波高點，顯示市場情緒樂觀且對後市信心回升。,2025-08-03 17:28:02,20
2024-11-17,0.3,市場對台股整體展望偏空，日月光作為大型電子股之一，短期面臨獲利下滑、庫存調整等壓力，市場情緒趨於謹慎。,2025-08-03 17:28:03,20
2024-11-18,0.1,美股重挫與台積電等電子權值股疲弱拖累大盤，季線岌岌可危，市場情緒悲觀。,2025-08-03 17:28:05,20
2024-11-19,0.6,市場情緒回溫，權值股與貨櫃三雄領漲帶動大盤強勁反彈，但個別產業展望仍有不確定性。,2025-08-03 17:28:08,20
2024-11-20,0.5,"台股延續反彈走勢，多數權值股維持漲勢，但市場仍關注川普政策的不確定性，以及後續經濟與產業發展。投資人可留意評價面合理或具高殖利率抗震力較佳的相關個股，作為布局重點。

請注意，以上分析僅供參考，不代表實際市場表現，投資人應自行判斷並承擔風險。",2025-08-03 17:28:12,20
2024-11-21,0.4,輝達財報未如預期，加上外資提款影響權值股走勢，市場情緒偏向保守。,2025-08-03 17:28:14,20
2024-11-26,0.6,AI 概念股財報亮眼，市場對產業前景樂觀，但整體經濟與政治因素干擾大盤表現，投資人觀望氣氛濃厚。,2025-08-03 17:28:48,20
2024-11-27,0.3,市場觀望川普課稅影響，權值股疲軟拖累大盤，電子、金融與傳產全面走弱，短期信心不足。,2025-08-03 17:28:50,20
2024-11-28,0.3,日月光導入 SAP 人資雲加速全球整合與數位轉型，展現企業數位化決心，但短期內仍面臨市場需求疲弱、庫存調整等挑戰，影響投資人信心。,2025-08-03 17:28:53,20
2024-11-29,0.6,電子權值股普遍走弱，台積電失守千元大關拖累大盤，但日月光等個別強勢股支撐市場情緒。,2025-08-03 17:28:54,20
2024-12-02,0.6,美股上揚帶動台股反彈，權值股領軍大盤收復季線，但成交量未能有效放大，市場情緒仍偏觀望。,2025-08-03 17:28:57,20
2024-12-03,0.7,台積電領漲帶動大盤反彈重返2萬3千點關卡，半導體及電子股走強，市場情緒轉趨樂觀，但仍需留意後續量能與個別族群表現。,2025-08-03 17:29:00,20
2024-12-04,0.6,台積電領漲帶動指數上攻，搭配光通訊與 BBU 概念股強勢表現，激勵市場情緒向上，但塑膠及紡織類股相對疲弱，整體而言維持中性偏正面。,2025-08-03 17:29:02,20
2024-12-05,0.6,電子權值股漲跌互現，資訊服務類股表現亮眼，千金股續強，整體市場情緒偏正面，但個別族群與公司表現仍有差異。,2025-08-03 17:29:04,20
2024-12-06,0.6,權值股漲跌互現，台積電走弱拖累大盤，但日月光等電子五哥齊心走紅，資安及營建股擔綱演出，三大法人合計賣超 20.89 億元。,2025-08-03 17:29:07,20
2024-12-08,0.6,外資買超與作帳行情啟動帶來正面支撐，但指標仍需補量以利多頭續攻。,2025-08-03 17:29:08,20
2024-12-10,0.3,權值股普遍走弱拖累大盤，營收與展望不佳的個股表現疲軟，但部分電子股逆勢抗跌，市場情緒偏向保守。,2025-08-03 17:29:10,20
2024-12-11,0.3,美股四大指數全面下跌拖累台股半導體股走弱，加上缺乏明顯買盤支撐，日月光等電子權值股同步下挫，市場情緒偏向保守。,2025-08-03 17:29:13,20
2024-12-12,0.6,權值股回神與市場情緒好轉提振大盤反彈，電子族群領漲但汽車零組件也有表現。,2025-08-03 17:29:14,20
2024-12-13,0.6,權值股漲跌互見，高價股強勢表現與中美晶集團利空消息影響個股走勢，使市場情緒偏向保守。,2025-08-03 17:29:16,20
2024-12-16,0.7,"美科技股上周五收漲，帶動台股早盤大漲逾 240 點，但中小型股依舊疲弱，櫃買指數翻黑。權值股漲跌互現，台積電漲幅 1.87%，貢獻大盤漲點 168.81 點。

====================

總體結論:
0.6
美科技股上周五收紅帶動台股早盤強彈，但中小型股表現疲弱，權值股漲跌互見。整體而言，市場情緒偏正面但仍有不確定性，預計後市將持續觀望 FOMC 會議結果。

====================

請注意以上分析僅供參考，不代表任何投資建議或實際交易行為。",2025-08-03 17:29:20,20
2024-12-17,0.6,台積電股價波動影響大盤走勢，日月光等權值股表現平穩，市場情緒偏向正面但不確定性仍在。,2025-08-03 17:29:22,20
2024-12-18,0.6,新鉅科出售廠房案由矽品承接，顯示半導體產業對擴張仍有需求，但市場對 AI 族群表現持保守態度。,2025-08-03 17:29:24,20
2024-12-20,0.5,市場情緒維持中性，個股表現分歧，權值股疲弱但營建與網通類股相對強勢。,2025-08-03 17:29:32,20
2024-12-22,0.3,設備廠擴產與籌資案反映對未來成長的信心，但市場需求展望仍不明朗，短期內營收表現恐受壓抑。,2025-08-03 17:29:34,20
2024-12-23,0.7,電子指標股領漲與權值股強勁反彈推升大盤大漲，市場情緒回溫但仍需留意耶誕新年假期影響。,2025-08-03 17:29:35,20
2024-12-24,0.6,電子權值股普遍走強，尤其是台積電再度挑戰歷史新高價位，帶動大盤上揚，但漲幅略有收斂且成交量減少，顯示市場觀望氣氛濃厚。,2025-08-03 17:29:37,20
2024-12-25,0.9,美股平安夜收紅、科技股表現亮眼，台股持續反彈，電子權值股穩健上漲，加上機器人概念股強勢點亮盤面，整體市場情緒樂觀，推升股價向上。,2025-08-03 17:29:40,20
2024-12-26,0.6,日月光在 ESG 方面持續獲得國際肯定，展現企業永續經營能力，激勵市場對其長期營運前景的正向期待。,2025-08-03 17:29:42,20
2024-12-27,0.6,市場情緒偏向正面，權值股漲跌互現且生化股強勢表現，但日月光等個別權值股走弱影響整體漲幅。,2025-08-03 17:29:43,20
2024-12-29,0.6,內資主導年底作帳行情與外資買超大型電子股帶動市場信心，但美債殖利率上升與聯準會立場恐影響多方意願。,2025-08-03 17:29:45,20
2024-12-30,0.6,市場情緒偏向正面，主要受惠於與軍工、無人機概念股表現亮眼，但權值股走勢疲弱且成交量萎縮，顯示投資人觀望氣氛濃厚。,2025-08-03 17:29:47,20
2024-12-31,0.3,台股封關日受美股拖累開低走低，權值股普遍疲軟，但部分中小型股逆勢抗跌，整體市場情緒偏向保守。日月光投控舉辦青少年永續創新競賽，展現對永續發展的重視與支持，但短期內相關新聞對股價影響有限。,2025-08-03 17:29:51,20
2025-01-02,0.6,牧德科技轉型效益顯現，營收與獲利成長動能強勁，激勵市場對未來發展前景的正面期待。,2025-08-03 17:29:52,20
2025-01-03,0.6,權值股漲跌互現，AI、無人機概念股強勢表態，綠能類股受惠政策利多，整體市場情緒偏正面但漲幅有限。,2025-08-03 17:29:54,20
2025-01-06,0.7,台積電領漲帶動半導體族群強彈，日月光等大型電子權值股同步走揚，市場情緒回溫但仍需留意個別公司基本面展望。,2025-08-03 17:29:57,20
2025-01-07,0.6,半導體設備需求強勁帶動產業擴張，但籌資案與營收表現仍需關注，市場情緒偏正面但謹慎。,2025-08-03 17:30:00,20
2025-01-08,0.3,美元反彈與主要亞幣走貶壓力加劇匯市波動，新台幣重貶並失守重要關卡，外資動向與出口商惜售行為影響交易量能，股匯雙跌引發市場信心疑慮。,2025-08-03 17:30:03,20
2025-01-09,0.3,電子權值股走弱、航運殺盤重心及資訊族群回檔，拖累大盤下跌 326 點，收在 23081 點。三大法人合計賣超 430 億元，其中外資連賣二日，投信則連賣四日。,2025-08-03 17:30:07,20
2025-01-10,0.7,營收表現符合預期且先進封裝需求穩健，激勵市場情緒但經濟環境與旺季效應不如往年仍是隱憂。,2025-08-03 17:30:09,20
2025-01-13,0.3,半導體設備業者營收與獲利成長動能趨緩，加上台股大跌拖累，市場對產業展望轉為謹慎保守。,2025-08-03 17:30:11,20
2025-01-14,0.6,市場觀望氣氛濃厚，權值股走勢分歧，整體大盤反彈力道有限，但個別產業如金融、傳產族群表現相對強勁。,2025-08-03 17:30:13,20
2025-01-15,0.9,黃仁勳親訪矽品精密參觀潭科廠並共同揭牌，顯示雙方合作關係緊密，外資預估日月光先進封測業績將再翻倍成長。,2025-08-03 17:30:15,20
2025-01-16,0.6,輝達執行長親訪矽品新廠，展現雙方合作關係，激勵市場對 AI 產業前景樂觀，但仍需留意半導體庫存調整影響。,2025-08-03 17:30:18,20
2025-01-17,0.7,台積電法說釋出強勁成長展望，激勵市場情緒，但權值股漲跌互現且台積電翻黑，指數由紅翻黑，跌破月線與季線。鋼鐵、觀光餐旅類股走強，AI 族群表現亮眼。整體而言，市場對於台積電法說內容反應正面，但漲多後獲利了結賣壓出籠，使得指數由紅翻黑，呈現高檔震盪格局。,2025-08-03 17:30:21,20
2025-01-18,0.9,"輝達執行長親臨台灣並與台積電、日月光等重要合作夥伴互動，顯示雙方關係密切且產能擴張計畫順利推進，激勵市場對未來成長前景的樂觀期待。

0.5
財政部統計處公布去年稅收超徵4972億元創歷史次高，顯示整體經濟表現仍維持正向，但個別產業與公司獲利狀況仍有差異，市場情緒中性。",2025-08-03 17:30:24,20
2025-01-20,0.7,AI 概念股與 CPO 供應鏈受惠題材激勵市場情緒，權值股普遍走揚推升大盤上漲，但成交量未能放大顯示買氣仍有疑慮。,2025-08-03 17:30:26,20
2025-01-21,0.6,地震影響有限，但 AI 題材與川普政策利多激勵市場情緒，預期指數維持高檔整理。,2025-08-03 17:30:28,20
