title,keywords,content,publish_at,id,summary,related_stocks,uuid
TDR定位不明恐侵害人權釀冤獄？金管會提三大聲明澄清,"['TDR', '金管會', '台灣存託憑證', '證交法']","近期媒體報導，立法院財政委員會日前召開公聽會，部分與會學者認為 TDR 未於證交法或依該法核定為有價證券之函令中明確列舉，未符法律明確性及罪刑法定主義，恐釀成冤獄，而有損害人權之虞，對此，金管會今 (16) 日提出三大聲明，強調 TDR 屬其他有價證券範疇，應受我國證券管理法令規範，不法行為的構成要件及刑事責任已有明確規定，符合罪刑法定主義及刑罰明確性原則，尚無違反人權之虞。


立法院日前舉行證交法修正草案公聽會，部分與會學者認為台灣存託憑證（TDR）未於《證交法》或依該法核定為有價證券之函令中明確列舉，未符法律明確性及罪刑法定主義，在 2012 年修法頒布前，已有 4 名投資人因買賣 TDR 涉炒作，遭法院依違反《證交法》判刑定讞，有損害人權之虞。


關於媒體報導「TDR 定位不明恐侵害人權」，金管會說明如下：


一、按 TDR 係表彰外國有價證券之憑證，核屬前財政部證券管理委員會 76 年 9 月 12 日（76）臺財證（二）字第 00900 號公告 (下稱 900 號公告) 核定應受我國證券管理法令規範之有價證券，屬證交法第 6 條第 1 項所稱經主管機關核定之其他有價證券範疇，應受我國證券管理法令規範，且證交法相關條文就各類證券不法行為之構成要件及刑事責任已有明確規定，亦為司法實務肯認符合罪刑法定主義及刑罰明確性原則，爰依法訴追不法行為者之刑事責任，以維護證券市場秩序及保障投資人權益，尚無違反人權之虞。


二、該次公聽會亦多位學者認為，我國證交法第 6 條有價證券之規範架構係與美國與德國立法體例相同，符合法律明確性及罪刑法定主義，並無損害人權或擴張解釋之虞：


(一)判斷是否為有價證券時，應考慮實質 (經濟特性) 而非形式或名稱，TDR 實質權利義務等同於外國股票，係屬 900 號公告核定為有價證券之範疇；同時，TDR 係依證交法募集發行並於證交所 (櫃買中心) 掛牌交易，投資人應可預見意圖影響 TDR 價格之炒作與操縱等不法行為之可罰性，    與近期憲法法庭 112 年憲判字第 5 號判決所闡釋之刑罰明確性及授權明確性之判斷標準相符。


(二) 學者並指出美國及德國為因應金融市場快速變化，亦未於證交法中明確列舉存託憑證，均採「有限列舉，概括授權」方式授權主管機關訂定，如德國規範存託憑證係屬證交法第 2 條所稱「代表股票的憑證」，美國 1933 年即於證交法第 2 條定義有價證券，並於 1946 年 Howey Test 確立判斷特性，目前仍為判斷後續各類新興金融商品是否為有價證券之基礎，故金管會依 76 年發布之 900 號公告認定 TDR 為證交法第 6 條規範之有價證券，與國際法規架構類同，未有擴張解釋情形。


三、有鑑不法炒作、操縱有價證券之交易行為，影響大多數投資人權益甚鉅，金管會已建立完整法規及市場監視制度，爰依法訴追不法行為者之刑事責任，方可維護證券市場秩序及保障投資人權益，落實證交法保障投資之立法意旨，尚無違反人權之虞。",2023-05-16 18:04:42,9910,TDR 定位不明恐侵害人權釀冤獄？金管會提三大聲明澄清,[],0226153f-3050-445c-b298-0b39f017681f
周休三日台股準備好了嗎？金管會示警：恐削減資本市場競爭力,"['台股', '周休三日', '金管會', '券商', '資本市場']","台灣是否「周休三日」為近期熱門話題，金管會今 (16) 日不諱言表示，周休三日若實施，恐削減台灣在資本市場上的競爭力，以及券商的獲利，因為「我們休息、別人交易，投資人可能會有疑慮」。


1998 年 1 月 1 日，全台灣開始施行隔周周休二日；2001 年 1 月 1 日起，實施周休二日，也就是說，周休二日至今已實施長達 22 年；由於有台灣民眾日前在公共政策網路參與平台上發起連署「讓台灣成為亞洲第一個週休三日的國家」，截止時已有 5736 人附議，達到連署門檻，政府因此需在 6 月底前回應此連署。


其實早在台灣之前，冰島、日本知名企業松下電器 (Panasonic) 就已導入了週休三日，企業生產力幾乎沒有下降，結果可說是「壓倒性的成功」。英國去 (2022) 年下半年更是舉行全球目前規模最大「周休三日」實驗，企業平均營收更是年增 35%。


因此，台灣是否「周休三日」引發熱議，對此，金管會主祕蘇福隆表示，因為此議題還未成熟，金管會目前金管會對此議題沒有評估，但初步認為對券商、資本市場衝擊較大，未來還是遵循人事總處與勞動部休假規定辦理。


有券商換算，原本交易日有 250 多天，若周休三日實施之後，就會不足 200 天，台股成交量恐減少 20%？證期局官員表示，這樣算不準確，交易天數變少的話，市場環境可能會有應對機制改善，股民也會趁平日時間多交易，成交量未必會等比例減少，不過現在還未精密試算，要等議題成熟再來討論。


但證期局官員坦言，未來如果一個禮拜變成只能交易 4 天，資本市場競爭力就會有疑慮，因為「我們休息、別人交易」，競爭力可能會有疑慮，連帶影響券商獲利。",2023-05-16 18:28:50,9909,台灣是否周休三日？金管會坦言：恐削減台灣資本市場競爭力,[],9cb5f1c1-2b5b-4596-a4cc-255a43a70f04
泰福-KY生物相似藥與Sandoz簽加國獨家授權 Q4啟動銷售,"['泰福', '生物相似藥', '授權', 'sandoz']","泰福 - KY(6541-TW) 今 (16) 日宣布，旗下第一個開發的生物相似藥 TX01 與全球知名藥廠 Sandoz AG 簽署經銷合約，正式授權生物相似藥 TX01、商品名 Nypozi 在加拿大之獨家經銷權，預計今年第四季上市銷售。


根據雙方簽訂的合約，泰福生技將獲得 Sandoz 支付的簽約金，且未來每年的營收主要是來自出貨收入與銷售分潤；至於合作內容，基於保密協議無法透露細節。


董事長閻雲表示，Nypozi 在加國銷售布局的最後一片拼圖，終於完成，產品上市的準備比預期來的繁複、耗時，不過非常高興與 Sandoz 建立合作夥伴關係，相信藉由 Sandoz 在當地累積的生物相似藥銷售經驗及通路網絡，加速 TX01 在加拿大市場的銷售業績。


Sandoz AG 為全球學名藥與生物相似藥的國際大廠，隷屬全球著名藥廠 Novartis 集團，對於生物相似藥與癌症用藥等藥品在歐美具有拓展市場與豐富的銷售經驗。泰福生技與 Sandoz 完成簽約之後，Nypozi 在加國的銷售計畫將全方位開展開來，預計今年第四季正式上市。


泰福生技旗下重組蛋白生物相似藥 TX 01，用於癌症化學治療所引起的嗜中性白血球減少症，除了在加國趕拼銷售規劃之外，TX 01 的美國藥證之路也全速前進，泰福生技 4 月底已正式向美國 FDA 重提 TX 01 藥品上市查驗登記審查申請。",2023-05-16 18:33:42,9908,泰福 - KY(6541-TW) 今 (16) 日宣布，旗下第一個開發的生物相似藥 TX01 與全球知名藥廠 Sandoz AG 簽署經銷合約，正式授權生物相似藥 TX01、商品名 Nypozi 在加拿大之獨家經銷權，預計今年第四季上市銷售。,['泰福-KY'],7f417f52-5340-4459-9aab-031b0bfb210b
經濟部組織法三讀通過 成立商業署、能源署,"['經濟部', '組織改造', '商業署']","「經濟部組織法」三讀通過，將原有 11 個業務單位、6 個輔助單位及 13 個行政機關，整併為 6 個業務單位、6 個輔助單位及 10 個三級行政機關，其中商業司升格為商業發展署、能源局升格為能源署、貿易局升格為國際貿易署。 


經濟部表示，原有 11 個業務單位、6 個輔助單位及 13 個行政機關，整併為 6 個業務單位、6 個輔助單位及 10 個三級行政機關。包含：經濟部商業發展署、經濟部產業發展署、經濟部國際貿易署、經濟部能源署、經濟部中小及新創企業署、經濟部水利署、經濟部智慧財產局、經濟部產業園區管理局、經濟部標準檢驗局、經濟部地質調查及礦業管理中心。 


經濟部表示，本次組織改造預期將達成「事權統一」、「組設優化」、「資源整合」 、「能量擴散」、「政策落實」等目標。 


首先是事權統一，增進管理效能，整併相關業務區塊，統合事權及各項專業資源與人力，例如整併經濟部資訊中心及所屬部分機關資訊單位成立「資訊處」；整併經濟部商業司及中部辦公室成立「商業發展署」；整併國際貿易局、經濟部國際合作處及貿易調查委員會成立「國際貿易署」，建構政策推展整體性，益於分配運用資源，發揮業務整合綜效。 


第二則是組設優化，改善行政流程：「水利署」、「智慧財產局」及「標準檢驗局」雖維持原機關層級，仍依核心職能就其內部組設進行通盤檢討，將功能執掌相近的單位及業務進行整併或專責化，以改善行政流程及效率、節省人力資源，提升施政效能。 


第三、資源整合，締造永續經濟。因應氣候變遷與自然環境的不確定性，經濟開發亦須兼顧能資源的合理利用，「水利署」續留經濟部，益於有效整合民生與產業用水，推動承洪韌性。 


另外，設立「地質調查及礦業管理中心」則可就礦產開發結合全方位地質管理，達成資源合理利用及經濟發展永續。 


第四、能量擴散，提高服務品質：「產業園區管理局」成立，有助於將科技產業園區單一窗口服務能量擴散至產業園區，同時爭取輔導資源挹注，並導入智慧化管理模式，強化各園區管理，提高整體服務品質。 


第五、政策落實，彰顯施政理念：本次「產業發展署」、「國際貿易署」、「能源署」及「中小及新創企業發展署」由局處改制為署，成為負責政策擬定及推動的重要三級機關，充分彰顯政府對產業轉型、經貿格局拓展、能源轉型及淨零排放與扶植中小及新創企業等重大政策之重視。",2023-05-16 18:37:44,9907,「經濟部組織法」三讀通過，將原有 11 個業務單位、6 個輔助單位及 13 個行政機關，整併為 6 個業務單位、6 個輔助單位及 10 個三級行政機關，其中商業司升格為商業發展署、能源局升格為能源署、貿易局升格為國際貿易署。 ,[],230e1840-a9be-4e4c-b04f-fbda2d4f383b
電信三雄提升偏鄉網路不遺餘力 擴增5G網路建設,"['電信', '中華電', '遠傳', '台灣大', '偏鄉']","電信三雄提升偏鄉網路不遺餘力，不只積極增設 5G 網路建設，降低城鄉數位服務落差，同時在偏鄉積極導入不同應用，包含導入 5G MR 沉浸式教學、加山計畫、遠距診療平台等。


中華電 (2412-TW) 董事長郭水義表示，過去一年加速建設 5G 基地台，運用全台 4G/5G 最大頻寬資源，全面提升行動網路速度與服務品質，截至去年底 5G 已涵蓋全國 22 縣市，並率先實現全國 368 鄉鎮區皆有 5G 涵蓋目標。


此外，後續將配合政府政策，從都會到偏鄉再至山林地區，持續擴大全台 5G 通信涵蓋，並協助政府加速偏鄉地區數位服務建設、降低城鄉數位服務落差及健全數位發展之政策目標，積極改善偏鄉及山林地區行動通訊信涵蓋。


台灣大 (3045-TW) 指出，5G 開台即投入偏鄉 5G 建設，自 4G 時代即動員上萬名人力走入村落、離島及山林佈建網路基礎建設，並於各類步道設置可通訊告示牌逾千面，偏鄉人口涵蓋率超過 97.8%，包含嘉明湖、司馬庫斯等知名景點也通訊順暢。


另外在軟體方面，運用核心職能，以「用科技擁抱愛」為主軸，發展數個偏鄉數位共融專案，包含連袂數位部共同於南投縣竹山鎮鯉魚國小參與「Coding Fun 偏鄉玩程式」營隊成果競賽，活動中導入 5G MR 沉浸式教學，啟發孩童學習動機，讓科技種子在偏鄉發芽。


遠傳 (4904-TW) 自 2015 年起啟動「加山計劃」，至今八年有成，陸續和羅東、新竹、東勢、南投、嘉義、屏東、臺東、花蓮八大林管處，以及雪管處、玉管處、自管處、新北市觀旅局等單位合作，動員破萬人次的工程人員前進全台偏遠山區。


此外，自主開發遠距診療平台，可整合醫療院所系統、虛擬健保卡認證、電子病歷，並運用 5G 高頻寬、低延遲特性，即時傳輸醫學影像並由遠端的專科醫師即時判讀，使專科醫師較為缺乏的偏鄉民眾，得以就近在衛生所看診，至今已遍及 12 縣市、35 鄉鎮，服務超過 3 萬人次。",2023-05-16 18:38:43,9906,電信三雄提升偏鄉網路不遺餘力，不只積極增設 5G 網路建設，降低城鄉數位服務落差，同時在偏鄉積極導入不同應用，包含導入 5G MR 沉浸式教學、加山計畫、遠距診療平台等。,"['中華電', '台灣大', '遠傳']",36e74289-bb0c-4b89-a5ee-5fcd5a7932fa
和泰車擴大結盟充電營運商 率先推充電漫遊,"['和泰車', '充電', '電動車', 'lexus', '華城']","和泰車 (2207-TW) 代理的 Lexus 首台以 e-TNGA 平台打造的電動車 RZ 450e 今 (16) 日舉辦上市發表會，繼日前全台巡迴舉辦城市試駕活動後，和泰車首度公布正式售價為 279 萬元，首波配額僅 30 台，而為配合 RZ 450e 導入，和泰車將擴大與外部充電營運商進行策略聯盟，並率先推出充電漫遊功能。


和泰車說明，Lexus 除了先前建置的 6 座據點快充站，預計於中和所、南港所、新竹所、北台中所、嘉義所和建國所共再增建 6 座據點快充站，以提升充電覆蓋率。


同時，和泰車將積極和外部充電營運商擴大策略聯盟，藉此持續完善全台充電網絡布建，並以 LEXUS Plus App 整合據點快充站和充電漫遊服務 OpenHub 資源，首波串起包括華城電能 EVALUE、U-POWER、起而行綠能，未來也即將加入和潤電能、Noodoe、iCharging 和連展電能的充電服務，率先各品牌推出充電漫遊的功能。


未來 Lexus 車主將可透過 LEXUS Plus APP，啟動包含據點和合作營運商超過 300 座快慢充站點、600 支以上充電樁的充電服務。


RZ 450e 搭載 71.4kWh 鋰電池模組，擁有 397 公里續航里程，分別支援 CCS1 的 DC 快充與 SAE J1772 的 AC 慢充，快充可接受最高至 150kW 的充電功率，而慢充則是最高 7kW 的充電功率，若使用快充為車輛充電，半小時即可將車輛自低電量警示補充至 80% 電力，若使用慢充則需 10 個小時可自顯示低電量完成 100% 充電，車上更附上一組可接上一般家用 110V 插座的旅充線，提高便利性。",2023-05-16 18:47:46,9905,和泰車擴大結盟充電營運商 率先推充電漫遊,['和泰車'],c2428557-5bab-43f7-919d-5da4017cf62f
華晶科估今年營收下滑 但業務組合變化有利獲利率上揚,"['華晶科', '營收', 'OEM', 'DMS']","在市場持續進行消費電子產品的庫存去化同時，華晶科技 (3059-TW) 對 2023 年營收看法保守，預估上半年的單月營收都將維持在 7-8 億元的水位，全年營收將明顯出現較去年的 140 億元明顯衰退，法人估，全年華晶營收將在 95-99 億元間，不過毛利率將優於去年的 20.66%。


華晶科今天出席券商法人座談會，對 2023 年第一季財報營收 22.54 億元，年減 36.92%，分析其中營收比重以車用 41% 最高，其次為醫療產品 38%，OEM 的組裝業務下滑到 16%，3D 感測的相機產品 3%，ISP 晶片降爲 2%，但華晶科認為由於今年低毛利率 OEM 組裝業務下滑趨勢明顯，雖然預估全年營收下滑，但毛利率將優於去年全年的 20.66%。


同時，在晶片事業 ISP 影像晶片今年擱置客製化晶片業務接單，也有助於成本的控制，提升營業利益率向上。


而華晶科主要車用產品出貨為車用感測相機 DMS(Driver Montioring System)，財務長陳矢學指出，DMS 相機主要在應用於駕駛艙對內及對外兩大監控系統，除對外監控道路環境之外，也監控駕駛人駕車狀態，華晶科指出，車用感測相機 DMS 目前多使用於商用車隊管理，多數爲車輛出廠後選擇配置，華晶科也看到車廠在車輛出廠前配置的市場機會。


同時，在目前個人使用車輛配備自動駕駛功能日益普及的同時，在爲防止車禍發生，未來也看到 DMS 運用於個人轎車輔助使用的機會。


華晶科技將其影像處理的核心技術應用於四大智能影像解決方案包括 AIoT、智慧車、機器人、精準醫療等業務，今年看到精準醫療部門仍呈現穩定。


華晶科 2023 年第一季營收 22.54 億元，毛利率 22.38%，季增 0.06 個百分點，年增 2 個百分點，稅後 6636 萬元，年減 46.17%，每股純益 0.24 元",2023-05-16 19:01:50,9904,在市場持續進行消費電子產品的庫存去化同時，華晶科技 (3059-TW) 對 2023 年營收看法保守，預估上半年的單月營收都將維持在 7-8 億元的水位，全年營收將明顯出現較去年的 140 億元明顯衰退。,['華晶科'],fbc3cdec-e186-49a6-b0b9-efdfd56c414e
Q1附委託衝破5000億元 債券投資價值浮現 年增近4倍,"['永豐金證', '債券', '升息']","據券商公會統計，今年第一季複委託零售成交金額突破 5000 億元，衝上 5065 億台幣，年增幅高達 21%，以債券類表現最亮眼，第一季即創下成交量 545 億元，年增率高達 395%。永豐金證券分析指出，債券價格在這一波升息影響回落低檔，投資價值浮現。


面對升息和通膨壓力，市場回跌，第一季複委託開始吸引投資人朝海外投資，各類投資標的均見強勁動能，股票、債券和結構型商品三大產品連袂成長，年增率分別為 12%、395% 和 29%，定期存股成交量也繼續成長，其中，永豐金證券以 24.6% 的市占居零售市場龍頭。


永豐金證券分析指出，債券成交量大幅翻揚，主要原因是聯準會目標利率 5-5.25% 來到 10 年來高點，債券價格回落低檔區，投資人逢低布局操作，去年第一季的成交金額僅 110 億元，今年爆增至 545 億元。


從交易地區來看，複委託零售交易量依序為美國成交量 3934 億元，占比達 78%，其次為香港 586 億元，占比 12%。


永豐金證券看好，投資人在歷經美股升息下跌等考驗後，迎來布局新機會，可觀察到，第一季標普 500 指數上漲 7.03%、納斯達克指數上漲 16.77%，聯準會也因銀行倒閉事件放緩升息速度，甚至下半年有望啟動降息，整體美股市場投資氛圍樂觀，進而帶動國人投資美股參與複委託交易。


永豐金證券研究顯示，升息結束後 1 年，股票累積報酬有望呈雙位數漲幅，目前市場共識升息循環進入尾端，近期美股本益比回落，建議投資人可藉由「大戶投」、「新理財網」等各電子交易平台投資個股參與市場成長機會，也可使用「豐存股 - 美股」平台投資 ETF 擴大投資範圍、分散風險。",2023-05-16 19:16:25,9903,Q1 附委託衝破 5000 億元 債券投資價值浮現 年增近 4 倍,[],0ca4773a-9f55-48c9-90d4-d66f3ce9b8c2
回歸反彈盤？迅杰、普安、樺漢、大世科如何看待？,"['趨勢分析', '楊惠珊', '五福臨門', '永誠投顧']","上週相信大家都渡過了不好過的一週，債務上漲 + FED 鷹派言論促使美股表現低迷，台股也同步整理了一段區間，但是在本週開始後，指數已經在 15400 附近形成短線支撐，先前主要下跌的對象主要反應在四月營收與季報表現沒太突出的族群，但沒有太突出不代表不好，先前跌幅比較偏向超跌，如今這些股票也迎來反彈機會。


目前主要能反彈的會是兩個種類，一來就是因盤勢不佳，進而過度壓回的好股票，這些股票分散在許多族群當中，若手中有這類持股的投資朋友，其實可以靜待反彈即可，而若手中沒有這類持股的人，此時反而是一個不錯的進場時機。


迅杰 (6243-TW) 此前隨盤勢壓回月線 37.8 元附近，如今以此為支撐，開始有了強彈表現，迅杰受惠電競周邊 MCU 產品線訂單動能強事，目前 MCU 訂單能見度到已經看到 7 月，也讓其四月營收開出來，月增 17.69%、年增 110.37%，就是我前面說的【因盤勢壓回的好股票】的典型，此時四月營收數字這麼好，更有望突破前高繼續上漲。


普安 (2495-TW) 也是同類型，普安是【儲存解決方案】廠商，主要經營磁碟陣列系統、網路附加儲存系統、儲存軟體以及周邊組件的研發，其最大的題材就是伺服器相關，在先前，普安曾經一度達到 28.2 元的高點，今天即使上漲 6% 也只有 24.7，再加上本身基本面、題材面都沒有問題，讓這中間的段落有望成為反彈空間，投資朋友也可以稍加關注，但要注意觸及前高附近時會有壓力。


以上是「因盤勢而壓回，而存在反彈空間」的上漲題材，而我剛剛說目前比較容易先漲的有兩種，另一種就是美股近期那斯達克指數一枝獨秀，搶先其他指數創高，而那斯達克指數最具代表性的就是【AI 人工智慧】相關題材，台股的 AI 應用也有望受惠。


像我們先前推薦過的【IC 設計四君子】，其中世芯 (3661-TW) 在今日一度來到 1440 元歷史新高價位，創意 (3443-TW) 也逐漸回到前波高點區間，這兩檔之前整理時有許多投資朋友認為題材已經結束，開始看衰，但要我來說的話，AI 智慧衍生出的 IC 設計等題材，近幾年都不會有【題材結束】的那天，壓回都可以視為正常整理現象，反而壓回會產生很多買點，就看眼光是否正確。


大世科 (8099-TW) 是我們【惠珊投資池 2.0 至現在 3.0】都存在的持股，雖然我將它歸類於儲能節電題材，但大世科是大同集團旗下「AI、大數據、雲端、資料中心、資安」等題材都有沾上邊的公司，等於是多變形的軟實力概念股，如今以 AI 智慧題材來上漲，也是理所當然的事，大世科屬於像是世芯、創意那類大股票以外的小額選擇，再加上先前有不小的壓回幅度，投資人可以多多關注。


伺服器龍頭樺漢 (6414-TW) 以產業面而言除了伺服器，還有著【工業電腦】相關題材，兩者都能跟 AI 智慧搭上邊，也有長期需求性。而技術面表現上，樺漢逐步墊高表現穩定，甚至沒有被之前的盤勢整理給影響。屬於基本面優秀、前景性也還不錯的公司，同時因為樺漢是相關概念股的【龍頭】，可以利用它的走勢來預測其他同族群的股票，表現不會相差太遠。


由於字數有限，更多台股產業最全面、最完整的解析，我都會持續在 LINE 當中提及，投資人想免費索取請加 LINE︰@588vip 並留言「我想得到惠珊老師的最新分析」，將會有專人為您服務。


專人諮詢服務｜02-25415555

LINE ID｜
https://lin.ee/cFL6Qcs

FB｜
https://bit.ly/3F3elUD

Youtube｜
https://bit.ly/3mYYyPL

諮詢表單｜
https://forms.gle/QZYzCJFe5445ZB8W7








本公司所推薦分析之個別有價證券

無不當之財務利益關係 以往之績效不保證未來獲利

投資人應獨立判斷 審慎評估並自負投資風險",2023-05-16 19:20:02,9902,無摘要,"['迅杰', '普安', '世芯-KY', '創意', '大世科', '樺漢']",2e4fa7bc-84b1-4e95-aeda-573af3ad6a43
