content,publish_at,id,summary,title,keywords,related_stocks,uuid
"受惠 AI 投資題材與美國聯準會態度轉鴿，全球股市今年以來氣勢如虹，其中台股 2 至 3 月連二月收紅，推升加權指數第一季漲幅達 13.5 %。時局進入第二季，台股多頭氣焰是否能延續、抑或在清明連假後出現漲多「變盤」？此外，近期高股息 ETF 正夯，對於長期投資者抑或是喜歡短打型的投資人而言，何時會是較佳的進場或加碼點？


00944「臺灣趨勢動能高股息 ETF」
(
本基金之配息來源可能為收益平準金）
經理人林怡君表示，根據統計，2015 年底以來觀察 1 至 12 月之月底進場投資台股並持有 3 個月表現，以加權指數為例，平均報酬大約落在 -1.85% 至 + 7.81%，然而若是在 4、5 與 10 月進場投資一季期間平均報酬率可望達 6% 以上，表現最為亮眼。進一步觀察，4 至 5 月恰逢台股公司的股東會密集期，宣布較佳股利配發政策的公司往往獲得資金簇擁，故此時若聚焦「強勢高息股」題材，亦即符合高股息條件同時股價具備正向趨勢動能，以「臺灣趨勢動能高股息指數」為例，4 或 5 月進場並持有 3 個月的平均表現則可望來到 8.8% 左右，成果更勝大盤。


不同月份進場並持有 3 個月平均表現




資料來源：Bloomberg、臺灣指數公司，2015/11/17-2024/2/29，分別採加權 (總報酬) 指數與臺灣趨勢動能高股息 (總報酬) 指數月底進場計算 3 個月報酬。本基金主要係採用完全複製法追蹤標的指數之績效表現為目標，然因基金必要費用、為因應申贖及指數調整等之相關交易、為維持曝險比例而從事證券相關商品交易及視特殊情形需要採最佳化複製法等因素，仍可能使本基金偏離標的指數之表現。
以上僅為標的指數成分股歷史資料回測結果，不代表本基金之未來績效保證。投資人無法直接投資指數，本資料僅為市場歷史數值統計概況說明，非基金績效表現之預測。




野村投信策略暨行銷處資深副總經理黃宏治表示，今年以來台股表現勢不可擋，台股相關 ETF 也跟著大放異彩，包括近期募集的高股息 ETF 更掀起民眾熱議與申購熱潮。繼 00939、00940 的熱賣後，後續核准募集的台股 ETF 清單滿滿，讓人眼花撩亂。同樣也是訴求高股息 ETF – 00944「臺灣趨勢動能高股息 ETF」(本基金之配息來源可能為收益平準金）也即將展開募集，料將「強勢」吸睛。究竟訴求「強勢高息股」的 00944「臺灣趨勢動能高股息 ETF」(本基金之配息來源可能為收益平準金）有什麼特別之處？黃宏治指出，這檔「臺灣趨勢動能高股息 ETF」(本基金之配息來源可能為收益平準金）是台股主動式基金常勝軍 - 野村投信踏入被動型 ETF 的第二檔產品。其第一檔 ETF00935 「野村臺灣創新科技 50 ETF」，於 2023 年 11 月 1 日掛牌至今，規模成長接近 6 倍，從成立時的新台幣 10.65 億來到最新 57.8 億 (資料來源：CMoney，截至 2024/4/2)。00935 吸引了不少「ETF 精品收藏家」，並且在這波 AI 科技浪潮中成為面子裡子雙贏的新起之秀。


野村投信策略暨行銷處資深副總經理黃宏治進一步表示，野村投研團隊深耕台股市場多年，借鑒主動式選股成功經驗，進軍被動式市場，無論是聚焦科技的野村臺灣創新科技 50 ETF、抑或是近期推出的「野村臺灣趨勢動能高股息 ETF」(本基金之配息來源可能為收益平準金），其追蹤指數在篩選成分股上都具備相當獨到創新的「方法論 (methodology)」。舉例來說，臺灣趨勢動能高股息指數就導入市面獨特創新的「動能」與「股利」雙指標，從市值前 300 大上市櫃公司，篩選出「夠大、流動性高、有獲利、永續」等具備基本好公司條件、同時又符合「強勢」與「高息」的 50 檔精選成分股。


林怡君進一步說明，所謂的「動能指標」，係採用「還原收盤價占最近 52 週還原收盤價最高點之比例」，愈高代表該個股的股價表現愈強勢，以期選出具備正向「趨勢動能」的強勢股。在「股利指標」方面，追蹤指數除了定期於每年 5 月股東會旺季調查「確定股利率」以網羅股利資優生，並會在 11 月透過創新的「預估股利」(即採用國際知名 FactSet 預估該公司未來每股盈餘 (EPS)，再乘上該公司過去 3 年平均股利發放率) 來提前卡位股利潛力股。成分股每年 5 月及 11 月定期調整兩次，以確保持股同時維持動能也符合高股息的要求。此外，除權息行情是每年台股的大事之一，這也是為什麼統計上 4 至 5 月進場台股持有一季有好表現機會更大；而 2024 年更值得期待，因為聯準會 3 月利率會議後鴿派態度定調，有利全球股市資金行情持續。在台股方面，資金料將持續追求收益水準較具吸引力之標的，因此無論清明連假是否變盤，對於短打型抑或屬於長期投資再加碼的投資人，均可把握 4-5 月的高勝率機會開始分批進場佈局，特別是應該聚焦高股息題材、同時股價具備正向趨勢動能之標的，例如「臺灣趨勢動能高股息 ETF」(本基金之配息來源可能為收益平準金），是目前唯一同時透過「動能指標」與「股利指標」雙重篩選出「強勢高息股」投資題材之高股息 ETF，有助掌握台股息利雙收的投資機會。


「臺灣趨勢動能高股息 ETF」(本基金之配息來源可能為收益平準金），將於 4 月 22 至 24 日募集、預計 5 月 9 日掛牌，投資人可以用每股 15 元掛牌價格輕鬆購入，該 ETF 具備月配息機制與平準金設計，預計第一次除息時間落在 7 月中，可立即參與今年度台股除權息行情，投資正逢時。銷售機構：富邦證券、國泰證券、統一證券、永豐證券、中國信託證劵、元大證劵、華南永昌證劵、凱基證劵、群益金鼎證劵、元富證劵、兆豐證劵、國票證劵。


>>> 閱讀更多精彩文章


野村投信

野村投信於 1998 年成立，為日商野村資產管理及香港 Allshores 集團等專業投資團隊所組成之合資企業。野村投信為高盛、晉達、野村基金 (愛爾蘭系列) 及駿利亨德森系列基金在台灣之總代理。截至 2023 年 12 月底，投信基金、境內全權委託與境外基金總代理在台規模共計新台幣 5,863 億元，居所有台灣資產管理業 (基金) 公司第 9 名。野村投信自 2018 年起連續三年榮獲亞洲資產管理雜誌台灣區最佳退休基金公司，以及連續四年獲最佳股票經理公司肯定(2020~2023)；且於 2014、2015、2016 及 2017 連續四年榮獲理柏台灣基金獎混合型團體大獎肯定。(資料來源：投信投顧公會(2022/12)；理柏(2014~2017)；亞洲資產管理雜誌(2023/01))


上述 ETF 基金經金管會核准或同意生效，惟不表示絕無風險。本公司以往之經理績效不保證基金之最低投資收益；本公司除盡善良管理人之注意義務外，不負責基金之盈虧，亦不保證最低之收益，投資人申購前應詳閱基金公開說明書。
基金買賣係以投資人自己之判斷為之，投資人應瞭解並承擔交易可能產生之損益，且最大可能損失達原始投資金額。基金不受存款保險、保險安定基金或其他相關保障機制之保障。如因基金交易所生紛爭， 台端得先向本公司申訴，如不接受前開申訴處理結果或本公司未在三十日內處理時，得在六十日內向金融消費評議中心申請評議。 台端亦得向投信投顧公會申訴、向證券投資人及期貨交易人保護中心申請調處或向法院起訴。
有關本基金之特性、相關投資風險及應負擔之費用已揭露於基金之公開說明書中，投資人可向本公司及基金之銷售機構索取，或至公開資訊觀測站及本公司網站 (https://www.nomurafunds.com.tw) 中查詢。本基金之特性、相關投資風險及投資人應負擔之成本費用等資訊，請詳閱基金公開說明書。本基金自成立日起，即得運用基金進行投資組合佈局，基金投資組合成分價格波動會影響基金淨值表現。基金自上市日或上櫃日起以追蹤標的指數之績效表現為投資目標，基金之投資績效將視其追蹤之標的指數之走勢而定，當標的指數波動劇烈時，基金之淨資產價值將有較大的波動風險。投資人於成立日 (不含當日) 前參與申購所買入之每受益權單位之發行價格，不等同於基金掛牌上市或上櫃後之價格，參與申購之投資人需自行承擔基金成立日起至上市日或上櫃日止期間之基金淨值波動所產生的風險。
本基金自成立日起至上市日前一個營業日止，經理公司或所委任之基金銷售機構不接受本基金受益權單位數之申購或買回。本基金受益憑證上市或上櫃後之買賣成交價格應依臺灣證券交易所或財團法人中華民國證券櫃檯買賣中心有關規定辦理，且無升降幅度限制。本基金受益憑證之上市買賣，應依證券交易市場有關規定辦理。本基金於上市日後將依臺灣證交所規定於臺灣證券交易時間內提供盤中估計淨值供投資人參考。計算盤中估計淨值因評價時點及資訊來源不同，與實際基金淨值計算或有差異，投資人應注意盤中估計淨值與實際淨值可能有誤差值之風險，經理公司於臺灣證券交易時間內提供的盤中估計淨值僅供投資人參考，實際淨值應以本公司最終公告之每日淨值為準。本基金配息率不代表基金報酬率，且過去配息率不代表未來配息率；基金淨值可能因市場因素而上下波動，於獲配息時須一併注意基金淨值之變動。投資人可至經理公司網站 (www.nomurafunds.com.tw) 或致電客服中心查詢。
本文提及之經濟走勢預測不必然代表本基金之績效，基金投資風險請詳閱基金公開說明書。本資料係整理分析各方面資訊之結果，純屬參考性質，本公司不作任何保證或承諾，請勿將本內容視為對個別投資人做基金買賣或其他任何投資之建議或要約。本公司已力求其中資訊之正確與完整，惟不保證本報告絕對正確無誤。未經授權不得複製、修改或散發引用。以上所提個股僅為舉例說明，非為個股推薦。
投資人申購本基金係持有基金受益憑證，而非本文提及之投資資產或標的。
【野村投信獨立經營管理】

指數免責聲明：「臺灣指數公司特選臺灣上市上櫃 FactSet 臺灣趨勢動能高股息指數 (簡稱「臺灣趨勢動能高股息指數」)」係由臺灣指數股份有限公司（臺灣指數公司）及財團法人中華民國證券櫃檯買賣中心(櫃檯買賣中心) (以上機構合稱「合作單位」) 共同開發，並由臺灣指數公司單獨授權野村證券投資信託股份有限公司使用發行「基金」。「合作單位」並未以任何方式贊助、背書、出售或促銷「基金」，且「合作單位」亦未明示或默示對使用指數之結果及 / 或指數於任一特定日期之任一特定時間或其他時間之數據提供任何保證或聲明。指數係由臺灣指數公司所計算。然「合作單位」就指數之任何錯誤、不正確、遺漏或指數資料之傳輸中斷對任何人均不負任何責任，且無任何義務將該等錯誤、不正確或遺漏通知任何人。

野村投信為高盛、晉達、野村基金 (愛爾蘭系列) 及駿利亨德森系列基金在台灣之總代理。【野村投信獨立經營管理】

野村證券投資信託股份有限公司 ，110615 台北市信義路五段 7 號 30 樓，理財諮詢專線 02-8758-1568


本公司提供之新聞稿，均依照投信投顧會員及其銷售機構從事廣告及營業活動行為規範，若須重製或編製新聞稿，應以公司公開資料為主，不得誇大不實。
        AMK01-240400007",2024-04-03 10:49:23,19337,受惠 AI 投資題材與美國聯準會態度轉鴿，全球股市今年以來氣勢如虹，其中台股 2 至 3 月連二月收紅，推升加權指數第一季漲幅達 13.5 %。時局進入第二季，台股多頭氣焰是否能延續、抑或在清明連假後出現漲多「變盤」？此外，近期高股息,清明變盤與否都好買？台股4、5月進場一季平均表現佳，提高勝率更要選「強勢高息股」,"['趨勢分析', '野村投信', '台灣高股息指數', '野村臺灣趨勢動能高股息', 'ETF', 'ESG', 'Fed', '波動', '原油', '股利', '殖利率', '全球', '美國', '美股', '財報', '標普500', 'ISM', '製造業', '工業生產指數', '服務業', 'CPI', '核心消費者物價指數', 'PPI', 'PCE', '生產者物價指數', 'GDP', '美元', '歐元', '日圓', '中國', '日本', '陸股', '港股', '日股', '台股', 'BOJ', '能源', '新興市場', 'PMI', 'EPFR', '外匯', '匯率', '通膨', '基金', '聯準會', '拜登', '鮑爾', '葉倫', '銀行', '貨幣', '利率', '期貨', 'VIX', 'ISM', '非農', 'ECB', '黃金', 'FOMC', 'AI', '科技', '00944']",[],26cf4f8d-d66b-4c4c-9862-0077d47f534f
"即將迎來清明連假，但因花蓮發生規模 7 以上強震南北交通大亂，台灣高鐵 (2633-TW) 說明，此次強震造成受影響路段超過 275 公里，目前採降級運轉，自 11：00 至 13：00 間原時刻表各車次取消，改以每 20 分鐘自南港站和左營站分別發出 1 班全車自由座列車 (第六節商務車廂除外) 以疏運旅客。


高鐵說明，受花蓮強震影響採降級運轉，此次受影響路段超過 275 公里，尤其部分路段測得 3 級地震告警，依台灣高鐵地震應變標準作業程序，維修人員需配合隨乘巡檢和軌道的動搖測試，且列車通過受影響區域須先以注意進行方式 (時速 45 公里以下) 運轉，後續再分別以時速 70 公里、120 公里、170 公里、230 公里順序，漸進提升運轉速度。


目前高鐵巡檢作業仍在持續進行中，敬請旅客耐心等候。


為因應降級運轉，高鐵自 11：00 至 13：00 間，改以每 20 分鐘自南港站和左營站，分別發出 1 班全車自由座列車 (第六節商務車廂除外) 以疏運旅客。


此事件導致部分列車取消，高鐵表示，除加開全車自由座列車因應外，也同步於車站及列車加強對旅客廣播，說明延遲情形，並在車站提供飲用水及麵包供旅客取用，後續最新營運訊息，將儘速對外公布。",2024-04-03 11:06:58,19336,連假前交通大亂 高鐵降級運轉 改採全車自由座疏運,〈0403強震〉連假前交通大亂 高鐵降級運轉 改採全車自由座疏運,"['地震', '高鐵', '疏運', '交通', '停駛']",['台灣高鐵'],d09c1425-5dfc-4d46-868f-ea0fa5ff04ee
"各家投信陸續公告 4 月 ETF 配息資訊，近期月配型產品引起熱烈討論，除了台股 ETF 外，債券 ETF 也有 4 檔，分別為群益 ESG 投等債 20+(00937B-TW)、國泰 10Y + 金融 (00933B-TW)、中信高評級公司債 (00772B-TW)、中信優先金融債 (00773B-TW)，當逢每月配息開獎之時，同樣受到市場關注。


根據投信投顧公會與各家投信網站所公告之配息資訊，以 4 月 2 日收盤日來推算，單次配息率以 00937B 0.53% 最高，本次預估每股配發金額為 0.084 元，已連續三次配息金額維持相同水準，年化配息率為 6.36%。


其次則為 00933B 的 0.42%，預估配發金額為 0.07 元，年化配息率為 5.04%；接下來分別為 00733B 和 00772B 的 0.39% 和 0.38%，預估每股配發金額為 0.142 元和 0.135 元，年化配息率為 4.68%、4.56%。


這四檔債券 ETF 都將於 4 月 18 日除息，想參與領息的投資人，請留意 4 月 17 日為最後買進日。


ETF 投資達人表示，隨著通膨壓力趨緩，聯準會自去年下半年來暫停升息，今年更可望啟動降息，債市多頭行情可期之下，債券 ETF 基於其擁有交易便利，投資組合透明，並具有配息機制能滿足投資人打造穩健收益的需求，都使得債券 ETF 投資熱度自去年開始明顯增溫，無論是受益人數或規模都有倍數式的成長。


當中又以未來受惠降息程度大的長天期債 ETF 最受青睞，而月配型債券 ETF 因每月配息，讓投資人資金運用上更為靈活，故市場關注熱度持續升溫。


ETF 投資達人進一步指出，觀察這四檔月配型債券 ETF，投資標的都為天期較長的投資級公司債，其中 00937B 在指數設計上還多納入 ESG 考量， 00933B 與 00773B 則以金融債為主，資產品質皆無太大疑慮。


值得一提的是，00937B 所布局之成分債券鎖定永續經營能力佳的 ESG 資優企業所發行之長天期 BBB 級公司債，並進一步精選票面利率大於 4.5% 以上者，可說是從源頭提升配息能力，有助投資人打造穩健收益來源。",2024-04-03 11:25:56,19335,各家投信陸續公告 4 月 ETF 配息資訊，近期月配型產品引起熱烈討論，除了台股 ETF 外，債券 ETF 也有 4 檔，分別為群益 ESG 投等債 20+(00937B-TW)、,4檔月配型債券ETF配息開獎 00937B年化配息率逾6%,"['債券ETF', '配息', '除息']","['群益ESG投等債20+', '國泰10Y+金融債', '中信高評級公司債', '中信優先金融債']",7a0d3f9a-9c91-45e0-b4b8-c3a1cb7c206d
"台灣東部海域今 (3) 日上午發生規模 7.2 有感地震，各地陸續傳出災情，適逢清明連假前夕，金管會要求各保險公司連假期間保戶服務不中斷，富壽、台壽、南山及新光人壽等各家保險公司都已啟動緊急應變措施，並加強各地通報機制，提供關懷與必要協助，以及進行快速理賠程序。


●富邦人壽提供保戶傷亡慰問金 啟動 10 大應變措施


富邦人壽表示，全台服務據點均不受強震影響。另宣布提供「保戶傷亡慰問金」，針對傷亡保戶提供身故 10 萬元、加護病房 5 萬元、一般住院 1 萬元的慰問金。


富邦人壽表示，已在第一時間啟動 10 大保戶服務應變措施，如保戶因震災成為受災戶，富壽將提供 24 小時服務專線、續期保費緩繳、保單借款利息緩繳、免費保單補發、快速理賠服務、受災戶房屋貸款優惠還款計畫諮商等多項緊急應變方案與關懷措施，申請期間自即日起至 7 月 30 日止，並加強各地通報機制，提供關懷與必要協助。


富壽指出，針對應繳月為今年 3 至 7 月的續期保費，給予受災保戶延繳 6 個月方案，保單借款利息亦得寬延 6 個月繳息；另外，若不幸受傷的保戶需辦理醫療險理賠，富壽均以方便保戶為原則，務求以最快的速度對受災保戶做好各項立即的服務，受災保戶可透過業務同仁以傳真或 EASY PAY 線上申請理賠，其他應備文件等資料可後續另行補齊。


●南山人壽整合企業資源派員關懷 提供受災戶慰問金


南山人壽、南山產物啟動緊急應變及關懷措施，包括提供不幸身故、受傷保戶 / 受災戶慰問金、安家補償慰問金以及保單借款紓困、房屋貸款紓困等，並整合企業資源，派員前往關心受災保戶及家屬，盼提供最實質的幫助，善盡企業之力，表達關懷，共渡難關。


針對此次地震可能釀成的災害，南山產物隨時掌握最新情況，並協助保戶後續理賠申請。保戶若因不幸受傷、或車輛、住家等發生財損情況，皆可撥打全天候理賠服務專線 0800-005-678，將有專人儘速提供協助。


關於受災戶慰問金，南山人壽提供不幸身故每人 10 萬元 (保戶)；不幸身故每人 5 萬元 (非保戶)。加護病房每人 6 萬元 (保戶) ；加護病房每人 3 萬元 (非保戶)。一般病房每人 2 萬元 (保戶) ；一般病房每人 1 萬元 (非保戶)。


●新光人壽啟動「防災五保」 受災保戶提供傷亡慰問金


新光人壽表示，已第一時間啟動緊急應變小組，清點各辦公大樓情況及人員安全，同時迅速啟動「新光防災五保」保戶關懷服務，提醒民眾留意餘震，注意自身安全。「新光防災五保」保戶關懷服務，提供保戶「主動協助理賠」、「保單補發免收工本費」、「續期保費緩繳優惠」、「保險單借款利息緩繳優惠」及「房屋貸款本金寬延優惠」等五項服務。


新壽同時針對受災保戶提供身故 10 萬元、加護病房 5 萬元、一般住院 1 萬元的傷亡慰問金，祈願台灣一切平安。


●台壽、中信產險主動關懷保戶 啟動快速理賠、後補文件


台灣人壽啟動保戶緊急應變五大服務，包括「快速理賠服務及預付醫療保險金｣、「續期保費緩繳三個月」、「保單借款利息緩繳六個月」、「補發保單工本費優惠」、「展延房屋貸款本金及利息一年」；中信產險則成立「災損服務中心」，由專人主動聯繫保戶關心狀況，並啟動快速理賠暨緊急應變關懷服務。


台灣人壽表示，地震發生第一時間即啟動全台各地服務通報機制，蒐集災情資料、查詢及迅速比對保戶，並動員全台各地業務員發動保戶受災關懷行動，針對身故保戶第一時間進行快速理賠，只需後補所需文件即可，另身故件及失蹤件將從寬認定；針對受傷保戶進行快速預付醫療保險金，必要時將派員送達，及時提供保戶及其家屬相關協助。台灣人壽暨中國信託產險第一線的客戶服務人員亦維持正常服務，隨時提供保戶緊急需求。",2024-04-03 11:32:57,19334,台灣東部海域今 (3) 日上午發生規模 7.2 有感地震，全台明顯搖晃，各地陸續傳出災情，適逢清明連假前夕，金管會要求各保險公司連假期間保戶服務不中斷，,〈0403強震〉震災理賠免驚！保險業啟動緊急應變措施 提供保戶關懷,"['地震', '保險', '產險', '保戶']",[],8e49be6f-6720-41b8-8e92-968bafba04e1
"花蓮今 (3) 日發生規模 7.2 強震，且餘震不斷，台泥 (1101-TW) 多個事業單位就在震央附近，目前已知水泥廠、電廠、工業港裝船機卸船機均受到影響、全面檢修中；亞泥 (1102-TW) 花蓮廠 3 號窯煙囪有略為傾斜情形。


此外，通往礦區道路多處落石坍方，上午地震發生時承包商車輛於上山路途車頭遭落石掩埋，經礦山團隊全力搶救已經救出兩位在地部落居民，所幸意識清楚無生命危險。


台泥表示，花蓮和平水泥廠因地震影響供電系統，目前全廠檢修中，蘇澳水泥廠預計兩天內恢復生產；和平工業港裝船機卸船機受損嚴重，但無人員受傷，和平電廠跳機先以輔機復電，全力檢修中。


台泥進一步說明，電池儲能綠能案場及其他各事業體無重大受損影響，各地製品廠正常運作發貨；台泥董事長張安平於地震後第一時間指示各事業體全面檢修設備，以同仁工作場域安全為優先考量。


亞泥 (1102-TW) 同樣也有廠區位在花蓮，公司表示，花蓮礦區下部落一切平安，花蓮廠的 3 號窯煙囪的消音器出現傾斜，煙囪本體無礙，無人員受傷；新城山礦區內有兩處邊坡有崩落現象，屬於已開採與未開採的交界處，相關狀態已提報地礦中心。",2024-04-03 11:34:26,19333,台泥和平廠區位處震央附近 設備受影響全面檢修 礦場 2 承包商險遭埋,〈0403強震〉台泥和平廠區位處震央 設備受影響全面檢修 礦場2承包商險遭埋,"['花蓮', '地震', '和平', '台泥', '亞泥']","['台泥', '亞泥']",804afc7a-7f2e-4256-a265-f782b4fb4745
