title,keywords,content,publish_at,id,summary,related_stocks,uuid
生華科持續開發新冠新藥 向台灣申請二期臨床試驗,"['生華科', '新冠病毒', '新藥']","生華科 (6492-TW) 持續開發新冠新藥，旗下開發治療新冠病毒 (SARS CoV-2) 新藥 Silmitasertib，向台灣衛福部提出針對新冠病毒可能引發免疫風暴或嚴重發炎反應的中重症住院患者二期臨床試驗申請 (IND)，規劃收案 40 人。


生華科開發的新藥 Silmitasertib 是人類蛋白激酶 CK2 抑制劑，藉由調控宿主 CK2、抑制由病毒誘發的免疫因子過度活化，緩解免疫風暴發生，改善臨床症狀，之前經過美國臨床實驗發現，有助病人較快恢復健康。


Silmitasertib 將進行新冠中重症住院患者的二期臨床試驗，此試驗為雙盲、隨機分配、對照試驗，來評估 SARS-CoV-2 陽性的 COVID-19 成人住院患者，接受 Silmitasertib (CX-4945) 治療的安全性及療效。


根據生華科規劃，試驗將收治 40 位因新冠病毒可能引發免疫風暴或嚴重發炎反應需住院治療之成人患者，受試者將以 1:1 隨機分配接受 CX-4945 或安慰劑治，加上 SOC/Remdesivir。病患將口服用藥、共 5 天療程，之後追蹤至多 30 天；試驗總時間 (包括篩選) 將不超過 40 天。


試驗主要指標是評估因新冠病毒可能引發嚴重發炎反應需住院治療患者合併接受 Silmitasertib(CX-4945) 治療之安全性和耐受性；次要及探索性評估指標為相關療效或臨床症狀緩解，如免疫因子變化、重症率、呼吸衰竭、出院率等。


生華科表示，目前針對因新冠病毒引發免疫風暴或相關嚴重發炎反應治療藥物為類固醇或免疫抑制劑，而美國 FDA 僅核准 Gilead 藥廠開發之瑞德西韋 (Remdesivir) 為住院患者治療藥物，但該藥物僅能減少住院天數，無益於降低死亡率。",2023-02-27 11:00:09,4830,生華科 (6492-TW) 持續開發新冠新藥，旗下開發治療新冠病毒 (SARS CoV-2) 新藥 Silmitasertib，向台灣衛福部提出針對新冠病毒可能引發免疫風暴或嚴重發炎反應的中重症住院患者二期臨床試驗申請 (IND)。,['生華科'],51ad9e96-4430-4833-ae2a-0cea06afbea7
〈車市〉車商各自出招 台灣福斯不漲價 淡季買氣升溫,"['福斯', 'kicks', 'bmw', '裕日車', '國產車', '車市']","隨著車用晶片短缺漸緩解，今 (2023) 年整體新車規模有望年增逾 4.5% 回到 45 萬台水準，因此，兔年才剛開始，各大車商的新車款已陸續亮相，裕日車 (2227-TW) 推出限量版 NISSAN KICKS 潮流版，台灣福斯汽車則強調，23 年式全車系維持價格不變，而 BMW 則推出首款 BMW iX1 純電運動休旅，即便處在車市上半年傳統淡季，需求仍可望在眾車商的努力下持續升溫。


裕日車指出，NISSAN KICKS 去年 10 月全新改款上市以來，至今年 1 月底累計銷售已達 4634 台，穩居小型跨界休旅冠軍。


為滿足車主追求個性化的需求，此次裕日車再加碼推限量 300 台的 KICKS 潮流版，並強打汰舊換新價格 81.5 萬元起、配備升級不加價，在一片漲聲中，期藉此帶進更多年輕客群。


而台灣福斯同樣看好車市需求，積極向原廠爭取配額，以達到最大交車量，首批車輛 3 月起陸續到港。


台灣福斯更強調，23 年式全車系維持價格不變，並提供 Volkswagen 車主舊換新購車補助方案，最高有 4 萬元的舊換新補助金。


另外，豪華進口車商 BMW 發表全新 BMW X1，此車款自推出以來在全球銷售超過 190 萬台，稱霸小型豪華 SAV 市場，此次除了導入第二代 48V 高效複合動力科技，更推首款 BMW iX1 純電運動休旅，為 X 家族純電世代揭開序幕，也在純電車市中持續提升品牌能見度。",2023-02-27 12:00:04,4829,(留稿) 車商各自出招 台灣福斯不漲價 淡季買氣升溫,['裕日車'],f6203e0d-d3d4-4edf-a97a-9eae79120471
升息壓力揮之不去 台股15500點恐不保 留意漲多個股拉回壓力,"['月線', '升息', '台股', '半導體', '航運']","台股周線、月線同步收紅，但法人提醒，在美國升息壓力籠罩、美股收黑等壓力下，台股短線仍有拉回壓力，下周短線將面臨 15500 點保衛戰，部分漲多個股勢將面臨資金調節壓力。


受 228 連假觀望心態，權值電子股受 MSCI 季度調整，引爆尾盤賣壓湧現，電子股淪為資金調節標的，拖累台股 24 日下挫 111.62 點作收，高低點來回震盪約 214 點。


針對近期盤勢，安聯投信台股團隊表示，台股 2 月表現相對其他亞股來得強勁，主要是受惠市場對風險偏好度回升所致，包括 Nasdaq 等科技相關主題都呈現相對強勢的表現。


安聯投信台股團隊認為，近期台股反彈並非是無基之彈，而是有跡可循，包括庫存調整步調開始放緩、距離半導體周期底部愈來愈近急單出現，加上中小型股活蹦亂跳，對市場而言都屬正面訊息，接下來就等市場需求何時回升。


以題材面來看，安聯投信台股團隊表示，科技部分長線仍看好 IP(矽智財)、客製化晶片、雲端伺服器、車用電子、晶圓代工先進特殊製程；另外，驅動 IC、面板、被動元件、記憶體、銅箔基板等景氣循環末段族群現階段也值得觀察 。


但安聯投信台股團隊也提醒，短線留意部分族群漲幅過大有獲利了結賣壓，另外 3 月即將登場的中國經濟會議，以及俄烏等地緣政治情勢變化也會左右亞股、甚至台股走勢。


大華優利高填息 30 經理人鄭翰紘表示，目前在台股布局上，建議應以價值股為優先考量，原因在於基本面相對穩健，加上 ETF 透過指數篩選，剔除了人為因素的干擾，將能更有效率進行多產業的配置，避免單押單一個股或產業，造成資產的減損。


在產業部分，鄭翰紘指出，近期美國晶片大廠輝達 (Nvidia) 的財報優於市場預期，激勵科技類股走勢，樂觀情緒蔓延，連帶讓台灣半導體以及 PC 類股因此受惠。


展望後市，鄭翰紘認為，PC 市場與消費者支出高度相關，隨著中國大陸經濟啟動疫後開放，消費者信心也隨之提升，有助電子產品銷售市況。


至於以半導體為首的科技類股尚待庫存去化完成，在獲利表現可持續提升的情況下，預期未來行情仍有空間發揮；另外航運股的部分，今年以來貨櫃報價持續下滑，不過股價出現低檔反彈，今年的配息也仍可期待，目前股價與殖利率仍具有吸引力。",2023-02-27 13:00:05,4828,台股周線、月線同步收紅，但法人提醒，在美國升息壓力籠罩、美股收黑等壓力下，台股短線仍有拉回壓力，下周短線將面臨 15500 點保衛戰，部分漲多個股勢將面臨資金調節壓力。,[],76aae8b4-f33d-4a90-b7f8-8729194754b7
茂順2月營收估達3.7億元年增41% 首季將突破10億元,"['茂順', '營收', 'EPS']","在客戶端訂單不斷湧入造成產能不敷需求，密封元件廠茂順 (9942-TW) 對兩岸新產能的擴充持續不間斷，進行擴產新進度預計於 3 月底前再完全開出 10% 新增產能，同時，2 月在工作天數增加之下，營收預估將月增 22% 到 3.7 億元，已達去 (2022) 年旺季單月營收水準，也將呈現年增 41%。


茂順 2023 年 1 月營收受制於工作天數短的不利因素之下，單月營收僅 3.03 億元，月減 20.54%，年減 4.59%，但在既有訂單能見度高的有利因素之下，預計 2 月起因工作天數增加及漲價效應推升營收，估計累計 2023 年前 2 月營收達 6.73 億元，年增 17%。首季營收也將突破 10 億元


茂順 2022 年全年營收 41.62 億元，創新高，年增 7.83%。茂順在 2023 年上半年訂單滿載之下，估 2023 年全年營收的成長幅度將自 10% 起跳。同時，茂順 2022 年前三季財報營收 29.91 億元，毛利率 34.35%，年減 1.91 個百分點，稅後純益 4.72 億元，年增 9.44%，每股純益達 5.67 元，2022 年全年每股純益上看 7.5 元。


茂順 2022 年初陸續在中國、台灣新增產能，新產能開出後就被客戶搶光，目前訂單滿載到 6 月，且目前依調漲的新價格交貨，也有利擴產後的獲利能力大幅躍升。市場估茂順今年的單月營收規模將提升到 4 億元以上。同時，茂順今年營收也將呈現逐季走高的態勢。


茂順密封元件應用廣泛，依應用比重來看，汽車、工業用各占 40%，近 20% 用於農業及建設；目前以工業及汽車產品接單最旺，訂單能見度也高，今年上半年訂單已經接滿。",2023-02-27 14:00:08,4827,在客戶端訂單不斷湧入造成產能不敷需求，密封元件廠茂順 (9942-TW) 對兩岸新產能的擴充持續不間斷，進行擴產新進度預計於 3 月底前再完全開出 10% 新增產能，同時，2 月在工作天數增加之下，營收預估將達 3.7 億元。,['茂順'],607ffc03-2b7e-481d-a2f9-7b7aa29636fc
企業資安漏洞頻傳 專家示警三大產業成駭客新目標,"['資安', '企業', '個資', '駭客']","近期發生多起企業個資外洩風波，部分企業甚是因此遭駭客恐嚇，對此 KPMG 安侯企管公司表示，駭客近期攻擊對象已從大型上市櫃企業轉戰中小企業，包括交通觀光、百貨零售及網路服務等，已成為駭客鎖定新目標。


KPMG 安侯企管公司董事總經理謝昀澤表示，過去駭客主要鎖定金融、製造和上市櫃大型企業，近期則迅速移轉到中小型企業上，包括交通觀光、百貨零售業、及網路服務等擁有消費者巨量個資的行業已成為駭客新目標。


而駭客在攻擊上的分工也有所轉變，上游由「網路狙擊手」先「代攻」竊取資料後，再交由中游的「數據販子」分批、分時於暗網中兜售，最後經「下游」的「取款車手」，以各種心理戰、媒體戰專業恐嚇企業交付贖金取款，並同時製造斷點，是近年最常見的模式。


謝昀澤說明，歸納企業受駭事件受駭者的特徵，大多都有「資料庫重要的欄位未加密」、「技術人員錯誤的安全設定」、「未能及時修補弱點」等；以近期零售業個資外洩來看，本該最被嚴加安全保護的資料庫，不僅丟失資料內容外，連資料庫系統的內部管理介面也暴露在外部網路，簡言之，企業整體網路架構與資料存取控制，形同被駭客接管。


根據謝昀澤觀察，台灣企業資安能力強弱懸殊，大致可分成：對資安敏感，有能力預先蒐集情報，並掌握產業鏈整體風險的「真知卓見組」，例如部分的半導體與金融業公司。


另一種則是誤認有裝防毒軟體、防火牆，就是完成資安的「自我感覺良好組」；甚至已被外部通報個資外洩，而不知所措，只會重新安裝系統的「資安神經麻痺組」。


謝昀澤提醒，未來駭客「柿子挑軟的吃」的趨勢將更顯著，部份把資安當作「選配」的企業，被入侵暴雷事件將更頻繁，這些企業會面臨「駭客霸凌」、「輿論炎上」、「商譽崩塌」的三重壓力。


KPMG 安侯企管公司執行副總林大馗建議，企業先由獨立第三方，針對資安體質與現況進行詳細的健檢，並盡速辨識並修補漏洞，其中對資安採高標準的企業，可參考 2022 年最新版國際資訊安全標準的技術控制措施，透過如資料庫加密機制，讓駭客鋌而走險得手的資料喪失利用價值。


另外，企業也可透過較積極的資料外洩防護技術 (DLP) 措施，來管制員工資料存取與轉送的行為。


林大馗強調，現代化的企業要把資安視為「標準配備」，更要重視基本功，優先針對員工安全意識、資訊人員技術能力、資安政策與管理流程等多方面，積極進行補強。",2023-02-27 15:00:04,4826,近期發生多起企業個資外洩風波，部分企業甚是因此遭駭客恐嚇，對此 KPMG 安侯企管公司表示，駭客近期攻擊對象已從大型上市櫃企業轉戰中小企業，包括交通觀光、百貨零售及網路服務等，已成為駭客鎖定新目標。,[],b2d738a9-bc98-436e-a4c4-48ce9cdb7d53
PS VR2上市熱銷 供應鏈營運進補,"['PS VR2', '元宇宙', '聯發科', '玉晶光', '瑞昱', '華邦電', '新唐']","PS VR2 自 2 月 22 日上市後，不僅在既有玩家間引起廣大迴響，也勾起新玩家想前往元宇宙的慾望，不少通路出現售完補貨中或排單生產，也挹注供應鏈後續出貨動能，包括聯發科 (2454-TW)、玉晶光 (3406-TW) 等業者。


PS VR2 此次更動明顯，包括採用兩片 2000 x 2040 的 OLED 顯示器，畫質高達 4K HDR，螢幕刷新率也衝上 120 Hz，化解先前玩家詬病的螢幕頓感，同時透過最新眼動追蹤技術，定位與強化視線焦點，提升遊戲沉浸感。


聯發科去年初成立元宇宙事業部門，此次也為 PS VR2 設計主晶片 SoC，一舉搶下大單，也打破現今 VR 裝置多由高通 (QCOM-US) 拿下的局面，預期首波出貨約 200 萬套。


此外，市場也傳出，SONY 為強化遊戲內容，預計在 E3 展前搶先舉行遊戲發布會，可望進一步刺激 PS5 的銷量，屆時包括聯發科旗下立錡、瑞昱 (2379-TW)、華邦電 (2344-TW) 與新唐 (4919-TW) 都可望同步受惠。",2023-02-27 15:30:04,4825,PS VR2 自 2 月 22 日上市後，不僅在既有玩家間引起廣大迴響，也勾起新玩家想前往元宇宙的慾望，不少通路出現售完補貨中或排單生產，也挹注供應鏈後續出貨動能，包括聯發科 (2454-TW)、玉晶光 (3406-TW) 等業者。,"['聯發科', '玉晶光', '瑞昱', '華邦電', '新唐', '高通']",08612a75-93ad-49f0-8027-f7c2b7415f0f
遠傳前進MWC 2023 展台灣5G實力,"['遠傳', '愛立信', 'mwc', '趨勢分析']","2023 世界行動通訊大會 (MWC) 於西班牙巴塞隆納盛大登場，睽違三年重啟全實體展出，展現通訊界豐沛的活力，遠傳 (4904-TW) 總座井琪也親率經營團隊出席通訊業界的盛會。


遠傳與愛立信攜手端出最新 5G 創新應用，吸引參觀者目光。其中「AI 節能網路應用」，可節省最高 46% 基地台能耗，目前已完成測試，被視為遠傳邁向淨零減排的重量級幫手。


此外，全台第一個 5G SA 結合網路切片商用案例「5G 智慧巡邏車」也同步亮相，這也是全球第一個 5G SA 網路切片的智慧警政應用，開啟公共服務發展的新紀元。


遠傳電信總經理井琪表示，今年 MWC 呈現出通訊界旺盛的研發能量，探討如何增進 5G 技術並加速向 B5G、6G 和更高效網路表現發展，協助各產業開創嶄新價值。


遠傳 5G 創新與永續發展並重，透過結合愛立信領先全球的網路技術，在持續優化 5G 網路體驗的同時也能降低能源使用，合力推動綠色網路、智慧城市治理等多面向發展。


遠傳在 MWC 展期將與多家國際頂尖科技大廠、電信業巨擘深度交流，展現台灣 5G 世界級的實力，更將持續結盟全球重量級伙伴，擴大遠傳電信本業和新經濟布局。


另外，遠傳與國際伙伴愛立信合作密切，日前更簽訂「B5G AI 創新應用與永續網路 MOU」，插旗下一代技術發展。台灣愛立信總經理周大企表示，隨著 5G 為社會帶來更多創新可能，具備節能、未來性的 5G 產品組合，帶來的效益也越加明顯，愛立信將持續精進網路現代化、智慧化網路營運、整體網路規畫三大面向，透過與遠傳深度合作，共同為大眾帶來更可靠、優質且節能的高品質網路體驗。


根據愛立信的研究，行動網路的整體能源使用中，無線接取網 (RAN) 能耗占比高達 75%，因此提升其能源效率、同時兼顧網路表現，是全球電信大廠邁向淨零碳排的關鍵課題。


遠傳與愛立信攜手合作，首次展出最新黑科技「AI 節能網路應用」，可自動監測各站點細胞 (cells) 的節能狀況、預測網路流量，並透過智慧演算法決定節能模式。目前已成功完成測試，在不影響用戶體驗、且沒有任何人工干預的前提下，平均節省 25% 能耗、部分時段更可節省高達 46% 能耗，是打造綠色網路的關鍵應用。


此外，遠傳與愛立信聯手展示「5G 智慧巡邏車」也讓參觀的產官學界專業人士給予高度評價，這不僅是全台第一個 5G SA 結合網路切片商用案例、更是全球第一個 5G SA 網路切片的智慧警政應用，開啟公共服務新紀元。


透過 5G 高速傳輸影像、AI 辨識，能短時間識別贓車，並發出即時告警。目前已與高雄市警察局合作在高雄亞洲新灣區完成測試，目標將此成功經驗部署至全台各地，提升城市犯罪偵防、治安管理量能。",2023-02-27 22:00:55,4824,2023 世界行動通訊大會 (MWC) 於西班牙巴塞隆納盛大登場，睽違三年重啟全實體展出，展現通訊界豐沛的活力，遠傳 (4904-TW) 總座井琪也親率經營團隊出席通訊業界的盛會。,['遠傳'],5adc0774-b431-4134-9f1d-62029569f1fc
鴻海斥8.8億元取得鄭州綜保區土地使用權 規劃建置智能倉儲,"['鴻海', '鄭州', '河南']","鴻海 (2317-TW) 今 (27) 日代子公司鴻富錦精密電子 (鄭州) 公告，取得鄭州綜合保稅區 M 區土地使用權資產，交易總金額約人民幣 1.97 億元(約新台幣 8.8 億元)，將用以建設智能倉儲項目。


鴻海是向鄭州市自然資源和規劃局鄭州航空港經濟綜合實驗區分局、中牟縣自然資源局，取得鄭州綜合保稅區富八街以東、康二路以北之土地使用權資產。


而此次交易土地面積約 19.54 萬平方米 (約 293.17 畝)，每畝均價約人民幣 67.18 萬元，交易總金額為人民幣 1.97 億元。


而鴻海董事長劉揚偉近日也與總財務長黃秋蓮、獨立董事王國城等，到鄭州富士康視察，劉揚偉強調，在集團 3+3 的轉型升級策略中，河南都具有極大的發展優勢，會在河南持續投入、長足發展。",2023-02-27 22:01:33,4823,鴻海 (2317-TW) 今 (27) 日代子公司鴻富錦精密電子 (鄭州) 公告，取得鄭州綜合保稅區 M 區土地使用權資產，交易總金額約人民幣 1.97 億元(約新台幣 8.77 億元)，將用以建設智能倉儲項目。,['鴻海'],1af32500-9f00-4647-9df8-60462f05ee2c
