title,keywords,content,publish_at,id,summary,related_stocks,uuid
蘋果PCB基板材料將改成RCC，聯茂 為主要受益的台灣廠商,"['亨達投顧', '陳智霖', '蘋果', '華為', 'PCB', 'RCC', 'HDI', 'ChatGPT', 'AI', '輝達', '黃仁勳', '半導體', '5G']","〈蘋果創新〉


蘋果 (AAPL-US) 最新一代四款新機已上市，最頂規的 iPhone 15 Pro Max 交貨時間長達約 38 天，創七年來最高；大摩也認為，這是 iPhone 15 銷售強勢開局，超越看跌市場情緒。但相比突破美國晶片禁令推出旗艦智能手機 Mate 60 Pro 的華為，蘋果的創新就略遜一籌，因此蘋果將會在下一代產品推出為新的應用，以重新吸引消費者的目光，近來市場就傳言為了讓電子產品能有更多空間，蘋果可能將 PCB 基板材料改成 RCC 背膠銅箔材料 (Resin Coated Copper)。


以過去歷史來看，蘋果新商品的主板 3-4 年會有大升級，上一次的大升級是 2017 年，改採用類載板的設計，對當時的 HDI、載板業者都算是一個新的領域，蘋果新機對 2023 年 PCB 產業仍無亮點，可能因疫情使延後大升級的時間點，因此看來 2024 年蘋果新商品外型變輕薄將是可期待的。




〈什麼是 RCC〉


RCC(Resin Coated Copper) 是一種新型的印刷電路板 (PCB) 材料，相對於傳統的銅箔基板是用玻纖布來當核心層，再拿樹脂固化，上下貼銅箔，就會成為一張銅箔基板；而 RCC 不用玻纖布，直接樹脂固化上下貼銅箔，直接少了一層玻璃布，整體變得更輕更薄。


將銅箔與樹脂層結合的材料，具有輕薄、高導電、低阻抗、高熱傳導等優點，適用於高速、高頻、高密度的電路設計。RCC 可以減少 PCB 的層數和厚度，提高信號品質和效率，降低成本和重量，可減少使用有毒化學品和廢水的量，更為環保。RCC 的主要應用是作為 HDI 板的材料。HDI 板是一種具有高密度互連的電路板。它使用細線路和小孔來提高電路的性能。RCC 的優點是可以幫助製造細線路和小孔，從而提高 HDI 板的性能。


RCC 材料應用廣泛，不只是做為下一世代 HDI 的重要材料，也是 ABF 載板的其中一個材料，RCC 主要是由日本的味之素公司 (Ajinomoto) 生產和供應，RCC 過去以日商為主，不論是跟隨客戶發展，或是拚供應鏈自給，目前台系 PCB 供應鏈正積極布局中。


〈台灣相關受惠概念股〉


台灣的聯茂 (6213-TW) 於 2021 年底成功開發出 RCC，是最早能量產的廠商，並在今年 7 月開始送樣給蘋果的台灣 PCB 供應商認證，由於蘋果的 PCB 供應鏈多為台商，且基於成本考量，在蘋果將 PCB 材料全面改用 RCC 後，聯茂也有望成為蘋果更改 PCB 材料的主要受益廠商。


華通 (2313-TW) 原本就是蘋果供應商，2022 年全球 PCB 廠產值排行第四，華通日前法說會表示，今年資本支出預計為 50-55 億元間，主要為擴充 mSAP 製程 HDI、軟板以及 SMT 設備。上半年應為今年營運低點，第 3 季開始進入各重要客戶新品備貨旺季。


欣興 (3037-TW) 原本就是蘋果供應商，2022 年全球 PCB 廠產值排行第二，欣興 8 月營收 92.18 億元，月增 7.6%，為今年以來單月次高。累計今年前八月營收 695.88 億元，年減少 22.9%。第 3 季受惠消費電子產品進入旺季，美系客戶手機新品發表，加上 AI 伺服器需求成長，預期 HDI、PCB 產線稼動率都將回升至 80%~90%，帶動本業獲利回升。


才剛剛接觸陳智霖分析師的新朋友，建議您現在立即點選紫色圖片下載安裝陳智霖分析師 APP，老師有提供 APP 新註冊用戶免費體驗午報導航及互動教學會員影音的活動，歡迎您透過體驗來了解陳智霖老師如何選股以及盤中的會員服務，午報導航體驗都是限時限額開放，千萬不要浪費了您可以免費體驗的權益喔。


邀請您可以點選下方紫色圖免費註冊陳智霖分析師 App，掌握老師最新的分析動態




陳智霖老師的直播節目以及 APP 語音文章都會針對國際總體經濟重要的事件追蹤分析有前景的產業趨勢，針對看好產業個股每個星期也都會準備投資名單且設定好操作價位，提供給付費的簡訊會員及 APP 選股會員，股市險惡呼籲忠實粉絲觀眾千萬不要單打獨鬥，務必換上富人的思維，把花時間的股市研究工作及盤中的進出判斷，包括操作資金的控管技巧交給專業的陳智霖分析師，邀請您可以跟著老師一邊操作一邊學習，關於最新的股市行情分析看法，您可以點擊以下影片收視 10/09 週六最新的直播節目。


最新影音 (請點影音上方標題至 Youtube 收視品質會更佳)




錢進熱線 02-2653-8299, 立即邁向系統依據的股票操作。


文章來源：陳智霖分析師 / 
亨達投顧


本公司所推薦分析之個別有價證券

無不當之財務利益關係 以往之績效不保證未來獲利

投資人應獨立判斷 審慎評估並自負投資風險",2023-10-10 09:10:03,15397,無摘要,"['聯茂', '華通', '欣興', '蘋果']",a708d205-709b-4b56-8745-74d0be99c7d7
〈台股風向球〉以巴戰爭短期連動兩題材股 以盤代跌消化不確定性,"['台股', '風向球', '美股', '以色列']","以色列和巴勒斯坦爆發 50 年來最大衝突，以色列進入戰爭狀態，中東的地緣政治緊張，不過，在我國慶連假期間，美股並未明顯反映，法人認為，短期來看，戰爭對原物料、軍工等題材股或有連動影響，但整體大盤應不至於強烈反應，預料難脫區間整理，惟須留意國際局勢不確定性高。


國慶連假前，投信一周來合計在集中市場買超 121 億元，呈現連 10 周買超，外資則是連 3 周賣超，雖新台幣貶勢止穩，仍暫無轉強的跡象。


先觀察投信上周買超的前 10 大標的，主要有緯創 (3231-TW) 超過 1.8 萬張，聯電 (2303-TW) 逾 7000 張，宏碁 (2353-TW) 和大聯大 (3702-TW)4000 張上下，元大高股息 (0056-TW)、定穎投控 (3715-TW)、旺宏 (2337-TW) 和威剛 (3260-TW) 在 3500 張上下，廣達 (2382-TW) 和瑞儀 (6176-TW) 也超過 3000 張。


若以金額來看，投信布局緯創、聯發科 (2454-TW) 和緯穎 (6669-TW) 均逾 10 億元最多。


據傳，輝創辦人暨執行長黃仁勳將於 10 月中旬來台為鴻海科技日站台，是否再度炒熱 AI 題材，受到市場矚目。


法人認為，從投信近期穩健的籌碼布局來看，第四季 AI 題材再掀漲勢受到期待，不過，新台幣偏弱，外資仍有持續流出疑慮，目前暫未見到一致簇擁大盤上攻的動能，預料在財報季來臨前，個股表現仍是主軸。


永豐投顧從技術面分析，加權指數仍受制於半年線，基本上延續 9 月中以來的 C 波下跌，但同時，低檔買盤漸強，上周三指數一度下探 16200 點，周四隨即大幅拉抬，顯示買盤刻意護持，有以盤代跌來完成 C 波整理態勢，16200 點支撐更堅實。


儘管以巴無預警衝突震驚國際市場，但美股暫無明顯波動反應，法人認為，國際變數多，等待打破僵局，聯準會的利率決策仍將是影響市場的最重要因素，短線觀察此次中東的地緣政治情勢緊張，是否影響原物料走勢，進一步造成全球通膨壓力擴大。",2023-10-10 13:03:32,15396,〈台股風向球〉以巴戰爭短期連動兩題材股 以盤代跌消化不確定性,"['緯創', '聯發科', '瑞儀', '廣達', '威剛', '旺宏', '定穎投控', '大聯大', '\ufeff宏碁', '聯電', '緯穎', '元大高股息']",ea70af4d-c78b-4122-9f44-95e745181fe7
〈Q4產業前瞻〉鋼廠樂看旺季效應 價穩量揚營運拚好轉,"['鋼鐵', '中鋼', '中鴻', '春源']","鋼鐵產業第四季將進入傳統旺季，在供需狀況轉佳、原料成本維持高檔支撐價格下，鋼鐵廠看好，鋼市呈現「量穩價揚」，中鋼 (2002-TW) 更把握機會，力拚全年轉盈。


鋼鐵業進入週期性低谷已持續一年，現今製造業去庫存已至最後階段，加上全球各國鋼鐵供給相繼縮減、社會庫存來到低點，在第四季進入歐美年底耶誕消費旺季下、拉貨動能可期。


中鋼表示，8 月出貨量回升至百萬噸、單月轉盈，9 月出貨量可望持穩，且盤漲幅擴大下，獲利可望進一步向上；而 10 月盤價也維持上漲、第四季季盤也開出平高盤下，在傳統旺季加持下，全年可望力拚轉盈。


中鋼旗下中鴻 (2014-TW) 則表示，在量價同步回溫下，9 月後虧損已看到改善；10 月盤價續漲、接單穩定下，營運表現可望進一步向上，第四季出貨量將力拚超過 45 萬噸、優於第三季。


春源 (2010-TW) 則認為，三大用鋼產業中，汽車狀況不錯，營建鋼構雖然受到打房政策干擾，但利空已逐漸鈍化，機械及工具機用鋼則相對低迷，但市況也慢慢好轉，整體還是樂觀。


盛餘 (2029-TW) 指出，由於先前鋼市復甦不明朗，因此客戶囤料建庫存的意願也較低，庫存水準均控制在可控範圍，不像過去 2 年有高庫存的狀況，目前庫存水位相對低，在鋼價上漲下，將刺激客戶回補庫存需求。",2023-10-10 13:24:26,15395,鋼鐵產業第四季將進入傳統旺季，在供需狀況轉佳、原料成本維持高檔支撐價格下，鋼鐵廠看好，鋼市呈現「量穩價揚」，中鋼 (2002-TW) 更把握機會，力拚全年轉盈。,"['中鋼', '中鴻', '春源', '盛餘']",a9d6b9c1-6a9c-48ae-ab31-4deb0618090e
是方裸機雲服務將上線 涵蓋地區擴增10倍,"['是方', '雲端', '公有雲']","是方電訊 (6561-TW) 為加速拓展國際雲服務市場，與國際合作夥伴打造的全球 Bare Metal(裸機) 雲服務預計本月上線，服務範圍將從目前 4、5 個國家，一舉擴充至 40 個，加上屬於租賃服務，有助守穩毛利率表現。


Bare Metal(裸機) 雲服務為雲服務的租賃平台，當企業需要到特定區域市場時，相較於過往需要特地飛去建置網路，透過是方 Bare Metal 可以直接連置當地網路，並建置伺服器、運算、雲服務等。


總經理劉耀元補充，目前許多公有雲有類似的服務，不過僅提供城市較發達的地方，而與國際夥伴打造的全球 Bare Metal(裸機) 雲服務，範圍涵蓋超過 40 個國家、60 個城市，其中亞洲地區涵蓋日、韓、新加坡、越南、泰國、印尼及印度等 12 個合作國家。


此外，隨著墨西哥、巴西等南美市場蓬勃發展，在其他公有雲業者尚未進軍前，是方即可透過 Bare Metal(裸機) 雲服務滿足企業需求，且享有更高階的雲端應用服務效能和網路安全性。


是方三大事業中，雲端業務營收比重已攀升至 16%，期望隨著雲端需求增加以及 Bare Metal(裸機) 雲服務挹注下，雲端業務營收比重攀升至 20% 以上。


是方 9 月營收 2.74 億元，月減 0.46%、年增 6.59%；第三季營收 8.22 億元，季增 3.8%、年增 7.3%；累計前 9 月營收 24.18 億元，年增 6%。",2023-10-10 14:00:06,15394,是方電訊 (6561-TW) 為加速拓展國際雲服務市場，與國際合作夥伴打造的全球 Bare Metal(裸機) 雲服務預計本月上線，服務範圍將從目前 4、5 個國家，一舉擴充至 40 個，加上屬於租賃服務，有助守穩毛利率表現。,['是方'],03de40b8-645b-4a93-a942-d1fb64914209
PCB廠加速越南開產能 志超投資千萬美元於北越新廠本月試量產,"['越南', '志超', '健鼎']","配合仁寶 (2324-TW)、鴻海 (2317-TW) 及和碩 (4938-TW) 等 EMS 廠在越南的投資腳步，周邊供應鏈 PCB 及 PCBA 廠都動起來，包括健鼎 (3044-TW) 及志超 (8213-TW) 都在越南取得產能，志超在北越河南省建立的每月 30 萬呎新產能在本 (10) 月底進入量產。


志超目前的產能分布在台灣桃園平鎮、高雄，中國大陸的江蘇無錫、廣東中山、四川遂寧，北越的河南省新廠，則爲志超在兩岸之外第一處海外新產能開出，投資金額 1000 萬美元，主要在開出應用車載、光電 PCB。


志超主管指出，北越也有相當數量的台商網通設備廠，志超的北越新廠產能開出後，也將支援開出部分網通板的生產。


而取得先機的健鼎以象徵性的 1 美元價格購併越南同奈省日系 PCB 廠，並已完成股權移轉，預計在改善製程後投入包括伺服器板等產品的生產，這也是 PCB 月產能達千萬平方呎的健鼎首度跨出兩岸布局。


健鼎對於東南亞的執行投資案已有多年考察經驗，此次以 1 美元購併位於越南同奈省邊和工業區日系 PCB 廠，已經完成官方的股權移轉流程，並由大陸無錫廠副總經理呂正明出任負責人，預計再投資 1-2 億元改善製程，屆時可投入包括伺服器板等多層板產品的生產；同時，健鼎在取得此一越南新基地後，也將繼續拓展大型生產基地。


在 PCBA 廠部分，台表科 (6278-TW) 斥資 1500 萬美元在越南投資新產能，也是台表科繼印度之後，在海外開拓設置的新生產線，越南新廠產能預計今年陸續開出。


台表科生產線目前有 220 條 SMT 線，分別在台灣、中國大陸東莞、蘇州、寧波、廈門、咸陽、合肥、重慶、成都及印度，2023 年預估將建置越南河南省及墨西哥 Monterrey 廠，總產線將擴增至 230 條。",2023-10-10 15:00:07,15393,配合仁寶 、鴻海及和碩等 EMS 廠在越南的投資腳步，周邊供應鏈包括 PCB 及 PCBA 廠都動起來，包括健鼎及志超都在越南取得產能，志超北越新廠在本月底進入試量產。,"['仁寶', '鴻海', '和碩', '健鼎', '志超', '台表科']",83cc94d0-2172-46f9-af2d-6febd31b8866
台股Q4開局報佳音 三利多提供下檔支撐,"['台股', 'i15', 'AI', '外資']","台股第 4 季首周報佳音，單周上漲 166.83 點、周線收紅，投信法人認為，儘管外資仍持續從股市提款，但在內資買盤力挺下，搭配消費性電子銷售、庫存水位轉趨健康，預期加權指數下檔仍有支撐力道。


從籌碼面來看，三大法人中僅投信法人力挺台股，累計已是連 10 周買超台股，單周買超金額 121.41 億元，外資則連續第三周賣超，賣超 401.53 億元，自營商也在台股調節 86.30 億元，三大法人上周合計賣超 366.42 億元。


PGIM 保德信高成長基金經理人孫傳恕表示，從基本面來看，今年下半年起已見到台股獲利持續改善，預期進入 2024 年之後，在電子、景氣循環類股獲利帶動下，將恢復成長動能，預料第四季股市將呈現震盪向上格局。


孫傳恕指出，配合升息進入尾聲，有利於台股成長股的後市表現，且台股因為握有 AI 關鍵供應鏈，以及選舉行情逐步發酵，即使出現震盪，在全球股市中仍相對抗跌。


孫傳恕補充，國慶連假後，全球股市將面對法說、美股財報季，台股中的光學龍頭大廠、晶圓龍頭大廠將在 10 月上、中旬舉辦法說，美股的特斯拉、IBM、蘋果、英特爾等，則將於 10 月中、下旬公布財報數據，目前市場對於企業獲利展望正面，有助提振投資情緒。


安聯投信台股團隊表示，智慧型手機需求較預期佳，中國高階手機廠商重回市場推出新機，新款 iPhone 也隨後發表，都將帶動市場買氣升溫，預估智慧型手機佔半導體終端應用約 3 到 4 成，而智慧型手機需求回復，也有助於半導體復甦，後續可關注雙 11 及美國第 4 季終端銷售旺季狀況。


安聯投信台股團隊認為，儘管近期美債殖利率波動等雜音仍干擾市場，不過大方向並沒有太大改變，主要仍以 AI 為主軸，建議可聚焦具有行業進入門檻，並具有規格提升與均價增加的公司，將是下階段重要布局關鍵。",2023-10-10 17:00:24,15392,台股第 4 季首周報佳音，單周上漲 166.83 點、周線收紅，投信法人認為，儘管外資仍持續從股市提款，但在內資買盤力挺下，搭配消費性電子銷售、庫存水位轉趨健康，預期加權指數下檔仍有支撐力道。,[],208f68b1-885f-42db-9a43-82149b7e0405
