title,keywords,content,publish_at,id,summary,related_stocks,uuid
2024年最有前景的產業(二) 非地面網路、6G 通訊與氧化鎵 昇達科 聯發科 環球晶 受惠大,"['亨達投顧', '陳智霖', '趨勢分析', '非地面網路', '6G通訊', '氧化鎵', '第四類半導體', '低軌道衛星', '啟碁', '昇達科', '台揚', '聯發科', '鴻海', '華碩', '漢磊', '環球晶', '閎康']","〈明年台股 11 大看好科技產業 - 2〉


台股本週創高後震盪整理，智霖老師受邀上電視台節目有特別分享，科技類股明年的成長性明確尤其在半導體，因此震盪整理之後電子科技類股仍舊是關注的重點，繼上星期與投資人分享 2024 年研究機構看好的 11 大科技產業，本篇為第二集，我們來談談非地面網路、6G 通訊以及氧化鎵這三個產業，與在未來的應用，以及相關概念股。


〈下載陳智霖分析師 APP 獲得更即時資訊 ，完成註冊獎勵金最高 6000 元 〉


陳智霖老師的直播節目及 APP 的獨家廣播都會針對國際總經還有重要財經事件即時追蹤分析，同時提供產業趨勢方向，只要 APP 完成註冊驗證者都可獲得獎勵金 (最高回饋 6000 元)，邀請您可以立即點選下方連結免費下載陳智霖分析師 App，下載連結: 
https://hantec.liveinapp.com/jhih-lin-app-link


〈非地面網路、6G 通訊以及氧化鎵〉


非地面網路: 非地面網路 (NTN) 技術透過低軌道衛星傳輸，讓終端使用者用衛星通訊方式進行資料雙向傳輸，彌補 5G 基礎建設在偏遠地區覆蓋率不足狀況，由於衛星不再需要電纜，所以在通信基礎設施薄弱的鄉村和偏遠地區具有很大優勢，非地面網路與低軌衛星的關係，可以類比為地面網路與地面基地台的關係。

現階段非地面網路主要聚焦在行動衛星通訊應用領域，展望 2024 年，晶片大廠加速推出衛星通訊晶片趨勢，帶動手機大廠以系統單晶片 (soc) 模式將衛星通訊功能整合至高階手機內，在部分用戶對高階手機有穩定需求下，讓非地面網路朝向小規模商用測試發展，成為 2024 年加速非地面網路應用普及驅動因素。


6G 通訊標準化規劃於 2024-2025 年啟動，首個標準技術將在 2027-2028 年推出，預估 2030 年商業化，6 G 要比大頻寬、大連結、超低延遲的 5G 更快、更穩，未來 6G 可望朝向複合型的網路型態發展，結合地面和非地面網路提供全覆蓋網路。


行動通訊與衛星通訊、感測技術的整合將是 6G 的應用關鍵，6G 時代所追求的，是覆蓋更全面、設備連接更無縫、以及使用體驗更真實的通訊技術，6G 市場在 2030 年估值將達到 400 億美元以上，預估從 2023 到 2030 年的複合年成長率 (CAGR) 將達到 34.2%，成長相當快速。

氧化鎵 (Ga2O3) 被稱為第四類半導體的原因是，其具有超寬能隙的特性，相較於第三類半導體的碳化矽 (SiC) 與氮化鎵 (GaN)，氧化鎵能使材料能承受更高電壓的崩潰電壓與臨界電場，以及較低的導通電阻，在超高功率元件應用極具潛力，特別是在電動汽車、電網系統、航空航太等領域。氧化鎵材料本身有為熱與 P-type 摻雜不易達成的技術性問題，但由於產業前景方面應用廣泛，隨著功率半導體巨頭的跟進，以及關鍵應用的牽引，其商業化指日可待，可說是很具前瞻性的材料之一。


〈台股相關受惠股〉


非地面網路受惠概念股為啟碁 (6285-TW)、昇達科 (3491-TW) 與台揚 (2314-TW)，其中以昇達科受惠程度最高，是全球四大低軌衛星營運商及 5 大衛星通訊系統製造商之直接合格供應商，第三季低軌衛星產品營收增幅則高達 96%，客戶拉貨潮推升第四季與明年營收展望。 昇達科 11 月營收 1.5 億元，月增 31.9%，年增 20.2%，技術面經過量縮整理，股價強勢站回均線之上。


6G 通訊相關受惠股為聯發科 (2454-TW) ，聯發科是全球智慧手機晶片龍頭廠，積極布局下世代 6G 技術，「6G NTN 技術白皮書」，聯發科提出的 6G 願景是一個有彈性的多維度整合無線通訊系統，以一種真正無處不在的方式，提供沉浸式行動連網服務，聯發科 10 月營收 428 億元，創今年次高，目前股價沿著月均線緩步墊高，多頭的慣性並沒有改變。


氧化鎵受惠股則有晶圓代工的漢磊 (3707-TW)，以及磊晶廠的環球晶 (6488-TW)，還有超前部署第四代半導體的閎康 (3587-TW) ，從技術面而言環球晶看來相對強勢，環球晶在法說會表示由於碳化矽產能滿載、供不應求， 第四代半導體氧化鎵已申請專利，並持續研發相關技術，隨著高壓、高溫、高頻等應用場景的增加，未來商業化之後的應用，將有機會為公司帶來獲利。環球晶前三季營收達 538.9 億元，創歷年同期新高，
陳智霖分析師也有帶領會員買進環球晶，在
 532 元佈局並且在 588 元獲利高出，節目都有提供相關進出證據，最近股價呈現拉回，下一個進場點邀請您可以跟著智霖老師的操作規劃。


最新影音 (請點影音上方標題至 Youtube 收視品質會更佳)




才剛剛接觸陳智霖分析師的新朋友，建議您現在立即點選紫色圖片下載安裝陳智霖分析師 APP，老師有提供 APP 新註冊用戶免費體驗午報導航及互動教學會員影音的活動，歡迎您透過體驗來了解陳智霖老師如何選股以及盤中的會員服務，午報導航體驗都是限時限額開放，千萬不要浪費了您可以免費體驗的權益喔。


點擊連結免費下載註冊〈陳智霖分析師 APP〉獎勵金回饋立即領


https://hantec.liveinapp.com/jhih-lin-app-link


錢進熱線 02-2653-8299, 立即邁向系統依據的股票操作。


文章來源：陳智霖分析師 / 亨達投顧


本公司所推薦分析之個別有價證券

無不當之財務利益關係 以往之績效不保證未來獲利

投資人應獨立判斷 審慎評估並自負投資風險",2023-12-10 09:10:05,18054,無摘要,"['啟碁', '昇達科', '台揚', '聯發科', '漢磊', '環球晶', '閎康']",4c3ad40a-195d-4716-9299-b05b6c41becb
家登拿航太客戶15年長單 明年開始發酵,"['家登', 'FOUP', 'FOSB', '晶圓載具', '光罩盒']","家登 (3680-TW) 近年積極將精密加工技術從半導體拓展至其他領域，今年取得航太相關認證，並拿下國際一線大廠訂單，周期長達 15 年，將進一步挹注明年營運，打出除光罩盒、晶圓載具外的營運第三隻腳。


家登指出，公司在短時間內獲取航太 AS9100D 認證及 NAPCAP 特殊製程認證，與國際上一線客戶取得長期合作關係，創下客戶端最短時間打樣完成的紀錄，並取得長單，關鍵產品也通過美國 FAA 關鍵零組件認證並核准進口，奠定未來十年航太事業穩定發展的基礎。


展望明年，家登目標要超越全球半導體成長水準，提升在全球載具的市佔率，且除了持續投入半導體市場，也衝刺航太業務，並運用近期完成的現金增資，擴展相關業務，支持集團半導體及航太事業更長遠的規劃，致力根留台灣，。


世界半導體貿易統計 (WSTS) 及 SEMI 預估，明年全球半導體產值達 5760 億美元，年增 11.8%，其中，晶圓廠設備銷售額年增 14.8%、測試設備市場年增 7.9%、組裝 / 封裝設備市場年增 16.4%，家登也將專注大中華地區並提供美國市場在地服務，與台灣在地供應鏈聯盟聯手開拓新市場。


家登前 11 月營收 45.59 億元，年增 18.6%，已超越去年全年營收 44.92 億元。",2023-12-10 10:13:51,18053,家登 (3680-TW) 近年積極將精密加工技術從半導體拓展至其他領域，今年取得航太相關認證，並拿下國際一線大廠訂單，周期長達 15 年，將進一步挹注明年營運，打出除光罩盒、晶圓載具外的營運第三隻腳。,['家登'],7373e343-08f1-442c-a9e7-4a8d833fab77
〈台股風向球〉外資資金上膛 推波助瀾內資年底作帳行情,"['台股', '風向球', '外資', '內資', '作帳']","台股加權指數上周下跌 54.36 點，終結連 5 周上漲，儘管在美國 FOMC 會議前，市場有觀望氛圍，但台股交易員認為，台股周 KD 和月 KD 向上，隨著新台幣整理後轉強、外資持續流入，有助進一步推升由內資發動的傳統年底作帳行情，偏多格局不變。


觀察 11 月外資淨匯入約 3500 億元，但外資於 11 月以來買超台股金額僅約 2400 億元，顯示資金面有餘裕。


從技術指標來看，台股處相對高檔，日 KD 下彎，不過，周 KD 和月 KD 向上，指數橫盤整理後，維持偏多格局無虞。


籌碼面上，隨著新台幣上周的前半周陷入整理，外資上周在集中市場轉為小賣 54.5 億元，終結連 4 周買超，不過，投信轉買 55.3 億元，呈現你丟我撿狀態。


從金額觀察，外資上周主要賣超聯電 (2303-TW) 達 37 億元，技嘉 (2376-TW)25 億元，華新 (1605-TW) 近 19 億元，東元 (1504-TW)、國泰金 (2882-TW)、台達電 (2308-TW) 和定穎投控 (3715-TW) 均近 15 億元。


反觀投信主要加碼技嘉近 19 億元，聯電近 18 億元，統一 (1216-TW) 近 10 億元。


永豐投顧表示，近一周上市櫃公司相繼公布 11 月營收，普遍看來營收並無大幅度起色，大部分仍呈現月減年減現象，但在公布營收後，股價不跌，反而有利空出盡味道，顯示投資人已將目光放在 2024 年的復甦而忽略短期逆風，這正是作夢行情的開始。


不過，須留意此次 FOMC 會議將公布利率點陣圖和經濟預測，點陣圖可能顯示高利率將維持一段較長時間，不符合市場目前看待 2024 年 3 月或 5 月開始降息的極樂觀看法，留意屆時澆熄市場樂觀氣氛，引發短期震盪。",2023-12-10 10:22:53,18052,〈台股風向球〉外資資金上膛 推波助瀾內資年底作帳行情,"['聯電', '定穎投控', '台達電', '國泰金', '東元', '華新', '技嘉', '統一']",a4ac1445-58c2-4575-adec-fc3897bf1128
這9檔狂刷存「債」感 鎖定高利率末班車錢進債券ETF,"['債券ETF', '債市', '台股', '存債感', '美債']","美國升息循環進入尾聲，掀起全球瘋買債浪潮，美銀 11 月全球經理人調查指出，加碼債券淨比例已來到金融海嘯以來最高，國內債券 ETF 買氣同步直線上升，盤點今年存「債」感大爆發的 9 檔債券 ETF，近期就屬群益 ESG 投等債 20 + (00937B-TW) 最風光，掛牌首日 1 小時即達募集額度上限，另外，20 年期美債、投等債、公司債相關 ETF 也受到投資人青睞。


美債 10 月殖利率漲翻天，據金管會統計，銀行業 10 月加碼債券 876 億元，創 4 個月以來新高，累計前 10 月敲進債券 1 兆 242 億元，提早布局卡位。截至 11 月底，整體債券 ETF 規模接近 1.82 兆元，今年來激增約 6114.85 億元。


以近期交易熱度來看，根據統計，元大美債 20 年 (00679B-TW)、國泰 20 年美債 (00687B-TW) 五日均量皆超過 5 萬張，統一美債 20 年 (00931B-TW) 五日均量也有 2.2 萬張，元大投資級公司債 (00720B-TW)、元大 AAA 至 A 公司債 (00751B-TW) 及國泰 10Y+ 金融債 (00933B-TW) 亦有超過 2 萬張。


分析師郭哲榮日前秀出對帳單，指出透過投資國泰 20 年美債 ETF，帳上淨賺已經來到 496 萬元，由於先前公布最多賠 150 萬元，一來一回差了快 650 萬元，報酬率接近 10%，如同用美債賺到一根漲停。


「不敗教主」陳重銘
在臉書上也秀出自己的債券 ETF 部位，他坦言，先前投入美債 20 年 ETF，最慘時帳面上賠百萬，但隨著持續配息，並加碼一些投資等級債，目前帳面上已經賺錢了。其中，00795B 買得最早，領到最多次股息，他認為美國公債很安全，便宜就買就對了，加上投等債也買，就能達到分散配置，接著等待明年美國開始降息。


今年月配型 ETF 掀起熱議，在爆發性的買盤挹注下，幾乎檔檔人氣爆棚，若是月配息搭配債券話題的基金，更是一掛牌即募爆，目前市面上共有四檔月，分別為規模上千億元的中信高評級公司債基金、中信優先金融債、國泰 10Y+ 金融債與群益 ESG 投等債 20+。


其中，群益投信旗下 00937B 上月底成立，短短 3 天就募集超過 150 億元，創台灣債券 ETF 史上最佳紀錄，5 日掛牌上市更上演秒殺行情，僅一小時就達可募集額度上限的 195 億元，是債券 ETF 史上頭一遭，當天成交量刷出 23.6 萬張天量，群益投信因而公告暫停受理初級市場申購，但投資人仍可透過次級市場交易。


擁有千億級規模、月配息機制的高評級公司債 ETF 中信高評級公司債及同樣也是月配息的中信優先金融債，日前公告 12 月第一階段分配評價結果，預估分別配息 0.138 元、0.14 元，若以 7 日淨值來計算年化配息率，00772B 為 4.61%，00773B 為 4.60%，現金收益將於 14 日公布 ，想參與配息的投資人須在 15 日前申購。




製表：鉅亨網記者陳于晴




今年債市買氣大爆發，元大投信指出，債券 ETF 具有節稅優勢，配息收益計入海外利息所得，適用個人最低稅負制，一般投資人新台幣 670 萬元內可免稅 (自然人)，且因其配息來源屬於境外所得，無論單次領息金額高低，都免繳二代健保補充保費。


永豐 20 年美公債 ETF 經理人周彥名表示，目前美債殖利率仍維持在相對高檔區間，加上市場普遍認為聯準會升息將邁入尾聲，甚至幾乎一面倒地預期降息，讓資金對債市偏好明顯優於股市，而長天期債券吸引力更勝短債。


周彥名建議，投資人若想降低長債利率風險，可將部分資金分散至美國短期公債，同樣具備美元資產性質，而且短天期債券距到期天數短，價格波動通常小於中長天期債券，相當適合閒置資金進行短暫停泊。


專家也提醒，民眾在投資時也須留意 ETF 的折、溢價情形，避免因溢價收斂而蒙受虧損。",2023-12-10 10:26:59,18051,美國升息循環進入尾聲，掀起全球瘋買債浪潮，美銀 11 月全球經理人調查指出，加碼債券淨比例已來到金融海嘯以來最高，國內債券 ETF 買氣同步直線上升，盤點今年存「債」感大爆發的 9 檔債券 ETF,"['群益ESG投等債20+', '元大美債20年', '國泰20年美債', '統一美債20年', '元大投資級公司債', '元大AAA至A公司債', '國泰10Y+金融債']",34c0d8bc-1c7c-444a-bc4a-782d69e72587
中鋼52年廠慶重返小港「起家厝」 董座：今年逆轉勝明年向上,"['中鋼', '廠慶', '鋼鐵']","中鋼 (2002-TW)9 日晚間在「起家厝」小港廠行政區舉辦 52 週年廠慶活動，董事長翁朝棟致詞時表示，今年雖然市況挑戰，但在全體中鋼人攜手團結下成功逆轉勝，預計明年上半年鋼市將重返上升態勢，期許同仁共同推動二軸三轉實現新願景，為中鋼永續成長奮力前行。


翁朝棟表示，今年是非常堅忍拚搏的一年，市場復甦的時間點不斷向後遞延，但中鋼勇於面對挑戰，今年前 11 月自結獲利並已超過 2020 年最艱困的一年，同仁 12 月也領到久違的產銷獎金，且隨著歐美鋼廠領漲帶動亞州指標同業跟進，預計明年上半年將邁入上升軌道。


翁朝棟進一步指出，面對全球鋼市競爭態勢與 2050 年全球碳中和艱鉅挑戰，中鋼在「新願景」引領下，今年首度擘畫十年期經營發展策略，積極推動「高值化精緻鋼廠」及「發展綠能產業」兩大主軸及開展三大轉型工作。


中鋼今年廠慶活動在小港廠行政區舉行，以「我愛 (52) 中鋼 永續發光」為主軸，並將「智慧創新、綠能減碳、價值共創」三項新願景要素及「數位轉型、低碳轉型、供應鏈轉型」三大轉型行動等意象，設計成六座燈柱。


而對於重返小港基地舉辦廠慶活動，中鋼說明，主要是近年來新生代員工陸續的加入，小港是中鋼的「起家厝」，也是公司精神醞釀發揚的基地，希望能讓新進同仁感受建廠初期的篳路藍縷歷程，勉勵飲水思源，同時，能夠承接中鋼 52 年累積的經驗及智慧，並承擔下一個 50 年發展的榮耀使命。",2023-12-10 11:24:26,18050,中鋼 (2002-TW)9 日晚間在小港廠行政區舉辦 52 週年廠慶活動，董事長翁朝棟致詞時表示，今年雖然間饋，但在全體中鋼人攜手團結下成功逆轉勝，預計明年上半年鋼市將平穩向上，期許同仁共同推動二軸三轉實現新願景。,['中鋼'],cfbc844a-dba5-4dec-a3c8-b2702e2d365f
