content,publish_at,id,summary,title,keywords,related_stocks,uuid
"台鋼集團旗下桂田文創 (4806-TW) 去年在藝人經紀展開以及影視作品完成下，虧損持續收斂，今年受惠應援經濟持續發酵，帶動藝人經紀及周邊商品銷售，整體營收估成長 2 倍以上、也可望終止連 8 年虧損。


桂田文創表示，應援經濟是持續攀升的百億產值事業，尤其在運動休閒娛樂風潮興起、帶動球賽票房持續上升，旗下藝人經紀的拉拉隊 Wing Stars 線上擴展至線下實體活動 (O2O) 效應顯現，也展開多元商業合作。


桂田文創指出，今年持續擴大藝人職能，銜接進入演藝產業鏈，並結合節目製作業務打造自製原創 IP；應援商品周邊則持續尋找跨界異業合作。另外，活動公關持續多元接案、累積實績，目標未來爭取跨國合作。


桂田文創去年受惠 Wing Stars 知名度提升、商演活動增加，也帶動應援商品銷售，加上影視作品《老少女奇遇記》完成等因素，去年全年營收 6715.6 萬元，年增 49.5 倍，虧損也估較 2023 年再收斂。


展望今年，桂田文創看好，藝人經紀持續成長以及多項文創業務展開，全年營收將成長超過 2 倍，達到 2 億元，並可望損平；若以營收比重來看，藝人經紀 3 成、商品銷售 3 成、活動公關 2 成、影視製作 2 成。


而為健全財務結構及配合未來營運發展需要，桂田文創也決議辦理減資股本彌補虧損，減資金額 9.99 億元，減資比率 50%，力拚營運轉骨；桂田文創預計將於 4 月 15 日召開股東會。",2025-02-02 08:10:05,37540,〈潛力股〉桂田文創今年營收估成長 2 倍 可望終止連 8 年虧損,〈潛力股〉桂田文創今年營收估成長2倍 可望終止連8年虧損,"['台鋼集團', '桂田文創', '藝人', '經紀', '影視']",['昇華'],3b6f2ea0-99f3-46db-a219-229959e30ffc
"興櫃交易自動化設備業者高明鐵 (4573-TW) 積極進行轉型展現成效，在市場的光通訊及半導體產業對於矽光子封裝 (CPO) 需求增加之下，2024 年下半營運優於上半年，且可望在下半年獲轉盈的績效挹注並弭平上半年的虧損，2024 年全年轉盈，預計在第四季提出上櫃申請。


高明鐵的業績成長激勵之下，最快在 2025 年第四季提出上櫃申請，主辦券商爲華南永昌證券。高明鐵金龍年股價由 12.35 元上漲至 1 月 22 日收盤的 88.5 元，漲幅達 6.16 倍，


同時，高明鐵 2024 年下半年營收營收優於上半年表現，全年營收 6.23 億元，年增 52.77%，創 2019 年以來的 6 年新高，法人預估高明鐵除 2024 年轉虧爲盈之外， 2025 年全年營收將有至少 20% 的成長幅度，預估並將維持下半年營收營收優於上半年的走勢。


同時，市場於光通訊及半導體產業對於矽光子封裝 (CPO) 需求增加之下，於大陸東莞成立子公司及組織銷售團隊，投資金額爲人民幣 500 萬元在 3 月正式營運，主要以銷售光模塊組裝相關系統爲主。


高明鐵 2024 年業績高成長達 52.77%，主要在 AI 晶片和資料中心應用加速矽光子和 CPO 共同封裝技術，歐美大廠在前端 PIC 和 EIC 設計占據先機，中國和韓國廠商急起直追，台廠包括台積電 (2330-TW)、日月光投控 (3711-TW)、鴻海 (2317-TW)，以及光通訊與光學元件等台廠，力拚形成矽光子和 CPO 封裝利基產業鏈。同時，高明鐵也向潛在客戶端積極送樣並尋求認證中。


高明鐵於 2018 年登錄興櫃交易，但 2020 年以來受制於疫情及自動化產業結構的改變，並且高明鐵內部在做整體研發方向調整，造成連續 3 年的虧損營運，但在今年以來在矽光子 (CPO) 發展的有利局面之下，有利高明鐵的高精密度耦合對位系統銷售更上層樓，有利於業績轉虧爲盈。


高明鐵董事長陳志鑫強調，高明鐵的高精密度耦合對位系統銷售利基，在於高精度的機械設計及來高明鐵依核心技術開發的應用軟體及演算法搭配競爭優勢，目前的產品主要市場競爭對手在日本及德國廠商，而需求的激增之下，高明鐵近期產品系列更與全球國際 AI 伺服器領導廠商及台灣光纖被動元件與模組製造大廠洽談合作案。


高明鐵於 2018 年登錄興櫃交易，但 2020 年以來受制於疫情及自動化產業結構的改變，並且高明鐵內部在做整體研發方向調整，造成連續 3 年的虧損營運，但在 2024 年以來在矽光子 (CPO) 發展的有利局面之下，有利高明鐵的高精密度耦合對位系統銷售更上層樓，業績在 2024 年可望轉虧爲盈。",2025-02-02 09:10:02,37539,興櫃交易自動化設備業者高明鐵 (4573-TW) 積極進行轉型展現成效，在市場的光通訊及半導體產業對於矽光子封裝 (CPO) 需求增加之下，2024 年下半營運優於上半年，且可望在下半年獲轉盈的績效挹注並弭平上半年的虧損。,光通訊加持高明鐵龍年股價漲6.16倍 去年料轉盈Q4申請IPO,"['高明鐵', '台積電', 'CPO', 'IPO', '日月光']","['台積電', '日月光投控', '鴻海', '高明鐵']",1ce67f4b-d016-4fa8-86a8-cb0a482f33b5
"人工智慧 (AI) 與淨零排放為全球趨勢，為鼓勵企業投資創新技術，發展重點創新事業，政府自去年著手修正產創條例，以減稅、降低門檻及保護關鍵技術等措施，提高 AI 及淨零產業發展誘因，進而吸引外資或天使投資人挹注新創，為推升力道，立院並於今年 1 月 15 日的初審再調高投資上限到 20 億元。但除了給紅蘿蔔也有棒子，若違反相關條例，除被要求限正改正、撤資，最高會罰到上千萬元。


安永聯合會計師事務所稅務依規服務執業會計師葉柏良，分享立院於 113 年 12 月 19 日及本會期初審的最新進度，歸納產創條例修法主要重點有三:


1. 加碼投資額度:


繼 113 年 12 月 19 日修法通過新納入 AI、節能減碳項目，將投資上限提高至新臺幣 18 億元，施行期限延長至 118 年 12 月 31 日。最新進展是經濟、財政聯席委員會於 114 年 1 月 15 日, 初審通過上限增加到新臺幣 20 億元。


2. 保護關鍵技術:


修法要求，凡公司從事投資國外特定國家或地區、特定產業或技術或達一定金額以上，需事前申請核准。亦即在「 國別」「產業」「技術」「 金額」分別都有限制，以保護新創的關鍵研發技術， 也是保衛產業競爭力。


3. 支持新創發展:


修法規定，有限合夥創投事業的實收出資額門檻, 調降至新臺幣 1.5 億元, 投資新創比例提高至 50%, 得採透視個體概念課稅。第 23 條之 2，更為天使投資人投資租稅抵減放寬, 增訂個人投資設立 2 年以上未滿 5 年的高風險新創事業公司符合要件者適用。


葉柏良表示，產創條例修正，直接受惠是國家重點發展、具國際競爭力產業，如最熱門的半導體及相關產業鏈，提供優惠措施，吸引外商投資、進而協助新創產業擴產，對業者是項利多。但因先前的投資抵減適用對象，未擴及 AI 及淨零產業，故在修法特別將這兩項納入修法範疇，適用於租稅優惠範疇。


再者，政府考量半導體等關鍵技術流到別的國家，導致國內競爭力降低，故將保護關鍵技術的精神納入第 22 條，針對投資範疇設限，並需事先申核。


此外，為促進新創事業發展，再降低投資門檻，首先是延長使用期限，原 113 年底到期的落日條款，本次修正再延長 5 年，至 118 年 12 月 31 日。本次修正並擴大產業適用範圍，從原本的「自行使用之智慧機械、第五代行動通訊系統 (5G)、資通安全產品或服務之相關軟體、硬體、技術或技術服務」，新納入「人工智慧產品或服務及節能減碳之相關軟體、硬體、技術或技術服務」，有助於引導百工百業投資相關設備，落實 AI 化與低碳化雙軸轉型。


在租稅優惠上，經申請後並獲專案核准的事業，得選擇於符合規定支出金額的年度 5% 內，或 3 年內 3% 限度內，抵減營利事業所得稅，但各年度投資抵減金額以不超過當年度應納營所稅的 30%。


本次需特別留意的是，除了優惠條件也有加重罰則。新草案除金額限制之外，針對投資特定的國家或者地區，或者是投資涉及特定的產業跟技術也有嚴格規定，葉柏良表示，條文指涉的特定國家地區，應是強調如伊朗、伊拉克等有出口管制的國家，至於特定產業技術，比如半導體產業或者技術，即應事先申請核准。


葉柏良強調，第 22 條本次新增重要罰則：第一個是影響國家安全，第二是對國家的經濟有不利的影響，第三是影響政府遵守所締結的國際條約或者是約定。第四則是違反勞動相關的法規，引起重大勞資糾紛。企業需特別留意，若未經核准逕行投資，或發生上述重大違規者，除被要求限期改正或撤資，最高會處 1000 萬的罰款。",2025-02-02 09:40:04,37538,人工智慧 (AI) 與淨零排放為全球趨勢，為鼓勵企業投資創新技術，發展重點創新事業，政府自去年著手修正產創條例，以減稅、降低門檻及保護關鍵技術等措施，提高 AI 及淨零產業發展誘因，進而吸引外資或天使投資人挹注新創，為推升力,有紅蘿蔔也有棒子！AI淨零納產創條例 若違反這4項最重罰千萬並撤資,"['產業創新條例', '經濟部', '立法院', 'AI', '淨零']",[],3d01a5a5-891d-4338-a92b-d8ed991a425c
"化學材料廠長興材料 (1717-TW) 今年的成長策略明確，除持續擴大特用材料與合成樹脂的海外市場占比外，電子材料部門也將跨足半導體設備領域，同時提升乾膜光阻高階產品比重。


長興材料表示，2024 年海外市場布局已見成效，2025 年將持續提升海外市場比重，以因應大陸市場競爭。在電子材料方面，公司將致力提升高階產品占比及整體市場占有率，並針對台、日、歐美及大陸市場分別制定拓展策略。


在新產品研發方面，長興材料除了精進 ABF 載板設備外，也將進軍半導體設備領域。此外，乾膜光阻業務預期將隨整體產業成長，公司將著重於提升高階產品比重。


長興材料 2024 年業績表現優異，12 月稅前純益 2.48 億元，年增 77.73%。雖然第四季為傳統淡季，但公司第四季營收達 112.67 億元，與第三季 113.34 億元相當，第四季稅前盈餘 7.26 億元更較第三季增加 7.35%，優於預期。


長興材料 2024 年全年稅前純益 27.44 億元，年增 25.73%，每股稅前純益 2.33 元。三大事業部門均有成長，其中特用材料與合成樹脂在整體銷長及成本有利下獲利顯著增加，電子材料部門則受惠於產品組合優化，雖乾膜光阻與精密設備銷量持平，但獲利仍較前一年度成長。",2025-02-02 10:10:02,37537,化學材料廠長興材料 (1717-TW) 今年的成長策略明確，除持續擴大特用材料與合成樹脂的海外市場占比外，電子材料部門也將跨足半導體設備領域，同時提升乾膜光阻高階產品比重。,〈潛力股〉長興材料擴大海外布局 電子材料進軍半導體設備領域,"['長興材料', '半導體', '化學']",['長興'],ea400a03-0e92-468c-94e3-8accf5da0fcf
"輝達 (NVDA-US)GB200 去年第四季小量出貨後，並在今年第一季放量，電子五哥包括廣達 (2382-TW)、緯創 (3231-TW)、英業達 (2356-TW)、和碩 (4938-TW) 以及仁寶 (2324-TW) 也都釋出蛇年最新產業展望，同時也提出各種因應川普 2.0 的布局與措施。 


廣達：GB200 需求未見減少如期出貨 第三季推 GB300 


市場傳出大型雲端業者 (CSP) 對 GB200 需求減少，輝達 GB200 出貨進度可能延後一季，不過廣達指出，需求未見減少，GB200 將如期於第一季出貨，另外，預計第三季將推出 GB300，目前正在開發中。 


至於通用型伺服器展望，廣達表示，去年第四季已經看到通用型伺服器有往上趨勢，雖然成長幅度仍不如 GPU、AI 伺服器，預期今年仍維持一定的成長。 


針對川普 2.0 來臨，廣達海外布局也已有所準備，包括美國加州 Fremont 廠、田納西州廠，以及泰國都有擴產計畫，廣達與其他業者相比，面臨川普 2.0 的壓力較小。 


緯創看好今年 AI 伺服器營收持續年增三位數 黃仁勳站台按讚 


緯創去年通用型伺服器加上 AI 伺服器營收比重達 45%，其中，AI 伺服器去年成長三位數的目標已經達成。緯創預期，今年通用型伺服器加上 AI 伺服器營收比重將突破 5 成，而 AI 伺服器將持續有三位數百分比成長的表現，且這幾年將高度成長。 


此外，緯創也積極拓展其他 AI 產品領域，包括 AI PC、SoW(晶圓級系統集成封裝技術)，以及邊緣 AI 等皆有布局，其中，SoW 相關產品已與台積電 (2330-TW) 合作超過 1 年。 


輝達執行長黃仁勳現身緯創尾牙，指出 AI 的出現，重新定義了人類最重要的工具，且現在正處於令人興奮的時刻，但輝達無法獨自完成一切，因此需要緯創、需要台灣的生態系，一同在 AI 時代成長，高喊「緯創是很好的合作夥伴」。 




輝達執行長黃仁勳 (右二) 現身緯創尾牙。(鉅亨網資料照)




因應川普 2.0 英業達赴美設廠德州為評估首選 


英業達過去在墨西哥、泰國、捷克、中國等地皆有布局以分散風險，針對美國總統川普上任，可能因此帶來關稅問題，透露若要到美國設廠，德州會是評估首選。 


英業達過去一兩年持續拓展生產基地，墨西哥廠有筆電、PC、車用及伺服器產品；泰國伺服器新廠已在去年 10 月完工。 


針對美國設廠議題，英業達說明，仍須觀察川普課稅政策，目前尚未定調，不過因德州距離墨西哥廠較近，加上電力相對充足，認為最可能的地方是德州。對於後段組裝而言，最重要的就是電力來源充足，生產線的架設也相對容易。 


和碩 GB200 整機已送至客戶資料中心測試 持續執行 5 年計畫 


和碩指出，輝達 GB200 整機完成組裝，且已送至客戶資料中心進行測試，若後續進展順利，看好相關訂單很快便能繳出好成績。 


和碩表示，公司在伺服器上，去年持續穩健布局，在人力與計畫皆投入大量資源，且和碩站在對的方向、踩著穩健的腳步，去年底也通過中型客戶的設備測試，預計今年就會有成果。 


另外，和碩墨西哥廠的伺服器預計在今年 4 月開始投產，至於是否赴美設廠，和碩目前仍在評估中，很快就會有定論。 


和碩持續執行 5 年計畫，在原有基礎上繼續長大，進一步推升獲利表現，聚焦新事業，包括醫材、AI 應用軟體、AR 眼鏡、機器人等，期望 4 至 5 年內可以開花結果。 


仁寶衝刺 AI 伺服器事業 力拚 AI 伺服器營收占整體伺服器 15 至 20% 


仁寶 2024 年非 PC 營收比重約 25%，其中伺服器營收占非 PC 營收中的 2%，而 AI 伺服器僅占伺服器營收中的低個位數百分比。仁寶指出，伺服器是今年重點發展的領域，將全力衝刺 AI 伺服器業務，力拚 AI 伺服器營收占整體伺服器 15 至 20%。 


仁寶表示，持續與輝達加深合作關係，積極探索 MGX 平台以及其他解決方案所帶來的機會，除鎖定四大雲端業者 (CSP) 外，也聚焦推論、小型模型等應用領域。 


此外，仁寶也跨足液冷領域，與 ZutaCore、Auras 及 BP 嘉實多 (Castrol) 攜手合作，共同推動液冷技術的應用與創新，特別是直接液體冷卻 (DLC) 以及浸沒式冷卻 (IC)，提供現代高耗能處理器散熱的理想解決方案。 




仁寶展示伺服器產品。(鉅亨網記者劉玟妤攝)",2025-02-02 10:40:03,37536,輝達 GB200 去年第四季小量出貨後，並在今年第一季放量，電子五哥包括廣達、緯創、英業達、和碩以及仁寶也都釋出蛇年最新產業展望，同時也提出各種因應川普 2.0 的布局與措施。 ,〈蛇年產業景氣前瞻〉輝達GB200啟動出貨 電子五哥曝最新展望,"['電子五哥', '輝達', 'GB200', 'AI伺服器', '廣達', '緯創', '英業達', '和碩', '仁寶']","['廣達', '緯創', '英業達', '和碩', '仁寶', '台積電', '輝達']",60a52fe4-7b1d-4431-94e4-63192dae882f
"台積電 (2330-TW)(TSM-US) 近期積極擴大委外測試與封裝，目的要將廠房空間用於最高階領域，多家測試廠皆積極爭取，IC 測試廠欣銓 (3264-TW) 近期傳出也是台積電考慮對象之一，對此公司回應，有任何新機會公司皆會積極爭取，看好今年營運重返成長。


台積電近來為因應客戶強勁的先進封裝需求，除了率先將 oS 段的封裝外包給日月光、矽品外，也陸續將蘋果 (AAPL-US) 處理器測試訂單交由旗下精材 (3374-TW)，並降低自家再生晶圓的生產比例，為的就是騰出廠房空間，專注在最高階的先進封裝，也讓台灣相關供應鏈受惠外溢訂單。


針對外溢訂單，欣銓不針對單一客戶評論，指出有任何機會都會積極爭取。據了解，欣銓現階段仍有廠房空間可以使用，如 2021 年甫投產的鼎新二廠仍有兩、三個樓層可以使用，龍潭廠也已完工，正在申請使用執照，具備廠房空間的優勢。


展望後市，欣銓去年受車用與工業客戶進行庫存調整，全年營收呈現小幅衰退，今年儘管歐、美系 IDM 大廠仍在去化庫存，不過隨著庫存去化至健康水準，也有機會重啟拉貨，另外，連接器應用今年受惠 AI 伺服器需求延續，相關訂單今年也可望維持增長態勢。


欣銓也積極拓展新應用，搶食 ASIC 商機，欣銓目前已與美系與台系 ASIC 客戶接洽，進行測試工程驗證，未來隨著客戶放量生產，可望貢獻公司營收，成為未來新動能。",2025-02-02 11:10:03,37535,台積電 (2330-TW)(TSM-US) 近期積極擴大委外測試與封裝，目的要將廠房空間用於最高階領域，多家測試廠皆積極爭取，IC 測試廠欣銓 (3264-TW) 近期也傳出也是台積電考慮對象之一，對此公司回應，對於任何新機會皆會,〈潛力股〉欣銓今年營運重返成長 靜待外包商機,"['欣銓', 'IC測試', '台積電', '委外', '先進封裝', 'ASIC']","['台積電', '欣銓', '精材', '台積電', '蘋果']",6af28382-eed6-4fb5-95f2-11a11e3e0c30
"走過 Covid-19 疫情，金融業 2024 迎來大豐收的一年，14 家金控全年狂賺近 6000 億元，再創輝煌佳績，金融三業前 11 月稅前盈餘更已突破兆元大關。多家金控去年在國內外股票及基金積極實現資本利得，加上淨值項下其他權益持續轉佳，為 2025 年股利發放添增動能，且多檔金融股股價已墊高，若要維持有競爭力的殖利率水準，勢必得多發現金股利。


14 家上市金控 2024 年合計稅後純益逼近 6000 億元，達 5979.8 億元，年增 63.7%，超越 2021 年 15 家金控合賺 5806 億元，改寫史上新高紀錄。其中，富邦金 (2881-TW) 去年豪賺逾 1500 億元、國泰金 (2882-TW) 亦大賺超過千億，金控雙雄合計獲利占全體金控比重達 44%。


金融業榮景主要受惠 2024 年美股、台股多頭行情，加上美元匯率強勢，挹注壽險業營運，業者把握時機積極實現資本利得，使得產壽險、證券業獲利普遍大幅提升，銀行業下半年雖面臨 Fed 降息壓力，但所幸降息速度未如市場預期般快速，淨利息收入仍有不錯表現。


根據金管會統計，台灣金融三業 2024 年前 11 月稅前盈餘合計達
新台幣
 1 兆 221.43 億元，年增 44.15%，為史上首見突破兆元大關，更超越歷年全年紀錄，其中，銀行獲利占比高達 52%，並創下歷年同期新高，證券業獲利亦創同期新高，保險業則寫下次高紀錄。


台股金龍年封關，金融股全年累計上漲 451 點、漲幅 26.92%，收在 2126.33 點，雖然略遜大盤漲幅 30%，但仍顯著優於兔年的漲幅 7.91%。


觀察 14 家上市金控龍年股價表現，國泰金累計大漲逾 52%，奪下龍年金控飆股王；新光金 (2888-TW) 受到雙雄搶珠的追捧，以 46% 漲幅位居第二；富邦金與凱基金 (2883-TW) 龍年狂漲約 43%，股價也相當強勢；中信金雖無緣成為新光金的結親對象，但反而受到外資力挺，股價強漲近 4 成；此外，華南金、元大金、永豐金、玉山金、國票金全年也有雙位數的漲幅。


富邦金 2024 年大賺逾一個股本，稅後純益來到 1511.6 億元，改寫史上新高紀錄，EPS 更衝破 10 元大關、達 10.8 元。法人指出，富邦金已連續 15 年發放股利，近 5 年平均現金殖利率為 3.82%，近 5 年平均盈餘分配率為 46.9%，法人保守估計，富邦金現金股利至少派發 3.5 元，總股利可望突破 4 元，才能維持與同業相當的水準，富邦金董事長蔡明興先前也公開表態，去年獲利亮眼，加上股價攀高，確實應該多發現金股利，而股票股利因應股東期盼仍會持續穩定配發。


國泰金 2024 年稅後純益 1111.9 億元，年成長 116%
，
EPS 達 7.28 元，累計稅後純益及 EPS 皆創歷史次高紀錄。法人表示，國泰金也是連續 15 年發放股利，近 5 年平均現金殖利率為 4.28%，近 5 年平均盈餘分配率為 43.7%，因此，預期現金股利要發出至少 2.8 元才有競爭力。對於股息殖利率是否有機會上看 4%，總經理李長庚先前在法說會上表示，「不敢打包票」，但會努力爭取，可預期股利會比去年好。


中信金 (2891-TW) 2024 年稅後純益達 720.28 億元，每股稅後純益 (EPS) 為 3.64 元，同創歷史新猷。法人也對中信金今年股利配發寄予高度期待，中信金已連續 17 年發放股利，近 5 年平均現金殖利率為 4.6%，近 5 年平均盈餘分配率為 53.8%，法人推估，中信金現金股利挑戰 2 元。總經理高麗雪前一次法說會也鬆口，以整體獲利來看確實有量能發放。


多家金控去年也繳出亮麗成績單，其中，連續兩年股利掛蛋的新光金，2024 終於擺脫虧損陰霾，全年大賺 206 億元，寫歷史次高，EPS 達 1.26 元，今年有機會重新配發現金股利，但最後一關仍需經過保險局核准。此外，元大金 (2885-TW) 受惠台股多頭行情及 ETF 市場蓬勃發展，去年大賺 358.3 億元，EPS 達 2.77 元，寫下史上次高紀錄，法人樂觀期待元大金股息殖利率上看 4%。",2025-02-02 11:40:02,37534,金融業 2024 迎來大豐收的一年，14 家金控全年狂賺近 6000 億元，再創輝煌佳績,〈蛇年產業景氣前瞻〉存股族安啦！金控業2024豐收年 2025股利香噴噴,"['金控', '金融股', '現金股利', '獲利']","['富邦金', '國泰金', '新光金', '開發金', '中信金', '元大金']",d062ff02-3b0f-4b84-97f9-a9cce21ed8fa
