title,keywords,content,publish_at,id,summary,related_stocks,uuid
NVIDIA公布財報，激勵台股再創史高！產業後市如何看待一文看懂,"['趨勢分析', '永豐金證券', 'AI', '輝達']","輝達財報公布，盤後股價漲約 10%，激勵台股再創歷史新高，AI 股價欣欣向榮，不過，輝達財報有哪些重點? 公司又怎麼看待產業後市? 開春後 AI 股價一度沉寂，在輝達利多上陣後已有回神，但此時要追 AI 還是要賣? 操作上應該注意哪些? 本文將從操作面帶大家細看。


輝達盤後大漲帶動台股創高，AI 喝了再上


週四台股迎來一陣春風，指數再創歷史新高，主要由 AI 相關個股所帶動，而開春後漲多呈現拉回的 AI 股週三重新回神主因還是在輝達財報表現。


眾所矚目的 AI 霸主輝達清晨公布財報，營收創新高、獲利亦遠超預期，公司看好本季將繼續迎來成長，並給出優於預期的營收展望，消息激勵盤後股價漲約 10%，不過盤後終究不是開盤，今晚輝達的實際表現更需要加以重視。


輝達財報展望大幅擊敗市場預期，樂觀看待 AI 後
市


輝達公告 4Q24 營收 221 億美元，季增 22％、年大增 265％，表現優於市場預估的 206.2 億美元。第四季純益 128.39 億美元，季增 28%，年增 491%，每股盈餘 5.16 美元，年增 486%，遠超過投資人的預期。四大業務板塊中以 Datacenter 持續維持最高增長，+26.8%QoQ，409%YoY，營運續創新高，佔營收比重超越八成，來到 83%。


在 FY1Q25 展望方面，受惠各領域 AI 服務器建置需求強勁，Datacenter 業務持續保持增長，部分增長將被 Gaming 營收下滑抵消，公司指引 FY1Q25 營收為 US$235~245 億 (+6~11%QoQ；+227~240%YoY)，毛利率 76.5~77.5%，展望亦優於市場預期，至於新產品 H200 將於 2Q24 上線，預計營運大幅提升，公司對 AI 產業保持樂觀看法不變。


此外，市場關注的中國區營收，目前來自中國的營收降至 5% 左右，預期 FY1Q25 變化不大，目前僅銷售不需批准的產品，未來將持續與客戶合作提供合規的新產品滿足需求。


輝達帶來希望，此時要追 AI 還是要賣? 完整文章請至
豐雲學堂
觀看！


延伸閱讀：


1. 
孫明德 × 李學詩強強聯手！分享 2024 年最新總經情勢解析，點我搶名額


2.
【豐學 PRIME｜投資知識不再挑食】從總經、產業、個股、話題時事、到存股策略都幫你準備好，時間有限就看這些！


3.
【法人籌碼跟著走】透過投信動作，每天篩出 1~5 檔有價差潛力的公司，選股痛點一次幫你解決",2024-02-22 10:47:41,20408,無摘要,[],5b9c6802-e10f-492f-aa0d-cf4beb4927d8
〈焦點股〉變壓器需求題材熱 華城、士電漲勢凌厲,"['重電', '華城', '士電', '變壓器']","重電雙雄華城 (1519-TW)、士電 (1503-TW) 持續受惠變壓器需求暢旺，帶動今 (22) 日漲勢凌厲。華城漲逾 3%，士電更是大漲逾半根停板，股價寫下歷史新高，雙雙站穩所有均線。 


華城今天以 515 元開高走高，最高漲至 525 元，漲幅約 3.35%，成交量超過 6000 張。士電今天強勢表態，以 163 元開高走高，最高來到 174.5 元，一舉超過 2023 年 7 月時的 174 元，股價寫下歷史新高，成交量超過 3.7 萬張。 


法人預估，2023 年至 2026 年為美國《基礎設施投資和就業法案》(IIJA) 以及《降低通膨法案》(IRA) 的電網政府基金年度分配高峰，預期每年將有 60 億美元的補助金額。電網分面，將著重在農村電網的開發、地下電纜、建設促進各州間和多地區的發電，以及微電網項目等。 


法人指出，華城是台灣唯一可以製造 500kV 級變壓器的廠商，500kV 的變壓器毛利較高，且符合美國需要的規格，加上華城為東南亞地區最大的變壓器廠商，看好華城今年外銷營收比重超過 4 成。另外，法人提到，士電大型變壓器新增的產能，將於 2025 年第一季開始投產，預估可以提升 25% 至 30% 的產能，有望爭取美國的變壓器訂單。",2024-02-22 11:03:04,20407,重電雙雄華城 (1519-TW)、士電 (1503-TW) 持續受惠變壓器需求暢旺，帶動今 (22) 日漲勢凌厲。華城漲逾 3%，士電更是大漲逾半根停板，股價寫下歷史新高，雙雙站穩所有均線。 ,"['華城', '士電']",1c61ffb0-e501-4a3f-b666-f4d0371699d9
〈焦點股〉東捷資訊獲利創高 今年有望優去年 亮燈漲停,"['東捷資訊', '碳盤查', 'esg', '雲端', '獲利創高', '焦點股']","東捷資訊 (6697-TW) 去年獲利創高，稅後純益 0.74 億元，年增 33.29%，每股純益 (EPS)2.71 元，激勵盤中股價量漲停燈號，創去年 9 月中旬以來新高價，展望後市，東捷資訊表示，將持續深耕資安、企業 ESG 碳盤查服務，營運動能穩健，力拚今年營運優於去年。


據市場調查機構 IDC 指出，台灣資服市場將以年增 3.9% 穩健擴張，至 2027 年增長至 30.4 億美元規模。


東捷資訊總經理陳春旭表示，今年在 ERP 等軟體授權維護客戶續約率高達 90%，營運具穩健發展基礎，也將積極拓張企業上雲、智慧工廠 AI 加值應用、AI 雲端智能客服與零信任資安布局，並深耕企業 ESG 碳盤查解決方案。


東捷資訊已成功協助多家製造業客戶導入自主研發的製造執行系統 (MES)，並依客戶規模與需求提供如 MES 輕量版等不同版本的 MES 解決方案，近期也推出 SaaS 雲端訂閱制的 MES 快速版。


此外，隨著零信任資安、金融資安與企業永續 ESG 碳盤查等剛性需求湧現，東捷資訊提供「FIDO 零信任無密碼身分驗證整合服務」、攜手 SAP 共同推展「MBC 銀企直連解決方案」，已獲數家金融機構與客戶青睞，將陸續挹注營運。


而助企業掌握碳盤查數據的「碳捷流」雲端智能管理平台，有客戶開始採用。


東捷去年合併營收達 13.43 億元，創歷年新高，營業毛利 1.86 億元，年增 1.33%，稅後純益 0.74 億元，年增 33.29%，創新高紀錄，每股純益 2.71 元，擬配發現金股利 2.2 元，也創歷年新高，配息率 81%。",2024-02-22 11:15:02,20406,〈焦點股〉東捷資訊獲利創高 今年有望優去年 亮燈漲停,['東捷資訊'],d039c7b1-e5de-4863-bb0f-21afb8ffdfcd
〈焦點股〉搶搭AI熱潮 含「輝」量高ETF股價強勢表態,"['AI', '輝達', 'ETF', '概念股']","全球 AI 晶片龍頭輝達 (Nvidia) (NVDA-US) 受惠需求強勁，第 4 財季營收、獲利雙雙超乎預期，本季展望持續樂觀看旺，激勵盤後股價大漲 10%。台股有多檔含「輝」量高的 ETF，包括國泰費城半導體 (00830-TW)、富邦未來車 (00895-TW)、國泰智能電動車 (00893-TW)、統一 FANG+(00757-TW) 等，今 (22) 日股價也都強勢表態，上漲 2-4%。


其他輝達含量也很高的股票型 ETF 包括兆豐洲際半導體 (00911-TW)、元大全球 AI(00762-TW)、富邦元宇宙 (00903-TW)、永豐美國科技 (00886-TW)、國泰北美科技 (00770-TW)、富邦 NASDAQ(00662-TW) 等，今天也獲到買盤追捧，股價都上漲超過 1%。


輝達 (Nvidia) 於美股週三收盤後公布上季業績，由於 AI 晶片需求持續強勁增長，超乎華爾街預期，淨利達 122.9 億元美元，年成長 7.7 倍，大幅超越市場預估的 103.4 億元，營收較去年同期更是翻倍成長達 221 億美元，甚至預估本季營收還會再繼續成長至 240 億美元，同樣優於分析師原先預期，帶動股價盤後一度大漲 10%。


台股不僅與晶片龍頭股組成的費城半導體指數高度連動，近兩年因輝達強勁的財報，亦帶旺相關輝達概念股暴衝，觀察過去幾次輝達公布亮眼財報後，多掀起一波概念股跟漲熱潮。


以上一季 2023 年 11 月輝達財報公布之後的台股表現來看，台廠相關輝達概念股至昨天平均上漲約 2 成。然而，由於個股波動較大，投資人較難以掌握進出場時間點，法人建議可挑選成分股包含重量級輝達概念股。


不過，產業分布較均勻的台股大盤市值型 ETF，也能享受到輝達靓財報帶起的跟漲熱潮，例如國泰台灣領袖 50 ETF(00922-TW)，就囊括 7 檔重量級輝達概念股，包含台積電、聯發科、廣達等 AI 熱潮受惠大廠，合計投資比重近 5 成，持股同時也包含去年落後其他產業、今年補漲機會大的金融股，更能捕捉到後市產業輪動的補漲機會。",2024-02-22 11:33:17,20405,全球 AI 晶片龍頭輝達 (Nvidia) 受惠需求強勁，第 4 財季營收、獲利雙雙超乎預期，本季展望持續樂觀看旺，激勵盤後股價大漲 10%。台股有多檔含「輝」量高的 ETF,"['國泰費城半導體', '富邦未來車', '國泰智能電動車', '統一FANG+', '兆豐洲際半導體', '元大全球AI', '富邦元宇宙', '永豐美國科技', '國泰北美科技', '富邦NASDAQ', '國泰台灣領袖50', '輝達']",d7beef2e-9980-45f2-9770-0b6e77bb8847
首家支援TWQR純網銀 將來銀行in-App支付超商最高100%回饋,"['將來銀行', '純網銀', 'TWQR', '超商', '回饋']","純網銀將來銀行 (NEXT BANK) 響應政府非現金支付政策，以及看準行動支付商機，繼 1 月率純網銀之先，推出支援 TWQR 及台灣 Pay 的「將來支付」後，今 (22) 日再宣布，從 24 日起，客戶透過將來支付到四大超商消費，最高可享 100% 回饋。


行動支付潮流方興未艾，政府瞄準 3 年內非現金支付交易金額要達 10 兆元大目標，將來銀行表示，為提供給客戶更全面、便利的金融服務，1 月已推出 in-App 支付服務，只要是將來銀行用戶，打開將來銀行 App 使用「將來支付」並綁定帳戶後，即可在全台支援「TWQR」或「台灣 Pay」的特約商店享便捷又快速的行動支付服務。


將來銀行指出，超商為民眾最常使用行動支付的場域，但今年起有多家銀行業者及支付業者中止超商支付服務。為使客戶能在超商使用行動支付又享有高回饋，特別逆勢推出於「四大超商消費，最高享 100% 回饋」優惠。


自 24 日起至 6 月 30 日止，以將來銀行 App 至全台四大超商使用「將來支付」功能，出示條碼付款結帳且單筆消費滿 50 元 (含) 以上，享 50 N 點回饋；若是將來銀行新戶則加碼再享 3 月底前單筆消費滿 100 元 (含) 以上，領 100 N 點回饋。


將來銀行表示，今年起逆勢推出的「一率雙享」活動倍受國人歡迎，凡活動期間內新開立將來銀行 NEXT BANK 帳戶，皆可享存 90 天活儲 20 萬 (內) 最高 3.5% 優利、換算利息逾 1400 元，且 1 元起計息；刷將將卡消費則再享當月刷滿 5000 元，指定通路最高享 3.5% N 點回饋，讓將將粉一率雙享，獲得 3.5% 存款利率及刷卡回饋雙重優惠。",2024-02-22 11:46:24,20404,純網銀將來銀行 (NEXT BANK) 響應政府非現金支付政策，以及看準行動支付商機，繼 1 月率純網銀之先，推出支援 TWQR 及台灣 Pay 的「將來支付」後，今 (22) 日再宣布，從 24 日起，客戶透過將來支付,[],12f596ae-aa44-4603-899a-b76146e60bf2
童子賢：摺疊機市場接受度不一 短時間內不會大流行,"['童子賢', '蘋果', '摺疊機', 'iPhone']","日前市場傳出，蘋果 (AAPL-US) 決定暫時擱置摺疊機的硏發。和碩 (4938-TW) 董事長童子賢針對摺疊機也提出看法，他認為目前市場對摺疊機的接受度不一，預期短時間內不會大流行。 


童子賢強調不評論單一客戶產品，不過他表示，自己同時為摺疊機與 iOS 手機的使用者，兩者各有所長。使用摺疊機 5、6 年的時間以來，童子賢認為摺疊機還存在幾項弱點，包括摺疊機的摺痕、整體手機容積仍大等問題。童子賢便分享，朋友使用摺疊機時指出，摺痕處有 3 至 5 毫米的波浪，看劇、閱讀時容易有反光情況。 


研調機構 TrendForce 也指出，摺疊手機成長趨緩，主因為消費者黏著度低，對產品信心不足。另外，目前市面上的摺疊手機售價也尚未達到消費者的甜蜜點，難以透過售價達到銷售目標。",2024-02-22 11:48:15,20403,日前市場傳出，蘋果 (AAPL-US) 決定暫時擱置摺疊機的硏發。和碩 (4938-TW) 董事長童子賢針對摺疊機也提出看法，他認為目前市場對摺疊機的接受度不一，預期短時間內不會大流行。 ,"['和碩', '蘋果']",04554411-458b-427b-b2ca-1adca0385d8c
〈台股盤中〉輝達財報激勵 半導體雙雄走強 早盤漲200點登18881點新高,"['台股', '輝達', '台積電', '聯發科']","輝達 (NvIdia) (NVDA-US) 財報報喜，激勵台股半導體、AI 族群今 (22) 日表現，也推升加權指數早盤跳空大漲 200 點，來到 18881.77 點新高，不過，盤中賣壓出籠，一度拉回逾百點，走勢震盪下，估量放大至 4000 億元。


台積電今日開盤大漲 14 元或 2%，來到 695 元；聯發科也漲 2%、重返千金股行列，達發大漲約 8%、股王世芯 - KY 也大漲半根停板，祥碩漲 3%，矽力 *-KY、瑞昱漲 4%，創意小漲 1%、半導體通路文曄、大聯大，封測指標京元電也同步走揚。


輝達財報報喜也激勵 AI 股今日表現，廣達漲逾 3%，緯創、技嘉連袂向上，散熱相關的奇鋐漲半根停板、健策漲 4%，電源大廠光寶科漲 2%，不過，智邦跌近 3%，仁寶、緯穎午前平盤下震盪，表現都相對弱勢，其他高價股來看，大立光、嘉澤、旭隼都有 1-2% 漲幅。


非電族群來看，貨櫃三雄表現不俗，長榮大漲 5%、陽明漲逾 4%、萬海漲 2%，重電指標大同、華城均漲 3%；近日強勢的生技族群今日則陷入修正，藥華藥走跌。",2024-02-22 11:54:52,20402,輝達 (NvIdia) 財報報喜，激勵台股半導體、AI 族群今 (22) 日表現，也推升加權指數早盤跳空大漲 200 點，來到 18881.77 點新高，不過，盤中賣壓出籠，一度拉回逾百點，走勢震盪下，估量放大至 4000 億元。,['輝達'],9ce7658f-610a-4d1b-aa99-352990350daf
柏承華東兩廠產能整合並搶攻利基市場訂單,"['柏承', 'PCB', '昆山']","PCB 廠柏承科技 (6141-TW) 在江蘇南通廠首期產能完成建置後，將有利於整合在大陸現有的昆山廠資源進一步搶攻在手機板之外的利基型產品，同時，由於柏承產能增加，法人估計 2024 年柏承的營收可逐季成長。


同時，對於完成新建置的柏承南通新廠，柏承主管指出，總投資金額約新台幣 30 億元，對於產能則規劃以全部 HDI 製程生產建置，總產能全部開出後將超越原有的昆山廠，且產線自動化程度高，同時，在手機板的原昆山廠強項之外，大陸的兩座廠區將進一步搶進等利基型市場。


柏承預估，新完成南通廠的認證工作預計在 2024 年第二季全部完成，如接單順利，加上柏承的資源整合有效管控成本，有助於 2024 年全年營收及獲利能力上升。


柏承 2023 年連虧三季，前三季稅後虧損 2.36 億元每股虧損 2.08 元。


柏承 2024 年 1 月營收達 2.63 億元，年增 1.07 倍。",2024-02-22 12:04:32,20401,PCB 廠柏承科技 (6141-TW) 在江蘇南通廠首期產能完成建置後，將有利於整合在大陸現有的昆山廠資源進一步搶攻在手機板之外的利基型產品，同時，由於柏承產能增加，法人估計 2024 年柏承的營收可逐季成長。,['柏承'],bb08a62e-3f37-494a-9436-60db77527fd0
輝達財報外掛多頭推進器  台股AI族群齊衝高,"['輝達', 'AI概念股', '廣達', '緯創']","輝達 (NVDA-US) 昨 (21) 日公布財報表現亮眼，激勵台股 AI 相關概念股今 (22) 日股價紛紛喊衝，包括台積電 (2330-TW)、廣達(2382-TW)、緯創(3231-TW)，以及技嘉(2376-TW) 等 AI 族群活蹦亂跳。 


廣達漲勢最強勁，早盤以 245.5 元開出，最高漲至 247.5 元，漲幅約 3.81%，成交爆量超過 3 萬張。台積電則大漲 8 元，漲幅 1.17%，成交量超過 1.9 萬張。緯創、技嘉則分別有 1.69% 與 1.01% 的漲幅，其中緯創成交量更是超過 8 萬張。 


持續受惠 AI 商機，輝達去年第四季營收、獲利表現雙雙超出預期，去年第四季營收 221 億美元，年增 2 倍，寫下歷史新高，獲利為 128.4 億美元，年增超過 4 倍。此外，根據輝達財測，預期第一季營收為 240 億美元，高於分析師預期的 221 億美元。 


輝達將於 3 月 18 至 21 日舉辦 AI 盛會 GTC 2024，屆時將發表最新款的 B100 晶片。據悉，台廠也不缺席，包括廣達與鴻海也將派員參與盛會。而台積電、緯穎 (6669-TW)、緯創、台達電 (2308-TW)、鴻海、華碩、技嘉、微星、聯發科，以及和碩等 10 家台灣廠商為贊助商。 


輝達創辦人黃仁勳先前來台時曾點名未來台廠的「AI 超級巨星」，包括台積電、廣達、緯創、技嘉、鴻海 (2317-TW)、華碩 (2357-TW)、聯發科 (2454-TW)、微星 (2377-TW)，以及日月光投控 (3711-TW) 旗下的矽品。",2024-02-22 12:23:37,20400,輝達 (NVDA-US) 昨日公布財報表現亮眼，激勵台股 AI 相關概念股今日股價紛紛喊衝，包括台積電 (2330-TW)、廣達 (2382-TW)、緯創 (3231-TW)，以及技嘉 (2376-TW) 等 AI 族群活蹦亂跳。,"['台積電', '日月光投控', '微星', '聯發科', '華碩', '鴻海', '技嘉', '緯創', '廣達', '台達電', '緯穎', '輝達']",8a7ac63e-e2c7-4474-b37d-74463e3c501a
〈焦點股〉頻率元件族群價量齊揚 泰藝、台嘉碩盤中攻漲停,"['頻率元件', '加高', '營收', '台嘉碩', '晶技']","在產業應用客戶端經歷逾 4 個季度的的庫存調整後，加上如網通 WiFi 7、汽車應用及 AI 伺服器的需求獲看好，頻率元件產業隨著終端需求在 2024 年逐步回溫，晶技 (3042-TW)、加高 (8182-TW) 、泰藝 (8289-TW) 及台嘉碩 (3221-TW) 等估股今 (21) 日都爆量上漲，其中晶技並站上百元價位。


同時，頻率元件業者積極搶進成長中的汽車市場應用，也是 2024 年的市場重頭戲。


今天盤中包括泰藝、台嘉碩盤中股價的追漲氣勢足，兩檔個股盤中都觸及漲停價位，也顯示目前市場資金的提前卡位動作，，頻率元件市場需求逐步回溫，業者認為較明確的復甦時間點在第二季，晶技及加高也認為 2024 年全年營收可出現小幅成長。",2024-02-22 12:53:22,20399,在產業應用客戶端經歷逾 4 個季度的的庫存調整後，加上如網通 WiFi 7、汽車應用及 AI 伺服器的需求獲看好，頻率元件產業隨著終端需求在 2024 年逐步回溫，晶技、加高 、泰藝股價走高。,"['晶技', '加高', '泰藝', '台嘉碩']",98b9c159-65f9-4b43-9c2f-c6420336ef1c
台灣大國際結盟 7電信商共組全球首個電信跨境獎勵聯盟,"['台灣大', '電信', '旅遊']","台灣大 (3045-TW) 今 (22) 日宣布，攜手泰國 AIS、菲律賓 Globe、香港 HKT、澳大利亞 Optus、新加坡 Singtel、印尼 Telkomsel 等指標性電信業者，共組全球第一個「電信跨境獎勵聯盟」並簽署合作備忘錄，展開跨境合作新里程碑。「電信跨境獎勵聯盟」平台預計 2024 年底正式上線。


在電信跨境獎勵聯盟平台，7 家成員計畫成立 7 家「旅遊特色館」。當旅客前往聯盟成員所在地，例如新加坡、泰國、菲律賓、香港、澳大利亞、台灣以及印尼等地旅遊時，都可以透過平台跨國累計積分，以點數兌換當地熱門伴手禮、觀光景點門票、電信服務、機場接送等多項優惠。


台灣大預計開放月租型用戶加入，享有該聯盟平台會員福利，同時運用強大電商物流和集貨能力，利用大數據天賦為「電信跨境獎勵聯盟」建構「台灣特色館」，供國際旅客抵達台灣時即可透過直觀便捷的使用者介面，享受專屬在地服務。


台灣大個人用戶事業商務長林東閔表示，電信跨境獎勵聯盟為全球數千萬旅客帶來的創新服務。台灣大在超 5G 方針下，運用 Telco+Tech 策略，鏈結集團資源與科技實力，與電商、旅遊平台等夥伴合作，透過電信跨境獎勵聯盟，於全球通用平台中建立「台灣特色館」，旅客可以使用全球通用的積分點數。",2024-02-22 12:54:33,20398,台灣大 (3045-TW) 今 (22) 日宣布，攜手泰國 AIS、菲律賓 Globe、香港 HKT、澳大利亞 Optus、新加坡 Singtel、印尼 Telkomsel 等指標性電信業者，共組全球第一個「電信跨境獎勵聯盟」簽署合作備忘錄。,['台灣大'],2ba1448d-fb54-4687-a64c-9103e199304b
盟立EFEM設備獲美大廠認證 搶進玻璃基板封裝商機,"['盟立', '半導體', 'EFEM', '載板', '應材']","盟立 (2464-TW) 積極發展 EFEM 晶圓傳送設備，據悉，盟立已獲應材 (AMAT-US) 認證，首度成為應材合格供應商，正式切入次世代玻璃基板封裝用的 EFEM 設備，預計上半年就會直接出貨給台系載板大廠，間接供應給美系 IDM，成為今年營運新動能。盟立對此表示，不評論單一客戶訂單。


英特爾 (INTC-US) 本次在 IFS 大會除了釋出最新 Intel 3-T 製程，更釋出最新 3D 先進封裝技術，並重申，玻璃基板封裝將在 2026 年進入量產，凸顯英特爾不只在先進製程上緊追台積電 (2330-TW)(TSM-US) 進度，還要利用先進封裝利器彎道超車，搶食 AI 晶片市場大餅。


業界認為，隨著市場對運算速度要求大增，單一封裝體容納的晶片數量增加，面積也越來越大，為解決有機材質載板的膨脹翹曲問題，玻璃基板封裝將成下世代 AI 晶片競爭的關鍵。


盟立此次與應材合作，運用過往在面板領域的技術，如面板級扇出型封裝 (FOPLP)，一同開發用於玻璃基板封裝的 EFEM 設備，不僅可穩定上下料，也可解決載板彎曲問題。


另外，盟立除了切入玻璃基板封裝，也期望與應材合作後，可望將 EFEM 設備一路拓展至其他客戶，如晶圓廠等，成為未來接單利器。盟立今年 1 月持續受面板客戶需求低迷與東南亞訂單遞延影響，營收 5.18 億元，年減 29%。",2024-02-22 13:03:29,20397,盟立 (2464-TW) 積極發展 EFEM 晶圓傳送設備，據悉已獲應材 (AMAT-US) 認證，首度成為應材合格供應商，盟立也正式切入次世代玻璃基板封裝用的 EFEM 設備，預計上半年就會直接出貨給台系載板大廠，成為今年營運新動能。,"['盟立', '台積電', '應用材料', '英特爾', '台積電']",ccdccce8-537c-4fe2-8a72-300e524f8d20
裕隆新春團拜 嚴陳莉蓮看集團今年重頭戲為電動車,"['裕隆', '電動車', '嚴陳莉蓮', '納智捷', '鴻華先進']","裕隆集團今 (22) 日在新店總部舉行新春開工祈福儀典，執行長嚴陳莉蓮表示，今年集團重頭戲是迎接納智捷 N7 電動車上市，並期許同仁發揮「一個裕隆」的團隊精神，全力強化移動服務生態系的發展。


嚴陳莉蓮今帶領集團高階主管祈拜，並透過直播視訊和各子公司團拜，也特別為集團所有同仁準備專屬設計的開工紅包袋和祝福小卡，表達對同仁的心意。


嚴陳莉蓮表示，感謝集團同仁們積極努力拓展業務，去年總獲利創下近 5 年最佳成績，為 70 周年增添光彩。


展望今年，嚴陳莉蓮強調，裕隆集團重頭戲是迎接納智捷 N7 電動車上市，期許同仁發揮一個裕隆的團隊精神，將各事業體串聯成移動服務的生態系，共同為集團電動車顧客創造滿意的消費體驗。",2024-02-22 13:06:28,20396,裕隆新春團拜 嚴陳莉蓮看集團今年重頭戲為電動車,['裕隆'],814fd488-e309-4ef3-9b4a-550b00b0559e
