title,keywords,content,publish_at,id,summary,related_stocks,uuid
〈力旺法說〉PUF IP導入各製程 啟動新一輪成長循環,"['力旺', 'PUF', 'MTP', '記憶體', '成長']","IP 大廠力旺 (3529-TW) 今 (6) 日召開法說會，董事長徐清祥表示，隨著強勁的技術授權及新製程產品應用陸續進入量產階段，包括 MTP 及 PUF security 相關新技術都導入各製程，將帶動權利金成長加速，公司營運開始進入下個成長循環，對未來相當樂觀。


力旺技術授權是一個平台型的生意模式，藉由在晶圓廠的製程佈建自家技術平台，讓客戶可以使用公司 IP 而由晶圓廠基於晶圓價格付給公司權利金，過去 20 年在全球 25 家晶圓廠，佈建 621 個製程平台，從 0.5 微米到 3 奈米。


力旺去年新增的技術授權案及正在開發驗證的技術平台是往年的 2 倍，顯示公司新技術如 MTP 及 PUF security 相關，正加速技術平台擴展，未來每多一個技術平台，就會多一個製程加入貢獻長久性的權利金， 越多的技術平台，越多的晶圓使用，就會產生越多的權利金收入。


至於新建的技術平台， 無論是加入 PUF security solution 的先進製程或者是 MTP 相關技術的製程，每片晶圓權利金都遠高於平均，將加速權利金成長，力旺對未來相當樂觀。


針對 AI，徐清祥看好，力旺 IP 在 AI 伺服器和 AI 邊緣裝置扮演重要角色，不論是 CPU、GPU、SRAM、DRAM、資料存儲控制器、傳感器、執行器等各種元件，都可以使用公司 IP 增強安全功能並提高產品良率，AI 廣泛發展將加速公司 IP 採用率，帶動公司快速成長。


觀察兩大產品線，總經理何明洲指出，強勁的授權需求會帶動授權金持續成長；權利金第一季因受受單一客戶製程轉換到更先進製程，短暫影響權利金收入，營收估較上季小幅下滑，但會較去年同期成長雙位數以上，預期隨著新製程及應用進入量產，營收動能會逐季增強。


細分製程，何明洲表示，特殊製程如高壓 (HV)、CIS、BCD、embedded flash 及 emerging memory 等往更先進製程開發，本季會有更多晶圓廠技術授權案，RRAM 也持續導入更多 IC 設計客戶，會帶動更多應用及每片權利金增長。


先進製程方面，力旺上季成功完成美國晶圓廠 3 奈米授權，未來雙方也將共同開發更先進製程；PUF security 也成功導入美國資料中心晶片大廠相關應用，有多個 3/4/5 奈米合作案正在進行。",2024-02-06 17:02:58,20918,IP 大廠力旺 (3529-TW) 今 (6) 日召開法說會，董事長徐清祥表示，隨著強勁的技術授權及新製程產品應用陸續進入量產階段，包括 MTP 及 PUF security 相關新技術都導入各製程，將帶動權利金成長加速，公司營運,['力旺'],0cd63ed8-3036-4f4f-8708-70cef9743d96
光罩旗下群豐科技進軍印度 攜手Kaynes簽署技術合作協議,"['光罩', '群豐科技', '封測廠']","台灣光罩 (2338-TW) 今 (6) 日代子公司群豐科技公告，群豐董事會決議與印度 Kaynes Semicon Private Limited 進行半導體封測技術合作訓練與 know-how 授權，並在今日完成簽訂合作協議。


群豐科技專注半導體封測及系統級封裝 (SiP) 領域，Kaynes Semicon Private Limited 則隸屬於印度 EMS 電子製造商 Kaynes Technology 子公司，有鑑印度本土龐大內需市場，以及印度政府積極發展半導體自主技術，群豐科技攜手印度 Kaynes 展開半導體封測技術之合作計畫。


群豐初期技術移轉及訓練金額為 550 萬美元，將提供人員技術訓練與 know-how 授權，協助 Kaynes 在印度建立封裝與測試能力。雙方未來在產品、技術研發及製造管理系統上將進一步合作，共創雙贏。",2024-02-06 17:04:44,20917,台灣光罩 (2338-TW) 今 (6) 日代子公司群豐科技公告，群豐董事會決議與印度 Kaynes Semicon Private Limited 進行半導體封測技術合作訓練與 know-how 授權，並在今日完成簽訂合作協議。,['光罩'],dc569006-1add-4c3f-ba5c-82fc42f4535a
年關近防詐騙！北富銀全國首創AI洗防系統「獵鷹系統」正式啟用,"['北富銀', 'AI', '詐騙', '洗錢防制', '獵鷹系統']","年關將近，詐騙集團又開始密集透過詐騙訊息、假禮券等手法誘騙民眾上當，為加強防制詐騙及各類犯罪交易，金融業防詐動起來！台北富邦銀行繼「鷹眼模型」後再度出擊，於農曆年前啟用全新開發的 AI 洗錢防制「獵鷹系統」，為全台銀行業首創，將能精準偵測檢核可疑交易，快速進行通報控管，以達到攔阻犯罪金流之目的。


北富銀風控總處副總經理蔡永原表示，金融安全是關乎金融業永續經營及推動社會共好的關鍵，也是未來金融數位發展的重點。為了強化金安核心能力，北富銀積極呼應富邦金控「金融安全數位轉型藍圖」，將多元金融科技運用於反詐欺、反舞弊及反洗錢領域中，希望透過前瞻科技的導入，提升國內金安科技實力，精準監控並有效打擊有害社會的非法交易。


蔡永原說明，民眾對「洗錢防制」這個名詞可能較陌生，其實洗錢防制是遏阻犯罪非常重要的一環。以詐騙為例，詐騙集團最終目的就是要在不暴露身分的前提下拿到錢，因此常透過人頭帳戶來收取犯罪所得，若能快速精確識別出可疑帳戶，依主管機關法規進行通報及控管，將能更有效地在金融處理環節阻截不法行為，避免詐騙所得被轉移，同時也可增加詐騙集團施行犯罪的難度，抑制案件發生機率。


不過實務上，銀行日常要處理大量金融交易，如何提升監控的效能及精準度，讓犯罪交易無所遁形，也成為金融安全強化的重要課題。北富銀每日約有超過百萬筆交易需要進行初步監測，其中有超過 6000 筆交易要進一步執行姓名檢核、風險評分或加強審查。過去監控及檢核的重點環節多為人工處理，無法立即反映監理法規及名單資料庫的變化，進行查核也需要一定作業時間，很難及時攔阻可疑金流。


同時，大部分銀行系統是採用規則式檢索，即使有少數運用了 AI 技術，但還是偏重輔助功能，實際執行依然仰賴人力，因此假警報比例往往居高不下，不僅耗用銀行極大的系統資源與處理人力，對客戶來說，由於需要配合補充說明資金用途、交易對象或提供交易佐證文件，也十分影響交易流暢度與服務體驗。


有鑑於此，北富銀自 2020 年開始，與全球反洗錢系統領導品牌 Tookitaki 合作開發「獵鷹系統」﹐為台灣銀行業首創具備 AI 智能模型的洗錢防制系統，擁有堪比人腦的嶄新 AI 智能模型，判斷精準且效率卓越，能自動篩檢出高風險交易進行後續處理，每秒約可處理 50 筆交易，提高一倍以上的審查效能。


此外，「獵鷹系統」還擁有自主學習能力，可以根據北富銀最新的風險管理政策資料自動建立機器學習模型，分析客戶行為並從檢核結果中自我進化，提高異常監控的精準度，預估上線初期即可降減 45% 的假警報。",2024-02-06 17:07:06,20916,年關將近，詐騙集團又開始密集透過詐騙訊息、假禮券等手法誘騙民眾上當，為加強防制詐騙及各類犯罪交易，金融業防詐動起來！台北富邦銀行繼「鷹眼模型」後再度出擊，於農曆年前啟用全新開發的 AI 洗錢防制「獵鷹系統」,[],13959827-cf2f-4963-bbd5-2fb5222c3d46
〈ESG狂潮〉台虹深化綠電布局 與泰ENMAX集團簽署綠電證書交易合作協議,"['ESG', '台虹', '泰國']","軟性銅箔基板 (FCCL) 大廠台虹科技 (8039-TW)）與泰國 ENMAX Group 今 (6) 日於台虹高雄總部簽訂太陽能系統及綠證採購合約，達成綠色電力證書交易合作協議。台虹本次與泰國 ENMAX Group 合作，除了在泰國廠區建置屋頂型太陽能發電系統外，更重要的是簽署 10 年購置總量達 7,500 萬度綠色電力證書採購協議。


台虹並強調，本次次與泰國 ENMAX Group 的簽約合作亦為台虹實現 RE100 提供具體解決方案。 


台虹泰國新廠將如預期於 2024 年第二季量產，並將在 5 月舉行揭幕儀式，泰國廠全面竣工後，將成為集團綠色製造示範標竿，並為集團東南亞營運奠定良好的發展基石，泰國廠也積極順應客戶及國際社會對於實現綠色能源的期待。


台虹指出，ENMAX Group 擁有多年太陽能系統綜合設計建造經驗，其自主開發的即時監控人工智慧系統，可確保太陽能發電效能最佳化，至今已完成 1,800 多個項目，總裝置容量達 250 兆瓦，係一家專注於再生能源和節能技術的公司。 


台虹指出，綠能、低碳科技已是全球環境保護發展趨勢，台虹為有效推動永續發展目標，特別成立「永續發展中心」，負責統籌集團子公司永續發展事務，包括發電、用電、系統、產業、環境保護及世界趨勢的研究與執行，計畫於 2030 年前完整再生能源、低碳排放、循環經濟等擘劃，並於 2050 年達成 RE100、碳中和以及 100% 循環經濟的永續目標。 


台虹泰國廠預計今年第二季量產，占地面積近 4.2 萬平方公尺 (約 1.28 萬坪)，第一期工程計畫投資 3500 萬美元，進行雙面無膠銅箔基板製造。台虹著眼於東南亞車載市場龐大潛力，未來將陸續規劃生產覆蓋膜、有膠銅箔基板等軟板材料。該廠全面竣工後，將為集團東南亞的營運基地。


台虹科技 2023 年前三季營收 59.69 億元，毛利率爲 22.09%，年減 2.37 個百分點；稅後純益爲 3.7 億元，年減 46.47%，每股純益爲 1.77 元。法人估台虹 2023 年每股純益可順利突破 2 元。",2024-02-06 17:08:10,20915,軟性銅箔基板 (FCCL) 大廠台虹科技 (8039-TW)）與泰國 ENMAX Group 今 (6) 日於台虹高雄總部簽訂太陽能系統及綠證採購合約，達成綠色電力證書交易合作協議。,['台虹'],df4c89fd-c783-4657-b31a-d4b589f894ca
技嘉元月營收暴衝翻倍至169億元 刷歷史新高,"['技嘉', '伺服器', '主機板']","技嘉 (2376-TW) 受惠 AI 伺服器組裝事業成長、RTX 40 系列顯卡出貨，推升元月營收 169.3 億元，月增 31.8%、年增 106%，刷新歷史新高。公司看好，在主板與伺服器業務動能延續下，全年營收、獲利將明顯跳增。


技嘉與輝達 (NVDA-US) 關係密切，不僅參與產品早期開發並跟隨輝達推出最新產品，在 GPU 取得上具有優勢。而技嘉伺服器產品線完成，去年受惠 AI 伺服器需求強勁，營收一舉跳升，營運動能也延續至今年。


技嘉表示，目前除了美系客戶持續增加訂單外，也規劃擴大歐洲、日本、泰國與越南等亞太地區的雲端服務客戶 (CSP) 供貨量，藉此全面增加業務動能，讓客戶結構更加趨於多元分散。",2024-02-06 17:22:14,20914,技嘉 (2376-TW) 受惠 AI 伺服器組裝事業成長、RTX 40 系列顯卡出貨，推升元月營收 169.3 億元，月增 31.8%、年增 106%，刷新歷史新高。公司看好，在主板與伺服器業務動能延續下，全年營收、獲利將明顯跳增。,"['技嘉', '輝達']",59113a77-19dc-412c-b279-36592250627d
台灣1月CPI 1.79%降至7個月低點 惟食物類仍漲4%,"['CPI', '主計', '物價', '通膨']","主計總處今 (6) 日公布 1 月消費者物價總指數 (CPI) 年增率為 1.79%，降至 2% 通膨警戒線下，並來到 7 個月來相對低點，扣除蔬菜水果後僅漲 1.58%，再剔除能源後的總指數 (即核心 CPI)，漲 1.64%；不過，外食費漲 4.00%，使民眾對通膨壓力仍明顯有感。


就各查價項目來看，價格上漲者主要有番石榴 (芭樂) 較去年同期大漲 88.38%、香蕉漲 67.77%、診所掛號費漲 10.23%、金飾及珠寶漲 10.03%、中藥材漲 10.01%、胡蘿蔔漲 8.71%、其他自付費 (處方藥品自付費等) 漲 8.63%、豬肉漲 8.44%。




圖表：主計總處提供。




從七大類來看，食物類漲 4.10% 最多，主因水果上漲 20.86%，肉類因飼養成本仍高，漲 5.63%，加上調理食品、外食費、穀類及其製品各漲 4.31%、4.00% 和 3.35%，惟蔬菜因近期天候穩定，供給充裕，價格下跌 14.54%，抵銷部分漲幅。


醫藥保健類漲 3.12%，反映去年 7 月起實施「健保部分負擔調整方案」，調高健保門診藥品和急診部分負擔，加上掛號費調漲，使醫療費用上漲 3.70%，藥品和保健食品漲 3.15%。


衣著類漲 2.47%，則因部分服飾優惠較去年減少，成衣價格上漲 2.68%。


居住類漲 1.75%，主因住宅維修費、房租和電費分別上漲 3.47%、2.14% 和 1.30%，惟家庭耐久設備 (如冷暖氣等耐久家電) 跌 1.79%，抵銷部分漲幅。


按商品性質別觀察，商品類上漲 2.18%，而服務類漲 1.38%，其中，外食費漲 4.00%。


與主要國家 (地區) 相比，去年我國 CPI 漲 2.49%，歐元區漲 5.4%，新加坡漲 4.8%，美國漲 4.1%，南韓漲 3.6%，日本漲 3.3%，香港漲 2.1%，中國漲 0.2%；1 月我國 CPI 漲 1.79%，歐元區和南韓均漲 2.8%。",2024-02-06 17:44:52,20913,1 月 CPI 年增率 1.79% 降至 7 個月低點 惟食物類仍漲 4%,[],c43b21e0-d5ef-4243-a867-9e2d5181fc23
智易受惠WiFi 7商機增溫 1月營收年增超過2成創同期新高,"['智易', '網通', 'WiFi 7']","網通廠智易 (3596-TW) 今 (6) 日公布 1 月營收 44.93 億元，年增超過 2 成，寫下同期新高。市場預期 WiFi 7 滲透率將在今年與明年逐漸提高，甚至在明年成為市場主流，法人預估，WiFi 7 將對智易今年營運提供成長動能。 


智易今年 1 月營收 44.93 億元，進入傳統淡季雖月減 2.6%，但較去年同期大幅成長 20.7%，創下同期新高。 


去年全球出貨仍以 WiFi 6 為最大宗，滲透率約 7 成。展望今年，法人指出雖還是以 WiFi 6 為主，不過 WiFi 7 具更快速、低延遲等優勢，市場看好 WiFi 7 滲透率逐漸提高，且可望在 2025 年快速爬升。因此法人認為，智易有望成為受惠業者之一，WiFi 7 成為智易重要成長動能。",2024-02-06 17:46:40,20912,網通廠智易 (3596-TW) 今 (6) 日公布 1 月營收 44.93 億元，年增超過 2 成，寫下同期新高。市場預期 WiFi 7 滲透率將在今年與明年逐漸提高，甚至在明年成為市場主流，法人預估，WiFi 7 將對智易今年營運提供成長動能。,['智易'],2a87755b-be61-4672-a629-21f21e5d4091
金管會核准合庫申設東京分行 成第9家插旗日本國銀,"['金管會', '合庫', '東京', '分行']","金管會今 (6) 日宣布，同意合作金庫商業銀行前往日本東京申設分行，為第九家插旗日本的國銀，目前國銀在日本共有 10 家分行、1 家子行，去 (2023) 年累計稅前盈餘達 31.6 億元，較前一年度轉盈，企金業務重拾成長動能。


金管會說明，合庫考量日本為全球主要經濟體，與我國雙邊貿易往來密切，並因應全球供應鏈區域化趨勢，規劃於日本設立東京分行，以延伸該行金融服務觸角至東北亞，逐步建構該行完整海外服務網絡。


截至去 (2023) 年 12 月底止，合庫銀行海外據點共計有 1 家子銀行、14 家分行、8 家支行及 3 家代表人辦事處等 26 處，分別設置於比利時、捷克、菲律賓、美國、香港、中國大陸、澳大利亞、柬埔寨、寮國及緬甸等地區。


金管會表示，目前本國銀行於日本已設有分支機構者，包括臺灣銀行、第一商業銀行、彰化商業銀行、兆豐國際商業銀行、臺灣中小企業銀行、玉山商業銀行、台新國際商業銀行及中國信託商業銀行等 8 家銀行，合計 10 家分行、1 家子行。


其中，兆豐銀行在東京、大阪各有 1 個分行，分別於民國 37、39 年開業，布局的時間相當早，而玉山銀行福岡分行也已於去年 9 月開業，是唯二有兩家分行的金融機構。


根據金管會統計，國銀在日本設立分行去年稅前盈餘合計 31.6 億元，較前一年度轉盈，銀行局副局長童政彰說明，前年合計虧損 10.3 億元，主要原因是授信品質變差，增提備抵呆帳，以及放款餘額驟減，去年疫情趨緩、景氣明顯復甦，帶動國銀日本分行的企金放款量能快速成長，取得不錯的成績。",2024-02-06 17:50:10,20911,金管會今 (6) 日宣布，同意合作金庫商業銀行前往日本東京申設分行，為第九家插旗日本的國銀，目前國銀在日本共有 10 家分行、1 家子行，去 (2023) 年累計稅前盈餘達 31.6 億元，較前一年度轉盈,[],409ded31-ea16-4dd4-bcef-40dd48c1dcc1
台灣大落實氣候治理 四度獲CDP評比最高等級A,"['台灣大', 'ESG', '電信', '共同推動']","世界最大碳揭露組織 CDP (Carbon Disclosure Project, 碳揭露專案) 「氣候變遷」評比今 (6) 日公布，台灣大哥大 (3045-TW) 四度獲最高等級「A」級肯定，為台灣電信業最佳。


CDP 鼓勵企業制定雄心勃勃的減碳目標，以增強氣候變遷的抵禦能力。今年全球有 21,000 家參與評鑑，僅 17% 企業獲選 A 級，其中台灣參加企業共 408 家，18 家企業獲得 A 等。


在 11 項評分項目中，台灣大共有 6 項獲得頂級評分，包括目標、範疇一 & 二排放、範疇三排放、機會揭露、商業策略 & 財務規劃和情境分析以及減排倡議和低碳產品，另外 2 項指標成績躍升，包含機會揭露和價值鏈參與，以最務實的作為，一同與地球共生共榮。


台灣大持續以永續氣候治理為最高原則，2023 年 IDC 雲端機房再生能源使用率，更是大幅超標達成原先設定的目標 (30%)，並可望在今年 2024 年實現 2030 年百分之百使用綠電的承諾，提前 6 年達標。2023 年台灣大全年減碳量高達 24,930 公噸，相當於 65 座大安森林公園碳吸附量，綠電轉供總裝置容量 30.7MW 及綠電建置容量 0.32MW。


台灣大哥大董事長蔡明忠強調，隨著氣候變遷和全球綠電不足的嚴重挑戰，全球急需採用新型態的潔淨能源以彌補缺口。台灣大與富邦金控積極贊助中研院的「淨零科技研發產研合作」計畫，其中去碳燃氫技術已啟動小規模商轉，成功將天然氣中的甲烷裂解成氫氣，同時產出具有高經濟價值的固態碳 (Carbon Black)，可廣泛應用於橡膠製品、塗料、電池和塑料等產業，創造出新的循環經濟模式。在台灣大與富邦金控的支持下，未來期望能加速去碳燃氫的大型商轉，持續創造兼具環境永續及新經濟價值的能源解決方案。


台灣大總經理林之晨表示，氣候變遷已經帶來自然環境翻天覆地的改變，減緩氣候變遷對環境與社會的衝擊乃是全球當前最重要的事情，台灣大由上至下落實氣候治理，設置隸屬董事會層級的永續發展委員會，導入 TCFD 框架 (Task Force on Climate-Related Financial Disclosures, 氣候相關財務揭露)，掌握氣候變遷對企業營運造成的風險與機會，依循 TNFD 框架 (The Taskforce on Nature-related Financial Disclosures, 自然相關財務揭露框架)，擴大對全自然環境的關懷，透過全面資訊的盤點與揭露，與上下游價值鏈共同掌握減碳與生物多樣性喪失所衍生的風險與機會。


隨著全球 5G 用戶數強勁成長，用電量攀升，電信業必須採取更積極的節能措施，台灣大營運過程中，嚴格落實減碳，同時支持中研院的新能源開發，擴大綠能投資，加速朝 2040 年 RE100 及 2050 年 Net Zero 目標邁進，打造氣候穩定的未來。


台灣大整體用電量中，超過 9 成來自基地台和機房 (含 IDC 雲端機房)，其中基地台的排碳量佔比最大。為了有效降低能耗，台灣大運用人工智慧和大數據分析，對各項耗能設備進行監測與分析，並率電信業之先引進諾基亞液冷式基地台設備，驗證顯示最高可減少 47% 的設備耗電、並降低 14 度設備溫度。為了提升 IDC 雲端機房的綠電使用率，台灣大在所有機房裝設 LED 燈具，同時引入 ISO50001 系統進行能耗管理。2023 年，台灣大 IDC 雲端機房再生能源使用率已經超越了原本設定的目標，可望提前達到 RE100。


除了基站與機房等硬體設備降低碳排之外，台灣大也啟動全數位化智慧門市改裝計畫。減少紙張印製，以電子螢幕搭配雲端數位公播系統，取代傳統海報；採用電子價格牌，落實門市無紙化且可即時提供用戶最優惠的價格資訊；實施門市溫度控制、照明汰換、調節招牌燈點亮時間，並推動帳單無紙化達到 86%。隨著全台門市陸續改裝，預估每年可減碳近 400 公噸。


根據 CDP 調查，供應鏈上下游的範疇三碳排放佔整體碳足跡 75% 以上，因此攜手用戶、供應商減少碳排量，是邁向淨零的關鍵。台灣大 2023 年導入 ISO 20400 永續採購框架，獲得 BSI 英國標準協會頒發驗證證書，將永續準則納入採購流程和供應鏈管理，透過實地審查以及教育訓練，協助供應商接軌國際永續標準，著手輔導供應商制定「科學基礎減碳目標」，預計 2030 年前實現碳排量較 2020 年減少 25% 的目標。同時台灣大號召用戶響應循環經濟，首創「認證二手機專案」，提供台灣大專業認證的二手機，搭配專案銷售，延長手機使用週期，減少電子產品碳足跡。",2024-02-06 18:31:23,20910,"世界最大碳揭露組織 CDP (Carbon Disclosure Project, 碳揭露專案) 「氣候變遷」評比今 (6) 日公布，台灣大哥大 (3045-TW) 四度獲最高等級「A」級肯定，為台灣電信業最佳。",['台灣大'],9bff82f8-ced7-42b6-ae58-5027593898c2
情人節商機現 統一集團7大通路開賣6.5萬支進口玫瑰花,"['統一', '情人節', '空運']","瞄準情人節商機，統一集團今 (6) 日宣布，今年集結旗下通路力量包括 7-ELEVEN、康是美、統一時代百貨台北店、高雄夢時代、BEING sport、BEING fit、星巴克、CupiCho 丘彼巧全球精品巧克力專門店等，同步獻上近 6.5 萬朵「進口空運玫瑰花」供消費者選購。


統一集團指出，今年西洋情人節適逢農曆初五，也是春節連假最後一天，預估臨時性購花需求將大增，因此，集結旗下 7 大品牌，提供民眾多元且便利的購花管道。


此次統一集團特別引進來自哥倫比亞、厄瓜多的空運進口玫瑰花，全程低溫保鮮運送，花型碩大立體飽滿、花瓣豐富多層次。


其中 2 月 12 日起 7-ELEVEN 限定門市將販售進口空運紅色玫瑰花，單支售價 179 元，並同步推出巧克力加價購。


康是美自 2 月 13 日至 2 月 15 日於指定門市販售，全店滿額 1000 元可享有 99 元加購優惠，全店滿額 2,000 元可獲贈玫瑰花 1 支。


統一時代百貨台北店自 2 月 13 日至 2 月 14 日止，全館化妝品 / 飾品指定櫃位消費滿 3000 元，贈送玫瑰花 1 支。


而 2 月 14 日當日，消費者於星巴克門市單筆消費滿 1314 元，即可獲得玫瑰花 1 支。",2024-02-06 18:32:19,20909,情人節商機現 統一集團 7 大通路開賣 6.5 萬支進口玫瑰花,['統一超'],07c6b8ba-b51a-4b33-9e19-bde5c7792330
