title,keywords,content,publish_at,id,summary,related_stocks,uuid
迅杰推類Chromebook IC 搶未來AI裝置,"['迅杰', 'AI', 'PC', 'Chromebook', 'EC']","AI 時代來臨，越來越多衍生新裝置即將問世，迅杰 (6243-TW) 近期規畫推出「Chromebook like」嵌入式控制器 (EC) 產品，搶進 Arm 架構處理器為核心的 AI 裝置，滿足未來 AI PC 與各裝置所需。


高通 (QCOM-US) 近日推出最新 PC 處理器 Snapdragon X Elite，宣示 Arm 架構的處理器效能超越 x86 架構，不少品牌廠都已採用，連輝達 (NVDA-US) 也有意進軍 Arm PC 市場，顯現未來 AI PC 時代中，Arm 架構處理器已成為關鍵核心。


迅杰看好，未來在 AI 驅動下，將催生更多 AI 邊緣裝置，並搭載 Arm 架構處理器，自家新推出的 Chromebook like EC 除了瞄準 Chromebook 外，也可滿足衍生的相關需求。


展望後市，迅杰第四季在 PC 需求持穩下，法人看好，營收可望維持年增，明年在整體景氣復甦、庫存去化至正常水位以及 PC 出貨量回升下，營運也正向看。


另外，迅杰是神盾 (6462-TW) 集團成員之一，除了有共同設計開案，也透過集團在晶圓採購的優勢，有助晶圓成本下降，目前已有兩顆新產品在新晶圓廠投片，預計明年在新品量產下，成本效益會逐步顯現。",2023-11-05 16:00:04,17022,AI 時代來臨，越來越多衍生新裝置即將問世，迅杰 (6243-TW) 近期規畫推出「Chromebook like」的嵌入式控制器 (EC) 產品，搶進 Arm 架構處理器為核心的 AI 裝置，滿足未來 AI PC 與各裝置所需。,"['迅杰', '神盾', '高通', '輝達']",6db8bf60-d6f1-4ba7-be05-e2e90eba5efe
鴻海10月營收7412億元月增12% Q4估顯著季增,"['鴻海', '營收', 'iPhone']","鴻海 (2317-TW) 今 (5) 日公告 10 月營收 7412 億元，月增 12.2%、年減 4.6%，為今年以來最高、並創歷年同期次高；累計前 10 月營收 5.05 兆元，年減 7.2%。


而鴻海的大客戶蘋果釋出本季營收表現持平的展望，但鴻海認為，在資通訊產業旺季帶動，以及客戶與產品結構越來越完整的情況下，維持第四季營收將顯著季增的看法。


鴻海 10 月四大產品表現來看，受惠新品拉貨，以及客戶提前備貨中國雙 11 及北美感恩節銷售旺季，帶動消費智能產品顯著月增、電腦終端強勁成長；雲端網路也受惠美系伺服器品牌客戶拉貨，月增表現同樣強勁，僅元件及其他產品約略持平前月。


若與去年同期相比，鴻海表示，元件及其他產品強勁年增，消費智能產品約略持平，雲端網路、電腦終端等產品則衰退；累計前 10 月來看，元件及其他產品約略持平，消費智能、雲端網路產品、電腦終端等產品則均微幅衰退。",2023-11-05 16:06:02,17021,鴻海 (2317-TW) 今 (5) 日公告 10 月營收，在 iPhone 15 銷售旺季以及 MacBook 新機備貨需求帶動，營收 7412 億元，月增 12.2%、年減 4.6%，為今年單月最高、歷年同期次高；累計前 10 月營收 5.05 兆元,['鴻海'],0deb67a2-32f4-459a-9679-69bc3dd04382
聯茂10月營收23.33億元 創今年新高,"['營收', 'CCL', '聯茂']","CCL(銅箔基板廠) 廠聯茂 (6213-TW) 今 (5) 日公布最新營收，10 月營收爲 23.33 億元，爲今年新高，月增 0.92%，年增 11.09%；前 10 月營收 206.76 億元，年減 15.15%。聯茂下半年營收都站穩 20 億元之上，預估第四季將優於第三季。


聯茂第四季接單趨於明朗，預估將較第三季成長，另外，聯茂泰國新廠也已動工，預計最快 2024 年下半年開出月產能 30 萬張，同時也積極增加對泰國廠的投資金額。


聯茂第三季營收爲 66.45 億元，毛利率 13.55%，季增 2.85 個百分點，年增 2.04 個百分點，單季稅後純益 2.35 億元，賺贏上半年，季增 4.64 倍，年減 15.41%，每股 0.65 元。


聯茂前三季營收 183.35 億元，毛利率 11.73%，年減 1.37 個百分點，稅後純益 3.5 億元，年減 76.98%，每股純益 0.96 元。


同時，聯茂董事會也通過對動工興建中泰國新廠增加 7.55 億元的投資金額，總投資金額由 15.36 億元增加到 22.91 億元。


聯茂指出，公司將持續受惠 AI 伺服器產業和車用電子升級之雙引擎成長趨勢，看好客戶未來在高階電子材料需求，並因應全球供應鏈變化，新增泰國廠產能於今年動土，明年開始試產，為長期成長提早奠定基礎。",2023-11-05 21:41:43,17020,CCL(銅箔基板廠) 廠聯茂 (6213-TW) 今 (5) 日公布最新營收，2023 年 10 月營收爲 23.33 億元，爲今年新高，月增 0.92%，年增 11.09%，2023 年 11 月營收 206.76 億元，年減 15.15%。,['聯茂'],b42aad32-9cdd-4fe4-989f-b597e6040cd6
