title,keywords,content,publish_at,id,summary,related_stocks,uuid
〈金龍年招財術〉發財水初六開工免費送 銀行領取懶人包別錯過,"['發財水', '龍年', '銀行', '招財', '新春', '提燈']","龍年大吉財運旺！各家銀行紛紛推出發財水、富貴米、開運錢母等應景小物，業者除了放入自家金庫加持外，甚至「睡過」財神廟雙重加持，希望把財運分享給客戶，期許新的一年財運亨通、生意源源不絕。 雖然有部分銀行活動已開跑，但多數仍預計在大年初六 (2/15) 開工日才會正式發送，《鉅亨網》幫讀者整理了懶人包，民眾可要把握時間前往領去。


發財水源自民間習俗，據說放在對的位置更能匯聚財氣能量，一、放在家中進門後 45 度角財位 (明財位)，將錢財吸引進門；二、放在家中或辦公室的正南方 (龍年偏財位)，增加偏財運；三、放在家中或辦公室的正北方 (龍年財庫位)，以達到最佳的聚財效果。


北富銀 88888 瓶發財水 2/15 開工全台分行免費送


北富銀發財水在設計上以金色底加上金色瓶蓋，搭配龍年圖騰設計，象徵金龍進家富滿堂的美好寓意，瓶身印上「新春福龍送吉祥、好事連連加倍多」吉祥話，祝福客戶獲得加倍好運。今年為了讓更多民眾分享好運氣，北富銀特別把發財水數量將增加三成，從去年的 66666 瓶增加為 88888 瓶，將入庫匯聚財氣，2 月 15 日開工日起正式發送，只要到北富銀全台分行洽辦業務即可索取，送完為止。


北富銀今年還準備了 3 萬份發財金，以招財開運的紅色搭配「龍年圖騰」和「富邦財神」圖樣，經竹山紫南宮香火過爐，可以放在錢包皮夾裡隨身攜帶，或是跟存摺放在一起，持續吸引財氣滾滾來。北富銀表示，財富管理客戶至全台分行洽辦業務即可獲贈一份，送完為止。




(圖：北富銀提供)




台中銀超 Q 吉祥物發財水 將送出 8 萬瓶


台中銀行今年發財水改版，瓶身造型以企業吉祥物「阿中」來設計，包裝以紅、金色系搭配，象徵喜氣與金融結合的富貴意象，將於春節期間置放於行舍金庫中，匯集日夜累積的興旺財氣，台中銀預計 2 月 15 日 (大年初六) 開工日於全台營業單位限量發放，共計送出 8 萬瓶發財水，希望將財運分享予客戶，期許財運亨通、生意源源不絕。 




(圖：台中銀提供)




新光銀發財水免費送 完成任務可兌換龍年提燈


新光銀行在農曆年節前，將限量的「龍迎百福發財水」放置在分行的金庫裡，於春節期間飽吸財氣後，客戶在農曆過年後第一個開工營業 2 月 15 日親臨全國各分行臨櫃辦理業務，即可免費索取發財水 1 瓶，數量有限送完為止。


新光金連續 19 年推出生肖提燈，今年以生肖「龍」為造型，並以「龍騰鴻運」為提燈主題，以飛龍姿態及靈活羽翼象徵龍年嶄新的活動；提燈亦結合祈福開運、變化造型及環保回收素材呈現，新光銀行信用卡卡友只要於即日起至 2024 年 2 月 23 日前刷卡累積每滿新台幣 5000 元，即可至全台分行兌換 1 只，上限 3 只，數量有限換完為止。


元大銀二款新春開運小物 完成指定任務還送元氣龍撲滿


元大銀行推出二款新春開運物品，包含限量 14 萬份的「欣欣向龍發財水」，以及 1 萬 4 千份的「一桶金招財擺飾」。客戶可至元大銀行全台各分行（共 149 家分行，含金門分行）領取限量發財水或一桶金招財擺飾乙份，數量有限送完為止。另外，元大銀自 2020 年金鼠年起推出一系列生肖撲滿，廣受客戶好評，至 3 月 31 日前完成專案指定理財任務，即可獲得今年限量的「元氣龍撲滿」一個。




(圖：元大銀提供)




中信銀發財禮限量 88888 份 2/15 贈來行財管客戶


中信銀行以「豐盈富足」為主題，發行限定年曆及發財金、發財水與客戶共享福氣，預計將於新春第一天開門營業日（2 月 15 日）餽贈來行的財富管理客戶，全臺限量 88888 份，數量有限、送完為止。


國泰世華銀行發財水瓶身搭上 ESG 概念


國泰世華銀行龍年發財水瓶身採用輕量環保材質，外包裝以書法運筆藝術詮釋祥龍攀天的富貴意象，圓融形體設計點綴龍躍天衢之勢，搭配燙金工藝展現品牌雅緻韻味，襯托出畫龍點睛之妙。 發財水已配送到全台 165 家分行，各分行放入金庫內將吸收滿滿財氣，發送時間由各分行自行決定。


台新銀金龍年送開運發財三寶


台新銀行特別準備 88888 瓶「開運水」，還有 58888 份「發財金」，以 8 的吉祥數量進行安排，希望客戶在金龍年都能發財順利、財運興旺。「平安御守」則是限量 888 份，來行新申辦 YBO 兒童會員即可獲得。民眾領取到「開運水」後建議放在家門兩側 45 度角的財位，擺放至元宵節後再飲用，為全家財運加分；拿到「發財金」後可放在皮夾、皮包或保險箱等放置財物的地方，可以招來財運；「平安御守」則是放在小朋友的書包或筆袋中，增添健康平安的庇佑能量。",2024-02-06 15:11:13,20929,龍年大吉財運旺！各家銀行紛紛推出發財水、富貴米、開運錢母等應景小物，業者除了放入自家金庫加持外，甚至「睡過」財神廟雙重加持，希望把財運分享給客戶，期許新的一年財運亨通、生意源源不絕。 雖然有部分銀行活動已開跑，,[],f3a6b5fc-22ac-4792-971e-241be817cece
新北市府與冠德攜手 推動新北捷運聯開首案預計Q4完工,"['冠德', '新北', '房產', 'ESG']","新北環狀線秀朗橋站捷運聯開大樓為新北市捷運局首件捷運聯合開發案，今 (6) 日舉行上樑典禮，由新北市長侯友宜及冠德建設 (2520-TW) 董事長馬志綱共同擔任主典者，同時也見證新北捷運局首件主辦捷運聯開案達成階段性目標，即將邁入新里程碑，打造成地上 20 層、地下 5 層的商辦大樓。


新北環狀線秀朗橋站捷運聯開大樓，預計 2024 年第四季完工且取得使用執照，


新北市長侯友宜表示，新北環狀線秀朗橋站是新北捷運局首件自辦的捷運開發案，將可提供 1.5 萬坪商業及辦公空間，創造 3000 個就業機會，成功將大眾運輸導向發展（TOD）政策，將人流及商業導引到捷運沿線活動及發展，也讓環狀線旅運量持續成長，打造安居樂業的新北捷運生活圈。


冠德建設董事長馬志綱表示，捷運聯合開發不僅能提升地區發展，更能帶動城市面貌再生，具發展性及永續性，冠德集團長期致力於發展軌道經濟，發揮專業投入捷運聯開案，累積了豐富的經驗與成果。


環狀線秀朗橋站聯開案自 2020 年 9 月簽約，在與新北市政府、新北捷運局團隊的攜手合作下，共同打造優質的捷運轉乘及商辦空間，不僅建立了政府及企業間共同推動都市發展的典範，未來引入的企業及就業人潮，也將推升區域商業活絡，推動都市發展。


新北環狀線捷運秀朗橋站聯開大樓，位於中和區主要交通幹道 - 景平路上，並銜接新北市新店區及中和區的交界處，打造成地上 20 層、地下 5 層的商辦大樓，1-2 樓除作為捷運出入口使用，並規劃 11 間店面，有利於各式商家進駐，方便旅客通勤時使用及增進鄰近住家之生活機能。


新北環狀線秀朗橋站捷運聯開大樓 3 樓規劃為圖書館、會議室、交誼廳等辦公共享空間，提升企業間互動頻率；4-20 層樓規劃為一般辦公室共 214 戶，可彈性調整供中小企業作微型企業總部、個人工作室等使用，形塑群聚效應，創造大量工作機會及人口進駐，並提供市民到站即上班的便利性，大幅縮短通勤交通時間，預計 2024 年第四季完工且取得使用執照，打造成為兼具環保、節能、永續的捷運開發大樓。",2024-02-06 15:14:36,20928,新北環狀線秀朗橋站捷運聯開大樓為新北市捷運局首件捷運聯合開發案，今 (6) 日舉行上樑典禮，由新北市長侯友宜及冠德建設 (2520-TW) 董事長馬志綱共同擔任主典者，同時也見證新北捷運局首件主辦捷運聯開案達成階段性目標。,['冠德'],3e5aae7b-ca3e-4e55-8dae-971aace0d461
玉晶光1月營收19.48億元創歷年同期新高 年增44.58%,"['大立光', '玉晶光', '蘋果', '光學']","蘋果供應鏈光學元件廠玉晶光 (3406-TW) 今 (6) 日公布 2024 年 1 月營收爲 19.48 億元，創歷年同期新高，月增 7.08%，年增 44.58%，在玉晶光積極於台灣及廈門擴充產能之下，有利於在 2024 年首季營創歷史同期新高。


玉晶光在掌握美系客戶的優勢之下，加上兩岸不斷的擴產產品品項及升級，公司營收在 2019 年高幅度成長逾 50% 突破 100 億元，到 2023 年已近倍增到 216.75 億元，這也是玉晶光年度營收首度突破 200 億元，公司對今年的業績並不看淡，如出貨順利，2024 年首季營收將超越去年同期的 33.28 億元。


玉晶光 2023 年第三季營收 88.53 億元，毛利率 35.05%，季增 4.93 個百分點，年減 7 個百分點，稅後純益 15.69 億元，年減 9.23%，每股純益 13.92 元；2023 年前三季營收 148.87 億元，毛利率 33.31%，年減 4.99 個百分點，稅後純益爲 19.19 億元，年減 21.01%，每股純益 17.02 元。2023 年第三季玉晶光毛利率表現不如預期，主要原因是產品組合其中 VR 產品占比達 20% 的影響，當然 VR 新產品的良率及生產規模影響也有關。


而玉晶光預計第四季在產品組合改變下，有利於毛利率有機會勝過第三季的 35.05%。


同為蘋果供應鏈的大立光 (3008-TW) 昨日公布 2024 年 1 月營收再下滑爲 44.67 億元，月減 6.57%，年增 37.03%，大立光在 2 月工作天數減少之下，出貨動能相對 1 月下降。",2024-02-06 15:32:51,20927,蘋果供應鏈光學元件廠玉晶光 (3406-TW) 今 (6) 日公布 2024 年 1 月營收爲 19.48 億元，創歷年同期新高，月增 7.08%，年增 44.58%，在玉晶光積極於台灣及廈擴充產能之下，有利於在 2024 年首季營創歷史同期新高。,"['玉晶光', '大立光']",d87d851c-62c4-4fcd-8e0f-4cd7ebba822a
〈聯詠法說〉Q4獲利季減16% 全年EPS 38.32元寫第三高,"['聯詠', '驅動IC', '存貨回沖', '毛利率']","驅動 IC 大廠聯詠 (3034-TW) 今 (6) 日召開法說會，並公布去年第四季財報，受整體需求趨緩影響，稅後純益較前季下滑 16%、約 53.28 億元，每股稅後純益 8.76 元，累計全年達 38.32 元，改寫歷史第三高。


聯詠去年第四季營收 271.54 億元，季減 6.14%，年增 21.11%，毛利率 41.48%，季減 0.77 個百分點，年增 0.93 個百分點，營益率 23.22%，季減 1.47 個百分點，年減 0.01 個百分點，稅後純益 53.28 億元，季減 16.3%，年增 31.79%，每股稅後純益 8.76 元。


聯詠去年全年營收 1104.39 億元，年增 0.43%，毛利率 41.85%，年減 4.48 個百分點，營益率 24.14%，年減 5.63 個百分點，稅後純益 233.18 億元，年減 16.64%，每股稅後純益 38.32 元。


細分三大產品線，聯詠去年第四季營收比重分別小尺寸驅動 IC 佔 35%、大尺寸驅動 IC 約 26%，SOC 則為 35%；聯詠今日也公布 1 月營收，為 87.2 億元，月增 0.46%，年增 20.71%。


聯詠去年第四季存貨淨額 85.51 億元，季減 6.19%，年減 28.91%，存貨週轉天數為 72 天，較去年第三季 74 天減少，展望第一季，存貨水準估與上季相當。


聯詠補充，第四季毛利率優於預期，主要因認列高毛利的委託設計 (NRE) 收入與存貨跌價回升，兩者貢獻毛利率達 1.6 個百分點，並看好今年 NRE 業績也會再優於去年。",2024-02-06 16:11:01,20926,驅動 IC 大廠聯詠 (3034-TW) 今 (6) 日召開法說會，並公布去年第四季財報，受整體需求趨緩影響，稅後純益較前季下滑 16%、約 53.28 億元，每股稅後純益 8.76 元，累計全年達 38.32 元，改寫歷史第三高。,['聯詠'],63b79c88-5103-485c-90cf-f2ec929ac1eb
淡季效應影響 宏達電元月營收降至2.25億元,"['宏達電', 'vr', 'HTC']","宏達電 (2498-TW) 今 (6) 日公告營收，由於適逢傳統產業淡季，單月營收降至 2.25 億元，月減 64.6%、年增 4.6%。宏達電因應春節期間祭出產品優惠，期望搶佔新年商機、穩住營運表現。


VR 布局方面，宏達電在 CES 2024 期間宣布推出全新的 VIVE XR Elite 全臉追蹤器，是針對開發者和企業而打造，可透過 USB-C 連接埠達到即插即用，搭載每秒 60 Hz 的面部追蹤速率，精準捕捉嘴唇、牙齒、舌頭等 38 個面部混合形狀動作，達到自然逼真的面部表達。配備雙眼攝像頭，可捕捉注視源、瞳孔大小、瞳孔位置和睜眼幅度，實現更精準的眼球運動追蹤。


同時，宏達電 HTC 宣布與 AT&T、Mynd Immersive 及美國消費技術協會基金會 (CTAF) 合作，推出「Great American Elderverse」沉浸式 VR 治療計畫，旨在透過 VR 技術為全美 500 多家老年照護社區的長者提供豐富而深具意義的生活體驗。此項計畫將針對尚未得到充分照護的老年社區引入沉浸式 VR 治療方案，在未來幾年中將改變數百萬美國長者的生活。",2024-02-06 16:12:10,20925,宏達電 (2498-TW) 今 (6) 日公告營收，由於適逢傳統產業淡季，單月營收降至 2.25 億元，月減 64.6%、年增 4.6%。宏達電因應春節期間祭出產品優惠，期望搶佔新年商機、穩住營運表現。,['宏達電'],9261364b-d139-494b-9906-1cdd52f2705c
可成受惠新品量產、組裝廠加速拉貨 1月營收年月雙增逾1成,"['可成', '機殼', 'AI PC']","機殼廠可成 (2474-TW) 今 (6) 日公布今年 1 月營收 12.98 億元，年月雙增逾 1 成。可成指出，由於品牌客戶新品量產，加上組裝廠加速拉貨動能，帶動 1 月營收較去年 12 月成長。 


可成 1 月營收 12.98 億元，較去年 12 月增加 2.67 億元，月增 25.9%，且較去年同期成長 1.17 億元，年增 10%。可成表示，受惠品牌客戶新品陸續量產，加上組裝廠加速拉貨，推升 1 月整體營運。 


可成進一步指出，品牌客戶的高階消費機種從第一季開始量產，預期農曆春節後，拉貨動能將有望更強勁。另外，因應微軟 (MSFT-US)Windows 11 將升級，以及 AI PC 熱潮，下半年開始有望看到商務需求緩步復甦，可成審慎樂觀看待 2024 年。",2024-02-06 16:13:31,20924,機殼廠可成 (2474-TW) 今 (6) 日公布今年 1 月營收 12.98 億元，年月雙增逾 1 成。可成指出，由於品牌客戶新品量產，加上組裝廠加速拉貨動能，帶動 1 月營收較去年 12 月成長。 ,"['可成', '微軟']",b2aa04ff-7ca5-48f4-b27e-0cd9c09e5796
是方元月營收刷同期高 IDC大樓獲NCC高度肯定,"['是方', '資料中心', 'IDC', 'NCC']","國家通訊傳播委員會 (NCC) 主委陳耀祥日前率領參訪團視察是方電訊 (6561-TW)IDC 大樓，瞭解相關機房設備、備援機制及機房安全管理等，並給予高度肯定。是方董事長吳彥宏表示，期待未來能夠持續優化人工智能資料中心 AIDC 服務，中央及地方政府支持將是方打造成台灣網路產業的台積電。


是方今日也同步公告元月營收 2.74 億元，創歷史同期新高，月增 0.55%、年增 5.2%。


是方為台灣最大國際網路交換中心，擁有國際級雲端交換中心、網路資料中心，以及台灣目前會員數和訊務交換量第一大、全球排名 95 名的台北網際網路交換中心 (TPIX)，同時，也獲得經濟部產業發展署公用雲端資料中心計畫，讓是方成為台灣推動企業數位化及雲端化的重要推手。

 

近年來，是方致力於成為東亞數位匯流及 AI 雲端應用中心，匯集目前亞太地區主要私有海纜系統以及各大共構海纜系統，並有國內外知名固網業者及各產業龍頭進駐，顯示是方已經成為台灣與世界接軌的重要戰略樞鈕。


陳耀祥日前率領參訪團瞭解是方 IDC 相關機房設備、災害防護措施、備援機制及機房安全管理等。他提到，是方去年獲得櫃買中心第九屆公司治理評鑑第一級 (前 5%) 殊榮，嘉許是方能夠持續努力，成為台灣網路產業的台積電，為台灣科技與經濟發展做出更大的貢獻。


吳彥宏指出，未來將會持續投資擴充機房容量，並引進最新的科技設備，以提供企業客戶最優質的服務，期盼政府能夠提供更多政策支持，讓台灣的網路產業能夠更加蓬勃發展。",2024-02-06 16:14:15,20923,國家通訊傳播委員會 (NCC) 主委陳耀祥日前率領參訪團視察是方電訊 (6561-TW)IDC 大樓，瞭解相關機房設備、備援機制及機房安全管理等，並給予高度肯定。,['是方'],63401b15-83b8-400a-94b2-feb5b8208c8d
儒鴻1月營收年增25% 接單持續正向發展,"['儒鴻', '聚陽', '成衣', '布', '紡織']","成衣大廠儒鴻 (1476-TW) 今 (6) 日公告 1 月營收 26.29 億元，雖然月減 2%，但年增 25%，主要受惠訂單持續回溫，公司表示，目前訂單能見度仍維持半年的水準。


儒鴻表示，目前零售通路商去化庫存狀況比品牌商好，品牌當中 Lululemon 進度較快，Nike 去化速度也有加快，第二季訂單會比較確定，今年中小品牌成長性會比大品牌好一點。


若以產品區分，儒鴻表示，成衣去年受到客戶調整庫存影響較大，但今年開始回溫，將成為推升業績表現的主要動能；布料方面，高階布料出貨、價格依舊持穩。


整體而言，儒鴻認為，目前訂單狀況持續朝正向發展，自有本廠的稼動率維持在 9 成的高檔水準，隨著訂單持續增加，外發比重將從現在 25-30%，慢慢恢復到過往 35%-45% 的水準。


另一成衣大廠聚陽 (1477-TW)1 月營收 27.55 億元，雖然月減 15.9%，但年增 15.4%。聚陽 1 月 ASP 雖然略減，但出貨量年增近 2 成，仍支撐營收繳出強勁年增表現，公司也維持第一季、上半年出貨量雙位數年增的展望。",2024-02-06 16:15:06,20922,成衣大廠儒鴻 (1476-TW) 今 (6) 日公告 1 月營收 26.29 億元，雖然月減 2%，但年增 25%，主要受惠訂單持續回溫，公司表示，目前訂單能見度仍維持半年的水準。,"['儒鴻', '聚陽']",0a51906e-5376-46da-8f81-4b7e78640b6a
〈聯詠法說〉Q1進入傳統淡季 營收估季減8-12%,"['聯詠', '驅動IC', 'OLED', '手機', '消費性電子']","驅動 IC 大廠聯詠 (3034-TW) 今 (6) 日召開法說會，副董暨總經理王守仁表示，第一季受傳統淡季與工作天數減少，營收估較上季下滑，且現階段需求不明朗，客戶多以急單、短單為主，以美元兌新台幣匯率 31.2 元推算，營收約 240-250 億元，季減 8-12%，年增 0-4%，毛利率 38.5-40.5%，營益率 19.5-21.5%。


細分終端應用，王守仁說，由於消費性電子進入傳統淡季，各種應用包括電視、顯示器、筆電、手機、VR 還有車用，需求都較上季下滑。


從三大產品線來看，王守仁指出，SOC 去年第四季已提早做修正，第一季業績估略減；中小尺寸驅動 IC 因手機客戶補貨告一段落，需觀察春節銷售狀況，整體業績呈現季減，其中，TDDI 呈現下滑、OLED 驅動 IC 大致持平，車用客戶也調整庫存；大尺寸驅動 IC 業績下滑幅度為產品線中最大，主要是電視、顯示器等都進入淡季，面板廠調整產線因應。


展望全年，王守仁看好，手機 OLED 驅動 IC 應該有不錯成長機會，電視 SOC 有新產品與新客戶加入，PC/NB 預期會有換機潮，且在 AI 驅動下，高階產品比重提升，對公司是新的成長契機。


針對庫存，王守仁認為，供應鏈針對經過一年多調整，產業庫存已恢復到健康水位，但關鍵仍是需求端，需密切觀察總體經濟與地緣政治對需求的影響。


展望 AI，王守仁指出，不論是 AI PC/NB / 手機，相關裝置隨著新功能加入，將驅動顯示器規格提升，終端裝置也會導入 AI 功能，如電視、顯示器等，且高速傳輸介面是公司核心技術，公司也已投入開發，不會缺席高速傳輸介面市場。


至於 ASIC 業務，聯詠為滿足部分客戶強調產品差異化，去年已認列委託設計 (NRE) 收入，且不論是驅動 IC/SOC 產品線都有 ASIC 業務，看好今年 ASIC 業務會持續成長。


聯詠產品最先進製程已達 6 奈米，王守仁補充，目前 6 奈米產品佔公司營收比重不高，主要是應用在智慧影像與顯示畫質產品，但看好前期導入對公司產品長期研發與 ASIC 業務開拓有幫助。",2024-02-06 16:34:22,20921,驅動 IC 大廠聯詠 (3034-TW) 今 (6) 日召開法說會，副董暨總經理王守仁表示，第一季受傳統淡季與工作天數減少，營收估較上季下滑，且現階段需求不明朗，客戶多以急單、短單為主，以美元兌新台幣匯率 31.2 元推算，營收約 240,['聯詠'],e9fffac1-756a-41c8-8547-900e8326aa77
材料-KY1月營收12.81億元創歷史次高 年增1.97倍,"['材料-KY', '營收', 'ESG', 'EPS']","材料 - KY(4763-TW) 在 2023 年 12 月營收因客戶加速提貨以因應今年首季的短少可出貨天數，單月以 13.51 億元創新高，而在材料 - KY 今 (6) 日公布 2024 年 1 月營收 12.81 億元，月減 5.13%，年增 1.97 倍，為歷史次高水準，也創歷史同期新高。主要由於絲束和醋片需求持續強勁，及絲束與醋片新產能擴增完成挹注，暨銷售價格調高等因素。


材料 - KY 指出，展望 2024 年，由於加熱不燃燒菸市場成長及地緣政治情勢變化等因素，全世界供應鏈已重新排列，絲束可望持續受惠；另看好醋片在中國的內需市場，供應鏈改變的長期趨勢持續支持材料成長。目前訂單能見度高，且對上游漿、醋酸供應及價格能充分掌握，2024 年訂單已陸續談妥，在平均銷售單價優於 2023 年，且 2024 年有新的絲束產能擴充規劃之下，樂觀看待成長動能延續。


材料 - KY 在產能規劃方面，因應絲束需求與營運成長，預計 2024 年 7 月中旬完成擴增 9,000 噸絲束產能，2025 年 1 月再擴增 9,000 噸的絲束產能，暨預計 2025 年第二季完成 35,000 噸醋片產能擴增。另東南亞設廠 (絲束) 計畫，目前正密集協商中，包含與四大菸草公司之一或當地第一大菸廠洽談合資方式，按規劃進度，東南亞新增產能可望於 2026 年開出。


材料 - KY 指出，除持續優化生產效率與擴大產能外，材料 - KY 往兩大策略方向局局，以達成長期成長及鞏固競爭優勢，包括把握循環經濟的發展機會，持續增加投資研發綠色環保材料及回收技術。同時，因應中國大陸醋酸纖維女裝面料需求，擴增醋酸纖維長絲產能，以佈局並增加多樣化產品。


材料 - KY 在 2023 年前三季營收 71.89 億元，毛利率 59.9%，年增 1.78 個百分點，前三季稅後純益 32.4 億元，年增 2.6 倍，每股純益 39.63 元。2023 年全年營收 110.26 億元，年增 1.58 倍，同時，在今年訂單已陸續談妥，在平均銷售單價優於 2023 年。",2024-02-06 16:35:35,20920,材料 - KY(4763-TW) 在 2023 年 12 月營收因客戶加速提貨以因應今年首季的短少可出貨天數，單月以 13.51 億元創新高，而在材料 - KY 今 (6) 日公布 2024 年 1 月營收 12.81 億元，月減 5.13%，年增 1.97 倍。,['材料-KY'],7fc89515-b716-4512-bf6f-5e8c2e51ee82
智邦1月營收年月雙減 WiFi 7、400G交換器商機有望推升營運,"['智邦', '網通', 'WiFi 7', '400G']","網通廠智邦 (2345-TW) 今 (6) 日公布今年 1 月營收 58.85 億元，年月雙減。不過隨著蘋果、三星今年都有計畫在新手機中導入 WiFi 7 功能，智邦將有望受惠。此外，智邦 400G 交換器出貨穩定成長，法人看好智邦今年營收有望雙位數成長。 


智邦 1 月營收 58.85 億元，較去年 12 月減少 20.42 億元，月減 25.8%，較去年同期衰退 3.85 億元，年減 6.3%。 


雖然智邦 1 月營收年月雙減，但隨著手機品牌大廠蘋果與三星，今年都有計畫將 WiFi 7 功能導入新手機，法人認為，智邦有望成為受惠業者。不過法人也指出，WiFi 7 終端產品可能要等到下半年才會亮相，上半年出貨仍以 WiFi 6E 為最大宗。 


另外，智邦自去年開始積極將 100G 產品轉換成 400G 產品，法人指出，目前整體轉換狀況佳，去年 12 月營收更創下歷史單月次高，且去年全年營收年增 9%。因此法人認為，400G 產品可望推升智邦營運動能，看好今年營收雙位數成長。",2024-02-06 16:49:18,20919,網通廠智邦 (2345-TW) 今日公布今年 1 月營收 58.85 億元，年月雙減。不過隨著蘋果、三星今年都有計畫在新手機中導入 WiFi 7 功能，智邦有望受惠。此外，智邦 400G 交換器出貨穩定，法人看好智邦今年營收有望雙位數成長。,['智邦'],56858e8a-0d45-466b-bcee-a2d9757cd9fd
