content,publish_at,id,summary,title,keywords,related_stocks,uuid
"英業達 (2356-TW) 今 (13) 日召開股東會，針對 AI 趨勢，經營層指出，公司一直都在這個產業，預計今年 AI 伺服器出貨比重將成長至 10% 以上，預計明年出貨量將成長雙位數。


英業達表示，旗下伺服器包含 4-8 顆 GPU 就算 AI 伺服器，目前伺服器 GPU 仍緊缺，預期缺貨情況要到年底才會舒緩，將能帶動明年出貨成長。


董事長葉力誠認為，AI 應用層面確實越來越廣，若谷歌、微軟大廠持續推出新應用就有機會推動企業加速應用，但對於生成式 AI 而言，資料資安會是關鍵。


英業達表示，未來 2-3 年將會是由 CSP 廠商拉動 AI 伺服器的需求，當 AI 應用更廣、更完整之後，將會啟動新一波動能，驅動企業端 (Enterprise) 啟動 AI 伺服器拉貨。


至於今年，英業達認為，今年景氣較緩客戶資本支出有所收斂，今年伺服器出貨量預估持平，對於客戶而言，預算多挪至 AI 應用採購，若明年景氣提升、資本支出預算增加，便將會提高一般、AI 伺服器銷量。


英業達去年資料中心營收比重約 4 成，其中企業端比重 7 成、CSP 比重 3 成，生產方面，未來將擴大泰國、墨西哥的產能，分散生產風險，強化供應鏈韌性。",2023-06-13 18:34:46,11399,英業達今 (13) 日召開股東會，針對 AI 趨勢，經營層指出，公司一直都在這個產業，預計今年 AI 伺服器出貨比重將成長至 10% 以上，預計明年出貨將成長雙位數。,〈英業達股東會〉今年AI伺服器比重衝1成以上 明年出貨量雙位數成長,"['英業達', '伺服器', 'AI']",['英業達'],03bacf72-ddf5-4720-ba7d-34241905ab4b
"宣捷幹細胞 (4724-TW) 將於周五 (16 日) 登錄興櫃，每股參考價 28 元，除了幹細胞儲存服務穩定貢獻營收外，也利用幹細胞進行新藥開發，其中，慢性阻塞性肺病 (POCD) 進度最快，預計明年底完成二期臨床試驗收案。


宣捷幹細胞主要從事臍帶血、臍帶 / 胎盤幹細胞、成人周邊血與免疫細胞的儲存，以及幹細胞新藥開發。其中，幹細胞儲存服務為主要營收來源，目前儲存量約 2 萬多劑，未來一條胎盤可擴增至 4 萬劑。


新藥開發方面，總經理吳世揚表示，臍帶間質幹細胞具有開發多適應症新藥的潛力，目前鎖定的適應症包括慢性阻塞性肺病 (COPD)、老人衰弱症 (FS)、早產兒支氣管肺發育不全 (BPD)。


其中，慢性阻塞性肺病二期臨床試驗預計 7、8 月可以展開收案，預計明年底收完 70 名病患；老人衰弱症一 / 二期臨床則會在今年第四季展開收案；早產兒支氣管肺發育不全已經取的美國 FDA 孤兒藥資格，同時正在與歐洲藥廠洽談授權。


另外，兒童腦性麻痺、週產期缺氧窒息腦病變、極早產兒腦傷等適應症，皆已完成臨床前試驗，後續會申請正式臨床試驗。


吳世揚指出，細胞治療邁向精準化時代，宣捷已經掌握特定細胞分化技術，目前鎖定多項特化神經細胞，未來在「再生醫療雙法」經立法院三讀通過後，宣捷在幹細胞新藥發展上將相當具有競爭力。",2023-06-13 18:35:25,11398,宣捷幹細胞 (4724-TW) 將於周五 (16 日) 登錄興櫃，每股參考價 28 元，除了幹細胞儲存服務穩定貢獻營收外，利用幹細胞進行新藥開發，其中，慢性阻塞性肺病 (POCD) 進度最快，預計明年底完成二期臨床試驗收案。,〈宣捷幹細胞登興櫃〉6/16登興櫃 慢性阻塞性肺病二期臨床明年完成收案,"['宣捷幹細胞', '幹細胞', '新藥']",['宣捷幹細胞'],8ac6af8f-37e5-44ef-9d36-aeca6f7817b7
"台股大漲、外資匯入，新台幣兌美元今 (13) 日升值 3.8 分收在 30.716 元，台北及元太兩大外匯交易市場合計成交量共 16.07 億美元。在聯準會利率政策出爐前，預期在觀望氛圍下，新台幣匯價將繼續區間震盪。


台股今天在半導體領軍下，終場大漲逾 200 點，新台幣兌美元早盤一度隨台股強彈升破 30.7 元價位，但中國人民銀行宣布調降短期利率政策，市場解讀有預告降準的意味，拖累人民幣貶值，新台幣一度跟著翻貶下壓至 30.759 元。


匯銀主管說，新台幣早盤偏弱整理，但午盤過後隨著外資匯入，帶動新台幣匯價再度翻升，終場升值 3.8 分以 30.716 元作收。


匯銀主管表示，今天新台幣升值主要由外資買盤帶動，進出口商有進有出，拋匯買匯力道相互抵消，但本周適逢聯準會利率決策會議，外資將呈現偏觀望，新台幣匯價將繼續區間震盪。


主要亞幣中，僅人民幣受政策影響而偏弱整理，人民幣兌美元貶值 0.12%、離岸人民幣兌美元貶值 0.1%、新台幣兌美元升值 0.12%、日元兌美元升值 0.04%、韓元兌美元相對強勢，升值 0.57%。",2023-06-13 18:46:39,11397,台股大漲外資匯入，新台幣兌美元今 (13) 日升值 3.8 分收在 30.716 元，台北及元太兩大外匯交易市場合計成交量共 16.07 億美元。在聯準會利率政策出爐前，預期在觀望氛圍下，新台幣匯價將繼續區間震盪。,〈台幣〉外資買股匯入支撐 新台幣升3.8分收30.716元,"['新台幣', '台股', '美元', '美元指數']",[],89f6422f-74f5-4562-9aef-9d49dd11d9f7
"華航 (2610-TW) 今 (13) 日舉辦今年第一次法人說明會，總經理高星潢表示，整體營運由「貨運為主，客運為輔」轉變為「客貨並進」，預期下半年客運復甦更為顯著。


華航第一季合併營收 426.92 億元，年增 14.66%，超越 2022 年各季表現，其中，客運收入大幅成長，年增 1417%，貨運量則維持與疫前相當，加上運價仍高於疫前，較疫前高出 50%。


華航說明，目前主要營收來源由貨運轉為客運，相較疫情期間客運和貨運收入的比例約 1 比 9，第一季已轉變為 6 比 4。


華航預期，下半年客運復甦更為顯著，預計整體客運班次數將達疫前 80%，其中，歐洲、北美和大洋洲等長程航線大致恢復至疫前規模，營收更遠超越疫前達 125-153%，且 7 月 18 日將開航台北 - 布拉格。


而區域航線則增加班次密集度，並陸續開航宿霧、峴港和清邁等東南亞新航點，也恢復高雄小港機場出發的航班。


華航將喜迎暑假訂位量持續攀升，看好有望迎來疫後旅運高峰。


貨運方面，民航局統計去年全年台灣進出口、轉口及直轉貨物，華航共承運 74 萬噸，市占 42%，居所有航空公司之冠，而今年上半年貨運巿場呈現供給成長、需求減緩現象，華航認為，隨著下半年產業供應鏈庫存持續去化，貨運需求可望趨穩。


華航正積極爭取中長期客製化專案包機，增攬半導體機台、冷鏈貨物、發動機和航材等高收益貨源，並強化整合型快遞與聯航合作，掌握貨運成長契機。


在機隊規劃上，華航陸續引進 25 架 A321neo 客機，目前交付 10 架，預計 2026 年全數到位，另訂購 24 架 787 客機，預計 2025-2028 年交機，並規畫延租既有的 737-800、研議增租長程機。


貨機方面，華航說明，將出售 5 架 747-400F 貨機，並持續引進 777F 貨機，已交機 6 架，預計剩餘 4 架於明年交完。",2023-06-13 19:05:31,11396,華航定調今年「客貨並進」 下半年客運喜迎疫後高峰,華航定調今年「客貨並進」 下半年客運喜迎疫後高峰,"['華航', '長榮航', '航空', '出國', '貨運', '空運', '觀光']",['華航'],e66be82e-3ffd-41fd-992c-267fe9031bb9
"能源議題發高燒，也大力推升高力 (8996-TW) 業績高速成長，同時高力今 (13) 日股東常會董事全面改選，也有新投資方加入董事會，高齡 87 歲的創辦人韓顯壽在今天的改選中並未進入新一屆董事會，新董事會推選原總經理吳誌雄出任董事長。


對於此次的董事全面改選結果，出現高力成立 53 年來首度有外部投資方進入董事會，韓顯壽表示，高力公司能讓年輕、有資金實力的人參與經營是件好事。


同時，高力公司也指出，高力原有技術團隊都還留在原工作崗位，此次改選結果，不會對高力的大步向前構成任何不利影響。


高力今年董事改選中，高力公司提出足額 6 董、3 獨董，阿拉丁投資提名 3 董、3 獨董參與競選，最終選舉結果，阿拉丁投資所提名的谷泓道、吳俊英選普董，湯智堯、毛恩洸當選獨董，這也是擁有 53 年歷史的高力首次有外部投資人當選董事。


韓顯壽表示，高力 53 年前從 8 個人開始，堅持了這麼久，終於看到了未來，如今高雄、中壢、寧波廠都是滿載，希望未來能朝著永續百年企業前進，自己原本就有規劃交棒，公司能讓年輕、有資金實力的人參與經營是件好事。




創辦人韓顯壽以 87 歲高齡卸下高力董事長職務。(鉅亨網記者張欽發攝)




高力 13 日股價漲幅 4.26%，以 306 元歷史高點作收，吳誌雄表示，受惠於俄烏戰爭帶動熱泵需求，近來愈來愈多的大型客戶來工廠參訪、稽核，板式熱交換器的訂單能見度已達今年底，看好今年高力在全球市占率將從去年 5.1% 增至 5.5%，2024 年目標往 6% 邁進，不過過去供需吃緊的熱泵未來隨大廠近年積極擴產，需求不擔心，但供給面是要觀察的問題。


熱能產品方面，有主力客戶 Bloom Energy (BE-US) 燃料電池反應盒長期大單，預估未來 3-5 年，熱能產品每年都能維持 30% 以上的成長。


高力在客戶強勁需求下，高力也增加新產能，陸續增加真空爐設備，預估 2023 年增加 9 座真空爐，產能預估也將提升達 40%。


高力 2023 年 5 月營收以 4.87 億元創新高，較去年同期大增 1.16 倍，由於 Bloom Energy 的拉貨力道可望延續到 6 月，也將有利於大幅推升 2023 年第二季營收續創新高。


高力 2023 年第一季營收以 9.7 億元攀登巔峰，毛利率 28.56%，優於去年平均毛利率的 27.69%，稅後純益 1.27 億元，年增 1.72 倍，每股純益 1.42 元，加計 4 月自結單月稅後純益 6400 萬元，前 4 月每股純益達 2.14 元；法人預估，高力在第二季營運規模擴大且能在毛利率得以維持之下，估單季獲利將加速成長。",2023-06-13 19:10:47,11395,高力 (8996-TW) 業績高速成長，同時高力今 (13) 日股東常會董事全面改選，也有新投資方的加入董事會，同時，高齡 87 歲的創辦人韓顯壽在今天的改選中並未進入新一屆董事會，新董事會並推選吳誌雄按任董事長。,韓顯壽87高齡卸下高力董座職務 由專業經理人吳誌雄接棒,"['高力', '股東會', '營收', 'EPS', '董事長']","['高力', 'Bloom Energy Corporation Class A']",4d515e19-c0e2-4eb7-a573-a3d55bdace4a
"信用卡雙雄激戰，中信金 (2891-TW) 旗下中國信託銀行支付金融事業處處長陳德風今 (13) 日表示，預計今年簽帳金額上看 8000 億元，流通卡數可望突破 900 萬張，明年挑戰千萬張紀錄。


迎接國內外旅遊需求復甦，中國信託銀行今日宣布攜手國際數位旅遊平臺 (Online Travel Agency, OTA)－Agoda 推出「中國信託 Agoda 聯名卡」。


陳德風表示，據中信銀統計，今年旅遊消費刷卡較去年同期成長七成，已超越 2019 年疫情之前，過去海外旅遊占整體國人刷卡比重只占 9~10% 左右，但今年到前 5 月為止，海外消費占比已經大舉拉高到 13%，且 73% 客戶選擇自助旅行，看準此兩大趨勢，因此決議與全球最大的 OTA 平台合作。


面對信用卡市場競爭激烈，中國信託目前居於亞軍，陳德風表示，數字只是經營的結果，客戶需求才是經營核心，如何提供最佳服務體驗、把客戶服務做到細緻化，才是中國信託支付業務的經營策略，而非市場排名，「我們在客戶心目中的排名才是最重要的。」


陳德風進一步指出，中國信託對應客戶需求就提供相應的產品，例如目前社群有 Line Pay 聯名卡、交通有中油聯名卡、航空亦有華航聯名卡、ANA 及大中華聯名卡，看準遊戲市場需求，中國信託也發行英雄聯盟聯名卡，對喜歡運動的民眾，則有中信兄弟聯名卡，如今針對旅遊產業又多了 Agoda 聯名卡，就是希望結合客戶食衣住行育樂的需求，提供需要的產品。


陳德風表示，中信銀去年度簽帳金額 (信用卡加上簽帳卡) 為 6700 億元，今年 1 至 5 月的成長率都有達到 30%，前 5 月已刷破 3060 億元，預計今年全年總消費簽帳金額將上看 8000 億元，而發卡數部分，今年可望突破 900 萬張，以中信銀每月新發數大約卡 10~15 萬張，明年新發卡數將有望突破千萬張里程碑。


至於今天新發的 Agoda 聯名卡，卡友可直升 Agoda 最高等級白金會員，於聯名卡專屬網頁刷卡訂房享現折 10%，或指定飯店訂房最高現折 40% 的折扣優惠；於 Agoda 官網刷卡消費享 3% A 金回饋、生日當月最高更有 6% A 金回饋；一般消費及國外消費則分別享 1% 及 2.5% A 金回饋；在旅遊必要支出的交通及餐飲方面，享日本 JR 官網、臺灣高鐵、臺灣鐵路購票及指定異國美食餐廳最高 10% A 金回饋。A 金可於 Agoda 網站折抵消費，使用效期最長兩年。


由於 Agoda 聯名卡回饋優，陳德風表示，Agoda 聯名卡發卡目標為 30 萬張，希望首年可以達標一半、發出 15 萬張卡。",2023-06-13 19:11:00,11394,中國信託今年簽帳金額上看 8000 億元 卡量可望突破 900 萬張,〈信用卡激戰〉中國信託今年簽帳金額上看8000億元 卡量可望突破900萬張,"['信用卡', '中國信託', '中信銀', 'Agoda聯名卡', '刷卡']",['中信金'],901bcb00-29b1-4826-a19a-37107d163b02
"信紘科 (6667-TW) 今 (13) 日舉辦股東會，展望後市，公司指出，綠色製程解決方案有斬獲，預計廢有機溶劑去除雙氧水有機會在本季小量貢獻，且機能水設備也可望隨著先進封裝需求熱絡、推升接單。


信紘科此次全面改選董事，董事共九席，董事包括董事長簡士堡、湘鼎投資代表人米湘菱、許景翔、丁泰安與王龍德，四席獨董則為高紹華、巫立宇、蘇靖棋與畢祖明，任期皆為三年。


展望下半年，信紘科在手訂單保持良好水準，持續擴大廠務供應系統、綠色製程兩大業務，其中，廠務系統除深化台灣在地化服務經營，也拓展中國、美國、日本、新加坡與馬來西亞等海外業務。


另外，信紘科也加速綠色製程解決方案，旗下廢有機溶劑去除雙氧水本季小量貢獻，也持續拓展機能水設備應用，藉由提供客戶節能 (CO2 及超潔淨水)、習用化學品減量與取代等方案，滿足前段黃光製程延伸至 EUV(極紫外線) 曝光後清洗的需求，協助客戶達到綠色製造與產業升級。


信紘科機能水設備目前已獨家供應給先進封裝客戶，看好 AI 商機進一步推升先進製程、先進封裝需求，帶動業務接單。",2023-06-13 19:13:43,11393,信紘科 (6667-TW) 今 (13) 日舉辦股東會，展望後市，公司指出，綠色製程解決方案有斬獲，預計廢有機溶劑去除雙氧水有機會在本季小量貢獻，且機能水設備也可望隨著先進封裝需求熱絡、推升接單。,信紘科綠色製程業務有斬獲 本季小量貢獻營運,"['信紘科', '廢液回收', '機能水', '設備', '半導體', '先進封裝']",['信紘科'],672b7343-585c-4ee0-985e-078d656c68ac
"英業達 (2356-TW) 今 (13) 日召開股東會，公司積極布局新事業，經營層指出，目前車用布局有不錯進展，今年目標取得車廠認證，預計 2026 年車載營收將達百億元。


英業達表示，今年捷克、墨西哥廠也相繼開始取得相對應的 IATF 16949 認證及量產車用電子產品，主要服務歐洲、北美、日本及中國客戶，產品包含 PCU 系統，客戶涵蓋傳統、新能源車廠。


消費性產品方面，英業達指出，上半年稼動率比較差，往年下半年消費產品出貨比重超過 6 成，預計今年消費產品下半年營收佔全年 60-65%，受惠 NB、電競掌機加持，今年消費品出貨可望較去年個位數成長或持平。


集團產能方面，目前馬來西亞檳城廠、越南河內廠已在本月開始試產，中國南昌、上海將持續縮小產能，英華達目前中國產能 6 成，馬來西亞 3 成、越南 1 成，未來馬來西亞、越南廠將生產數位影音產品、穿戴式、5G、智能終端，遊戲裝置產品。


英業達表示，目標填滿上海、越南等新舊廠產能，下半年越南、上海、馬來西亞產能可望填滿，未來上海將是新產品試量產據點，量產、終端組裝則會移到海外生產，至於印度，公司表示，由於客戶沒有這樣需求，因此印度暫時不會考慮。",2023-06-13 19:16:15,11392,英業達 (2356-TW) 今 (13) 日召開股東會，公司積極布局新事業，經營層指出，目前車用布局有不錯進展，今年目標取得車廠認證，預計 2026 年車載營收將達百億元。,〈英業達股東會〉車載布局增溫 2026年營收衝百億元,"['英業達', '車載', '汽車', '車用電子']",['英業達'],2c21c20e-ee5a-4646-a2d3-e80b1a132ef4
"今日將公佈 5 月 CPI，以及聯準會議開始，後天則公佈是否升息。在這些不確定因素下，美股卻持續上漲，尤其費半大漲 3.3%，帶動台股由台積電 (2330-TW) 領軍再漲近 300 點，遙想曾經幾個月前還在說萬六是否會過，如今都已經攻上萬七關卡，整體行情好的不得了，就是今天台積電佔據漲幅較多，中小型電子股發展上較為收斂。


【IC 設計四君子】創意 (3443-TW)、世芯 (3661-TW) 兩者走向基本一致，先前已經預告過各位，創意世芯雖然是我長線看好的最強股票，只要壓回都是不錯的買點，果然創意壓回 1400 以後兩天強漲回 1560、世芯也再次挑戰 1800 元壓力關卡。


至於聯發科 (2454-TW) 在所有人都看壞的情況下，被我預測 5 月 2 日底部成形 660 必然向上，如今已經漲至 768，完全符合我的預測，但由於聯發科前波下跌前高點就在 780 附近，我認為這邊的壓力是需要時間來突破的，今日最高觸及 782 承壓壓回，表現符合預期。


目前的盤勢漲得過快，所以有跳脫族群看股性上漲的特性，而其中有兩種【股性】的股票在此時率先表現漲幅，那就是承受壓力橫向整理許久的好股票，以及低點依靠題材反轉向上的潛力股。


前者代表除了 IC 設計四君子以外，還有我近期操作的僑威 (3078-TW) 就在 4 月到 5 月橫向整理了一個月左右，直到近期才突破壓力區間積極向上，另一檔建準 (2421-TW) 則是階梯式向上，每到一個區間就整理一小波段，隨後繼續突破，這兩檔股票都成功讓我們達到【30%】以上的獲利！


另一種股性「依靠題材反轉向上」的股票，則有精材 (3374-TW) 與采鈺 (6789-TW) 做為代表。精材第二季應用於光學感測領域之 12 吋特殊加工專案，於此時開始量產，具備轉機性。采鈺則是在近期傳出台積熊本 CIS 後段訂單，因索尼此次產能嚴重不足，罕見委由采鈺承接，此單量能之大前所未見，會為采鈺的營運帶來新的活水，兩者皆給我們帶來【20~25%】獲利。


除了【股性】帶來的題材以外，產業題材我認為 AI 智慧、電動車、低軌衛星與 5G 仍然是中長線主流，這點不會改變。


公準 (3178-TW) 在近幾年切入航太領域，開始量產航太電機致動器零組件相關業務、及專用顯示器零組件，都是低軌衛星所需物件，今年二、三、四、五月營收穩定年增，百元關卡突破以後可能稍有整理，但整理完繼續向上的可能性也不低，屬於低軌衛星首選股。


普誠 (6129-TW) 的車用 LED 驅動及 HUD 驅動 IC，成功打入中國大型車輛用大燈供應鏈，並獲得前裝車廠大單，訂單一路放眼到 2023 年，確保了今年的營運無慮。且公司第一季財報，單季合併營收為 4.31 億元、年成長 24.7％，毛利率為 37.4％也維持高檔，後續表現值得期待。


建碁 (3046-TW) 則是我們電動車投資池 3.0 納入的新持股，專注於開發基礎建設適用的無風扇、寬溫、寬壓等各式工業用控制主機，這同時可以應用在【工業電腦】、【電動車充電站】兩大發展性極高的產業身上，尤其電動車充電站目前各國都積極建置，可以想見後續商機。


最後，光通訊廠華星光 (4979-TW) 的 5G 題材則支持著這些先進科技發展，華星光今年第一季 EPS0.3 元，與去年同期的每股淨損 0.01 元相較，呈現虧轉盈的優勢，也符合我們所說的第二種股性，但是目前已經漲得太多，就不建議投資人隨意追高。


由於字數有限，更多台股產業最全面、最完整的解析，我都會持續在 LINE 當中提及，投資人想免費索取請加 LINE︰@588vip 並留言「我想得到惠珊老師的最新分析」，將會有專人為您服務。


專人諮詢服務｜02-25415555


LINE ID｜
https://lin.ee/cFL6Qcs


FB｜
https://bit.ly/3F3elUD


Youtube｜
https://bit.ly/3mYYyPL


諮詢表單｜
https://forms.gle/hyKztFHKt1Z2FWWn8


本公司所推薦分析之個別有價證券

無不當之財務利益關係 以往之績效不保證未來獲利

投資人應獨立判斷 審慎評估並自負投資風險",2023-06-13 19:20:07,11391,無摘要,公準、普誠、建碁、華星光、精材、采鈺、建準、僑威,"['趨勢分析', '楊惠珊', '永誠投顧', '五福臨門', '台股']","['台積電', '創意', '世芯-KY', '聯發科', '僑威', '建準', '精材', '公準', '普誠', '\ufeff建碁', '華星光', '采鈺']",f11ffa7e-ecc1-43c5-9f5d-6f74eb2dfbd6
"板卡廠華擎 (3515-TW) 近期漲勢凌厲，依照主管機關規定公告自結數，受到傳統淡季影響，5 月稅後純益 5100 萬元，年減 20.3%，每股純益 0.42 元。


華擎 5 月營收 12.61 異元，年減 8.02%；稅前盈餘 8200 萬元，年減 16.48%；稅後純益 5100 萬元，年減 20.3%，每股純益 0.42 元。


總經理許隆倫曾提到，顯卡第三季開始需求有望陸續回溫，此外，去年顯卡因挖礦需求消失、庫存跌價損失，毛利率轉負，儘管去年整體需求量仍無法跟過往相比，在低基期下，毛利率將轉正。


伺服器方面，雖然產品推出時間比預期久，今年上半年比較辛苦，下半年則會好一些，預期整體需求要提升可能要到今年第四季或是明年第一季。",2023-06-13 19:27:06,11390,板卡廠華擎 (3515-TW) 近期漲勢凌厲，依照主管機關規定公告自結數，受到傳統淡季影響，5 月稅後純益 5100 萬元，年減 20.3%，每股純益 0.42 元。,華擎5月稅後純益年減逾2成 每股賺0.42元,"['華擎', '板卡', '顯卡']",['華擎'],d6a68e4c-0655-4de7-b3ba-8c15060057f2
"晶圓廠聯電 (2303-TW)(UMC-US) 今 (13) 日公告，近三個交易日處分京元電(2449-TW)5428 張持股，每股平均交易價格 56.4 元，交易總金額 3.06 億元，處分利益 4290 萬元。


聯電表示，此次處分京元電主因為理財計劃，預計處分完之後，仍持有近 1773 萬股，持股比 1.45%。


京元電近期股價連日上漲，甚至超越疫情間的高點，今日最高衝上 58.2 元，改寫 22 年新高，更逼近上市時的歷史高點 61 元，三大法人方面，外資今日逢高調節 5351 張、自營商也小賣 63 張，投信則持續加碼 6381 張。",2023-06-13 19:29:43,11389,晶圓廠聯電 (2303-TW)(UMC-US) 今 (13) 日公告，近三個交易日處分京元電(2449-TW)5428 張持股，每股平均交易價格 56.4 元，交易總金額 3.06 億元，處分利益 4290 萬元。,聯電處分京元電5428張 處分利益4290萬元,"['聯電', '京元電', '處分', '持股', '處分利益', '獲利']","['聯電', '京元電子', '聯電']",0716393f-7b2e-485e-a161-b3ca695765c2
