content,publish_at,id,summary,title,keywords,related_stocks,uuid
"中鋼 (2002-TW) 集團旗下中宇 (1535-TW) 表示，第一季已承攬未完工的在建工程金額 146.1 億元，隨著中鋼大力推動再生水，公司也結合集團研發量能，持續擴大發展相關工程及技術。


中宇說明，在建工程主要是已承攬未完工金額，且未含以實作實算認列的代營運及操作維護工案，以第一季在建工程比重來看，機電工程 63%、綠能及環保工程 24%、耐火材料工程 12%、生技工程 1%。


展望後續，中宇表示，除了中鋼的鋼化聯產、碳捕集工程外，也擴展儲能結合微電腦系統工程、太陽能 (PV) 設置工程，拓展節能減碳銷售業務；同時，發展再生水工程，並結合集團研發量能、精進空污水務技術。


中宇第一季營收 26.04 億元，年增 30%、毛利率 9%，持平去年同期、營業利益 1.09 億元，年增 93%、營益率 4%、年增 1 個百分點，稅後純益 1.19 億元，年增 4%，每股純益 0.97 元。


以中宇首季營收占比來看，機電工程 37%、代營運及操作維護 28%、綠能及環保工程 18%、耐火材料工程 14%、其他 2%、在建工程 1%。",2024-05-26 11:30:05,19751,中宇首季在建工程 146 億元 擴大發展再生水工程,中宇首季在建工程146億元 擴大發展再生水工程,"['中鋼', '中宇', '再生水']","['中鋼', '中宇']",0720486d-d264-4905-83ff-05c56998f5e3
"共軍舉行環台軍演，美國國務院兩度表達關切，總統拜登周六（25 日）也重申堅定維護台海和平穩定的立場。


拜登周六在西點軍校畢業典禮致詞時表示：「為了保護我們的國家、我們的盟友、我們的核心利益，我始終願意在必要時使用武力。」


美國是否會出兵馳援台灣，是拜登出任總統以來外界最關注的外交議題之一。他在 2022 年接受美媒專訪時說，若解放軍犯台，美軍將出手協助捍衛台灣。周六至少是拜登上任以來第四次公開表態。


總統賴清德宣誓就職後，北京文攻武嚇不斷，本周共軍東部戰區更在台灣周邊展開「聯合利劍 - 2024A」軍演。


在提及烏克蘭戰爭，拜登指出，美軍正在支持烏克蘭為自由而戰，但不是在烏克蘭當地，而是讓彈藥和裝備能夠進入烏克蘭。


拜登說：「沒有美國士兵在烏克蘭參戰，我決心保持這種狀態。」


他並表示，我方堅定與烏克蘭站在一起，將繼續努力訓練烏克蘭士兵如何使用先進武器系統，並向烏克蘭醫務人員傳授護理等經驗。",2024-05-26 15:03:49,19750,共軍舉行環台軍演，美國國務院兩度表達關切，總統拜登周六（25 日）也重申堅定維護台海和平穩定的立場。,共軍舉行環台軍演 拜登發話了：堅定維護台海和平 願使用武力保護盟友,"['拜登', '台灣', '武力']",[],665efebf-1931-4929-98bf-c879dda3090b
