title,keywords,content,publish_at,id,summary,related_stocks,uuid
〈台幣〉連4貶收32.352元 貶值9.4分 創近1個月最大貶幅,"['美元', '台幣', '匯率', '美債', '聯準會', '升息']","由於美國聯準會再度釋出偏鷹訊息，美債殖利率反彈，新台幣今 (10) 日收在 32.352 元，貶值 9.4 分，貶幅 0.29%，不僅連 4 貶，貶幅也創近 1 個月新高。


非美貨幣齊轉弱，而中央銀行總裁楊金龍最新表態，新台幣下檔沒有「楊金龍防線」，而是會觀察其他貨幣走勢；法人認為，若匯市偏弱，不排除短期仍會使股市承受一定程度的壓力。


新台幣今日以 32.28 元開出，終場收在 32.352 元，貶值 9.4 分，台北外匯經紀公司成交值 8.09 億美元，全日高低價差 9.8 分，最低見 32.378 元。


而主要亞幣多數走弱，泰銖和馬來幣貶 0.3% 上下，韓元貶逾 0.2%，人民幣和日圓也處在小貶態勢，港幣和新幣橫盤整理。


元大投顧指出，聯準會主席鮑爾在 11 月 9 日的 IMF 上發表談話，主要傳達三點訊息，包括 (1) 聯準會沒有信心現在的緊縮足夠讓通膨回到 2%，(2) 若需要，聯準會將毫不猶豫升息，(3) 殖利率急速拉升不能忽視，在意此現象是否持續。


亦即，聯準會將令金融狀況維持在「有點緊又不會太緊」的狀態，只是有條件的暫停升息，保留進一步升息的可能性，後續影響全球匯市動態。",2023-11-10 17:35:15,16728,新台幣連 4 貶收 32.352 元 貶值 9.4 分 創近 1 個月最大貶幅,[],4f11155d-f988-4d50-823f-1c855046de02
偉訓接單暢旺 明年營收估雙位數成長 衝百億元新高,"['偉訓', '富驊', '電源', '機殼']","電源及機殼廠偉訓 (3032-TW) 表示，明年受惠電競機箱、電源以及雲端機櫃都有拿下大單，加上自有品牌市佔率提升、子公司富驊同步成長，法人看好，明年集團營收將有雙位數成長、突破百億元，毛利率則可持穩 20% 以上。


偉訓第三季稅後純益 1.81 億元，年增 81%，每股純益 1.62 元，創同期新高；前三季稅後純益 5.85 億元、每股純益 4.22 元，也是同期最佳，更賺贏去年一整年；公司看好，第四季營運可望向上，來到今年次高。偉訓前 10 月營收 67.93 億元，年增 28.8%。


展望明年，偉訓表示，機箱除了拿到全球桌上型電腦銷量重量級客戶中高階電競機種的機箱訂單外，明年歐美客戶雲端機櫃出貨也將顯著增長，且因機櫃毛利率較佳，有助提升獲利表現。


電源產品方面，偉訓表示，今年電源事業營收估成長 2 倍，明年則有國內電腦品牌的電競電源代工大單，主要供應小尺寸、大瓦數與低噪音產品，預計明年電競電源業績將有雙位數的增幅。


此外，偉訓自有電競品牌 COUGAR 目前市佔率也穩定攀升，明年也將推出新款電競椅、電競機箱產品，公司看好，在 COUGAR 創新能力及消費者品牌認同度不斷增強的情況下，自有品牌明年也會有雙位數成長。


此外，偉訓子公司富驊 (5465-TW) 也打進中國電動車龍頭，供應電池包外殼，以及供應陸系大廠充電樁的電源，將帶動富驊營運表現。以偉訓集團營收比重來看，目前伺服器約 3 成、電競自有品牌 2 成、電競代工 5 成 (電源 3 成、機箱 / 機殼 2 成)。",2023-11-10 17:37:25,16727,電源廠偉訓 (3032-TW) 表示，第四季營收估將季增，明年則受惠電競機箱、電源以及雲端機櫃都有拿下大單，加上自有品牌市佔率提升、子公司富驊同步成長下，法人看好，明年集團營收將有雙位數成長、突破百億元，毛利率則可持穩 20%,"['偉訓', '富驊']",2b369496-87c0-4336-91d5-0861628fe83e
開發金控ESG綠色影響力論壇 共創永續新未來,"['ESG共同推動', '趨勢分析', '開發金']","開發金控今 (10) 日舉辦「ESG 綠色影響力論壇」，以「贏戰全球永續力 企業轉型創新局」為主題，關注在氣候變遷風險下，企業如何實踐綠色轉型，打造永續及創新兼具之營運模式，進而打造世界級競爭力。


開發金控「ESG 綠色影響力論壇」，邀請行政院副院長鄭文燦致詞，並邀請向陽集團董事長陳貴光、安侯永續發展顧問公司執行副總經理林泉興、台達能源股份有限公司總經理張立業，以及凱基投信總經理張慈恩分享如何前瞻未來，加速淨零轉型，打造更具韌性的永續環境。


行政院副院長鄭文燦致詞時表示，ESG、淨零轉型已經是全球的共識，更是跨國界、產業、世代的工程。淨零減碳既是挑戰也是契機，將帶動國家韌性永續、產業前瞻創新，進一步發展龐大的綠能產業；透過綠色金融，促成資金投資及產業創新追求綠色及永續發展，帶動投資與融資的永續良性循環，未來綠色商品可望有更多樣化的發展。


開發金控總經理龐德明致詞時指出，開發金控致力推動綠色金融發展，積極參與綠色投融資，為實現永續發展做出貢獻。淨零永續成為企業厚植競爭力的重要關鍵，開發金控持續以 ABCDE 五大策略，透過壽險、商銀、證券、創投／私募股權四引擎齊力並進，協助客戶達成永續轉型的目標。


為積極發揮金融影響力，開發金控運用「IMPACT–影響力策略」，分別以綠色投資 (Green Investment; I)、風險管理 (Risk Management; M) 、綠色金融產品 (Green Financial Products; P)、異業結盟 (Green Cross-industry Alliance; A)、永續相關籌資輔導 (Sustainability-related Fundraising Consultancy; C)、綠色轉型 (Green Transition; T) 等面向，攜手子公司實踐綠色金融。2022 年開發金控自有資產投資在六大核心戰略產業金額達 1,231 億元，其中六成投資於綠電及再生能源領域。


龐德明進一步指出，開發金控長期參與台灣能源產業重要發展，近年更參與多項大型綠色專案融資，支持客戶對能源產業的前瞻性投入，推動台灣能源轉型。未來，開發金將持續作為產業綠色轉型的推手，支持佈局基礎建設，協助企業邁向永續願景。",2023-11-10 17:37:46,16726,開發金控今 (10) 日舉辦「ESG 綠色影響力論壇」，以「贏戰全球永續力 企業轉型創新局」為主題，關注在氣候變遷風險下，企業如何實踐綠色轉型，打造永續及創新兼具之營運模式，進而打造世界級競爭力。,[],d0f8a83d-21c9-4710-95fc-280ef63543e9
〈英業達法說〉樂觀看明年 AI伺服器營收可望倍數成長,"['英業達', 'AI伺服器', 'ODM', 'PC']","英業達 (2356-TW) 今 (10) 日召開第三季法說會，展望明年，總經理蔡枝安表示，雖然第四季營收可能下滑，但明年第一季開始景氣回溫，預期全年表現將優於今年，且 AI 伺服器營收有機會倍數成長。 


蔡枝安指出，今年 AI 伺服器佔整體伺服器 5-7%，基期相對低，預期明年將倍數成長。其中北美 CSP 客戶出貨仍以 L6 主機板為主，未來有機會往 L10、L11 整機系統組裝發展，不過還在洽談中。


蔡枝安補充，英業達在 AI 領域上不會缺席，且採 ODM 代工模式，很多產品與業務都有參與。 


英業達表示，第四季無論 NB、伺服器及營收都呈現下滑，不過明年第一季景氣復甦，預期營收將季增，NB 將有個位數成長，伺服器則可能成長一成，且 2024 年全年將優於 2023 年，甚至超越 2022 年。 


美國先前擴大晶片銷往中國禁令，對於公司 AI 伺服器以及 CSP 出貨的影響，蔡枝安說，對第四季營收有影響但不大，占整體伺服器不到 5%。未來將遵循美國政府要求，並持續與客戶洽談合作。 


英業達第三季產品組合 PC 相關佔整體 51-55%，伺服器佔 41-45%，智能裝置相關則佔 6-10%。",2023-11-10 17:42:01,16725,英業達 (2356-TW) 今 (10) 日召開第三季法說會，展望明年，總經理蔡枝安表示，雖第四季營收可能下滑，但明年第一季開始景氣回溫，預期 2024 年全年表現將優於 2023 年，且 AI 伺服器有機會倍數成長。 ,['英業達'],a7ac2c4b-c5d0-4f41-90ed-84cc6ab7147e
國泰金前10月賺652億元年增14% 國泰世華銀獲利創高,"['國泰金', '自結', '獲利', '國泰人壽', '國泰世華銀行']","國泰金 (2882-TW) 今 (10) 日發布 10 月自結獲利，稅後純益 58.2 億元，累計前 10 月稅後純益 652.2 億元，年增 14%，國泰金表示，今年以來各子公司核心業務動能穩健，其中，國泰世華銀行前 10 月稅後純益已超越去年全年，且創歷史新高，國泰投信前 10 月稅後純益也創同期新高紀錄。


國泰金表示，國泰人壽獲利維持穩健，10 月稅後純益 30.2 億元，累計稅後純益 333.6 億元，主要反映資本利得、經常性收益及匯兌利益挹注。今年以來金融市場波動仍存，但公司投資操作平穩，保險本業營運穩健，整體財務表現仍維持良好。10 月初年度保費及初年度等價保費分別為 135 億元及 39 億元。


保險業務方面，國泰人壽 10 月初年度保費收入月增 150%、年增 48%，初年度保費收入穩居業界第一。受惠澳幣國際債投資型商品熱銷，帶動投資型商品銷售動能提升，初年度保費收入月增 414%、年增 78%。


國泰世華銀行 10 月稅後純益 24.2 億元，累計稅後純益 278.4 億元，年增 19%；其中，累計淨利息收入穩健成長，主因今年以來放款成長動能穩健，把握利率高檔，持續佈建外幣有價證券；


國泰世華銀行累計淨手續費收入持續成長，受惠於信用卡累積消費金額與財富管理收益增加。國泰金指出，主力信用卡產品 CUBE 卡新戶增加，累計流通卡數逾 500 萬張，動卡率亦表現良好。截至 10 月底逾放比率為 0.1%，備抵呆帳覆蓋率為 1618%，資產品質維持穩健。


國泰產險 10 月稅後純益 2.5 億元，累計前 10 月稅後純益 12.1 億元。國泰金表示，持續秉持質量並重及保戶價值導向雙核心經營理念，擴大業務基盤，10 月份簽單保費 27 億元，累計簽單保費達 266.2 億元，年增 15%，持續雙位數成長。


國泰證券 10 月稅後純益 1.3 億元，累計前 10 月稅後純益 17.1 億元，年增 42%。受惠於今年以來國內外股市交易活絡，零售投資人積極參與市場，國泰證券透過數位經營模式維持成長。累計前 10 月台股經紀市佔率創同期新高達 3.95%；深受投資人喜愛的台股定期定額業務，累計扣款金額年成長超過 6 成，累計扣款人數成長也超過 3 成。",2023-11-10 17:42:24,16724,國泰金 (2882-TW) 今 (10) 日發布 10 月自結獲利，稅後純益 58.2 億元，累計前 10 月稅後純益 652.2 億元，年增 14%，國泰金表示，今年以來各子公司核心業務動能穩健，其中，國泰世華銀行前,['國泰金'],ba0d737f-2a36-473f-a2fb-f56355997921
欣陸投控前三季純益年減52% 每股純益1.54元,"['欣陸', '營收', 'EPS']","欣陸投控 (3703-TW) 今 (10) 日公布最新財報，第三季稅後純益 4.74 億元，季減 17.73%，年增 1.85%，每股純益 0.57 元；前三季稅後純益 12.64 億元，年減 52.21%，每股純益 1.54 元。


欣陸投控第三季營收 77.94 億元，毛利率 13.28%，季減 2.02 個百分點，與去年同期相同，稅後純益 4.74 億元，季減 17.73%，年增 1.85%，每股純益 0.57 元。


欣陸投控前三季營收 225.63 億元，毛利率 13.85%，年減 3.09 個百分點，前三季稅後純益 12.64 億元，年減 52.21%，每股純益 1.54 元。


欣陸投控指出，前三季合併營收較去年同期減少 7.8%，主要因今年不動產開發事業（大陸建設）建案完工交屋金額較去年同期減少，抵銷營建工程事業（大陸工程）受惠於公共工程專案貢獻，毛利率較去年同期下滑，主要是去年同期不動產開發事業營收比重較高。


欣陸投控指出，截至第三季底，營建工程事業的工程存量為 735 億元，相當於該事業體 2022 年合併營收的 3.8 倍；不動產開發事業的營收存量為 125 億元，相當於該事業體 2022 年合併營收的 1.3 倍；環境工程及水資源處理事業的在手合約餘額為 692 億元，相當於該事業體 2022 年合併營收的 14.7 倍。",2023-11-10 17:44:35,16723,欣陸投控今 (10) 日公布最新財報，2023 年第三季稅後純益 4.74 億元，季減 17.73%，年增 1.85%，每股純益 0.57 元；2023 年前三季稅後純益 12.64 億元，年減 52.21%，每股純益 1.54 元。,['欣陸'],2d1a5f49-61bc-44b5-a870-2b743c663112
〈廣達法說〉Q3純益季增26% 前三季每股賺7.63元,"['廣達', 'AI伺服器', 'PC']","廣達 (2382-TW) 今 (10) 日召開第三季法說會，AI 伺服器熱度不減，帶動單季稅後純益達 128 億，季增 26.4%，年增 38.3%，每股純益 3.32 元。前三季純益 293.98 億元，年增 47%，每股純益 7.63 元。 


廣達第三季營收 2865.05 億元，季增 16.9%，年減 25%。毛利率 8.1%，季減 0.4 個百分點，年增 2.5 個百分點。營益率 4.4%，季減 0.2 個百分點，年增 1.7 個百分點。稅後純益 128 億，季增 26.4%，年增 38.3%，每股純益 3.32 元。 


廣達前三季營收 7977.15 億，年減 16%，毛利率 7.7%，年增 2.5 個百分點，營益率 4%，年增 2 個百分點。稅後純益 293.98 億元，年增 47%，每股純益 7.63 元。 


展望第四季及明年，法人認為，第四季 AI 伺服器出貨持續升溫，營運將優於第三季。明年 PC 市況有望逐步復甦，加上 AI 伺服器助攻，樂觀看明年。",2023-11-10 17:51:35,16722,廣達 (2382-TW) 今 (10) 日召開第三季法說會，AI 伺服器熱度不減，單季稅後純益 128 億，季增 26.4%，年增 38.3%，每股純益 3.32 元。前三季純益 293.98 億元，年增 47%，每股純益 7.63 元。 ,['廣達'],ad54fef7-8013-4ebc-b405-f229bd17c66b
漢來美食前三季獲利暴增逾5倍 賺贏過去2年總和,"['漢來美食', '飯店', '自助餐', '餐飲', '獲利創高']","連鎖餐飲集團漢來美食 (1268-TW) 公告第三季財報，單季稅後純益 8469 萬元，每股純益 (EPS)2.01 元，累計前三季稅後純益 2.87 億元，年增 576.7%，EPS 6.8 元，一舉超過 2021-2022 年二年的獲利總和，法人預期，漢來美食全年獲利有望挑戰新高。


漢來美食第三季合併營收 12 億元，季增 7.74%，年增 15.43%，僅次於第一季，創歷史次高，主要是因海港自助餐和宴會廳需求強勁彈升，挹注營業利益達 8492 萬元，年增 41.77%，稅後純益 0.85 億元，年減 16.96%，則是因業外的其他收入相較去年同期少，實際上餐飲本業表現熱絡，EPS 達 2.01 元。


而漢來美食前三季合併營收 36.09 億元，年增 38.09%，毛利率達 44.97% 創新高，營益率 9.14% 則創歷史次高，稅後純益 2.87 億元，年增 576.7%，EPS 6.8 元，營收、獲利均創同期新高。


漢來美食也公告 10 月合併營收 4.03 億元，月減 1.83%，年增 14.08%，累計前 10 月合併營收 40.12 億元，年增 35.23%，已超越去年全年。


漢來美食指出，旗下海港自助餐升級版品牌「島語」和高端中菜「東方樓」於 10 月新開出後，開始挹注營收；目前各品牌全面開放除夕訂位訂餐，島語除夕兩輪在開放訂位 1 小時內滿位。


展望後市，漢來美食將再開出高價鍋物和牛排館兩個新品牌餐廳，坐落於台北漢來大飯店內，除了持續擴大集團在北台灣多品牌美食服務內容，營運規模正不斷擴大，成長動能無虞。


另一方面，漢來美食開始深入街邊布局，「溜溜酸菜魚專賣店」位在高雄裕誠商圈的首家街邊店，正緊鑼密鼓裝潢中，預計 11 月下旬開幕。",2023-11-10 17:52:04,16721,漢來美食前三季獲利暴增逾 5 倍 賺贏過去 2 年總和,['漢來美食'],46d686a3-5a43-4a1f-970b-f467687b0865
鮑爾放鷹不改第四季上漲趨勢，AI股震盪把握切入機會，金像電高出後持續買進AI概念股,"['趨勢分析', '亨達投顧', '陳智霖', '趨勢分析', '飽爾', 'AI', '金像電', '台積電', '低軌衛星', 'CoWoS', '鴻海', '及AI伺服器']","先祝福大家週末愉快，臺北股市今天震盪小跌 62 點，成交量為 2302 億元，下跌主因是 FED 主席鮑爾放鷹，但是仍然不會改變第四季有利上漲的條件，成交量來看，大家仍然非常沒有信心，因此在操作節奏及個股選擇上建議投資人要透過專業協助，這段上漲很多人不敢買，今天大盤震盪依舊不敢進場，第四季看好的原因老師不再特別重複，前面的文章或影音都已經詳細的說明。


臺股第四季看好的理由，就是如同看好台積電 (2330-TW) 的邏輯，今天臺股即便震盪，台積電仍收在最高點，不要忘記老師告訴你的 1 月份台積電特別會漲，收盤後台積電公告十月營收創下歷史新高，台積電也是最純的 AI 概念股，請投資朋友們要把智霖老師星期四的直撥看過一遍，更多的細節請下載 APP，智霖老師在 APP 獨家廣播都有分享。


〈下載陳智霖分析師 APP 獲得更即時資訊 ，完成註冊獎勵金最高 6000 元 〉


陳智霖老師的直播節目及 APP 的獨家廣播都會針對國際總經還有重要財經事件即時追蹤分析，同時提供產業趨勢方向，只要 APP 完成註冊驗證者都可獲得獎勵金 (最高回饋 6000 元)，邀請您可以立即點選下方連結免費下載陳智霖分析師 App，下載連結: 
https://hantec.liveinapp.com/jhih-lin-app-link


今天不少老師預告的股票都下跌，成交量縮小 2300 億，行情是走輪動，此時的操作你必須要具備耐心，儘量保留產業前景有機會的股票，盤中依照數據適度地做一些進出的操作，舉例來講，昨天直播預告週三會員出手 AI 概念股，其中一檔金像電 (2368-TW) 會員在 206 元買進的穿價證據如圖片，今天最高來到 231.5 元，早盤在上漲時，我們已經請會員朋友獲利了結，資金買進下一檔 AI 概念股。






智霖老師在 9 月份就跟大家預告第四季的重點跟多頭關鍵是 AI 概念股，現在我們按照計畫去做操作，許多 AI 概念股有籌碼面的問題，所以在挑選個股上，建議投資人一定要跟上老師專業的操作選擇，低軌衛星跟 CoWoS 今天雖然下跌但並不會改變產業的趨勢，鴻海 (2317-TW) 珍珠號衛星延後發射，股價今天算是一個失望性賣壓，但韓國跟日本都要持續的發射衛星，臺灣難道會缺席嗎? 從台積電營收創歷史新高，以及 AI 伺服器推升 CoWos 建置明年產量將翻倍，相關的股票邀請你可以跟著智霖老師的盤中依據節奏來操作。


最新影音 (請點影音上方標題至 Youtube 收視品質會更佳)




 


才剛剛接觸陳智霖分析師的新朋友，建議您現在立即點選紫色圖片下載安裝陳智霖分析師 APP，老師有提供 APP 新註冊用戶免費體驗午報導航及互動教學會員影音的活動，歡迎您透過體驗來了解陳智霖老師如何選股以及盤中的會員服務，午報導航體驗都是限時限額開放，千萬不要浪費了您可以免費體驗的權益喔。


點擊紫色圖免費下載註冊
〈
陳智霖分析師
 APP
〉
獎勵金回饋立即領




錢進熱線 02-2653-8299, 立即邁向系統依據的股票操作。


文章來源：陳智霖分析師 / 亨達投顧


本公司所推薦分析之個別有價證券

無不當之財務利益關係 以往之績效不保證未來獲利

投資人應獨立判斷 審慎評估並自負投資風險",2023-11-10 18:10:03,16720,無摘要,"['台積電', '金像電', '鴻海']",88a04fe6-992d-4d4e-81e5-40b3592afe94
電信三雄10月營收雙增 中華電坐穩獲利王 累計EPS 4.1元,"['中華電', '台灣大', '遠傳', '電信']","電信三雄今 (10) 日公布自結數，在 iPhone 15 新機銷售挹注下，三家電信商 10 月營收均呈現雙增；獲利方面，中華電 (2412-TW) 坐穩獲利王寶座，10 月每股純益 0.4 元，贏過台灣大 (3045-TW) 的 0.31 元、遠傳 (4904-TW)0.29 元；中華電前 10 月每股賺 4.1 元，同樣超過台灣大 3.39 元、遠傳 2.86 元。


中華電


10 月營收 194.4 億元，月增 5.1%、年增 1.1%；EBITDA 71.9 億元，月增 4.8%、年增 1.7%；稅後純益 31.1 億元，月增 8.7%、年增 7.8%，每股純益 0.4 元。


前 10 月營收 1807.8 億元，年增 2.4%；EBITDA 728.2 億元，年增 0.5%；稅後純益 317.7 億元，年增 2.6%，每股純益 4.1 元。


中華電信表示，累計至 10 月底，整體營收與財務績效穩健走揚，超越預期。個人家庭事業群營收持續向上，企客事業群穩定發展，國際事業群營收維持年增率雙位數。


10 月整體行動業務持續勁揚，在行動服務品質不斷推升 5G 用戶數與整體 090 門號數、行動數據受惠國際漫遊帶動營收成長，推升整體行動服務營收年增 6.3%，連續 31 個月成長；行動月租型 ARPU(每用戶平均收入) 年增 4.9%，也連續 31 個月上揚，行動月租型離網率則年減 23.2%，持續保持電信業最低。


另外，固網寬頻營收因升速促銷方案廣受歡迎而持續向上，寬頻接取營收年增 3.2%，數據網路營收年增 1.1%，其中 Wi-Fi 營收年增率近 50%，表現強勁。iPhone 15 系列銷售暢旺帶動銷貨收入增加。ICT 整合專標案因平台建置專案入帳，營收達雙位數成長。


遠傳


受惠 iPhone 15 新機銷售強勁帶動客戶升級 5G、新經濟營收貢獻和漫遊業務持續增溫等因素，10 月、前 10 月營收雙成長。10 月合併營收 89.23 億元，月增 4%、年增 7.9%；EBITDA 26.59 億元，月減 2.4%、年增 3.3%；稅後純益 9.59 億元，月增 1.8%、年增 17%，每股純益 0.29 元，年增 17%，維持強勁雙位數增長。

 

累計前 10 月營收 761.47 億元，年增 4.2%；EBITDA 265.93 億元，年增 4.4%；稅後純益 93.07 億元，年增 18.1%；每股純益 2.86 元，年增率達 18.1%。


遠傳致力運用資通訊核心技術打造綠色新經濟，協助公私部門創新轉型，共同邁向「2050 淨零排放」目標，推出交通號誌不斷電系統 UPS)，有效再利用 Gogoro、光陽電動機車電池作為路口號誌電力備援，除了已導入台北市共 187 處重要路口，也開始在高雄市進行試行。


台灣大


10 月營收 148.2 億元，月增 3.3%、年增 3.3%；EBITDA 28.3 億元，與前一月相當、年增 4.3%；稅後純益 8.7 億元，月減 1.1%、年增 5.3%，每股純益 0.31 元。


累計前 10 月營收 1445.7 億元，年增 6.3%；EBITDA 291.7 億元，年增 2.7%；稅後純益 95.5 億元，年增 2%，每股純益 3.39 元。


台灣大說明，iPhone 15 系列開賣以來成果斐然，選搭月租 1399 元以上高資費者占比較前一代提升，加上台灣大哥大獨門方案助攻，有效推動用戶升轉 5G，並在漫遊與遊戲相關收入加持下，10 月行動服務營收創 2019 年 1 月後單月新高，年成長率 7.7%，其中智慧型手機月租 ARPU 年成長 5.8%，達 724 元，為近四年新高、月租用戶月退租率維持低檔，僅 0.7%。行動業務大幅推升整體電信服務營收，年增率逾 7%，帶動 10 月份電信營業利益較去年同期成長 10%。",2023-11-10 18:24:56,16719,電信三雄今 (10) 日公布自結數，在 iPhone 15 新機銷售挹注下，三家電信商 10 月營收均呈現雙增；獲利方面，中華電 (2412-TW) 坐穩獲利王寶座，10 月每股純益 0.4 元，贏過台灣大 (3045-TW) 的 0.31 元。,"['中華電', '台灣大', '遠傳']",81abdfa8-aaca-4d5f-9b92-c9ce681ee4b9
良得電Q3純益季增3倍 前三季EPS 1.76元賺贏去年整年,"['良得電', '財報', '電動車']","電源線廠良得電 (2462-TW) 今 (10) 日公告第三季財報，稅後純益 1.71 億元，季增 357%、年增 126%，每股純益 1.17 元，超越上半年、創 12 年單季新高；前三季稅後純益 2.54 億元，年增 156%，每股純益 1.76 元，賺贏去年整年。


良得電第三季營收 10.8 億元，季增 22.9%、年減 9.1%；毛利率 19.6%，季增 6 個百分點、年增 9.9 個百分點；營益率 9.7%、季增 6.4 個百分點、年增 8.7 個百分點。


累計良得電前三季營收 28.73 億元，年減 21%、毛利率 16.3%，年增 9.4 個百分點、營益率 6.3%，較去年同期由負轉正。公司說明，受惠優化客戶及產品結構效益顯現，毛利率大幅改善，推升獲利表現顯著成長。


良得電認為，第四季營收及毛利率可望持穩第三季的水準，其中，歐系三大車廠的電動車旅充開發案持續量產，預估需求將提升 1 倍；日本電動車款新案也已經量產，產能持續開出。


展望明年，公司看好，在電動車、低軌衛星、遊戲機、伺服器等高單價、高毛利的利基型客戶及新應用持續發酵下，營收動能續強，毛利率可望站穩 20%，獲利也將進一步向上。",2023-11-10 18:25:37,16718,良得電 Q3 純益季增 3 倍 前三季 EPS1.76 元賺贏去年整年,['良得電'],6644348f-7a28-41d4-9417-0415ae797298
