title,keywords,content,publish_at,id,summary,related_stocks,uuid
反駁台灣綠電發展牛步 經部：截至7月底光電累計併網量翻倍增長,"['綠電', '離岸風電', '太陽能', '經濟部']","針對媒體報導，批評台灣綠電落後、未來燃氣存量不足一事，經濟部今 (3) 日表示，綠電用電占比與經濟成長、半導體投資推升用電成長有關，加上疫情影響光、風電建設工程，統計到今 (2023) 年 7 月底，光電累計併網量已較 2016 年底增加 7.9 倍。


媒體引述審計部報告，指稱台灣綠電落後、未來燃氣儲存量不足，批評台灣的綠電發展緩慢且燃氣存量不足，批評台灣綠電發展進度落後；對此經濟部今 (3) 日發布新聞稿澄清，反駁媒體的批評。


經濟部指出，綠電占比 20% 的目標預估將在 2026 年 10 月完成，但影響綠電占主要三大因素。首先是總用電量 (分母) 變大，導致原規劃占比變動，其中 2008 年至 2016 年的經濟成長率為 2.9%，2016 年至 2022 年則是 3.4%，經濟成長加上半導體投資帶動用電成長較高所致。


第二、離岸風電風場合約原就容許隔年併網、加上發電旺季秋冬，因此年度電量計算會反映在隔年。


第三、光電、風電建設都深受疫情影響，包括施工人員的出入境及相應防疫安排，或是國際施工船、材料等等的短缺及運送困難，但經濟部強調，即使比例變動，台電在總體電力調度以燃氣優先，仍可確保供電無虞。


經濟部說明，以光電為例，去 (2022) 年雖受疫情與缺工因素影響，單年併網量仍達 2.02GW，其中光電裝置量 2.52GW 創年度設置歷史新高，截至 2023 年 7 月底，累積併網量已達 11.11GW，相較於 2016 年底之併網量 1.245GW，已大幅增加約 7.9 倍。


另外，台電針對太陽光電併網熱區已推動 40 餘項電力網加強工程，透過先期併網點、屋外模組化變電所協助熱區併網，預計 2024 年底可再增加 6.35GW 饋線容量，足以供應未來光電併網容量。


至於漁電共生的模式，經濟部指出，初期推動因利害關係人複雜、案場設計需兼顧養殖需求，需審慎規劃，現已建立推動經驗與模式，將持續跨部會加速行政程序，並與地方政府合作推動。


根據統計，目前已併網 0.5GW，施工中 0.45GW，行政程序中 1.58GW，尚有 15,072 公頃專區潛量約 3.6GW，可達漁電共生 2025 年設置目標 4.4GW。


另外，離岸風電則是受疫情影響，導致全球工程進度延遲，考量台灣海峽是良好風場，連帶也限縮每年施工期間僅 6-7 個月，因此契約給予 1 年緩衝期間。截至 2023 年 7 月已完成 232 座共 1.8GW 容量。


在天然氣安全儲槽容積天數部分，經濟部已定期召開專案會議，監管進度及目標，遭遇困難進行跨部會協商，督促中油公司積極推動新 (擴) 建接收站與儲槽計畫，目前中油公司仍有進行中的增建儲槽計畫，包括觀塘接收站與台中接收站各 2 個儲槽將至 2027 年將陸續完成，每增加一儲槽可再增加一天的儲槽容量，故加計至 2027 年完成增建的四座儲槽，將可達到所規範之 24 天。",2023-08-03 19:49:06,13350,媒體批評台灣綠電落後、未來燃氣存量不足一事，經濟部今 (3) 日表示，綠電用電占比與經濟成長、半導體投資推升用電成長有關，加上疫情影響光、風電建設工程，統計到今年 7 月底，光電累計併網量已較 2016 年底增加近 8 倍。,[],d9016179-9582-4e52-8363-329af07cb571
〈達方法說〉Q2季增近6成EPS 0.82元 上半年每股賺1.33元,"['達方', '鍵盤', 'MLCC']","達方 (8163-TW) 今 (3) 日公告第二季財報，稅後純益 2.28 億元，季增近 6 成，年減 20.3%，每股純益 0.82 元；上半年稅後純益 3.71 億元，年減 30.6%，每股純益 1.33 元。


達方第二季營收 68.88 億元，季增 14.8%、年減 11.2%；毛利率 5.1%，季減 0.1 個百分點、年減 0.9 個百分點；營益率 4.6%，季增 0.9 個百分點、年減 0.2 個百分點。


累計達方上半年營收 128.89 億元，年減 15%、毛利率 5.2%，年減 0.3 個百分點、營益率 4.2%，年減 0.2 個百分點。


達方說明，第二季營收入因鍵盤為主的 IT 需求反彈而增加，鍵盤產品營收季成長逾 15%，加上保持健康的產品組合，使毛利率趨勢持續上升。


上半年產品營收比重來看，IT 周邊產品 42%、電動輔助自行車 (eBike) 發展主軸的綠能事業為 47%，MLCC 等整合元件暨材料 11%。",2023-08-03 21:08:55,13349,達方 (8163-TW) 今 (3) 日公告第二季財報，稅後純益 2.28 億元，季增近 6 成，年減 20.3%，每股純益 0.82 元；上半年稅後純益 3.71 億元，年減 30.6%，每股純益 1.33 元。,['達方'],f46b12b5-e4d0-41c4-86f9-4225dbdddf23
〈達方法說〉下半年估優於上半年 IT產品切非鍵盤應用成新動能,"['達方', '鍵盤', '指紋辨識', '觸控', 'E-Bike']","達方 (8163-TW) 今 (3) 日召開法說，董事長蘇開建表示，下半年綠能動能依舊較弱，但受惠筆電市況持續好轉，將帶動鍵盤產品同步升溫，整體營運優於上半年、毛利率也會提升。


蘇開建表示，IT 週邊產品庫存去化已至健康水位，整體需求轉佳外，也切入非鍵盤的產品線，像指紋辨識模組切進美系大客戶，今年第二、三季開始出貨，另外還有觸控模組，預計下半年到明年陸續發酵。


蘇開建進一步指出，指紋辨識及觸控模組等今年會有 2-3 成著成長，預計明年也可望維持同樣幅度，將帶動整體 IT 產品業績向上，且毛利率較佳，也有助獲利表現。


綠能產品部分，蘇開建說明，雖然傳統自行車持續在去化庫存的階段，且預計要調整至明年上半年，可能要到明年下半年調整告一段落，動能才會恢復，但 E-Bike 和中高階自行車銷售動能持續。


整體而言，蘇開建認為，第三季鍵盤等 IT 產品可望持續成長、綠能產品維持保守、整合元件暨材料也估持平。在此消彼長下，IT 產品下半年佔比將超越綠能，重新成為營收比重最高的產品線。",2023-08-03 21:09:22,13348,達方 (8163-TW) 今 (3) 日召開法說，董事長蘇開建表示，下半年綠能動能依舊較弱，但受惠筆電市況持續好轉，將帶動鍵盤產品同步升溫，整體營運優於上半年、毛利率也會提升。,['達方'],b0e5bdc3-47e2-474e-9ffb-7c6940af7393
聚陽Q2每股賺3.33元同期高 廣越轉盈,"['聚陽', '廣越', '成衣']","成衣代工廠第二季財報陸續出爐，聚陽 (1477-TW) 每股純益 3.33 元、上半年來到 7.25 元，均創歷史同期新高；廣越 (4438-TW) 第二季每股純益 2.48 元，則較前季轉盈。


聚陽第二季營收 72.24 億元，季減 7.8%、年減 1.6%；毛利率 24.6%，季減 0.6 個百分點、年減 0.4 個百分點；營益率 13.7%，季減 1.8 個百分點、年增 0.5 個百分點，稅後純益 8.04 億元，季減 15%，但年增 9.6%。


聚陽上半年營收 150.58 億元，年減 1.7%、毛利率 24.9%，年減 0.7 個百分點、營益率 14.7%，年增 1.1 個百分點，稅後純益 17.52 億元，年增 7.7%。


廣越第二季營收 47.53 億元，季增 78.9%、年減 1.5%；毛利率 16.5%，季增 1.8 個百分點、年減 2.6 個百分點；營益率 8.4%，季增 7.5 個百分點、年增 0.1 個百分點，稅後純益 2.55 億元，年減 23.5%，但較首季轉盈。


廣越上半年營收 74.1 億元，年減 5.4%、毛利率 15.8%，年減 1.3 個百分點、營益率 5.7%，年減 1.9 個百分點，稅後純益 2.09 億元，年減 39.1%，每股純益 2.03 元。",2023-08-03 21:52:22,13347,成衣代工廠第二季財報陸續出爐，聚陽 (1477-TW) 每股純益 3.33 元、上半年來到 7.25 元，均創歷史同期新高；廣越 (4438-TW) 第二季每股純益 2.48 元，則較前季轉盈。,"['聚陽', '廣越']",9c6407b0-6559-40df-92f1-d9970aed3943
