title,keywords,content,publish_at,id,summary,related_stocks,uuid
中鋼前2月營收年增5.9% Q1出貨可望達陣 Q2盼先蹲後跳,"['中鋼', '營收', '鋼鐵', '盤價']","中鋼 (2002-TW) 今 (11) 日公告 2 月受到農曆春節假期、工作天數減少影響，營收 280.64 億元，月減 9.3%、年減 7.3%；累計前 2 月營收 608.95 億元，年增 5.9%；中鋼預計 14 日 (周四) 開出 4 月及第二季盤價。


中鋼表示，2 月出貨量約 89 萬多噸快 90 萬噸，3 月出貨則估落在 92-94 萬噸，第一季 280 萬噸的目標可望達陣，但在回補庫存需求尚未明顯浮現下，4 月暫以平穩偏弱看待，第二季盼能先蹲後跳。


中鋼進一步指出，目前國內的廠辦需求回溫，鋼構確實有見到復甦，但外銷的冷軋、鍍鋅等鋼品面臨國際低價競爭，會比較辛苦一點。


各國市況來看，中鋼表示，雖然歐美鋼價前陣子修正，但近期美國鋼廠宣布出廠價調漲，行情可望展開反彈；越南和發、台塑河靜鋼近期開出的盤價走弱，主要是受到中國低價鋼品擾市影響。


中國年後鋼廠及社會庫存增加，中鋼認為，得觀察是看好後市的備庫存，還是需求沒跟上導致庫存增加；由於目前煉鋼成本還是在高位，近期也傳出中國鋼廠將「遇漲則漲、遇跌不跌」，盼透過維持鋼價減輕虧損壓力。",2024-03-11 17:46:51,22143,中鋼 (2002-TW) 今 (11) 日公告 2 月營收，280.64 億元，月減 9.3%、年減 7.3%；累計前 2 月營收 608.95 億元，年增 5.9%。中鋼表示，目前尚未見到明顯的年後回補庫存需求，3 月出貨量估僅較 2 月略增。,['中鋼'],418f8d12-c1bc-4d6d-addb-0d34f24f8d49
信紘科前2月營收3.98億元 年增21%創同期高,"['信紘科', '拆移機', '工程', '業務']","信紘科 (6667-TW) 今 (11) 日公布 2 月營收 1.63 億元，月減 30.38%，年增 4.53%，累計前 2 月營收 3.98 億元，年增 20.94%；受惠大客戶持續擴建廠，整體拉貨動能穩健，帶動前 2 月營收創歷年同期新高。


信紘科指出，2024 年積極擴大接單規模，並擴充人力團隊與完善供應鏈管理，且台灣半導體產業景氣可望逐步回溫，加上公司持續推動統包業務轉型，成效可望陸續展現。


根據台灣半導體產業協會 (TSIA) 最新預估，國內半導體產值恢復正向成長力道，2024 年台灣 IC 產業產值將達 5.01 兆元，年增 15.4%，有助挹注信紘科良好的業務空間，增添新動能。


展望 2024 年第一季，信紘科掌握主要客戶擴廠與增產計畫進度，並積極參與國際知名半導體相關大廠啟動擴建項目接單機會，同時專注於廠務供應系統整合設備與施作工法等研發能力、以及擴增專業人才團隊，提升市場競爭力並保持公司整體營運正面效果。


信紘科 2023 年全年營收為新台幣 24.13 億元，稅後淨利 3.21 億元，年增 52.24%，每股稅後盈餘達 7.17 元，全年獲利繳出歷年新高。


此外，考量公司資本公積充沛且財務體質健全，董事會通過 2023 年擬配發每股 6.46 元現金股利，配發率達 90.1%，現金股息配發金額創歷年新高，以期將公司營運回饋給全體股東共享。",2024-03-11 17:52:05,22142,信紘科 (6667-TW) 今 (11) 日公布 2 月營收 1.63 億元，月減 30.38%，年增 4.53%，累計前 2 月營收 3.98 億元，年增 20.94%；受惠大客戶持續擴建廠，整體拉貨動能穩健，帶動前 2 月營收創歷年同期新高。,['信紘科'],2a42bd89-2061-4b2f-89d9-7d5479680f49
晶鑽生醫與安奈美簽合作意向書 MIT生物醫材進軍中國市場,"['晶鑽生醫', '生技', '醫美']","晶鑽生醫 (6815-TW) 今 (11) 日宣布，與安奈美 (LELITE M) 醫療美容集團完成簽署戰略合作意向書，雙方將在生物醫材拉提線材與保養品銷售、專科醫療培訓，以及場域據點與培訓基地等展開全方位合作，建立長期戰略夥伴關係，攜手搶攻中國逾千億人民幣的高端輕醫美市場商機。


根據意向書，晶鑽生醫將負責當地百位醫師團隊的專業培訓，並於安奈美的通路據點協助各類再生醫美的療程推廣，結合雙方於再生醫美領域的專業優勢，打造高品質的服務體系。


安奈美則向晶鑽生醫採購包括 MIT 品牌第三代拉提線「美特拉」與醫療級術後保養品牌鑽美肌 S+DIAMOND 系列產品，搭配通路合作未來可能進一步延伸至 ODM 與 OEM 業務。


安奈美成立於 2021 年，集團總裁施廷昆亦為 LiteMed 台醫俱樂部創始人，具有專業醫師背景，不僅累積豐富市場經驗，在兩岸醫學美容交流活動也扮演重要角色。該集團在中國事業體涵蓋上海安奈美醫療美容診所、上海正衡軒中醫診所、上海蒙娜美容、上海儀拓生技公司等。


其中，上海安奈美醫療美容診所以抗衰老輕醫美為核心，融合專業醫師技術與學術研究，並結合中西醫療理念，引進國際高奢醫美品牌，如喬雅登 (Juvederm)、科醫人 (Lumenis)、瑞藍 (Restylane) 等，鎖定高端消費市場，可說是中國新型態的高端醫美診所代表。該集團目標以上海為基礎，規劃五年內將在全球市場至少布局 10-15 家醫療美容機構。


晶鑽生醫總經理謝佳憲表示，安奈美的另一個獨特處在於擁有經合格機構全認證的專業台籍醫師團隊，且皆深諳輕醫美理念，很高興能與其成為合作夥伴，未來借重安奈美在中國取得主場的銷售優勢，搭配晶鑽生醫的研發能力與獨特的品牌產品，共同在中國高端醫美市場搶下市占。


根據數據智能科技平台 Mob 研究院發布的《2023 年醫美人群洞察報告》指出，中國輕醫美項目交易訂單自 2017 年起逐年上升，至 2022 年占比已達 84%，顯見輕醫美療程逐漸成為主流趨勢。此外，依新氣數據顏究院的預測，2023 年中國輕醫美市場規模已達人民幣 1,461 億元，估計 2030 年市場規模將達 4,157 億元，年複合成長率 16.11%。",2024-03-11 17:52:55,22141,晶鑽生醫 (6815-TW) 今 (11) 日宣布，與安奈美 (LELITE M) 醫療美容集團完成簽署戰略合作意向書，雙方將在生物醫材拉提線材與保養品銷售、專科醫療培訓，以及場域據點與培訓基地等展開全方位合作。,"['晶鑽生醫', '晶鑽生醫']",b4cda909-a5b7-44c0-9bc1-619ac0a0d53a
週五上市櫃融資大減，權值股休兵 中小型個股輪動表現驗證，台積電  日月光 台達電 英業達 廣達  采鈺,"['趨勢分析', '亨達投顧', '陳智霖', '台積電', '櫃買指數', 'AI', '輝達', 'CPI', '采鈺', '英業達', '先進半導體', '矽晶圓', '環球晶', 'AI PC', '台達電', '台北國際電腦展', '谷歌', '微軟', '蘋果', 'CoWoS', '先進封裝', '日月光投控']","臺北股市今天在盤下游走，收盤下跌 59 點，但櫃買指數收漲 1.2%，今天權值個股持續拉回，台積電 (2330-TW) 下跌 2.3%，上周五美股在創高之後走跌， AI 的指標股輝達 (NVDA-US) 股價出現大跌，盤後盤也是持續性的下跌，過去大型 AI 科技股帶動指數的上漲行情，短期內將會先稍作休息，但是智霖老師在周六直播已經明確告訴各位，這一波行情融資是賺錢，而且在上週四跟週五都有逢高大幅減碼，按照目前股市的氣氛以及技術面的條件，減碼的資金勢必會再進場，從今天的盤面表現就可以得到驗證。


本週二晚上有重要的數據，美國將要公告 CPI，市場預期通膨將會有反彈的可能性，加上美國散戶情緒調查再度突破五成，因此預期大盤的行情會走震盪，操作方面可以找尋 2 月營收較去年年增的個股，因為 2 月份農曆過年放假，還可以比去年同期成長的個股代表基本面有明顯的好轉，例如采鈺 (6789-TW) 與英業達 (2356-TW)，這些都是智霖老師跟大家預告的重點三族群裡面 (先進半導體與 AI 概念股)。


〈下載陳智霖分析師 APP 獲得更即時資訊 ，完成註冊獎勵金最高 6000 元 〉


陳智霖老師的直播節目及 APP 的獨家廣播都會針對國際總經還有重要財經事件即時追蹤分析，同時提供產業趨勢方向，只要 APP 完成註冊驗證者都可獲得獎勵金 (最高回饋 6000 元)，邀請您可以立即點選下方連結免費下載陳智霖分析師 App，下載連結: 
https://hantec.liveinapp.com/jhih-lin-app-link


當前台股最熱門的話題莫過於台積電，是陳智霖老師的忠實鐵粉都很清楚我們如何長期操作台積電而且有提供證據，在 2022 年股災時 475 元以下逢低分批進場買台積電，包括最後一次在 2023 年 10 月股市行情低迷最後公開進場帶客戶買在 525 元的台積電，能夠拿出有買進台積電實戰證據的分析師，整個投顧同業應該只有我一人長期追蹤台積電。




本波股市行情起漲在 2023/11/02，當時市場熱衷想買美債，智霖老師直言債券目前還僅適合少量配置並不合適重壓，因為你只有一套資金。適合買進的應該是台積電，因為台積電的績效將會打敗美債，而且老師告訴各位台積電將會漲到讓你流口水，打敗美債跟台股漲到讓你流口水，這 2 個都是完全驗證，而重押美債的投資人現在紛紛放棄賣出債券，轉而追高台積電， 525 元附近不買，要追在 800 元附近的台積電，拼搏它會漲到 1000 元，你認為這是專業分析師應該做的事情嗎?  如果是用賭博的方式，你還需要找分析師嗎?




週六最新的直播智霖老師有跟大家預告很多未來看好的產業方向，這波因為漲台積電漲指數攻上 2 萬點，很多個股其實並沒有跟漲，當台積電陷入休息就是這些股票的機會，半導體上游矽晶圓龍頭環球晶 (6488-TW) 董事長徐秀蘭女士告訴我們第二季是谷底下半年將會顯著的復甦，陸續第二季還有台北國際電腦展，將有 AI PC 的題材，另外因為人工智慧還有電動車所產生的大量電力需求，經過長時間整理的台股龍頭台達電 (2308-TW)，低檔爆大量轉強都是投資人波段可以參考的標的，反觀已經大量噴出的日月光投控 (3711-TW)，老師在上週都有提醒大家星期五是賣點，封測族群高本益比並不符合常規，因此有超漲的嫌疑，當前應該買什麼? 邀請投資朋友跟上陳智霖老師的團隊，我們每個星期都會準備選股名單並設定好價位，目前參加會員還可以享有老師 20 年經驗所累積。


集結的精華操盤課程，錯過了這次，機會不再有，投資朋友敬請把握，關於行情的最新看法以及產業分析，您可以點選下方影音收看老師最新的直播精華節目。


最新影音 (請點影音上方標題至 Youtube 收視品質會更佳)




點擊連結免費下載註冊〈陳智霖分析師 APP〉獎勵金回饋立即領


https://hantec.liveinapp.com/jhih-lin-app-link


才剛剛接觸陳智霖分析師的新朋友，建議您現在立即點選連結下載安裝陳智霖分析師 APP，新註冊的用戶可免費盤中選股以及會員專屬影音，歡迎您透過體驗來了解陳智霖老師，午報導航體驗都是限時限額開放，千萬不要浪費了您可以免費體驗的權益喔。




錢進熱線 02-2653-8299, 立即邁向系統依據的股票操作。


文章來源：陳智霖分析師 / 亨達投顧


本公司所推薦分析之個別有價證券

無不當之財務利益關係 以往之績效不保證未來獲利

投資人應獨立判斷 審慎評估並自負投資風",2024-03-11 18:10:05,22140,無摘要,"['台積電', '英業達', '環球晶', '台達電', '日月光投控', '采鈺', '采鈺', '輝達']",59ecb4f1-9e7c-4d3a-a04a-c04eb27c5adb
晶華去年獲利年增逾5成 擬超額配息11.38元,"['飯店', '餐飲', '超額配息', '獲利創高', '晶華']","連鎖飯店集團晶華 (2707-TW) 今 (11) 日公布去年財報，稅後純益 14.15 億元，年增 56.7%，創歷年次高，每股純益(EPS)11.11 元，董事會也通過擬超額配息 11.3821 元的現金股利，配息率達 102%，換算現金殖利率約 5.4%；晶華指出，4 月起冠軍牛肉麵禮盒將在歐洲多國的超市上架開賣，增添營運新動能。


晶華指出，餐飲消費需求已恢復正常，推升去年合併營收達 67.65 億元，年增 20.86%，稅後純益 14.15 億元，年增 56.7%。


展望後市，晶華積極拓展晶英、晶泉、捷絲旅等品牌新據點，北投晶泉丰旅預計 8 月開幕，規劃有 94 間客房、22 間湯屋、3 間 SPA 和 2 間餐廳，目前已進入人力招募階段。


而晶華受到各國旅客歡迎的冠軍牛肉麵禮盒，也將於 4 月進軍歐洲，於英國、法國、荷蘭、西班牙、德國和義大利的超市銷售，此為晶華首度將餐飲版圖擴大至歐洲。


就住房業務來看，晶華說明，晶英酒店和捷絲旅推出各式應景的清明連假住房專案，有助帶動國旅住房需求。


而大本營台北晶華酒店則受惠海外商旅回流，大型國際會展也陸續舉辦，住房率可望穩健成長。


餐飲方面，隨著各大企業陸續舉辦春酒，緊接著母親節檔期帶動餐飲消費熱潮，晶華看好，勢必為上半年的業績注入強勁的營運動能。


除了持續提升營收績效外，台北晶華酒店加入 EarthCheck 認證計劃，成為全球性永續旅遊認證組織 EarthCheck 在台灣的首位會員。",2024-03-11 18:28:25,22139,晶華去年獲利年增逾 5 成 擬超額配息 11.38 元,['晶華'],c05832ab-d1fd-4753-83c2-9c846789a997
蔡明彰觀點：大怒神繫緊安全帶  高殖利率、航運相對安全,"['萬寶投顧', '蔡明彰', '趨勢分析', '台股']","今天報告的主題是「大怒神繫緊安全帶  高殖利率、航運相對安全」。


萬寶投顧蔡明彰強調，以前台股參考美股的道瓊指數、那斯達克、費半走勢，現在 AI 信仰之下，只關注四檔美股 AI 股，輝達、AMD、美超微、台積電 ADR，只要四檔續創歷史新高，台股投資人繼續往前衝，大盤也跟著改寫歷史新高，但多頭陷阱也出現。


以前參考道瓊指數有金融及傳產，那斯達克有廣泛的科技及生技股，台股跟進就會漲到非電子族群及各種科技產業股價都會輪動，但最近 AI 信仰只拉升台積電 (2330-TW)，其他與美股四檔 AI 無關的股票漲不起來。


不少個股賺指數、賠差價，AI 信仰只有少數股票開香檳慶祝，當前大盤的周線、月線的 K 值 90％嚴重超買，部分投資人不耐手中持股賺指數、賠差價，調節賣出及換股操作，造成盤勢大震盪。


3 月 8 日台股看到 2 萬點，但不是普天同慶，而是驚心動魄，八成上市櫃股票收黑。2 萬點台股大怒神，參與者繫緊安全帶，準備嘔吐袋，2 萬點是台股史上重大里程碑，如何大怒神可參考 30 多年前的 1 萬點。 


萬寶投顧蔡明彰強調，1989 年台股首次衝上 1 萬點，創歷史新高，加權指數衝關靠當時主流金融股，但市場炒作資產股、中小型股，在那個新台幣大升值引進熱錢、狂炒房地產的年代，有土斯有財是台股最大信仰。


第一次攻上 1 萬點，主力大戶調節出貨，台股激烈震盪修正，漲多的資產股、投機股崩跌，但資金行情沒結束，半年內台股在 1990 年初成功站穩 1 萬點，並創下 12,682 點新天價，帶動大盤仍是金融股，但中小型飆股全部換人，因此 2 萬點不是天花板，這次經過修正後台積電 (2330-TW)、聯發科 (2454-TW) 及受惠降息的金控權值股富邦金 (2881-TW)、國泰金 (2882-TW)、中信金 (2891-TW) 仍會拉抬大盤，再創下歷史新高，但市場炒作的中小型股全面輪替，不要相信，飆股還有續集，大漲一次就要果斷下車。


萬寶投顧蔡明彰強調，AI 信仰使股市狂熱，本身存在不可測的風險，如何降低風險有三大操作。


第一個，挑選高殖利的股票絕對是大怒神的安全防護，以今年來大漲 23％漲幅領先各類股的半導體為例，聯發科殖利率 4.5％、聯詠 (3034-TW)5％、矽創 (8016-TW) 配息 12 元，殖利率 4.2％，一旦股價回檔，殖利率更高，會吸引買盤湧入。成熟製程的聯電 (2303-TW) 基本面平淡，但有配息 3 元，殖利率 6％，相對抗跌。


台股大怒神第二個防護工具，進出補漲股，AI 伺服器的廣達 (2382-TW)、緯創 (3231-TW)，今年來績效遠不如散熱的雙鴻 (3324-TW)、奇鋐 (3017-TW)，但廣達、緯創 2 月營收雙增優於預期，但雙鴻、奇鋐 2 月營收並沒有雙增，雙鴻更是雙減，月減 42％，年減 26％，恐怕市場資金賣漲多的散熱，轉進補漲的 AI 伺服器。


不過，要提防美股 AI 伺服器妖股美超微 3 月 18 日納入標普 500 成份股，是否利多出盡，依照過去納入標普 500 成份股的走勢來看，股價提前大漲，但正式成為成份股，就有一波利多出盡的賣壓。


AI 信仰並非毫無漏洞，網通晶片大廠博通、邁威爾 3 月 8 日公佈財報股價重挫，並拖累輝達，出現本波最大跌幅，同時暴巨量，高檔爆量，對短線股價不是好事。博通上季財報優於預期，但未調升全年營收目標，邁威爾本季營收財測低於市場預期，顯示 AI 需求尚未充分擴散到網通領域。


台股網通、光通訊，本波訴求 AI 題材，新復興 (4909-TW)、光聖 (6442-TW)、上詮 (3363-TW) 等漲幅超前，恐過度反映了。


萬寶投顧蔡明彰強調，今年來台股大漲 1,800 點，居然台積電貢獻 1,600 點，極為不正常。應對台股大怒神的第三個法寶，資金轉入與台積電負相關股票，台積電是美股拉動亞利桑那州廠，傳獲 50 億美元美國晶片法案補助，低於預期的 100 億美元。


中國經濟及股市與美國負相關，中國今年前兩月出口 5,280 億美元，年增 7.1％，高於預期的 1.9％，也優於去年 12 月的 2.3％。中國出口增長不同於台灣受惠 AI，而是反映全球需求好轉，先行反映在航運股。


貨櫃三雄長榮 (2603-TW)、陽明 (2609-TW)、萬海 (2615-TW) 漲最兇創天價的 2021 上半年，排擠護國神山台積電在 679 至 518 元間修正逾兩成，證明航運與台積電走勢背道而馳。


今年前兩個月營收年增率，長榮成長 30％，陽明成長 18％。長榮可望配息 7 至 8 元，高殖利率題材，股價創一年半新高，陽明去年 Q4 EPS 虧損 0.37 元，全年 1.37 元，今年 Q1 可望由虧轉盈。陽明、長榮價差過大，短線補漲力道增強。


萬寶投顧蔡明彰強調，散裝輪運價表現更好，今年來 BDI、BCI 已轉為上漲，反映在正德 (2641-TW) 前兩月營收年增 62％最大，其次裕民 (2606-TW) 年增 47％，慧洋 - KY(2637-TW) 年增 31％。其餘，新興 (2605-TW)、中航 (2612-TW)、台航 (2617-TW) 年增率 10％上下。


以龍頭裕民為例，月營收長達一年負成長，自去年 12 月起連續三個月正成長，受環保法規影響，今年全球散裝輪缺船效應，可望營收持續成長，股價卻遲遲沒動靜，也許市場正在等待市場資金從漲多的電子股撤退，轉入的時機。


文章來源：萬寶投顧蔡明彰


立即免費加入蔡明彰粉絲團，可獲得更多資訊分享


蔡總選黑馬蔡明彰 LINE 粉絲團


https://line.me/ti/p/@marbo666


蔡總選黑馬蔡明彰 免費 YOUTUBE 影音頻道


https://www.youtube.com/channel/UCHjkjx50-BTduhjwiwFA3nw


蔡總選黑馬蔡明彰 FB 社團


https://www.facebook.com/groups/marbo666/


蔡總選黑馬蔡明彰 telegram 粉絲團


https://t.me/marbo666


本公司所推薦分析之個別有價證券

無不當之財務利益關係 以往之績效不保證未來獲利

投資人應獨立判斷 審慎評估並自負投資風險",2024-03-11 18:30:06,22138,無摘要,"['中航', '聯發科', '富邦金', '國泰金', '中信金', '聯詠', '矽創', '聯電', '廣達', '緯創', '雙鴻', '奇鋐', '新復興', '台積電', '上詮', '長榮', '陽明', '萬海', '正德', '裕民', '慧洋-KY', '新興', '光聖', '台航']",4fc52e76-b1f7-4d53-9e77-188fb3be6065
中華電坐穩雙冠王寶座 2月每股賺0.42元創近7年同期新高,"['中華電', '台灣大', '遠傳', '電信']","電信三雄今 (11) 日公布自結數，中華電 (2412-TW) 坐穩雙冠王寶座，2 月營收、獲利創近 7 年同期新高，每股純益 0.42 元，贏過台灣大 (3045-TW) 的 0.29 元、遠傳 (4904-TW)0.27 元；累計前 2 月營運方面，中華電每股賺 0.83 元，台灣大與遠傳則分別為 0.64 元、0.54 元。


中華電


2 月營收 186.7 億元，月增 4.13%、年增 4.1%；EBITDA 74 億元，月增 1.37%、年增 2.6%；稅後純益 32.4 億元，月增 2.21%、年增 3%，每股純益 0.42 元。


中華電信表示，2 月業務及財務表現雙雙攀升，三大事業群皆繳出營收正成長的佳績，整體合併營收、營業淨利、EBITDA 及 EPS 則創近七年同期新高。


各業務方面，中華電指出，2 月行動服務營收年增 5.1%，主因行動服務品質優異，帶動 5G 用戶數與整體 090 門號數提升，行動數據營收亦受惠國際漫遊需求而增加，加上春節期間影視內容大受歡迎，有效挹注整體營收。此外，行動月租型 ARPU(每用戶平均收入) 年增 3.2%，連續 35 個月成長；行動月租型離網率維持 0.36%，持續保持電信業最低。


新興業務表現同樣亮眼，智慧聯網營收年增 27.8%，主因太陽光電專案入帳；資安業務營收年成長也達雙位數、ICT 整合專標案因大型專案入帳，營收年增 13.1%，帶動整體 ICT 營收年成長。銷貨收入則年成長 1.7%。


中華電前 2 月營收 366 億元，年增 2.5%，財測達成率 99.8%-100.3%；EBITDA 147 億元，年增 0.4%；稅後純益 64.1 億元，與去年同期相當，財測達成率 106.4%-108%，每股純益 0.83 元。


遠傳


2 月合併營收 84.91 億元，月減 5.01%、年增 18.6%；EBITDA 29.38 億元，月減 1.57%、年增 12.2%；稅後純益 9.71 億元，與前一月相當、年減 1%，主要是受合併折舊與攤銷費用增加，以及去年同期業外一次性利益墊高基期影響，每股純益 0.27 元。


累計前 2 月營收 174.29 億元，年增 16.4%；EBITDA 59.23 億元，年增 13.1%；稅後純益 19.48 億元，年增 7.3%，每股純益 0.54 元。


遠傳表示，受惠 5G 滲透率穩定提升、農曆春節漫遊業務升溫、合併亞太電信綜效以及企業智慧資通訊服務、遠傳守護網、遠傳 friDay 影音、行動金融服務等新經濟營收成長亮眼，挹注 2 月月租型用戶每月平均貢獻度 (ARPU) 相較 1 月攀升，帶動行動服務營收年成長率擴大至 19.1%，締造自 2021 年 3 月以來連續 36 個月正成長的佳績。


台灣大


2 月營收 152.5 億元，月減 10%、年增 11%；EBITDA 33.3 億元，月減 9.5%、年增增 17%；稅後純益 8.8 億元，月減 17%、年減 4.7%，每股純益 0.29 元。


前 2 月營收 322.1 億元，年增 12.8%；EBITDA 70.1 億元，年增 22%；稅後純益 19.4 億元，年增 9.4%，每股純益 0.64 元。


台灣大財務長兼發言人張家麒表示，今年 2 月除了併入台灣之星用戶的營收貢獻外，台灣大既有智慧型手機月租用戶 ARPU 年增 7%，加上漫遊相關營收月增 15%、達 2019 年底疫情前單月水準，使行動服務營收年成長幅度達 27%，接近 53 億元。


累計前兩個月，在行動業務、電子商務、家用寬頻三大引擎同步推升，以及整併效益逐漸發酵下，合併 EBITDA 與合併營業利益較去年同期分別成長 22% 與 8%。",2024-03-11 18:41:03,22137,電信三雄今 (11) 日公布自結數，中華電 (2412-TW) 坐穩雙冠王寶座，2 月營收、獲利創近 7 年同期新高，每股純益 0.42 元，贏過台灣大 (3045-TW) 的 0.29 元、遠傳 (4904-TW)0.27 元。,"['中華電', '台灣大', '遠傳']",23b4cfff-215b-4e22-837a-fa7c0e4b5196
