title,keywords,content,publish_at,id,summary,related_stocks,uuid
鳳凰樂看出國旅遊暢旺 加強開團體包機、郵輪產品,"['鳳凰', '出國', '郵輪', '觀光', '旅遊', '日本', '旅行社']","受惠疫後出國旅遊熱潮，旅行社業者鳳凰 (5706) 去年稅後純益 1.78 億元，每股純益 (EPS) 2.44 元，不僅轉虧為盈，也創下 4 年來新高，鳳凰總經理卞傑民表示，今年將加強取得機位，同時布局各種郵輪產品、增添航空代理業務，透過三大營運動能，穩步推升成長。


鳳凰說明，隨著出國旅遊需求持續暢旺，今年將強化團體行程成長，正加強各路線系列團體機位取得，爭取包機合作機會，已上架日本鳥取、菲律賓長灘、巴拉望等行程熱賣中。


而隨著郵輪市場復甦，鳳凰爭取以基隆、高雄為母港的包船，並上架長短線機加船 (flight cruise) 產品。


看準疫後高端旅遊需求，鳳凰更增加南極郵輪、歐洲河輪、中南美、美加地區國家公園、金鳳凰系列等產品。


而鳳凰旗下航空代理業務，最新取得蒙古航空、韓國可依航空代理，未來也將爭取新合作機會。


鳳凰董事會通過擬配發每股現金股利 2 元、股票股利 1 元，保持上市櫃 23 年以來連續發放股利，將於 6 月 7 日召開股東常會。",2024-03-11 11:34:40,22177,鳳凰樂看出國旅遊暢旺 加強開團體包機、郵輪產品,[],ebd18fa3-a617-4b64-8a75-7771dc60dbb7
〈焦點股〉廣達2月營收回神年月雙增 資金簇擁勁揚,"['廣達', '電子五哥', 'AI伺服器']","廣達 (2382-TW) 持續受惠 AI 伺服器挹注，帶動 2 月營收年月雙增，月增 15.6%，年增 1.1%，不受工作天數少影響。廣達今天買盤湧進，盤中一度漲逾半根停板，最高漲至 254.5 元，力拚站回所有均線。 


廣達今天早盤以 243.5 元開高走高，盤中一度漲逾半根停板，來到 254.5 元，雖隨後漲幅收斂，但仍上漲超過 2%，成交量超過 3.2 萬張。 


廣達 2 月營收 842.93 億元，月增 15.6%，年增 1.1%。累計今年 1 至 2 月營收 1572.3 億元，年減 9.3%。不過即便廣達旗下以消費性產品為大宗，2 月筆電出貨 290 萬台，與 1 月持平，無明顯衰退。 


廣達指出，雖然第一季為傳統淡季，但看好 3 月客戶拉貨帶起季底效應，推升第一季整體營運。至於缺料問題，廣達也表示，預期 5、6 月供貨吃緊狀況可以緩解，將使出貨狀況回穩，同時也看好今年 AI 伺服器能有雙位數的成長。",2024-03-11 11:38:01,22176,廣達 (2382-TW) 持續受惠 AI 伺服器挹注，帶動 2 月營收年月雙增，月增 15.6%，年增 1.1%，不受工作天數少影響。廣達今天買盤湧進，盤中一度漲逾半根停板，最高漲至 254.5 元，力拼站回所有均線。 ,['廣達'],f4351a28-9898-4974-8ef5-892a98ddb3e2
臺灣企銀結盟歐付寶 105萬會員綁定消費100元享回饋,"['臺企銀', '歐付寶', '信用卡']","臺灣企銀 (2834-TW) 結盟擁有 105 萬廣大會員數的歐付寶電子支付平台，聯手推出帳戶連結與消費功能，共同舉辦「歐付寶綁定臺企銀帳戶消費 100 元 最高回饋歐付寶紅利 200 點」活動，民眾只要透過歐付寶綁定連結臺灣企銀存款帳戶，除了可享受歐付寶便利的付款、儲值及提領體驗，最高還可享歐付寶紅利點數 200 點


自今（113) 年 3 月 11 日起至 5 月 31 日止，歐付寶會員首次綁定臺灣企銀存款帳戶，單筆消費扣款滿新臺幣 (以下同)100 元，即享歐付寶紅利點數 100 點，若於活動期間首次綁定帳戶為該行新開立之 Hokii 數位存款帳戶，再加碼贈歐付寶紅利點數 50 點，另外符合該行 Hokii 數位會員資格者可再加碼贈歐付寶紅利點數 50 點，合計每人最高可得歐付寶紅利點數 200 點 (1 點等於 1 元)，限時限量優惠送完為止。


歐付寶合作通路範圍跨足全台各大連鎖商店，包含全家、萊爾富、OK 超商、NET 服飾、美廉社及中油加油站等生活消費場域，讓民眾得以使用便利的電子支付，消費所獲得的歐付寶紅利點數可用於合作通路，買越多賺越多! 現在申請臺灣企銀 Hokii 數位會員及臺幣與外幣數位存款帳戶，還可享優惠存款利率、線上申辦信用貸款系統作業費折扣等豐富金融優惠，讓您更活用消費理財放大術！


臺灣企銀積極建構支付生態圈，目前已與台灣 Pay、一卡通 Money、街口支付、icash Pay、全盈 + pay、全支付及悠遊付等大型電子支付機構推出帳戶連結消費服務，提供客戶多元消費場景及普惠金融服務，體驗更美好便捷的數位生活。",2024-03-11 11:39:08,22175,臺灣企銀結盟擁有 105 萬廣大會員數的歐付寶電子支付平台，聯手推出帳戶連結與消費功能，共同舉辦「歐付寶綁定臺企銀帳戶消費 100 元 最高回饋歐付寶紅利 200 點」活動，,['臺企銀'],be0faa62-a06c-43cc-b57b-161ce7a93d00
〈焦點股〉英特磊2月營收年增逾2成 亮燈漲停,"['三五族群', '砷化鎵', '英特磊']","三五族半導體英特磊 IET-KY(4971-TW)2 月營收 0.66 億元，年增 23.35%，激勵今天股價開高走高，強攻漲停鎖住 68.7 元，不僅站穩所有均線，且股價創下波段新高。 


英特磊 2 月營收 0.66 億元，雖月減 2.1%，不過年增超過 2 成，達 23.35%。累計今年 1 至 2 月營收 1.33 億元，年增 25.61%。 


英特磊董事長高永中先前指出，包括銻化鎵、MBE 設備與服務，以及 6 吋磷化銦 (InP) 的 HBT，帶領英特磊走出營運谷底，更是英特磊的重要成長動能。


另外，AI 話題持續火燙，高永中也說，磷化銦 (InP) 常用於高速、高效能的元件，在 AI 硬體中扮演重要角色，尤其在資料中心與高性能運算平台等，有助於英特磊整體營運。英特磊於本周五 (15 日) 召開法說會，預料屆時將釋出最新市況與展望。",2024-03-11 12:28:25,22174,三五族群英特磊 IET-KY(4971-TW)2 月營收 0.66 億元，年增 23.35%，激勵今天股價開高走高，強攻漲停鎖住 68.7 元，不僅站穩所有均線，且股價創下波段新高。,['IET-KY'],89c05287-891e-46aa-b424-d62a9f1258c7
仲恩生醫今登錄興櫃 治療小腦萎縮幹細胞藥物目標申請日藥證,"['仲恩生醫', '生技', '幹細胞']","仲恩生醫 (7729-TW) 今 (11) 日以每股 35 元登錄興櫃，董事長暨總經理王玲美表示，公司長期專注於神經罕見疾病藥物研發，目前進展最快的是旗下幹細胞藥物 Stemchymal 治療小腦萎縮症(SCA)，預計 2024、2025 年提出日本藥證申請。


仲恩生醫創立於 2007 年，致力於脂肪間質幹細胞投入罕見疾病療法藥物研發，至今已累積多項創新幹細胞技術平台開發、前臨床及臨床試驗，適應症涵蓋小腦萎縮症與亨丁頓舞蹈症兩項罕病，以及急性缺血性腦中風、急性肝衰竭、急性呼吸窘迫症等急性發炎性疾病。


副總柯景懷指出，獨家開發的首個幹細胞藥物 Stemchymal，經動物實驗及離體細胞實驗證實，Stemchymal 治療機制可透過特定分泌因子，經自體吞噬的路徑達到減少異常蛋白質堆疊、調節發炎反應、抗氧化能力、支持神經細胞修復、生長。


此外，相較於市面上研發藥物多為單一靶點，Stemchymal 可多靶點達到保護神經細胞及抑制突變蛋白質的堆積。目前仲恩已與日本 Reprocell、韓國 SCM Lifescience 兩家公司達成 Stemchymal 技術授權，未來也持續積極拓展其他國際市場如美國及歐洲等，爭取技轉授權到海外的機會。


藥證取得方面，除日本市場預計 2024、2025 年提出藥證申請外，台灣可望在「再生醫療製劑條例」通過後，依據「有附款許可」取得暫時性許可。加上衛福部今年 1 月施行「已於醫藥先進國核准之罕見疾病藥品認定併查驗登記審查試辦方案」，兩種途徑都可能縮短 Stemchymal 在台上市時程，為台灣罕病病友提供治療方案。


至於臨床三期規劃，王玲美表示，臨床試驗三期收案人數初步的估算大約在 100 人左右，但因為是罕見疾病，有機會再往下調整，細節會與專家討論後才能確定。",2024-03-11 12:29:19,22173,仲恩生醫 (7729-TW) 今 (11) 日以每股 35 元登錄興櫃，董事長暨總經理王玲美表示，公司長期專注於神經罕見疾病藥物研發，目前進展最快的是旗下幹細胞藥物 Stemchymal 治療小腦萎縮症(SCA)。,['仲恩生醫'],200ecd8b-dd74-4e18-8bcc-4979b130b25e
〈焦點股〉2壽險型金控領漲 保險、證券股活蹦亂跳,"['國泰金', '開發金', '金融股']","台股今 (11) 日震盪拉回，但金融族群在 2 月獲利及股利等利多題材護體下強勢走揚，由國泰金 (2882-TW)、開發金 (2883-TW) 等壽險型金控發動攻勢，保險股中再保 (2851-TW)、第一保 (2852-TW) 及證券股統一證 (2855-TW)、群益證 (6005-TW) 等均獲買盤青睞，盤中約有 2-5% 不等的漲幅。


金控股持續發動補漲，國泰金股價連日走揚，站上半年線，今天盤中再上漲超過 2%，最高來到 46.5 元，創波段新高；開發金亦呈量價齊揚，盤中漲逾 4%，最高觸及 13.5 元，攀至 15 個月以來的新高。


資金輪動從高基期個股流向低基期，許多前波沒漲到的中小型保險股今天一吐悶氣，其中，中再保大漲逾半根停板，來到 24 元，站上半年線，為近半年以來新高；第一保、旺旺保、新產、台產亦為盤面多頭焦點，股價約上漲 2-4%。


金融保險族群今天扮演撐盤要角，中小型銀行股王道銀、聯邦銀盤中上漲超過 1%，亦表現不俗；近來股市交投熱絡，帶動證券公司業績，統一證、群益證今天獲資金點火，上漲力道也很強勁。


國泰金 2 月自結稅後純益 109.9 億元，無懼工作天數少影響，較 1 月成長，更奪下單月獲利王寶座，累計前 2 月稅後純益 203.9 億元，年增 3.78 倍，EPS 為 1.41 元。開發金 2 月稅後純益 28.05 億元，前 2 月稅後純益 56.14 億元，年增 261%，每股純益 0.34 元。


王道銀行 (2897-TW) 董事長駱怡君表示，今年股利發放一定會比去年好，將盡力在董事會上爭取，預計 4、5 月就能通過；對於國銀積極跟隨台積電前往日本，駱怡君透露，王道銀行海外布局仍以東南亞市場為主，暫時不考慮前進日本。


聯邦銀 (2838-TW) 2 月自結稅後純益 4.15 億元，累計前 2 月稅後純益 7.13 億元，每股純益為 0.19 元。",2024-03-11 12:30:25,22172,台股今 (11) 日震盪拉回，但金融股在 2 月獲利及股利等利多題材護體下強勢走揚，由國泰金 (2882-TW)、開發金 (2883-TW) 等壽險型金控發動攻勢,"['國泰金', '開發金', '中再保', '第一保', '統一證', '群益證', '王道銀行', '聯邦銀']",d1c0ce7e-4f21-432f-bf7f-641966b75bcf
聚恆桃園分部正式啟用 滿足中北部客戶需求,"['聚恆', '太陽能', '綠能', '事業']","太陽能業者聚恆科技 (4582TW) 今 (11) 日表示，桃園全新辦事處大樓正式落成，可更快回應中北部客戶需求，並提升同仁交通便利性，建築包含舒適的辦公與住宿環境，屋頂建置容量 18kwp 光電系統，呼應企業永續低碳的概念。


聚恆科技指出，作為一家致力於綠色能源開發與投資的企業，聚恆與大亞集團共同投資興建，並在 2022 年底完成全台首件大型漁電共生案場掛錶及營運，案場面積達 114 公頃，預估每年發出 1.2 億度電力，且與既有養殖戶共同規劃的養殖區已經開始產出穩定漁獲。


另外，聚恆科技儲能事業也榮獲台電儲能自動頻率控制 (AFC) 調頻服務資源採購案五家得標廠商之一，在台南市永康區總部建置 2MW/1.2MWh 儲能系統。


展望未來，聚恆科技董事長周恒豪表示，公司應正視能源轉型趨勢中所帶來的機遇與挑戰，憑藉著 26 年累積的工程經驗與研發能力，聚恆科技將不斷探索各項能源的可能性與解決方案，以拓展綠色能源藍圖。",2024-03-11 13:28:13,22171,太陽能業者聚恆科技 (4582TW) 今 (11) 日表示，桃園全新辦事處大樓正式落成，可更快回應中北部客戶需求，並提升同仁交通便利性，建築包含舒適的辦公與住宿環境，屋頂建置容量 18kwp 光電系統，呼應企業永續低碳的概念。,['聚恆'],7e0b7d98-562f-4261-894c-96795cc2ba9f
本土唯一 國泰世華私銀5度蟬聯台灣最佳私銀,"['國泰世華私人銀行', '亞洲私人銀行家', '財管2.0']","國泰世華私人銀行業務再度傳來好消息！知名媒體《亞洲私人銀行家》(Asian Private Banker) 連續 5 年將國泰世華私銀選為台灣 2023 最佳私人銀行，為國內本土銀行中唯一榮膺此獎肯定的業者；此外，國泰世華也已獲金管會同意續辦高資產客戶新財管方案 (財管 2.0)。


國泰世華私人銀行執行長傅伯昇表示，面對投資需求具高度明確性、追求穩健增值的高資產客群，私銀除了提供客製化的投組建議，還需要擁有足夠多元的資產工具來協助靈活配置。為此，國泰世華私銀早在 2019 年成立「私募另類投資商品專家團隊」，網羅擁有十數年金融產業資歷，且具備國際資本市場投資經驗的成員加入。


傅伯昇進一步指出，去年率先引進台灣銀行業者中首檔以信託方式受託投資「未具證投信基金性質」的境外基金；同年更增設「專責投組團隊」，專門為每位客戶制訂最適宜的投組策略，讓其享有更即時與完整的全方位投資組合諮詢服務，以滿足高資產客戶日益提升的全面性諮詢需求。


傅伯昇強調，國泰世華私銀規模逐漸壯大，如今於台灣、香港及新加坡皆設有服務據點，未來將持續建置更完善與全面的私銀服務品質，讓台、港、星客戶皆能享有更精緻的頂級金融服務體驗。


隨著通膨逐漸降溫、緩步降息的訊號浮出，今 (2024) 年整體經濟動能可望更為明朗。然而，今年迎來全球選舉年，地緣政治風險恐進一步升溫，高資產客群在進行資產配置時，將更加仰賴合作的金融單位可以給予即時、正確又完整的市場資訊進行輔助。


國泰世華私銀深耕高資產客群即將邁入第 11 年，除了持續強化產品組合及諮詢服務，更以百人專責團隊享譽市場。回顧過去十年總資產管理規模年複合成長率 (CAGR) 高達雙位數，亮眼表現不僅獲得廣泛客戶信賴，也在國際資本市場綻放光芒。",2024-03-11 13:28:52,22170,國泰世華私人銀行業務再度傳來好消息！知名媒體《亞洲私人銀行家》(Asian Private Banker) 連續 5 年將國泰世華私銀選為台灣 2023 最佳私人銀行，為國內本土銀行中唯一榮膺此獎肯定的業者,[],de914898-a858-494f-b5cf-fb540f15607c
元富證投資論壇22日登場 解析降息、原物料和台股後市,"['元富', '券商', '證券', '投資論壇']","新光金控 (2888-TW) 旗下元富證券今 (11) 日表示，子公司元富期貨首度攜手元富投顧和元大投信，將於 3 月 22 日舉辦免費的投資論壇，分享聯準會降息預期、台股布局商機等投資人聚焦的熱門內容。


此次元富證舉辦的投資論壇中，將解析 2024 年最新油、金、產能趨勢變化，以及美台經濟及金融市場的展望與策略，為投資人掌握絕佳投資時機。


元富期貨表示，近期受美元疲軟和中東緊張局勢加劇的推動，金價創歷史新高，除了黃金的避險吸引力外，全球也關注亞洲市場對貴金屬持續不斷的需求，增強黃金作為首選避險資產的地位。


而通膨危機是否將捲土重來，永續減碳等議題，持續影響著全球經濟與產業，2024 年是否會再次出現未知的黑天鵝事件，增添了市場的不確定性。


至於降息何時啟動，也成為市場關注的焦點，面對 2024 年美中關係緊繃、地緣政治風險提高，元富預測，全球經濟將繼續面臨多重挑戰。


元富投顧研究團隊陣容堅強，負責台、美、歐、中、日五大區域經濟研究，以及股、匯、債資產配置，連續三年獲得 CMoney 金曜獎最佳研究報告盈餘預估準確獎第一名，透過精準掌握股市投資趨勢等分析看法，對法人及元富證券客戶均有極大影響力。",2024-03-11 13:40:28,22169,元富證投資論壇 22 日登場 解析降息、原物料和台股後市,['新光金'],a883d1be-73fb-4430-80b8-fd852dde503b
【總經焦點】歐洲央行維持利率水準，下修通膨經濟成長預測！一文掌握上週大事,"['趨勢分析', '永豐金證券', '歐洲央行', 'ECB']","中國的兩會取消會後的總理中外記者會，而在兩會上，政府提出將發行超長期特別國債來支撐地方經濟，並且提出「新質生產力」作為政府工作任務的第一要點。其次是歐洲央行利率決議，第四度宣布維持利率水準，同時調降通膨和經濟成長的預測，市場認為有望與美國聯準會同調在六月降息。


一、上週盤勢與本週大事– 中國兩會打破三十年慣例，取消總理記者會


上週大事紀多，首先是中國的兩會取消會後的總理中外記者會，而在兩會上，政府提出將發行超長期特別國債來支撐地方經濟，並且提出「新質生產力」作為政府工作任務的第一要點。其次是歐洲央行利率決議，第四度宣布維持利率水準，同時調降通膨和經濟成長的預測，市場認為有望與美國聯準會同調在六月降息。




二、歐洲央行利率決議重點– 放鬆限制性立場，同步下調經濟與通膨預期


在 3/7 歐洲央行 ECB 舉行利率會議，維持三大利率不變，也是第四度暫停升息，同時將維持縮表計畫不變，被外界認為升息循環已結束。會後記者會中，央行行長 Christine Lagarde 表示將開始討論放寬限制性立場 (restrictive stance)，暗示可能在六月的利率會議上降息。




在新一季的經濟預測中，ECB 下修了全年經濟成長預估至 0.6%，同時也下調通膨至 2.3%，預期到 2025 年可降至 2.0%。目前歐元區的通膨緩解速度比美國來得快速，核心通膨下降速度也較快。未來關注重點將是薪資通膨，隨著職位空缺減少，第四季度工資數據將放緩。市場預期今年可能會三次調降銀行存款利率，利率在年底達到 3.25% 左右。


完整文章請至
豐雲學堂
閱讀


延伸閱讀：


1. 
孫明德來啦！2024 年接下來總經怎麼看？孫主任告訴你


2.
【豐學 PRIME｜投資知識不再挑食】從總經、產業、個股、話題時事、到存股策略都幫你準備好，時間有限就看這些！


3.
【法人籌碼跟著走】透過投信動作，每天篩出 1~5 檔有價差潛力的公司，選股痛點一次幫你解決",2024-03-11 13:49:39,22168,無摘要,[],59292993-a411-44e0-998c-548a24c01835
〈台股盤後〉半導體雙雄下跌拖累收跌 留意OTC指數回穩收紅,"['鴻海', '台積電', '台股']","台股今 (11) 日在權值股台積電 (2330-TW) 及聯發科 (2454-TW) 走勢不振之下，全局震盪有加劇之勢，但盤中仍有鴻海 (2317-TW) 及金融股的力撑，收盤指數小跌 59.24 點或 0.3%，指數收在 19726.08 點，成交值 3976.39 億元，市場專家指出，台股在類股輪漲格局之下，台股將爲高檔震盪的格局。


而以中小型股爲主的 OTC 指數今天回穩，收盤指數上漲 1.2 點，指數報收 248.63 點，成交值爲 1157.28 億元。


台股集中市場大盤今日早盤開盤開在 19671.9 點，最高 19828.7 點，最低 19649.67 點，終場以 19305.31 點作收，收盤指數小跌 59.24 點或 0.3%，指數收在 19726.08 點，成交值萎縮爲 3976.39 億元。


權值股台積電、聯發科、聯電 (2303-TW) 下跌作收、鴻海 (2317-TW) 收漲，大立光 (3008-TW) 收漲 20 元或 0.8，收盤價報 2520 元，成交量萎縮爲 376 張。而高階 ABF 需求回升緩慢，ABF 類股欣興 (3037-TW)、景碩 (3189-TW) 及南電 (8046-TW) 今天股價同步收紅。


航運股長榮 (2603-TW)、陽明 (2609-TW) 及萬海 (2615-TW) 今天也同步收紅。


台積電今天開盤報 768 元，最低 761 元，最高 778 元，收在 766 元，下跌 18 元或 2.3%，成交量萎縮至 6.46 萬張。


在台積電等電子權值股拉高股價藉以大大墊高指數的格局不再出現後，證券分析師黃漢成說，目前台股集中市場加權股價指數 2 萬點的整數關卡在前，投資人風險可能偏高可能操作宜偏向保守，不要追高。",2024-03-11 14:17:13,22167,台股 10 日在權值股台積電 (2330-TW) 及聯發科 (2454-TW) 走勢不振之下，全局震盪有加劇之勢，但盤中仍有鴻海 (2317-TW) 及金融股的力撑，收盤指數小跌 59.24 點或 0.3%，指數收在 1972,"['台積電', '聯發科', '陽明', '長榮', '南電', '景碩', '欣興', '大立光', '聯電', '鴻海', '萬海']",84300769-8964-46d9-b655-e71c29c9405d
品牌手機去年Q4產量年增12% 蘋果全年2.23億支直逼三星,"['手機', 'AI', '研調']","研調機構 TrendForce 出具最新報告指出，2023 年第四季手機品牌為鞏固市占率、進行年末衝刺，全球智慧型手機產量達 3.37 億支，年增 12.1%；2023 全年產量約 11.66 億支，年減 2.1%，預期 2024 年 AI 手機將逐步普及。


各品牌表現方面，蘋果 (Apple) 受惠新機 iPhone 15 系列發表，去年第四季產量約 7850 萬支位居第一名，季增 58.6%；全年產量 2.23 億支，年減 4.2%。TrendForce 認為，由於蘋果與華為在中國內需高階客群市場重疊，面對華為捲土重來，未來在中國的銷售市場將面臨極大挑戰。


排名第二的三星 (Samsung) 去年第四季介於旗艦機銷售過渡期，故產量季減 11%，約 5350 萬支；全年產量 2.29 億支，年減 11.3%。值得注意的是，三星智慧型手機去年市占率下滑至 19.6%，儘管蟬聯市占首位，但與第二名的蘋果 (Apple) 的差距縮小至僅剩 0.5%。


小米 Xiaomi(含 Xiaomi、Redmi、POCO) 位居第三，去年第四季產量約 4310 萬支，季增 0.7%；全年產量 1.47 億支，年減 6.1%。Oppo(含 Oppo、Realme、OnePlus) 去年第四季產量約 4000 萬支，季增 3.4%，位居第四；全年產量 1.39 億支，年減 4.1%。


值得留意的是，季度、年度排名提升至全球第五的是 Transsion(傳音)(含 TECNO、Infinix、itel)，去年第四季產量約 2950 萬支，季增 11.3%，全年產量首度突破 9000 萬關卡，年增 46.3%。


TrendForce 分析，Transsion 的成長除了受惠通路庫存回補、產品跳脫低階框架，朝向多元發展外，還包含新開發市場如印度、南美等區域經營有成。


Vivo(含 Vivo、iQoo) 則位居第六，去年第四季產量 2550 萬支，季增 4.1%；全年產量 9350 萬支，年減 2.9%。TrendForce 表示，中國作為全球最大消費市場，如今面臨消費力低迷挑戰，加上華為復甦後積極搶食中國市占率，對於高度仰賴中國市場的智慧型手機品牌而言，將面臨更嚴苛的市場競爭。


展望 2024 年，TrendForce 指出，與 2023 年相較雖不復見通路庫存的壓力，但由於市場復甦情況仍待觀察，產業發展則聚焦 AI 應用，透過處理器大廠及品牌端的合作將加速 AI 賦能的智慧型手機逐步普及。",2024-03-11 14:38:57,22166,研調機構 TrendForce 出具最新報告指出，2023 年第四季手機品牌為鞏固市占率、進行年末衝刺，全球智慧型手機產量達 3.37 億支，年增 12.1%；2023 全年產量約 11.66 億支，年減 2.1%。,[],ec9e8556-987b-4560-a778-03095b22d857
