title,keywords,content,publish_at,id,summary,related_stocks,uuid
〈台股盤後〉跌62點收16682點 失守五日線周線連二紅,"['台股', '半導體', '生技']","受到美國聯準會 (Fed) 主席鮑爾態度偏鷹、美債殖利率走高影響，美股收黑，亞股全盤皆墨，台股今 (10) 日同步開低震盪，加上電子三雄疲軟，金融、傳產撐盤無力，指數失守 16700 點關卡、5 日線，終場收在 16682.67 點，下跌 62.98 點或 0.38%，成交量 2302.38 億元，日 K 線終止連七紅、周線連二紅。


電子權值股普遍疲軟，台積電 (2330-TW) 終場以平盤作收；聯發科 (2454-TW) 震盪走低，收在今日最低點 884 元，下跌逾 2%；鴻海也收黑，下跌約 0.7%；廣達、聯電、聯詠、研華等都表現疲軟。


半導體群族仍有零星點火，金麗科強漲 7%，安國、沛亨也有逾 3% 漲幅；穩懋、點序、全宇昕、中美晶、旺矽、普誠、欣銓、合晶等逆勢收盤上。另外，精元、迎廣、勤誠、倫飛、圓剛、神達等表現也不俗。


生技股上沖下洗，合一 (4743-TW) 開發糖尿病族足部傷口潰瘍新藥獲得中國認證，股價衝上漲停後賣壓出籠，終場翻黑下跌逾 4%，同集團的中天跌幅收斂，小漲作收。


飯店股漲勢整齊，寒舍亮燈漲停，富野拉出逾根停板、力麗店、洛碁、亞都都有 2-3% 漲幅；老爺知、遠雄來、第一店、雲品同步收紅；另外，觀光族群的五福飆漲逾 9%，燦星旅、富野、易飛網、山富、豆府表現也不俗。


傳產方面，中鋼 10 月自結稅前盈餘 8.23 億元，月增 60.2%、較去年同期轉盈，並對全年獲利「深具信心」，今日股價相對有撐，收漲 0.4%；其餘鋼鐵股世紀鋼勁揚逾 5%，運錩、盛餘、彰源、志聯表現抗跌。",2023-11-10 13:54:37,16746,受到美國聯準會 (Fed) 主席鮑爾態度偏鷹、美債殖利率走高影響，美股收黑，亞股全盤皆墨，台股今 (10) 日同步開低震盪，加上電子三雄疲軟，金融、傳產撐盤無力，指數失守 16700 點關卡、5 日線，終場收在 16682.76 點。,"['台積電', '聯發科', '合一']",048df6b8-6acf-4d47-9b9f-a3123fc96240
電金傳無力台股止步連七彈 三大法人賣超92.19億元,"['趨勢分析', '三大法人買賣超', '外資', '自營商', '籌碼', '投信']","台股今 (10) 日開低震盪，加上電子三雄疲軟，金融、傳產撐盤無力，指數失守 16700 點關卡、5 日線，終場收在 16682.67 點，下跌 62.98 點或 0.38%，成交量 2302.38 億元；三大法人合計賣超 92.19 億元。


觀察三大法人今天籌碼動向，外資賣超 66.86 億元；自營商賣超 31.24 億元；投信續挺台股買超 5.91 億元，為連 17 買；三大法人合計賣超 92.19 億元。",2023-11-10 15:03:56,16745,無摘要,[],b0e62669-6a59-4c08-8eb3-5e1db0561481
設備廠聯策科技Q3賺贏上半年 前三季每股純益1.02元,"['迅得', '臻鼎', '營收', '聯策', 'EPS', 'IPO']","PCB、半導體及智動化設備廠聯策科技 (6658-TW) 今 (10) 日公布最新財報，第三季純益超越上半年，單季稅後純益 1906 萬元，季增 80.45%，年減 48.87%，每股 0.63 元，前三季稅後純益 3064 萬元，每股純益 1.02 元。


聯策科技以科技類股申請上市獲准，包括迅得 (6438-TW)、臻鼎 - KY(4958-TW) 都是重要股東。


聯策第三季營收 3.8 億元，毛利率 25.37%，季增 3.41 個百分點，年增 3.06 個百分點，單季稅後純益 1906 萬元，季增 80.45%，年減 48.87%，每股 0.63 元。


聯策前三季營收 9.85 億元，毛利率 24.59%，年減 1.67 個百分點，前三季稅後純益 3064 萬元，年減 66.86%，每股純益 1.02 元。聯策認為，下半年業績將優於上半年，且在半導體及 PCB 產業推進智慧製造的有利環境下，明年可望再登高。


同時，聯策科技看好，台系 PCB 廠大量赴泰國、越南等國家設立新廠，最快 2024 年第四季起帶來需求。


聯策於 2002 年成立初期以設備代理，逐步發展自有技術雙向深耕，並聚焦於「AI 機器視覺應用」與「高階自動化智慧製造」做為營運發展主軸，目前主要三大產品線包括 AI 機器視覺設備、濕製程智慧化及生產智動化產品。",2023-11-10 15:49:25,16744,設備廠聯策科技 (6658-TW)， 今 (10) 日公布最新財報，2023 年第三季純益超越上半年，單季稅後純益 1906 萬元，季增 80.45%，年減 48.87%，每股 0.63 元，前三季 EPS1.02 元。,"['聯策', '迅得', '臻鼎-KY']",5769c572-6627-4f66-897a-183b0b005747
上銀清算子公司上銀光電 影響Q3每股純益0.98元,"['上銀', '光電', '太陽能']","上銀 (2049-TW) 今 (10) 日發布重大訊息指出，持股 89% 子公司上銀光電因面臨中國太陽能業者的低價競爭、原材料成本上漲等多項不利因素，為避免虧損持續擴大，擬決議依法解散、提列資產減損約 2.5 億元，將影響上銀第三季合併報表每股純益 0.98 元。


上銀光電考量許多外在不利因素，短期營運不會改善，並可能延續數年，為避免虧損持續擴大，上銀光電董事會今日決議擬依法解散，並在第三季財報中估列清算相關費用及損失 1.38 億元及提列資產減損損失 2.5 億元，合計 3.89 億元，並預計 11 月 27 日召開股東臨時會討論。上銀光電每年影響集團每股純益約 1-2 元。


另外，上銀光電考量經營型態改變，董事長卓永財、副董事長卓文恒即日起請辭職務、保留董事職務，新任董座由總經理林明堯兼任、副董事長則暫不補選。


上銀光電主要業務為研發及生產無鎘製程的銅銦鎵硒 (CIGS) 薄膜太陽能電池模組、太陽能屋瓦及太陽能外牆，產品具有最低溫度係數、抗遮蔭效果、弱光發電等特性，多年來運用 CIGS 優勢轉型至建築領域，開發出與傳統瓦片結合的太陽能屋瓦，並推出彩色太陽能屋瓦及立面型太陽能帷幕牆等建築整合產品。


不過，中國太陽能業者以低價大量傾銷歐洲導致售價崩跌，使許多歐洲太陽能業者陸續宣布停產或瀕臨破產，且受到產地、人力、通膨等影響，使 CIGS 生產成本上漲及原材料供應商相繼退場。",2023-11-10 15:50:26,16743,上銀 (2049-TW) 今 (10) 日發布重大訊息指出，持股 89% 子公司上銀光電因面臨中國太陽能業者的低價競爭、原材料成本上漲等多項不利因素，為避免虧損持續擴大，擬決議依法解散、提列資產減損約 2.5 億元。,['上銀'],51d69330-02b4-44ce-9e93-143c44aae14e
永續金融先行者聯盟首年成果豐 綠色採購總額近15億元,"['中信金', '永續金融先行者聯盟', '淨零']","金管會號召 5 家金控成立永續金融先行者聯盟，中信金 (
2891-TW
) 今年擔任輪值主席，今 (10) 日舉辦首屆成果發表會，據統計，去 (2022) 年綠色採購總金額將近新台幣 15 億元，較前一年成長  67%，透過投融資實際投入前瞻戰略經濟活動及國發會 2050 淨零排放路徑之關鍵戰略產業總金額超過 5800 億元。


金管會主委黃天牧親自出席致詞，他強調，金融市場最重要的資本就是信任，這需要靠金融機構一起經營出來，必須從領導、文化、社會溝通與承擔的責任，去顯現這個金融機構是值得被信任的，因此，財務業務合規合法、有做好風控內控是可以得到信任，但可以做得更好。


黃天牧引述《大失衡》(The Raging 2020s) 一書，他提及作者羅斯說「全球數十億人口是被企業治理，而不是國家」，作者期待企業要承擔更多公共責任。黃天牧同時肯定五家金控推動先行者聯盟，並在永續金融議題上提供了更多的公共財，也承擔了更多社會的期待跟角色，值得被大家有更多的信任。


中信金總經理陳佳文分享首年先行者聯盟成果，去年綠色採購總金額近新台幣 15 億元，較前一年成長  67%，透過投融資實際投入前瞻戰略經濟活動及國發會 2050 淨零排放路徑之關鍵戰略產業總金額超過 5800 億元，較前一年成長  24%。


陳佳文表示，先行者聯盟成員致力透過永續個人金融等面向，去年共推出 7 項新永續應用分析工具。


先行者聯盟成員分別為中信金、元大金、玉山金、第一金及國泰金。國泰金總經理李長庚致詞時指出，8 年以來綠色採購總額已超過 27 億元、近 3 年在地採購比例超過 95%，降低採購運輸過程的碳排放，並連續 13 年獲台北市政府「綠色採購績優企業」殊榮。",2023-11-10 16:04:51,16742,金管會號召 5 家金控成立永續金融先行者聯盟，中信金 (2891-TW) 今年擔任輪值主席，今 (10) 日舉辦首屆成果發表會，根據統計，去 (2022) 年綠色採購總金額近新台幣 15 億元，較前一年成長  67%,[],c26c8c23-f577-4dae-8411-4fabbca42c29
〈英業達法說〉Q3獲利季增34% 前三季每股賺1.16元,"['英業達', 'AI', '伺服器', 'NB']","代工大廠英業達 (2356-TW) 今 (10) 日召開第三季法說會，單季稅後純益 18.73 億，季增 34.7%，年增 7.1%，每股純益 0.52 元。前三季純益 41.44 億元，年減 13%，每股純益 1.16 元。 


英業達第三季營收 1358.41 億元，季增 4%，年減 4.6%。毛利率 5.2%，季增 0.6 個百分點，年增 0.1 個百分點。營益率 1.6%，季增 0.6 個百分點，年對年持平。稅後純益 18.73 億，季增 34.7%，年增 7.1%，每股純益 0.52 元。 


英業達前三季營收 3866.75 億，年減 5%，毛利率 4.9%，年增 0.25 個百分點，營益率 1.3%，與去年同期持平。稅後純益 41.44 億元，年減 13%，每股純益 1.16 元。 


展望第四季，英業達總經理蔡枝安表示，第四季較第三季微幅下修，預估 2023 全年營收個位數下降。不過明年第一季景氣逐步轉好，不論 NB、伺服器以及消費性電子產品都將回溫，預期 2024 年將比 2023 年好，甚至高於 2022 年。",2023-11-10 16:06:01,16741,代工大廠英業達 (2356-TW) 今 (10) 日召開第三季法說會，單季稅後純益 18.73 億，季增 34.7%，年增 7.1%，每股純益 0.52 元。前三季純益 41.44 億元，年減 13%，每股純益 1.16 元。,['英業達'],23d4fd63-c97f-4474-bcaf-2272676598d7
大盤再攻條件有哪些？合一、中天出貨量如何解讀？,"['趨勢分析', '摩爾投顧', '陳冠廷', '合一', '中天']","大盤我們觀察到，從 6-7 月的壓力高點幾乎都有接近 5 千億的大量，但 11 月開始的反攻量只有 2 千多億。大盤要能成功克服 17500 的壓力，量勢必得提升上來，因為 6-7 月的套牢量若後續能解套，都將成為後面的賣盤，所以當大盤真的克服壓力後，不只得消化套牢的賣壓，還得有更大的追價量把盤往上拉升才行。


以目前結構看，大盤可能走緩步墊高，或回測 16100 支撐打第二支腳後再往上攻，所以大盤適度回檔是合理的，可能性最低的走法是一路直直衝過壓力，除非有什麼天大的利多好消息。


合一 (4743-TW)、中天(4128-TW) 今天盤中一度攻到漲停板，但中場漲停打開大幅下殺，合一收黑大跌 4.3%，中天漲幅收斂剩小漲不到 1%，這樣的價量關係短線看可以解讀成出貨量，因為兩檔今天都出現近期的大量，而且價格從漲停摔下來，代表有大量的買盤，但價格卻無法收在高點，表示賣出的力量壓制了買方力量。


接收個股分析和免費盤後訊息，請加入 line 粉絲團成為好友。


台股鈔能力 - 陳冠廷分析師 
https://lin.ee/6rOzncL


更完整分析歡迎收看 11/10 盤後節目


https://youtu.be/s6qm_2xaIpw










文章來源: 摩爾投顧 - 陳冠廷分析師


本公司所推薦分析之個別有價證券 無不當之財務利益關係 以往之績效不保證未來獲利 投資人應獨立判斷 審慎評估並自負投資風險",2023-11-10 16:07:28,16740,無摘要,"['合一', '中天']",73742d13-69d6-4780-8df2-f53232802cb7
〈成電論壇〉第三屆登場 五位重量級校友探討生成式AI發展趨勢,"['成電論壇', '旺宏', '華邦電', '華碩', '東台', '奇景', '南茂']","國立成功大學第三屆成電論壇今 (10) 日登場，本屆主題為「生成式 AI」，今年邀請五位畢業系校友蒞臨，包含東台精機 (4526-TW) 董事長嚴瑞雄、華碩 (2357-TW) 執行長胡書賓、華邦電 (2344-TW) 總經理陳沛銘、奇景光電 (HIMX-US) 副總陳有棟、耐能智慧創辦人暨執行長劉峻誠，分別就 AI 驅動智慧製造、生成式 AI 的發展應用與未來進行分享與探討。


成大校長沈孟儒重視不斷學習新知，全程參與論壇活動，並表示，跟校友見面就像家族再度重新聚會般溫馨熱鬧，感謝畢業校友在各行各業的努力，讓世界看見成大。成大連續 9 年都是企業最愛，來自於團隊合作、人際溝通、學習意願、具韌性等特質，目前學校正在翻轉，邀請大家一起，共同讓學校愈來愈好。


成大電機系友會理事長暨旺宏 (2337-TW) 電子董事長吳敏求表示，自擔任理事長以來，3 年前首次推動「成電論壇」，探討前瞻科技趨勢，讓師生與產業界近距離對話，激盪創意的火花。未來將規劃設置青年教授講座，每位講座每年提供 100 萬元獎勵，延攬傑出優秀的國內外年輕教授人才於成大任教，教授新知與傳承經驗，提升台灣科技整體的創新動能。


第一屆成電論壇探討 IC 產業發展與佈局，第二屆則著墨電動車產業的發展與第三類半導體 SiC 在電動車產業的應用。今年則以引發改變世界熱潮的「生成式 AI」為論壇主軸，關注 AI 快速發展推動科技再一次進步創新的未來趨勢。


東台精機董事長嚴瑞雄以「AI 驅動的智慧製造」為題，敘述生成式 AI 的出現，讓 AI 技術能在區分和理解數據上創造出新的解決方案和創意，解決智慧製造少量多樣的挑戰，大幅加速 AI 導入的時程。讓生成式 AI 與現有 AI 的結合，拓寬智慧製造的應用範疇，也定義新的發展方向。相信生成式 AI 將繼續推動智慧製造技術的創新和進步，讓大家共同邁向製造者的桃花源。


華碩共同執行長胡書賓以「生成式 AI 的發展、應用及生態系」為主題，透過簡單易懂的譬喻，為現場帶來有關 AI 演進、產業鏈生態系、大型語言模型等宏觀面分享。她提到，過去 AI 1.0 可以解決是非題、選擇題，現在 AI2.0 生成式 AI 可以解決申論題，應用層面更廣。


胡書賓也以台智雲為例，這是國科會在 2018 年投入 50 億建置可用於模型訓練的 AI 超級電腦為基礎的超算力雲服務公司，今年 5 月便推出利用 2000 億個文字與近百萬的訓練樣本所做出的福爾摩沙大語言模型，提供台灣各產業發展生成式 AI 重要關鍵的基礎建設。


胡書賓強調，生成式 AI 驅動知識生成、應用、生產力創造的典範轉移，台灣產業鏈具有競爭力，應擁抱生成式 AI 帶來的未來契機，推動台灣成為亞洲 AI 生態系強國，創造另一護國神山。


華邦電總經理陳沛銘以「Memory for AI」主題分享，看好 AI 對記憶體是一個充滿挑戰但也充滿機會的領域，期待記憶體技術能為 AI 領域未來描繪出更加輝煌的前景。


以技術面而言，AI 模型中，特別是大型的語言模型如 ChatGPT，需要大量的記憶體來處理龐大的參數作訓練，傳統記憶體技術已顯現瓶頸。為滿足 AI 模型的龐大需求，記憶體必須進一步革新的趨勢。


伴隨 AI 技術普及，Edge AI 應用也逐漸蓬勃發展。記憶體需配合其應用特性架構開發特殊的創新技術，例如：發展高效能、高頻寬、低延遲、低耗電的記憶體，以及利用 3D 堆疊技術增加記憶體容量及頻寬等技術創新，也是未來關注的重點。


奇景光電副總陳有棟以「微型機器學習 (TinyML) 發展及應用」為現場帶來不同的 AI 應用實例。他提到，未來 10 年人工智慧運算會從「雲端」到「邊緣端」蓬勃發展，而 TinyML (微型機器學習) 技術將人工智慧運算推向設備的最終端，結合感測器和嵌入式系統在終端以極低功耗，低成本，低延遲完成邊緣機器學習運算，對於物聯網，穿戴式設備，智慧家居，智慧健康監控和工業自動化等應用都帶來突破性的發展。


不過，微型機器學習也必須同時克服工程面的硬體設計，機器學習算法優化，開源工具鏈整合等問題，及商務模式上應用碎片化等問題，以奇景光電 WiseEye 平台為實例，透過整合低功耗影像感測器及終端人工智慧處理器，如何克服這些工程與商務的困難，並提出結合 TinyML 生態圈的未來發展方向。


耐能智慧執行長劉峻誠以「個人化 GPT：未來在終端」進行分享，並在現場展示沒有連接網際網路的「私有化 GPT」，舉凡搜尋世界名人相關資料、語言翻譯或寫程式等該 GPT 的回覆時間都很即時，隨後他更強調這些技術小型電路就能實現，而且沒有風扇、可以像積木一樣堆疊，符合各式市場需求，引發現場諸多好奇。


劉峻誠提到，考慮到運行 ChatGPT 所需的 GPU 計算資源可能導致碳排放增加和成本上升，這對實現 AI 的民主性構成挑戰。終端算力 NPU 可同時解決延遲和隱私揭露問題，通過在邊緣運行 AI 演算法，實現最小延遲，成本效益顯著。


今年是成大電機系創系 92 週年，現任系主任江孟學教授表示，感謝成電文教基金會系友支持捐助母系，持續籌辦三屆成電論壇活動，今年第三棟大樓啟端館正式啟用，設立崇華講堂、OpenLab，加上半導體學院團隊進駐，結合敏求智慧運算學院與電資學院資源，讓電機系師生有更充裕的研究環境與空間，電機系為一系多所的大電機學群，目前教師 79 名、學生人數共 1800 多名，每名教師平均研究經費每年約為新台幣 400 多萬元。


感謝創惟科技王國肇學長捐助高額 400 萬之大學申請入學獎學金及每年 100 萬之教授論文獎勵、達爾集團盧克修學長捐助高額 300 萬獎學金予電機系普渡雙聯組分科測驗入學成績優異者，亦贊助成大 Nova 辰星計畫 2 萬美元出國獎學金，以及各級系友們持續捐助之各項獎學金讓成大學弟妹在學習環境上擁有更多豐沛資源，藉以鼓勵學弟妹培養個人軟硬實力、提升遠見、拓展國際視野。


同日於電機系館 1 樓舉辦「創新系統應用與設計成果展示」，邀請電機系前一年度全國性校內外獲獎作品或執行計畫金額單年達 1500 萬以上經費之國家計畫團隊共同參與展示，共計 8 組團隊參展，領域多元，包含高綠能占比多重微電網區塊鏈調度平台、街路等級調整率 AI 自動評估系統、物聯網微處理器系統、AI 智慧投資、血氧影像分析預測系統、心臟疾病診斷晶片系統、非接觸式液滴噴射系統、元宇宙之生成虛擬代理人臉與同步互動等。


第三屆成電論壇與創新系統應用與設計成果展示，由成大電機系與成電文教基金會主辦，旺宏電子、南茂科技、佳世達科技、耐能智慧等公司協辦，藉由成電論壇講者分享與創新系統應用與設計成果展示之活動，提升成大電機系優質研究能力與加深學術與產業界的互動及交流。",2023-11-10 16:21:08,16739,國立成功大學第三屆成電論壇今 (10) 日登場，本屆主題為「生成式 AI」，今年邀請五位畢業系校友蒞臨，包含東台精機 (4526-TW) 董事長嚴瑞雄、華碩 (2357-TW) 執行長胡書賓、華邦電 (2344-TW) 總經理陳沛銘、奇景,"['東台', '華碩', '華邦電', '旺宏', '奇景光電']",5385eb6d-9e72-42ee-86fa-a83bb94e9c85
圓裕前三季每股純益2.56元 軟板廠中獲利僅次台郡,"['軟板', '欣興', '旭軟', '圓裕', '嘉聯益', '台郡']","軟板廠圓裕 (6835-TW) 隨著客戶庫存逐漸回到正常水位，各產品出貨亦逐步穩定，營運表現也逐季回升，圓裕今 (10) 日公布最新財報，2023 年第三季稅後純益 8132 萬元，季增 61.86%，年減 25.47%，每股 1.23 元，2023 年前三季稅後純益 1.69 億元，年減 30.92%，每股純益 2.56 元。


就已公布 2023 年前三季獲利成績單的軟板廠而言，圓裕仍爲獲利前段班，其中台郡 (6269-TW) 今年前三季台郡稅後純益達 14.36 億元，年減 51.8%，每股純益 4.49 元，旭軟 (3390-TW) 稅後純益 8543 萬元，每股純益 1.24 元；同泰 (3321-TW)、嘉聯益 (6153-TW) 都屬虧損，其中並以嘉聯益 2023 年前三季虧損 28.64 億元，每股虧損 5.17 元最嚴重。


同時，嘉聯益爲償還銀行借款，擬辦理發行 4 萬張的現增股進行公開市場籌資。


今天圓裕並公布 2023 年 10 月營收 1.84 億元，月減 3.03%，年減 8.56%，2023 年 10 月營收 18.09 億元，年減 22.45%。


圓裕 2023 年第三季營收 5.97 億元，毛利率 28.41%，季增 4.41 個百分點，年增 4.43 個百分點，第三季稅後純益 8132 萬元，季增 61.86%，年減 25.47%，每股 1.23 元。


2023 年前三季營收 16.24 億元，毛利率 26.52%，年增 5.34 個百分點，前三季稅後純益 1.69 億元，年減 30.92%，每股純益 2.56 元。


圓裕產品高度客製化，仍難以避免客戶去化庫存的影響，不過今年即使面對出貨量減少，公司仍致力於優化產品組合，保持毛利率水準。

 

圓裕表示，公司長期專注在高技術門檻市場穩健經營，目前軍工規、商用、消費性電子產品出貨穩定，第三季獲利已經接近上半年，下半年表現將優於上半年。展望明年，終端需求尚未明顯復甦，公司仍持保守看法，不過保守中仍有正向期待，研調機構普遍預期明年全球 NB 將呈現溫和成長，預期圓裕商用型、消費型筆電產品也將受惠。",2023-11-10 16:36:29,16738,軟板廠圓裕 (6835-TW) 今 (10) 日公布最新財報，2023 年第三季稅後純益 8132 萬元，季增 61.86%，年減 25.47%，每股 1.23 元，2023 年前三季稅後純益 1.69 億元，年減 30.92%，每股純益 2.56 元。,"['台郡', '旭軟', '同泰', '嘉聯益', '圓裕', '圓裕']",86fffd7c-3095-4117-82b2-b9e347792eda
〈敦泰法說〉Q3獲利攀一年半高點 前三季EPS 1.37元,"['敦泰', '驅動IC', '獲利', '本業', '業外挹注']","驅動 IC 業者敦泰 (3545-TW) 今 (10) 日召開法說會，並公告第三季財報，受惠業外挹注，加上本業相對穩定，稅後純益 1.27 億元，季增 20.85%，較去年同期轉盈，每股稅後純益 0.61 元，雙雙改寫一年半高點，前三季合計 1.37 元。


敦泰第三季營收 35.98 億元，季增 15.62%，年增 51.81%，毛利率 19.62%，季減 0.88 個百分點，較去年同期轉正，營益率 0.36%，季減 0.79 個百分點，較去年同期轉正，稅後純益 1.27 億元，季增 20.85%，較去年同期轉盈，每股稅後純益 0.61 元。


敦泰前三季營收 99.36 億元，年增 3.61%，毛利率 19.64%， 年增 12.66 個百分點，營益率 0.86%，較去年同期轉正，稅後純益 2.84 億元，較去年同期轉盈，每股稅後純益 1.37 元。


針對庫存，隨著面板客戶持續去化，加上手機需求回溫，敦泰第三季底存貨淨額降至 32.98 億元，季減 8.2%，年減 53.32%。",2023-11-10 16:39:19,16737,驅動 IC 業者敦泰 (3545-TW) 今 (10) 日召開法說會，並公告第三季財報，受惠業外挹注，加上本業相對穩定，稅後純益 1.27 億元，季增 20.85%，較去年同期轉盈，每股稅後純益 0.61 元，雙雙改寫一年半高點，前三季合計 1,['敦泰'],7cc69078-1e52-4001-a7b2-a2c7c0d9e83a
陽明Q3成功轉盈 前三季獲利逾60億元,"['陽明', '海運', '貨櫃', '運價']","貨櫃航商陽明 (2609-TW) 今 (10) 日公告第三季財報，單季稅後純益 28.07 億元，較上季成功轉虧為盈，年減約 94%，每股純益(EPS)0.8 元，前三季稅後純益 60.78 億元，年減約 96%，EPS 1.74 元；不過，陽明仍示警，海運市況持續面臨供過於求的挑戰。


據法國海運諮詢機構 Alphaliner 統計，截至 10 月 23 日，全球約有 4.7% 貨櫃船隊 (近 129 萬 TEUS) 處閒置狀態，閒置船舶運力 (含船舶塢修) 有逐步上升趨勢，但供給未明顯縮減，主要因新造船持續交付。


進入第四季後，陽明甫公布 10 月合併營收 113.02 億元，月減 7.42%，年減 52.89%，為連 2 月衰退，反映中國十一長假貨量減少且運價下跌；累計前 10 月，陽明合併營收 1192.03 億元，年減 64.94%。


據 Alphaliner 供需最新預測，今年供給成長為 8.4%，需求成長為 1.4%，即便進入 2024 年，供給成長上增至 9.1%，需求成長僅 2.2%，亦即供過於求的壓力短期間內，無法減緩。


陽明直指，未來全球經濟前景具不確定性，尤其第四季至明年第一季為海運傳統淡季，而供需成長持續存在差距，航運市場仍處挑戰狀態。",2023-11-10 16:40:47,16736,陽明 Q3 成功轉盈 前三季獲利逾 60 億元,['陽明'],edc12770-d4f4-40e7-a445-5987e1057c96
