title,keywords,content,publish_at,id,summary,related_stocks,uuid
台灣大哥大連續7年蟬聯DJSI世界指數 全球電信業前三名,"['台灣大', 'djsi', '電信', 'ESG共同推動']","2023 年「道瓊永續指數」(Dow Jones Sustainability Indices，以下簡稱 DJSI) 於 9 日凌晨公布最新評選結果，台灣大哥大 (3045-TW) 連續第 7 年入選 DJSI「世界指數」(DJSI World)，位列全球電信業前三名，同時連續第 12 年名列「新興市場指數」(DJSI Emerging Markets)。今年 (2023 年) 入選 DJSI 「世界指數」的台灣企業有 30 家；入選「新興市場指數」則有 29 家企業。


在全球 166 家電信業者當中，台灣大哥大在治理、環境、社會三面向，總計 106 項子題中，16 項指標獲全球電信產業最優成績，14 項題組獲得滿分。滿分題組包含：治理面向的「董事獨立性」(Board Independence)、環境面向「零毀林承諾」(No Deforestation Commitment) 、「雲端機房再生能用使用比率」(Share of Renewable Energy in Data Centers)、社會面向的「隱私政策: 程序與管理系統」(Privacy Policy: Systems/ Procedures) 等，其中「零毀林承諾」與「生物多樣性承諾」(Biodiversity Commitment) 績效大幅躍進，居全球電信產業之冠。


在台灣電信產業積極整併，重新邁入「電信三雄」的關鍵時刻，台灣大哥大再度入選 DJSI 世界指數，董事長蔡明忠表示，今年兩大電信合併案，台灣大合併台灣之星最能發揮減碳綜效、減緩地球暖化；合併後短短不到一週內，5G 台灣隊已關閉原台灣之星 3G 基地台設備，落實節能減碳和汰停設備之承諾；未來隨著 4G、5G 無線網路整合作業逐站進行，雙邊網路陸續接通後，將 5G 的四條高速公路關掉一條，可減少一套基礎設施用電，每年將省下高達 1- 2 億度電。


蔡明忠董事長進一步提出「生物多樣性流失」(Biodiversity loss) 這一項新興風險。指出地球每升溫 1 度，物種滅絕風險就隨之提高。生物多樣性的流失將削弱大自然的調適能力，引發極端氣候事件，衝擊生態系統，最終將危及人類生存。為了保護生物多樣性，台灣大將持續落實低碳營運，並於 2040 年投資百億布局綠電，與中研院攜手開發新型潔淨能源，更將前瞻導入「自然相關財務揭露」The Taskforce on Nature-related Financial Disclosures，以下簡稱 TNFD)，承諾於 2050 年實現生物多樣性淨正向衝擊 (Net Positive Impact)，同時終止任何形式的毀林行為 (No Gross Deforestation)。台灣大將積極推動山林溼地保育，擴增自然碳匯，將資通訊核心專業結合永續思維，以「價值創造」為核心，為地球創造永續生命力。


大步邁向淨零目標，台灣大哥大以提高綠電占比、落實低碳營運、開發新型潔淨能源，3 大策略在 DJSI 再生能源題組也獲得最高肯定。台灣大哥大總經理林之晨表示，氣候變遷日益嚴重，2023 年已成史上最熱的一年，企業實施減碳行動刻不容緩。台灣大以「台灣大綠能、永續大未來」為主軸，於 2018 年即領先業界導入 TCFD 框架，2023 年召開三場 TCFD 工作坊，發表首本「氣候相關財務揭露報告書 (Task Force on Climate-Related Financial Disclosures Report)」(TCFD 報告書)，是亞洲第一個通過 SBTi 2050 淨零排放路徑 (Net-zero) 的電信業者。同時，全面擴展綠能布局，初期以太陽光電為主，中期轉為風電，目標 2030 年再生能源比率達 35%、2035 年使用再生能源比率達 60%，並承諾 2040 年百分百使用再生能源，藉由綠能倡議吸引更多企業共同響應，加速實現台灣淨零排放目標。


完善的公司治理是企業經營的基石，董事會是經營管理核心，獨立董事則是強化管理的重要推手。台灣大哥大不僅率先施行董事會獨立董事過半，善盡監督之責。此外，將「永續發展委員會」提升為董事會層級，由董事長及五位獨立董事擔任委員；同時攜手供應商，打造永續供應鏈，2023 年導入 ISO 20400 永續採購框架，並透過實地審查，再輔以教育訓練，助力供應商接軌國際永續標準，也積極推動綠色採購，由內而外落實減碳。


社會面部分，台灣大結合科技力，主動投入社會參與，加入反詐行列，運用強大資料庫、AI 模型辨識等資通訊核心能力，率先建構完整反詐生態圈，推出偵測偽冒網站的「反詐戰警」、隱碼服務「安心 Call」兩大反詐利器，並配合政府推動國際來電 (+886 9) 語音警示、111 政府專屬短碼簡訊平


連續 7 年推動創新綠能公益專案「種福電」，串連供應商、消費者等利害關係人，推動綠能倡議，累計參與捐款總人次破萬，實募金額達 3,365 萬元，累計建置 607 kW 太陽能系統，預估 20 年累積收益可達 8,315 萬元及產生 1,290 萬度綠電，減碳效益超過 6,768 公噸。台灣大更承諾加碼採購等量綠電，倍增減碳效益，用實際行動為地球節能減碳。


道瓊公司於 1999 年推出「道瓊永續指數」(Dow Jones Sustainability Indexes，DJSI)，是全世界第一個永續指數。該指數 DJSI 以投資角度評估企業之 ESG(環境、社會、公司治理) 成效，提供全球投資人衡量企業績效，也幫助企業吸引志同道合的負責任投資者，共同實現永續發展。",2023-12-10 08:56:23,18058,台灣大哥大 (3045-TW) 連續第 7 年入選 DJSI「世界指數」(DJSI World)，位列全球電信業前三名。,['台灣大'],533daecb-f68b-4e09-80b6-380b7b728fbc
台灣永續之光！遠傳DJSI拿下全球電信業第一,"['遠傳', 'ESG', 'djsi', '電信']","遠傳電信 (4904-TW)ESG(環境、社會、公司治理) 永續績效再創佳績，榮獲全球指標性評比肯定！道瓊永續指數 (Dow Jones Sustainability Index, DJSI) 美國時間８日公布評選結果，遠傳 91 分佳績居台灣電信業第一高分，並連續 5 年入選最高等級「道瓊永續世界指數 (DJSI World)」成分股，分數排名在該指數第一。


遠傳同時也連續 8 年名列「道瓊永續新興市場指數 DJSI Emerging Markets」成分股，世界第二。遠傳在 24 項評選面向中，共獲得 10 項全球電信業最高分，顯示遠傳長期投入永續發展深獲國際肯定。


遠傳總經理井琪表示，很高興遠傳能獲得國際級永續評比台灣電信業第一高分的肯定，拿下世界指數全球第一的好成績，這是遠傳攜手員工、供應商、企業夥伴、客戶等利害關係人一起努力擴大永續影響力的共同成果。然而，永續的道路既艱且長，遠傳希望能和產業先進多多學習互相合作，攜手積極節能減碳，減少地球氣候災難，同時打造無距、共融、共好的社會。


DJSI 為全球最權威與最具公信力的永續評比，每年就 ESG 三大面向評估全球知名企業永續發展績效，其中競爭最激烈的「世界指數」(DJSI World) 從全球約 2500 間在永續發展居領導地位的企業中，挑選該產業前 10% 列為世界指數成分股，遠傳不但從眾多企業中脫穎而出入選世界指數，排名第一，更在 10 項指標獲滿分或最高分，包含「風險與危機管理」、「稅務策略」、「創新管理」、「環境政策與管理」、「廢棄物管理」、「水資源管理」、「人權」、「利害關係人議和」滿分、更在「氣候策略」、「生物多樣性」面向上獲得電信產業最高分，為歷年成績最佳！


遠傳長年投入 ESG，將 ESG 融入企業營運，推動永續發展由內而外。一方面以科技落實自身低碳營運，對外也以綠色資通訊解決方案協助企業、政府機關推動淨零、數位雙轉型。在環境面向，遠傳在今年初率先通過科學基礎目標倡議組織 (Science-Based Targets initiative, SBTi) 審查，為全台首家將目標控制在近程 1.5℃升溫情境的電信業者，遠傳也承諾在 2048 年達到淨零排放。


同時，遠傳加入國際再生能源倡議組織 RE100，目標在 2030 年前辦公室、門市及主要機房全面使用再生能源，2040 年全公司 100% 使用再生能源。遠傳也攜手供應商共同降低氣候變遷風險，CDP 供應商氣候變遷議合的管理績效名列全球企業前 8%(領導等級)。15 日與亞太合併後，將整併雙方基地台，搭配遠傳自行開發的 AI 節電技術與能源管理系統，達成網路更綿密、偏鄉涵蓋更廣的同時，每年用電還可省 8,600 萬瓩，減碳 43,000 噸，相當於 110 座大安森林公園碳吸納量。


遠傳在社會永續上以「打造無距共融社會」為主軸，對內積極建置多元、平等、共融的職場環境，不僅提供員工身心方面的照顧、提供彈性工時及在家工作的選擇，也透過內外部教育訓練，培養員工未來職場能力。


同時，每年兩次進行員工 eNPS 淨推薦指數調查，蒐集員工反饋並在當年完成改善事項，是認真傾聽員工心聲的幸福企業。對外持續推動數位平權，將偏鄉網路涵蓋率提升至 98%；遠傳更運用大人物 (大數據、人工智慧、物連網) 技術，建立全台第一個「AI 預測詐騙自動偵測系統」，成功減少詐騙電話、簡訊逾九成，更推出「遠傳守護網」阻斷惡意程式，為網路端提供安全偵測高達 51 億次，訂閱用戶已突破 30 萬，將安心上網的權力還給大眾。


遠傳堪稱公司治理的模範生，連續 9 年名列台灣證交所公司治理評鑑前 5% 最高榮耀，今年也獲得「國家永續發展獎」、天下永續公民獎大型企業組第四名，名列電信業第一、更六度獲得「台灣永續獎」(Taiwan Corporate Sustainability Awards, TCSA)「十大永續典範企業獎」等多項國內外永續評比獎項肯定。未來遠傳將持續善用核心技術推動永續，落實永續發展目標，發揮企業影響力，實踐企業社會責任。",2023-12-10 08:57:27,18057,遠傳電信 (4904-TW)ESG(環境、社會、公司治理) 永續績效再創佳績，榮獲全球指標性評比肯定！,['遠傳'],a6768cd4-b322-49e6-b351-9392532d695e
中華電信蟬聯入選道瓊永續世界指數 名列全球電信業第一,"['中華電信', 'esg', 'djsi', '電信']","美國標準普爾道瓊指數公司 (S&P Dow Jones Indices) 與瑞士永續集團 (RobecoSAM) 公布中華電信 (2412-TW) 為 2023 年道瓊永續指數 (Dow Jones Sustainability Index，DJSI) 世界成分股，名列全球電信業受評公司第一名，並連續 12 年入選新興市場成分股，穩居國際級產業領導者地位，顯現於 ESG 治理各方面表現成效卓著，獲得國際肯定。


DJSI 為全球第一個永續發展指數，也是全球最知名及權威之一的永續評比。今年中華電信蟬聯入選 DJSI 世界成分股，更名列全球電信業受評公司第一名，在 ESG 25 項評比指標中，永續揭露透明度、商業道德、稅務政策、資安治理、創新管理、環境治理政策、溫室氣體排放量、能源使用政策、人權治理、職安衛生管理、隱私權保護與利益關係人議和共 12 項指標均獲滿分；所有 100 條評比項目中，67 條勇奪滿分，是全球電信通訊服務產業最高分。


其中，環境面不僅積極參與國際組織、響應國際減碳及生物多樣性的倡議，並利用科技力輔以使用再生能源、淨零減碳，各項作為廣獲肯定；社會面則持續累積、擴大正面社會影響力、創新制度完善照顧同仁；以及不斷精進的誠信透明公司治理，在在獲得 ESG 全方位的肯定。


郭水義董事長表示，中華電信 ESG 表現成功接軌聯合國永續發展目標 (SDGs)，以 ICT 核心實力做為起點，連線低碳環境、社會發展、公司治理議題，全方面實踐「誠信為本、客戶信賴、創新創價和承諾當責」四大價值觀，運用客戶夥伴、科技平台、基礎網路和組織人才四個核心資產與資源，打造客戶信賴的數位生態系統，為客戶、策略夥伴、股東以及員工創造價值。


郭水義董事長指出，面對全球環境惡化加劇，中華電信積極響應國際倡議，將環境議題融入企業營運及管理中，承諾於 2030 年達成生物多樣性的淨正向影響 (Net Positive Impact, NPI) 與實現無淨毀林 (No Net Deforestation, NND) 目標，持續投入資源進行森林復育，規劃擴大全台植樹及保育造林 8 年 15 萬棵，具體落實聯合國《2020 年後全球生物多樣性框架》，以達成 2030 年『扭轉生物多樣性流失』里程碑與 2050 年『人與自然和諧共存願景』」。


中華電信總經理林昭陽表示，中華電信為全球再生能源倡議 RE100 的重要成員，並通過國際氣候變遷權威組織 - 科學基礎減碳目標倡議 (SBTi) 溫室氣體近程減量目標驗證，具體承諾 2030 年達到 IDC 全面採用再生能源、2040 年達到全公司 100% 使用再生能源、2050 年前達成全面淨零排放目標；並且率先同業實施內部碳費機制，積極推動低碳營運；同時引進低耗能設備、進行電信設備集中整併與汰換、優化行動網路架構、關閉 3G 基地台以達智慧節電，將節電減碳納入年度 KPI；今年更舉辦首屆「供應商 ESG 綠金工作坊」，帶領供應商夥伴接軌 ESG 邁向永續低碳轉型，具體承諾並努力達成淨零排放之企業願景。


郭水義董事長表示，中華電信長期厚植組織及人才資產，員工是企業經營最重要的資產，員工家庭生活幸福美滿，是成就公司永續經營發展重要的動能，因此，中華電信致力落實員工及其家庭照顧，鼓勵員工兼顧工作與家庭生活。例如 2022 年推出全台首創育兒減少工時制度，家有 3 歲以下幼兒的員工可申請每日減少 1 小時工時（不扣薪），受到員工熱烈迴響，公司將於 2024 年起擴大實施，放寬育有 6 歲以下幼兒之員工皆可申請。


2024 年起所有員工還將定額加薪、7 月起再加給伙食津貼，長期以來積極建構多元、包容、友善的職場環境，從員工的旅遊補助、休假補助、體育活動費、全國各地會館，到擴及員工家庭的關懷、福利，如集團結婚、生育補助、0~6 歲子女托兒津貼，子女教育補助依學制補助、持股信託獎勵金等。此外，2024 年將推出「增給持股信託獎勵金」留才方案，提供多元選擇，增給部分除採持股信託者，亦可選擇福利儲蓄信託方案。


公司並於六都設立 9 處、16 班職場互助教保服務中心，收托滿 2 至 6 歲幼兒，體貼員工的幼托需求；爸爸媽媽在樓上上班，幼兒在樓下上學，大手拉小手，上班上學一起走，除了便利，也讓幼兒安心，爸媽放心。


中華電信以行動呼應聯合國永續發展目標之 SDG4 優質教育及 SDG10 減少不平等，深耕偏鄉教育推廣十餘載。鼓勵多用網路少用馬路，推動伴您好讀社區網路課輔服務，累積逾 11.5 萬個小時教學時數，協助偏鄉學童透過網路學習，縮短教育落差、順利翻轉人生；並與誠致教育基金會合作，針對花蓮、台東等偏鄉國中小，建構雲端平台，讓教師跨校共備、共享教學資源。讓學生跨校共課，打造雲端教室來解決偏鄉師資流失問題，縮短城鄉教育落差，落實偏鄉數位平權。


中華電信更擴大對弱勢族群的數位賦能作為，透過舉辦「iPhone 助盲系列課程與二手 iPhone 手機捐贈」，幫助視障朋友學習使用手機 App 感受智慧生活，並致贈手機，讓視障朋友真正能於日常生活中享受科技帶來智慧生活的便利，「內化、共好」是中華電信對自我的期許，今年公司將策略委員會及永續發展委員會整合為永續發展暨策略委員會，並提升至董事會功能性委員會層級，進一步擴大董事參與重要 ESG 及風險管理議題；並將高階主管變動薪酬連結 ESG 目標，加大力道，從上到下將 ESG 內化為企業 DNA。


郭水義董事長表示，未來將持續與環境、社會及利益關係人共榮共好，致力數位轉型與淨零轉型，深化 ESG 永續作為，透過訂定各項 ESG 績效目標及積極落實行動方案，發揮企業永續發展影響力，實現以永續發展為基礎的國際標竿企業、數位生態系統賦能者的領導品牌，以及遠遠超越兆元市值的頂尖科技企業集團的願景，並以「綠化低碳、數位賦能、誠信透明」的永續願景，為人類、國家、社會的永續發展貢獻心力！",2023-12-10 08:58:38,18056,中華電信為 2023 年道瓊永續指數 (Dow Jones Sustainability Index，DJSI) 世界成分股，名列全球電信業受評公司第一名，並連續 12 年入選新興市場成分股。,['中華電'],f326b3b1-0d45-4d56-9010-9c8074bf6d35
出口連12衰，台灣撐過今年貿易「猛烈撞牆」...2024年GDP可保3「撥雲見日的一年」仍藏2大風險,"['今周刊', '出口', 'GDP', '2024經濟展望']","撰文 ‧ 今周刊編輯團隊


過去一年，「高通膨」是全球經濟的主旋律；然而，隨著歐美央行升息循環告一段落，這場持續近 2 年的抗通膨之戰，似乎也到了收尾階段。


通膨落下、利率在高位徘徊，主要央行貨幣政策即將轉向……，「撥雲見日」之後，2024 年的全球經濟，也將呈現出另一番新的光景。


以台灣來說，在經歷出口連續 12 個月衰退、外銷訂單萎縮，庫存大量累積等衝擊，年中以來，各家預測機構不斷下修台灣今年經濟成長數字。在不少國人眼中，2023 年可謂台灣貿易「猛烈撞牆」的一年。


但，隨著時序邁入年底，出口於 9 月重回正成長，台灣經濟否極泰來的曙光，已漸漸閃現。


「2024 年會比今年好上不少。」台經院研究六所所長吳孟道指出，台灣經濟有望脫離今年力圖「保一」的泥淖，重新回到 3% 的中度成長區間。


吳孟道解釋，從投資面看，目前庫存已逐漸回到正常水準，加之廠商先前遞延的投資將於 2024 年逐步落實，而「淨零排放」目標將加快綠色投資；從消費面看，則來自明年基本工資與軍公教員工的薪資調升，以及每人基本生活費免稅額的調整，推升民眾可支配所得；從出口面看，則是有望受惠於全球商品需求的復甦。


呼應吳孟道的說法，富邦金控首席經濟學家羅瑋接受本刊訪問時亦認為，在資通訊產品出口已恢復正成長、民間投資力道有望回溫至 2022 年上半年的背景下，明年台灣的經濟成長率「保三」應無大礙。


但羅瑋也提醒，展望 2024 年，全球經濟仍有幾大風險值得關注，若相關風險未能妥善應對，加上製造業復甦動能假設未如預期，全球經濟在最糟情境下，不排除出現「同步停滯」的景況。


第一個風險，是全球利率「高原期」過長。羅瑋觀察，若主要央行維持限制性利率水準太高、或時間過長，「將可能導致部分金融機構的流動性出現問題。」嚴重的話，羅瑋表示，不排除再度引發類似今年 3 月美歐銀行爆雷事件。


第二個風險，則是地緣政治。「明年美國、印度、印尼、俄羅斯、南非，以及台灣，都將舉行選舉。」羅瑋一一列舉。「其中，尤以美國的變數最大。」他表示，鑑於共和黨可能在明年美國總統大選中勝出，屆時如果是川普回朝，勢將再度對國際經貿關係投下一記震撼彈。


對此，台新金控首席經濟學家李鎮宇亦提醒，根據過去針對美國選舉年的研究發現，1952 年至今，沒有一位總統候選人可以在經濟衰退當年度成功連任；這代表什麼？「只要美國經濟軟著陸失敗，川普就有很大機會出線，」如果是這種局面的話，「預計最早 2024 年下半年，全球資本市場就會開始出現動盪。」


不過，李鎮宇補充，他相信美國經濟終究得以避免衰退，因為他觀察，回顧去年此時，許多人在預測中犯下的最大錯誤，就是小看了美國經濟的「韌性」。於是，展望 2024 年，一幅「軟復甦之路」的圖景漸漸明晰。


在這條路上，美、歐兩大經濟體有望成功「著陸」，台灣、日本則將重拾成長動能，至於深陷「信心缺失」衝擊的中國，則正在摸索著去槓桿下的轉型契機。


雖然，在這條路上，衰退的烏雲仍未散盡，通膨的暗影仍在遠處徘徊，但無論如何，站在全球經濟的窗櫺前，成長的曙光已然清晰可見。


向前一步，推開 2024 年的大門，「撥雲見日」之後，將是全新局面的一年。




來源：《今周刊》 第 1407 期

更多精彩內容請至
《今周刊》


本文授權自今周刊，
原文見此
。


延伸閱讀：


00929、00919、00713 奉上耶誕大禮包！一張表看「8 檔高股息 ETF 12 月除息登場」：這檔年化配息率達 7.7％


COP28 達歷史性決議：啟動損失與損害基金，日本 1000 萬美元、美國 1750 萬美元！支援遭氣候變遷衝擊國家",2023-12-10 09:00:05,18055,過去一年，「高通膨」是全球經濟的主旋律；然而，隨著歐美央行升息循環告一段落，這場持續近 2 年的抗通膨之戰，似乎也到了收尾階段。,[],ff950de5-13b1-4995-a91f-d21331d6806c
