content,publish_at,id,summary,title,keywords,related_stocks,uuid
"隨著眾多品牌業者都預計在下半年推出 AI PC，大中 (6435-TW) 看好，下半年將回歸傳統淡旺季表現，營運有機會再優於上半年，全年營收目標維持雙位數成長。


筆電產業自前年底開始去化庫存，直至去年下半年庫存調節才告一段落，大中今年第一季受惠英特爾 (INTC-US)Meteor Lake 新平台推出，帶動首季營運淡季不淡，第一季營收達 6.14 億元，年增幅達 13%。


不過，由於客戶已在第一季先行拉貨，第二季加上面臨傳統淡季，以及終端銷售低預期，預估營收會略低於首季，下半年則隨著 AI PC 新平台陸續上市，將有助客戶進一步拉貨。


大中也持續開發新產品如 Dr.MOS、SJMOS 等，其中，Dr.MOS 產品研發多年，部分客戶已測試完成，預期下半年將打入筆電與桌機新機種，SJMOS 第二代產品也已完成開發。


展望 2024 年，法人預估，大中今年營收將重返成長，年增估達雙位數，毛利率也隨著晶圓代工價格下跌有所回升，整體營運會優於去年。",2024-05-26 08:55:42,19758,隨著眾多品牌業者都預計在下半年推出 AI PC，大中 (6435-TW) 看好，下半年將回歸傳統淡旺季表現，營運有機會再優於上半年，全年營收目標維持雙位數成長。,AI PC加持 大中下半年迎旺季 全年營收估增逾1成,"['MOS', '大中', '茂達', 'AI PC']","['大中', '英特爾']",2ba7d002-bc16-481e-94f2-c7f0d21c8f39
"撰文 ‧ 徐采薇


作為台灣唯一上市櫃的本土電梯廠，崇友在 2018 年撤出中國，專注台灣市場後，已連續 5 年營收、獲利正成長，其亮眼成績的背後，其實藏有兩大關鍵決策。


50 周年、營收要超過 50 億元、EPS（每股稅後純益）要超過 5 元，都發生在去年。」說這話的人，是現年 65 歲的本土電梯大廠、崇友實業總經理游本立。在公司打拚逾 47 年的他，幾乎見證崇友半世紀的發展史。


台灣人對崇友這個品牌並不陌生，民眾日常生活中所搭乘的電梯，約有 22 至 25％都是它的產品。舉凡台北 101、寒舍艾美酒店、遠雄金融中心、高雄捷運等地的電梯，均出自它手，是台灣前三大電梯業者中，唯一一家本土電梯品牌；2022 年永大下市後，則為台股裡僅存的電梯股。


攤開崇友財報，該公司去年營收 52.7 億元，EPS5.06 元，是第五年營收、獲利雙成長。今年 4 月股價更是突破百元大關，5 月衝上 126.5 元高點。


「公司目前手握 90 億元訂單，是歷史新高！」游本立興奮地分享著，表示這些訂單將在未來 3 年陸續出貨。


進口產品價格高、維修難

挹注資金研發國產電梯


表面上，崇友近年營收、獲利，均繳出亮眼成績單，帶動股價走揚，是受惠於房市交易熱絡。但其實，崇友能持續穩健成長的原因，是 30 年磨一劍的成果。


時間回到 1974 年，當時的崇友，還缺乏電梯技術，只能靠代理日本東芝（Toshiba）品牌，並作為與其技術合作的電梯代工廠。「講白話就是你必須花錢買它們的技術，前後大概有 3、4 種機型，每一種平均要花 5 千萬元，這個價碼在當時是很高的。」游本立直言。


1995 年，崇友下定決心要做自有品牌，因其深知必須掌握自有技術，才能有效降低進口成本，提升市場競爭力。游本立指出，「30 年前核心設備從日本進來，一台電梯可能要賣 8 百萬元，有了自有技術後，一台售價降至 270 萬元。」


崇友花了兩年做研發，1997 年，終於做出旗下第一台低速電梯，並在同年推出自有品牌崇友，只是當時，這台低速電梯一秒鐘移動不到一層樓。


游本立強調，當時能做的還只是最低速的電梯，根據崇友官網顯示，速度約落在秒速 2.5 公尺，但已經是國產電梯的創舉，賣進不少社區大樓。


後來，隨著樓層愈蓋愈高，以及對電梯的安全性要求提升，崇友也陸續再投資上億元研發，成功在 2014 年將秒速 4 公尺的電梯國產化 ，到現在已經可以做出 1 秒鐘跑 6 公尺（兩層樓高度）的電梯。「你不要小看這個技術，台灣不到 10 棟大樓有這麼快的電梯。」游本立的語氣裡滿是自豪。


目前，崇友在桃園楊梅廠還設有台灣最高、內含 4 個升降道的研發塔，用於電力測試；研發部則配有 40 位同仁， 至今仍每年投資 2 至 3％營收金額，進行研發設計。


來源：《今周刊》 第 1431 期

更多精彩內容請至
《今周刊》


本文授權自今周刊，
原文見此
。




延伸閱讀：


股票基金房產...40 歲前投資全軍覆沒，他只花 5 年財富自由、45 歲提早退休：給年輕人的 6 個建議


緯創在印度被砸廠，損失上億！鼎泰豐也在澳洲被重罰 8000 萬⋯這些海外投資帶給台商的三個啟示",2024-05-26 09:00:03,19757,作為台灣唯一上市櫃的本土電梯廠，崇友在 2018 年撤出中國，專注台灣市場後，已連續 5 年營收、獲利正成長，其亮眼成績的背後，其實藏有兩大關鍵決策。,1秒鐘跑兩層樓，台北101電梯是崇友做的…50年老品牌緊追日廠，賺半個股本，總座親揭成功靠這2件事,"['趨勢分析', '今周刊', '電梯廠', '崇友', '101']",[],0c9ea2c2-c980-48a1-9e66-57985be1a81b
"〈全球電動車需求放緩  特斯拉大規模裁員〉


隨著全球電動車需求放緩，直接影響了特斯拉的銷售表現，特斯拉計劃裁減 10% 的全球員工，涉及約 1.4 萬人，大規模裁員主要針對德國、加拿大以及中國市場，反映出特斯拉在多個市場面臨庫存積壓問題，在中國尤其明顯，在歐美甚至出現了將庫存車輛存放於廢棄購物中心和港口的情況，特斯拉的庫存壓力也凸顯了電動車產能過剩的問題。




儘管面臨裁員和市場壓力，特斯拉執行長馬斯克仍宣布將投入超過 5 億美元擴展超級充電站網絡，計劃新建數千個新的充電樁，提高充電便利性，解決電動車使用的一大痛點，隨著更多充電站的建設，用戶將能更方便地進行長途旅行，將有助於提高電動車的吸引力和推動電動車普及。特斯拉曾對美國最成功充電網路的團隊大幅裁員，近期也重新聘用部分被裁員工，顯示其壓縮成本的同時，仍積極擴展充電基礎設施。


〈下載陳智霖分析師 APP 獲得更即時資訊 ，完成註冊獎勵金最高 6000 元 〉


陳智霖老師的直播節目及 APP 的獨家廣播都會針對國際總經還有重要財經事件即時追蹤分析，同時提供產業趨勢方向，只要 APP 完成註冊驗證者都可獲得獎勵金 (最高回饋 6000 元)，邀請您可以立即點選下方連結免費下載陳智霖分析師 App，下載連結: 
https://hantec.liveinapp.com/jhih-lin-app-link


〈特斯拉擴大投資 AI  自駕計程車 Robotaxi、機器人 Optimus 加速發展〉


特斯拉的超級充電站基礎設施，是美國最大的公共快速充電網路，許多汽車製造商決定採用特斯拉的 NACS 充電標準，台廠充電模組概念股的台達電 (2308-TW)、光寶科 (2301-TW) 可望同步受惠，貿聯 - KY(3665-TW) 為特斯拉電池線束供應商，特斯拉加大充電樁佈建力道，後續營運動能也可望隨之成長。


特斯拉擴大投資 AI，馬斯克的 X.AI 公司近期獲得了 60 億美元的融資，特斯拉的全自動駕駛系統 (FSD) 也計畫於今年 8 月推出自駕計程車 Robotaxi 上路，人形機器人 Optimus 也正加速研發，目標在明年底問世。


2023 年 7 月智霖老師提出 AI 未來還會有主升段，而且將會走應用端，當時就點名了機器人，輝達在今年 3 月 18 日舉行的 GTC 大會上也發表了 AI 人形機器人計畫，帶動機器人感測技術的所羅門 (2359-TW) 股價近期飆漲，週四從接近漲停到翻黑下跌爆大量，輝達 (NVDA-US) 財測及 COMPUTEX 將至，現在就是利多最多的時刻，股票行情都是反應在前面，見報追利多題材通常已經沒有利潤，因此容易套牢，然後就一直等待解套，這是群眾在操作的寫照，老師還是強調一定要先學習股票基本正確觀念後逐步投入股票市場，當前應該買什麼股票? 用什麼策略?  資金如何控管? 如果你還是一臉問號不如就尋求專業管道，千萬不要單打獨鬥，跟上陳智霖老師的 APP 選股名單邊操作邊學習，個股輪動的行情你會更需要老師的獨家盤中數據來指引你，關於最新的行情看法則可以立即點選下方影音收看老師在週六最新的直播節目。


最新影音 (請點影音上方標題至 Youtube 收視品質會更佳)




才剛剛接觸陳智霖分析師的新朋友，建議您現在立即點選連結下載安裝陳智霖分析師 APP，新註冊的用戶可免費體驗午報導航、盤中選股以及會員專屬影音，歡迎您透過體驗來了解陳智霖老師，體驗都是限時限額開放，千萬不要浪費了您可以免費體驗的權益喔。




點擊連結免費下載註冊〈陳智霖分析師
 APP
〉獎勵金回饋立即領 
https://hantec.liveinapp.com/jhih-lin-app-link


錢進熱線 02-2653-8299， 立即邁向系統依據的股票操作。


文章來源：陳智霖分析師 / 亨達投顧


本公司所推薦分析之個別有價證券

無不當之財務利益關係 以往之績效不保證未來獲利

投資人應獨立判斷 審慎評估並自負投資風險",2024-05-26 09:10:04,19756,無摘要,電動車產能過剩需求放緩，特斯拉轉攻充電樁、AI機器人發展: 台達電、光寶科、貿聯-KY、所羅門、廣明、達發,"['趨勢分析', '亨達投顧', '陳智霖', '電動車', '特斯拉', '中國', '充電樁', 'NACS', '台達電', '光寶科', '貿聯', '電池', '馬斯克', 'FSD', 'Robotaxi', 'Optimus', '輝達', '機器人', '所羅門', 'COMPUTEX', '廣明', '達發']","['台達電', '光寶科', '貿聯-KY', '所羅門', '輝達']",9c97b678-7666-4f2a-89ac-c420ba07f529
"暌違 9 年，潤泰集團迎來子公司潤德室內設計股票上櫃，憑藉去年賺逾一個股本的實力，潤德掛牌當日股價大漲逾 5 成，一度來到 249.5 元，是否帶動潤泰概念股股價表現，將是接下來觀察焦點。


來到台北政大附近指南路，走進近年有全台最美圖書館之稱的網紅朝聖打卡景點「政大達賢圖書館」，彷彿置身在哈利波特電影場景中，其內部空間就是由近期上櫃的潤德設計操刀。


在台灣，登記成立的室內設計公司高達 10 萬家，產值逾 5 千億元，然而多年來能夠真正走向資本市場者卻屈指可數，除了 2020 年曾出現專攻商場空間的匯僑上市之外，另一家就是在 5 月 21 日上櫃的潤德設計。


「大家都以為室內設計很好做，其實不然。」潤德設計總經理盧玉璜說，「室內設計是高度人力密集的產業，最重要的資產就是設計師，在成本主導一切的情況下，如何拉高潤德獲利，一直是我們想要突破的重點。」


攤開潤德財報，2021 年營收 9.11 億元、EPS（每股稅後純益）5.2 元，到了 2023 年，營收 15.22 億元、EPS10.97 元，堪稱是潤泰集團孵育多年的小金雞。


「富爸爸」資源多

業務發展具廣度深度優勢


潤德能有今天的成績，和三個優勢有關。第一個優勢，便是有「富爸爸」的資源。


成立已 33 年的潤德，最早是因應潤泰集團持續發展所需，也因此，早期業績有超過 5 至 6 成來自於集團內部關係企業，包括書田診所、集團內中高齡專用住宅、銀行總部、科技廠辦、潤泰創新住宅社區的公設規畫，以及上海安泰大樓，給了潤德業務發展的廣度及深度，更奠定了室內裝修設計工程的基礎。


這樣的奧援，既有助潤德的業務組成比其他同業更多元、分散，透過一個又一個實績，又能讓口碑被更多客戶看到。盧玉璜觀察，目前台灣室內設計公司業務集中在特定領域，有的只做商場，有的只做住宅，潤德則因早年累積許多辦公室與住宅大樓的公設空間實績延續下來，業務比重相當平均。


盧玉璜直言，想要走向資本市場的潤德，曾面臨櫃買中心上櫃審查法規要求，「按法令規定，室內設計公司要上櫃，非關係人業務比重須高於關係人，也就是說，外案營收比重須超過五○％，因此，這幾年潤德非常努力分散客戶來源。」所幸經過多年耕耘，隨著口碑的累積，潤德已達到櫃買中心的審查標準，二三年非關係人營收占比達到五二％，客戶分散化成效已逐步顯現。


「潤德可以在極短時間內切入集團之外訂單，關鍵在於集團關係建案打出名號。」盧玉璜透露，包括大陸建設位於台中七期重劃區豪宅案寶格與麗格，與辦公大樓，都是因為觀察到潤德的施工品質，才委託潤德執行國外設計師公設裝修案。「這些知名建商將建案興建最後一棒交給潤德，靠的就是口碑。」


垂直整合模組化管理

縮短時間風險成本增競爭力


垂直整合與模組化管理，是潤德的第二個優勢。


裝修從細部設計到施工共包含十幾個流程，潤德將多年來服務客戶所累積的經驗整合成許多模組化的解決方案可套用，讓客製化服務不須從零開始，大幅縮短了客戶的時間成本與風險成本，成為潤德核心的競爭力。


不只如此，隨著業務量愈來愈大，潤德也開始發展成一條龍服務，從設計與裝修工程，到設計藝術、建築工程與專案管理技術統包，這樣的模組化管理也讓潤德可以接到微軟與谷歌等國際科技大廠實驗室裝修案。


來源：《今周刊》 第 1431 期

更多精彩內容請至
《今周刊》


本文授權自今周刊，
原文見此
。




延伸閱讀：


股票基金房產...40 歲前投資全軍覆沒，他只花 5 年財富自由、45 歲提早退休：給年輕人的 6 個建議


緯創在印度被砸廠，損失上億！鼎泰豐也在澳洲被重罰 8000 萬⋯這些海外投資帶給台商的三個啟示",2024-05-26 09:20:03,19755,暌違 9 年，潤泰集團迎來子公司潤德室內設計股票上櫃，憑藉去年賺逾一個股本的實力，潤德掛牌當日股價大漲逾 5 成，一度來到 249.5 元，是否帶動潤泰概念股股價表現，將是接下來觀察焦點。,彷彿置身哈利波特...全台最美圖書館它操刀的！「潤泰小金雞」潤德靠3大優勢，殺出室內設計紅海爭氣上櫃,"['趨勢分析', '今周刊', '潤泰', '潤德']",[],f64b4ea8-9f37-4519-9eaa-0709993685f5
"美家人力資源公司申請經營外籍移工國外小額匯兌業務已獲金管會核准，公司並已接獲正式核准公文，美家人力資源主管指出，公司對於此一業務籌備已到最後階段，將會在 2024 年年底前登場提供服務，同時，美家人力資源並準備登錄創櫃板交易，目前也在輔導中。


目前包括統振 (6170-TW)、東聯互動、數位至匯三家業者都已陸續獲准開辦外籍移工國外小額匯兌業務，根據統計，2024 年 1-3 月，匯兌筆數達 212 萬筆，年增 78%，匯兌金額計 202 億元，年增 8 成，客戶數達 68.8 萬人，年增 71%。已經在 2020 年開辦此一業務的統振已經掛牌 OTC 交易，而目前股本 2.49 億元的東聯互動已在今年 1 月完成股票公開發行，預計在第二季申請登錄興櫃，美家人力資源並準備登錄創櫃板交易。


由於東聯互動先前以每股 150 元辦理現增，並吸引金控業者參與這一輪的現增案，目前市場關注東聯互動登錄興櫃的參考價及登錄興櫃的確切時間表。


美家人力資源原本就持有移工人力仲介執照以及為移工服務的代結匯權，此次申請並獲准成為台灣第四家的外籍移工國外小額匯兌業者，也等於美家人力資源將在移工小額匯兌業務上擴大經營，未來得提供印尼籍、越南籍及菲律賓籍移工將款項匯出至母國服務。


統振、東聯互動目前對此一移工匯款業務執行，採取以 FinTech 的金融科技模式處理並與海外金融機構合作，美家人力資源主管指出，美家人力資源本身已備妥這方面的人才，在移工小額匯兌業務的申請案獲金管會核准後，目前也與超商業者及其他合作廠商進一步洽談合作之中。


根據勞動部最新統計數據指出，至 2024 年 3 月底產業及社福移工人數達 76.34 萬人，較 2023 年 12 月底增加 1.32％，移工匯款市場規模可觀，統振建立金融科技行動 APP 串接便利商店及國外金融機構的完整網絡，做到外籍移工僅需簡單 4 個步驟 (下載 APP、註冊會員、下 APP 匯款指示、超商繳款) 即可完成便利的匯款程序，且款項一般在 1 個小時內即可到國外帳戶，大幅縮短外籍移工小額匯款過往需長達 1 - 2 天匯回該國家的時間差，統振內部資料顯示，目前累計 QuickPay 總會員數已攀高到 40 餘萬會員數。


統計顯示，累計今年前 4 月移工匯款業務所匯出金額已達新台幣 125.65 億元、年增 56.61%，凸顯統振深獲台灣多數外籍移工高度肯定與信賴。


統振看好台商回流將推動外籍移工需求的人數增加，以及政府簽證放寬引進外籍移工等之趨勢明確，憑藉長達 24 年經營移工電信預付卡市場的經驗，持續積極拓展公司布局金融科技的移工匯款業務更多市場占有率 ，一方面，透過軟硬體的升級、客服效能的提升，強化與海外金融機構系統化的介接效率，以及持續與合作夥伴深化外籍移工國外小額匯兌 QuickPay 多樣性業務內涵，致力建立更完整、多元、友善的金融科技環境，完整生活 Q 生態系，並運用包括定期手續費優惠、電影發行商傳影互動合作推廣等，拉高 QuickPay 的品牌力，推進統振在台灣外籍移工匯款的市占率提升。",2024-05-26 09:40:05,19754,美家人力資源公司申請經營外籍移工國外小額匯兌業務已獲金管會核准，公司並已接獲正式核准公文，美家人力資源主管指出，公司對於此一業務籌備已到最後階段，將會在 2024 年年底前登場提供服務，同時，美家並準備登錄創櫃板交易。,美家FinTech移工小額匯款業務年底前登場 也擬登錄創櫃板,"['統振', '美家', '東聯互動']",['統振'],07c32a9a-8203-416f-a090-0a6b66777cc2
"近日歐洲理事會剛在上週二（21 日）通過全球首部監管人工智慧的 AI Act (人工智慧法)，OpenAI 等生成式 AI 產品企業首當其衝。KPMG 安侯企業管理董事總經理謝昀澤表示，此法勢將帶動全球，包含台灣在內的 AI 治理法規紛紛跟進，全面加速立法。


去年生成式 AI 應用的大爆發，被喻為 AI 的「iPhone 高光時刻」，謝昀澤比喻，現在 AI Act 的通過，可以說是 AI 的「信任標竿時刻」。


謝昀澤說明，面對歐盟 AI 法案的正式實施，被法規定義為高風險的 AI 系統，將受到最嚴格的義務和要求，常見包含醫療設備、運輸安全、能源管理、金融科技等領域的 AI 應用。台灣廠商若在歐盟領域內開發或使用 AI 系統，要確保其產品符合 AI Act 要求，並進行適當的風險管理和資料治理，必須具備其符合記錄保存、透明度、人類監督等關鍵要求的明確證據。


台灣企業除了必須密切關注 AI Act 的合規性外，KPMG 安侯企業科技法律專家趙慶宏提醒，歐盟 AI Act 也與歐盟的《網路韌性法》(The European Cyber Resilience Act, CRA) 草案、《一般個人資料保護規則》(General Data Protection Regulation， GDPR)、CE 標誌規範等規範要求有相互適用關係。歐盟的科技法律架構，是一張「科技應用的道德、安全與信任大網」，相關企業如以個別法條合規傳統方法處理，可能掛一漏萬、或拼湊疊床架屋的內部規範，將形成法遵災難。


趙慶宏進一步分析，AI Act 還將對 ChatGPT 等熱門生成式 AI 及大型語言模型，在歐盟的布局帶來兩大衝擊。


首先，OpenAI 等 AI 巨頭，將需投入大量資源進行合規性審查，確保數據使用、透明度和人類監督機制符合歐盟 AI 風險管理要求；此舉可能會對新興 AI 公司和中小企業造成更大壓力，因為他們可能無法承擔高額的合規成本和技術要求。這將有利於像 OpenAI 這樣資源充足的大型企業在市場中拉開更大優勢，進一步鞏固其市場地位。


其次，AI 使用者將獲得更多透明度和保障，知悉與 AI 互動的細節及風險，但同時也可能面臨更嚴格的使用限制。從消費者角度，趟慶宏也提醒 AI 科技使用者，積極提升自我「AI 風險素養」，了解 AI 如何收集、使用和存儲個人資料，避免在對話中透露敏感個人資料，以確保在享受 AI 技術便利的同時，保障自己的個資隱私。",2024-05-26 11:06:23,19753,近日歐洲理事會剛在上週二（21 日）通過全球首部監管人工智慧的 AI Act (人工智慧法)，以歐盟為主要市場的企業首當其衝。KPMG 安侯企業管理董事總經理謝昀澤表示，此法勢將帶動全球包含台灣在內的 AI 治理法規跟進,歐盟AI法通過OpenAI剉咧等？ KPMG：將帶動台灣加速立法  ,"['生成式AI', '歐盟', 'AI Act']",[],60a82bf2-1ead-4758-8cf8-0fed5755b73c
"台股 5 月以來累計上漲 5.93%，520 後 AI 概念股有接棒表現之態，包括 AI 散熱、AI PC、AI 光通訊、AI 機器人等族群皆相對強勢。此外，根據統計，進入美國大選年，通常股市上漲機率較高，短線風險亦因指數已進行震盪整理而下降，法人認為，現階段，台股基本上維持利空不跌的態勢，建議觀盤重點以選股不選市為原則。


安聯投信台股團隊指出，不論是 AI、高股息等主題，或是市場期待 6 月登場的台北電腦展，都成為現階段相對受資金青睞的族群，儘管部分資金有從近期漲多的非電族群流出，但有些近期處於相對基本面較低基期等族群，反倒成為近期吸引部分資金挹注的標的。


展望後市，安聯投信台股團隊表示，台股近期仍有望在資金快速輪動、以及各類主題輪番吸引資金挹注的盤勢下，維持一定強勢格局；除了 AI 主題外，另包括股息、非電金題材、落後補漲標的，亦是吸引資金推動大盤向上力道來源之一；部分落後補漲非電金題材主要是受惠於財報公布、獲利上調等正面消息的加乘效果所激勵。


安聯投信台股團隊表示，整體而言，科技產業多數庫存見底，往復甦方向前進，但次產業表現有落差，主動選股、尋找投資能見度達 2-3 年的產業或公司 (如 AI、IP/ASIC、光通訊、重電等)，仍是較佳的布局方向。


日盛投信台股投資研究團隊表示，VIX 指數、美債、美元以及油價等風險因子數值下降，市場關注美國聯準會 (Fed) 動向，美國 4 月 CPI 回歸放緩軌道、零售銷售溫和成長，仍需關注長期通膨趨勢下滑是否改變。


觀察台灣基本面，受惠 AI 人工智慧等新興科技應用商機強勁，海關出口續為紅燈，並帶動生產、銷售、機械及電機設備進口值等指標普遍呈現綠燈，3 月景氣對策信號綜合判斷分數站上 30 分，續亮綠燈，顯見基本面持續給力。


日盛投信台股投資研究團隊指出，美 GPU 大廠財報強勁，顯示 AI 基本面逐漸兌現，台灣相關概念股將實質受惠。因 AI 需求強勁，預期 AI 伺服器供應鏈持續受益於 2024-25 年營收與獲利上揚，此外，AI 伺服器亦將推升散熱、電源供應、機櫃組裝之內含價值，預估 AI 供應鏈及半導體供應鏈仍將持續擔任盤面要角，相關概念股可持續關注。",2024-05-26 11:10:04,19752,台股 5 月以來累計上漲 5.93%，520 後 AI 概念股有接棒表現之態，包括 AI 散熱、AI PC、AI 光通訊、AI 機器人等族群皆相對強勢。此外，根據統計，進入美國大選年，通常股市上漲機率較高,台股高檔利空不跌 題材照樣輪番表現 操作選股不選市,"['台股', 'AI概念股', '高息']",[],6987d49a-dde7-45e7-a4af-fbf2a1a676d2
