title,keywords,content,publish_at,id,summary,related_stocks,uuid
上船了沒？00960上市一週規模暴漲增3倍 Q4旺季到仍有看頭,"['00960', '野村投信', 'NYSE FactSet', '航運股', 'ETF']","全球關注海運供應鏈的「10 月驚奇」，美國碼頭工人與港口營運商已達成暫時協議。步入航運旺季第四季，彭博統計 9/23-9/27 航運類股單週大漲 10.83%，台灣貨櫃三雄也有不錯表現，00960 自 9/20 上市第一週規模即從 10.8 億元成長至 47.4 億元，暴增數倍。目前航運股話題與投資機會豐富，加上 Q4 傳統航運旺季，法人看好航運股後市，若等盤勢拉回買進，持有 1 年以上的表現更為亮眼。


野村投信投資策略部副總經理但漢遠分析全球航運股過往走勢特性指出，根據統計，當航運題材股票拉回時進場投資，以 NYSE FactSet 全球航運龍頭息收指數為例，分別持有 60、120 與 240 個交易日 (即約 3、6 個月與 1 年)，平均而言都是正報酬，漲幅可望達 7.27%、15.72% 與 37.73%，表現相當亮眼；然若在該指數創高時進場，上述期間平均漲幅則為 10.22%、21.85% 與 31.54%，短中長期的爆發力則更為驚人。


00960 野村全球航運龍頭息收 ETF 經理人張怡琳分析指出，歷史統計，當全球航運股起漲時動能往往延續 3-6 個月，當中包括適逢下半年乃至於第四季航運營運旺季等挹注，航運股價未來仍有表現的空間。創高買進後的爆發力較強，適合積極型投資人進行價差交易；只要經濟與貿易活動穩健向上，航運股長期向上可期，若等盤勢拉回買進之平均長期 (如持有一年以上) 的表現，可望更為亮眼，適合長期投資人適度配置。


但漢遠進一步表示，近期航運類股再度受到市場關注翻紅，根據統計，最近一週 (9/20-9/27) 台股 ETF 中之海外股票型分類，其中 00960 無論在規模或受益人數均大幅成長，總規模從 9 月 20 日的 10.8 億元成長至 9 月 27 日的 47.4 億元，增幅達 339%，若從受益人數來看，00960 受益人數從 9 月 20 日的 5469 人成長至 9 月 27 日的 19224 人，大增 13755 人、增幅逾 250%。


野村投信表示，目前航運股話題與投資機會豐富，加上傳統航運旺季，包括年底購物旺季拉貨潮助長貨櫃業者、歐美秋冬對南半球糧食推升散裝運輸需求，乃至於北半球秋冬取暖用油需求帶動油輪運輸，貿易「運量」可望達到高峰，至於消息面包括俄烏戰爭持續、中東地區紅海危機，這些都可能進一步造成航運「供不應求」，這從許多航運公司例如台灣貨櫃三雄等營收獲利表現出色亦可看出端倪。",2024-10-06 16:49:05,35136,全球關注海運供應鏈的「10 月驚奇」，美國碼頭工人與港口營運商已達成暫時協議。步入航運旺季第四季，彭博統計 9/23-9/27 航運類股單週大漲 10.83%，台灣貨櫃三雄也有不錯表現，00960 單週規模從 10.8 億元成長至 47,[],13a02ac2-e335-4974-83dc-80ff98dd169c
〈智慧能源週〉聚恆科技推出聚能網與液冷型儲能櫃 進軍表後微電網市場,"['聚恆', '微電網', '能源', '綠電', '儲能']","聚恆科技 (4582-TW) 於「2024 Energy Taiwan 台灣國際智慧能源週」智慧儲能應用展區，推出全新 HHR 液冷儲能電池櫃與 EMS 能源管理系統「H-ELink 聚能網」，整合「創能」和「儲能」，為企業同時解決節能、減碳、不斷電、高電價的問題。


聚恆科技推出兩款儲能電池櫃，是台灣首款通過 CNS 62619 驗證並取得 VPC 證書，擁有三大優勢，一是安全性高，符合美國防火協會 NFPA 855 認證，採用氣溶膠消防系統，模組具備 IP 67 防護等級，機櫃具備 IP 55 防護等級。


二是運行高效，液冷系統可將電芯溫差控制在 3°C 內，精準控溫。三是精巧靈活，一體化設計便於安裝與運輸，靈活配置系統擴充容易，可橫向並排安裝節省空間。結合「H-ELink 聚能網」能源管理系統，可依據企業用電紀錄與綠能發電量進行最佳化分配，有效節約電費成本，並為各項設備提供備用電源。


聚恆科技是國內太陽能系統 EPC 廠商，擁有超過 25 年的專業經驗，早前聚恆子公司聚恆動能甫推出 HiEV 品牌成功進軍充電樁市場，預計到 2026 年將設置 60 個站點。


此次發表全新儲能系統，聚恆科技將提供多種客製化儲能方案，包括電廠與輸配電業儲能方案、工商業用電大戶儲能方案、太陽能與儲能整合方案、電動車充電樁與微電網方案，協助企業實現能源轉型與永續發展目標。",2024-10-06 16:50:43,35135,聚恆科技 (4582-TW) 於「2024 Energy Taiwan 台灣國際智慧能源週」智慧儲能應用展區，推出全新 HHR 液冷儲能電池櫃與 EMS 能源管理系統「H-ELink 聚能網」，整合「創能」和「儲能」，為企業同時解決節,['聚恆'],449c85a9-dde5-4815-ae94-9b0c56bcbe4c
亞光菲律賓廠CNC加工區5日晚間遭祝融 已恢復正常運作,"['亞光', '火警', '菲律賓']","光學元件廠亞光 (3019-TW) 在菲律賓的原有廠區 CNC 金屬加工部門，昨 (5) 日晚間發生火警，亞光指出，火警消防人員全力協助下迅速撲滅火勢，並無任何人員傷亡，已迅速恢復正常運作。


亞光集團在海外除中國大陸之外，在緬甸及菲律賓都設立有生產線，且積極展開在菲律賓展開新廠的建設中，亞光主管指出，昨日晚間發生火警的廠區爲先前投資以生產射擊瞄準鏡的子公司，發生火警的廠區是 CNC 金屬加工區域，生產瞄準鏡的金屬件產品，昨晚起火後火勢迅速遭到撲滅，並沒有人員傷亡事件傳出。


亞光指出，菲律賓子公司有投保火險，已通知保險公司火警事故進行勘查，並進行相關理賠程序。


亞光 2024 年 9 月營收爲 21.85 億元，月減 9.6%，年增 36.71%，2024 年第三季營收 68.28 億元，季增 21.61%，年增 44.81%，2024 年 1-9 月營收爲 167.3 億元，年增 28.67%。


亞光 2024 年上半年財報營收 99.03 億元，毛利率 16.56%，稅後純益 5.57 億元，每股純益 1.99 元。",2024-10-06 19:11:42,35134,光學元件廠亞光 (3019-TW) 在菲律賓的原有廠區 CNC 金屬加工部門，昨 (5) 日晚間發生火警，亞光指出，火警消防人員全力協助下迅速撲滅火勢，並無任何人員傷亡，已迅速恢復正常運作。,['亞光'],1076a89a-0a13-48b3-90d7-27a2c0de100a
