title,keywords,content,publish_at,id,summary,related_stocks,uuid
高力Q3營收11.48億元改寫歷史同期新高 年增5成,"['高力', '營收', 'CB', 'EPS', '擴產']","高力 (8996-TW) 受惠氫燃料電池製造商 Bloom Energy 拉貨升溫，拉貨力道大增挹注業績提升效應明顯，由於產品銷售金額的成長，今 (11) 日公布最新營收資訊，2023 年第三季營收以 11.48 億元改寫歷史同期新高，年增 50.79%，第四季在新產能到位挹注下，業績並不看淡。


高力 2023 年 9 月營收 3.27 億元，月減 18.65%，年增 21.43%，2023 年第三季營收以 11.48 億元改寫歷史同期新高，季減 12.23%，年增 50.79%，2023 年 1-9 月營收 34.26 億元，年增 75.98%。


高力 2023 年 1-9 月累計營收較去年同期增加 75.98%，公司指出，主要是板式熱交換器及熱能產品營業額，較去年同期累計分別增加 63.14% 及 92.51% 挹注。


高力董事會並決議以發行無擔保可轉換公司債 (CB) 募集 10 億元，籌資目的爲償還銀行借款。


高力 2023 年上半年營收 22.78 億元，毛利率 29.17%，年增 1.8 個百分點，上半年稅後純益 3.34 億元，年增 2.08 倍，每股純益 3.74 元，已超過 2022 年一整年獲利。


高力預估產能今年增加約 40%，目前也依規劃進度建置中，同時，Bloom Energy 的燃料電池反應盒 (Hot Box) 方面，2023 年訂單狀況需求暢旺，法人估，訂單量比起去年增加雙位數水準，加上新產能開出後，也將增加出貨動能，更加有利於下半年的業績突出表現。",2023-10-11 17:45:09,15349,高力受惠氫燃料電池製造商 Bloom Energy 拉貨升溫，拉貨力道大增挹注業績提升效應明顯，由於產品銷售金額的成長，今 (11) 日公布最新營收資訊，2023 年第三季營收以 11.48 億元改寫歷史同期新高。,['高力'],ab0b01f6-459a-4714-9156-df0145f9d36d
蔡明彰觀點：以巴戰爭避險需求 記憶體、IC設計先行指標,"['趨勢分析', '萬寶投顧', '蔡明彰', '台股']","今天報告的主題是「以巴戰爭避險需求  記憶體、IC 設計先行指標」。


萬寶投顧蔡明彰強調，第四季選股著重庫存回補，記憶體 9 月營收月增幅度擴大，顯示補庫存加速。


群聯 (8299-TW) 受惠中國十一長假出貨 50 億元，月增 25％，並扭轉連續 14 個月年減，變成年增 4％。NAND 控制 IC 點序(6485-TW)1.67 億元，創 17 個月新高，月增 17％，並終止連 15 個月年減，轉為年增 14％。DRAM 模組十銓(4967-TW)14.8 億元，雙增，月增 16％，年增高達 113％。


DRAM 自低點反彈 12％，NAND Flash 反彈 22％，但不足以讓生產商損益兩平。南亞科 (2408-TW)9 月營收 27.2 億元，月增 6％，年減 15％。華邦電 (2344-TW)67.7 億元，同樣月增 5％，但年減 8％。月增個位數，幅度不大，並且年減表示終端需求未大舉回溫，必須營收轉為年增，才能證明需求好轉。


有時候中下游廠商的心態跟做股票相似，追高殺低，現在三星電子第二波減產後，覺得明年記憶體景氣會變好，第四季趕快補庫存，記憶體合約價估上漲 10％，現貨價漲幅上看 15％～20％，記憶體漲勢加大，反而中下游廠商去追價，所以形成 DRAM 模組廠營收月增幅度比生產商更大。


從營收變化來看，月增幅度加大，並且扭轉為年增的群聯、點序股價力道較強，應有機會創波段新高，目前還有兩檔記憶體可望加快補漲。


華邦切入 AI 的 HBM(高頻寬記憶體)，HBM 為記憶體明日之星，雖然海力士、三星、美光都已出貨給輝達，但國內供應鏈才由華邦開始，預計 2024 下半年華邦量產，有 HBM 題材加持，華邦在這次記憶體的多頭週期比南亞科、旺宏 (2337-TW) 多了想像空間。


以工控為主的宜鼎 (5289-TW)9 月營收 6.9 億元，6 個月新高，補漲邏輯也是靠 AI，是輝達重要合作夥伴，將在 10 月下旬與輝達發表新的人工智慧解決方案，為國內廠商第一個切入智慧工廠。


萬寶投顧蔡明彰強調，AI 興起在 2025 年全球高達 1.5 兆美元智慧工廠，這是 AI 很大的應用市場。智慧工廠運用人工智慧、機器深度學習，促進自動化流程。宜鼎今年 EPS 估 17 元，明年上看 25 元，已有外資給予 20 倍本益比，目標價 500 元。


補庫存一定先從上游關鍵元件及 IC 設計展開，全球第二大記憶體模組廠威剛 (3260-TW)，全球第一大手機晶片聯發科 (2454-TW)，這波相當強勢，股價接近今年最高點，背後正是補庫存力量推升。


回顧威剛上波最高價 2021 年 7 月的 132 元，這麼早時間做頭，預告後來兩年記憶體庫存調整的苦日子來臨。全球第一大記憶體模組廠金士頓沒有掛牌上市，所以威剛成這個領域的先行指標。


威剛的 EPS 起伏很大，好日子 2021 年高達 9.14 元，苦日子 2022 年掉到 3.19 元，變成三分之一。2023 年 EPS 更低，估 3 元，但景氣循環股股價不看當年 EPS，而是看未來的明年。2021 年最高 132 元，不反映當年 EPS 9 元，而是提前反映衰退 2022 年的 3 元，同理今年股價大漲，提前反映 2024 年 EPS 大幅成長。


萬寶投顧蔡明彰強調，以巴戰爭雖初步研判對台股沒有太大的影響，但選股仍要有避險考量。補庫存之外，具備明年高股息殖利率是資金的避風港。萬一伊朗捲入戰爭，美國公債收益率必定噴發。


台股前十大權值股股息殖利率最高是聯發科 (2454-TW)，明年股利估 50 元，殖利率逾 6％。聯電(2303-TW) 明年股利殖利率估 5％。


以色列高塔半導體 (Tower Semiconductor) 為全球第七大晶圓代工，若產能被波及，對聯電是紓解晶圓代工成熟製程壓力。10 月到明年 2 月農曆年是大陸手機銷售旺季。聯發科營收出現年增機率大，聯發科營收年減已持續一年，一旦轉為年增，加上 10 月底發表天璣 9300 超越高通驍龍 8 Gen3，聯發科奔向千元不是夢。


在聯發科帶動下，哪些 IC 設計可望漲勢更兇悍。9 月營收雙增並且年增逾 30％，表示補庫存力道強勁。最強是世芯 - KY(3661-TW) 年增 111％，其次，聯陽 (3014-TW)87％，晶相光 (3530-TW)83％，昇佳電子 (6732-TW)61％，祥碩 (5269-TW)44％，義隆 (2458-TW)34％，茂達 (6138-TW)31％，果然股價反應了。


世芯 - KY 今天來大漲 254％，漲幅居 IC 設計之首。聯陽今年來大漲 134％，在 IC 設計漲幅前五名。聯陽 9 月營收 6.5 億元，創 24 個月新高。義隆 12.07 億元，15 個月新高。系微 (6231-TW)1.54 億元刷新歷史新高，這三檔 IC 設計與 PC、筆電相關程度大，顯示 PC 零組件回補庫存優於市場預期。


萬寶投顧蔡明彰強調，輝達 CEO 黃仁勳將參加 10 月 18 日鴻海科技日，再度訪台，市場熱烈期待再掀 AI 熱潮，但這次時空環境與 5 月底台北國際電腦展引爆 AI 大行情不同。拜登政府即將發佈出口中國新 AI 禁令，恐怕連降規版 GPU 都被限制，恐打到輝達的中國業務。


輝達賺太多令人眼紅，OpenAI 及微軟都宣布自研晶片，擺脫對輝達的依賴。以巴衝突，輝達宣布取消在以色列舉辦的 AI 高峰會，造勢題材又少了一個利多。


再來，現在大家都知道什麼是 AI，AI 鏈也曾大漲一波，不少人高檔套牢，籌碼透露玄機。


廣達 (2382-TW) 股本 386 億元，比緯創(3231-TW)291 億元更大，但融資餘額 6.5 萬張，比緯創 10 萬張更少。廣達站上季線，緯創仍在季線之下，籌碼顯示散戶對緯創期待很高，但問題誰來拉抬，讓散戶解套。


緯創集團 9 月營收不如預期，緯創 778 億元，月增 7％，但年減 17％。緯穎 (6669-TW)157 億元，月減 19％，更年減 50％，旺季營收力道不足，被傳統伺服器庫存調整拖累了。


文章來源：萬寶投顧蔡明彰


萬寶投顧蔡明彰免費演講 立即報名


https://www.honsec.com.tw/event/course/index.aspx?cid=11


立即免費加入蔡明彰粉絲團，可獲得更多資訊分享


蔡總選黑馬蔡明彰 LINE 粉絲團


https://line.me/ti/p/@marbo666


蔡總選黑馬蔡明彰 免費 YOUTUBE 影音頻道


https://www.youtube.com/channel/UCHjkjx50-BTduhjwiwFA3nw


蔡總選黑馬蔡明彰 FB 社團


https://www.facebook.com/groups/marbo666/


蔡總選黑馬蔡明彰 telegram 粉絲團


https://t.me/marbo666


本公司所推薦分析之個別有價證券

無不當之財務利益關係 以往之績效不保證未來獲利",2023-10-11 18:00:09,15348,無摘要,"['群聯', '世芯-KY', '南亞科', '華邦電', '旺宏', '宜鼎', '威剛', '聯發科', '聯電', '聯陽', '點序', '晶相光', '昇佳電子', '祥碩', '義隆', '茂達', '系微', '廣達', '緯創', '十銓', '緯穎']",a33a1415-c24c-47c1-b3b2-70a28fe40bfd
台幣大升驗證，台積電帶領台股站回月均線，半導體Q4營收值得期待,"['亨達投顧', '陳智霖', '趨勢分析', '櫃買指數', '台積電', '匯率', '緯創', '廣達', '英業達', '技嘉', 'AI', '聯發科', '瑞昱', 'IC設計', '創意', '製造業PMI']","雙十假期期間，國際股市表現非常不錯，臺北股市今天跟進大漲了 151 點，成交量為 3589 億元，大盤收復月均線本應該是件開心的事情，不過櫃買指數反而是下跌 - 0.9%，今天盤勢個股的內容屬於拉積盤 (漲權值跌中小型股)，有買台積電(2330-TW) 應該會比較開心，智霖老師上星期四節目已經有提供證據，請全體會員於 525 元買進台積電，其中一個重要理由為台幣匯率，今天台幣大升至 32 元附近，關於匯率的轉折點，忠實粉絲都可以驗證老師所談的觀點。




今天台股表現之所以虎頭蛇尾，主要受到 AI 概念股重挫影響，緯創 (3231-TW)、廣達(2382-TW)、英業達(2356-TW) 與技嘉 (2376-TW) 都有超過 5% 以上的跌幅，會有這樣的走勢跟股票估值有關聯，投資人不妨回想一下智霖老師於 9/30 節目所談的 AI 操作四項重點，其中一項要找估值有反應空間的，包括台股融資籌碼面的因素，操作方面建議請跟上專業。


最新影音 (請點影音上方標題至 Youtube 收視品質會更佳)






陳智霖老師的直播節目以及 APP 語音文章都會針對國際總體經濟重要的事件追蹤分析有前景的產業趨勢，針對看好產業個股每個星期也都會準備投資名單且設定好操作價位，提供給付費的簡訊會員及 APP 選股會員，股市險惡呼籲忠實粉絲觀眾千萬不要單打獨鬥，請換上富人的思維，把花時間的股市研究工作及盤中的進出判斷資金的控管技巧交給專業的陳智霖分析師，您可以跟著老師一邊操作一邊學習。


邀請您可以點選下方紫色圖免費註冊陳智霖分析師 App，掌握老師最新的分析動態




才剛剛接觸陳智霖分析師的新朋友，建議您現在立即點選紫色圖片下載安裝陳智霖分析師 APP，老師有提供 APP 新註冊用戶免費體驗午報導航及互動教學會員影音的活動，歡迎您透過體驗來了解陳智霖老師如何選股以及盤中的會員服務，午報導航體驗都是限時限額開放，千萬不要浪費了您可以免費體驗的權益喔。


一樣是 AI 概念股，智霖老師在 8 月 26 日的節目分享，AI 軟體商機大於硬體，直接點名了聯發科 (2454-TW) 與瑞昱 (2379-TW)，台灣受惠的就是在 IC 設計，今天整理許久的創意(3443-TW) 攻漲停板，AI 現在漲跌還是以應用端為主，而且市場重視個股的估值。




美國製造業 PMI 創 11 個月新高，這星期五開始就是美國股市的財報季，接下來的操作機會跟題材在哪裡，相關細節投資朋友可以鎖定 10/11(三) 今天晚上 11 點電視 56 台 TVBS「金臨天下」節目，老師會在節目中詳細介紹。




錢進熱線 02-2653-8299, 立即邁向系統依據的股票操作。


文章來源：陳智霖分析師 / 
亨達投顧


本公司所推薦分析之個別有價證券

無不當之財務利益關係 以往之績效不保證未來獲利

投資人應獨立判斷 審慎評估並自負投資風險",2023-10-11 18:10:02,15347,無摘要,"['台積電', '瑞昱', '聯發科', '技嘉', '英業達', '廣達', '緯創', '創意']",e79b035b-236c-4fcf-9ca8-775faef4c83b
IKKA-KY 9月營收寫近2年高點 看Q4、明年營運有望挑戰新高,"['IKKA', '豐田', 'toyota', '日系車', '車用']","汽車零組件大廠 IKKA-KY(2250-TW) 今 (11) 日公告 9 月合併營收 3.54 億元，月增 7.13%，年增 1.08%，創 2022 年 1 月以來新高，IKKA 表示，已擺脫銷售陰霾，看好第四季和明年營運，有望挑戰新高。


IKKA 指出，主要大客戶豐田汽車今年全球產量約 1020 萬台，年增約 10%，並超過 2019 年的 905 萬台，將創歷年新高紀錄，同時，為加速電動車發展，豐田開始重新調整電動車生產模式，開發新的電動車底盤和電池動力。


因此，隨著豐田汽車產能回復正常，IKKA 認為，已擺脫過去銷售陰霾，在日本名古屋第三工廠加入後，展望第四季和明年營運，可望挑戰新高。",2023-10-11 18:12:35,15346,IKKA-KY 9 月營收寫近 21 個月高點 看 Q4、明年營運有望挑戰新高,['IKKA-KY'],74adb5db-d9de-4073-9dc1-c561b2e1797e
嘉威生活9月營收雙增逾2成 已動工興建越南新廠,"['嘉威', '越南', 'EPS', '營收']","嘉威生活 (3557-TW) 在越南投資 4200 萬美元設立的新廠已經正式動工，預計於 2026 年投產，同時，嘉威生活今年的進入旺季時間啟動，今 (11) 日公布的 2023 年 9 月營收達 4.08 億元，月增 23.86%，年增 22.35%。


嘉威生活 2023 年第三季營收 10.69 億元，季增 8.63%，年減 1.59%。2023 年 1-9 月營收 35.26 億元，年減 17.05%，嘉威生活，10 月開始邁向第四季及翌年第一季傳統旺季，營運有望持續邁向復甦軌道。


嘉威生活今年受去庫存化影響，第二季為營收谷底，不過，原物料價格較往年平穩，使得今年上半年毛利率爬升到 38.71%。近期北美零售產業市場的庫存在返校季採購的助益下恢復水準，嘉威生活主要客戶 Walmart、COSTCO 最近季度的營收均呈年增表現，在營收進入旺季的效應下，可望穩住下半年的毛利率。


嘉威 2023 年上半年營收 24.57 億元，毛利率爲 38.51%，年增 3.89 個百分點，上半年稅後純益 2.12 億元，年減 35.21%，每股純益 2.64 元。


嘉威生活 8 月 11 日董事會通過越南廠投資案，將斥資美金 1,250 萬元成立全資子公司籌建越南生產基地，總投資金額預估為美金 4,200 萬元。越南廠位於北越南定的美順工業區，該廠已於 9 月 28 日動土興建，建廠預計將於 2025 完工，年產值可達 7,000 萬美元，2026 年可望為量產的第一個完整年度，以因應營運發展需求。


嘉威生活越南廠將規畫為環保產品的生產基地，R.PET 產品自 2020 年度推出市場以來，R.PET 材料的使用量逐年成長，2022 年已逾 3,500 噸，用量較前一年度成長超過 8 成。為增加環保產品產能因此前進越南設廠，以因應客戶端環保產品成長需求。R.PET(再生酯粒) 被市場視為新型的再生環保聚酯材料，採用寶特瓶回收再生的聚脂材料，可以減少生產聚酯纖維所產生的二氧化碳，達到減碳的目的，市場接受程度日漸增高。


嘉威生活越南生產基地的規畫，將可瞄準環保意識抬頭的市場趨勢，持續拓展環保產品的營收。",2023-10-11 18:21:58,15345,嘉威生活在越南投資 4200 萬美元設立的新廠已經正式動工，預計於 2026 年投產，同時，嘉威生活今年的進入旺季時間提早，(11) 日公布的 2023 年 9 月營收 4 億元達 4.08 億元，月增 23.86%，年增 22.35%。,['嘉威'],1c6432c2-7b86-41d5-ada8-5bc3d067c132
〈台幣〉聯準會唱鴿美元轉弱 新台幣升8.5分收32.122元 創逾2周來新高,"['新台幣', '美元', '聯準會']","美國聯準會放鴿子讓美元指數降至 106，帶動非美貨幣彈升，新台幣兌美元今 (11) 日一度強彈逾 1.2 角，終場升幅收斂但仍升值 8.5 分，收在 32.122 元，站上逾 2 周以來新高，總成交量合計共 15.915 億美元。


聯準會官員釋放鴿派訊號，壓抑美債殖利率及美元指數漲勢，新台幣早盤在外資湧入帶動下，早盤強彈逾 1 角，午盤過後升幅一度擴大，推升匯價高點來到 32.068 元，但尾盤時外資匯入規模縮小，令新台幣升幅收斂，終場收在 32.122 元。


外匯交易員表示，新台幣今天大幅升值主要來自於外資匯入所帶動，帶動匯價逼近 32 元整數關卡，聯準會官員釋放鴿派訊號，令市場解讀 11、12 月升息機率降低，美元指數應聲回落，讓包含新台幣在內的亞幣應聲翻揚。


但要注意的是，以巴衝突多少會吸引資金湧入美元避險，因此儘管聯準會升息機率下降，但國際地緣政治衝突，預期仍將提供美元支撐空間，至於新台幣有無機會回升至 31 字頭，就得看聯準會有多鴿。


根據中央銀行統計，美元指數下跌 0.5%，主要亞幣中韓元升值 0.84%、日元升值 0.08%、人民幣升值 0.02%。",2023-10-11 18:22:55,15344,美國聯準會放鴿子讓美元指數降至 106，帶動非美貨幣彈升，新台幣兌美元今 (11) 日一度強彈逾 1.2 角，終場升幅收斂但仍升值 8.5 分，收在 32.122 元，站上逾 2 周以來新高，總成交量合計共 15.915 億美元。,[],9194a5be-b236-402c-8c47-a71dab8ec3ed
海運三雄9月營收年衰5成起跳 供需結構恐惡化,"['海運', '運價', '貨櫃', '陽明', '萬海', '長榮']","海運三雄陸續公布 9 月合併營收，由於第三季旺季不旺，單月合併營收年衰退均逾 50% 起跳，陽明 (2609-TW) 不諱言，經濟前景仍充滿挑戰，萬海 (2615-TW) 則表示，會審視個別航線效益並精簡成本。


長榮 (2603-TW)9 月合併營收 244.83 億元，月減 1.74%，年減 51.22%，第三季合併營收 728.25 億元，季增 8.07%，年減 57.27%，累計前三季合併營收 2070.36 億元，年減 59.9%。


陽明 9 月合併營收 122.08 億元，月減 0.24%，年減 56.36%，第三季合併營收 359.01 億元，季增 2.44%，年減 64.03%，累計前三季合併營收 1079.01 億元，年減 65.85%。


萬海 9 月合併營收 82.42 億元，月減 3.82%，年減 55.66%，第三季合併營收 250.48 億元，季增 2.36%，年減 60.74%，累計前三季合併營收 750.76 億元，年減 65.79%。


陽明表示，受全球油價上漲影響，通膨升溫，市場需求持續疲軟、製造業景氣陷入低迷，加上美債殖利率波動帶來金融市場震盪，經濟前景仍充滿挑戰，需審慎應對各種不確定性，並適時調整經營策略。


萬海則提到，受中國十一長假因素和市場供需影響，部分航線運價略有回落，會持續審視個別航線效益、精簡成本，以維持公司經營效率。


長榮則在日前的法說會坦言，明年除非發生足以扭轉供需的重大事件，例如新冠疫情，否則仍是供需失衡、充滿挑戰的一年。


據法國海運諮詢機構 Alphaliner 最新預測，今年供給成長為 8.2%，需求成長為 1.4%，明年供給成長更擴大至 9.1%，需求成長僅略升至 2.2%。


據 Alphaliner 統計，第四季航運市場將交付約 87 萬 TEUS 新造船，然而，截至 9 月 25 日，全球約有 3.4% 貨櫃船隊 (94 萬 TEUS) 處於閒置狀態，閒置船舶運力於第四季至明年第一季的傳統淡季，恐將逐步上升。",2023-10-11 18:24:03,15343,海運三雄 9 月營收年衰 5 成起跳 供需結構恐惡化,"['陽明', '萬海', '長榮']",5cea136c-ca61-4ccc-8732-2ffd8267eddb
國安基金已出脫6成持股 逾60億元收益入袋,"['國安基金', '台股', '護盤', '以巴衝突']","國安基金今 (11) 日召開第 3 季例會，通過第 3 季財報，截至 9 月底共已出脫約 6 成持股，其中認列實現利益約 53.3 億元，股利收益約 13.5 億元，合計實現損益加股利收益共約 61.8 億元。


國安基金自今 (2023) 年 4 月 13 日退場後，逐次在市場出脫持股，根據最新出爐的財報顯示，截至 9 月底止，國安基金已經出脫約 6 成持股，目前還持有股票市值 259.8 億餘元，扣掉持股成本 230.09 億元後，未實現資本利得約 29.7 億多元。


考量升息循環、俄烏戰爭等外在因素對股市的衝擊，國安基金自去 (2022) 年 7 月 13 日起進場護盤，並在今年 4 月 13 日決議退場，結束長達 275 天、史上最長的護盤任務。


根據國安基金公布財報資料，此次護盤共投入 545.08 億元資金進場，護盤金額為史上第三高。


國安基金表示，台股近期受美股連動及國際政經波動震盪走弱，但外銷減幅收斂、出口轉正，內需持續活絡及政策支援擴大投資，支持經濟成長及股市穩定。


國安基金表示，考量國際政經情勢詭譎多變，通膨上行風險猶存，主要國家貨幣政策分歧，地緣政治風險仍高，國安基金將持續關注各項國內外政經情勢變動及影響情形，在不影響金融市場穩定之原則下，依規定審慎就操作標的適時予以處理。


至於近期爆發的以巴衝突，國安基金官員認為，目前看來油價沒有太大波動、美股則持續上漲，因此對於金融市場的實際影響還要進一步再觀察，但強調國安基金將持續緊盯市場及資金走勢。",2023-10-11 18:28:32,15342,國安基金今 (11) 日召開第 3 季例會，通過第 3 季財報，截至 9 月底共已出脫約 6 成持股，其中認列實現利益約 53.3 億元，股利收益約 13.5 億元，合計實現損益加股利收益共約 66.8 億元。,[],c089af6f-9b82-43c0-bdea-3e0643bbc054
〈華懋轉上市〉在手訂單超過20億元 明年營運創新高,"['華懋', 'VOCs', '工程', '台積電']","華懋 (5292-TW) 預計年底前掛牌上市，今 (11) 日舉辦媒體茶敘，總經理林國源表示，今年營運大致持平去年，明年在台灣、海外地區接單成長下，能見度已經直達明年底，營運可望創新高；法人指出，華懋目前在手訂單超過 20 億元。


華懋目前實收資本額 3.08 億元，主要從事半導體產業揮發性有機氣體 (VOCs) 處理及污染防治設備、工業用除濕工程及相關維修保養服務，客戶群囊括台灣半導體主要大廠。


華懋指出，受惠台灣半導體業者擴建新廠，帶動 VOCs 工程設備需求熱絡，近兩年營收年增幅均逾 30%，今年雖受景氣放緩、下游去化庫存影響，不過，每年的設備保養維修服務需求仍持續成長，加上大客戶以外的工程陸續認列，全年營運仍可持平去年。


華懋維修業務比重約 15%，林國源看好，公司每年都會銷售新設備，隨著銷售設備不斷疊加，維護保養的需求也跟著成長，尤其是老舊設備維護保養的費用更高，因此今年維修相關業績仍持續提升，加上其為高毛利產品，也可推升整體毛利率。


華懋今年上半年營收 10.34 億元，年增 11.17%，營業利益 1.63 億元，年增達 60.43%，稅後淨利 1.45 億元，年增 38.65%，每股稅後純益 4.72 元，全數改寫同期新高，毛利率與營益率分別為 22.6%、15.77%。",2023-10-11 18:55:34,15341,華懋 (5292-TW) 預計年底前掛牌上市，今 (11) 日舉辦媒體茶敘，總經理林國源表示，今年營運大致持平去年，明年在台灣、海外地區接單成長下，能見度已經直達明年底，營運可望創新高；法人指出，華懋目前在手訂單超過 20 億元。,['華懋'],5378c88a-5996-4251-bd5c-4145c2ba0f4e
中鋼9月稅前盈餘月增11倍 Q3力守獲利,"['中鋼', '自結損益', '鋼鐵']","中鋼 (2002-TW) 今 (11) 日公告 9 月自結損益，稅前盈餘 5.14 億元，月增 11.2 倍、較去年同期虧轉盈；第三季稅前盈餘 1.54 億元，季減 91.2%、年減 90%，每股稅前盈餘約 0.01 元；累計前三季稅前盈餘 18.38 億元，年減 94%，每股稅前盈餘約 0.12 元。


中鋼 9 月營收 294.68 億元，月減 3.6%、年減 18.8%；營業利益 3.66 億元，月增 28.4%、較去年同期虧轉盈，營益率 1.2%，月增 0.3 個百分點，每股稅前盈餘約 0.03 元。


中鋼第三季營收 882.29 億元，季減 7.5%、年減 16.2%；營業虧損 4.93 億元，較前季轉虧。累計前三季營收 2749.32 億元，年減 22.4%；營業利益 9.18 億元，年減 96.4%，營益率 0.3%，年減 6.8 個百分點。


公司說明，9 月加計子公司中龍出貨量約 95 萬噸，略低於原先近百萬噸的目標，導致營收下滑，但受惠月盤盤價續漲、單位成本下降，仍支撐本業獲利，加上業外也有礦業投資獲配股利等挹注，推升整體獲利表現。",2023-10-11 18:56:17,15340,中鋼 (2002-TW) 今 (11) 日公告 9 月自結損益，稅前盈餘 5.14 億元，月增 11.2 倍、較去年同期虧轉盈；第三季稅前盈餘 1.54 億元，季減 91.2%、年減 90%，每股稅前盈餘約 0.01 元。,['中鋼'],6cb54cfc-4b7b-4662-8307-1c9e0de446c6
