content,publish_at,id,summary,title,keywords,related_stocks,uuid
"在市場主流趨勢帶動下，2025 年晶圓代工廠與其外包封測夥伴將讓 CoWoS 產能翻倍，同時一線封測廠也積極投入類 CoWoS 產線擴充，擴廠所需的設備訂單開始大舉釋出，包括由田 (3455-TW)、迅得 (6438-TW) 及群翊 (6664-TW) 都相繼擴充產能因應，而今年來自半導體設備的營收倍增且將跨越整體營收的比重 50%，帶動獲利的大幅彈升。


其中，由田因應半導體相關設備需求帶動訂單的擴張，將在桃園平鎮廠進行擴廠，投資的土木、機電工程金額合計達 1.35 億元，主要是由田爲這一波半導體設備採購本土化趨勢的受益者，獲得封測大廠 CoWoS 與類 CoWoS 採購訂單，用於黃光相關中介層製程。


同時，且因封裝上排版尺寸效益的關係，FOPLP 議題頗受市場關注，由田布局相關領域，2025 年可望開始收割，同時，由田在自動巨觀檢測端，也已經接到來自半導體業者訂單，兩者成為驅動 2025 年由田營收及獲利成長的主要動能。


而擬發行 4000 張現增股籌資的迅得，決議對現增案以 2 月 12 日爲除權交易日，全部繳款程序在 3 月底前完成。迅得的此一市場籌資案暫訂以每股 180 元發行，擬自市場募集 7.2 億元


迅得 2024 年全年營收 51.21 億元，年減 11.86%。2024 年前三季迅得營收 38.37 億元，稅後純益爲 2.8 億元，每股純益爲 3.71 元。迅得預計 2025 年來自半導體設備的營收將占總體營收 55% 以上。


在產能規劃方面，迅得由於新建中壢新生廠的廠房高達 1.2 萬坪，並即將完工，公司預計 2025 年第二季底前完成進駐，迅得中壢新生廠相較楊梅廠及榮民路中壢廠完整且面積大。


群翊完成發行無擔保轉換公司債 (CB) 案，籌資 13.37 億元， 同時，群翊 2025 年營收估可望有 3-5% 的成長，同時在半導體設備上，在營收占比將提高到 50-60%。


同時，群翊因應未來市場產品需求，因現有廠房的樓面承載重量負荷及追求高階產品環境潔淨度，擬向關係人購置土地用以新建廠房供未來產品生產營運使用，取得桃園市楊梅區約 2830 坪，交易總金額 6.22 億元，將在今年初完成交割並展開建廠設計。群翊對於楊梅新廠的建廠進度規劃，預計規劃 100 級無塵室設計，預售將在 2026 年第四季建廠完成，預估年營收增加 6 億元。


群翊 2024 年前三季營收爲 18.51 億元，毛利率 51.16%，年增 3.52 個百分點，稅後純益 6.79 億元，年增 11.46%，每股純益 11.59 元。",2025-02-01 08:10:15,34417,2025 年晶圓代工廠與其外包封測夥伴將讓 CoWoS 產能翻倍，同時一線封測廠也積極投入類 CoWoS 產線擴充，擴廠所需的設備訂單開始大舉釋出，包括由田、迅得及群翊大舉投資擴廠。,〈觀察〉設備廠搶食半導體先進封裝龐大商機 投資擴廠急急急,"['迅得', '由田', '群翊', '半導體', 'CoWoS']","['由田', '迅得', '群翊']",770cc7ca-9152-46dc-b46f-6b6ccc0aa899
"輝達執行長黃仁勳、特斯拉執行長馬斯克、台積電董事長魏哲家等大咖紛紛點出「機器人」趨勢，此外，美國總統川普上任後簽署行政命令，「要讓美國成為 AI 世界之都」，可望加速推進 AI 機器人發展。上銀 (2049-TW) 近年積極投入 AI 機器人關鍵零組件研發，自身具備「美國製造」優勢，未來規劃擴大在美布局，包括機電及機器人整合服務，全年目標力拚營收、獲利雙成長。


上銀攜手美國物流新創公司合作發表新一代專用型的物流 AI 機器人，董事長卓文恒先前透露，預計今年先小量出貨，年底逐步放量，這款 AI 物流機器人具有上下料功能，搭配 AI 視覺模擬判斷系統，上銀主要供應機械手臂。


對於 AI 機器人相關應用，卓文恒持樂觀看法，上銀仍將主攻專用型機器人，儘管目前機器人營收占比還不到 10%，但未來營收占比會再進一步提升。


川普再次重回白宮，「美國優先」已成為未來經貿政策之主軸，上銀布局美國超過 30 年，卓文恒預期美國市場未來滿有機會，上銀也會思考如何將機電產品、機器人等進一步與其他產業整合，提供在地服務。


除了物流領域外，上銀也將擴大布局晶圓機器人及人形機器人領域，卓文恒表示，美國檯面上的機器人公司，都開始與上銀美國子公司接觸，洽詢諧波減速機、交叉滾柱軸承等相關產品的合作機會。",2025-02-01 08:40:04,34416,輝達執行長黃仁勳、特斯拉執行長馬斯克、台積電董事長魏哲家等大咖紛紛點出「機器人」趨勢，此外，美國總統川普上任後簽署行政命令，「要讓美國成為 AI 世界之都」,〈潛力股〉跟著大咖布局AI機器人 上銀挾美國製造優勢,"['AI機器人', '美國製造', '上銀']",['上銀'],2a396789-5fc2-4178-af99-7ced39bac0fb
"輝達 (NVDA-US)GB200 機櫃將於第一季放量，將進一步推升伺服器機殼廠包含晟銘電 (3013-TW)、迎廣 (6117-TW) 以及勤誠 (8210-TW) 成長動能。 


晟銘電 GB200 SideCar 將出貨 營運再添柴火 


根據供應鏈調查，Meta(META-US)GB200 水冷機櫃 (SideCar) 採用廣達 (2382-TW) 自主研發的產品，並由晟銘電代工製造，將在第一季出貨，有望進一步推升營收表現。 


法人預估，Meta GB200 SideCar 將於 2 至 3 月出貨，初期出貨量約 700 至 800 櫃，占 Meta 份額超過 7 成，晟銘電為 Meta 主要供應商，若後續零組件供應順暢，有望帶動出貨量。除 Meta GB200 SideCar，Meta MTIA ASIC 伺服器已小量試產，法人預估，出貨量約 1000 櫃，也是今年晟銘電營運動能。 


此外，廣達也取得微軟 (MSFT-US)GB200 訂單，晟銘電有望因此受惠，加上 GB300 可能搭載 3 櫃 SideCar 法人持續看好，晟銘電營運表現， 


晟銘電泰國廠預計今年完工投產，廠區約 6.9 萬平方米，正式投產後可提升 3 成的產能。 


迎廣水冷產品第一季出貨 水冷營收比重看增 


迎廣積極切入水冷領域，第一季伺服器啟動出貨，迎廣也接到相關訂單，預期今年水冷相關營收比重將持續提升。 


另外，迎廣也積極布局海外，美國廠方面，過去多以銷售為主，但現在也在美國設廠，以因應川普 2.0。美國廠位在洛杉磯，總計投入 400 萬美元 (約新台幣 1.3 億元)，第一階段投入 3 條彈性生產線，預計今年第一季就會投產。 


馬來西亞廠部分，迎廣則指出，第一階段以系統組裝為主，預計今年第三季投產，機構製造則因製成較為複雜，進度將較系統組裝落後 2 至 3 季，未來也不排除製造水冷相關產品，預期馬來西亞廠將在 2026 年開始發酵貢獻。 


勤誠 GB200 出貨在即 成長可期 


勤誠為 GB200 氣水冷機殼主要供應商之一，今年第一季啟動出貨，加上 B200 高 U 數的伺服器機殼逐步放量，需求強勁，法人看好，將進一步帶動勤誠營收成長。 


勤誠表示，公司持續關注外部環境變化，並隨時調整方向，也因考量地緣政治風險，「全球製造在地化」成為公司近年的布局策略。已完成勤鋒廠搬遷作業，從五股廠區搬至樹林廠區，進行 NCT 擴產規劃，更快速滿足客戶打樣需求。 


海外布局方面，去年底也啟動美國加州廠以及馬來西亞廠的建置。其中，馬來西亞廠區為勤誠首座東南亞生產基地，預計在 2026 上半年投入試量產，看好馬來西亞廠成為東南亞資料中心樞紐。未來廠區建置完成後，有機會服務更多客戶，並成為公司中長期的成長動能。",2025-02-01 09:40:04,34415,輝達 (NVDA-US)GB200 機櫃將於第一季放量，將進一步推升伺服器機殼廠包含晟銘電 (3013-TW)、迎廣 (6117-TW) 以及勤誠 (8210-TW) 成長動能。 ,〈蛇年產業景氣前瞻〉輝達GB200第一季放量 機殼族群喜迎出貨潮,"['輝達', 'GB200', 'AI伺服器', '機殼', '晟銘電', '迎廣', '勤誠']","['晟銘電', '迎廣', '勤誠', '廣達', '輝達', '微軟', 'Ball元宇宙ETF', 'Ball元宇宙ETF']",6c0d2da5-352f-4fbe-8ad7-3c06bd6b453c
"Windows 10 將於今年 10 月 14 日終止支援，加上新一代 AI PC 陸續上市，IDC 預期將帶動 2025 年全球 PC 市場年增 6%。台廠華碩 (2357-TW)、宏碁 (2353-TW) 等品牌廠已搶先推出搭載新世代處理器的 AI PC 新品，瞄準換機商機。


IDC 指出，2024 年第四季全球 PC 出貨量雖因部分國家補貼政策和年終促銷帶動，年增 1.8% 達 6890 萬台，但表現不如預期。不過，製造端拉貨比下游需求強勁，主要是廠商擔心美國新政府上任後可能對中國產品課稅。


在顯示卡市場，輝達與超微於 CES 發表新款電競 GPU，其中輝達新款 RTX 5090、5080、5070 系列顯示卡效能較前代翻倍，AMD 則推出 RX 9000 系列 GPU，預計今年首季開始銷售，新 GPU 與 3A 遊戲推出將加速顯卡換機潮。


另外，華碩日前指出，筆電使用年限約 3-4 年，2019 年就曾出現一波大規模汰換，在顯卡、AI 技術提升、作業系統更新情形下，都將陸續帶動新一波換機潮。


AI PC 產品方面，華碩推出重量不到 1 公斤的全新 Zenbook A14，號稱是全球最輕的 Copilot+ PC；宏碁則擴大 AI PC 產品線布局，推出多款搭載 Copilot 功能的筆電和桌機新品。",2025-02-01 10:10:03,34414,Windows 10 將於今年 10 月 14 日終止支援，加上新一代 AI PC 陸續上市，IDC 預期將帶動 2025 年全球 PC 市場年增 6%。台廠華碩 (2357-TW)、宏碁 (2353-TW) 等品牌廠已搶先推出搭載新世代處理器的 AI,〈觀察〉AI PC 換機潮已現 台灣電腦廠迎拉貨商機,"['華碩', '宏碁', 'AIPC']","['華碩', '\ufeff宏碁']",7fff1208-fac5-4f0f-93db-830b2d817cf0
"美國新任總統川普自去年 11 月當選到 1/20 就任，「川政」動向持續為舉世矚目。金蛇年前夕《鉅亨網》獨家專訪總體經濟專家吳嘉隆，拆解川普 2.0，預測中國在高關稅壓力下，企業將紛紛出走、資金流向美國，看好美股持續帶動台股走升，指數扣關 3 萬點，台積電上看 1800 元，他提供在複雜經濟情勢下的「簡單投資策略」與投資人分享，並看好晶片、AI、機器人、無人機及矽光子 5 種產業。


吳嘉隆首先指出，川普 2.0 有兩大主軸，地緣政治與經濟。在地緣政治方面，他要對普丁施壓，以結束烏克蘭戰爭，手段之一即是降低油價，打擊俄羅斯的財政收入。再加上，川普退出巴黎氣候協定，不再支持綠色能源這個民主黨政府的「神主牌」，相對傳統能源的生產會增加。綜合這兩個因素，美國油價會走低，有助於減輕通膨壓力，也有助於美國聯準會恢復降息的操作。


除了油價，川普 2.0 經濟對策另一重點，即是關稅。他在競選時提及要對所有國家課徵「普遍性關稅」，這會有兩個效果，第一是增加財政收入，在財政平衡原則下，川普會在其他地方減稅，如降低所得稅與營業稅。這麼一來，美國的家庭消費與企業投資會得到刺激，有助於美國實體經濟的擴張。


第二個效果是，這會逼外國製造業乾脆來美國投資，把生產線設在美國境內，可節省關稅，也增加美國的就業機會與政府稅收。增加就業機會一直是川普經濟政策的核心，因他關心社會基層，許多藍領階級在全球化浪潮受到壓抑，許多就業機會移轉到中國與印度。可預見的，在普遍性關稅下，許多國家將不得不增加對美國的投資。


至於對中國課徵高關稅，吳嘉隆認為，將給中國經濟帶來龐大壓力，不但外資會撤離，即連中國企業也可能到第三國去設廠，或利用第三國來間接出口，以便規避關稅。若果如此，也會加速資金離開中國，回流美國，讓人民幣進一步貶值。


吳嘉隆強調，基於以上幾點，「資金回流美國是肯定的」，這將有助於美元指數維持上升趨勢。同時，這些資金進入美國之後，大部分會變成美國公債的買盤，有助於支撐美國公債的價格，壓低美國公債殖利率上漲的力道。若不是資金流入，美國十年期公債的殖利率可能早就站上 5% 了。


至於資本市場，吳嘉隆認為，在資金與信心的支持下，美國股市會反映 AI 革命在商業應用的擴大，會看到企業營收與獲利的上升，將有助於推升 EPS 與本益比。可預見美國股市的持續走高，將帶動台股跟著持續上揚，並推升大盤挑戰 3 萬點。


2024 年台股漲幅高達 28%、傲居全球第二，金蛇年的台股前景如何？吳嘉隆建議：持續押注具有成長動能的科技股，例如晶片，AI，機器人，無人機，矽光子這 4 大熱門領域，因為他們的成長動能會點燃經濟與股市的熱度。至於個股，可針對具成長動能的族群，挑選具領導地位的企業，長期續抱，不必在乎短線波動。


吳嘉隆表示，有個最簡單的懶人投資策略：長線持有台積電 (2330-TW)(TSM-US)，買不起 1 張就用零股持續累積成 1 張，它未來 1 年的 EPS 估計有 50 多元，隨著海內外的新廠陸續完工量產，會成長到 80 多元，本益比用保守的 20 倍來估計，現在 1100 元左右的台積電，有機會成長到 1600 到 1800 。他鼓勵投資人，只要台積電價位有拉回，都可以買起來放著，「就當作是在買銀行的定存」。",2025-02-01 10:40:58,34413,美國新任總統川普自去年 11 月當選到 1/20 就任，「川政」動向持續為舉世矚目。《鉅亨網》獨家專訪總體經濟專家吳嘉隆，拆解川普 2.0，預測中國在高關稅壓力下，企業將紛紛出走、資金流向美國，看好美股持續帶動台股走升，指數扣關,〈名家開講〉吳嘉隆：經濟情勢越複雜、投資策略越簡單 台股上看3萬 5大產業看俏,"['台股', '美股', '台積電', '川普', '中國', '關稅']","['台積電', '台積電']",a622cbd7-8c3d-4acb-9eaf-e0513af6ba3d
"紡織大廠遠東新 (1402-TW) 擴大車用布局，公司看好，輪胎簾布等近年成長快速，今年可望維持 20-30% 成長，因應長期需求，遠東新也規畫明後年在越南、中國無錫，可望進一步發揮垂直整合效益。


遠東新旗下的工業纖維群產品目前涵蓋三大領域，包括永續環保綠色產品、穩定成長車用材料、高效能差異化產品，近年也積極將永續材料應用於安全氣囊、輪胎簾布等車用關鍵材料。


遠東新表示，目前與多家國際知名車材廠合作，安全氣囊切入歐系、日系 Tier 1 車廠供應鏈；輪胎簾布近三年成長快速，去年銷售量有 2000 多噸，今年可望維持 20-30% 成長。


因應長期需求，遠東新也啟動擴產計畫，越南廠 2026 年將達成 SFT 酯粒年產能 8 萬公噸，工業絲 5.5 萬公噸的目標；中國無錫廠 2027 年完成氣囊布年產能 8000 公噸，氣囊袋 1800 萬只的產能擴充，可望垂直整合及規模效益。",2025-02-01 11:10:03,34412,遠東新衝刺車用紡織布局 越南、中國明後年擴產,遠東新衝刺車用布局 越南、中國明後年相繼擴產,"['遠東新', '紡織', '車用']",['遠東新'],49b32e6c-bf06-4ef9-810e-c29032b91456
"美國新總統川普可能祭出高關稅政策是 2025 年受到全球矚目的大事，不過，不少從事金屬加工製造業的台商早有準備，無論是開始評估在美國設廠、或是設廠在東南亞，包括 jpp-KY(5284-TW)(經寶精密)、光隆精密 - KY(4581-TW)、金興精密 (7732-TW)，反而有望在新一波美中貿易戰下受惠。


長期深耕泰國的經寶指出，今年同時滿足了天時、地利和人和，除了工廠基地深耕於泰國，在 AI 的需求帶動下，已成為客戶尋求伺服器解決方案的最佳合作夥伴，除了 AI 伺服器的機櫃、機殼和電源機構件、水冷機構件及擴充機構件都在密集的生產準備當中。


為因應接單，經寶正興建三層樓的新廠房，預計下半年完工，並在現有基地的後方新購土地，提前為未來充分準備。


金興精密同樣設廠於泰國，自川普當選新任美國總統後，AM 件快速迎來轉單效應，金興認為，後續美中貿易衝突若加劇，將有利帶來更大的轉單，已開始從 AM 市場加大力道跨足 OE，拚 5-6 年後將 OE 營收占比拉升至 20%。


光隆精密則表示，因應美國市場日益增加的在地生產需求，去年在美國印第安納州完成購置土地和廠房設施，初期將作為物流倉儲中心，計畫今年啟動 2 號廠房興建和生產線導入計畫。


目前光隆精密接獲主要客戶新開發及量產總成件於美國生產項目，其他客戶北美市場新開發件也陸續展開。",2025-02-01 11:40:02,34411,川普 2.0 盤點貿易戰烽火下的金屬加工受惠業者,〈蛇年產業景氣前瞻〉川普2.0 盤點貿易戰烽火下的金屬加工受惠業者,"['光隆', '金興', '金屬加工', '貿易戰', 'jpp', '經寶']","['jpp-KY', '光隆精密-KY', '金興精密']",b957369b-4d57-4714-bf21-68227e44a187
