title,keywords,content,publish_at,id,summary,related_stocks,uuid
〈Q2產業前瞻〉出入境旅遊熱度升 旅遊業榮景來了！,"['旅行社', '出境', '觀光', '出國', '華航', '長榮航', '虎航', '星宇']","疫情影響式微，觀光業從去年第四季起迎來春燕，除了國旅大爆發，甚至出入境旅客人數也快速成長，旅行社正積極推動出境旅遊行程、甚至開展街邊門市，而接待來台商務和觀光旅客的飯店業，住房也相當熱絡，航空公司更是跨境旅遊第一線受惠者，可以樂觀預期，壓抑已久的觀光市況，將一路熱至暑期旺季。


國內旅行社龍頭雄獅 (2731-TW) 近期重啟展店計畫，預計今年開出 8-10 家據點，且第二季將開出海外的香港和溫哥華門市，藉此同步搶啖 outbound 和 inbound 市場。


而雄獅關係企業旅天下看準地區小型旅行社擁有廣大在地客群優勢，透過「通路」和「產品」加盟策略，將全力深耕二三線城鎮，預計至 2025 年在全台達百間門市加盟商；為增添品牌知名度，旅天下規劃第二季申請公開發行、第三季登錄興櫃，力拚成為疫後首間掛牌旅行社，


隨著出境旅遊越來越暢旺，航空業同為第一線受惠者，華航表示，東北亞、東南亞旅客湧現，因此，台灣出發每周往返日韓已有約 150 班，3 月 26 日起再復飛釜山、增班曼谷、金邊等旅遊熱門目的地，第二季客運動能強勁。


而台灣虎航 (6757-TW) 也將於 5 月 10 日開航普吉島，是繼曼谷廊曼後，飛往泰國的第二個航點。


長榮北美航線自 3 月 27 日起陸續增班，5 月 15 日起將達每周 84 班，回到疫前水準。


除了出境旅遊景氣佳溫，不少國內五星飯店業者預期，最慢第三季住房市場將回到疫前水準，尤其全球最大連鎖飯店集團萬豪國際和第二大的洲際酒店集團 IHG 陸續宣示，有持續在台拓點計畫，可以預見，觀光業的榮景即將再現。",2023-04-04 10:00:03,9117,出入境旅遊熱度升 旅遊業榮景來了,"['雄獅', '台灣虎航']",51202682-259a-44f0-bd6b-af5a0f8513f1
〈Q2產業前瞻〉PCB廠Q2能見度低 靠汽車板及低軌衛星板訂單支撐,"['華通', '健鼎', '欣興']","PCB 產業產能利用率自 2022 年第四季開始明顯下滑，且今年在第一季仍受到消費性電子去化庫存的不利影響，產能利用率並未見回升，迄今的訂單能見度不高，大型 PCB 廠對第二季業績表現無過多樂觀看法，而相對穩定的則是在汽車及低軌衛星的應用端 PCB。


華通 (2313-TW)2023 年 1 月及 2 月的實際營收都在 50 億元之下，3 月營收也難有樂觀預期，而過去 PCB 廠在第二季因工作天數的增加而有較佳的營收表現慣性，但 2023 年第二季恐怕難以見到，也就是說，整體上半年就是個「淡」字。


不過，法人預期，華通今年呈先蹲後跳。低軌衛星和美系客戶筆電新訂單，是華通 2023 年上半年淡季營運的重要支撐，同時，對華通而言，來自中國自有品牌手機板訂單，可能在第二季略有回溫。


而健鼎 (3044-TW) 今年所看好的應用端產品在汽車及伺服器應用，健鼎目前在汽車板的庫存持續獲得去化，但在目前因 ChatGPT、AI 應用對來自伺服器板則的訂單期待，健鼎則認為伺服器因重新設計所觸發的訂單，預估要到第三季才會明顯醱酵。


健鼎第一季以降載、去化庫存以維持獲利競爭力，目前認為 2023 年第二季營收持平於第一季，但並不排除有較首季微增的機會。


在目前整體終端消費市場在通膨、去化庫存同時，PCB 廠如欣興 (3037-TW) 仍指目前市場能見度低，並且鼓勵員工多多休假，並且指望 AI 及 HPC 的需求儘快出現。",2023-04-04 11:00:07,9116,PCB 產業產能利用率自 2022 年第四季開始明顯下滑，產能利用率並未見回升，迄今的訂單能見度不高，大型 PCB 廠對第二季業績表現無過多樂觀看法，而相對穩定的則是在汽車及低軌衛星板。,"['華通', '健鼎', '欣興']",364a648a-55d0-4be8-b815-bcdfe3122543
〈Q2產業前瞻〉矽光啟動新傳輸革命 800G交換器將進入CPO時代,"['矽光', '矽光子', '交換器', 'CPO', '光纖', '傳輸', '銅線', '博通', '騰訊', '眾達', '波若威', '聯亞']","後疫情時代全球數位需求大幅成長，各大科技業、企業大規模積極建置資料中心並提高傳輸速度，然而，半導體系統的電氣線路連接已日趨達到資料傳輸速度的極限，光纖、晶片整合的矽光子技術已成為下一代趨勢，光通訊業者認為，交換器傳輸速度進入 800G 後，將正式進入矽光共封裝 (CPO) 的天下。


博通 (AVGO-US) 在去年 8 月推出 Tomahawk 4 25.6TB CPO 交換器 Humboldt，功耗、成本皆較以往傳統交換器節省 5 成，緊接著在今年 3 月正式發表 Tomahawk 5 51.2TB CPO 交換器 Bailly，效能持續躍進。


博通強調，一台 Tomahawk 5 51.2TB CPO 交換器將能替代 48 台 2014 年推出的 Tomahawk 1 舊式交換器。


運算需求提升下，傳統模組功耗問題已浮上檯面，眾達 - KY (4977-TW) 指出， 傳統要做到 51.2 TB 超高傳輸交換器，除了光模組用量將大幅增加，散熱表現也不佳，因此，矽光 CPO 交換器成為高傳輸時代的最佳解決方案。


業者指出，100、400G 交換器仍多使用銅線傳輸，此階段銅線具備低成本、高傳輸優勢，但隨著 800G 時代來臨，800G 交換器搭配銅線傳輸將會出現信號衰減現象，成本、能耗表現也不佳，勢必會限制 800G 交換器的成長。


波若威 (3163-TW) 表示，現階段 400G CPO 設備都還在客製化階段，各大科技大廠紛紛指出，800G 才會擴大 CPO 的應用，未來相關 ASIC、設備廠商將是主要受惠族群，包含博通、超微、輝達、思科等。


波若威認為，光通訊廠商也將分一杯羹，CPO 時代光通訊產業同樣擁有光線捆束 (fiber harness) 市場，並能進一步搶進光纖繞線 (fiber routing) 設備商機，隨著交換器速率倍增，客戶多能接受設備零件成本增加 50%，這可望帶動光通訊零件產值增加 50%。


矽光磊晶片大廠聯亞 (3081-TW) 也看好矽光的應用，近期市場逐步推動 CPO 的開發，公司指出，今年 1 月已開始出貨 800G 矽光雷射磊晶片給美國網路大廠，預估第二季出貨量將進一步較本季倍增，矽光 CPO 等應用可望在 2025 年後正式發酵。


聯亞表示，目前矽光業務多為美國客戶，預計今年還會有 4-5 個專案分別進入量產，目前除矽光磊晶片以外，未來也不排除向下拓展至晶片製造服務，研發團隊正持續相關開發與研究。",2023-04-04 13:00:05,9115,無摘要,"['眾達-KY', '波若威', '聯亞', '博通']",80a1ac6e-5aa7-47be-bd10-8c131cc4bdcf
逸達過敏性氣喘新藥二期臨床 主要指標數據正向,"['逸達', '氣喘', '新藥', '臨床', '解盲']","逸達 (6576-TW) 今 (4) 日公布旗下治療過敏性氣喘新成分新藥 MMP-12 抑制劑 FP-025 的 2A 期概念性驗證試驗結果，三項主要療效指標分析中，有兩項達到統計顯著差異，後續預計 1-2 個月完成次要指標，並將依規劃啟動授權。


逸達表示，此臨床試驗的主要療效指標是比較用藥組 (FP-025) 與對照組 (安慰劑) 在過敏原氣喘發作後 3-8 小時晚期氣喘反應 (簡稱 LAR)FEV1(用力呼氣 1 秒量) 曲線下面積 (簡稱 AUC) 之差異。


從敏感性家塵蹣小鼠之動物實驗數據顯示，FP-025 有持久的抗發炎功效以及疾病緩解作用，有鑑於發現此臨床試驗是使用交叉設計對氣喘患者進行首創新藥治療，因此評估是否存在可能的藥物治療延續性效應 (carry-over effect)。


此外，先服用 FP-025 再服用安慰劑之給藥順序，即使兩個給藥期間已間隔 3 至 7 週的藥品洗除期 (washout period)，仍發生顯著的延續性效應 (P-value = 0.0340)，顯示第一個期間 FP-025 用藥的效果可能持續到同一受試者接受安慰劑的第二個給藥期間。


由於發現不在預期之內的延續性效應，因此統計學家以下列三種統計方法，進行臨床試驗之主要療效指標分析。


第一種是以同序列分析，比較給藥期間服用安慰劑以及給藥期間服用 FP-025(N=8) 同一受試者於過敏性氣喘發作後 3-8 小時晚期氣喘反應之 FEV1(用力呼氣 1 秒量) 與基準線相比之曲線下面積 (AUC) ，其結果指出，FP-025 用藥組與安慰劑組相較，達統計上顯著差異 (P-value = 0.0161)。兩條呼吸道反應曲線皆由同一位受試者生成，具有自身對照及較高之統計學顯著意義檢定力。


第二種是以同期間分析，在給藥期間 1 服用 FP-025(N=11) 與服用安慰劑組 (N=8) 比較，受試者於過敏性氣喘發作後 3-8 小時晚期氣喘反應之 FEV1 與基準線相比之曲線下面積，其結果顯示，用藥組與安慰劑組相比，雖未達統計上顯著差異 (P-value = 0.1302)，不過呈現正向趨勢。


第三種是以混合模式 (mixed-effect model)ANOVA 分析，於給藥期間 1、2 服用 FP-025(N=19) 與給藥期間 1 服用安慰劑 (N=8) 比較，受試者於過敏性氣喘發作後 3-8 小時晚期氣喘反應之 FEV1 與基準線相比之曲線下面積，其數據顯示，FP-025 用藥組與安慰劑組相比，達統計上顯著差異 (P-value = 0.0149)。


醫務長李怡聖表示，從數據顯示來看，FP-025 在試驗中有正面的發現，採以上 3 種統計方法進行主要療效指標分析，其中以同序列以及混合模式 ANOVA 分析方法，均顯示 FP-025 與安慰劑相較，達到統計上顯著之差異；另外以同期間分析 (於給藥期間 1 分別服用安慰劑及 FP-025)，雖未達統計上顯著差異，惟已呈現正向趨勢，目前正在進行次要療效指標分析，包括生物標記研究等，希望能更了解 FP-025 的作用機制，預計 1 到 2 個月內完成。


臨床試驗計畫主持人胸腔科權威醫師 Dr. Zuzana Diamant 以及阿姆斯特丹大學學術醫學中心 Dr. Rene Lutter 指出，考量首創新藥治療及交叉試驗設計，規劃 32 位可衡量受試者的初始樣本量，為一般類似性質之交叉試驗設計所需人數 (即每組 8 至 10 位) 的 2 倍，代表 19 位可衡量受試者已符合試驗設計。


此外，對於過敏原誘發氣喘以及 FP-025 而言，最初考量藥品洗除期時間 3 至 7 週，是依 FP-025 之藥動學數據，理論上 3 週時間已十分充足，不過因為延續性效應對於 FP-025 小分子藥物是非常罕見的，考量 FP-025 用藥期間短暫，能出現延續性效應是正面訊息。


董事長暨總經理簡銘達強調，FP-025 用於過敏性氣喘主要療效指標分析數據極具潛力，逸達再度達成另一重要里程碑，將依規劃啟動後續授權洽談。


逸達在荷蘭進行新成分新藥 MMP-12 抑制劑 FP-025 用於治療過敏性氣喘之 Phase 2a 概念性驗證試驗，共計收案 29 位受試者，其中包含 19 位可衡量受試者。


此試驗係一隨機、雙盲、安慰劑對照、兩給藥期間交叉的試驗，收治不吸菸、臨床穩定、輕度氣喘且具嗜酸性粒細胞（eosinophil）表達之患者。


臨床試驗設計兩個相同給藥期間 (各 12 天)，兩個給藥期間間隔 3 至 7 週之藥品洗除期 (washout period)；受試者以隨機交叉方式服用 FP-025 400 毫克或安慰劑一日兩次。",2023-04-04 13:05:31,9114,逸達 (6576-TW) 今 (4) 日公布旗下治療過敏性氣喘新成分新藥 MMP-12 抑制劑 FP-025 的 2A 期概念性驗證試驗結果，三項主要療效指標分析中，有兩項達到統計顯著差異，後續預計 1-2 個月完成次要指標。,['逸達'],70917c02-5daa-4583-a9e2-6f33e58e034f
〈Q2產業前瞻〉新藥廠陸續完成收案 推進臨床試驗,"['新藥', '臨床', '仁新', '昱展', '瑩碩', '生技股']","國內新藥廠持續推進臨床試驗進度，預計第二季陸續完成收案，包括仁新 (6696-TW) 斯特格病變新藥 LBS-008 三期試驗最快 4 月前完成收案，後續將規劃期中分析，昱展新藥 (6785-TW)、瑩碩 (6677-TW) 開發的新藥也將展開試驗。


仁新針對斯特格病變 (STGD1) 進行全球三期臨床試驗，包括在美國、英國、德國、比利時、瑞士、香港、台灣和澳洲等地，預計最快 4 月前完成收案 60 人，後續用藥治療與觀察期約 2 年，預計 2025 年中會完成臨床。


斯特格病成因複雜且為遺傳疾病，導致成人和兒童的中央視力模糊、甚至喪失，屬於罕見疾病，以美國市場來看，約有 3 萬名患者，由於尚未有核准藥物，患者年醫藥費達 5-8 萬美元。


昱展新藥旗下長效緩釋藥物 ALA-1000，為長效 3 個月皮下注射針劑，已與美國 FDA 完成臨床三期前會議 (End-of-Phase 2)，隨著完成國際授權，後續將由授權夥伴展開三期臨床試驗，有機會今年上半年提出正式文件。


瑩碩則有許多臨床開發案持續進行中，包括與祥翊的第一個合作品項，是治療嚴重痤瘡軟膠囊皮膚專科用藥，預計今年上半年將展開生體相等性 (BE) 試驗；與霖揚合作首個治療思覺失調症長效奈米針劑產品，也有機會在今年挺進 BE。",2023-04-04 14:00:06,9113,國內新藥廠持續推進臨床試驗進度，預計第二季陸續完成收案，包括仁新 (6696-TW) 斯特格病變新藥 LBS-008 三期試驗最快 4 月前完成收案，後續將規劃期中分析。,"['昱展新藥', '仁新', '瑩碩生技', '昱展新藥']",d3ff7105-33db-4444-80cd-4a8c53b0ef75
〈Q2產業前瞻〉紡織景氣脫離谷底 成衣、化纖廠營運回溫,"['儒鴻', '聚陽', '新纖', '南紡', '成衣', '化纖', '紡織']","隨著品牌客戶庫存去化狀況告一段落，紡織產業景氣漸脫谷底，不只成衣廠看好第二季營運將回升，化纖、紗線業者也認為，營運將呈現季增，且第三季有機會更好。


成衣大廠儒鴻 (1476-TW) 就直言，目前每個客戶去化速度不一，但好一點的已經看到下單動能回升，但就 3、4 月營收逐月向上，第二季開始會改善很多，下半年成衣市況將進一步好轉。


聚陽 (1477-TW) 則表示，雖然美系品牌客戶持續調節庫存，但日系客戶需求強勁，也有看到急單、短單需求浮現，同樣看好第二季業績會比首季好，逐步回到正常水準。


而新纖 (1409-TW) 化纖產品受惠品牌客戶庫存去化告一段落，需求脫離谷底，第二季可望回升，加上固聚有民生基本需求加持，狀況維持穩定，隨第二季旺季前備貨需求升溫、第三季進入旺季，營運將逐季回溫。


南紡 (1440-TW) 也受惠年後需求回升，稼動率已回到滿載水準，公司透露，訂單能見度已達上半年，預計第一季是谷底，第二季紡織業可望回到正常，營運也會看到較明顯回升，樂觀看待今年。",2023-04-04 15:00:06,9112,隨著品牌客戶庫存去化狀況告一段落，紡織產業景氣漸脫谷底，不只成衣廠看好第二季營運將回升，化纖、紗線業者也認為，營運將呈現季增，且第三季有機會更好。,"['儒鴻', '聚陽', '新纖', '南紡']",1c34f084-7508-4594-837b-fef0ade3b9d1
長榮股東會市價600元康寧隨行杯大方送 近23萬名零股股東想領有兩招,"['長榮', '股東會紀念品', '中鋼', '大魯閣', '散戶', '零股']","繼大魯閣 (1432-TW)、中鋼 (2002-TW) 等受到小股民期待的股東會紀念品公布後，去 (2022) 年大賺超過 3000 億元的長榮 (2603-TW) 也傳出，今年紀念品將由過往的超商 50 元商品券換成康寧陶瓷不鏽鋼真空保溫隨行杯，市價約 600 元左右，並將印有「EVERGREEN」字樣，但是近 23 萬名零股股東若想要領取只有親自出席等兩方式。


據統計，截至 3 月底，長榮股東數共有 38 萬 7165 人，其中，不足 1 張股票的零股散戶就達 22 萬 9799 人。


長榮去年稅後純益 3342.01 億元，年增 39.82%，每股純益 (EPS) 達 87.07 元，續寫獲利新高紀錄，除了每股擬將配發現金股利 70 元，連股東紀念品價值也大方提升。


據悉，今年長榮將送出的隨行杯外觀，以長榮集團主色綠色為主，並印上「EVERGREEN」字樣。


不過，小股民須留意，若是持股未滿 1000 股的股東，必須股東親自出席股東會，或以電子方式行使表決權者，才可領取。",2023-04-04 22:57:22,9111,長榮大方發股東會紀念品 康寧隨行杯市價約 600 元,"['大魯閣', '中鋼', '長榮']",979ac566-2b4d-41d7-8bda-f8be0bcf5cc4
