title,keywords,content,publish_at,id,summary,related_stocks,uuid
〈台股盤前要聞〉金控好匯賺、不能只看台積電 提防資金拉指數出中小股,"['台股', '台股盤前', '台股盤前要聞']","3/11 台股盤前要聞


台股上周五衝破 2 萬點寫下歷史的新里程碑，終場收在 19785.32 點，周漲 849.39 點，其中，台積電 (2330-TW) 周漲 13.79%，貢獻指數約 780 點，反觀同時，近 20 檔個股周跌幅在 20% 左右，更有超過 60 檔周跌超過 10%，不少投資人只能看著台積電「一個人的武林」；本周市場都在看，2 萬點能否成為行情的新地板，但須留意，輝達 (NVDA-TW) 周五大跌、費半指數重挫，居高思危氣氛正升溫，仍要提防資金拉指數、出中小股的壓力。


台積電 (2330-TW)(TSM-US) 即將在 3 月 18 日進行除息，每股將配發約 3.4998 元現金股利，以外資現有持股 1934 萬 7455 張推算，外資可望領走 677.12 億元，同時，距離上次除息交易日，台積電一共飆漲 202 元，等同外資持有台積電，股息、資本利得兩頭賺。


14 家上市金控今年 2 月自結獲利出爐，儘管適逢農曆春節假期及 228 國定假日，工作天數較少，但在
新台幣
匯率持續走貶下，壽險型金控大有斬獲，並在國內外股市伺機實現資本利得，14 家金控單月合計賺進 442.92 億元，累計前 2 月獲利逼近千億、達 982.07 億元。


貨櫃航商長榮 (2603-TW) 和陽明 (2609-TW) 2 月合併營收，長榮達 301.7 億元，創 2022 年 12 月來新高，陽明為 142.57 億元，也創去年 1 月以來新高，農曆年節期間業績淡季不淡，反映紅海危機帶動運價反彈。


上海航交所最新一期上海出口集裝箱運價指數 (SCFI)，較上周續跌 93.38 點至 1885.74 點，跌幅約 4.7%，合計農曆年來已跌掉約 10%，三大長程航線全面續跌，反映年節出貨少，處傳統淡季，貨攬業者也提醒，第二季船噸過剩壓力恐升高。


〈台股風向球〉台股 2 萬不能只看台積漲 80 檔周跌逾 1 成 提防賣壓暗潮


一張表速覽！14 家金控前 2 月海賺近千億 壽險好「匯」賺


台股上 2 萬最大推手 外資買超 432 億擠進史上前十大 今年已買 1783 億


海運業績隨運價反彈 長榮、陽明 2 月營收同創逾 1 年新高


SCFI 年後跌約 1 成 三大長程航線續跌 Q2 供給過剩壓力恐加劇


外資抱緊台積電 價差股息兩頭賺翻了 3/18 除息估領走 677 億元


全靠台積電今年來貢獻大盤 1600 漲點 台股市值衝破 62 兆元


台股個股焦點新聞


台積電 2 月營收月減 15.8% 累計前 2 月營收 3974 億元


聯發科 2 月營收 385 億元創次高 3 月營收可望回升


威剛去年 Q4 毛利率衝 19.74% 全年純益大增 7 成賺半個股本


先進光前 2 月營收達 6.14 億元創史上同期次高 年增 23%


飲料包材廠宏全去年每股純益達 8.6 元 擬配息 5.35 元


邑錡雙業務加上軍工業務大動能 強勢業績將延續到 2025


鮮活果汁去年獲利成長 EPS 達 12.41 元 擬配發每股 6.6 元股息


保瑞手握三大策略優勢 無懼胃食道逆流競品上市競爭


華航去年獲利年增近 140% 創 10 年來次高 EPS 1.13 元


長榮航 2 月營收創同期新高 春節助攻客運營收年增近 5 成


引進策略性投資人是「現在進行式」 遠東銀釋四大條件


伺服器挹注 緯創 2 月營收 9 個月來新高 年月雙增逾 2 成


廣達 2 月營收 843 億年月雙增 預期 Q1 受惠季底拉貨效應


〈群聯法說〉去年 Q4 賺一個股本 毛利率 36% 創新高 全年 EPS 18.48 元",2024-03-11 05:10:04,22195,台股盤前要聞,"['台積電', '長榮', '陽明', '台積電']",2f921bb0-d652-409e-8ea1-5c6c8b5891f4
輝達從+5%到-5%科技股拉警報?長榮外資上看2XX元,"['趨勢分析', '亨達投顧', '邱鼎泰', '輝達', '長榮', '正德', '凌群', '威盛', '昇貿', '華星光', '保瑞']","週五美股收跌科技股領跌，輝達 (NVDA-US) 股價大幅震盪收盤更大跌逾 5%，拖累美股那指和費半，2 月的非農數據市場解讀為利於 6 月的降息，美元指數急跌破 103 大關(現報 102.7)，黃金期大幅上漲一度扣關 2200 美元 / 盎司收盤漲 0.9% 報價 2185 美元，續創歷史新高，比特幣也首次跨越 70000 美元 / 枚，但過高後拉回現報 69100 美元 / 枚，週五道瓊小跌近 0.2% 標普指數跌幅為 0.6%，科技股那指 1.1% 費半大跌 4%，總計一週下來，道瓊累計下跌 0.9% 標普下跌近 0.3%，那指週跌 1.1% 費半一週則是小漲 0.6%。恐慌指數 VIX 週漲逾 7%。


美股今天開始夏令時間，開收盤都提前一個小時其他重要個股蘋果 (AAPL-US) 在連跌 4 天後反彈 1.0%，但一週仍跌近 5.0%，微軟 (MSFT-US) 跌 0.7%，META-US 跌 1.2%(創高)，亞馬遜 (AMZN-US) 跌 0.8%。伺服器大廠美超微 (SMCI-US) 從大漲逾 5% 但收盤反而下跌 1.7%，谷歌 (GOOG-US) 則是反彈 0.7%，費城半導體的輝達 (NVDA-US) 如前所述從大漲逾 5% 收盤卻大跌 5.5% 震盪逾 10%，超微 (AMD-US) 跌 1.9%，續創歷史新高，半導體權重股博通 (AVGO-US) 則因財測不如預期跌約 7%(請小心聯發科的拉回)，記憶體大廠美光 (MU-US) 跌 1.3%，台積電 ADR(TSM-US)跌近 2% 是歷史新高後拉回，日月光 ADR(ASX-US)前日再飆 10% 週五拉回 3.7%，特斯拉 (TSLA-US) 股價下跌 1.8%，AI PC 兩檔美股指標股英特爾 (INTC-US) 下跌 4.6%，戴爾 (DELL-US) 下跌 3.5%。兩檔減肥藥大廠諾和諾德 (NVO-US) 因為推出新的口服減肥藥前一日大漲 9% 週五回檔 2%，禮來 (LLY-US) 跌 2.3%。小型股羅素 2000 指數創波段新高後收平盤，那斯達克生技指數小漲 0.4%，散裝運價指數 BDI 續漲 4.1% 週漲 6.4%，BCI 海岬指數則上漲 6.6%，週漲 6.7%，台股夜盤指數下跌 75 點。




美股週五科技股引爆點在輝達，截至現在華爾街對輝達從 + 5% 到 - 5%，並未有明確的說法，或許可以歸究於漲多的獲利回吐，不過這也是一個警訊，知名的女股神伍德小姐則稱半導體晶片股將回調，市場則傳出輝達有意將股票拆四股，利於潛在投資者不致因為高價股望而卻步。不過正如老師說的美股科技確實也須要一個小波段的拉回才合理，當然輝達的拉回美股也將回檔這推論是合理的，重要的時間轉折約在 FED 的利率會議前後，這是之前老師說過的波段時間轉折。


僅管如此，我們卻不認是多頭將反轉為空頭，美股週五也是補漲股上漲，蘋果逆勢上漲就是很好的例子。相信台股接下來也會如此，上週五台股也出現之前無基之彈的個股開始大幅回檔了，因此，本週我們將以此為選股的方式。科技股選股為威盛 (2388-TW) 去年財報大幅成長從虧損 0.17 元轉盈為 0.82 元股價在晶片股位階相當低。AI 雲端軟體資安股凌 (2468-TW)2 月營收年月雙增(年增 21% 年增 15%)，去年營收也創下歷史新高，昇貿(3305-TW) 老師將其歸類在 COWOS，推荐的原因是基本金屬鍚價創下近 7 個月新高，矽光子看好華星光 (4979-TW)，理由是中國股市飆漲 CPO(矽光子) 概念股並且股價早拉回。電子次產業則看好遊戲 (免費語音有推荐) 和生技，生技股王保瑞 (6472-TW) 去年獲利 30 元(前年 18 元)，上週四宣佈實施庫藏股目前股價已來到庫藏股的低點附近，四月又是國內生技股波段的轉折月，值得留意。


非電子股中，持續看好海運股，海運股 2 月營收明顯轉佳，長榮 (2603-TW) 年增 61% 月增 6%，散裝輪部分年增最多的是正德 (2641-TW) 年增達 64%，近日 BDI 和 BCI 指數表現強勢，長榮 (2603-TW) 頻創新高是帶動海運的關鍵，在重電股漲幅已大，海運股或將成非電子的主流。最後仍要提醒投資朋友，黃金近日頻創歷史新高，黃金概念股金益鼎 (8390-TW) 也是本週重要的投資組合。


老師的免費語音近期大受歡迎，以上大漲的個股，一切都在老師的影音 (台股鑫攻略) 和免費會員語音。現在加入正當時。


近日操作難度提高了，投資朋友若有操作上或持股的問題歡迎加入老師的 LINE。


LINE 好友連結 : 
https://lin.ee/5fbMyC2


最新影音 (請點影音上方標題至 Youtube 收視品質會更佳)




您可以點選下方黃色圖，股票健診或詢問入會，將有專人會協助您!




台股鑫攻略，帶您掌握全世界，跟著邱老師，穩中求勝才是您的最佳操作策略。台股鑫熱線 02-2653-8299。


文章來源：邱鼎泰分析師 / 亨達投顧


本公司所推薦分析之個別有價證券

無不當之財務利益關係 以往之績效不保證未來獲利

投資人應獨立判斷 審慎評估並自負投資風",2024-03-11 07:51:08,22194,無摘要,"['長榮', '正德', '華經', '昇貿', '華星光', '保瑞', '金益鼎', '威盛', '輝達', '蘋果', '亞馬遜', 'Super Micro Computer Inc', 'Google', '超微', '博通', '美光', '台積電', '日月光', '特斯拉', '英特爾', '戴爾電腦', 'Novo Nordisk - ADR', '微軟', '禮來公司']",3cde6efa-f3a8-4b06-ab2d-499f9066ce38
週五美股及中小型股全面崩盤 AI準備泡沫嗎?,"['趨勢分析', 'AI', '摩爾投顧', '楊育華']","週五美股偏弱勢費半指數更是大跌 4.03%，AI 精神領袖輝達跌 5.5%、AMD、美超微、台積電 ADR 也全部下跌，很多人擔心會不會 AI 準備泡沫了? 先提醒大家不要想太多目前還沒有!! 不知道各位有沒有發現這些股票週五全部都是創歷史新高後拉回，這是短線上漲多正乖離過大會有的震盪、洗盤現象，且這一波上漲過程中還不只發生一次了!!


我們來看一下美超微在 2/16(五) 當天早盤再創歷史新高後，當天瞬間拉回跌快 20% 這幅度無敵嚇人，整理了 1 週多後股價再創歷史高，當時約 800 美元現在來到約 1200 美元再漲 50%，這就是我常說的多頭格局底下漲震震、漲震震的節奏，現在的拉回暫時不用那麼緊張還沒有轉空的疑慮且做頭也是需要時間，目前就是把握每一次的震震才會有便宜可以撿!!


而台股上週大漲 849 點主要就是靠台積電和聯發科這兩大權值股貢獻漲點，其餘的中小型股普遍呈現拉回狀況，這是正常現象反而經過上週的修正很多股票買點會陸續浮現!!


我簡單舉個例子台積電上週飆漲前連續震盪了三週小漲小跌，這三週是不是買點呢? 你現在可能會回答是，但從籌碼來看小股東人數是持續減少，反而 400 張大戶人數持續增加，就知道前三週震盪、洗盤把很多散戶洗出去，我建議要成為贏家要有大戶思維要有點耐心才能賺大錢，而台積電接下來如何操作，我 3/8(五) YouTube 影音解盤節目有說我就不重複了!!


最後不要被上週五一天的走勢嚇到，只要你不是去追高買股票的問題都不大，本週特別留意一下散熱族群 (3324-TW) 雙鴻、(3017-TW)奇鋐；PCB 族群 (2367-TW) 燿華、(2368-TW)金像電、(6274-TW)台燿；伺服器組裝族群 (3231-TW) 緯創、(6669-TW)緯穎、(2382-TW)廣達尤其更是要注意，週五暴跌沒什麼跌這代表籌碼很穩定，記得漲震震、漲震震的節奏震震才會有好買點出現，【買、賣節奏】掌握好就能穩定的獲利下去!!


【楊育華分析師 LINE@粉絲團，享有即時精選個股分享】


點選以下連結即可加入:
https://lin.ee/ktArFEp


【訂閱楊育華分析師 YouTube 頻道，有每天詳細的解盤影片】


點選以下連結即可加入:


https://www.youtube.com/channel/UCK1TfbeSlR0jc733Ep83Xfg


文章來源: 摩爾證券投顧 --- 楊育華分析師


本公司所推薦分析之個別有價證券 無不當之財務利益關係 以往之績效不保證未來獲利 投資人應獨立判斷 審慎評估並自負投資風險",2024-03-11 08:12:43,22193,無摘要,"['雙鴻', '緯穎', '緯創', '台燿', '金像電', '燿華', '奇鋐', '廣達']",1f5c4f5c-5dd7-43b4-8212-f08a90b8bae2
〈台股盤前〉美股盡墨、費半跌4%  台股惜敗2萬點後拉回整理難免,"['台股', '美股', '台積電']","美股上周五開高走低，四大指數全數收黑，費半大跌逾 200 點、跌幅達 4%，台積電 ADR(TSM-US) 也下跌 1.90%，法人預估，台股今 (11) 日短線恐面臨漲多拉回整理。


法人表示，2 萬大關得而復失且 K 線收黑，顯示 2 萬大關壓力確實不輕，台股日 KD 指標仍在嚴重超買區，漲勢有過度集中於部分半導體股的現象，整體下跌家數亦遠高於上漲家數不利於類股輪動。


回顧美股主要指數上周五表現，盤中短暫觸及新高後大舉拉回，道瓊收跌 68.20 點或 0.18%；標普收跌 33.67 點或 0.65%；那指收跌 188.26 點或 1.16%；費半收跌 208.05 點或 4.03%。


其中，輝達 (NVDA-US) 終場收黑 5.6%、止步連六紅，台股 ADR 也全數收黑，除了台積電 ADR 跌 1.90% 外，日月光 ADR(ASX-US) 跌 3.77%、聯電 ADR(UMC-US) 跌 0.48%；中華電信 ADR(CHT-US) 跌 0.52%。


台股方面，上周五跨過 2 萬點大關，最高衝上 20065.5 點後，大漲逾 370 點，但在獲利賣壓出籠下，盤中翻黑，終場在台積電撐盤下，上漲 91.8 點或 0.47%，成交金額 5890 億元，但櫃買指數重挫，下跌 5.47 點或 2.2%，收 247.43 點。",2024-03-11 08:41:03,22192,〈台股盤前〉美股上周五開高走低收黑 短線面臨漲多拉回,"['台積電', '輝達', '日月光', '聯電', '中華電信']",3dbd01f6-51c5-4426-911e-cf77135d304a
嘉威生活去年EPS 4.81元擬配息3元 營運動能轉強中,"['嘉威生活', '股利', '營收', 'EPS', 'ESG']","嘉威生活 (3557-TW) 2023 年財報揭露，全年營收為 47.52 億元，每股純益 4.81 元，董事會並通過配發股息 3 元，盈餘配發比例為 62％，以上周五收盤價計算，現金殖利率為 4.70%。同時，嘉威生活 2 月營收為 4.67 億元，年增 13.08，連續兩個月呈現雙位數成長，2024 年整體業績有望轉強。


生活用品及餐、廚具生產商嘉威生活受到 2023 年北美市場去庫存化的影響， 2023 年全年營收為 47.52 億元，營業毛利 18.31 億，毛利率 38.62%，年增 2.75 個百分點、營業利益 5.06 億元，稅後純益 3.86 億元，年 31.58%，但在原物料價格較前期平穩的助益下，毛利率由 2022 年的 35.87% 增加至 2023 年的 38.53％，毛利率持續穩定的維持在 35% 以上的水準，同時也創歷年毛利率次高水準。


在美國大型零售通路如 Walmart、Costco、及 Target 等近期的營運顯示獲利均呈現年增情形，嘉威生活的第一大客戶 Walmart 在 2023 年第四季總營收年增長了 5.7%，在全球電子商務銷售額更是年增長 23%。Walmart 另宣布以 23 億美元買下由台裔企業家王蔚創辦的智慧電視廠商 Vizio，沃爾瑪一直是 VIZIO 最大通路，藉由收購 VIZIO，沃爾瑪將有機會控制美國電視市場的 22%。


VIZIO 的服務模式跨足了連網電視廣告等領域，在搶攻市場佔有率的背後，Walmart 更大的價值在於坐擁消費數據、廣告版位的拓展。Walmart 對今年度的營收預測將成長 3-4%，並將持續在技術和創新方面進行長期投資，以優化其供應鏈和商店，預計未來幾年資本支出將佔銷售額的 3％至 3.5％，對未來保持樂觀的預期。


經歷 2023 年的調整期，嘉威生活持續擴展版圖，陸續投資興建越南廠主攻 R.PET 材質環保產品，並在美國德州租用倉庫，建置自有團隊運作倉儲，以因應市場取向與客戶成長需求。


嘉威生活 2024 年 1 月及 2 月營收分別年增 35.06% 及 13.08%，今年以來都是雙位數成長，主要傳統旺季加上訂單回溫的效應所致，前 2 月年增 26.02%，預期第 1 季營收將較去年同期成長，也顯示最壞時間已過，隨著嘉威生活北美核心客戶對於營運的正面預期，接單能見度持續轉佳，全年營運審慎樂觀。",2024-03-11 09:04:03,22191,嘉威生活 (3557-TW) 2023 年財報揭露，全年營收為 47.52 億元，每股純益 4.81 元，董事會並通過配發股息 3 元，盈餘配發比例為 62％，以上周五收盤價計算，現金殖利率為 4.7%。,['嘉威'],2cd07f2e-2835-4af1-9514-7babfb8ed775
月配息ETF申購潮，這6檔成分股即將噴出！,"['趨勢分析', '摩爾投顧', '何基鼎', 'ETF']","聯準會主席鮑爾國會聽證會表示『不見得要等到通膨降至 3％才降息』，帶動本周美股全面上漲，特別是 AI 類股，在輝達、美超微上漲帶動下，科技類股全面性的上漲，由於科技類股對利率敏感度較高，下周三（3/12）美國要公佈最新的消費者物價指數 (CPI)，CPI 年增率如果能低於前值 3.1％，將激勵科技類股再創新高，帶動美股全面再創新高！




台股本周正式突破 2 萬點，雖然主要都是由台積電 (2330-TW)、日月光(3711-TW)、聯發科(2454-TW) 等大型股所帶動，其餘中小型類股卻普遍出現明顯的下跌，然而國際股市持續向上，台經院發布製造業景氣燈號也跳級到黃紅燈，基本面沒有問題，此外，外資上周大買 968 億，加上 ETF 申購熱潮，將為台股帶來被動式的買盤，無論從國際股市、技術面、籌碼面觀察，台股多頭格局沒有改變，各類股族群就會輪動上漲，未來漲的不會只有『台積電』，把握其他股票下修正的機會，還有機會在這波多頭行情中賺到大錢。


輝達、美超微持續再創歷史新高，生成式 AI 為電子產業帶來全新的希望，台灣相關類股如散熱雙鴻 (3324-TW)、奇鋐(3017-TW)；封測的日月光(3711-TW)、京元電(2449-TW) 等漲高了不建議過度追價，除了 AI 產業外，自從復華台灣優息 (00929-TW) 月配息 ETF 上市後，市場接受度超高，規模突破 1500 億，各大投信公司也相繼推出月配息的 ETF，統一投信 3/20 掛牌統一台灣高息動能(00939-TW)，元大也將再 4/1 掛牌元大台灣價值高息 ETF(00940-TW)，ETF 被動式買盤也成分股，帶來全新的上漲動能，相關類股本周可以留意聯電(2303-TW)、聯詠(3034-TW)，而 AI 的發展，也是盤面上的焦點之一，AI 股下周可留意緯穎(6669-TW)、沛亨(6291-TW)


聯電 (2303-TW)


成熟製程晶圓代工廠商，隨著消費性電子產品庫存逐漸去化，今年營運將先下後上，在台積電積極發展先進製程下，成熟製程外溢效果，將成為聯電未來營運新的動能，此外，聯電近年營收穩定，近三年每股盈餘都能維持在 5 元附近，本益比只有 10.3 倍，殖利率高達 5.98％，因此被即將發行的月配息 ETF 元大台灣價值高股息 (00940-TW) 納入成分股，在被動式買盤拉抬下，短線股價值得期待，近期股價落底後，都穩守在 47.5 元之上，短線只要不跌破 49 元，多頭氣勢不變，後續行情值得期待。


聯詠 (3034-TW)


驅動 IC 大廠，主要產品為全系列的平面顯示螢幕驅動 IC，以及行動裝置及消費性電子產品上應用之數位影音，多媒體單晶片產品解決方案，Q3 稅後純益 63.66 億元，每股盈餘 10.46 元，累計前三季達 29.56 元，賺近 3 個股本，未來在 OLED 驅動 IC 隨著摺疊機，車用晶片明年也將持續成長，本益比只有 15.6 倍，殖利率高達 6.19％，被眾多高股息 ETF 如 00929、00939 等納入成分股，在 ETF 被動式買盤帶動下，股價 580-610 間區間震盪不跌，KD 指標即將出現黃金交叉，震盪後噴出突破前高機率大！


緯穎 (6669-TW)


大型雲端資料中心硬體及解決方案之供應商，人工智能發展，帶動 AI 伺服器需求強勁，馬來西亞廠正式啟用，將為超大型資料中心提供 AI 伺服器與先進冷卻技術，將帶動明年營收持續成長，主要客戶微軟、META 等國際大廠，積極投入生成式 AI 研發，帶動相關伺服器的需求大幅提昇，今年 AI 營收佔比將高達 2 成以上，有助於毛利率、營益率的提高，成長動能無虞，近期股價維持在 2400 元之上震盪，短多動能強勁，隨持有機會突破 2600 元再創歷史新高！


沛亨 (6291-TW)


台灣第一家專業之類比 IC fabless 公司，振曜集團入主後，轉型為 AI+IC，朝 AI 邁進，子公司西伯、東荃布局 AI PC 及嵌入式平台軟硬體市場，『超昱』打入 AI 伺服器線材，以此為基礎，協助沛亨 PMIC 業務，介入 AI 伺服器市場，去年每股盈餘 10.32 元，配息 8 元，殖利率 3.8％，基本面表現佳，隨著今年第一季光纖新機台的產能陸續開出、揚聲器越南新增產能也將於下半年貢獻，今年營收持續挑戰雙位數年增，KD 指標落底已久，股價依舊在 200 元附近震盪不跌，底部逐漸成形，喜歡逢低佈局的朋友，千萬不要錯過！






誰說『權值股』不會漲，專欄 1/20 介紹台積電 (2330-TW)，當周股價維持在 628 元震盪，讓大家輕鬆買，要買多少就買多少，短短不到 2 個月，台積電就漲至 784 元，再創歷史新高，波段漲幅超過 24％；此外，我們還在 2/24 專欄介紹台積電相關供應鏈，漢唐(2404-TW) 上漲 36％、洋基工程 (6691-TW) 漲 14％、達興材料 (5234-TW) 大漲 34％。




錯過了台積電和他的供應鏈，本周幫大家整理最台最夯月配息 ETF，00929、00939、00940 的成分股中，重疊度最高、佔比最大，且技術面有機會在短線出現大爆發的個股，歡迎直接點擊下方連接，加入 LINE 之後，回覆：666 即可免費獲得！


➤鼎極操盤手 何基鼎 LINE 粉絲團


https://lin.ee/QhS4Cfk


➤鼎極操盤手 何基鼎 YOUTUBE 影音頻道


https://reurl.cc/mqzQ9G


文章來源：摩爾投顧 何基鼎分析師


本公司所推薦分析之個別有價證券

無不當之財務利益關係 以往之績效不保證未來獲利

投資人應獨立判斷 審慎評估並自負投資風險",2024-03-11 09:29:15,22190,無摘要,"['台積電', '洋基工程', '漢唐', '沛亨', '緯穎', '聯詠', '聯電', '京元電子', '奇鋐', '雙鴻', '聯發科', '日月光投控', '達興材料', '洋基工程', '復華台灣科技優息', '元大台灣價值高息', '統一台灣高息動能']",f8d104a1-783a-45bc-b782-24091ff29938
邑昇去年EPS 0.34元擬配股息0.8元 爲首次實施超額配息,"['邑昇', '營收', 'PCB', '股息', 'ESG']","邑昇 (5291-TW) 2023 全年財務報告，2023 年稅後純益 1391 萬元，年減 92.15%，每股純益 0.34 元，整體營運表現係受 2023 年電子供應鏈調整庫存影響，使生產出貨未達經濟規模，加上事業產品組合不利毛利表現，但邑昇今 (11) 日公布去年配發每股現金 0.8 元，為公司創立以來首次實施超額配息。


邑昇對 2023 年股利配發內容爲盈餘配發每股現金 0.3 元，資本公積配發每股現金 0.5 元，合計爲 0.8 元。2023 年邑昇營收 9.45 億元，毛利率 20.25%，年減 4.41 個百分點，2023 年稅後純益 1391 萬元，年減 92.15%，每股純益 0.34 元


邑昇兩大事業 2023 年營收占比為 PCB 占 80%、LED 自行車燈 20%。PCB 事業方面，下半年起 AI 浪潮推升各大雲端伺服器、工業電腦與 AI PC 等高階運算設備規格提升，帶動 PCB 朝高階多層板推進，市場規模逐步擴大，公司長期耕耘中高階領域，未來也將朝更高階精緻化發展。LED 自行車燈方面，公司持續布局終端消費市場，以滿足客戶對產品的需求，2023 全年出貨穩健挹注。


邑昇仍持續維持每年推出新款產品政策，於今年自行車展上，針對不同客戶群體需求，提供了兩款 e-bike 代步通勤解決方案，首先為主打居家日常採買與親子接送的都市運輸需求，以輕巧減重、低續航力為主要核心設計概念，並標配可快速拆裝貨籃，也可選配加裝幼童座椅，為都市生活帶來更便捷的交通新選擇。


透過投入 e-bike 的發展，邑昇積極打造友善環境、關懷社區之優良企業，邑昇不僅長期贊助全台自行車活動，推廣運動風氣，更致力回饋當地社區，在農曆年後的補班日，由董事長簡榮坤、總經理李上治親自率領集團同仁，騎乘公司自有品牌「DOSUN」，並以貨車款 e-cargo 載運愛心物資，e 騎送愛心前往桃園觀音愛心家園，並與學員共同製作蛋糕與互動活動，透過低碳節能環保、身體力行的方式，以實際行動落實環境保育與企業社會責任，實踐公益精神。


AI 浪潮趨勢帶動高階 PCB 需求增加，邑昇為迎接市場變化，邑昇堅定朝向高階、多層板的方向推進，且致力提高高階精緻化產品，同時調整 e-bike 海外布局與銷售策略，將重心轉往開發中國家的金字塔頂端市場。",2024-03-11 09:46:29,22189,邑昇去年每股純益 0.34 元，整體營運表現係受 2023 年電子供應鏈調整庫存影響，使生產出貨未達經濟規模，加上事業產品組合不利毛利表現，但邑昇今 (10) 日公布去年配發 0.8 元股息。,['邑昇'],4c7fa8d7-ec8b-4055-bda4-22c43b1679f0
