title,keywords,content,publish_at,id,summary,related_stocks,uuid
AI強勢整理，半導體加入輪動 !,"['趨勢分析', '永誠投顧', 'FOMC', '台股', '楊少凱', '神準贏家', 'AI #技術分析']","聯準會昨天如預期升息一碼，FOMC 也沒有針對未來進一步升息的可能性提供指引，不過主席鮑爾保留了今年底前進一步升息的可能性，並強調經濟「軟著陸」的希望升高，但有經濟學者指出，鮑爾在決策會後記者會的開場，顯露出他的鴿派傾向。好景不常，今天美國商務部公布數據顯示第二季 GDP 成長遠超預期，增幅不僅超越第一季的 2%，也遠超出市場預期的 1.8%，令希望聯準會降息的投資人感到不安，再加上擔憂日本央行可能政策轉向緊縮，使恐慌指數 VIX 創下 5 月份以來最大漲幅，導致美股週四 (27 日) 四大指數開高走低，


道瓊更收黑逾 230 點，揮別連續 13 個交易日的漲勢。


回到台股部分，今天大盤開低測試 5、10 日均線支撐後，震蕩走高終場小漲 51.11 點，收在 17292.93 點，短線走勢目前仍與預期相符，因此下周往上突破上週二高點應該也是【大概率的事】，下方短支撐一樣持續觀察 5,10 日均線，中線關鍵支撐則為 17030~17040 點左右。本周周線收紅，但周線必須搭配月線的波浪結構，所以等下週一收月線再一起解析。


回顧這禮拜大家可以發現，AI 相關類股雖然還是主流，但漲勢已經不像之前一樣兇猛，轉而進入短暫的強勢整理期，市場的資金也在同時慢慢擴散到其他族群，像是「半導體相關類股」本來就強勢的辛耘 (3583-TW)、弘塑 (3131-TW) 、萬潤 (6187-TW)，近日擴散到均華 (6640-TW)、愛普 (6531-TW)；「碳權概念股」的士紙 (1903-TW)、華紙 (1905-TW)、叡揚(6752-TW)、倍力(6874-TW) 等等。


個股部分，之前我們一直提到的廣達 2 號 - 廣明 (6188-TW)，在週四也來到了我們預告的最小漲幅 124 元，並帶會員獲利賣出一半，並保留另一半部位續抱波段到我們預設的合理漲幅。




再來神準 (3558-TW) 先是受惠美國總統拜登日前宣布，將從基建法案中提撥超過 420 億美元，約新台幣 1.3 億元打造全美高速網路，再來為因應訂單需求又繼續擴廠，並邁向全球布局，繼華亞新廠今年 3 月加入量產後和越南建廠之外，五月也在印度設立營運、研發據點，更考量到印度進口關稅，也有赴印度設廠的計畫以便就近出貨，其中預估華亞新廠產能稼動率若是拉到滿載，台灣產能將可貢獻每月約 20 億元的營收，全年可有 200 億元業績，再加上越南新廠的話，神準 2-3 年後就有機會挑戰 400 億元的營業額規模；7/11 日跟你預告這檔股票有大行情，7/25 日要準備發動的時候我還貼心的在節目提醒大家，7/27 日的時候帶新同學看準時機進場買進，結果當天馬上發動攻勢現買現賺，今天又再繼續大漲 7% 左右，看到這裡想要跟著進場追高的投資朋友請先等等，因為我們的成本價已經不一樣了，如果你早一兩天跟上我，完全不需要去追高，只需要坐享其成等著別人幫我們抬轎。






【同心協力 168】倒數 2 天


把握翻身的機會


享受賺大波段的幸福感


有困難立刻找我！


由於字數有限，如果想知道更多更詳細的技術分析


請準時收看我的每日盤後節目持續鎖定我們的相關社團


並讓我用 30 年專業的技術和經驗！


幫你找出大飆股",2023-07-28 20:20:03,12091,無摘要,"['辛耘', '廣明', '倍力', '叡揚資訊', '華紙', '士紙', '愛普', '均華', '萬潤', '弘塑', '神準']",c5436dcd-a11f-4d0c-9ee7-ed833a74cfc5
振大環球Q3迎旺季 營收可望季增雙位數,"['振大環球', '成衣', '紡織']","成衣代工廠振大環球 (4441-TW) 表示，第三季進入傳統旺季，營收可望季增雙位數，但客戶下單仍較保守，仍多以短單為主，第四季能見度還不高，預計 8 月下旬接單告一段落才會比較明朗。


振大環球表示，目前終端庫存逐漸回到正常，以公司家的美系客戶來看，目前庫存低於去年第四季及今年上班年，但下單較觀望，主要反映消費端買氣還是疲弱，新品銷售動能放緩。


振大環球認為，預估市況要到明年第一季才會回到比較正常水準，以公司客戶來看，運動用品連鎖店 DICK""S 的狀況較佳，是今年為數不多訂單保持成長的客戶。


雖然目前短單較多，但振大環球認為，在疫情期間，部分廠商成衣供應商退出市場，加上品牌客戶採購模式也改變，導致供應鏈大者恆大的趨勢更加明顯，是一大接單利基。


振大環球今年 6 月營收新台幣 5.77 億元、年減 34.16%，累計前 6 月營收 25.39 億元、年減 40.51%。",2023-07-28 21:50:20,12090,成衣代工廠振大環球 (4441-TW) 表示，第三季進入傳統旺季，營收可望季增雙位數，但客戶下單仍較保守，仍多以短單為主，第四季訂單能見度還不高，8 月下旬才會比較明朗。,['振大環球'],5f2afe24-2a32-4541-a030-5ee82f58f1d4
客戶詢價轉趨熱絡 燁聯8月內外銷盤價走揚,"['燁聯', '不銹鋼', '鋼鐵', '盤價']","不銹鋼廠燁聯 (9957-TW) 今 (28) 日開出 8 月盤價，內銷 304 不銹鋼產品每公噸上漲 1500 元；外銷則是全面調漲，每公噸上漲 30-50 美元不等。


燁聯表示，上周中國市場價格已率先反映調漲，亞洲及歐美市場客戶詢價趨於熱絡，反映終端用戶去庫存將告一段落，轉為下半年積極備料。


另一方面，近期主要原物料價格皆呈現上漲趨勢，同時因台幣持續貶值，推升不銹鋼生產成本。


考量經銷商在各市場之接單競爭力，燁聯表示，本月適度反應成本增幅，內銷 304 不銹鋼產品每公噸上漲 1500 元、430 不銹鋼產品平盤。此外，316L 產品附價每公噸漲 1000 元。


外銷部分，燁聯表示，304 不銹鋼產品每公噸上漲 50 美元、430 不銹鋼產品每公噸上漲 30 美元，316L 產品附價同樣每公噸上漲 30 美元。",2023-07-28 22:01:40,12089,不銹鋼廠燁聯 (9957-TW) 今 (28) 日開出 8 月盤價，內銷 304 不銹鋼產品每公噸上漲 1500 元；外銷則是全面調漲，每公噸上漲 30-50 美元不等。,['燁聯'],fc3b7a9d-633e-4884-95ea-f01ab68bcfcc
鴻海現金股利入袋 郭台銘領逾90億元親曝將這樣花,"['郭台銘', '鴻海', '現金股利', '基金會', '慈善']","鴻海 (2317-TW) 今 (28) 日發放現金股利，每股配息 5.3 元，集團創辦人郭台銘也領到逾 92 億元，對於外界好奇將如何使用這筆股利，他在臉書以「九十幾億的股利怎麼花？」為題發文解答。


鴻海去年每股純益 10.21 元，則為 15 年最佳，每股配息 5.3 元，創歷史新高，配發率約 52%，總計發出 734.73 億元的現金股利，以郭台銘持股近 174.22 萬張估算，可領到 92.33 億元。


郭台銘發文指出，陸續收到年輕朋友們的發問，詢問這次收到的股利要如何花用，由於自己沒有什麼花錢的時間，也不常購物消費，早就簽下婚前協議書，身後的財產，家人只繼承 10%，其餘 90% 全留做慈善與公益事業。


「錢，生不帶來，死不帶去」，他表示，對財富真的沒有那麼在乎，一直呼籲，基於社會共善的精神，台灣政府應該課徵「富人稅」，擴大稅基，創造全民的幸福，這個想法，至今沒有變過。過去二十幾年來，已陸續將財富，投入主持的三個基金會。


第一個是永齡健康基金會，創立目的是為興建癌症醫院與投資抗癌技術；第二個是 永齡教育基金會。台灣城鄉落差太大，希望孩子們不受家境影響，讓教育盡可能地平等；第三個是永齡慈善基金會，專責在災難動員、軍公教罹難撫卹，並幫助有需要的弱勢族群，期盼受助者都能成為助人者，創造善的循環。


最後，郭台銘寫道，人年輕的時候，一定要學著賺錢，在絕境中自我挑戰，才能成就眼界與氣量；人富足的時候，一定要學會花錢，付出後的幸福才是真財富，重點不再是錢的數字，而是所能創造的價值，取之於社會、用之於社會，這就是自己的理財之道。",2023-07-28 23:10:44,12088,鴻海發放現金股利 郭台銘領逾 90 億元投入三大領域,['鴻海'],005441e0-0852-4e2c-92ae-4872fc7bf2ca
藥華藥不到一個月再祭庫藏股 擬買回4000張,"['藥華藥', '庫藏股', '生技股']","藥華藥 (6446-TW) 不到一個月再祭庫藏股，今 (28) 日公告，將買回股份轉讓予員工，自 7 月 31 日起至 9 月 29 日止，買回 4000 張，買回區間價格 350 元至 450 元。


公司表示，若股價低於區間價格下限時，將繼續執行買回，買回股份總數占公司已發行股份的 1.18%。


這也是藥華藥今年以來第二度執行庫藏股，前一次原定 5 月 26 日至 7 月 21 日買回 5000 張，最終實際買回 4001 張，執行率 80.02%，總計斥資 13.66 億元，平均每股買回價格 341.46 元。


另外，2020 年 10 月 29 日至 12 月 25 日則預定買回 3200 張，實際買回張數為 2935 張，執行率 91.72；後續則在 2021 年 1 月 8 日至 3 月 5 日執行庫藏股，原規劃買回 1500 張，最終買回 904 張，執行率 60.27%。",2023-07-28 23:10:58,12087,藥華藥 (6446-TW) 不到一個月再祭庫藏股，今 (28) 日公告，將買回股份轉讓予員工，自 7 月 31 日起至 9 月 29 日止，買回 4000 張，買回區間價格 350 元至 450 元。,['藥華藥'],9233a5ac-df0f-49e6-bce3-d3beeb27acd0
世豐上半年純益年減近2成EPS 2.75元 Q3展望仍保守,"['世豐', '螺絲', '鋼鐵']","螺絲廠世豐 (2065-TW) 公告第二季財報，稅後純益 5564 萬元，季減 35%、年減 40%，每股純益 1.07 元；上半年稅後純益 1.42 億元，年減 19%，每股純益 2.75 元。展望第三季，世豐維持審慎保守看法。


世豐第二季營收 5.17 億元，季減 23.2%、年減 15.7%；毛利率 18.4%，季減 3.5 個百分點、年減 4.7 個百分點；營益率 10%，季減 5.1 個百分點、年減 5.5 個百分點。


累計世豐上半年營收 11.9 億元，年減 5.9%、毛利率 20.4 %，年減 1.3 個百分點、營益率 13%，年減 1.1 個百分點。


世豐說明，雖然受到歐、美地區客戶拉貨力道短期轉為保守，但受惠 DIY 居家修繕、建築工業等產業保持一定需求，上半年美洲地區營收仍成長 6%；以地區營收佔比，美洲佔 6 成。


庫存方面，世豐表示，第二季底的存貨金額達 5.44 億元，分別季減 9.2%、年減 23.06%，整體庫存水位保持健康水準。世豐表示，將持續進行接單策略調整，擴大利基型新品接單。",2023-07-28 23:14:29,12086,螺絲廠世豐 (2065-TW) 公告第二季財報，稅後純益 5564 萬元，季減 35%、年減 40%，每股純益 1.07 元；上半年稅後純益 1.42 億元，年減 19%，每股純益 2.75 元。展望第三季，世豐維持審慎保守看法。,['世豐'],30af2a93-a948-47cf-a260-2795e6412991
