title,keywords,content,publish_at,id,summary,related_stocks,uuid
三大旅行社看旺出國熱潮 旅天下訂單接到明年Q2,"['旅天下', '雄獅', '觀光', '出國']","旅遊業陸續公布 10 月合併營收，多繳出好成績，旅行社龍頭雄獅 (2731-TW) 營收逼近疫情前同期表現，雄獅轉投資旅天下 (6961-TW) 更創單月新高，顯示出境旅遊快速復甦，旅天下指出，長線訂單能見度已看到明年第二季。


雄獅 10 月合併營收達 26.06 億元，月增 18.03%，年增 553.21%，主要因出境旅遊市場持續加溫，雙十連假出遊、郵輪業務和獎勵旅遊大團挹注營收，同時，雄獅 10 月 1 日起開跑的線上旅展也助攻，銷售以日本線和歐洲線最亮眼。


旅天下 10 月合併營收衝上 3.63 億元，月增 24.08%，年增 2371.24%，創單月消高，旅天下說明，中秋、國慶連假接棒推升業績，前 10 月合併營收 22.93 億元，年增 2029%，也是同期新高，甚至超越疫情前 2019 年接近 10%。


旅天下全台現有 48 家通路加盟門市，並積極精耕日本產品線，賞楓團已售出 97%，目前長線訂單能見度看到明年第二季，部分清明連假商品已上架，而短線訂單中，春節進單量達 65%。


此外，旅天下指出，為強化長線歐洲、亞非產品布局，積極轉型，不僅與低成本航空公司合作轉機，更同步擴展與國籍航空、國泰、阿聯酋航空等直飛航班，將強化提供中高價位產品的多元選擇。


對於中國團體旅遊禁令將在明年 3 月解除，旅天下說明，有觀察到旅客詢問度增加，甚至部分旅客提前辦理台胞證，預期明年中國旅遊市場看旺。


鳳凰 (5706-TW) 則指出，營收動能主要以長線大歐洲地區、短線日本和基隆為母港的郵輪包船業務帶動，整體營收已恢復至疫情前近 70%，進入第四季後，預期季節性賞楓、賞雪行程、南半球紐澳地區產品以及公司行號獎旅包團，可望推動成長，並已開賣 2024 年寒假過年及春季產品。",2023-11-09 10:32:29,16828,三大旅行社看旺出國熱潮 旅天下訂單接到明年 Q2,"['雄獅', '鳳凰', '旅天下']",b95618c9-f1b0-46fe-89b1-3b0269b5749e
〈台股盤中〉權值雙王回檔修正 下探16680點失守半年線,"['AI', '聯發科', '台積電', '台股', '半年線']","台股近六個交易日飆漲 739 點，今 (9) 日早盤開低後震盪，台積電 (2330-TW)、聯發科 (2454-TW) 也雙雙下挫，影響大盤跌幅一度達 60 點、下探 16680 點，失守半年線，預計今日成交量 2500 億元，較昨日收斂。


權值股走勢分歧，台積電小跌，聯發科因漲多拉回，跌幅超過 1.3%，面臨 900 元保衛戰，鴻海 (2317-TW) 則逆勢反彈超過 1%，台達電 (2308-TW)、南亞、台塑與台化等也走揚，不過，金控雙雄、聯電 (2303-TW)、中鋼 (2002-TW) 等也都在盤下游走，壓抑整體大盤走勢。


今日盤面焦點依舊是 AI 概念股，緯創、技嘉延續反彈氣勢，緯創小漲接近 1%，技嘉也上漲超過 2%，ASIC 雙雄創意、世芯 - KY 也都在平盤上表現，其餘如 M31、群聯、奇鋐、力致等漲幅也都在 2% 左右。


至於先前飆漲的矽統，自出關以後便一路下跌，今日再度爆量下挫 9%，回測季線支撐，華泰也在昨日暴漲後，今日跌勢慘重、達 6%，其餘如緯穎、川湖等強勢個股也回檔修正。",2023-11-09 11:12:32,16827,台股近六個交易日飆漲 739 點，今 (9) 日早盤開低後震盪，台積電、聯發科也雙雙下挫，影響大盤跌幅一度達 60 點、下探 16680 點，失守半年線，預計今日成交量 2500 億元，較昨日收斂。,"['台積電', '聯發科', '鴻海', '台達電', '聯電', '中鋼']",430cae66-2876-43e6-80d8-ef559382ba42
精英擬斥15億元建置泰國廠 2025年完工投產,"['精英', '泰國', '板卡']","精英 (2331-TW) 因應地緣政治、全球供應鏈變化，以及未來 PCB 成長動能，擬斥資 15 億元設置泰國廠，預計 2025 年完工、開始營運，將專注於高頻高速電路板及多層電路板，應用產品包括主機板、顯示卡、伺服器、資料中心、網通產品、車載產品等。


精英透過精祥科技 (開曼) 股份有限公司投資在泰國設立孫公司 Elite Circuit Technology (Thailand) Co., Ltd.，預計未來三年內投資 15 億元，其中購買土地約 4.6 億元，新建廠房 7.6 億元。


展望後市，精英表示，從 2022 年後疫情時代開始，世界總體經濟環境持續低迷，雖然今年第三季個人電腦需求能見度不佳，但通路庫存正健康消化，2024 年在生成式 AI 等創新技術推力影響下，將密切關注 PC 市場需求動能，同時加速開展邊緣運算的各種技術應用與多元平台組合。


精英第三季營收 44.52 億元，季減 31.75%、年減 41.07%；毛利率 17.37%，創歷史次高，季減 1.04 個百分點、 年增 5.36 個百分點；營益率 2.09%，季減 4.31 個百分點、 年增 1.55 個百分點；稅後純益 2.77 億元，季減 36.48%、年減 32.46%，每股純益 0.5 元。


前三季營收 154.13 億元，年減 40.25%；毛利率 16.17%，年增 6.41 個百分點；營益率 3.03%，年增 1.92 個百分點；稅後純益 7.18 億元，年減 22.85%，每股純益 1.29 元。",2023-11-09 11:12:48,16826,精英 (2331-TW) 因應地緣政治、全球供應鏈變化，以及未來 PCB 成長動能，擬斥資 15 億元設置泰國廠，預計 2025 年完工、開始營運，將專注於高頻高速電路板及多層電路板，應用產品包括主機板、顯示卡、伺服器。,['精英'],317b7989-f076-4a87-b3ad-8af18a8c21a6
〈楊金龍立院備詢〉談我國升息循環 「有保留、還沒結束」,"['央行', '楊金龍', '物價', 'CPI', '通膨', '升息']","中央銀行總裁楊金龍今 (9) 日赴立院備詢，被立委問及台灣的升息循環是否已結束，楊金龍回應「有保留、還沒結束」；而儘管 10 月消費者物價指數 (CPI) 年增率達 3.05%，楊金龍則認為，物價處緩步下滑態勢。


楊金龍說明，主要國家如美國、英國、澳大利亞、加拿大以及歐元區等，幾乎是已達到升息循環的最高點，而我國通膨率已慢慢下降，「應該也會慢慢達到」，但也提醒，升息循環還沒結束。


對於 10 月我國 CPI 年增率達 3.05%，又衝上 9 個月來高點，楊金龍認為，主要是過去連續 3 個月都有颱風，拉高蔬果價格，實際上，通膨壓力仍趨緩中，全年平均 CPI 年增率突破 2.5% 的可能性仍不大，而明年物價有望持續下滑。


另外，談到明年我國經濟成長率 (GDP)，楊金龍指出，因明年比較基期會低一點，出口可望好轉，並帶動投資增加，一般預期明年會較今年好，今年則可望「保 1」。",2023-11-09 11:15:12,16825,央行楊金龍談我國升息循環 「有保留、還沒結束」,[],fec9bc6a-a67f-4ff8-a80b-7eb92dd929fd
鎖定財報利空不跌、投信認養股！財經專家Q&A解答股票問題,"['趨勢分析', '投資豐向球', '永豐金證券']","台股從 8 月開始下跌近 1500 點後，近期大舉反彈！不到 6 個開盤日，已經從底部上漲逾 700 點。市場氣氛良好，這時候也是檢視自己手中持股的大好機會。行情來的時候，好好觀察手中的持股是否也跟著上漲？如果還持續套牢，現在便是汰弱換強的好機會。


不論你是持股績效表現不佳，還是想超前佈署尋找 2024 新機會，歡迎報名 11/14(二) 下午 3 點，陳唯泰分析師的見面會，投資豐向球邀請您與財經名師面對面喝咖啡、聊股票！現場也將與大家分享
財報利空不跌
及
投信認養股
的主題內容，錯過講師獨家選股秘訣，一定會非常扼腕！實體見面會座位有限，歡迎立即點擊連結　
https://dmp.sinotrade.com.tw/t/R5a
　或下方圖片卡位報名，11/14 一起為新年的投資做好準備！




投資豐向球每月都會邀請財經名師來與投資人線上直播互動或是舉辦線下咖啡見面會，找專家來幫投資人解決股票操作問題！今年年底投資豐向球更邀請了 4 位投資專家來和大家一起交流投資心得，分別是台灣經濟研究院預測中心主任孫明德、擅長存股打造現金流的節目主持人蔡尚樺、私募基金操盤人產業會隊長張捷以及眾所皆知的重量級散戶權證小哥！現場還有 iPhone15 抽獎活動及各樣好禮，同步開放投資人 QA 提問，任何投資問題都可以請講師親自為您解答！務必把握與投資專家互動的超級好機會！


立即點我報名：
https://dmp.sinotrade.com.tw/t/N5a",2023-11-09 11:48:44,16824,無摘要,[],f56a655a-24dc-414e-a895-fa3a8bb048e7
高階專案陸續出貨 勤誠Q3毛利率回升 前三季每股賺4.39元,"['勤誠', '伺服器機殼', 'AI伺服器']","伺服器機殼廠勤誠 (8210-TW) 公布第三季財報，單季稅後純益 2.5 億元，與上季持平，年減 43.2%，每股純益 2.08 元。隨著高階專案陸續出貨，毛利率 23.7%，季增 0.2 個百分點。前三季純益 5.3 億，年增 2%，每股純益 4.39 元。 


勤誠第三季營收 23.6 億元，季減 6%，年減 22.1%。毛利率 23.7%，季增 0.2 個百分點，年增 0.3 個百分點。營益率 11.9%，季減 1.7 個百分點，年減 2.7 個百分點。稅後純益 2.5 億元，與上季持平，年減 43.2%，每股純益 2.08 元。 


勤誠前三季營收 65.2 億元，年減 17%，毛利率 21.8%，年增 1.2 個百分點，營益率 10.3%，年減 1 個百分點。前三季純益 5.3 億，年增 2%，每股純益 4.39 元。 


勤誠指出，前三季因受到經濟復甦放緩，加上客戶調整庫存，因此營收成長幅度有限。不過第二季開始，隨著高階專案陸續出貨，第三季持續放量，將有效帶動整體毛利穩步提升。 


以產品組合來看，第三季伺服器／存儲機殼產品佔整體營收比重 99％，勤誠透過系統整合商與通路商出貨，其中超過 60% 營收的終端客戶為大型資料中心。以出貨區域來分，美國市場佔 36％，中國市場佔 31％，歐洲地區佔 10%，其它地區佔 23%。 


據研調機構 Trendforce 指出，2023 年 AI 伺服器，包含 GPU、FPGA、ASIC 等出貨量將超過 120 萬台，2024 年將可再成長超過 33%，AI 伺服器佔所有伺服器比率將突破雙位數，達近 12%。 


對此勤誠表示，在高階 AI 應用的帶動下，訂單詢問度不斷提高，終端需求優於原先預期。因此目前全力支持相關專案的開發，各類型專案陸續出貨，且同步搭載 CPU 新平台的換機需求微幅貢獻，整體業績成長可期，樂觀看第四季及明年出貨及獲利成長。 


展望第四季，高階專案需求優於預期，訂單持續增加中，CPU 新平台的換機需求也逐漸顯現，勤誠預期有望帶動全年營收回穩，且成長力度可持續至明年，並以優化毛利率為營運首要目標。",2023-11-09 11:57:00,16823,勤誠公布第三季財報，單季稅後純益 2.5 億元，與上季持平，年減 43.2%，每股純益 2.08 元。隨高階專案陸續出貨，毛利率 23.7%，季增 0.2 個百分點，年增 0.3 個百分點。前三季純益 5.3 億，年增 2%，每股純益 4.39 元。,['勤誠'],9a8a9e9f-0c15-41b5-86ab-75cbbaf7c496
逸達前列腺癌新藥在美銷售量續創高 本月分潤金有望回升,"['逸達', '新藥', '生技']","逸達 (6576-TW) 旗下治療晚期前列腺癌新劑型新藥 CAMCEVI 42 毫克六個月緩釋針劑，10 月美國終端銷售量成長至 1699 支，月增 6.5%、年增 395.3%，續創高，不過因整體分潤金一次性調整影響，導致 10 月營收較前一月下滑，預期 11 月有望回溫。


逸達 10 月營收 1272 萬元，月減 79.03%、年增 5580%；前 10 月營收 1.39 億元，年減 52.28%。公司說明，雖然 10 月美國終端銷售量創新高，不過整體銷售分潤金額受到一次性調整項影響而較低，預期 11 月銷售分潤金有望回升，且近期供貨價格也有明顯提高。


另外，逸達開發的口服新藥 ALDH2 活化劑 FP-045，預計明年展開治療間質性肺病引起的肺高壓 (PH-ILD) 的二期臨床試驗；而與 FP-045 同系列的化合物口服醛去氫酶 ALDH2 活化劑 AD9308，可透過調節心臟中的 Dicer-miRNA 途徑改善心臟衰竭，此研究成果也攜手西聖保羅大學共同發表在心血管類別之頂尖醫學期刊《European Heart Journal》(歐洲心臟雜誌)。


聖保羅大學醫學院生醫科學研究所教授 Julio C.B. Ferreira 表示，過去幾年累積不少關於 ALDH2 生物學以及逸達 ALDH2 活化劑在心血管和肌肉疾病中的治療應用上的轉譯數據。此篇新發表的論文闡明心臟衰竭疾病病理學的一個新機制，並能更好理解 ALDH2 活化劑如何在心臟衰竭動物模型中顯著改善心臟功能和減少重塑的途徑。


逸達研發長楊文津指出，此數據進一步擴展對於 ALDH2 在心血管代謝疾病中生物學角色及作用的理解，並更加鞏固 ALDH2 活化劑在一個多樣化的疾病群體治療潛力的看法，其中粒線體功能障礙發揮著關鍵作用。",2023-11-09 11:57:14,16822,逸達 (6576-TW) 旗下治療晚期前列腺癌新劑型新藥 CAMCEVI 42 毫克六個月緩釋針劑，10 月美國終端銷售量成長至 1699 支，月增 6.5%、年增 395.3%，續創高。,['逸達'],dafeaebf-5558-4bc1-b8a5-8dc5274a6fad
〈楊金龍立院備詢〉遭美列匯率操縱觀察 央行：有阻貶 沒有制裁問題,"['匯率', '美元', '台幣', '外匯存底', '楊金龍', '央行', 'GDP']","美國財政部在最新發布的半年期報告中，續將台灣列為匯率操縱國觀察名單，中央銀行總裁楊金龍今 (9) 日赴立院備詢時對此回應，短時間內要調整不太容易，央行「有阻貶」，同時，美方可以接受順差並非全然是台灣單方面的因素，實際上不會有制裁問題，


美國財政部判定的匯率操縱國須同時符合 3 項條件，若符合 2 項則列入觀察名單國，包括 (1) 對美國商品貿易順差超過 150 億美元，(2) 經常帳順差對 GDP 比率逾 3% 或依美國財政部模型估算其經常帳缺口對 GDP 比率逾 1%，(3) 淨買匯金額對 GDP 比率逾 2%，且 12 個月中有 8 個月以上為淨買匯月數；台灣符合前 2 項。


楊金龍直言，經常帳順差占 GDP 比降到 3% 以下非常困難，恐怕需要到「很久很久以後」。


另一方面，楊金龍提到，我國過往對美國順差均在 150 億美元以下，是在美中貿易衝突後，美國對台資通訊產品需求很大，因而導致順差大增，美方可接受順差不全然是台灣單方因素，因此，不會有制裁問題。


楊金龍強調，不會影響台灣經濟前景。


此外，楊金龍指出，將綠色債券納入外匯存底管理運用考量，是為永續發展、永續經營，未來外匯存底每年將以增 5% 綠色債券為目標 (並非占外匯存底的 5%)。",2023-11-09 11:57:37,16821,遭美列匯率操縱觀察 央行：有阻貶 沒有制裁問題,[],dd19286c-41c1-4ae9-abc7-984e2d80d444
華懋10月營收創新高 今起公開申購,"['華懋', '環保工程', '擴產', '營收', '創高']","華懋 (5292-TW) 受惠客戶工程陸續進入認列階段，10 月營收達 2.96 億元，創下新高，月增 83.85%，年增 4.65%，累計前 10 月營收 17.38 億元，年增 0.06%；另外，華懋即將在 21 日掛牌上市，今 (9) 日起開始進行公開申購。


華懋為首家以科技事業暨綠能環保類股申請上市公司，預計在 11 月 21 日掛牌上市，日前已完成競價拍賣，此次超額認購 3.43 倍，得標均價 83.31 元，自今日起至 11 月 13 日為公開申購期間，11 月 15 日為公開抽籤日，本次公開申購價格為 68 元，以今日興櫃開盤價 104 元推算，中籤者有機會現賺 3 萬元。


華懋指出，今年雖受景氣放緩、下游去化庫存影響，不過，每年的設備保養維修服務需求仍持續成長，加上大客戶以外的工程陸續認列，全年營運仍可持平去年；，明年受惠台灣、海外地區接單成長下，能見度直達明年底，營運可望創新高。


此外，華懋目前在手訂單超過 20 億元，根據在手訂單與客戶未來需求評估，預計在龍潭廠附近進行擴產，可提升 30-50% 左右的產能，預計 2026 年以後開出。",2023-11-09 11:57:58,16820,華懋 (5292-TW) 受惠客戶工程陸續進入認列階段，10 月營收達 2.96 億元，創下新高，月增 83.85%，年增 4.65%，累計前 10 月營收 17.38 億元，年增 0.06%，在營收激勵下，今 (9) 日股價也一度大漲 13.19%,['華懋'],5db6f7a8-05eb-4664-89eb-e06fef667400
新股掛牌蜜月行情開跑 富世達飆漲7成 宸曜漲3成,"['富世達', '軸承', '宸曜', '工業電腦', 'IPO']","軸承廠富世達、工業電腦廠宸曜今 (9) 日掛牌上市櫃，富世達掛牌價 200 元，盤中最高來到 345 元，大漲逾 7 成；宸曜則以 82 元掛牌，早盤大漲逾 3 成，越過百元大關，最高來到 110.5 元，雙雙大展蜜月行情。


富世達 (6805-TW) 主要產品包含內折與外折式柔性屏轉軸、多模式連動轉軸、微型轉軸等，目前是中系及美系折疊手機主要供應商，除了折疊手機、折疊平板及筆電外，也可應用在 AR/VR 眼鏡及耳機盒等 3C 產品。


公司看好，折疊手機軸承受惠中系客戶推出新機，以及新增美系客戶，帶動下半年業績逐月成長，第四季營運將再向上，後市同樣樂觀看待，富世達第三季稅後純益 1.97 億元，季增 10.9%，前三季稅後純益 4.52 億元，每股純益 7.48 元。


宸曜 (6922-TW) 專注於設計製造兼具強固及緊湊小尺寸的無風扇工業電腦平台，並以自有品牌「Neousys」，拓展全球嵌入式電腦市場，產品應用包含自動化智能工廠、機器視覺、交通運輸、GPU 智能運算、自動駕駛、監控和視覺分析等。


展望第四季，宸曜表示，美國市場從悲觀觀望轉趨中性、歐洲市場通路庫存雖然還要 1-2 個季度消化，但整體而言，歐美 AI 邊緣運算還是有滿多的機會，也有滿多案子從產品驗證進入到小規模量產。",2023-11-09 12:15:26,16819,軸承廠富世達、工業電腦廠宸曜今 (9) 日掛牌上市櫃，富世達掛牌價 200 元，盤中最高來到 345 元，大漲逾 7 成；宸曜則以 82 元掛牌，早盤大漲逾 3 成，越過百元大關，雙雙大展蜜月行情。,"['富世達', '宸曜', '宸曜']",5d13cdef-6e6a-4624-8915-8dc145a15a93
帆宣六廠今動土 為成立以來最大廠房 預計明年底完工,"['帆宣', '南科', '六廠', '擴產', '面板', '設備', '半導體']","半導體及面板設備大廠帆宣 (6196-TW) 今 (9) 日舉辦六廠動土典禮，公司指出，為因應客戶需求，在南科三期規劃 1 萬坪土地興建六廠，預計 2024 年底完工，為公司成立 35 年來最大的廠房，且設計兼顧環境永續，成為南科三期第一個標竿廠房建築。


帆宣指出，由於業務不斷成長，現有廠房空間不足，因此決定投入興建六廠，結合 AI 人工智慧、永續減碳以及綠建築概念，打造全新智慧廠房，成為南科三期第一個進駐的廠商，預計未來將投入國際重要客戶的設備製造及研發。


帆宣補充，此次新廠設計結合許多綠色環保節能減碳的概念，綠化率 110.84%，預計年固碳量 10104.82 公斤，讓員工在工作場域中，能有寬闊的綠色視野，保持清晰思維突破工作挑戰，在環保永續節能的新概念下，此座新廠也將為南科三期指標性的綠色廠房。


帆宣為全方位發展的半導體整合服務公司，不僅是台積電 (2330-TW) 重要廠務供應商，20 年前便投入資源著手設備製造與研發，無論在半導體或是面板設備都扮演舉足輕重的角色，已連續多次榮獲全球設備大廠肯定。


台南科學園區第三期範圍北起區道南 134 線 (民生路)、南至國道 8 號北側，鄰近樹谷聯絡道、北外環快速道路等建設，交通區位優越，全區規劃 48.2 公頃事業專用區、45.4 公頃公共設施用地，滿足既有台南科學園區業者的業務擴張需求，更吸引許多海外國際廠商的進駐，點亮整個台南科學園區，成為永續減碳的科技重鎮，帶來 4900 個就業機會以及 392 億元年均產值。",2023-11-09 12:17:06,16818,半導體及面板設備大廠帆宣 (6196-TW) 今 (9) 日舉辦六廠動土典禮，公司指出，為因應客戶需求，在南科三期規劃 1 萬坪土地興建六廠，預計 2024 年底完工，為公司成立 35 年來最大的廠房，且設計兼顧環境永續，成為南科三期第一個,"['帆宣', '台積電']",5fe6471d-96ff-4036-873d-24bc3c415586
中華電信再度蟬聯Frost & Sullivan國際三項大獎,"['中華電', '電信', '5G', '趨勢分析']","全球知名顧問公司 Frost & Sullivan 於吉隆坡舉辦 2023 年《亞太最佳實踐獎》(2023 Frost & Sullivan Best Practices Awards) 頒獎典禮，中華電信 (2412-TW) 一舉囊括「台灣年度最佳電信服務業者獎」(Taiwan Telecoms Company of the Year Award)、「台灣 5G 服務客戶價值領導獎」(Taiwanese 5G Services Customer Value Leadership Award) 及「台灣最佳資料中心服務業者獎」(Taiwan Data Center Services Company of the Year Award) 三項大獎，這是中華電信二度蟬聯 Frost & Sullivan 三項指標性大獎，也是連續六年榮獲《亞太最佳實踐獎》肯定，彰顯中華電信卓越的企業營運、優異的電信網路與 5G 服務、及全方位的 IDC 及雲端服務，深獲國際肯定，表現傲視群倫。


Frost & Sullivan 亞太最佳實踐獎每年針對企業的前瞻創新性、經營成效與客戶價值等面向進行評選，選出年度最佳業者。中華電信財務長陳宇紳代表領獎時表示，很榮幸再次獲得 Frost & Sullivan 的肯定；中華電信不但是台灣電信業的領導者，更以成為國際標竿典範企業自我期許。我們相信 5G 將顛覆許多現有的商業模式，加速企業數位轉型及產業升級。中華電信會善用客戶夥伴、科技平台、基礎網路及優質人才等四項資產優勢，並運用『迎向客戶』、『跨群協作』及『廣結同盟』策略，持續深耕新興科技及 5G 創新應用，賦能產業打造實用場域，整合全方面的資通訊資源，提供客戶信賴的全方位電信服務，進一步為客戶創新創價。未來，我們將持續深化以客戶為中心的價值創造，朝成為『數位生態系賦能者的領導品牌』的目標邁進。


Frost & Sullivan 分析報告指出，中華電信能在變動的環境下引領同業，持續以電信龍頭之姿成為市場領導品牌，是因為精準洞悉消費者市場動態，掌握以客戶為中心的核心策略及了解潛在的客戶需求，加上對服務品質和價值創造的不妥協，與擁有優秀的資通訊人才，因而連續三年獲選為台灣年度最佳電信服務業者。Frost & Sullivan 分析師並指出，中華電信長年投入綿密的行固網寬頻佈建、機房及雲端資源建設、以及前瞻資通訊技術研究，在 5G 服務面，除以優異的網路品質提供客戶服務外，並致力開發能夠滿足企業的 5G 垂直應用解決方案，滿足企業後疫情時代的需求，憑藉強勁的 5G 整體表現，連續兩年獲頒「台灣 5G 服務客戶價值領導獎」。在 IDC 服務面，中華電信是全台最大的 IDC 服務業者，具備最堅強的技術優勢及最高規格的 IDC 機房，因而連續六年授予中華電信「台灣最佳資料中心服務業者獎」。


中華電信在台灣擁有行動寬頻主流頻段 Sub 6GHz 下 290MHz 最大可使用頻寬及最大連續頻寬，並建設了全國最多的行動基地台，是公認行動網路最大容量、最大涵蓋之電信業者，同時，公司獨家推出 5G 雙 CA(3.5GHz+2.1GHz) 載波聚合，是唯一 5G 下載速率理論峰值超過 2Gbps 的業者；此外，公司擁有最具發展潛力可擴充連續 28GHz 頻寬空間，可供未來 5G 及衛星發展使用。再者，中華電信以 5G 結合 AI、大數據、雲端、物聯網、資安、區塊鏈、AR/VR 等技術，開發出各類創新應用及 5G 垂直整合創新解決方案，絕對可以提供給客戶最佳體驗。


陳宇紳財務長指出，中華電信服務及產品是以客戶信賴及永續發展為基礎，以 IDC 服務為例，中華電信板橋的雲端資料中心為台灣第一家最高等級 Tier 4 的資料中心，提供客戶更值得信賴且有效率的 IDC 服務。此外，中華電信引進尖端節能與冷卻技術，打造高效能機房，客戶透過一站式整合服務租用 IDC 服務，除可免去空間租賃、設備維護、資訊安全等煩惱，還可透過中華電信研發的智慧節能、能源數據管理與監控等方案，大幅降低碳排放量，實現綠色通訊低碳轉型。陳財務長強調，公司秉持「內化、共好」的初衷，期待和大家一同努力提前實現 2050 年淨零碳排的目標。",2023-11-09 12:17:29,16817,中華電信 (2412-TW) 一舉囊括台灣年度最佳電信服務業者獎、台灣 5G 服務客戶價值領導獎、台灣 5G 服務客戶價值領導獎等。,['中華電'],e0cfec28-e069-4c97-8738-47e33c34714a
