title,keywords,content,publish_at,id,summary,related_stocks,uuid
晶圓代工拚不過台積電 英特爾用玻璃基板鎖定美國先進封裝市場,"['趨勢分析', '亨達投顧', '陳智霖', '英特爾', '玻璃基板', '先進封裝', '電晶體', '摩爾定律', '矽光子', '台積電', '三星', '半導體', 'AI', 'GPU', 'ABF', '欣興', '健鼎', '南電', '群創']","〈英特爾推出最新一代先進封裝技術〉


英特爾 (INTC-US) 在本月 18 日發表會宣布進封裝技術的最新發展和突破創新，推出新一代以玻璃為基板的先進封裝方案，未來單一封裝能容納 1 兆個電晶體，並計劃在 2026 至 2030 年量產。目前一個晶片中有好幾百萬個電晶體，而一支蘋果手機就有 150 億個電晶體，這一突破性成就將使單一封裝納入更多的電晶體，並繼續推進摩爾定律，也將使得近期市場上討論度很高的矽光子技術發展有了重要的進展。




英特爾 9 月初就向媒體發出邀請函，搶先在英特爾創新日 (Intel Innovation) 前一天發表藉此吸引眼球，因為媒體報導台積電美國廠晶圓代工製造後還要送回台灣進行先進封裝，英特爾發表新技術就想要分食的台積電 (2330-TW) 先進封裝，當前最火熱的 AI 題材所需的輝達(NVDA-US) GPU 晶片，就是因為台積電 CoWos 先進封裝產能不及而短缺。


在英特爾創新日的同一時間美國亞利桑那州長郝愷悌 (Katie Hobbs) 來台並訪問台積電(2330-TW)，力邀台積電在美國新廠增加先進封裝產能，但台積電迄今並未宣布在美國打造先進封裝設施的計畫。英特爾在晶圓代工拚不過台積電，現在則想在先進封裝這一個市場分一杯羹。


〈玻璃基板為何可以成為解決方式〉


玻璃基板，原理是利用玻璃的超低平坦度、更佳的熱穩定性和機械穩定性，提高基板的互連密度。目前的先進封裝技術大多採用有機基板，例如塑膠或陶瓷。有機基板具有一定的平坦度限制，因此在封裝多個晶片時，難以實現精密的互連，而且有機基板的熱穩定性和機械穩定性也較差，在高溫、高壓等環境下容易變形或損壞。玻璃基板突破現有傳統基板的限制，讓半導體封裝電晶體數量極限最大化，同時更省電、更具散熱優勢，將用於更高速、更先進的資料中心、AI、GPU 高階晶片封裝。


先進封裝的玻璃基板，是將基板材的核心層也就是矽中介層換成玻璃，上下的增層仍是使用目前的 ABF 載板，英特爾表示玻璃材料能夠提高晶片供電效率，互連密度提高 10 倍，頻寬翻倍提升至 448G，適用於大尺寸封裝，並與有機材質基板共存。英特爾表示，先進封裝玻璃基板方案展現其超越 18A 製程節點，對下一個運算時代的前瞻性關注和願景。




〈市場看法〉


封裝廠將能夠於一片基板上封裝更多尺寸更小的晶片，倘玻璃基板能成功商業化，成本和生產效率將有機會大大增加。但是未來如何成功商轉，包含客戶種類和接單能力，更是未來重要的關鍵。外界認為英特爾高調宣布先進封裝玻璃基板是行銷宣傳大過實質，因為世界大廠包括南韓、台灣與中國等，都在低調的研發玻璃基板技術，玻璃基板有優點也有缺點，英特爾能否在 2026 年至 2030 年間就有最終的解決方案，搭配的設備產線也能到位達成量產的目標，都還需要持續觀察追蹤。


〈相關概念股〉


全球經英特爾認證過的載板廠有 4 家廠商，包括日本揖斐電 (lbiden)、日本新光電氣工業(Shinko Electric)、台灣的欣興(3037-TW) 以及奧地利的奧特斯(AT&S)，


英特爾若開發出玻璃基板，這 4 家合作夥伴將可受惠，台廠積極配合英特爾研發，健鼎 (3044-TW) 與南電 (8046-TW) 也有機會迎來商機。長江證券於 5 月的一份報告亦指出，玻璃基板在先進封裝領域的應用已經得到驗證，玻璃大廠康寧 (GLW-US) 已推出相關產品，台灣媒體傳言英特爾有機會與群創 (3481-TW) 合作，未來台廠供應鏈也有機會受惠。投資朋友如果想操作相關概念股，歡迎你跟上智霖老師的行列，讓老師帶領你操作。


陳智霖老師的直播節目以及 APP 語音文章都會針對國際總體經濟重要的事件追蹤分析有前景的產業趨勢，針對看好產業個股每個星期也都會準備投資名單且設定好操作價位，提供給付費的簡訊會員及 APP 選股會員，股市險惡呼籲忠實粉絲觀眾千萬不要單打獨鬥，請換上富人的思維，把花時間的股市研究工作及盤中的進出判斷資金的控管技巧交給專業的陳智霖分析師，邀請您可以跟著老師一邊操作一邊學習，關於最新的股市行情分析看法，您可以點擊以下影片收視 9/23 週六最新的直播節目。


最新影音 (請點影音上方標題至 Youtube 收視品質會更佳)




邀請您可以點選下方紫色圖免費註冊陳智霖分析師 App，掌握老師最新的分析動態




才剛剛接觸陳智霖分析師的新朋友，建議您現在立即點選紫色圖片下載安裝陳智霖分析師 APP，老師有提供 APP 新註冊用戶免費體驗午報導航及互動教學會員影音的活動，歡迎您透過體驗來了解陳智霖老師如何選股以及盤中的會員服務，午報導航體驗都是限時限額開放，千萬不要浪費了您可以免費體驗的權益喔。


錢進熱線 02-2653-8299, 立即邁向系統依據的股票操作。


文章來源：陳智霖分析師 / 亨達投顧


本公司所推薦分析之個別有價證券 無不當之財務利益關係 以往之績效不保證未來獲利 投資人應獨立判斷 審慎評估並自負投資風險",2023-09-24 09:10:03,13649,無摘要,"['台積電', '欣興', '健鼎', '南電', '群創', '英特爾', '輝達', '康寧公司']",9dbd3e1a-ef47-4571-aebe-311a93d01c1d
下週三大強勢族群，是哪三大？一次搶先看！,"['趨勢分析', '摩爾投顧', '陳冠廷', '台股']","本週五台股明顯強勢的族群有


1. 光通訊 / 矽光子，上詮 (3363-TW) 漲停板下週有機會挑戰波段新高，波若威 (3163-TW) 季線上止跌轉強，訊芯 - KY(6451-TW)下週將創新高，前鼎 (4908-TW) 將創波段新高，一詮 (2486-TW)、統新(6426-TW) 也已止跌。


2.PCB / 車用 PCB，定穎投控 (3715-TW) 收復均線轉強，下週將突破箱型壓力區。台燿 (6274-TW) 也站上均線轉強，金像電 (2368-TW) 季線上轉強。健鼎 (3044-TW) 已止跌，看下週能否轉強。聯茂 (6213-TW)、楠梓電(2316-TW) 皆大漲。


3.IC 設計 / 封測，京元電子 (2449-TW) 止跌轉強，點序 (6485-TW) 站在所有均線上有望挑戰箱型整理區。矽統 (2363-TW) 轉強站上均線，下週將突破箱型壓力區。安格 (6684-TW) 也漲超過 5%，量小股要安排籌碼操作比較安全。


其他比如機殼的營邦 (3693-TW) 和勤誠 (8210-TW) 也強勢，華星光 (4979-TW)、廣達(2382-TW)、技嘉(2376-TW) 今天出現強彈，但上方均線反壓仍大，後面還是會上下洗盤慢慢消化上檔壓力機率較大。


更完整分析歡迎收看 9/22 盤後節目


https://youtu.be/m15MzUKAtKQ


接收第一手個股與產業分析，請加入 line 粉絲團。


台股鈔能力 - 陳冠廷分析師


https://lin.ee/6rOzncL


本公司所推薦分析之個別有價證券

無不當之財務利益關係 以往之績效不保證未來獲利

投資人應獨立判斷 審慎評估並自負投資風險",2023-09-24 10:10:03,13648,無摘要,[],d2367de7-606b-4f24-b548-72102a92aaf4
〈台股風向球〉2個因素牽動 指數恐有再下探空間,"['台股', '外資', '風向球', '聯準會']","外資上周大砍台股多達 1054 億元，創去年 6 月中旬以來單周最大賣超，造成加權指數周跌點達 576 點，跌幅也創去年 10 月中來最大，法人認為，先觀察能否續守前低 16264 點，隨著國內即將迎來中秋連假，加上季底結帳恐出籠，不排除還有下探空間。


聯準會主席鮑爾進行鷹派發言，使美元持續走強，新台幣續弱，外資一周來也從台股快速提走多達 1054 億元，對大盤造成回檔壓力。


以金額來看，外資上周大賣台積電 (2330-TW)485 億元最多，其次為元大台灣 50(0050-TW) 達 41.3 億元，欣興 (3037-TW)36 億元，復華台灣科技優息 (00929-TW)、聯電 (2303-TW) 和鴻海 (2317-TW) 均逾 20 億元，智邦 (2345-TW)、台達電 (2308-TW) 和台泥 (1101-TW) 也在 19 億元上下。


不過，法人提醒，外資同步小幅布局回檔多的 AI 相關族群，買超光寶科 (2301-TW) 逾 20 億元，技嘉 (2376-TW) 約 15 億元，智原 (3035-TW) 和奇鋐 (3017-TW) 均逾 10 億元，智易 (3596-TW) 和緯創 (3231-TW) 也超過 8 億元，不排除科技股回檔探低測試後，趨止穩築底。


永豐投顧則說明，以技術面來看，加權指數連 4 根黑 K，一反前周連 4 紅上攻態勢，顯示多空勢力出現急遽反轉，而此波空方勢力來勢洶洶，直接貫穿過去一個多月形成的半年線支撐，也跌破 5 月中的低點 16264 點，依型態分析，台股恐還有下探空間。


同時，美國公債殖利率不斷飆升，與升息即將告終的想法矛盾，可能反映聯準會縮表的影響，再加上 AI 龍頭輝達自 9 月初就一路下滑，新上市的 ARM 也叫好不叫座，均不利台股氣氛，不過，輝達目前股價已來到起漲區，若反彈，可望帶動台灣的 AI。


以震盪區間測量，下跌波段低點滿足約在 16000 點，觀察 5 月台股發展軌跡，16000 點是波段上漲的起始缺口，預料多方在 15961 點將展現強力抵抗。",2023-09-24 12:00:07,13647,〈台股風向球〉2 個因素牽動 指數恐有再下探空間,"['智易', '奇鋐', '智原', '技嘉', '光寶科', '台泥', '台達電', '智邦', '鴻海', '聯電', '欣興', '台積電', '緯創', '復華台灣科技優息', '元大台灣50']",39710ed7-8adf-4c4a-b676-43c59361d7f3
台達電攜海科館 打造亞洲首座零碳珊瑚保種中心,"['台達電', '電源', '自動化']","電源大廠台達電 (2308-TW) 攜手國立海洋科技打造「潮境珊瑚保種中心」，23 日宣布啟用，整合台達電的工業與樓宇自動化技術，透過智慧養殖、環境管理，預計三年復育超過 1 萬株珊瑚。


潮境珊瑚保種中心位於基隆潮境海灣資源保育區旁，由台達基金會出資上千萬整建，投入包括高效珊瑚養殖系統、智能樓宇控制系統等，百坪基地可養殖約 6000 株珊瑚苗，結合水下珊瑚苗圃將可達 1 萬株。


台達電表示，利用工業與樓宇自動化技術，為珊瑚量身打造適宜生長且節能的溫室，長成後再挑選耐熱珊瑚移植潮境保育區。此外，台達電也捐贈再生電力供應珊瑚復育，將以 100% 使用再生電力營運，致力打造亞洲首座零碳珊瑚保種中心。


潮境保種中心另根據國際自然保護聯盟 (IUCN) 瀕危及易受害珊瑚名冊，目標保存 20 種指標珊瑚物種，並利用台達微米級電腦斷層掃描儀器（Micro CT），建立瀕危與易受害珊瑚的碳酸鈣骨骼資料庫。


台達基金會也持續與海科館及保育團體展開教育推廣計畫，讓更多民眾可以藉由參與保種中心開設的珊瑚復育課程，就近認識珊瑚生態系對台灣海洋生態的重要性，即早調適地球暖化對台灣生態所造成的衝擊。",2023-09-24 12:32:30,13646,電源大廠台達電 (2308-TW) 攜手國立海洋科技打造「潮境珊瑚保種中心」，23 日宣布啟用，整合台達電的工業與樓宇自動化技術，透過智慧養殖、環境管理，預計三年復育超過 1 萬株珊瑚。,['台達電'],7ca1ed86-23b9-441b-9be6-03c9f1731861
中國衛健委第二批罕病目錄 藥華藥兩適應症納入名單,"['藥華藥', '新藥', '孤兒藥']","中國國家衛生健康委員會 (衛健委) 近日公布「第二批罕見疾病目錄通知」，其中，藥華藥 (6446-TW) 旗下新藥 Ropeg，用來治療真性紅血球增多症 (PV)、原發性骨髓纖維化 (PMF)，被納入目錄名單。藥華藥看好，將有助新藥 Ropeg 在中國市場的推展。


衛健委公布的第二批罕見疾病目錄通知，為罕見疾病診療指南和治療標準的修訂，被納入罕見疾病目錄的適應症與產品將有優先審評，並有利於未來在中國醫療保險的價格談判、門診用藥推廣等。


中國罕見疾病目錄政策為加強中國在罕見病的管理、提高罕見病診療水準、和維護罕見病患者健康權益提供依據，對於中國未來在罕見病診療保障事業的推動、促進藥物近用、健全並保障罕病患者從診斷至治療的醫療。


藥華藥看好，旗下治療真性紅血球增多症 (PV) 新藥 Ropeg，正在申請中國藥證、Ropeg 正在發展原發性骨髓纖維化 (PMF)，隨著納入目錄名單，有助未來在中國市場加快審查。其中，真性紅血球增多症中國目前尚未有藥物正式獲准，Ropeg 有望是第一個獲中國主管機關核准用於治療 PV 的藥物。


藥華藥補充，由於罕見疾病的病人數較少，罕病用藥也被稱為孤兒藥，比起常見疾病用藥，孤兒藥常因病因與成因不明，不僅在研發上容易遇到瓶頸，可以進行臨床試驗的患者也較少，投入研究不一定能成功。


為了鼓勵藥廠開發孤兒藥，許多國家給予孤兒藥優惠，其中，美國 FDA 規定，每年發病病患人數不足 20 萬人且未有主流用藥的困難疾病，即可申請孤兒藥資格認定；若產品獲取孤兒藥資格，大多可享有快速通關的審查資格，未來上市後也可能享有自由定價、獨占市場等優惠條件。",2023-09-24 16:29:04,13645,中國國家衛生健康委員會 (衛健委) 近日公布「第二批罕見疾病目錄通知」，其中，藥華藥 (6446-TW) 旗下新藥 Ropeg，用來治療真性紅血球增多症 (PV)、原發性骨髓纖維化 (PMF)，被納入目錄名單。,['藥華藥'],850b488c-2fdf-43f2-a4b2-37f70c431909
外資倒貨 台股失守半年線 市場寄望Q4電子股穩盤,"['台股', 'AI', '電子', '半年線']","受外資大舉調節壓力影響，台股失守半年線，投信認為，在聯準會偏鷹態度下，美股大幅震盪、台股也難逃整理壓力，短線需時間消化消息面影響，但隨著時序邁入傳統旺季，預期電子股可望成為支撐大盤主力。


在籌碼面部分，外資賣超金額擴大至 1056.95 億元，創下 2022 年 6 月中旬以來單週賣超最高金額，自營商單周也從台股提款 332.59 億元，僅投信連續第 8 周買超，本週回補 98.49 億元，但三大法人合計仍賣超台股 1291.04 億元。


PGIM 保德信高成長基金經理人孫傳恕表示，9 月來外資已調節台股 1307.72 億元，金額已超過 8 月調節的 1240.02 億元，是大盤欲振乏力的主因，指數也跌破半年線支撐。


孫傳恕指出，聯準會在發表偏鷹派的會後聲明後，導致美債殖利率攀至新高、美元走強，加上美國會難以就短期開支法案達成共識，美國政府本月底再面臨關門危機，使得美股出現大幅震盪，也影響台股的投資情緒，預料股市仍需時間消化此次偏鷹派的聲明。


此外，國際油價也成為近期變數，孫傳恕說明，沙烏地和俄羅斯的減產延長，造成油品市場龐大缺口，引發能源價格再度波動。


目前布蘭特與西德州原油價格雙雙站上 90 美元大關，根據 OPEC 最新原油展望報告，第 4 季原油供給缺口將達每日 330 萬桶，可能創 10 多年來最大缺口，且如果歐洲與中國經濟數據開始轉為樂觀，將使原油市場更加緊繃。


安聯投信台股團隊認為，近期市場出現較大波動，主要也是在反映利率政策方向步調與市場期望有所落差所致。


安聯投信台股團隊表示，台股在全球現階段處在各類資訊的空窗期的情況下，短中期相對承壓，並且需要等待更多新消息，目前市場也在等待基本面落底後更多正面數據、利率政策新訊號與評價面整理。",2023-09-24 16:45:38,13644,受外資大舉調節壓力影響，台股失守半年線，投信認為，在聯準會偏鷹態度下，美股大幅震盪台股也難逃整理壓力，短線需時間消化消息面影響，但隨著時序邁入傳統旺季，預期電子股可望成為支撐大盤主力。,[],99b44feb-27be-4637-92f4-acf5001270ab
明揚屏東廠區爆炸造重大傷亡 將成立信託基金帳戶專款撫卹,"['明安', '明揚', '屏東', '信託']","生產高爾夫球的明揚國際 (8420-TW) 及母公司明安國際 (8938-TW)，今 (24) 日下午針對明揚 22 日屏東廠區發生一廠爆炸及火警延燒提出說明，明安及明揚兩家公司的董事長及總經理就起身鞠躬道歉，並承諾從優補償受到影響的人，在明日將成立信託基金帳戶專款專用，對傷、亡者及家屬，絕對會負責到底。


明揚總經理呂英誠並指出，整體最大損失金額仍持續評估中，但建築物、設備、存貨等投保金額 15 億元，有足額保險，保險公司也已經展開調查，明揚將盡快完成理賠程序。同時，明揚董事長劉安晧今天會中面色凝重且一度哽咽，他指出，公司會成立專款專用的相關信託專戶，明天就會請相關專家研討相關細節，盡快完成設置。


明揚表示，整體最大損失金額仍持續評估中，但建築物、設備、存貨等投保金額 15 億元，有足額保險，保險公司也已經展開調查。


明揚國際為明安持股 52.12% 的子公司，並納入合併報表，分析明安集團營運包括高爾夫球具、複合材料及明揚國際生產的高爾夫球，其中高爾夫球具 65% 營收、高爾夫球占 20%，複合材料占 15%。明揚產能的折損，也將影響並造成明安的業績表現受挫。


明揚母公司明安的董事長鄭錫潛表示，母公司明安將會全力支援明揚，無論是資金還是傷、亡等協助及撫卹事宜都會將盡全力，明安集團帳上資金足以因應，對於信託基金的金額，明安及明揚僅回應將待明日與專家討論後才會公布詳的數字。


呂英誠指出，屏東廠 22 日放原物料的倉庫發生有煙霧，消防人員和公司討論之後，沒想到還是發生爆炸，一廠因火災造成嚴重傷害。他說，目前第一優先將對傷亡的人盡力救治及協助，並在明安附近找辦公廠所快點重回常軌。生產地點也會對外評估合適的廠房租賃，儘快完成產能重新建置。


呂英誠並指出，明揚的日常行政會透過母公司明安來正常進行，也希望在接近原來的廠區附近找到租賃的地點，盼望一切能盡快回到常軌，而災廠政府單位警戒中，將會全力配合調查。


明揚屏東廠區 22 日傍晚發生爆炸及火警案己造成包括警消及員工在內高達百餘人的傷亡，同時，明揚屏東一廠的高爾夫球產能因此全部受損。",2023-09-24 16:49:03,13643,生產高爾夫球的明揚國際 (8420-TW) 及母公司明安國際 (8938-TW)，今 (24) 日下午針對明揚 22 日屏東廠區發生一廠爆炸及火警延燒提出說明，兩家公司的董事長及總經理就起身鞠躬道歉，並將成立信託基金帳戶專款撫卹。,"['明揚', '明安']",8d36cde9-195e-411c-8cf4-0fbff1ee35ec
